"","artist","title","album","text","url","metadata"
"7","Eko Fresh","Toy Soldier","Best of freetracks volume 4","[Hook]
Step by step, heart to heart, left right left we all fall downStep by step, heart to heart, left right left, we all fall down like TOY SOLDIERSBit by bit torn apart, we never win but the battle wages on for TOY SOLDIERS
[Part1]
Erst war es Ekattack jetzt ist es Ring FreiJeder der Ohren hat, weiß, die Single klingt tight
Doch zu szenemäßig für den MainstreamZu mainstreamig für die Szene wo es nur Hate gibt
Ich fühl mich wie in einer Matrix gefangen
""Verkauf besser Platten, Jung, oder dein Arsch ist bald dran!""
Was ist passiert mit dem viel versprechendstem Rapper jetzt?
Wie kann man, wenn man auf seinem Track ist, vergessen wer Ek war?
Du sollst doch, außer ihm ne Chance geben, nichts machen
Er ist immernoch der selbe von ""Jetzt kommen wir auf die Sachen""
Die Leute halten gerne große Menschen extra klein
Man ich will nicht der erste tote deutsche Rapper sein
Es war knapp, ich war reich. Es war abwechslungsreich
Aber lass es jetzt sein ich will doch wieder hoch!
Es ist erst vorbei wenn der Gong erklingt
Kuck im Internet wo die Wende schon beginnt!
An meine Alboz: Es tut mir so verdammt leid!Seht doch wie ein türkischer Bruder euch die Hand reichtIhr habt mich falsch verstanden, ich würd euch nie beleidigenIch hoff, wir können es mit Wörtern hier bereinigenKommt, wir lassen uns nicht gegenseitig aufhetzen!In dieser Szene stürzen Leben ein, wie Bauklötze
Hörst du, hörst du diese friedlichen Zeilen?
Ich hab, ich hab keinen Beef mehr mit keinem!
Denn ich, denn ich muss mich schließlich entscheiden!
Viele, viele können Freezy nicht leiden...
Meinen Ruf haben sie in den Dreck gezogen!
Kuck mal Proof, denn er chillt nämlich jetzt da oben
Wir sind Toy Soldiers!

[Hook]
Step by step, heart to heart, left right left we all fall down
Step by step, heart to heart, left right left, we all fall down like TOY SOLDIERS
Bit by bit torn apart, we never win but the battle wages on for TOY SOLDIERS

[Part 2]
Jetzt hab ich über mein Album zu reden halt gemacht
Manchmal denke ich, ich habe alles im Leben falsch gemacht...
Dann sag ich wieder: der Scheiss ist doch nicht echt vorbei!
Es war nur die Prüfung vor dem eigentlichen Ekohype!
Rapper scheinen für euch, wie Zeichentrick, nicht echt zu sein
Wie schickt ihr sie so sonst, nachdem sie reich sind, ins Ghettoheim?
Verdammt ich hab meine Lektion gelernt, mein Lehrgeld bezahlt
Es war auch verkehrt mit Savas
Doch was ist jetzt? Die alte Magic ist verflogen!
Nicht nur bei dir, sondern bei mir, ging es nicht nach oben!
Du hast in vielen Dingen recht gehabt!
Aber ich auch, da haben wir nun einmal Pech gehabt
Na Hauptsache irgendwelche Pisser wurden unterhalten...
Wenn wir tot sind können wir uns da oben unterhalten!
Es ist Schicksal! Weil ich an sowas glaub
Ist die ganze Welt grau. Geht es dann wieder rauf?
Jedermann, jede Frau weiß es langsam genau
Denn ich stand wieder auf, man, ich stand wieder auf
Und die ganze Geschichte trage ich in mir selbst
Denn ich hab durch den ganzen Beef nicht den Namen erwähnt von ...
Muss mit anhören, wie Leute die Familie bedrohen
Man ihr raffts nicht: Rapper sind doch reale Personen!
Sie haben einen Pass, sie haben eine Klingel!
Egal, der Beef passt nämlich gerade zu der Single!
Die Medien ficken dich dann nochmal bis du heulst
Mir ist egal was ihr alle sagt: Costa ist mein Freund!
Ich bin ein ersguterjunge heute, seht zu!
Und auch wenn der Schmerz so ungeheuer weh tut!
Was hat der ganze Beef gemacht?
Was hat der ganze Beef gebracht?
Alles ist so wertlos! (wertlos!)
Ich wünsche Manuell viel Glück!
Ich wünsche Kay viel Glück!
Und das mein ich ernst, Homes! (Homes!)
Hiphop.de, habt ihr das mal hinterfragt?
Ich fühle mich als deutscher Rapper wie ein Zinnsoldat!
Und jetzt sag mir nochmal, ich wär nur eine Pac Kopie!
Ich mach das nicht für dich, sondern weil ich das so lieb!
Wir sind nur Toy Soldiers

[Hook]
Step by step, heart to heart, left right left we all fall down
Step by step, heart to heart, left right left, we all fall down like TOY SOLDIERS
Bit by bit torn apart, we never win but the battle wages on for TOY SOLDIERS

[Outro]
Yeah!
Das ist für alle Brüder!
Die für mich da waren...
Hakan Abi!
Faysel...
Erdal, was geht?
Murat, Cengiz..
Bizzy! Bist zufrieden jetzt, Bro!
Yeah!","https://genius.com/Eko-fresh-toy-soldier-lyrics","Released 2020
Primary Artists

    
      Bushido, Capkekz, Eko Fresh & 3 more
Featuring

    
      Capkekz, Eko Fresh, Farid Bang & 6 more
Producers

    
      Bushido, Kingsize, Prodycem & 1 more
Writers

    
      Azra, Bushido, Capkekz & 9 more
Additional Voice

    
      Redman"
"8","Bushido","Flerräter","Best of freetracks volume 4","[Intro, gesprochen von Bushido]
Yeah Fler, ich hatte keinen Bock auf den Stress, aber du hast keinen Respekt mehr. Du hast vergessen wo du herkommstDu Vogel. Ich hoffe, du weißt wo du morgen hingehst

[Verse 1: Bushido]
Halt dich fest, jetzt ist Frank dran. Lass' die Gang ranDu bist keine Konkurrenz. Ich rappe und es fängt an
Sieh es ein, du bist kein Rapper aus Gold
Seitdem ich weg bin wirst du jeden Tag fetter, du Troll
Du bist nicht hart, wenn du wie kein Mann flowst
Wenn du wirklich ziehst, wie viel kostet ein Gramm Koks?
Wir haben beide was gemeinsam, werden beide gehasst
Du hast Fans bei Olli Pocher, ich hab meine im Knast
Und jetzt? Was willst du wieder tun?
Ich machklick klack bala bala klick klack BOOM!
Du bist der neue Star bei Aggro Berlin?
Glaubst du im Ernst, du darfst mehr als ein Sido verdienen?
Ich lass' deinen Traum platzen, Junge. Du bist dritte Wahl
Du bist so unbeliebt, du kannst nicht mal nach Mitte fahr'n
Wenn ich will, nehm' ich dir alles wieder weg. Wenn ich
Wenn ich will, fresst ihr alle wieder Dreck! *aah*
Du lebst von Krümeln, die von Tellerrand fallen
Nach deinem ersten Album lassen dich die Penner dann fallen
Und du kriegst kein Video ohne Feature vom Maskenmann
An mein Geschäft lass' ich keinen von euch Spasten ran
Oh wie schade,Patrickfindet jetzt Bushido dumm?
Kuck mal Eko Fresh hängt jetzt mit Pussydo rum!
Eigentlich hatte ich gegen dich nichtsUnd bevor du mich kanntest war dein Leben gefickt
Ich war auf Tour mit Azad. Ich hab dir Props gegebenIch war auch mal bei Aggro und hab dir 'nen Job gegeben
Heute nennst du mich den Sohn einer Hure, Fler
Und dass Ilan nur ein geldgeiler Jude wär
Keine Sorge, du kriegst alles von selbst zurück
Und was du heute bist, war nicht mal zur Hälfte Glück!
Es war nur mein Fame und Sentences Stift
Mein Wunsch ist's einfach dich nie wieder zu sehen, du Bitch

[Gesprochen von Bushido]
Ok, Patrick, wir werden uns nie wieder flertragen und
Rate mal, wer jetzt kommt

[Hook: Eko Fresh]
Du bist ein Flerräter. Das hast du dir selber eingebrockt
Wir sind dein Hartz IV. Such' dir selber einen Job!
Du hast jetzt flerkackt, denn wir haben dich flernichtet
Willst du uns flerarschen, Patrick? Flerpiss dich!
[Hook: Bushido]
Du bist ein Flerräter. Das hast du dir selber eingebrockt
Wir sind dein Hartz IV. Such' dir selber einen Job!
Du hast jetzt flerkackt, denn wir haben dich flernichtet
Willst du uns flerarschen, Patrick?

[Verse 2: Eko Fresh]
Du bist ein Flerräter, also flerflixt nochmal!
Nächstes Jahr sieht man dann wie Fler fixt vor Spar
Es nervt mich total, was ist zur Hölle passiert?
Sido und Fler wollen jetzt auf einmal telefonieren?
Das ist die neue deutsche Schelle und dein Ende, du Kind
Das ist nicht 8 Mile, weil der Blonde nicht am Ende gewinnt
Fler trägt die Kette bis zum Sack,doch Eko rechnet abEs tut mir Leid für dich, falls es mit dem Rappen nicht mehr klapptIch weiß, dass du daheim zitterst
Kommt, ich zeig euch etwas lustiges:Fler, sag doch bitte nochmal ""Ein Snickers""
Keiner ist schlechter als Fler. Keiner ist schlechter als er
Alle, die ich kenne hassen deine Fresse so sehr
Was redest du von Ehre? Du ziehst deine Fahne durch denArsch einer Ollen!
Fler, vergiss es einfach, hart sein zu wollen
Baba Saad hat dich auf Electro Ghetto geburned!
Nenn' dein verficktes Album ""Früher hab ich Eko gehört""!
Ich bin eh deine Scheiße Leid. Du muss jetzt nach Berlin. Bushido sagt, es gibt Yayo zum halben Preis
So nimmt das Leben seinen Lauf. Du redest über meine Frau?
Ich fick' dich lyrisch und Bushido rammt dir Schläge in den Bauch!
Ey yo, Patrick, du Arschbacke?
Junge, ich bin, was du sein willst. Ein waschechter Kanacke!
Fler, du weißt Bescheid. Lerne aus dem Scheiß!
Ich rapp' 9 Bars und deine Karriere ist vorbei!
Du bist Deutscher. Was redest du von ""Alter, ist krass!
Diesen Sound pumpen sie bei Walter im Knast!""
[Eko Fresh]: Du kennst Türken, die sich für mich schämen?Ich kenne keinen Deutschen, der sich nicht für dich schämtIch ficke deinen piss Fame!
Ich bin ein Star, du bist einer von Tausden Bitern!
Ich bin E.K.O. aka der auf dich Scheißer
Ich komme mit Bushido Seite an Seite
Du bist gleich am verzweifeln. Sido gibt dir Streicheleinheiten

[Hook]

[Bushido gesprochen]
Ok, Patrick, hast du mir zu gehört?
Ich will mich nicht wiederholen. Ich hab' keinen Bock, noch einen Track gegen dich zu machen, Alter! Ein Track hat gereicht. Das waren zweimal 32 Takte in dein Gesicht, du Opfer! Du hast keinen Respekt mehr, Rap hin, Rap her. Aggro Berlin hin, Aggro Berlin her

Das geht um unsere Mütter, du Idiot!Du kennst meine Mutter, ich kenn' deine Mutter!Wer hat damals bei mir geschlafen, als er im Heim nicht mal chillen konnte, Alter? Welche Mutter hat für dich gekocht? Meine Mutter!Du hast keinen Respekt mehr, Alter!Wenn schon nicht vor mir, dann wenigstens vor meiner Mutter, du Opfer! Wer bist du? Ein Rapper? Ein deutscher Rapper? Du bist die neue deutsche Welle? Ich ficke deine neue deutsche Welle, du Opfer!

Ich wollte nix mehr sagen. Du hast alle genervt, alle, Alter! Wer bist du schon? Du bist ein Komplex, du Idiot!
Damals schon in Zehlendorf! Nix bist du, Alter!
Ich hab' dich zu dem gemacht, was du bist! Ich, ich!
Und Eko hat dich gefickt! Hack' nicht auf Eko rum!Hast du seine Takte gehört? Hast du seine Strophe gehört?Der Junge will sich nicht boxen. Der Junge fickt dich!Er fickt deinen Rap und dein Rap ist dein LebenAlso hat er dein Leben gefickt, Alter!
Du unintelligentes Stück deutsche Scheiße, Alter!Du bist Deutscher? Meine Mutter ist auch Deutsch, du Opfer!Sie schämt sich für dich, Alter! Du Riesenspasst, Mann!

Ilan hat mich aufgenommen. Ein Jude hat mich aufgenommen, Alter, ok? Dieses geldgeile Judenschwein, Alter!
Waren das nicht deine Worte? Deine Worte und Specters Worte?Mann, Alter, ey! Das war's, Junge! Du bist game over, Alter, ok?

Ich warte auf dein Album. Ich kauf' mir dein Album zweimalDann hast du zwei Alben verkauft, du Opfer! Zwei Stück! Zwei! Nicht mehr und nicht weniger, ok? Du bist in den Top 10 und hast noch kein Album draußen?

Weißt du, warum ihr alle drei in den Top 10 seid?
Wegen mir! Wegen meinem Namen! Wegen meinem Image! Wegen meinen Freunden, Alter, ok?

Aggro Berlin ist der Schwanz, der dich in den Arsch bumst!
Tut mir Leid, Alter. Ich muss weg!

Rammstein wartet auf mich!","https://genius.com/Bushido-flerrater-lyrics","Released 2020
Primary Artists

    
      Bushido, Capkekz, Eko Fresh & 3 more
Featuring

    
      Capkekz, Eko Fresh, Farid Bang & 6 more
Producers

    
      Bushido, Kingsize, Prodycem & 1 more
Writers

    
      Azra, Bushido, Capkekz & 9 more
Additional Voice

    
      Redman"
"9","Farid Bang","Arm aus’m Fenster","Best of freetracks volume 4","[Intro: Eko Fresh]
Yeah. German Dream Evangelium. Kingsize, was geht ab yoah?
Prodycem, was geht ab yoah?
Ah, Ah, Ah, Whoooah!

[Part 1: Summer Cem]
Siki Cem, ja ihr Fotzen seid zu weich
Hier kommt der Boss von diesem Scheiß, aus dem Osten der Türkei
Eko, sag wer will den Balboa am Mic ficken
Ich tritt dich aus, wie Marlboro Light Kippe
Wer will Streit, denn ihr wisst wer ich bin
Schaut mich an, in Vergleich seid ihr Strichmänneken
Eyo du fauchst wie ne Katze, leg dich erstmal auf die Schaumstoffmatratze
Es gibt Faust in die Fatze
Geld auf die Hand und, ich bin der Fels in der Brandung
Der, der dich Kelb an die Hand boomt
Gerade geboomt dieser Part auf den Song
Zerschmettert dein Kopf wie ein Glas auf Beton
S-U, doppel M, E-R und ich bleibe Admiral
Komm zu dir nach Hause, und ficke dein Eigenkapital
Ich geb dir ein Tipp, schwing dein Arsch auf den [Pampers ?]
Ich fahr durch die Branx, mit dem Arm aus dem Fenster

[Hook: Hakan Abi]
Ihr seid jetzt gefickt, Westside ist die Cliq
Ich kriege nicht genug, von diesem Grembranx Shit (yeah)
Evangelium, Cologne City, Crip Walk
Und das ganze kam dir ohne hin verrückt vor
Hör mal was aus diesem Auto pumpt
Nord-Rhein-Westside, 100 Tausend Jungs (yeah)
Komm wir reißen euch den Arsch auf ihr Gangster
Ich fahr durch die Branx, mit dem Arm aus dem Fenster

[Part 2: Farid Bang]
Das ist die Westside, du weist dass dein Lehrer heut gefickt ist
Du hast Achselhaare, so wie Nena '79
Und ich höre nur Alicia Keys
Frauenkauf in Prag, mir bringt Alicia Kies
Du willst mich ficken, doch die Sache hat ein Haken wie Boxer
Ich hole Nutten von der Straße wie Popstars
Ausländer, Draufgänger, tot in deiner Siedlung
Rap hat mehr Huansöhne, als ein Polizeipräsidium
Ich leg Frauen flach wie ne Boxweltmeisterin
Du hängst an der Nadel, wie ne Stoff-Fell-Schneiderin
Damenbart, ja du bist verrückt nach Ashanti
Guck dich an du bist am Drücker, wie Junkies
Und du liegst im Wald, wie eine Bärenfalle
Ich komm in den Club und du siehst wie Bären fallen
Farid Bang Bus ich bin der Käfigkämpfer
Und ich streck mein' Arm aus im Mercedesfenster

[Hook: Hakan Abi]
Ihr seid jetzt gefickt, Westside ist die Cliq
Ich kriege nicht genug, von diesem Grembranx Shit (yeah)
Evangelium, Cologne City, Crip Walk
Und das ganze kam dir ohne hin verrückt vor
Hör mal was aus diesem Auto pumpt
Nord-Rhein-Westside, 100 Tausend Jungs (yeah)
Komm wir reißen euch den Arsch auf ihr Gangster
Ich fahr durch die Branx, mit dem Arm aus dem Fenster

[Part 3: Capkekz]
Ich hör das Martinshorn und schon lassen sich Stricher zeigen
Hier in meinem Viertel, kriegen die Bullen ein Ficker-Zeichen
Mit einem Schraubenschlüssel, hau ich deinen Häuptling ins Koma
Stehe vor deiner Tür, wie die Zeugen Jehovas
Du hast ne käufliche Oma, und ein gebrochenen Kiefer
Wenn mein Album kommt, Nigger, wird geschossen auf VIVA
Ich lieb das trockene Klima, und wir boxen dich raus
Es ist Crimetime, glaub mir deine Fotzen sind out
Ich hab euch Penner massakiert, weil ich ficke wie ein Stier
Seit dem German Dream, gibt es keine Pisser mehr hier
Ich hab dich im Visier, und alle sehen wie du fällst
Deine Fresse muss ich klatschen, den es geht hier um Geld
Ich bin gern bei der Sache, fick den Rest deiner Spacken
Kreuz die Finger zu 'nem W, und sei ein Westside Kanake
Du bist echt nur ein Affe, nimm den Rat eines Gangster
Grembranx Sampler und Arm aus'm Fenster

[Hook: Hakan Abi]
Ihr seid jetzt gefickt, Westside ist die Cliq
Ich kriege nicht genug, von diesem Grembranx Shit (yeah)
Evangelium, Cologne City, Crip Walk
Und das ganze kam dir ohne hin verrückt vor
Hör mal was aus diesem Auto pumpt
Nord-Rhein-Westside, 100 Tausend Jungs (yeah)
Komm wir reißen euch den Arsch auf ihr Gangster
Ich fahr durch die Branx, mit dem Arm aus dem Fenster

[Part 4: S.Diddy]
Du bist ein Chicken, ich geh nach dem Ficken direkt ins Studio um zu spitten
Ich spritz so 'nem Hurensohn auf die Titten, ich schmier euch das Koks auf die Klit, denn
Rapper benehmen sich wie Nutten, ich rappe ein Verse, du gehst in deinem Elend kaputt
GD ist das Label der Hood
Guck, ich spuck etwas Müll auf ein Blatt und es klingt geil, wenn ich rhyme
Du machst den Mund auf und ich schiebe dir die Scheiße rein
Siehst mich um 6 Uhr morgens auf Teilen und einem Stein
Wenn du anfängst Scheine zu zeigen, sind deine Scheine mein'
Diddy ist hier... palim palim. Keiner hat sich für dich interessiert
Und ich bin der King am Ring
Immer wenn ich rapp', reagieren draußen tausend geschockt
Komm' zu mir nach Hause in einem Rock und ich ficke deine Frau mit einem Stock
Ich hab nur Flausen im Kopf, aha ...hmm, wie toll
[?] bis ich drauf' gehe wie Anna Nicole Smith
Deine Frau ist im Wagen am blasen und jetzt tropft das Sperma vom Lenkrad
Doch ich fahr durch die Branx mit dem Arm ausm Fenster

[Hook: Hakan Abi]
Ihr seid jetzt gefickt, Westside ist die Cliq
Ich kriege nicht genug, von diesem Grembranx Shit (yeah)
Evangelium, Cologne City, Crip Walk
Und das ganze kam dir ohne hin verrückt vor
Hör mal was aus diesem Auto pumpt
Nord-Rhein-Westside, 100 Tausend Jungs (yeah)
Komm wir reißen euch den Arsch auf ihr Gangster
Ich fahr durch die Branx, mit dem Arm aus demFenster","https://genius.com/Farid-bang-arm-ausm-fenster-lyrics","Released 2020
Primary Artists

    
      Bushido, Capkekz, Eko Fresh & 3 more
Featuring

    
      Capkekz, Eko Fresh, Farid Bang & 6 more
Producers

    
      Bushido, Kingsize, Prodycem & 1 more
Writers

    
      Azra, Bushido, Capkekz & 9 more
Additional Voice

    
      Redman"
