"";"artist";"title";"album";"text";"url";"metadata"
"8";"Beginner";"Geht was?";"Bambule";"[Verse I:]
Die Beginner wolllen mehr
Ich flick’ an meinen Styles
Schneide Beats, gleiches Handwerk, wie ein Näher
Doch nur mit einem Hit wär’ ich aus’m Schneider
Endlich am Ziel: Mehr Geld als Neider -
Immer weiter
Denn unser Stil ist Zucker
Bin nicht Macker sondern Mucker
Und lecker, schein’ bei jedem Wetter
Verdien’ meine Brötchen nicht als Bäcker
Obwohl du denkst: Au Backe!
Wenn ich coole Raps gebacken kriege und auf Beats packe
Wir haben Tinte im Füller für neue Rap-Knüller
Knaller, kunterbunte Styles, wie Pippi’s Villa
Die AB-LP, Lolli-Pop, derber Lutscher
Wir werden abgeschleckt, doch niemals abgelutschter
Als Styles von Gestern
Weil ""sehr gut"" gäb’s, gäb’s Plattentester
Unter Stiftung Warentest-Testern
Mein Redefluß fließt, fall nicht hinein
Sonst gibt’s ‘nen Reinfall wie in Krefeld am Rhein
Wir bleiben groß, wie der Toast, wenn du Hunger hast
Wir bleiben groß, wie der Kloß, wenn du Kummer hast
Wenn ich Rap zu dir sende und weiter dichte
Merkst du, er geht nie zu Ende, wie Michaels’ Geschichte!

[Refrain:]
Check das, check das, check das! Die Beginner kommen und sie kommen krass!
Mit dem Beat und dem Bass! Da geht was! Da geht was!

[Verse II:]
Check das, check das, das Rap As rapt das, wie Astaire steppt das
Ich bin im Haus und geh’ so schnell nicht wieder raus
Wie die, die Schleyer fanden, reiß ich die Klappe auf
Hier kommt der Fuchs, der die Hits bringt
Der euch auf die Tanzfläche wie’n Schleudersitz zwingt
Ihr wackelt mit dem Popo, werdet völlig loco
Hör’n wir auf, kommt ihr um euch zu beschweren wie Toco
Wie wir so die Styles wieBaslerBälle kicken tun
Da muß aber eine alte Frau lange für stricken tun
Kein pro forma Performer, Cosa Nostra-Poser
MC wie auf MTV
Wir sind anders, wie Lilo Wanders, aber nicht Ufer-mäßig
Im Style-Jeopardy zuverlässig
Denn wir kennen sie alle, von Abba bis Zappa
Keine Sample CDs, aber Platten von Papa
Wär’ mein Rap ein StripDann wär’ am Ende meiner Strophe ‘ne Menge Geld in meinem Slip
Dann noch die Beginner und der Beat und der Bass da
Bräuchten wir ‘n Laster für den ganzen Zaster!

[Refrain]

[Verse III:]
Dies hier geht raus an alle hippen Hopper
VIVA-Divas und MTV-Roboter
Zieht euch den Stock aus’m Arsch und macht euch locker
Und ahnt mal die neuen Styles vom alten Chef-Rocker
Mit’m Mikro statt Mosquitos und Sampler statt ‘ner Chopper beginn ich absolutDoch hab´ nix am Hut mit Wodka
Wär’n Raps Schuhe, man, dann wär’ ich footlocker
Das Gelbe vom Ei und du bist nur das Dotter
Ich erzähl’ Geschichten wie ollen Opa
Nur gereimt und ‘n bißchen flotter
Toppe den Act, toppe die Hits, toppe die Ten, toppe die Gun
Toppe die Secret - denn ich bin der Alles-Topper
Viele machen Schrott und machen damit Schotter
Die Leute ham’ wohl Bock auf Gestammel und Gestotter
An die Wellenreiter, ich sag’ nur:
Hoppa, hoppa, wenn er fällt, dann schreit er! Hoppla!";"https://genius.com/Beginner-geht-was-lyrics";"Released November 9, 1998
Featuring

    
      Das Bo, David P., Ferris MC & 1 more
Producers

    
      Denyo, DJ Mad, Eizi Eiz & 2 more
Writers

    
      Denyo, Eizi Eiz, Jan Delay & 2 more"
"9";"Beginner";"Geh’ Bitte";"Bambule";"[Hook]
Geh bitte, sag niemand', dass du hier warst
Geh bitte, sag niemand', dass du hier warst
Geh bitte, sag niemand', dass du hier warst
Geh bitte, geh-geh, bitte!
Geh bitte, sag niemand', dass du hier warst
Geh bitte, sag niemand', dass du hier warst
Geh bitte, sag niemand', dass du hier warst
Geh bitte, geh-geh, bitte!

[Part 1]
Du hast an meine Tür geklopft und ich hab’ aufgemacht
Dann hast du deine Styles gezeigt, ich hab’ dich ausgelacht
Denn da geht leider nix und da wird nie was geh’n
Denn man wird Michael Jordan auch niemals in Fila seh’n
Deine Raps mach ich aus’m Po auf’m KloDurch die Spülung hat das Ganze immer noch mehr Flow
Sowieso, denn deiner steht still, wie auf’m Abschlussfoto
Du bist für gute Musik, wie für die Beatles YokoOno- Oh no, no, no, no/Bringst mir Spaß, wie Star Wars in Mono
Hast soviel Stil, wie ein Cornetto Eis
Und soviel Plan von coolen Beats, wie Abels Bruder heißt
Denn deine sind tot und dünn wie Knäckebrot
Und deine Styles gibt’s bei Karstadt im Sonderangebot
Und ist bei deinem MistAuch nur eine kleine Idee ‘bei, dann kauf’ ich sie freiNicht, weil sie für mich vielleicht viel wert istIch will nicht, dass sie länger im Gefängnis eingesperrt ist
Verehrtester toy, hop hop, weg mit deinem Schrott
Mach die Tür von außen zu und nenn’ mich Gott ...

[Hook]
Geh bitte, sag niemand', dass du hier warst
Geh bitte, sag niemand', dass du hier warst
Geh bitte, sag niemand', dass du hier warst
Geh bitte, geh-geh, bitte!
Geh bitte, sag niemand', dass du hier warst
Geh bitte, sag niemand', dass du hier warst
Geh bitte, sag niemand', dass du hier warst
Geh bitte, geh-geh, bitte!

[Part 2: Denyo]
Während mein Flimmerkasten deine Mucke zeigt
Und du hoffst, dass ich frag’, wo denn meine Spucke bleibt
Merk’ ich, du hast kein’ Style parat, nix am Start und nix drauf
Dein Rap ist hingefurzt und ich mach’ das Fenster auf
Bei dir hilft nix, auch keine Frauen im BikiniLange Beine, kurzer Sinn, lange Reime kurz mal in
Dein Lied Platz 1, doch deine Styles verbrannte Plätzchen
Du nimmst ‘ n Blatt vor’m Mund und ich zum Joint gerollte Blättchen
Nein Typ, du hast nichts auf’m Kasten
Dein Bass ist auf Diät und deine Beats war’n fasten
Mit deinen Partys am Pool chillst du voll cool
Doch rollt dein Reim nicht mal mit Rollstuhl
Von Platz 1 hört man dich stürzen, noch 100 Meter, es wird platschen
Bei dir gibts kein in die Hände- sondern dich zu klatschen
Du Pfeife, ich flutsch dich in ‘ner Bong
Und hab statt deim’ Bass in ‘ner Box lieber Ruhe im Karton
Du wirst heiß umworben, doch bist höchstens heiser
Bist du majestätisch ist Roland Kaiser
Alle müssten wissen, dass bei dir nichts geht
Denn du drückst dich aus, wie Teenies Pickel in der Pubertät

[Bridge]
Geh bitte!

[Part 3: Platin Martin]
Ein Abend mit dir ist wie eine Woche mit Grippe, ey
Mein Style hundert Joints und dein Style eine Kippe, ey
Wie Gitte, hey, hab’ ich Lampenfieber, aber schnippe dich lieber weg
Rauch’ lieber mein Cheeba, als deinen Dreck
Guck, Styles wie meine wird es nur einmal geben
Während ich Styles kick’, trittst du daneben
Fällst in den Styleabgrund und liegst da unten
Wirst irgendwann zusammen mit Clogs und Muscle-Shirts und so gefunden
Ungünstig, deine Kunst ist künstlich wie Silikon-Titten
Voll nicht so heiß und nicht halb so umstritten
Jeder weiß, dass dein Style abgeschaut ist, geklaut ist
Gestohlen bleiben kann er jedem, der mit Rap vertraut ist
Du willst ans Telefon kommen, komm in die Puschen
In der Zelle um die Ecke hat deine Oma angerufen
Überhaupt wird’s jetzt Zeit, dass du gehst, du
Sag niemand’, dass du hier warst, verstehst du

[Bridge]
Geh bitte (you gotta go)
Geh bitte (you gotta go)
Geh bitte (you got-)
Geh bitte, geh-geh, bitte! (ta go)
Geh bitte, geh bitte! (because ..)
Geh bitte! (because ..)
Geh bitte! (we don't need you on here anymore)
Geh bitte, geh-geh, bitte!

[Hook]
Geh bitte, sag niemand', dass du hier warst
Geh bitte, sag niemand', dass du hier warst
Geh bitte, sag niemand', dass du hier warst
Geh bitte, geh-geh, bitte!
Geh bitte, sag niemand', dass du hier warst
Geh bitte, sag niemand', dass du hier warst
Geh bitte, sag niemand', dass du hier warst
Geh bitte, geh-geh, bitte!";"https://genius.com/Beginner-geh-bitte-lyrics";"Released November 9, 1998
Featuring

    
      Das Bo, David P., Ferris MC & 1 more
Producers

    
      Denyo, DJ Mad, Eizi Eiz & 2 more
Writers

    
      Denyo, Eizi Eiz, Jan Delay & 2 more"
"10";"Beginner";"Nie Nett";"Bambule";"[Verse I: Eißfeldt]
Wo ich chill' da, steh'n Schilder, die sagen
Ich will da keine Labernasen, die mich plagen
Kein Hubba-Bubba von deinem Blubber-Blubber
Geh und verscheuer Heizdecken auf'm Butter-Kutter
Sorry, kein Bock auf deine StoryGeh zu 'ner Parkuhr, kost' zwei Mark nur
Ich hab dir nix zu sagen
Du hast mich nix zu fragen
Tu lieber so, als ob ich gar nicht da bin
Ich will nur irgendwo da oben sitzen, runter gucken
Ab und zu grüßen, ab und zu spucken
Mit den Schultern zucken bei den Puppen aus'm Werbeclip
Und dem grausamen ich-will-dass-ich-was-werde-Blick
Mit gelacktem Kompaktgrinsen
Unter gleich Beknackten nach Kontakt linsen
Wie kann man nur so unfunky tanzen, bitte?
Ihr netten, Adretten nervt, wie Junkies im Schanzenviertel!

[Part 2: Bo]
Ich bin nie wieder nett, wenn Nat-King Cole
Nenn' mich Unforgeta-Bo
Ich brech die NDW, das ist die Nette Deutsche Welle
Stelle nette Rapper in' Schatten
Die biten wie Ratten
Ich bin die Quelle für Raps mit Profil und Charakter
Ich bin nicht aalglatt
Ich schneid' den Aal ab
Und schließ' den Saal ab, in dem ihr nett seid
Und wenn ihr jetzt immer noch denkt, dass ihr fett seid
Habt ihr euch so heftig geschnitten, wie 'ne Amputation
Und ohne Beine seid ihr nur noch arm dran' und 'n StumpenIhr könnt nicht mal humpeln
Na, sind deine Protesen weg, hast du sie noch nicht gefunden?
Ich hab sie versteckt
Ist das nicht nett?
""Nat Turner? Wo?""
Der heißt Ted Turner, ist in der Vagina von Tina, und danach im Po
""Mensch Bo!"" - Was denn? - ""Verarsch' mich nicht immer, sei doch mal nett!""
""My memory's bad hon, I just fuckin' forget""

[Hook: Bo]
Wir wollen Blumen brennen seh'n
Sandalen rennen seh'n
Grinsende halbe Hemden flennen seh'n
Eure Karrieren enden seh'n
Eure Style-Rechnung ist nicht aufgegangen, wir kommen, pfänden geh'n
Wir wollen Blumen brennen seh'n
Sandalen rennen seh'n
Grinsende halbe Hemden flennen seh'n
Haben 'n Track und senden den
Eure Style-Rechnung ist nicht aufgegangen, wir kommen, pfänden geh'n

[Part 3: Ferris]
I rock the house, roll a spliff
Gegenmittel gegen mich gibt's nich'
Gib mir 'n Beat, mein Kopf is' voll ""Pures Gift""
Sind die Augen rot, mach ich blau bis ich schwarz seh'
Lifestyle: Kamikaze
Bei mir 'ne Dauerphase
Noch 'ne Frage:
Was ist geil, geiler, am geilsten?
Prollstyle vom Feinsten - frontal
Bleib' locker sonst wird das Monster beißen, wie Mike Tyson, is' mir egal
Meine Weste keine von den weissen - und du hast keine Wahl
Mongo-Clicke, Mongo-Attack
Du wirst schwitzen wie Kurt Russell in Backdraft
Sobald 'n Freak ""eins, zwo"" in's Mic rappt, burnen alle Wack-MCs weg
Durch heiße Ware auf Vinyl, CD und auf Tapedeck
Sie sind viel zu weit weg
Von diesem Level mit Scheißdreck
Darum hat battlen hier kein' Zweck
Erstens ist mein Atem länger
Zweitens sind meine Taschen leer
Drittens: Ich bin so derbe fett, aber der größte Hänger

[Part 4: Denyo]
Ich lebe um zu liebenNette führn Intrigen
Schneiden geschwollen labernd und lachend Grimassen wie Skins Frisen
Poppen morgens auf Kocken, ham' mittags 'n paar Kongresse
Und Abends haun' sie auf Feten lächelnd Kollegen auf die Fresse
Doch nur mit Wörtern, versteht sich
Geplant ist jede Gestik
Das Gut-drauf-sein
Muß gekauft sein
Ihre Parties stimmen heiter, wie 'n Aids-Test positiv
Da's dort nur falsche gute Laune und nichts Großes gibt
Nee, nee, sind solche Typen vor der Bühne, riskier' ich 'ne dicke LippeRappe nicht mehr für Geld, nee, für pikierte Blicke
Wie Bo und Ferris, die die Beginner begleiten
Und Beweisen, dass die meisten, die rappen nicht tight sind, sondern Pfeifen
Ich scheiß' auf nett, streich es aus'm Wörterbuch
Verzichte drauf, wenn ich aus'm Duden Wörter buch'
Alle Netten seh'n schlecht aus
Sie zu dissen nicht heikel und wenn, nehm' ich mir das Recht raus
Und bring den Scheiß erst recht raus

[Hook]

[Outro: Bo]
Für mich ist nett nix
Das Bo is' nicht nix
Jetzt kommt die Nummer 13 von den Mongo-Flash-Tips
Zwei Blunts nebeneinander seh'n aus wie 'n Twix
Wenn Bo cool wie Winter rappt
Is' er nur im Internet

";"https://genius.com/Beginner-nie-nett-lyrics";"Released November 9, 1998
Featuring

    
      Das Bo, David P., Ferris MC & 1 more
Producers

    
      Denyo, DJ Mad, Eizi Eiz & 2 more
Writers

    
      Denyo, Eizi Eiz, Jan Delay & 2 more"
"11";"Beginner";"Mikro In Der Hand";"Bambule";"“Mikro in der Hand!Hey Leute, wo wollt ihr hin mit dem Mikro in der Hand? (yeah yeah) Mikro in der Hand!
Ich frage ""Hey David, wo willst du hin mit dem Mikro in der Hand?” (yeah oh Baby, yeah) Mikro in der Hand!""

[Verse I: David P]
Check mich aus
Ich bin im Haus
Wo immer das auch ist, ich mach das Beste draus
Sie sagen, ich sei drauf - lauf' die ganze Zeit bergauf
David El Shaddai- paß auf!
Meine Schöpfung offenbart sich durch die 7. Öffnung
El Shadai sagt dir Bescheid, bringt Bewegung in die Köpfe
Zieh' dorthin wo die Mikros sind, ins Zentrum der Verbindung
Die Bedingung war nie mehr als nur Empfindung für die Schwingung
Segne Soundlabs mit Raps, hab' Weedbacks für Tracks
Die Beginner und der Typ, der Zeichen setzt vom Ghettoplatz
Die Besten gehn' zuletzt, wie du siehst sind wir noch immer da
Wir konstruieren wie Zimmerer,den Bau der bis in' Himmel ragt
Hast du schon gesehen, was geht wenn ich übernehm'
In Hamburg würd' man von mir sagen - ""Ey, ahnst du den?!""
Der Fuchs kommt auf Ideen, der ist groß, da wird was gehn'
Denn wir rappen, weil es ein muß, nicht wie andere aus Versehen
Sind die Mics bereits von Ice getestet, bin ich auch da
Hol' Schätze aus den Tiefen meines Geistes wie Perlentaucher
Alles brauchbar für's Archiv
Für die Platten vonAbees
Das Micro ist gesegnet - Peace!

[Verse II: Eißfeldt]
Wir waren HipHops ohne wenn und aber
Und crossten over, von Planet Rock bis nach Lambada
Wir sahen das ziemlich eng, wenn Leute uns nicht ernst nahmen
Und nahmen nur Leute ernst, die alles nicht so eng sahen
Chillten mit Lang-Haaren, mit Gitarren auf'm Rücken
Fluchten, weil die Suchen nach Rock-Frei-Radio mißglückten
Wir ham' gefressen, was man uns vorsetzte
Und wir ham' geschimpft wie die Rohrspätze
Hatten 'nen Auftritt in der Küche von Odette
Rockten barocke Theater mit goldenem Klosette
Für ein Diner beiMcDschnell noch Geld geliehn'
Und wir spielten niemals in Dörfern ohne Nouvelle Cuisine
Auf Anlagen, fähig den Super-Gau zu startenUnd auch auf Boxen, die wir sonst als Kopfhörer tragen
Autobahn, ohne Gurt, zehn Mann imFiesta
Und über den Wolken im Flieger, 'ne Siesta
Engagiert, agitiert, toleriert, propagiert
Und von der Wortpolizei observiert
Wir kamen mit dem Zeige- und mit dem Mittelfinger
Machten Dicke- und Dünne- aber nie Mittel-Dinger!

[Verse III:Denyo]
Mit Afrika-Amulett als Semi-Deutscher-Afro-Nigga
Und ""Skateboarding is not a crime"" - Sticker
Mit Kick-Flips, Rail-Rides,-Slides und all' den Tricks
Statt Snares, Hats und Kicks, so wie's halt heute is'
Mehr Unsinn als Rainer, war der Chef, fand mich super
Mit Porno- und Nike-Streifen als Mittelpunkt der Puper
Im Badezimmer, wo ich vor'm Spiegel alleinstand
P.E.-Texte nachsagte, ihn fragte: ""Gibt's Styles in meinem Land?""
Mein Reim fand ich, wurd' es mir zu öde, was 'rauskam
Träumte auf Jams, daß für mich der Applaus kam
So kam mein Style von selbst, fragte: ""Dennis, wie heißt du?""
""Ich bin geil"", war meine Antwort, die frage: ""Bleibst Du?""
Zu Haus, nee ich ging raus, nahm' ihn mit und vergaß die Leine
So konnt' ich sie nicht mehr ziehen, weshalb ich locker reime
So macht mein Style heute was er will, pißt im Stehen, ist nicht
Stubenrein
Und noch taktloser, laß' ich's üben sein
Erste Autobahnen-Fahren-Aktionen im vollen Maße
War nie im Ghetto doch ein Teil meines Lebens war die Straße
Weil die Fans uns lieben, kannt' ich schon damals jeden Winkel der A7!";"https://genius.com/Beginner-mikro-in-der-hand-lyrics";"Released November 9, 1998
Featuring

    
      Das Bo, David P., Ferris MC & 1 more
Producers

    
      Denyo, DJ Mad, Eizi Eiz & 2 more
Writers

    
      Denyo, Eizi Eiz, Jan Delay & 2 more"
"12";"Beginner";"Nicht Allein";"Bambule";"[Verse 1: Jan Delay]
Halleluja, hallo du da, ja du da
Siehst du dich nicht auch, ab und zu malAllein auf weiter Flur, nur von Einzellern umgebenDie sich zur Musik von Zweizellern bewegenIhr Leben nach dem Wort von Dreizellern lebenUnd all' ihre Moneten den Vierzellern geben
Bist auch du ein Fernsehen-GernseherObwohl du beinahe kotzt, wenn du dann einmal glotztZapp, zapp: Gescheiterte, GescheitelteZapp, zapp: Verblühte, VergnügteZapp, zapp: Oh Gott, was'n SchrottDoch der Finger kann nicht drücken, auf den kleinen roten Knopp!
Ist auch dir die Übernahme durch's Digitale nicht geheuerDie PC-CD Paranoia
Wo alles nur noch piept, inklusive Eier
Nur noch die Daten zählen, als wär' die Welt 'n Flyer
Wird im Winter nett geraved, wird's im Internet gesavedAlle schön mit Online,näher dran an Bonn sein
Siehst du dich nicht manchmal auch im ICE nach EschedeAls einziger der's ahnen kann, der alle warnen kannUnd dann schaust du dich um, siehst das Grauen um dich 'rumDu weißt, die sind zu dumm, um dir zuGlauben und du bleibst stummDie wollen es doch nicht checken, na sollen sie doch verreckenMit Vollgas und Grinse-Fressen ins Ende des Schreckens!

[Verse 2: Denyo]
Wenn alles Jacke wie Hose ist, dummes Rumgepose istNix geheuer ist und alles zu teuer istUnd über kurz oder lang alles gleich wird und trägeDurch dick und dünn, ohne Kollege
Nasebohrend vor'm Kühlschrank, der leer istIch früher weit vorn und jetzt alles weit her ist
Keine Frau, kein Glück, kein Style, da ""0190..."" und so weiter
Weder klingelnde Kassen, noch TelephoneKein Schwein weiß, wo ich wohne
Wenn der Hocker der Thron ist, auf dem ich throneAm Tresen in der Kneipe, auf'm Bier die Krone
Keiner mit mir, sondern jeder down istLang nix abging, weil jeder abgehaun' ist
Freunde mir Raps stehlen, statt mit mir Pferde
Meine Mutter mich fragt, was ich werde!";"https://genius.com/Beginner-nicht-allein-lyrics";"Released November 9, 1998
Featuring

    
      Das Bo, David P., Ferris MC & 1 more
Producers

    
      Denyo, DJ Mad, Eizi Eiz & 2 more
Writers

    
      Denyo, Eizi Eiz, Jan Delay & 2 more"
