"","artist","title","album","text","url","metadata"
"9","Fettes Brot","Frikadelle am Ohr (Weekend Blues)","Fettes brot fur die welt","Es ist wieder mal Samstagmorgen und ich wache plötzlich auf von einem Klingeln an der Tür, doch ich mach mir da nichts draus. Ich bleibe besser liegen, ist mir eigentlich auch egal, aber nach tausendmal klingeln hab ich keine andere Wahl. Vor der Tür steht 'n Mann mit 'nem grauen Kittel an, als er dann zu reden anfängt kann ich vage die Lage erkennen, denn er ist der Hausmeister und er sagt, wenn ich so ein' Lärm wie letzte Nacht noch einmal mach, hätte ich den letzten Tag in dieser Wohnung verbracht Er meckert, er kleckert nicht, er klotzt, er motzt, und ich hätte ihm fast vor seine Füße gekotzt. Trotz alledem redet er immmer noch, und es wird schlimmer doch, nachdem ich in mein Zimmer kroch, holt er eine Flasche aus der Tasche - einen Flachmann ""Prooost!"" - man versteht sich unter Nachbarn. Er leert den Schnaps mit einem Schwung. Er sagt, er könnte mich verstehen, er war ja auch mal jung. Ganz väterlich quält er mich mit einem Schwank aus seinem Leben. Das war zuviel für mich, ich muss mich übergeben - daneben..., dabei war die Party fett. Endlich ist der Kerl gegangen, und ich kann wieder ins Bett. Das war alles nicht so schlimm, ich nehm' es mit Humor, doch schläft es sich schlecht mit Frikadelle am Ohr. Baby, red' mir eine Frikadelle ans Ohr!

Oh, oh weia, was für eine Feier, war ja die Pest gestern nacht - erst um acht in der Heia. Naja, es ging ganz sutsche los: Um neun ging das Geknutsche los. An meinem Bier mich labend, freute ich mich auf den Abend. Ich steh am Büfett, wobei ich Chips aus meinem Mund pule: ""Hey - ist das nicht Fips aus meiner Grundschule!?!"" Cool ey, wir stoßen an auf alte Zeiten, leider lässt er sich dazu verleiten, Nichtigkeiten zu verbreiten. Zu gescheiten Kommentaren ist er offenbar nicht fähig und eh ich einschlafe dann geh ich lieber - fieberhaft überlege ich, auf welchem Wege ich diesen Mann wieder loswerden kann. Er fragt mich nach Aspirin - ma' sehen, vielleicht hab' ich noch Arsen für ihn. Er redet wie ein Labersack - nicht gerade interessant, dafür aber Schabernack - ohne Sinn und Verstand. Ich hasse Leute, die nicht merken, wenn sie nerven, nur mit Dichtungen von eigenen Werken um sich werfen. Noch einen Mucks und ich schicke ihn flugs mit dem Fluxkompensator zurück in die Vergangenheit wie Michael J. Fox. Der Typ ist doch dicht wie Fort Knox. Hört nicht auf zu texten. Ich merke schon, mir wächst'n Kropf am Kopf. Mann, ich bin herbivor - ich ess kein Fleisch, nimm das Hack aus meinem Ohr!

Baby, red' mir eine Frikadelle ans Ohr!

Ich sitz grad' beim Mittagessen, ess 'n leckeres Gericht. es klingelt laut an der Tür und ich erschrecke mich. Mittagessen in den Augen, richtig sehen kann ich nicht, mach die Tür auf, jemand drückt mir eine Bibel ins Gesicht. ""Hallo, mein Sohn. Ich wollte mit Dir über Gott sprechen!"" Und an dieser Stelle wollt' ich das Gespräch abbrechen, doch der Typ redet weiter über Sein, über Schein, die Mundwinkel voller Schleim. Oh nein! Er kommt rein! ""Sex vor der Ehe, das ist Sünde mein Sohn. Du sollst Deine Unschuld bis zur Hochzeitsnacht schonen!"" Er zeigt mir Bücher, bunte Bilder mit bibeltreuen Brüdern. Und er sagt zu mir: ""Mein Sohn, willst Du überleben, musst Du mir etwas geben und Gebete reden."" Er redet über Engel, über Himmel, über Erde. Er redet über Frieden und wie ich erlöst werde. Er lächelt mich an und sagt, wie glücklich er ist, und mir wird klar, der Typ heisst Schmidt und ist Christ. Und er redet und er redet und er redet und er redet und er redet und er liest mir etwas vor. Und weil er redet, weil er redet, weil er redet, weil er redet, wächst mir 'ne Frikadelle am Ohr. Und aufgrund dieser Frikadelle hör ich ihn seit Stunden nicht, doch er redet und er redet und er redet und er redet. Er redet und ich werde ohnmächtig...

Baby, red' mir eine Frikadelle ans Ohr!","https://genius.com/Fettes-brot-frikadelle-am-ohr-weekend-blues-lyrics","Released May 12, 2000
Featuring

    
      Beginner, Der Tobi, Der Tobi & das Bo & 2 more
Producers

    
      André Luth & Fettes Brot
Copyright ©

    
      Intercord Ton GmbH & Yo Mama’s Recording
Distribution

    
      Indigo Musikproduktion + Vertrieb GmbH & Intercord Ton GmbH
Label

    
      Yo Mama’s Recording"
"10","Fettes Brot","Hausmänner & Liebhaber","Fettes brot fur die welt","Männer – ob blond, ob braun, ob Henna
Egal, ob du ein Manager bist oder ein Penner
Es fehlt an Vertrauen zwischen uns und den Frauen
Dort gibt es einen Bruch aber keinen Hauptnenner
Mancher Mann sagt wenn er eine Frau sieht am Steuer
Das sei ihm nicht geheuer und werde sicher teuer
Doch da ist auch die Frau, die ihr Vorurteil pflegt
Daß ich ein Macho bin, der sein Hirn in der Hose trägt
Gleichberechtigung heißt nicht gleich Berechtigung zur Ermächtigung
Ich find' die sind gar nicht so schlecht, die Jungen
Wie's dir vielleicht erscheint, ich hab auch schon mal geweint
Ich bin den Freund und nicht dein Feind, doch viele meinen
Ein Mann sei ein Softie, wenn er ebensolchen nimmt
Weil ihn etwas traurig stimmt
Erklimmt ein Mann nicht die Leiter der Karriere
Das wäre eine schwere Schwächung seiner Ehre
Muck auf und spuck auf den gesellschaftlichen Druck
Wenn du willst, dann bleib zuhause, wie die Stubenfliege Puck
Bis zum Alltag gehört, daß auch ein Mann schwanger wird
Und eh man's kapiert ist man emanzipiert als Mann – als ganzer Mann
Ich bin ein Mann – ein ganzer Mann
Bin ich ein Mann? – ein ganzer Mann
Ich bin ein Mann – ein ganzer Mann

Mann und Frau, Frau und Mann, so viele ungeklärte Fragen
Oh mann wo fang ich an?
Okay, ein Unterschied zwischen Er und Sie
Ist deutlich zu erkennen in der Anantomie
Doch darüberhinaus ist es schwer auszumachen
Was sind Gerüchte und was sind Tatsachen
Zum Beispiel wird mir immer wieder gerne erzählt
Daß Frauen sensibler sind, weil Männern der Sinn dazu fehlt
Männer sind sexbesessen, Frauen weit davon entfernt
Mh mh, Leute, ich hab's anders kennengelernt
Auch, daß man als Mann logischer denkt, kann ich nicht glauben
Weil bei Logik sich mein Hirn aushängt
Auch andere Klischees treffen oft nicht zu
Doch trotzdem läßt mir dieses Thema keine Ruh
Manchmal überlege, wie ist es denn jetzt eigentlich?
Ist es alles Lüge oder worin unterscheid' ich mich?
Sind wir wirklich gleich oder grundverschieden
Verschiedene Gefühle oder gleich im Lieben?
Ich kann es euch nicht sagen, doch wenn es jemand kann
Sag es mir, denn ich bin König Boris
Und ein ganzer Mann – ein ganzer Mann
Ich bin ein Mann – ein ganzer Mann
Bin ich ein Mann? – ein ganzer Mann
Ich bin ein Mann – ein ganzer Mann

Ich bin ein Mann, keine Frau und kein Eunuch
Ich hab es mir nicht ausgesucht und manchmal hab ich es verflucht
Wenn ich das Bild der Männer hierzulande anseh
Dann kann ich es kaum glauben, so tut es mir dann weh
Ne, oh weh, in welchem Licht ich da steh dazu gehör ich nicht
Passe nicht in dies Klischee
Ständig männlich immer voll den harten
Und dann gibt es auch noch Frauen die eben das erwarten
Ich bin kein Schnurrbartrtäger, Besserwisser
Autopfleger, Imstehenpisser
Kein Krawattenumbinder, Messerzücker, Kinderschänder, Oberunterdrücker
Ich kann sie auch nicht hören, die Machosprüche
Frauen an den Herd und zurück in die Küche
Denn betrachtest du die Sache einmal ganz genau
Ist im Restaurant der Chefkoch keine Frau
Mann und Macho sind zwei verschiedene Paar Schuhe
Es geht mir auf den Nerv dieses Image Getue
Eins kann ich euch sagen, wenn man Mann und Frau vergleicht
Man hat's vielleicht nicht schwerer
Doch als Mann hat man's nicht leicht
Ich bin ein Mann – ein ganzer Mann
Ich bin ein Mann – ein ganzer Mann
Bin ich ein Mann? – ein ganzer Mann
Ich bin ein Mann – ein ganzer Mann","https://genius.com/Fettes-brot-hausmanner-and-liebhaber-lyrics","Released May 12, 2000
Featuring

    
      Beginner, Der Tobi, Der Tobi & das Bo & 2 more
Producers

    
      André Luth & Fettes Brot
Copyright ©

    
      Intercord Ton GmbH & Yo Mama’s Recording
Distribution

    
      Indigo Musikproduktion + Vertrieb GmbH & Intercord Ton GmbH
Label

    
      Yo Mama’s Recording"
"11","Fettes Brot","Drogen","Fettes brot fur die welt","Interviewer: Ähh, wann haben Sie das letze mal Drogen konsumiert?
FB: Drogen? Gestern Abend
Interviewer: Und das waren: welche?
FB: Ja, das waren welche
Interviewer: (Lacht) Okay, gut, vielen Dank","https://genius.com/Fettes-brot-drogen-lyrics","Released May 12, 2000
Featuring

    
      Beginner, Der Tobi, Der Tobi & das Bo & 2 more
Producers

    
      André Luth & Fettes Brot
Copyright ©

    
      Intercord Ton GmbH & Yo Mama’s Recording
Distribution

    
      Indigo Musikproduktion + Vertrieb GmbH & Intercord Ton GmbH
Label

    
      Yo Mama’s Recording"
"12","Fettes Brot","Dusch dich mal","Fettes brot fur die welt","Hallo, hallo, hallo Leude
Hört mal zu, hier kommt ein neuer Song
Von Schiffmeister vom Fetten Brot
Ein Song der sich gewaschen hat
Es geht ums Duschen
Direkt unter eure Achselhöhlen

(Wasser ist zum Waschen daFalleri und fallera)

Neulich traf ich meinen KumpelMatula
Ich ging so auf der Straße
Ich sag: ""Hallo""
Doch irgendwas biss mir ganz tierisch in die Nase
Es beißt und kratzt mir in den Augen
Das ist wirklich kaum zu glauben
Ich fange an zu röcheln, husten
Fange an zu schnauben
Du hast so 'ne rießengroße Nase
Mitten im Gesicht
Du stinkst Matula
Riechst du das denn nicht?
Und deshalb dusch dich mal!
Dusch dich mal
Dusch dich mal
Bitte, bitte, dusch dich mal

Später abends war ich auf ner Party von nem guten Freund von mir
Völlig besoffen betret ich den Raum
Doch Moment, was riecht das hier?
In der Mitte seh ich sitzten
Doktor Renz, der ist am Schwitzen
Keine Chanze abzuhauen, wegzulaufen, wegzuflitzen
Er steht auf und kommt mir entgegen
""Hi, Schiffi"", fängt er an zu reden
Doch mir ist schlecht, mir ist übel
Ich muss mich übergeben
Und deshalb dusch dich mal!
Dusch dich mal
Dusch dich mal
Dusch dich mal

Nächsten Morgen wach ich mit nem Kater auf
Und komm kaum aus dem Bett
Die Party gestern abend war wirklich deftig, prall, laut, fett
Doch ich muss hoch aus den Federn
Denn ich hab mit Boris noch ein Date
'Ne halbe Stunde steh ich da
Doch Boris kommt zu spät
Endlich seh ich ihn dann in der Ferne
Er kommt schnell angerannt
Von weitem schon zu riechen
Ein schweißtriefender Gestank
""Hey König Boris, du stinkst.""
""Hey Schiffi, ich bin Punk.""
Alles klar, dusch dich mal!
Dusch dich mal
Genau, dusch dich mal
Dusch dich mal
Dusch dich mal

In der Innenstadt endlich angekommen
Doch was seh ich da
Karlstadt Grabbeltisch, Göttmann Chaoskommisar
Doch wie wars auch anders zu erwarten
Hier traf mich dann auch bald
Ein Zug vom Geruch und mir wurde heiß und kalt
Vom ganzen Hin- und Hergerenne
Da wird eim richtig warm
Ich sag, das ist leicht zu erkennen
An dem Schweissfelck unterm Arm
Und deshalb dusch dich mal!
Bitte, dusch dich mal
Genau, geh duschen
Dusch dich mal

Und wenn du immer noch nicht kapiert hast
Wovon der Kerl am Micro singt
Es geht hier um das Thema
Dass das ganze Fette Brot stinkt
Wie ein Iltis in der Wildnis
Oder ein Gouda nach drei Wochen
Es ist nicht zu beschreiben
Wie die Typen damals rochen
Ich sag, vom ganzen Reime reißen
Ist mir schon ganz heiß
Hey Jungs, wisst ihr was
Ich glaub ich riech nach Schweiß
Und deshalb dusch ich mal
Dusch ich mal
Genau, ich geh jetzt duschen
Dusch mich mal
Ich gehe duschen
Komm in die Puschen
Ich mach jetzt Pause
Geh unter die Brause
Das war der Gesang
Über den Gestank
Oh, Oh","https://genius.com/Fettes-brot-dusch-dich-mal-lyrics","Released May 12, 2000
Featuring

    
      Beginner, Der Tobi, Der Tobi & das Bo & 2 more
Producers

    
      André Luth & Fettes Brot
Copyright ©

    
      Intercord Ton GmbH & Yo Mama’s Recording
Distribution

    
      Indigo Musikproduktion + Vertrieb GmbH & Intercord Ton GmbH
Label

    
      Yo Mama’s Recording"
"13","Fettes Brot","Schade Schokolade","Fettes brot fur die welt","Guten Abend, wir sind Fettes Brot
Direkt aus Hamburg von der Waterkant
Und wir rocken jedes Haus durchs ganze Land!
- so stand ich wieder auf der Bühne
Bin der Zwerg und nicht der Hüne
Bin der HipHobbit mit dem Tophit - stop it!
Denn irgendetwas stimmt nicht
Irgendwer ergrimmt sich
Und die Party war versaut - Oh, schade!
Es ist beim Breaker der Notarzt
Und beim Maler die Soko, schade Schokolade, dass der Harte
Gerade bei unserm Auftritt im Laufschritt wie Aufschnitt
Zum Brot kommt und prompt
Drängelt sich der Schnomp in die erste Reihe
Geschreie - Ah! - ich prophezeie:
Die paar Miesmacher bringen hier die Stimmung in den Keller
Und schneller als gedacht
Ham sie meine Prophezeiung auch zur Wirklichkeit gemacht
Ich sag, das war ein Fehltritt, dieser Ausritt
Doch der Schnomp zahlt ja den Eintritt, wenn er eintritt
Und so sichert er mein Einkommen und auch meinen Shit
Vor denen und deren Geschwafel schütz ich mit ner Tafel
Schade Schokolade
Schade Schokolade

Samstag Nacht und ich trage mein' Körper aufn Fest
Nette Leute, gute Musik, sozusagen allerbestens
Bis das Gesicht auftaucht, das Bände spricht
Das gern Arme, Beine, Hälse und auch Hände bricht
Ich denk: Scheiße, was will denn hier das Sackgesicht?
Ach, vergiss es Boris, der interessiert dich nicht
Einfach nicht beachten, dann lässt er dich in Ruh
Und prompt kommt der Schnomp direkt auf dich zu
""ey, du Wichser, du Wanderpokal, du Wurstmischer! Komm sofort her, du redest schlecht über mich und meine Freundin!""
""Nee, tu ich nicht!"" ""Natürlich tust du das!"" ""Nee, wirklich nicht!""
Schon fliegt die Faust in mein Gesicht
Uh ah uh! - Er probiert neue Tricks
In den Magen geschlagen, ins Gesicht
Ein paar Kicks sieht geschmeidig aus, so wie Bruce Lee
Drehung links, ins Gesicht das Knie
Aua, aua, aua - Aufhören, es tut weh!
Und der Typ hört auch auf als ich zu Boden geh
Er war nicht größer als ich und auch nicht stärker - nein
Doch die waren zu dritt und ich war allein. ""Wie gemein!""
Denk ich mir, mach meine Nase wieder grade
Denk ""Der Typ hat nichts verstanden:
Schade Schokolade!""
Schade Schokolade

Eine schneeweiße Villa in stiller Umgebung
Am großen Fluss, auf einer sanften Erhebung
Hier lebt unser Held wie im Paradies
Und feiert Partys vom Geld seines Vatis
Gratis gab's zum Abitur den Zweitgolf
Zweifelsohne: Sohnemann ist 'n Leitwolf
Vati führt seine Firma mit fester Hand
Und hat 'n Restaurant in Westerland
Für mich begann der Stress dann gestern
Ich flirte auf nem Fest mit einer seiner Schwestern
Prompt kommt der Schnomp - Silencium!
Denn er rennt rum, als sei er das Zentrum des Universums
Renz, besser du verstummst
Denn da steht er: Aufgebläht, als hätt' er Mumps
Rums, bums! Er wollt mir gleich eine klatschen
""hey, soll ein Proll dein Fräulein voll quatschen?""
Nun ja, ich nehm an, jemand wie er hatt's einfach nötig
Doch meinst du deshalb töte ich?
Er ist so'n Kerl der neben's Becken pinkelt
Und die Klofrau sieht nicht einen Pfennig Trinkgeld
Der Typ tötet mir auf den Nerv wie Karius und Baktus
Doch er kriegt keinen Kaktus
Obwohl er nichts merkt oder eben drum
Grade kriegt er ne schöne schade Schokolade
Schade Schokolade","https://genius.com/Fettes-brot-schade-schokolade-lyrics","Released May 12, 2000
Featuring

    
      Beginner, Der Tobi, Der Tobi & das Bo & 2 more
Producers

    
      André Luth & Fettes Brot
Copyright ©

    
      Intercord Ton GmbH & Yo Mama’s Recording
Distribution

    
      Indigo Musikproduktion + Vertrieb GmbH & Intercord Ton GmbH
Label

    
      Yo Mama’s Recording"
"14","Fettes Brot","Das Lied vom Ende","Fettes brot fur die welt","Niemand ist gern allein
Wird mir langsam klar
Sie küsst grad irgendein Schwein im Laternenschein
Und ich schlaf vor Fernseher ein – nein!
Ich hatte mich alles andere als munter gefühlt
Deshalb wohl den Kummer hinuntergespült mit Alkohol
Bin wider Erwarten wieder erwacht in der Nacht
Muss mal unbedingt dringend wo hin:
Im Magen tobt ne Schlacht
Ich raff's nicht, Alter
Torkel trunken durchs Dunkel
Im Ernst: Dies ist grade schlimmer als Kettenkarussell
Ich schaff es bis zum Lichtschalter, seh viele funkelnde Punkte
Und dann? – Wird nicht das Badezimmer, sondern das Treppenhaus hell!
Ausgesperrt im Pyjama und draußen liegt Schnee
Dieses menschliche Drama spottet jedem Klischee
Ich brauch jetzt schnell ne Rasenfläche – das ist der Haken dabei
Denn ich leide leider an Blasenschwäche und muss kacken für Zwei!
Ganz allmählich erinnere mich: Schon immer und ewig
Gibt's ne Baustelle an der Hauptstraße, aufm Gehweg
Steht'n ganz famoses Dixi-Klo
Kein allzu großes Risiko
Also – ich bin drin, hock mich hin
Doch plötzlich bebt der Boden, es wackeln die Wände
Ich glaub ich spinn, ich werd nach oben hochgehoben
Diese Idioten hören mich nicht, obwohl ich brüll in einer Tour:
""Seit ihr Kidnapper oder nur die verdammte Müllabfuhr?!""
Unvorstellbar, was ich selber seh:
Sie laden mich auf nen LKW
Leise fällt der Schnee
Und traurig sage ich der Welt ""ade""
Wir halten an, dann geschieht das Ungeheuere:
Sie schmeißen mich mitsamt der Scheiße in ein Becken voller Säure

Ich frag mich, warum war ich fünf Minuten vor meim Wecker wach?
Mein Schlaf heut Nacht so flach
Denke scharf nach und dann... ach, da war was!
Ja, irgendwas war da:
Es hatte was zu tun mitWarns, Lauterbach und Schrader
Es geht um diese Band mit Talent
Auf diesem Riesen Event
Uns lieben die Fans
Doch ich pie mir ins Hemd
Das ist mir fremd
Weil man mich als MC so nicht kennt
Denn wenn diese Band brennt
Bin ich eigentlich nicht so gehemmt
Mann, was ist bloß los? Wo ist mein Kampfgeist?
Im Hals 'n riesen Kloß, auf der Stirn der Angstschweiß
Dabei rockten wir Shows von Österreich bis vor die Tore Frankreichs
Jedes Land weiß, unser Scheiß ist brandheiß!
Doch ich steh auf der Bühne, mir tut alles weh:
Kopf, Brust und Bandscheiben
Und ich sag ""Leute, ich geh und lass mich krankschreiben
Aber nein, das war ein Scherz!"", hörte ich mich noch sagen
Spürte ein' Schmerz und mein Herz das letzte mal schlagen
Und jetzt lieg ich auf der Bühne zusammengebrochen
Und denke ""Scheiße, die drehen durch, der Saal ist am Kochen!
Verdammt! Ausgerechnet heute geh ich über den Jordan
Doch lächelnd, weil die Leute ne Zugabe fordern.""
Denn dass ich wirklich liegen bleib, da hat keiner dran geglaubt
""Steh auf jetzt!"", werd ich von der Seite angepflaumt
Doch ich bin schon sehr weit oben und hör nen andern Sound
Und schicke letzte Grüße an den Underground

Wie so oft am Morgen
Muss ich mir mein Frühstück erst besorgen
Denn in meinem Kühlschrank herrscht wieder einmal gähnende Leere
Doch muss ich vorher schnell zur Bank geh'n
Mir Geld aus der Wand nehm'
Und das liegt zum Glück gleich auf dem Weg, was zu erwähnen wäre
Steh so zehn Minuten später in der Bank am Automaten
Dreimal darfst du raten: Natürlich muss ich warten
Da erkenne ich mein' Nebenmann – aha – der Typ heißt Hinnerk
Ist 'n bisschen spinnert schon sein ganzes Leben lang
Er geht mit einer jungen Dame Arm in Arm zu dem Kassierer
Was wohl passiert war?
Warum geh'n die schönsten Frauen mit dem Verlierer?
Auf leeren Magen und schweren Herzens
Sag ich ""Du bist immer noch der Alte, Jan Hinnerk Mertens!""
Er dreht sich um, reißt die Augen auf
Ich hab ihn nur verlegen angegrinst
Er brüllt: ""Scheiße, du Spinner, sieh zu, dass du jetzt Land gewinnst!
Halt im eigenen Interesse deine Fresse, sonst passiert was!""
Und alle die uns anstarren, seit ich ankam, interessiert das
Wollt nur ein bisschen Smalltalk
Er ist geladen wie 'n 9-Volt-Block
Und faltet mich jetzt fachgerecht zusammen wie 'n Zollstock
Was soll der Streit?
Er schmeißt die Frau zu Boden, ich merk sofort:
Ich bin zur falschen Zeit am falschen Ort
Er schreit: ""Ich lass mir durch dich Labersack nicht meine Tour vermasseln!
Ich bin ein Mann der Taten, keiner, der nur quasselt!""
Und das Letzte, was ich hörte, war ein Schuss
Dann war Schluss","https://genius.com/Fettes-brot-das-lied-vom-ende-lyrics","Released May 12, 2000
Featuring

    
      Beginner, Der Tobi, Der Tobi & das Bo & 2 more
Producers

    
      André Luth & Fettes Brot
Copyright ©

    
      Intercord Ton GmbH & Yo Mama’s Recording
Distribution

    
      Indigo Musikproduktion + Vertrieb GmbH & Intercord Ton GmbH
Label

    
      Yo Mama’s Recording"
"15","Fettes Brot","“Die da” hat mir gut gefallen","Fettes brot fur die welt","- Alter dich muss ich jetzt nochmal fragen. Dich muss ich jetzt nochmal fragen: Bist du ein echter Fettes Brot Fan so?

- Absolut

- Echt?

- Ja

- Hast du denn auch die älteren Platten von uns? Und gibt's da einen Song, B-Seite oder Remix, der dir besonders gut gefallen hat, den du gerne wieder hören möchtest?

- Die Da

- Ähm ok, das lässt sich einrichten","https://genius.com/Fettes-brot-die-da-hat-mir-gut-gefallen-lyrics","Released May 12, 2000
Featuring

    
      Beginner, Der Tobi, Der Tobi & das Bo & 2 more
Producers

    
      André Luth & Fettes Brot
Copyright ©

    
      Intercord Ton GmbH & Yo Mama’s Recording
Distribution

    
      Indigo Musikproduktion + Vertrieb GmbH & Intercord Ton GmbH
Label

    
      Yo Mama’s Recording"
"16","Fettes Brot","Smudos Traffic Beatbox Jam","Fettes brot fur die welt","Stehen im Stau wieder alle Räder still
Weiß ich genau, was jeder will – whowhowhow
Smudeo Soundsystem geht ab
Ich lache über Lauterbach und tanze auf dem Autodach
Und singe nur für mich – yeah yeah yeah
Smudeo Soundsystem geht ab

Nix geht mehr im Stau auf der Autobahn
Nur hier oben geht was, Frau und Mann, schaut uns an
Reißt die Boxen auf und dann seid dabei
Über den Wolken wie Reinhard Mey
Mit Haut und Haaren gegen den Einheitsbrei
Aaaaight, wir sind der letzte Schrei
Die Langeweile ist jetzt vorbei
Schluss mit der dummen Rumsitzerei
Ihr habt alle hitzefrei
Wenn ihr sonst ins Büro fahrt, hört ihr Mozart
Leute, heute ist Smudeo-Tag in euerm Go-Kart
Denn alle waltons so, auch Jim-Bob und John-Boy
Wir treiben Schabernack wie Rubberduck im Convoy
Wir sehen, ihr seid Gott sei Dank bereit
Jenseits der Leitplanke herrscht der blanke Neid
Jenseits der Leitplanke herrscht der blanke Neid
Verstehste? Ist auch die nächste Tanke weit

Stehen im Stau wieder alle Räder still
Weiß ich genau, was jeder will – whowhowhow
Smudeo Soundsystem geht ab
Ich lache über Lauterbach und tanze auf dem Autodach
Und singe nur für mich – yeah yeah yeah
Smudeo Soundsystem geht ab

Auf dem Highway ist die Hölle los – Verkehrsinfarkt
Doch dieser Beat bleibt frisch wie am ersten Tag
Wir schmieren Pausenbrote, ihr sterbt tausend Tode
In der Hitze sitzen bleiben ist schon lange aus der Mode
Kommt alle raus aus euern PKW
Party aufm Mittelstreifen, Jippjeijehjeh
Okay, das Ambiente ist grausam
Die Getränke sind lauwarm
Wenn wir Spiegeleier auf der Motorhaube brutzeln
Schlagen selbst Biker Wurzeln
Lassen den Sturzhelm purzeln
Auf Ultrakurzwellen ist diese Blechlawine Schwerpunkt
Es steigt die Stimmung in der Sprecherkabine vom Verkehrsfunk
Wir denken grade, is ja ne geile Parade
""Hey, der Stau löst sich auf!"", meint Hans-Jürgen aus Stade
Oh, wie schade! Nur noch zwei Kilometer
Bis zur nächsten Four-Track Jam
See you later!

Stehen im Stau wieder alle Räder still
Weiß ich genau, was jeder will – whowhowhow
Smudeo Soundsystem geht ab
Ich lache über Lauterbach und tanze auf dem Autodach
Und singe nur für mich – yeah yeah yeah
Smudeo Soundsystem geht ab","https://genius.com/Fettes-brot-smudos-traffic-beatbox-jam-lyrics","Released May 12, 2000
Featuring

    
      Beginner, Der Tobi, Der Tobi & das Bo & 2 more
Producers

    
      André Luth & Fettes Brot
Copyright ©

    
      Intercord Ton GmbH & Yo Mama’s Recording
Distribution

    
      Indigo Musikproduktion + Vertrieb GmbH & Intercord Ton GmbH
Label

    
      Yo Mama’s Recording"
"17","Fettes Brot","Von Hamburg nach Haiti","Fettes brot fur die welt","","https://genius.com/Fettes-brot-von-hamburg-nach-haiti-lyrics","Released May 12, 2000
Featuring

    
      Beginner, Der Tobi, Der Tobi & das Bo & 2 more
Producers

    
      André Luth & Fettes Brot
Copyright ©

    
      Intercord Ton GmbH & Yo Mama’s Recording
Distribution

    
      Indigo Musikproduktion + Vertrieb GmbH & Intercord Ton GmbH
Label

    
      Yo Mama’s Recording"
"18","Fettes Brot","Lua spricht","Fettes brot fur die welt","Hi, this is Lua, Iwould.. and I would like to hear
Rock Mic's Remix","https://genius.com/Fettes-brot-lua-spricht-lyrics","Released May 12, 2000
Featuring

    
      Beginner, Der Tobi, Der Tobi & das Bo & 2 more
Producers

    
      André Luth & Fettes Brot
Copyright ©

    
      Intercord Ton GmbH & Yo Mama’s Recording
Distribution

    
      Indigo Musikproduktion + Vertrieb GmbH & Intercord Ton GmbH
Label

    
      Yo Mama’s Recording"
