"","artist","title","album","text","url","metadata"
"1","Eko Fresh","König von Deutschland - Part II","Best of freetracks volume 4","Aha, yeah...Eko Fresh... König von Deutschland

[Verse I]
Deutschland sucht keinen, wir warten auf die zweite Staffel
Ich bin jetzt ein Star, aber da ist eine Sache
Irgendwann geht vielleicht gar nichts mehr klar
Und man buht mich aus wie Daniel K
Locker bleiben! Halt von mir was du hältst
Ich melde mich bei Popstars - Das Duell
Wenn du sie siehst, sag Lumidee
Ich will einen Hit und nehme auch so zu wie sie
Richtig, denn die No Angels haben sich getrennt
Ich find's zum wegschießen, wie 50 Cent
Und, ich mache jetzt mein Ding wie Jess
Sing und rap, geh hin und check' mein Album im Geschäft
King in Deutschland, man hat mich mal so genannt
Seh mich heut an, ich steh in der BRAVO und Yam!
Eko Fresh. Keiner von euch braucht wieder rappen
Willst du mich sehen, kannst du auch auf VIVA zappen

[Hook]
Deutschland, gewöhne dich neu dran, denn ich bin euer König von Heut an
Ich hab' euch keinen Scheiß erzählt, wenn ihr wollt nennt mich eure Majestät
Deutschland, gewöhne dich neu dran, denn ich bin euer König von Heut an
Ich hielte es wirklich 100 Pro ein, wenn du willst, nenn' mich königliche Hoheit

[Verse II]
Kleider machen Leute, zumindest war das so bis heute
Wir ziehen uns aus und verziehen uns auf irgendeinen FKK Strand
Wenn du davon ausgehst, dass du ein Star wirst
Kannst du rausgehen - Bewirb dich bei Star Search
Da ist kein Rapper im Showbiz, der...
Sich anzieht, als ob er bei Bro'Sis wär
Oh! Wo ist die Indira nur hin?
Außer mir, findet es niemand so schlimm
Ich bin jetzt zurück, wie Jasmin Wagner
Find jetzt mein Glück und mach die Charts klar
Ich war Fresh und hatte's im Gefühl
Ich bin wie Alex, ein Gewinner-Typ
Die meisten von euch, ich kenn' wie sie rappen
Willst du mich sehen, musst du nur auf MTV zappen

[Hook]

[Bridge]
Irgendwie bin ich, der King von Deutschland. Sag nicht, hätte es nicht prophezeit
Mein Album ist langsam auch mal fertig, es wird was ganz großes sein
Irgendwie bin ich jedoch der König und sag nicht ich hätte es nicht erzählt
Glaubt nicht das außer meinem Album, auf Deutsch hier noch was geht!

[Hook]","https://genius.com/Eko-fresh-konig-von-deutschland-part-ii-lyrics","Released 2020
Primary Artists

    
      Bushido, Capkekz, Eko Fresh & 3 more
Featuring

    
      Capkekz, Eko Fresh, Farid Bang & 6 more
Producers

    
      Bushido, Kingsize, Prodycem & 1 more
Writers

    
      Azra, Bushido, Capkekz & 9 more
Additional Voice

    
      Redman"
"2","Eko Fresh","Joe","Best of freetracks volume 4","[Intro: Redman]
Ey yo, listen man. When i'm over here in germany, ya know i'm sayin'. if y'all ain't bumpin' any of y'all shit, you gotta be pumpin' my man Eko Fresh. Eko Fresh is in the fucking house, we might have to do a record together, to let y'all niggas know how we get down, 'cause it's heavy over here! And we're gonna do some heavy for the german fans and for the us fans. So you know what, Eko Fresh, my nigga, you already know what it is. He's already certified by Red and Meth, so y'all motherfuckers get him lovе, 'cause he rides with us and wе ride with him. That's what it is, niggas

[Verse 1]
Check mich ab, 2003 hieß es Joe oder 50
Ohne anzugeben, sag ich euch, der Bora war busy
Und die Pläne des Idioten
Sollten sich mit meinen kreuzen, er wurde mir von BMG angeboten
Da hatte er einen kleinen Hit, er hieß ""Pump it up""
16.000 war der Preis und ich hab es dann gemacht
Damals ging es nicht um Geld
Es ging darum die Welt zu übernehmen und mich selbst zu entertainen
Hatte Bock ein Video zu drehen, es waren 40.000
Für so ein Budget würdest du bei Männern über 40 saugen
Joe, und mir noch 'nen Cheeseburger geben
German Dream für mein Leben
Du wirst nicht geliebt von der Szene
Du kannst Europa nicht verarschen
Alter, alle wissen hier, du bist der brokeste in den Staaten
Ich sag's in deiner Sprache, damit du Homo es raffst
Whole Germany thinks that Joe Budden sucks

[Hook]
Ich trage jeden Tag ein new Jersey
Und da ist ein MC den ich ficke
Er kommt mitten aus New Jersey
Willst du mich verarschen? Ich lass mich nicht verarschen
Mach dir doch nichts vor. Jeder hasst dich in den Staaten
Merk dir eins, das kann man nicht mit Eko tun
Meine EP fickt dein' ""Padded Room""
Vielleicht ging es Eko Fresh nicht so gut
Doch egal, Bud', ich hab trotzdem mehr Cash als du

[Verse 2]
Was ist los, Joe, denkst du, dass du was besseres bist?
Warum antwortest du sonst auf meine Messages nicht
Es tut mir Leid. Du wurdest von Def Jam gedropped
Machst auf Conscious Rapper, jetzt von Ekrem gepoppt
Komm nach Deutschland, ich zeig dir 1-2 Verbrecher
Ich sag Ransom ist besser. Saigon ist besser
Und Slaughterhouse ist nur eine gefickte Crew
Bitch, guck auf YouTube, ich hab' mehr Clicks als du
Du bist nicht Joe Budden, du bist Jim Knopf
Ich hab auch nicht mehr so viel, aber jeder weiß, ich bring's noch
Wer gibt dir heute 16.000 für 'nen Part?
Du willst nicht mit mir zu tun haben, leck mich am Arsch
Hast du meine Kohle gut durchgebracht
Ich verkaufe auch Features, aber ich bin tausend mal realer
Denn hinterher ignoriere ich die Leute nicht
Vielleicht sind es morgen sie, aber heute ich

[Hook]

[Verse 3]
Joe Budden. J.R. hat dich gefickt. Game hat dich gefickt
Es wird höchste Zeit, dass EK dich noch fickt
Yeah, schieb dir deine Props in der Backspin sonst wo hin
Du bist nur 'ne Fotze die Cash nimmt
Damals warst du cool auf den Clue Tapes
Wer konnte wissen, dass du als Inbegriff für schwul stehst
Mit dem mach ich keinen Joint an. Wofür?
Komm nach Kölle, kriegst auf's Maul, wie dein Freund an der Tür

[Hook]

[Outro]
Yeah! Was geht ab, man? Das geschieht, wenn man sich für was besseres hält, Pisser. Wat denkst du wer du bist, junge, Joe Pesci oder was. Never say no, Joe
And by the way, to all americans, the name of our car is not ""Mayback"" - it's MAYBACH, Junge. MAYBACH. German, deutsche Ruger[?], Junge. Mercedes Benz. MERCEDES. MAYBACH, Junge. So sieht es nämlich aus. Eko Freezy, ich bin draußen. Ich ficke jeden, ist egal von wo er kommt. New Jersey, jeden Tag trage ich ein new Jersey. Joe Budden, du bist zu dirty. Motherfucker","https://genius.com/Eko-fresh-joe-lyrics","Released 2020
Primary Artists

    
      Bushido, Capkekz, Eko Fresh & 3 more
Featuring

    
      Capkekz, Eko Fresh, Farid Bang & 6 more
Producers

    
      Bushido, Kingsize, Prodycem & 1 more
Writers

    
      Azra, Bushido, Capkekz & 9 more
Additional Voice

    
      Redman"
"3","Eko Fresh","Mein Block (Remix)","Best of freetracks volume 4","[Verse I]
Du mit deinem Underground-Sound lachst mich aus
Weil du denkst, du kommst irgendwann groß raus
In meinem Block stehen viele Termine
Wie willst du dein Geld mit Realness verdienen?
Ich stehe auf, um 6, 7 oder 8
Geh ins Studio und mache ein paar Tracks, 7 oder 8
Jeden Tag höre ich einen Diss von irgendwelchen deutschen Kids
Nur so kriegen sie ein etwas Liebe und sie freuen sich!
Mein Block hat mehr Seiten als die Bibel
Hättest du so viel zu tun, du würdest wein' wie beim schneiden einer Zwiebel
Auf Seite 2 steht die Nummer von Thomas Stein
Leih dir einen Anzug und ich lad dich in die Oper ein
Ich engagierte dafür extra ein Schreiber
Und kaufte einen extra Block für die Geschäfte mit Staiger
Verkaufe an die Streets und verkaufe an die Teenies
Und zwinker mit den Augen wie die bezaubernde Jeannie

[Hook]
Meine Arbeit, mein Geld, mein Label
Mein Stress, die Verträge, die Finanzen
Mein Block!
Meine Lyrics, meine Pläne, die Ideen
Die Notizen. Kennt ausser mein Block nur Gott
Meine Arbeit, mein Geld, mein Label
Mein Stress, die Verträge, die Finanzen
Mein Block!
Meine Lyrics, meine Pläne, die Ideen
Die Notizen. Kennt ausser mein Block nur Gott

[Verse II]
Die Seite mit den Rapper-nummern hab ich heute rausgerissen
Ihr wollt jetzt nicht mehr mit mir arbeiten, doch drauf geschissen
An euch Oberclowns: Ihr kriegt alle kein Respekt vor mir!
Ich chille nur mit Akay von Overground
Mein Block, manchmal blätter ich nur rum, aus Scheiß
Was war das? Achja... Catterfeldt Nr.1!
In meinem Block ist kein Fehler!
Und ich schreibe Lyrics, aber rappen aus dem Kopf ist kein Thema!
Ruf an, wenn du irgendwelche Wörter suchst
In meinem Block hab ich alle neue Börsen-news
Im Algemeinen: Ich les Frankfurter-Allgemeine
Okay, Zieh die Punks ruhig auf deine Seite
Ich hab jetzt ein Label. Homie, keiner kannte mich!
In meinem Block steht: Bald bin ich 21!
Das ist Mönchengladbach
Eure Kackidole wollen alle erreichen was ich geschafft hab! (Eko Fresh!!)

[Hook]
Meine Arbeit, mein Geld, mein Label
Mein Stress, die Verträge, die Finanzen
Mein Block!
Meine Lyrics, meine Pläne, die Ideen
Die Notizen. Kennt ausser mein Block nur Gott
Meine Arbeit, mein Geld, mein Label
Mein Stress, die Verträge, die Finanzen
Mein Block!
Meine Lyrics, meine Pläne, die Ideen
Die Notizen. Kennt ausser mein Block nur Gott

[Verse III]
Ihr seid gegen mich, doch ich schreib eben Hits
Mich zu dissen ändert euer scheiß Leben nicht
Ich bin ein Prominenter, ähnlich wie Tony Dancer
Habe schon so oft die Nummer meines Phones geändert
Haltet eure Schnauze denn ich hab es ausgerechnet
Für mich kann es besser gar nicht laufen!
Manche Rapper machen Doppel-Alben wegen mir
Doch sie können sich nicht eine Woche halten neben mir
Nenn mich König oder Vater!
Ob Ernährung oder Style: Ich hab einen persönlichen Berater!
Oh Backe!! Ihr seid alle so Kacke!
In meinem Block stehts noch drin: Mit Joe Budden
Kack drauf was du rauchst!
Homie ich bin Eko Fresh! Ich smoke mit Yukmouth und Dru Down
Es steht in meinem Block: Ich mach jetz Pinke Pinke
Also Kiss tha Game, goodbye und dann Winke Winke

[Hook]
Meine Arbeit, mein Geld, mein Label
Mein Stress, die Verträge, die Finanzen
Mein Block!
Meine Lyrics, meine Pläne, die Ideen
Die Notizen. Kennt ausser mein Block nur Gott
Meine Arbeit, mein Geld, mein Label
Mein Stress, die Verträge, die Finanzen
Mein Block!
Meine Lyrics, meine Pläne, die Ideen
Die Notizen. Kennt ausser mein Block nur Gott

[Outro]
Yeah. Jetzt könnt ihr euch entscheiden
Wer hat den härtesten Job in Deutschland, Alter
L.O.V.E. - Out Now!
Eko & Azra - Am 7.6
Summer Cem hat ein Deal!
Ramsi Aliani hat ein Deal!
German Dream, baby! Haha","https://genius.com/Eko-fresh-mein-block-remix-lyrics","Released 2020
Primary Artists

    
      Bushido, Capkekz, Eko Fresh & 3 more
Featuring

    
      Capkekz, Eko Fresh, Farid Bang & 6 more
Producers

    
      Bushido, Kingsize, Prodycem & 1 more
Writers

    
      Azra, Bushido, Capkekz & 9 more
Additional Voice

    
      Redman"
"4","Eko Fresh","Mach dich grade Fotze","Best of freetracks volume 4","[Intro: Sample]
""Dieses verdammte Schwein hat mein Leben kaputt gemacht. Versprich mir, dass du ihn findest und fertig machst! Mach ihn für immer kampfunfähig. Und lass ihn es spüren, ja, er soll es spüren!""""Ich verspreche [?]""

[Part 1: Summer Cem]
Du willst ein 1 gegen 1? Ich komm allein gegen 3
Das hier ist Haarlack, Nutte, und kein Heiligenschein
Komm, ich schreib dir die Single, ich werd von Weibern umzingelt
Und du wirst jetzt so zerquetscht wie ein eitriger Pickel
Ey yo, du bist korrekt und fährst in die Eifel zum Chillen
Deine Frau sucht einen Job und ich zeig ihr den Pimmel
Denn der Abend fängt mit Party an und endet im After
Bevor aus dir ein Star wird, ist Summer Cem bei der NASA
Ey yo, wart nicht, komm, besser flieh, weil du den Partner von Eko siehst
Und nicht den Moderator vom Wetterdienst
Du gestaltest deinen Tag nur mit Jeopardy!
Doch ich bin der Türke, der Gas in die Fresse schießt
Weil deine Frau traurig wie ein Dalmatiner guckt
Nehm ich sie mit und erfahr, dass sie wie ein Benziner schluckt
Deine Eltern wissen nicht, dass du meine Mucke hörst
Meine Eltern wissen nicht einmal, dass ich rappe, yeah

[Part 2: Farid Bang]
Es ist Drive-By, Crimetime, ich mach dich kalt mit ein' Stein
Fick auf die Schule, Hure, wer ist Albert Einstein
Und dein Label hat mehr Affen als die Steinzeit
Hör, wie dein Weib schreit, ich schieb mein drittes Bein rein
Du sitzt bei Vera am Mittag, du bist ein Streber, kein Ticker
Schaffst für 'nen Zehner am Strich an, hast 7 Väter, du Pisser
Sie reden Schwachsinn, weil sie alle schwach sind
30 Zentimeter, guck, ich hab ein Prachtding
Anabol macht mich breit wie mein Schwanz dein Arsch
Ek, Cem, Kay und F, wir sind wie Panzerglas
Du hast beim Kampf versagt, Dream ist ein harter Brocken
Ausbildung ist für mich wie für mein Vater Kochen
Du bist ein Crack-Kind, ja, ich habe Hero für dein Team
Deine Frau sieht aus als käm sie von 'ner Chemo-Therapie
Es ist Farid Bang, jetzt ist deine Nase gebrochen
Das ist Hartz IV, also mach dich grade, du Fotze

[Hook 2x: Kay One]
Mach dich grade, Fotze, du wolltest reden, doch solltest geh'n
Hartz IV, musst sich verkaufen, sonst fangen wir an, zu stehl'n
Mach dich grade, Fotze, Mann, wir bleiben das Evangelium
Und Eko schafft ein Imperium, ja, die Kings aus Cologne

[Part 3: Kay One]
Alle dummen Penner wollen so wie Kay sein, geh zu 'ner Gay-Line, alle meine Brüder wollen immer wieder Paytime
Ich gebe kein Fick, yo, Mann, und bleibe der Boss in meinem Block, Mann, auf Rap hat ja keiner mehr Bock
Zieh sie Gun, klick, klick, klick, klick, klick, meine Uhr, sie macht tick, tick, tick, tick
Bring seiner Mutter einen Fick, Fick, Fick, Fick, sie nimmt meinen Dick, Dick, Dick, Dick
Blitzlicht, alle Penner wollen so rhym'n, Showtime, Kay One
Ray Ban, Sixpack, Bodycheck, 100 Pro, Mann, ich bin wirklich so geil
Ich gebe keinen Fick auf alle Motherfucker, denn ich bleibe der Boss in diesem Rap-Geschäft
Kay One ist der King, mehr bring ich sowieso, denn ich rap für Cash
Ich ess den Kaviar, ich bin Halb-Spanier
Ich bin auf der Sonnenbank und fick mit Estefania
Das hier sind die Panzer-Raketen, du bist den Schwanz hier am Kneten
Kay One, ich werd nächstes Jahr als Kanzler antreten

[Part 4: Eko Fresh]
Mach dich grade, Fotze, du bist der Grund, warum ich grade kotze
Schau mir in die Augen, wenn ich dir in die Visage rotze
Denkt an uns, wenn bei eurer Clique nix geht
Weil du nix vom Business verstehst und du glaubst, dein Shit ist okay
Bitch, komm backstage, ich und Kay, wir ficken extrem
Dein Freund steht dumm in der Ecke so wie ein Fitnessgerät
Es hat keinen Zweck, klick jetzt deine Parts doch beiseite
Ich hab das Gefühl, heute wird dein Arschloch geweitet
Köln-Kalk und ich sterbe im Stützpunkt
Disse mich zum 12. Mal, herzlichen Glückwunsch
Ich hänge ab wie ein Koalabär im Dschungel
Du wirst von alten Männern zum Oralverkehr gezwungen
Yeah, du kannst die Konkurrenz seh'n aber welche?
Kommt und wir begraben sie im Gremberger Wäldchen
Ich bin ein Playboy, alle wollen Freezy küssen
Mich kennt jede Olle mit 'ner Satellitenschüssel
Jetzt holt der Junge Nikes heute bei Footlocker
Tritt dir in den Unterleib, jetzt ist deine Futt locker
Jetzt kommt ihr Fotzen an, ja, ich bin wie Rocky, Mann
Schau doch in den Spiegel, Pisser, du bist nur ein Ottifant
Deine Freundin mag Französisch total
Sie befriedigt jetzt den König oral - Das ist German Dream
Ihr müsst fall'n so wie Scheiße in 'nem Plumpsklo
Du kannst deine Jungs hol'n, ihr seid jetzt gebumst, woah

[Hook 2x: Kay One]
Mach dich grade, Fotze, du wolltest reden, doch solltest geh'n
Hartz IV, musst sich verkaufen, sonst fangen wir an, zu stehl'n
Mach dich grade, Fotze, Mann, wir bleiben das Evangelium
Und Eko schafft ein Imperium, ja, die Kings aus Cologne","https://genius.com/Eko-fresh-mach-dich-grade-fotze-lyrics","Released 2020
Primary Artists

    
      Bushido, Capkekz, Eko Fresh & 3 more
Featuring

    
      Capkekz, Eko Fresh, Farid Bang & 6 more
Producers

    
      Bushido, Kingsize, Prodycem & 1 more
Writers

    
      Azra, Bushido, Capkekz & 9 more
Additional Voice

    
      Redman"
"5","Bushido","Gegensätze ziehen sich an","Best of freetracks volume 4","[Hook: Bushido &Eko]
Bushido und E-K-O. Sag mir, wo sind all die Gegner bloß?
Das Game ist overGegensätze ziehen sich an
Sie glauben es nichtSie sehen jetzt, ihn und mich zusammen
Bushido und E-K-O. Sag mir, was ist mit den Hatern los?
Das Game ist overGegensätze ziehen sich an
Sie glauben es nichtSie sehen jetzt, ihn und mich zusammen

[Verse I: Eko]
Oh Shit
Ich seh mich in der Bravo, ich bin so schick, yeah
Eko Fresh, der Don ist back
Stimmt es, dass Optik dich rausgeschmissen hat? (Jaa)
Stimmt es, dein popiger Sound nix gerissen hat? (Nein)
Es ist ein schmaler Grad, zwischen Liebe und Hass
Ich hör dies oder dass, ich hätte bei Bushido verkackt
Der Albtraum wird wahr und ich weiß dass ihr ein Hals auf mich habt
Sonny Black auf meiner Seite, er ist bald auch ein Star
Was würd ich dafür geben jetzt eure Fressen zu sehen
Ihr könnt nix tun außer heulend zur Presse zu gehen
Dies hier geht raus an meine Schwestern und Brüder
Glaubt nicht was im Fernsehen kommt, all diese Rapper sind Lügner
Sie sind ab heute out, wir sind der deutsche Traum
Ihr habt nichts, was ihr habt ist nur ein feuchter Traum
Ihr seid keine Rap-Renner, ihr seid die Rap-Grandpa's
Ich und Bushido können jetzt das gesamte Business mit einem Track ändern

[Hook: Bushido &Eko]

[Verse II: Bushido]
Sie sagen: ""Danke, dass ihr so zu mir seid""
Es hat keinen Sinn, ich frag mich wozu ihr Mädchen noch weint
Und noch eins ""Ohh, wer ist der König von Deutschland?""
Du kannst nichts außer blöd in nem Golf fahren
Ohh, rate mal bei wem ich jetzt war
Ich kann behaupten, ich bin auch noch ohne Arte ein Star
Guck mal da, ahh, siehst du da den Typen da drüben?
Der Grund warum ich ihn nie traf ist, weil die Typen da lügen
Und jetzt, hör mir zu ich bin mit Eko gekommen
Ich will dass ihr alle wisst, ich bin ausm Ghetto gekommen
Ihr kennt diese Line (du musst üben)
Also brenn dir die Line, wenn dein Vorschuß dir nicht reicht
Kann ich dir mein Handy mal leihen
Ohh, nein, ich merke, dass ihr schlechter träumt
Nach all der Zeit kann ich sagen ""du warst kein echter Freund""
Doch ganz egal, ab heute mach ichs wieder für euch
Und wieder für euch, schreib ich die Lieder wieder auf deutsch, oh

[Hook: Bushido &Eko]

[Verse III:Eko& Bushido]
Eko Fresh, präg dir mein Gesicht ein, Typ
Jeder Andere, der behauptet dass er Hits hat, lügt
Was ist mit euren Plänen? Sie sind vernichtet und erldigt!
Ich lass Bushido wie einen Pitbull aus dem Käfig
Die Headz weinen: ""Wie kann das überhaupt passieren""
Weil er der Einzige mit Eiern ist, außer mir, also labert keinen
Scheiß mehr, wir haben keinen Streit mehr
German Dream ist jetzt die Nummer eins, yeah
Okay, Homie, ich wette zehn zu eins, das Game ist meins
Behalte deinen Szenescheiß
Geh, ich weiß, ihr wollt euch transformieren
Ich frag dich öffentlich: ""Was willst du Schwanz von mir?""
Leider sind deine Gerüchte kaum in Time, ihr kommt mir vor, wie
Senioren, die dann wie Frauen weinen (ich traue keinem)
Dafür kenn' ich zu viele von denen
Die danach sagen ich wär irgendwie ein Videogame, woo

[Hook: Bushido & Eko]","https://genius.com/Bushido-gegensatze-ziehen-sich-an-lyrics","Released 2020
Primary Artists

    
      Bushido, Capkekz, Eko Fresh & 3 more
Featuring

    
      Capkekz, Eko Fresh, Farid Bang & 6 more
Producers

    
      Bushido, Kingsize, Prodycem & 1 more
Writers

    
      Azra, Bushido, Capkekz & 9 more
Additional Voice

    
      Redman"
"6","Eko Fresh","Hartz 1","Best of freetracks volume 4","[Verse 1: Capkekz]
Meine Bombe ist am ticken, ich lasse den Schläfer raus
Wir vernichten euren Dreck, so damit es jeder glaubt
Wir holen die Säbel raus, weil ihr die Schläge braucht
German Dream, Hartz 4 - Alter, ich leb den Traum
Ich seh sie geben auf, wir haben sie weich gespült
Wir haben den Sieg in der Hand, während sie in Scheiße wühlen
Der Scheiß ist preisgekürt, mein Rap ist eisgekühlt
Schwarzkopf-Ehrenkodex - Ich bleib ein [?]
Jetzt wird es heiß und schwül, denn wir sind kampferprobt
In diesem Kriegsgebiet bin ich ein Bandensohn
Ich treib den Handel hoch, ihr habt meinen Schwanz im Po
Ich mach mein [?] und lad die Gun mit Schrot
Guck dein bester Mann ist tot, guck du wirst hier kalt geduscht
Guck wie dieser [Traum?] jetzt rappt, ich hab die Gewalt im Blut
Ich hör wenn die Straße ruft, für mich seid ihr alle schwul
Das ist für den Hansaring und alle meine Kalker Homies

[Hook: SDiddy]
Das hier geht unter die Haut
Ihr werdet von Hunden missbraucht
Wir drei haben uns einen Bunker gebaut
Hartz 4 schießt von ganz unten hinauf

Das hier geht über alles hinaus
Ihr habt beinahe alles versaut
Wir bauen jetzt alles neu auf
Hartz 4 kommt und alles ist aus

[Verse 2: SDiddy]
Hier kommt die reine Wahrheit, Gott führ meine Hand wenn ich schreibe
Brüder es wird Zeit dass ihr aufsteht und anfangt zu fighten
Viele haben keine Klarheit, keine Arbeit, auch wir haben lang gestruggelt
Doch jetzt wird zusammen [gemaggelt?]
Der Erfolg gibt uns Recht, alle kommen angewackelt
Hört auf zu Rappen, konzentriert euch auf ne andere Sache
Deine Frau wird angefackelt, wenn mein Homie Capkekz abwichst
Ich feiere hart, weil der arabische Freund am [?]
Wir tun was für dieses, wir tun es für den Erfolg
Wir machen etwas aus nichts und rücken Rap in ein besseres Licht
Wenn du Paras hast unterzugehen, komm an Land
Wir sagen dir was du zu tun hast wie ein Kommandant
Reich uns die Hand, auf einmal sind die Leute gespannt
Denn wir lassen keinen im Dunklen wie beleuchteter Gang
Das ist der German Dream - Dirtys Team
Und nichts kann Eko bremsen, das hier ist das ""Ghetto Anthem""

[Hook: SDiddy]
Das hier geht unter die Haut
Ihr werdet von Hunden missbraucht
Wir drei haben uns einen Bunker gebaut
Hartz 4 schießt von ganz unten hinauf

Das hier geht über alles hinaus
Ihr habt beinahe alles versaut
Wir bauen jetzt alles neu auf
Hartz 4 kommt und alles ist aus

[Verse 3: Eko Fresh]
Guck mich an ich bin eh King von hier bis nach Peking
Ich schmeiß eine Pille bis ich ähnlich wie SD kling
Ich habe keine Gnade, ich hab eine Hakennase
[Guck her?] Hakan Abi wird dich durch den Laden jagen
Du hast einen weichen Kern unter deiner harten Schale?
Ich habe weißen Sperm und die Groupies blasen gerade
Ey yo! Mein Lebensstil ist so large
Dein Backup-Rapper kriegt den Besenstiel in den Arsch
Du bist ein kleiner Lehrling, ich bin gemeingefährlich
Nutte sei mal ehrlich, ich mache dich einfach fertig
Wir sind die Cosa Nostra, du bist ein Ober-Opfer
Und bewahrst dein Mikrofon auf in einem rosa Koffer
Ich bin zurück wie die Backtstreet Boys
Ich bin der Typ der nach dem Rappen eine Pepsi säuft
Der Champion des Volks, ich kämpf mit dem Colt
Sag meine Meinung weil ich ein Mensch bin mit Stolz
Und es ist alles easy, ja ich bin der alte Freezy
Dein Label ist nicht mehr wert als eine halbe Kiwi
Und ich ficke auf dem Raufaser-Teppich
Du siehst aus wie eine geile Frau, blas mal dreckig
Und perfekt bei jeder Aufnahme Rap ich (Hartz 4)
Mein Album kommt raus also check mich
Ihr seid nicht cool sondern einfach nur läppsch
Scheiß auf euch, ich geh zu Jams zurück und cypher mit Spax

[Hook: SDiddy]
Das hier geht unter die Haut
Ihr werdet von Hunden missbraucht
Wir drei haben uns einen Bunker gebaut
Hartz 4 schießt von ganz unten hinauf

Das hier geht über alles hinaus
Ihr habt beinahe alles versaut
Wir bauen jetzt alles neu auf
Hartz 4 kommt und alles ist aus

Yeah","https://genius.com/Eko-fresh-hartz-1-lyrics","Released 2020
Primary Artists

    
      Bushido, Capkekz, Eko Fresh & 3 more
Featuring

    
      Capkekz, Eko Fresh, Farid Bang & 6 more
Producers

    
      Bushido, Kingsize, Prodycem & 1 more
Writers

    
      Azra, Bushido, Capkekz & 9 more
Additional Voice

    
      Redman"
