"","artist","title","album","text","url","metadata"
"1","Fler & Jalil","Hype","Epic","[Intro: Fler]
Yeah, Epic, Epic, Epic, Epic
Yeah, Yeah

[Hook: Fler]
Der im Club, der nicht tanzt, der nur Moves macht (Moves macht) - der nur Moves macht (Moves macht)Der im Club, der nicht tanzt, der nur Moves macht (Moves macht)
Die Bitches kleben an mei'm Hype(alle)
Die Bitches kleben an mei'm Hype
Yeah, yeah

[Part 1: Fler]
Laufe durch Berlin wie ein einsamer Wolf(shit)
Vibe das beste Album, doch leider kein Gold
Bitches geh'n runter wie die Scheiben vom Royce(uh)
Und mein Alki-Vater säuft sich weiterhin voll
Das' der Bentley-Continental-Shit
Frank-White-auf-dem-Instrumental-Shit
Wie mir jetzt jeder Komplimente gibt
Hab' deine Fanpost in den Spam geschickt
Ich machte „cholerisch-sein“ salonfähig
Und auf einmal nennt man unseren Jargon „Predigt“
Um mich rum sind alle Schmeißfliegen
Alles Blutsauger, die mein'n Hype lieben
Trage Louboutins, die anderen Nike, Junge
Ein Hurensohn, wer sagt, ich hab' kein'n Hype, Junge
Nackenfalte wie ein Pitbull-Welpe
Deutsche Rapper, Mann, ich fick' die Hälfte
Die andere Hälfte an mei'm Schwanz dran
Du bist dem Pionier zu undankbarDu bist dem Pionier zu undankbar
Was für Fast-Life? Deutscher Rap ist Stop-N'-Go
Meine Attitude ist irgendwann für sie zu Rock 'n' Roll
Doch heute fanden alle mich schon immer coolJeder Journalist, der mich zerriss, will jetzt ein Interview
Hab' 'ne ellenlange StrafakteJedes Urteil ist ein Teil von meinem CharakterDie Narben und die Tattoos sind nicht abwaschbarUnd ich pack' das alles in ein paar Takte
Schlechte Tatts' auf den UnterarmAlte Labellogos und paar Hundenamen
Hundert Rapper hab' ich schon gepusht, du weißt99 waren undankbar, wir sind back

[Hook: Fler]
Der im Club, der nicht tanzt, der nur Moves macht (Moves macht) - der nur Moves macht (Moves macht)Der im Club, der nicht tanzt, der nur Moves macht (Moves macht)
Die Bitches kleben an mei'm Hype (alle)
Die Bitches kleben an mei'm Hype
Hängen an mei'm Schwanz für Karrieremöglichkeit

[Part 2: Jalil]
Hab' die Nino-Brown-Attitude auf als Sportanzug
Die Legende sagt, ich wurd' geboren in Jordan-Schuhen
Designermarken hab' ich selbst bei meiner Boxer-Shorts
Früher KFC, heutzutage Coq au vin
Lauf mit Alpha-Jacke rein ins Ritz Carlton
Gib' die Fünfer an die Penner, denn ich will sie nicht stapeln, ich schwör'
Auf einmal wird jeder Hurensohn Redakteur
Und jeder Ex-Maskuliner zum Deserteur
Und der Status macht das Leben leichter mittlerweile
Ich spreiz' die Beine meiner Bitches wie Gewinnerzeichen
In meiner Kultur begrüßen wir uns mit Gang-Signs
Mein Schwanz hat die Farbe und die Grösse der Maglite
Hype lässt mich in die Traumrolle schlüpfen
Was für Arbeit? Seh ich aus, als würd' ich Baumwolle pflücken?
Früher war es Nine-to-Five, heute klickt die Hasselblad
Und speichert jede Einzelheit vom Nigga, der gehustlet hat
Musste jahrelang mein'n Kopf zerbrechen
In den Kellerstudios, um irgendwann im Loft zu rappen
Steig' in Luxusautos, drück' aufs Gas mit neuen Luxus-Sneakers
Und fahre im Cabrio die Küstenstrecken Costa Ricas

[Hook: Fler]
Der im Club, der nicht tanzt, der nur Moves macht (Moves macht) - der nur Moves macht (Moves macht)Der im Club, der nicht tanzt, der nur Moves macht (Moves macht)
Die Bitches kleben an mei'm Hype (alle)
Die Bitches kleben an mei'm Hype
Hängen an mei'm Schwanz für Karrieremöglichkeit

","https://genius.com/Fler-and-jalil-hype-lyrics","Released June 30, 2017
Distributor

    
      Groove Attack
Label

    
      Maskulin
Executive Producer

    
      Fler
Featuring

    
      Mortel & Remoe
Producers

    
      Christopher Bauer, Fler, Grasser & 7 more
Writers

    
      Christopher Bauer, Fler, Grasser & 9 more
Additional Vocals

    
      Kool Savas & Remoe
Artwork

    
      Memo Filiz & Omely"
"2","Fler & Jalil","Standing","Epic","[Intro: Sample]The time has come where we must learnThe time has come where we must learn

[Hook: Fler]
Kann euch nicht mehr dissen wegen mei'm Standing
Kann euch nicht mehr dissen wegen mei'm Standing
Kann euch nicht mehr dissen wegen mei'm Standing

[Part 1: Fler]
Heute flieg' ich im Privatjet - PJ, PJ
Meine Bitches – dicke Ärsche, cheat day, cheat day
Rapper gehen Pleite, wollen sich an mir hochzieh'n
Rufen bei mir in Miami an und zahl'n das Roaming
Kann euch nicht mehr dissen wegen mei'm Standing
Auf den Scheinen steht: Franklin, Benja-Benjamin Franklin
Ich bin auf der Stage, du bist der Headliner beim Camping
Heute auf den Festivals, der-der-der Champion
Jeden Tag ein Interview, das Gegenteil von Kurdo
Schieße auch im Dönerladen sowie Shomo
Jede Nacht 'ne neue Groupie-Hoe, ich bin beschäftigt
Frag' beim Frühstück wie sie heißt, ich bin vergesslich
Vor Miami Yacine in Miamis Gassen
Hit des Jahres, das muss man Miami lassen
Kann euch nicht mehr dissen wegen mei'm Standing
Doch jeden Beef den Flizzy hatte, ohne Happy Ending

[Hook: Fler]
Kann euch nicht mehr dissen wegen mei'm Standing
Kann euch nicht mehr dissen wegen mei'm Standing
Kann euch nicht mehr dissen wegen mei'm Standing

[Part 2: Jalil]
Ah, Jumpman an der Ferse, Jumpman bis ich sterbeGehe nur in Retrokicks von dieser Erde
Unverschämter Neger lebt wie ein Verschwender
Wisch' mit Hunis Regentropfen von dem Benzer
Reisetaschen – Louis V, das ist mein Branding
Wenn es Beef gibt, hat die Glock bei Schüssen bestes Handling
Rapper rufen an und woll'n die Friedenspfeife rauchen
Kann euch gerne Kippen mit paar Lila Scheinen kaufen
Kann euch nicht mehr dissen wegen mei'm Standing
Kann euch nicht mehr dissen wegen mei'm Standing
Checke heut' mit meiner App den Wagenstatus
Motor und Design sind Bar bezahlt bei Brabus
Das ist kein Fotoshoot, bin jeden Tag so stylisch
Jalil – ein Segen für die Straßen, ich bin heilig
Kann euch nicht mehr dissen wegen mei'm Standing
Bin als Champ' im Ruhestand wie Peyton Manning

[Hook: Jalil]
Kann euch nicht mehr dissen wegen mei'm Standing
Kann euch nicht mehr dissen wegen mei'm Standing
Kann euch nicht mehr dissen wegen mei'm Standing

","https://genius.com/Fler-and-jalil-standing-lyrics","Released June 30, 2017
Distributor

    
      Groove Attack
Label

    
      Maskulin
Executive Producer

    
      Fler
Featuring

    
      Mortel & Remoe
Producers

    
      Christopher Bauer, Fler, Grasser & 7 more
Writers

    
      Christopher Bauer, Fler, Grasser & 9 more
Additional Vocals

    
      Kool Savas & Remoe
Artwork

    
      Memo Filiz & Omely"
"3","Fler & Jalil","Zenit","Epic","[Hook: Fler &Jalil]
Leute denken Vibe, war mein Zenit
Plötzlich bin ich überall beliebt
Aber ist nicht, denn ich setze wieder Trends, die vor mir noch keiner sieht
Leute denken, Vibe war mein Zenit
Plötzlich bin ich überall beliebt
Aber ist nicht, denn ich setze wieder Trends, die vor mir noch keiner sieht
Air System war nicht mein Zenit
Plötzlich bin ich überall beliebt
Aber ist nicht, denn ich setze wieder Trends, die vor mir noch keiner sieht
Air System war nicht mein Zenit
Plötzlich bin ich überall beliebt
Aber ist nicht, denn ich setze wieder Trends, die vor mir noch keiner sieht

[Part 1: Fler]
Neue Kontroverse, neuer Beef
Von dem Staatsanwalt ein neuer Brief
Gangster Frank White, diese Deutschrap-Idioten werden wieder mal geteacht
Rappe eine Line, das ist die Hook
Festivals, ich werde jetzt gebookt
Man dein Disstrack ging 'ne halbe Stunde lang, Junge komm mal auf den Punkt
Interviews zu meinen Interviews
1000 Euro für die limitierten BoostDas sind keine Yeezys, das ist meine eigene Marke Maskulin von Kopf bis Fuß
Sentence tingelt wieder kreuz und querMarvins Platz ist wieder leerIhr wollt 'ne Reunion, denn das letzte gute Steak ist bei beiden lange her

[Interlude: Frauenstimme]
„Ich hab's dir geglaubt, dass du es bist, aber ich mag deine Stimme! - (hehehe) - Ehm, sorry, dass es so lang' gedauert hat, ich bin gerad' erst vom Friseur rausgekommen, also beziehungsweise ich bin jetzt wieder Zuhause, und ja...“

[Hook: Fler &Jalil]
Leute denken, Vibe war mein Zenit
Plötzlich bin ich überall beliebt
Aber ist nicht, denn ich setze wieder Trends, die vor mir noch keiner sieht
Leute denken, Vibe war mein Zenit
Plötzlich bin ich überall beliebt
Aber ist nicht, denn ich setze wieder Trends, die vor mir noch keiner sieht
Air System war nicht mein Zenit
Plötzlich bin ich überall beliebt
Aber ist nicht, denn ich setze wieder Trends, die vor mir noch keiner sieht
Air System war nicht mein Zenit
Plötzlich bin ich überall beliebt
Aber ist nicht, denn ich setze wieder Trends, die vor mir noch keiner sieht

[Part 2: Jalil]
Ich bin chillig und relaxt
Werd' deswegen ständig unterschätzt
Staiger macht auf seriös, doch erkläre mal den Leuten, wo ist Royal Bunker jetzt?
Trinke Codein mit SpriteHennessey mit Coke Light
Bitch, ich bin ein Playboy
Ich spendiere dir ein Drink und du machst deine Beine breit
Polizei macht auf Freund und HelferNett gemeint, doch ich helf' mir lieber selber
Mach' hier nicht auf DavudZeig ein bisschen mehr Respekt, denn ich trag die Jordan 11er
Nehme mir dein GirlyUnd ich fick' die Schlampe dirty
Ich bin wie RonaldoDenn ich komme mit dem Lambo mit der Sieben auf dem Jersey

[Hook: Fler &Jalil]
Leute denken, Vibe war mein Zenit
Plötzlich bin ich überall beliebt
Aber ist nicht, denn ich setze wieder Trends, die vor mir noch keiner sieht
Leute denken, Vibe war mein Zenit
Plötzlich bin ich überall beliebt
Aber ist nicht, denn ich setze wieder Trends, die vor mir noch keiner sieht
Air System war nicht mein Zenit
Plötzlich bin ich überall beliebt
Aber ist nicht, denn ich setze wieder Trends, die vor mir noch keiner sieht
Air System war nicht mein Zenit
Plötzlich bin ich überall beliebt
Aber ist nicht, denn ich setze wieder Trends, die vor mir noch keiner sieht","https://genius.com/Fler-and-jalil-zenit-lyrics","Released June 30, 2017
Distributor

    
      Groove Attack
Label

    
      Maskulin
Executive Producer

    
      Fler
Featuring

    
      Mortel & Remoe
Producers

    
      Christopher Bauer, Fler, Grasser & 7 more
Writers

    
      Christopher Bauer, Fler, Grasser & 9 more
Additional Vocals

    
      Kool Savas & Remoe
Artwork

    
      Memo Filiz & Omely"
"4","Fler & Jalil","Slowmotion","Epic","[Intro]
Nico shit man

[Hook: Fler]
Geile Weiber sind mein Fetisch
Ich wirk' auf sie magnetisch
Ich red' mit Gott und er ist gnädig
Komm' in den Club und nichts bewegt sich
Laufe rein in Slomo-mo
Laufe rein in Slomo!
Laufe rein in Slomo-mo
Laufe rein in Slomo!
Geile Weiber sind mein Fetisch
Ich wirk' auf sie magnetisch
Ich red' mit Gott und er ist gnädig
Komm' in den Club und nichts bewegt sich
Laufe rein in Slomo-mo
Laufe rein in Slomo!
Laufe rein in Slomo-mo
Laufe rein in Slomo!

[Part 1: Fler]
Vierunddreißig, doch bin drauf wie achtzehn
Ich will diese kleine Biatch Shirin David nackt sehen
Freeze - Baby, Baby, Freeze
Nur für eine Nacht, nicht dass du dich in mich verliebst, ayy
Meine Homies sind real, meine Bitches sind fakeDoch ich rede nur von der Oberweite, wenn ich sag': „Sie sind fake.“
Geile Ärsche sind mein Fetisch (woah)
Ich glaub', Jalil, er sieht das ähnlich
Letzte Woche hatt' ich mein Meeting mit Apple (Ja, mann)Die wollten wissen wie viel Geld ich gerne hätteSpotify bezahlt mir meine neue Kette
Zwei Kilo Gold, Junge, das ist Heavy Metal! (Rammstein)
Trag' die Scharfe unterm Sweater (Bang!)
Jeder Hurensohn wird Rapper
In der Booth ist alles neblig (Shit!)
Dieser Lifestyle - Für dich schädlich!
Freeze - Baby, Baby, Freeze
Herzchen bei WhatsApp am Morgen, als ich sie verließ, ayy

[Hook: Fler]
Geile Weiber sind mein Fetisch
Ich wirk' auf sie magnetisch
Ich red' mit Gott und er ist gnädig
Komm' in den Club und nichts bewegt sich
Laufe rein in Slomo-mo
Laufe rein in Slomo!
Laufe rein in Slomo-mo
Laufe rein in Slomo!
Geile Weiber sind mein Fetisch
Ich wirk' auf sie magnetisch
Ich red' mit Gott und er ist gnädig
Komm' in den Club und nichts bewegt sich
Laufe rein in Slomo-mo
Laufe rein in Slomo!
Laufe rein in Slomo-mo
Laufe rein in Slomo!

[Part 2: Jalil]
Lauf' in den Club wie bei Matrix, all die Weiber werden panisch
Jeder Schritt ist in Slomo, alle deutschen Rapper steh'n nur statisch
Laber mich nicht voll, wenn dein Booty kaum bounct
Ich lauf heute bargeldlos, denn alles geht hier aufs Haus
Scheine regnen runter auf die Models von der Fashionweek
Bin und bleib' ein Badboy, weil der Gute nur in Märchen siegt
Damals hatt' ich keine Kohle, Geld konnt' ich nur schwer verdien'n
Heute läuft die Scheiße flüssig, Nigga ist am schwer verdien'n
Mein erster Wagen - CLA - AMG - Sportsitze
Das hat nichts mit Glück zu tun - Bitch, man nennt es Fortschritte (woah)
Ich hätte nie gedacht, ich hatte keine Ahnung (woah)
Dass ich lila Scheine trage, für die kleinste Zahlung (woah)
Statt im Ibis schlaf' ich jetzt im Interconti
Bring auch deine Freundin mit, ich fick' euch beide in der Kombi (denn)

[Hook: Fler]
Geile Weiber sind mein Fetisch
Ich wirk' auf sie magnetisch
Ich red' mit Gott und er ist gnädig
Komm' in den Club und nichts bewegt sich
Laufe rein in Slomo-mo
Laufe rein in Slomo!
Laufe rein in Slomo-mo
Laufe rein in Slomo!
Geile Weiber sind mein Fetisch
Ich wirk' auf sie magnetisch
Ich red' mit Gott und er ist gnädig
Komm' in den Club und nichts bewegt sich
Laufe rein in Slomo-mo
Laufe rein in Slomo!
Laufe rein in Slomo-mo
Laufe rein in Slomo!

","https://genius.com/Fler-and-jalil-slowmotion-lyrics","Released June 30, 2017
Distributor

    
      Groove Attack
Label

    
      Maskulin
Executive Producer

    
      Fler
Featuring

    
      Mortel & Remoe
Producers

    
      Christopher Bauer, Fler, Grasser & 7 more
Writers

    
      Christopher Bauer, Fler, Grasser & 9 more
Additional Vocals

    
      Kool Savas & Remoe
Artwork

    
      Memo Filiz & Omely"
"5","Fler & Jalil","Alles VVS","Epic","[Hook: Fler]
Wenn ich aus dem AMG im Dunklen zieleWird es hell, am Tatort liegen ProjektileDiamanten-Bracelet, weil ich dieses Funkeln liebeScheine halten wach, der Lifestyle macht mich müde
Will, dass meine Homies alle vollhäng'n
Will, dass meine Homies alle vollhäng'n
Heute ha'm wir das, wovon wir immer träumten
24 Karat VVS, alles VVS

[Part 1: Fler]
Alles VVS
Ziel' die Schlampen an, sie tanzen im Bikinidress
Single is on fire, Junge, alle stream'n im Netz
Alle mieses Cash, glaub mir, alle Yeezys echt, yeah
Trink' am Corner den Henny, immer bewaffnet und ready
Scheiß mal auf Rapper mit Maske, halbes Gesicht unterm Cappi
24 Karat häng'n an meinem Neck
Weiber nerven mich, die ganze Nacht WhatsApp
Jage mit mei'm Bruder jeden Tag das MulaBis wir alle vollhäng'n wie Slick Rick the Ruler
Teile mit der Gang Stack für Stack und Snack für Snack
Kille meine Feinde Kek für Kek, back to back
Diamanten, weil ich dieses Funkeln liebe
Slowmotion-Yacht – zwölf K für paar Stunden Miete
Wir ha'm keine Skrupel, geh'n rein mit den Neunmillis
Audemars Piguet an den Handgelenken, voll Brillies

[Hook: Fler]
Wenn ich aus dem AMG im Dunklen zieleWird es hell, am Tatort liegen ProjektileDiamanten-Bracelet, weil ich dieses Funkeln liebeScheine halten wach, der Lifestyle macht mich müde
Will, dass meine Homies alle vollhäng'n
Will, dass meine Homies alle vollhäng'n
Heute ha'm wir das, wovon wir immer träumten
24 Karat VVS, alles VVS

[Part 2: Jalil]
Yeah, Projektile fliegen aus dem weißen Boxster
In den meisten Fitnessrappern seh' ich breite Opfer
Esse tagsüber nur Steak und nachts Champagnerregen
Schmuck kommt aus New York, Jacob the Jeweler muss selbst Hand anlegen
Yeah, brauch' mehr Ketten als ein Sklavenhändler
Schwarze Haut auf schwarzem Leder in 'nem schwarzen Benzer
Früher hingen all meine Träume im Schaufenster
Damals ein dreckiger Ausländer, trag' ich sie heute ein Draufgänger
Verkehrte Welt, Kette so schwer, ich krieg' Schmerzensgeld
Frage nicht nach 'nem Feature solange dein Name nicht zufällig Fler enthält (facts, facts)
Jede Woche beim Barbier, damals kein Geld für ein'n Haarschnitt
Mittlerweile investier' ich ein Hartz-IV (facts, facts, facts, facts)
Die Gang schießt scharf, alles für Blutdiamanten
Pumpen seit Jugend die Hantel, ich kenne nur die Mutanten, Bitch
Easy Rider, wenn wir aus dem Wagen zielen
Schwer im Geschäft, würden sie mich auf der Straße wiegen

[Hook: Fler]
Wenn ich aus dem AMG im Dunklen zieleWird es hell, am Tatort liegen ProjektileDiamanten-Bracelet, weil ich dieses Funkeln liebeScheine halten wach, der Lifestyle macht mich müde
Will, dass meine Homies alle vollhäng'n
Will, dass meine Homies alle vollhäng'n
Heute ha'm wir das, wovon wir immer träumten
24 Karat VVS, alles VVS

","https://genius.com/Fler-and-jalil-alles-vvs-lyrics","Released June 30, 2017
Distributor

    
      Groove Attack
Label

    
      Maskulin
Executive Producer

    
      Fler
Featuring

    
      Mortel & Remoe
Producers

    
      Christopher Bauer, Fler, Grasser & 7 more
Writers

    
      Christopher Bauer, Fler, Grasser & 9 more
Additional Vocals

    
      Kool Savas & Remoe
Artwork

    
      Memo Filiz & Omely"
"6","Fler & Jalil","Flex’n","Epic","[Intro: Fler]
Flex'n, Babe, ich bin am Flex'n, yeahFlex'n, yeahFlex'n, Babe, ich bin am Flex'n, flex'n

[Hook: Jalil &Fler]
Flex'n, Babe, ich bin am Flex'n
Denn die Diamanten in der Roli sind am glänzen
Flex'n, Babe, ich bin am Flex'n
Immer nur am Handy, weil die Bitches mit mir texten
Flex'n, Babe, ich bin am Flex'n
Wenn ich shoppen gehe, nicht ein bisschen die Collection
Flex'n, Babe, ich bin am Flex'n
Es ist kein Geheimnis, Mann, du fickst hier mit den besten

[Part 1: Jalil]
Action – Mann, es geht um Action
Früher in den Block, da war ich immer die Connection
Mit Yankee-Fitted-Cap, Kette bis zum Unterleib und sie scheint wie geölt
Fahr' bei Nacht durch die City, die Scheiben getönt
Die Felgen, sie kosten ein Monatsgehalt
Mein Zuhause, das ist deine Wohnung mal drei
Früher da hatt' ich kein'n Cent für ein'n Fahrschein
Heute da sitz' ich im Benz und er parkt ein
Kam aus dem Ghetto, der einzig' Wahre
Rede mit den Fäusten meine Zeichensprache
Bin der Deutschrap-Messias
Häng' nur mit Gewinnern und scheu' die Verlierer
Belvedere Flaschen auf Eis in 'nem Bottich
Gib Rooz Interviews, aber keine für Toxik
Und keine für Olli und Rap.de
Dieses Jahr Top drei, Hip-Hop-Resümee
Außer Gott ist keiner da, der mich beschützt
Deshalb im mei'm Auto meine Milli auf dem Sitz

[Hook: Jalil& Fler]
Flex'n, Babe, ich bin am Flex'n
Denn die Diamanten in der Roli sind am glänzen
Flex'n, Babe, ich bin am Flex'n
Immer nur am Handy, weil die Bitches mit mir texten
Flex'n, Babe, ich bin am Flex'n
Wenn ich shoppen gehe, nicht ein bisschen die Collection
Flex'n, Babe, ich bin am Flex'n
Es ist kein Geheimnis, Mann, du fickst hier mit den besten

[Part 2: Fler]
Heute vorfahr'n im Daimler Benz
Private parken auf allen Events
Alle Bitches wie Tyra Banks
Alle Hater auf einmal Fans
Bin wie ich bin, brauch' den Macho nicht spiel'n
Jump' in die Menge seit Aggro Berlin
Streit mich mit jedem seit CCN 1
Das Leben im Heim, war 'ne Trainingseinheit
Alle bekamen nur, was sie verdien'
Es lagt nicht an mir, denn es lag nur an ihn
Nie mit der Masse, nur gegen den Strom
Ihr Hater habt heute so viel Sympathie
Wieder der Szene drei Jahre voraus
Fangt ihr damit an, hör' ich grad' damit auf
So ein Badboy, selbst Personal-Trainer verklagen mich auch
Ich glaube, der Richter ist in mich verliebt
Warum schreibt er mir sonst jeden Tag einen Brief?
Hab' es prophezeit und es ist passiert
Jeder macht jetzt Trap, ich hab' nicht phantasiert

[Hook: Jalil & Fler]
Flex'n, Babe, ich bin am Flex'n
Denn die Diamanten in der Roli sind am glänzen
Flex'n, Babe, ich bin am Flex'n
Immer nur am Handy, weil die Bitches mit mir texten
Flex'n, Babe, ich bin am Flex'nWenn ich shoppen gehe, nicht ein bisschen die CollectionFlex'n, Babe, ich bin am Flex'nEs ist kein Geheimnis, Mann, du fickst hier mit den besten

","https://genius.com/Fler-and-jalil-flexn-lyrics","Released June 30, 2017
Distributor

    
      Groove Attack
Label

    
      Maskulin
Executive Producer

    
      Fler
Featuring

    
      Mortel & Remoe
Producers

    
      Christopher Bauer, Fler, Grasser & 7 more
Writers

    
      Christopher Bauer, Fler, Grasser & 9 more
Additional Vocals

    
      Kool Savas & Remoe
Artwork

    
      Memo Filiz & Omely"
"7","Fler & Jalil","Mir gehört die Nacht","Epic","[Producertag]
Simes got that secret sauce

[Intro: Fler]
Weil ich immer mein Film fahr', wie ein Bentley in Silber
Fick' die Bullen, denn ich hab' keine Para' vor irgendwelchen Ampel und Schildern
Weil ich immer mein Film fahr', wie ein Bentley in Silber
Fick' die Bullen, denn ich hab' keine Para' vor irgendwelchen Ampel und Schildern

[Hook: Fler]
Yeah, yeah, yeah, mir gehört die Nacht, Junge
Yeah, yeah, mir gehört die Nacht, Junge
Yeah, mir gehört die Nacht, Junge
Denn mir gehört die Nacht, Junge

[Part 1: Fler]
Fick' diese Möchtegern-Vattenfall-PennerSie stell'n mir den Strom ab, ich zapf' aus dem Keller
Ghetto auf Ewig, mein Hustle geht länger
Ich häng' auf den Straßen, die Taschen voll Paper
Mir gehört die Nacht, jage dich wie Dark Knight
Woo, bitte komm mir nicht mit Thug-Life
Woo, Hauptverdächtiger zur Tatzeit
Ah, Frank White, Collage-Jacke: Schwarz-weiß
Mach' nicht auf Streber wie J. Cole
Mein Kontostand: over the rainbow
Wir schrei'n „Life is a bitch“
Doch für mich ist das Leben kein Sidechick sondern meine Mainhoe
Augen sind Rot vom Zigarrenqualm
Laufe in Slow-Mo, doch Workflow ist Doubletime
Mörder' im Dunkeln wie 'n Hammerhai
Deine scheiß Mutter, sie twerkt für mich wieder bis tief in die Nacht hinein

[Bridge: Fler]
Weil ich immer mein Film fahr', wie ein Bentley in Silber
Fick' die Bullen, denn ich hab' keine Para' vor irgendwelchen Ampel und Schildern
Weil ich immer mein Film fahr', wie ein Bentley in Silber
Fick' die Bullen, denn ich hab' keine Para' vor irgendwelchen Ampel und Schildern

[Hook: Fler]
Yeah, yeah, yeah, mir gehört die Nacht, Junge
Yeah, yeah, mir gehört die Nacht, Junge
Yeah, mir gehört die Nacht, Junge
Denn mir gehört die Nacht, Junge

[Part 2: Jalil]
Trag' bei Nacht meine Sonnenbrille wie Blade
Verschiebe meine Kilos wie Release-Dates
Nutten rufen durch, bring mir neues Guthaben
Importier' Grün durch Amsterdamer Zugfahrten
Adidas Sneaker, gestapelt wie ein Schuhladen
Damals Schluss vor fünf, heute spiel'n wir Zugaben
M-A-S-KU, mein Alphabet die Buchstaben
Kontostand wie wenn ich dreimal mein'n IQ mal nehm'
Der Mond ist mein Zeuge, König der Straße - Gangster
Mindset: geboren, im Block gelernt auszuteilen
Und davor jahrelang nur wie man einsteckt
Ich flieg' durch die Stadt
Die Felge – drei Mille, Kette – drei Mille, Jordans – drei Mille
Sag mir, Junge, fühlst du nicht meinen Vibe
Ich krieg' heute für paar Worte drei Mille, ah

[Bridge: Fler]
Weil ich immer mein Film fahr', wie ein Bentley in Silber
Fick' die Bullen, denn ich hab' keine Para' vor irgendwelchen Ampel und Schildern
Weil ich immer mein Film fahr', wie ein Bentley in Silber
Fick' die Bullen, denn ich hab' keine Para' vor irgendwelchen Ampel und Schildern

[Hook: Fler]
Yeah, yeah, yeah, mir gehört die Nacht, Junge
Yeah, yeah, mir gehört die Nacht, Junge
Yeah, mir gehört die Nacht, Junge
Denn mir gehört die Nacht, Junge

","https://genius.com/Fler-and-jalil-mir-gehort-die-nacht-lyrics","Released June 30, 2017
Distributor

    
      Groove Attack
Label

    
      Maskulin
Executive Producer

    
      Fler
Featuring

    
      Mortel & Remoe
Producers

    
      Christopher Bauer, Fler, Grasser & 7 more
Writers

    
      Christopher Bauer, Fler, Grasser & 9 more
Additional Vocals

    
      Kool Savas & Remoe
Artwork

    
      Memo Filiz & Omely"
