"","artist","title","album","text","url","metadata"
"1","Kool Savas","Optik Anthem","Optik anthem","[Part 1: Eko Fresh &Kool Savas]
Wir kommen langsam auf die Sachen,ihr glaubt Rap sei tot
Doch ich merk', ihr beherrscht jetzt perfekt meinen Flow
Check' meinen Flow, während du keinen Job kriegst und weinst
Habe ich längst einen Deal bei Optik gesigned
Ich schieb' Optikund rhyme besser als der Rest den ihr kennt
S ist der Man,besser, als der Rest den ihr kennt
Rap', wenn ich penn',denn ich mach' höchstens Fehler im Traum
Und hab' irgendwie das Gefühl, mich will jeder beklauen
Ich hab' Lyrics für jeden im Raum, jeden, der will
Du bist mit jedem down, jedem, der will
Rede nicht und chill', die Meisten meiner Fans sind älter
Als ich, E-K-O, ich represente mich selber
Du brauchst 60 Helfer,um genau zu flowen
Ich will endlich Geld haben, für ein ""Haus und Boot""
Ich schaue zum Mond, denn er ist ein optisches O
Also tu' ich, was ich kann, schieb' Optik und flow
Du bist dope, aber deine Stimme passt nicht gut zum Beat
Ich kill' Crews und Freaks, sage danach: ""Oops"" wie Tweet
Es geht mal auf, mal ab
Doch immer nach vorne - Kinder des Zorns
Optik, die Gewinner von Morgen

[Hook: Kool Savas, Eko Fresh & Valezka]
Versucht es zu versteh'n, wir sind zu true für's Game
Optik, alle ander'n Crews sind fake
Ihr macht's euch zu bequem und habt noch dues zu pay'n
S-A-V, alle ander'n Dudes sind fake
Versucht es zu versteh'n, wir sind zu true für's Game
Optik, alle andern Crews sind fake
Ihr macht's euch zu bequem und habt noch dues zu pay'n
E-K-O, alle ander'n Dudes sind fake

[Part 2: Eko &Kool Savas]
Sagt O für:Ohne uns macht Rap kein' Spaß und P:
Präg ihn dir ein, rap' perfekt meinen Part
T: Du brauchst tausend Rhymes, tausend Bars
I-K: Ich komme, rhyme, kille, geh' und das war's
Eko und Savas, irgendwann wie ""Blade"" im KinoIrgenwann auf dem Cover der Source wie Ray Benzino
Irgendwannkauf' ich jedes deutsche Hip-Hop Label
Drop die Acts, die glauben, dass sie Hip-Hop leben
Manche meinen die Twin Towers zu zerstören war schlimmDoch hört erst hin, wie die meisten deutschen Rap-Acts klingen
Ich bring' mit drei Namen gleichzeitig drei LPs
Höre drei mal: ""Ich wär' viel zu tight für's Game""
Ich fick' zehn Crews mit zehn Lines an einem Mic
Hör' zehn mal: ""Ich wär für das Game zu tight""
Geh' und schreib' 100 Raps, mich wundert es, warum wird
E-K-Os Megaflow unterschätzt?
Lad' mein Album runter, lass' mich nix verdienen
Doch ich bin trotzdem immer besser, als ihr Bitch-MCs
Komm her, wenn du unsere Flows und Texte liebst!
Optik, der Rest ist mies! - Rest in peace!

[Hook: Kool Savas, Eko Fresh & Valezka]
Versucht es zu versteh'n, wir sind zu true für's Game
Optik, alle ander'n Crews sind fake
Ihr macht's euch zu bequem und habt noch dues zu pay'n
S-A-V, alle ander'n Dudes sind fake
Versucht es zu versteh'n, wir sind zu true für's Game
Optik, alle andern Crews sind fake
Ihr macht's euch zu bequem und habt noch dues zu pay'n
E-K-O, alle ander'n Dudes sind fake

[Hook: Kool Savas, Eko Fresh & Valezka]
Versucht es zu versteh'n, wir sind zu true für's Game
Optik, alle ander'n Crews sind fake
Ihr macht's euch zu bequem und habt noch dues zu pay'n
S-A-V, alle ander'n Dudes sind fake
Versucht es zu versteh'n, wir sind zu true für's Game
Optik, alle andern Crews sind fake
Ihr macht's euch zu bequem und habt noch dues zu pay'n
E-K-O, alle ander'n Dudes sind fake","https://genius.com/Kool-savas-optik-anthem-lyrics","Released January 13, 2003
Featuring

    
      Eko Fresh, Melbeatz & Valezka
Producers

    
      Kool Savas & Melbeatz
Writers

    
      Eko Fresh, Kool Savas & Valezka
Composer

    
      Melbeatz
Copyright ©

    
      German Dream Empire & Sony BMG Music Entertainment (Germany) GmbH"
"2","Kool Savas","Deutschlands 1","Optik anthem","[Verse 1: Kool Savas]
Ich bin älter jetzt, lass keinen mehr an mein' Business ran
Bitches sagen: Wow, du bist jetzt ein Businessmann
Kids flehen mich an: ""Bitte Spitte!"" und ich spitte für Geld
Säuber das Feld. Sieh, ich ficke die Welt
Dem besten Tag deines Lebens, hörst du die besten Parts deines Lebens
Bite ruhig, ich zahl deine Spesen, Punk
Obwohl du niemals freestylen konntest
Gehst du doch zum Freestyle Contest
Glaubst du kannst gewinnen auf die funny Art wie Reen
Warum kommst du nicht zum Splash mit Bodyguards wie Reen
Optik keep on making it. Du, keep on faking it
Bitches kommen zwar zum Battle, aber überlebens nicht
Hiphop ist ein schwieriger Fall
Ich sag ein Wort und Rapper laufen fort, wie Tiere im Wald
Ich bin kein Idol für die Kids, Teacher und Priester
Nur der beste Rapper im Game und das beliebteste Feature

[Hook]
S-A-V Ich geh für euch ans Mic
Und hätte ich 'ne Nummer, wäre ich Deutschlands 1
Sag ""Oooh!""
Weil du den Tophit hier liebst, sag ""Oooh!""
Das neue Optik Release
E-K-O Ich geh für euch ans Mic
Und hätte ich 'ne Nummer, wäre ich Deutschlands 1
Sag ""Oooh!""
Wenn du den Clubshit genießt, sag ""Ooo!""
Das neue Optik Release

[Verse 2: Eko Fresh]
Das einzige was mich interessiert, ist wie kann ich Geld wie verrückt machen
Klar, dass ich bei diesem Lifestyle verfluchte Neider hab
Ich regel das per Driveby-Besuch in deiner Stadt
Und zwar jetzt oder nie, im Lex oder Jeep
Ich bin wie Ali, ein respektvoller G
Ob Text oder Beat, du stehst ziemlich weit am Anfang
Ich pump, pu-pu-pu pump auf Reen mit einer Pumpgun
Langsam mach ich mehr Cash als Sportsfreunde StillerAuf einmal werden alle deine Sportsfreunde stiller
Weil ich mit Mordsbräuten chille, hab ich Game wenn ich rappe
Ich kann nichts dafür, Bitches geben Brain wenn ich rappe
Fick Fame, seit ich rappe hab ich mehr Feinde als zuvor
Scheine als zuvor, denn ich bin fresh wie keiner war zuvor
Liebst du meine Art Humor, schrei du brauchst Eko hier
Ich lass mir Thug Life auf den Bauch tatowieren

[Hook]
S-A-V Ich geh für euch ans Mic
Und hätte ich 'ne Nummer, wäre ich Deutschlands 1
Sag ""Oooh!""
Weil du den Tophit hier liebst, sag ""Oooh!""
Das neue Optik Release
E-K-O Ich geh für euch ans Mic
Und hätte ich 'ne Nummer, wäre ich Deutschlands 1
Sag ""Oooh!""
Wenn du den Clubshit genießt, sag ""Ooo!""
Das neue Optik Release

[Verse 3: Kool Savas]
Du bist null-bedrohlich nur full-idiotisch
Künstlich Ghetto wie Jennifer Lopez
Du meinst ich verdien' noch eine Krone mehr in der Juice(Jop) Ich verdien' noch eine Krone mehr in der Juice

[Verse 4: Eko Fresh]
Optik ist wenn für Dich alles glatt läuft und
Dieser Track heute Nacht neu im
Club deiner Stadt läuft und
Du nur denkst: Alter Watt Live!?

[Verse 5: Kool Savas]
Ihr habt euch selber zu gern
Nehmt euch selber zu ernst
Bis hier hin hab ich alles selber gelernt
Eure Tapes sind die Gelder nicht wert
Zu Dreck für den Markt
Ich geh weg wenn ich will komm back wenn ich mag (Ah)

[Verse 6: Eko Fresh]
Yo zeig mir einen vermeintlich besseren Rapper
Und es stellt sich raus ich bin ein noch viel besserer Rapper
Das ist lächerlich weshalb kommst du mir wie O-Dogg
Und bist wie Cuba Gooding Jr. in Snowdogs

[Hook]
S-A-V Ich geh für euch ans Mic
Und hätte ich 'ne Nummer, wäre ich Deutschlands 1
Sag ""Oooh!""
Weil du den Tophit hier liebst, sag ""Oooh!""
Das neue Optik Release
E-K-O Ich geh für euch ans Mic
Und hätte ich 'ne Nummer, wäre ich Deutschlands 1
Sag ""Oooh!""
Wenn du den Clubshit genießt, sag ""Ooo!""
Das neue Optik Release

[Hook]
S-A-V Ich geh für euch ans Mic
Und hätte ich 'ne Nummer, wäre ich Deutschlands 1
Sag ""Oooh!""
Weil du den Tophit hier liebst, sag ""Oooh!""
Das neue Optik Release
E-K-O Ich geh für euch ans Mic
Und hätte ich 'ne Nummer, wäre ich Deutschlands 1
Sag ""Oooh!""
Wenn du den Clubshit genießt, sag ""Ooo!""
Das neue Optik Release","https://genius.com/Kool-savas-deutschlands-1-lyrics","Released January 13, 2003
Featuring

    
      Eko Fresh, Melbeatz & Valezka
Producers

    
      Kool Savas & Melbeatz
Writers

    
      Eko Fresh, Kool Savas & Valezka
Composer

    
      Melbeatz
Copyright ©

    
      German Dream Empire & Sony BMG Music Entertainment (Germany) GmbH"
