"";"artist";"title";"album";"text";"url";"metadata"
"20";"Kay One";"Rasieren";"Der junge von damals";"[Part 1: Kay One]
Ich hab' dich beleidigt und ich krieg' Post, du Hund
Der Versorger aller Frau'n, nenn mich Steve Jobs in jung
Paparazzis vor dem Restaurant woll'n mich mit 'ner Bitch ablichten
Du willst Urlaub am Bodensee machen, bring 'ne Freundin mit, ich fick' Touristen
Kay One ist der Killer, Digga, ich bin eklig
Beleidig' Polizisten aus dem fahrenden Mercedes
Schwarze Nummernschilder, Blitzer begrüß' ich mit dem Fickfinger
Und fahr' im AMG zur Kür Miss und mach' alle Bitches klar
Tankstellenstop, Marlboro und Super-Plus
Jeder fragt nach mei'm Duft, direkt nach dem Bruderkuss
Schulabschluss? Ne, Dicka, mach nicht auf Athletiker
Allein der Anblick meiner Felgen fickt zehn Mütter
Früher Teelichter, heute Swarovski-Lampen
Womit ich meine Haare mach'? Schwarzkopf, ihr Transen
Komm und fahr mich, du Schlampe, ich hab' wieder drei Promille
Und zahl' bei der Apotheke mit 'nem lila Schein die Pille
Safety first, ich begrabsch' die Sekretärin
Die Bitches, die ich knall', fickst du vielleicht im nächsten Leben
Doch Hater reden und erzähl'n, doch ich ich schlaf' dabei ein
Wer ich bin? Alter, Marty McFly

[Hook: Kay One &Nizar]
Und auf einmal komm'n alle an, nur weil ich im Fernsehn war
Hoff', meine Ex erholt sich gut von dem Herzinfarkt
Du willst rasier'n? Komm zu mir und mach mir erst den Bart
Wer noch hatet, beißt jetzt zuerst ins Gras
Bis zumLimit, Limit, wir machen, was wir grad woll'n
Schalt die Glotze ein, du siehst den aoszial'n Proll
Kay One, Nizar, Mister Da-Vinci-Code kommt
Wir hol'n uns, was uns zusteht, nix ist umsonst

[Part 2: Al Gear]
Ey yo, die Rapper wollen Beef, geht in Deckung, wenn ich schieß'
Ich lass' euch nach und nach verschwinden wie die Tattoos von Massiv
Abu-Dhabi-Party, Bitches geben einfach Mund
Und woll'n von mir ein Foto als wär' ich Heidi Klum
Und weil ich Poker spiele, Koka deale, checkst du die Mafiosi-Schiene
Schwänger' deine drei Schwestern und schenk' dir 'ne Großfamilie
Schreibe ein paar Lieder, schaff's damit zu Al Jazeera
Und was mein'n Führerschein betrifft, hab' ich mehr Punkte als ein Dalmatiner
Nuckel du an deiner Shisha, während ich mein'n Stoff bunker'
Rap ist für mich Zeitvertreib wie Sex mit MOKs Mutter
Alter, ich hab' kein'n Bock mehr auf Schlampen, die nicht blasen
Innere Werte sind mir wichtig, denn ich handel' mit Organ'n
Deine Tante sitzt im Wagen und der Milfhunter fährt
Ich hab' eine Bitch im Bett, dafür zehn hinterm Herd
Seh' die Welt zwar verkehrt, doch fahr' weiter meine Täterschiene
Bin erst übern Berg, wenn ich über Andrea liege

[Hook: Kay One & Nizar]
Und auf einmal komm'n alle an, nur weil ich im Fernsehn war
Hoff', meine Ex erholt sich gut von dem Herzinfarkt
Du willst rasier'n? Komm zu mir und mach mir erst den Bart
Wer noch hatet, beißt jetzt zuerst ins Gras
Bis zum Limit, Limit, wir machen, was wir grad woll'nSchalt die Glotze ein, du siehst den aoszial'n ProllKay One, Nizar, Mister Da-Vinci-Code kommtWir hol'n uns, was uns zusteht, nix ist umsonst

[Part 3: Kay One]
Mein Traum war schon mit zwölf wie Eazy einen [?] fahr'n mit Compton-Mütze
Ich schau' dein Outfit an und frag' mich echt, bekommst du Stütze?
Ihr seid alles Schwuchteln, gründet doch 'ne Boygroup
Bodyguard ist nur ein Film, du Bastard, warum heulst du?
Asozial, besoffen, parken auf dem Bürgersteig
Das ist Shades of Grey, ich schlage bis der Gürtel reißt
Jeden Tag erster Mai, ich lass' dein'n Wagen brenn'n
Und setze mein Erspartes bei 'nem illegalen Straßenrenn'n
Ich wollte nie ein Teil von eurer Szene sein
Bin glücklich, so wie's ist, Unterwäsche fliegt und Mädchen wein'n
Rappe in mei'm Loft und lass' mich vom Klavier begleiten
Date Bitches und erzähle, ich bin fasziniert vom Reisen
Businessclass, zwanzig Stunden halt' ich sonst nicht aus
Die erste Frage nach der Landung: „Hast noch ein McDonalds auf?“
Yeah, dreh voll auf laut, ich will alle Nachbarn wecken
Wie, du willst mein Essen zahl'n? Nett von dir, doch lass mal stecken
Handylicht, ich bin immer nachts am chatten
Sag' zu meiner Bitch: „Keine Sorge, das sind Wasserflecken“
Auch wenn's keiner sieht, trag' ich Zuhaus manchmal achtzig Ketten
Und ich hör' mich an, als würde Usher rappen

[Hook: Kay One & Nizar]
Und auf einmal komm'n alle an, nur weil ich im Fernsehn war
Hoff', meine Ex erholt sich gut von dem Herzinfarkt
Du willst rasier'n? Komm zu mir und mach mir erst den Bart
Wer noch hatet, beißt jetzt zuerst ins Gras
Bis zum Limit, Limit, wir machen, was wir grad woll'nSchalt die Glotze ein, du siehst den aoszial'n ProllKay One, Nizar, Mister Da-Vinci-Code kommtWir hol'n uns, was uns zusteht, nix ist umsonst

";"https://genius.com/Kay-one-rasieren-lyrics";"Released September 2, 2016
Distributor

    
      Tonpool Medien GmbH
Copyright ©

    
      Prince Kay One GmbH
Phonographic Copyright ℗

    
      Prince Kay One GmbH
Label

    
      Prince Kay One GmbH
Cover Design

    
      Mikkansy
Artwork

    
      Eric Ullrich
Executive Producer

    
      Kay One
Featuring

    
      Al-Gear, Brandon Beal, Faydee & 5 more
Producers

    
      Gorex
Writers

    
      Alex Dehn, Al-Gear, Brandon Beal & 8 more
Composer

    
      Alex Dehn, Gorex, Mario Winans & 1 more
Copyright ©

    
      Prince Kay One GmbH"
"21";"Kay One";"Thriller from Manila";"Der junge von damals";"[Part 1]
Bitch, ich verteil' Körbe, fick' die Industrie
Digga, knall' Nutten, die so scharf sind, dass meine Knie zittern
Zielsicher, schieß', Digga, Panzerglasscheiben
Dein schwuler Vater lässt sich ein'n Undercut schneiden
Ich fick' Rapper gern, Streetrapper sind fake
Durch Shows verdien' ich jetzt mehr Cash als T-Pain
Alle meine Autos schwarz, so wie Diddy Pablo
Schwarz wie mein Lamborghini Diablo
Zieh deine Bahn Koks, geh mal weiter freestyl'n am Bahnhof
Und deine Mutter liebt den Spagat, Bro
Gib mir Carpaccio, ich lieb' rohes Fleisch
Deutschrap ist wieder mal für 'nen Deepthroat bereit
Ich kack' auf die Szene, denn bald ist das Spiel vorbei
Und kleid' mich ein wie ein scheiß Immobilienhai
Und jetzt zieh dir rein wie dieser lila Schein
Deine Frau lutschen lässt, heut fick' ich ihren Preis

[Hook]
Helikopter fliegen um die Villa
Ich spring' in mein'n Ferrari California
Halt' die Uzi aus dem Fenster
Wer ich bin? (wer ich bin?) – Thriller from Manila
Kein'n Respekt, kein'n Anstand, was wollt ihr Toys?
Deine Frau wird bei 22 Zoll hier feucht
Helikopter fliegen um die Villa, wer ich bin?

[Part 2]
Hol dir dein'n Uppercut ab, shut the fuck up, Papperlapapp
Glaub nicht, dass du in dei'm Mazda Platz hast
Also was, du Bastard? Mach nicht auf hart, Bitch
Fick dein YouTube, du wichst dir ein'n auf paar Klicks
Rauch' grad Shit, ficke Bitches aus Madrid
Sauf' nur Chris, ich bin wieder auf 'nem Trip
Blaulicht fickt mein'n Kopf, du glaubst es nicht
Und deine Mutter zaubert sich die Scheine aus dem Slip
Rauschgift ist überall, fick den Zoll
Du Student, deine Felgen haben siebzehn Zoll
Ich bin Proll, weil ich alles einfach leb'
Und auf Facebook mach' ich ein'n auf scheiß Poet
Jeder weiß, dass du Schwänze liebst, mach nicht auf Memphis Bleek
Ich überroll' dich im brandneuen Wrangler Jeep
Und am Ende krieg' ich, was ich will
Mann, ich mach' ein Selfie, doch du bist nicht im Bild

[Hook]
Helikopter fliegen um die Villa
Ich spring' in mein'n Ferrari California
Halt' die Uzi aus dem Fenster
Wer ich bin? (wer ich bin?) – Thriller from Manila
Kein'n Respekt, kein'n Anstand, was wollt ihr Toys?
Deine Frau wird bei 22 Zoll hier feucht
Helikopter fliegen um die Villa, wer ich bin?

";"https://genius.com/Kay-one-thriller-from-manila-lyrics";"Released September 2, 2016
Distributor

    
      Tonpool Medien GmbH
Copyright ©

    
      Prince Kay One GmbH
Phonographic Copyright ℗

    
      Prince Kay One GmbH
Label

    
      Prince Kay One GmbH
Cover Design

    
      Mikkansy
Artwork

    
      Eric Ullrich
Executive Producer

    
      Kay One
Featuring

    
      Al-Gear, Brandon Beal, Faydee & 5 more
Producers

    
      Gorex
Writers

    
      Alex Dehn, Al-Gear, Brandon Beal & 8 more
Composer

    
      Alex Dehn, Gorex, Mario Winans & 1 more
Copyright ©

    
      Prince Kay One GmbH"
"22";"Kay One";"What Happend";"Der junge von damals";"[Intro: Mario Winans]
Have you ever lost someone?
It broke your heart 'til you almost died
I lost some other too
And I did anything in the world to get her back
So I'm in a bad boy crises
Kay One, Mario Winans
What happend?

[Hook: Mario Winans]
Girl, what happend, where did our love go?
Girl, what happend, there's no tomorrow
Girl, what happend, believe me [?]
Girl, what happend, girl, what happend to me and you

[Part 1: Kay One]
Baby, mir geht's ums Prinzip
Wir haben mehr diskutiert als uns geliebt
Haben uns doch geschwor'n, immer da zu sein
Doch wer geht grad allein durch die harte Zeit
Es fickt so krass Kopf, ich kann's nicht versteh'n
Ich kotz', wenn dein neuer Mann vor mir steht
Noch eine Flasche, noch ein'n Schluck
Auf mei'm Kopfkissen immer noch dein Duft
Briefe, Bilder, Geschenke, Videos
Alles noch an seinem Platz, sag, wieso
Fällt's dir leicht, mich einzutauschen?
Weil ich mal gesagt hab', bleib zu Hause
Weil ich Angst hatte, dass du wie der Rest wirst
Sorry, dass mir bei so Frauen schlecht wird
Ich hab's gut gemeint
Und wenn das dein Ziel war, hast du's erreicht

[Hook: Mario Winans]
Girl, what happend, where did our love go?
Girl, what happend, there's no tomorrow
Girl, what happend, believe me [?]
Girl, what happend, girl, what happend to me and you

[Part 2: Kay One]
Saufen, Rauchen, Frust, Fressen
Wir lang wird's noch in der Brust stechen
Werd' diesen Abschiedskuss rappen
Ich hab' kein'n Bock, aber muss lächeln
Das Leben geht weiter, ich sitz' hier und bleib' wach
Ich geb' es zu, es ist nicht grade einfach
Weil's mir schwer fällt einzuschlafen
Fick Partys, du warst mein Freitagabend
Ich lieb' und hass' dich, du hast recht, das passt nicht
Doch was tun, wenn man zu schwach ist
Du bist eine Sünde, ich hab' Blut geleckt
Es musste so kommen, es war zu perfekt
Glaub mir, ich vermiss' die Zeit sehr
Doch ich hoff', der Song hier bricht dein scheiß Herz
Blick in meins, du siehst, es bleibt Herbst
Doch ich muss das hier endlich mal allein lern'n

[Hook: Mario Winans]
Girl, what happend, where did our love go?
Girl, what happend, there's no tomorrow
Girl, what happend, believe me [?]
Girl, what happend, girl, what happend to me and you
Girl, what happend, where did our love go?
Girl, what happend, there's no tomorrow
Girl, what happend, believe me [?]
Girl, what happend, girl, what happend to me and you

";"https://genius.com/Kay-one-what-happend-lyrics";"Released September 2, 2016
Distributor

    
      Tonpool Medien GmbH
Copyright ©

    
      Prince Kay One GmbH
Phonographic Copyright ℗

    
      Prince Kay One GmbH
Label

    
      Prince Kay One GmbH
Cover Design

    
      Mikkansy
Artwork

    
      Eric Ullrich
Executive Producer

    
      Kay One
Featuring

    
      Al-Gear, Brandon Beal, Faydee & 5 more
Producers

    
      Gorex
Writers

    
      Alex Dehn, Al-Gear, Brandon Beal & 8 more
Composer

    
      Alex Dehn, Gorex, Mario Winans & 1 more
Copyright ©

    
      Prince Kay One GmbH"
"23";"Kay One";"Freestyle";"Der junge von damals";"[Intro]
Check, check, check
Pass auf, Alter
Okay, okay, pass auf
Ein Freestyle nur für Gorex, komm

[Part]
Ah, ey yo, Gorex, was geht ab, Bruder?
Ich spitt' ein'n Freestyle, gib mir Bass, Bruder
Dieser Junge hat den Beat hier grade eingespielt
Herzlich willkomm'n in meiner Highsociety
Und wir sind nicht allein, [?] ist dabei
Und hält die Kamera und filmt die Scheiße grade live
Yo, Gorex, ich hab' Durst, also wer geht zur Tanke?
Denkst du wirklich, dass ich mit dir verhandle?
Spaß, Bruder, du weißt, Spaß muss sein
Doch das Glas ist leer, du weißt, ich mag doch Wein
Und ich mag Molokko und ich mag noch Kippen
Nicht mal Texteschreiber könnten heute diese Bars hier spitten
Und da kommt Manuellsen grade rein
Ey yo, was geht ab, Bruder, hast du die Harley dabei?
Ich freestyle einfach und ficke diese ganze Szene
Guck mich an, wie ich ins Studio mit einem Anzug gehe
Ferrari vor dem Studio, jeder ist mein Zeuge
Dieser Junge lebt hier seine Träume
Aber heute haben wir schon drei Tracks gemacht
Ich blick' auf meine Audemars und gleich ist es acht
Gorex, Feierabend, Peace!


";"https://genius.com/Kay-one-freestyle-lyrics";"Released September 2, 2016
Distributor

    
      Tonpool Medien GmbH
Copyright ©

    
      Prince Kay One GmbH
Phonographic Copyright ℗

    
      Prince Kay One GmbH
Label

    
      Prince Kay One GmbH
Cover Design

    
      Mikkansy
Artwork

    
      Eric Ullrich
Executive Producer

    
      Kay One
Featuring

    
      Al-Gear, Brandon Beal, Faydee & 5 more
Producers

    
      Gorex
Writers

    
      Alex Dehn, Al-Gear, Brandon Beal & 8 more
Composer

    
      Alex Dehn, Gorex, Mario Winans & 1 more
Copyright ©

    
      Prince Kay One GmbH"
