"","artist","title","album","text","url","metadata"
"26","Fettes Brot","Raptus Melancholicus","Fettes brot fur die welt","Es ist so schön, in Deinen Armen aufzuwachen
Die rote Sonne aufgehn zu sehn
In den Tag zu lachen
Du bist die Frau, nach der ich immer gesucht hab
Doch jetzt bist Du da, weil ich im Glück
Ein Zimmer gebucht hab

Jetzt sind wir ein Paar – einfach unschlagbar
Komm sag mal hast Du jemals sowas gesehn, unsagbar
Vertrag war nich nötig, lächelst Du mich an, erröt ich
Noch immer – und immer wieder
Und für niemand anders als für Dich sing ich meine Lieder

Du nimmst meine Hand
Ah, was ist das?
Ich seh so verschwommen, komm hör auf, Du machst nur Spaß
Doch es wird dunkel – ein Blitz – das Grauen
Ich wache auf
Argh!
Alles nur ein Traum!

Es reißt mir das Herz aus der Mitte
Unsagbare Schmerzen, Schläge und Tritte
Ich wünsch mich zurück – ich will zurück zu Dir
Denn hier bin ich allein, also was soll ich hier
Doch die Tür zu Dir ist für immer verschlossen
Die Einsicht kommt – und die Tränen in die Augen geschossen
Du warst so schön, alles nur ein Traum
Es hilft kein Flehen, alles nur ein Traum
Du bist weg, alles nur ein Traum
Und was übrig bleibt bin ich, verdeckt vom Dreck

Dunkle Schatten, die drohn mich aufzufressen
Der dunklen Schatten Lohn:
Dich zu vergessen!
Nichts bringt sie zurück, die Fata Morgana
Ich würd alles für sie tun
Mich selbst zum Untertan
Ja, ich kann nichts mehr spüren, nichts mehr verstehn
Es bleibt nur der Traum, Dich wiederzusehn

Voller Frustation steh ich an der Busstation
Doch ich wußt ja schon vorher
Ich wär nich so taff
Ihr zu sagen
Wie sehr ich auf sie abfahr
Mann, wie knapp war ich heut wieder davor
Ich Tor
Tschüs – sagte sie süß in mein Ohr
Das genügte, damit ich meinen Verstand verlor

Ich reiß mich am Riemen
Natürlich weiß ich von ihm
Ihrem Freund, der sie einzäunt
Und selbst rumstreunt!
Sie liebt ihn und gibt ihm
Niemals den Laufpaß
Ich schwöre mir, daß ich auf sie aufpaß
Romeo liebt Julia, Fool liebt Foola
Ich liebe sie, doch ist für sie mein Nebenbuhler eben cooler
Dabei ist er irgendwie viel zu lasch
Dieser lange Lulatsch
Was mag sie denn an so 'nem ätzenden Gesichtsgulasch?
Unfaßbar dieser Kaspar
Wah – spielt Tennis im Verein und macht 'ne Leere bei der Haspa
Haß bar jeder barmherzigen Gnade
Was hat er
Was ich nicht habe?

Ich labe mich an ihrer Nähe
Wehe mir, wenn ich sie nur ansehe
Ich möchte sie berührn, umschlingen, aufsaugen
Und wieder schicken mich die Augen
Dieser Frau gen Himmel
Doch dann bricht auch Frust ein
In mein Bewußtsein
Und tausend Stecknadeln durchdringen mein Brustbein

Letzte Nacht, als ich tief schlief
Träumte ich davon, daß ich sie anrief
Dies fiese Zeichen wollt nicht weichen
Sie ist besetzt – ich kann sie nicht erreichen!

""Ja, es stimmt, Du hattest Recht
Wir können trotzdem Freunde bleiben
Mir geht es gar nicht mal so schlecht
Ich kann ihn leiden
Deinen Neuen, um den Dich alle beneiden
Ich würd mich für Euch freuen
Wenn Ihr glücklich seid, Ihr beiden
Paßt gut zusammen, seid ein schönes Liebespaar
Und mir ist klar
Daß es niemals wieder so wird, wie es war
Ich bin drüber weg
Es macht mir nichts mehr aus
Treffe mich mit alten Freunden
Gehe abends wieder raus
So gesehn hat auch alles
Sein Gutes
Und so tut es
Gar nicht weh
Wenn ich Euch zusammen seh.""

Ich hasse ihn
Und was ich sagte war gelogen
Ich haß und liebe Dich
Fühle mich
Betrogen
Ich könnt kotzen, wenn ich ihn seh
Denn er ist Schuld daran
Und vor allem hat er das, was ich nicht haben kann

Versuche meine Gefühle zu bändigen
Von ständigen Erinnerungen an Dich
Um dann nicht im Selbstmitleid zu versinken
Und auch wenn ich abend weg geh
Fang ich doch nur an zu trinken

Mir geht's mies
Nur damit Du weißt wie's ist
Wenn Du nicht vergißt
Nicht vergessen kannst
Wir haben getanzt – nur einen Sommer lang
Komma dann kann die Wende
Unsere Musik war zu Ende

Zustände dieser Depression schlagen um in Haß
Und ich laß
Ihn raus
Schlage mit der Faust
In Gedanken ihm eine rein – ich laß es sein
Und fühl mich wieder allein","https://genius.com/Fettes-brot-raptus-melancholicus-lyrics","Released May 12, 2000
Featuring

    
      Beginner, Der Tobi, Der Tobi & das Bo & 2 more
Producers

    
      André Luth & Fettes Brot
Copyright ©

    
      Intercord Ton GmbH & Yo Mama’s Recording
Distribution

    
      Indigo Musikproduktion + Vertrieb GmbH & Intercord Ton GmbH
Label

    
      Yo Mama’s Recording"
"27","Fettes Brot","Jugend forscht","Fettes brot fur die welt","Hallo Zielgruppe, wir sind's nur
5 Jungs beim Toursport, scheffeln Kohle wie der Ruhrpott
Mit jedem Sure Shot, kommt doch mal vorbei
Nehmt euch ein paar Stunden Zeit
Und rastet gefälligst aus, wenn ihr mit uns unten seid

Wir kommen in eine fremde Stadt und irgendwo schreit einer:
""Da sind Fettes Brot und Eins Zwo in ihrem Nightliner""
That's right Kleiner, so geil wie wir ist beinahe keiner
Die ganze Sache passt wie der Arsch auf den Eimer
Entschuldige daß ich hier so reinplatz, mein Schatz
AberKarl Lauerist nunmal 24 Stunden im Einsatz
Wenn die Crew um Gnade fleht, bin ich grad am Starten
Und mach Gags über eure Mütter wie der letzte Satansbraten
Du mußt beachten, daß ich den ganzen Tag nicht richtig wach bin
Örtlich betäubt, immer nah dem Schwachsinn
Doch wir rocken jeden Abend, damit wir uns nicht mißverstehen:
Ich kenn Bela B. und ich hab KISS gesehen
Halb Mensch halb taub, mann ist der Monitor laut
Nichts würd ich tauschen, gegen dasallabendliche Meeresrauschen
Wir hoffen auf die Gunst unseres Publikums
Denn dann glückt uns das Kunststück:
Einmal alle hin und weg und zurück

[Refrain x2]

Was kaum einer aushält, weil's sich erst später rausstellt
Ist daß der Kerl??? als mit der Tür ins Haus fällt
Ich servier nur Kimme und Korn, Beats wie Willi Tells
Auf meinen Tapes von Melly Mels bis???
Nacht für Nacht gibt's für jedermann Seemannsgarn
Und Jägermeister statt Lebertran
""Willst' noch was zu essen Schiff?"" ruft Doktor Renz von nebenan
Erstaunlich, wie lang man nur von Käsebrötchen leben kann
Es könnt so ewig weitergehen wie ein Perpetuum Mobile
Nur manchmal bin ich angepisster als ne Klobrille
Pech gehabt, wer hat mir mein Käsebrötchen weggeschnappt
Ihr wißt doch Vitamine, sind viel gesünder wie Termine
Ist doch mein Reden, Alter, adrett wie Matt Bianco
Cool wie Al Pacino trink ich meinen Vino Blanco
Und seh ich dann platt aus, wie ne Blattlaus
Setz ich meine Sonnenbrille auf, und warte auf Applaus

[Refrain x2]

Ey du, wenn ich erstmal sitze, werde ich nach einiger Zeit weit mehr als faul
Denn ich bin völler als Rudi und breitner als Paul
Ich halt das Maul und trink lieber mit Vasily noch nen Ouzo
Und was machst du so,Larusso?
Ich find's selbst nicht gut und will's ab morgen ändern
Jeden Tag torkel ich durch den Bus mit drei paar Augenrändern
Nichtsdestotrotz kriegt der Maestro Props
Weil bei meinem Atem geht Ungeziefer restlos hops
Ich bin 1, 72, das ist relativ niedlich
Selbst dafür ist unser Gefährt viel zu niedrig
So krieg ich jeden Morgen nach dem Aufstehen keinen Kuss
Sondern ne astreine Kopfnuss vom Bus
Ich steh auf Veranstalter die in irgendeinem Szeneladen
Mir beweisen daß sie ein gestörtes Verhältnis zur Hygienehaben
Ich geh lieber stinkig ins Bett, als hier zu duschen
Und ich möcht' gar nicht erst wissen
Welche Luschen sich hier schon wuschen

Word up, yo
Wir kicken Neben- und Hauptsätze
Bringen den Mörderflow an 1000 Schauplätze
Ihr staunt Bauklötze
Wie die Damen und Herren bei Schwäbisch-Hall
Immer, überall und auf jeden Fall!
Also besuch uns bald (immer überall und auf jeden Fall)
Auf den Brettern die das Geld bedeuten","https://genius.com/Fettes-brot-jugend-forscht-lyrics","Released May 12, 2000
Featuring

    
      Beginner, Der Tobi, Der Tobi & das Bo & 2 more
Producers

    
      André Luth & Fettes Brot
Copyright ©

    
      Intercord Ton GmbH & Yo Mama’s Recording
Distribution

    
      Indigo Musikproduktion + Vertrieb GmbH & Intercord Ton GmbH
Label

    
      Yo Mama’s Recording"
"28","Fettes Brot","6 Million Ways to Rome, Choose One","Fettes brot fur die welt","What what
Viele Wege führen nachEimsbush

Ich war beim Karneval in Rio
Fuhr durch Holland mit Rad
Und letztens war ich auf der fürchterlichsten Party der Stadt
Ich sprang vom Kilimandscharo in den Silbersee
Fühl dasselbe wenn ich auf'm 3er im Kaifu Freibad steh'

Welchen Weg ich auch wählte irgendetwas fehlte
Das Glück macht sich nur selten für einen stark
Ich bin auf der suche nach dir
Durch achtzig Welten an einem Tag

Viele Wege führen nach Rom, doch nur einer führt zu dir
Du sagst ich kenn' ihn schon, bitte zeig ihn mir
Was soll ich denn in Rom? Da bleib' ich lieber hier
Ich weiß nicht wo du wohnst. Ich wär' so gern bei dir

""Viele Wege führen nach Rom"" hätte Mama jetzt gesagt
Doch momentan denk' ich nur an den Traum von letzter Nacht
Ich war dein Gigolo im Kimono, der Libero der Libido
Do re mi fa so, ein Figaro Figaro mit allem Pipapo
Doch warum find' ich den Weg nicht, frage ich mich täglich
Ich möchte doch so gerne bei dir sein
Vielleicht wohnst du gleich nebenan
Mein Herz ist groß und die Welt ist klein

Viele Wege führen nach Rom, doch nur einer führt zu dir
Du sagst ich kenn' ihn schon, bitte zeig ihn mir
Was soll ich denn in Rom? Da bleib' ich lieber hier
Ich weiß nicht wo du wohnst. Ich wär' so gern bei dir

What what, die Beginner, Fat Bread, DJ Mad

Viele Wege führen nach Rom, doch nur einer führt zu dir
Du sagst ich kenn' ihn schon, bitte zeig ihn mir
Was soll ich denn in Rom? Da bleib' ich lieber hier in Dessau
Ich weiß nicht wo du wohnst. Ich wär' so gern bei dir

Viele Wege führen nach Rom, doch nur einer, der führt zu dir
Ich mein', du sagst ich kenn' ihn schon, dann zeig ihn mir
Ich mein', was soll ich denn in Rom? Da bleib' ich doch lieber hier
Ich mein', ich weiß zwar nicht wo du wohnst, ja? Aber Ich wär' wirklich gern bei dir
Das ist tatsächlich so

Viele Wege führen nach Rom, doch nur einer führt zu dir
Du sagst ich kenn' ihn schon, bitte zeig ihn mir
Was soll ich denn in Rom? Da bleib' ich in Hannover
Ich weiß nicht wo ich wohn'. Ich wär' so gern bei mir","https://genius.com/Fettes-brot-6-million-ways-to-rome-choose-one-lyrics","Released May 12, 2000
Featuring

    
      Beginner, Der Tobi, Der Tobi & das Bo & 2 more
Producers

    
      André Luth & Fettes Brot
Copyright ©

    
      Intercord Ton GmbH & Yo Mama’s Recording
Distribution

    
      Indigo Musikproduktion + Vertrieb GmbH & Intercord Ton GmbH
Label

    
      Yo Mama’s Recording"
"29","Fettes Brot","Herrenabend","Fettes brot fur die welt","Ist es ein Vogel? – Nein!
Ist es ein UFO? – Nein!
Es ist kein Vogel, kein UFO, na dann ist es 'n Flugzeug
Nein, es ist Fettes Brot, also duckt euch
Denn ich erzähl euch von 3 Tagedieben, die sich schon seit Jahren lieben
Hin und wieder in die Haare kriegen, doch bis jetzt sind alle dageblieben
Denn wir sind eine Einheit, wie der Elch und IKEA
Alles läuft geschmiert wie mit Milch von Nivea
Denn wir brauchen nur'n paar Kräuter und'n Platz im Trockenen
Daß wir zu Songs aus Jamaika ne Nacht lang rocken können
Das ist es was ich liebe, wenn drin ist was draufsteht
Irgendjemand stundenlang auflegt
Wenn wir wie Affen mit den Köpfen nicken, bis alle Nacken knacken
Das ist was mir unter die Haut geht
Bis irgendeinem von uns leicht verwirrten Trotteln plötzlich aufgeht
Dass wir das Essen vergessen wie Models auf'm Laufsteg
Ja, das ist doch noch lange kein Grund warum man schwitzen müsste
Wir lösen das Problem im Sitzen mit 'nem Griff zu Pizzaliste
Und bis zur Fütterung suchen wir auf Krautsalat 'nen Doppelreim
Das geht viel schneller als 'ne Autofahrt in Hockenheim

Aus Scheiße Gold zu machen, Simsalabim
Das ist für mich doch keine Kunst
Und hört hier irgendwer Stimmen
Dann ist es nicht weiter schlimm
Das sind nur ich und meine Jungs

Aus Scheiße Gold zu machen, Simsalabim
Das ist für mich doch keine Kunst
Und hört hier irgendwer Stimmen
Dann ist es nicht weiter schlimm
Das sind nur ich und meine Jungs

Wie kann es das geben, dass ich niemals die Lust verliere
Weil wir eben mehr Dinge erleben als die Musketiere
Doch nicht von wegen Mantel und Degen
Wusstet ihr Kollegen, ich krieg schon 'nen Tennisarm von drei mal Hanteln heben
Wir ham zusammen in all den Jahren so manches Land entdeckt
Manchen Schwank gecheckt, immer 'n derben Track im Handgepäck
Doch auf den meisten Reisen haben wir nur die Reperbahn in Brand gesteckt
Und geht es einem von uns schlecht gibt's Lebertran ans Krankenbett
Denn nicht nur am Herrenabend, sondern auch an schweren Tagen
Zeigen wir, dass wir uns wirklich gern haben
Wir sind große Jungs und hart im Nehmen
""Er war einer von uns"" wird auf meinem Grabstein stehn
Bis dahin zieht die Karawane noch'n bisschen weiter
Man weiß halt woraufs ankommt ab'm gewissen Alter
Ihr wisst schon von Dingen her, dass nicht nur äußere Werte zählen
Und mit euch werd ich noch 'ne ganze Herde Pferde stehlen

Aus Scheiße Gold zu machen, Simsalabim
Das ist für mich doch keine Kunst
Und hört hier irgendwer Stimmen
Dann ist es nicht weiter schlimm
Das sind nur ich und meine Jungs

Aus Scheiße Gold zu machen, Simsalabim
Das ist für mich doch keine Kunst
Und hört hier irgendwer Stimmen
Dann ist es nicht weiter schlimm
Das sind nur ich und meine Jungs

Das sind nur ich und meine Jungs
Das sind nur ich und meine Jungs
Das sind nur ich und meine Jungs
Das sind nur ich und meine Jungs

Und meine Jungs kenn' ich so gut wie meine Westentasche
Sie können mir kein' vom Pferd erzählen, selbst mit der besten Masche
Ich darf mir ihre Karre leihn, ihre Geschwister knutschen
Ihnen ganz allein die Haare schneiden und die Eltern duzen
Gibt's denn 'ne größere Befriedigung, als abzufeiern bis zum Siedepunkt?
(Noch nicht nachweisbar)
Hab euch den Schlaf geraubt wie Diebe, drum landen wir auf dem Präsidium
(Tach Herr Wachtmeister)
Am nächsten Morgen mach ich den Weckdienst, und sag
""Ey Jungs, ihr seht ja schlimmer aus als ungeschminkte Drag Queens""
Sind meine Witze auch schäbig wie der Fraß im Fast-Food-Laden
Ich weiß, ihr versteht mich und seid für jeden Spaß zu haben
Drei Mal darfst du raten, wer hier die coolsten Kollegen hat
Ich seh sie jeden Tag, die tollsten Typen der Gegenwart
Eigentlich soll ich ja nicht ""We are the Champions"" singen
Doch manchmal muss man sich auch selber mal'n Ständchen bringen

Aus Scheiße Gold zu machen, Simsalabim
Das ist für mich doch keine Kunst
Und hört hier irgendwer Stimmen
Dann ist es nicht weiter schlimm
Das sind nur ich und meine Jungs

Aus Scheiße Gold zu machen, Simsalabim
Das ist für mich doch keine Kunst
Und hört hier irgendwer Stimmen
Dann ist es nicht weiter schlimm
Das sind nur ich und meine Jungs","https://genius.com/Fettes-brot-herrenabend-lyrics","Released May 12, 2000
Featuring

    
      Beginner, Der Tobi, Der Tobi & das Bo & 2 more
Producers

    
      André Luth & Fettes Brot
Copyright ©

    
      Intercord Ton GmbH & Yo Mama’s Recording
Distribution

    
      Indigo Musikproduktion + Vertrieb GmbH & Intercord Ton GmbH
Label

    
      Yo Mama’s Recording"
"30","Fettes Brot","Dr. Dur","Fettes brot fur die welt","Ey Dokter Renz spiel mal was in Dur","https://genius.com/Fettes-brot-dr-dur-lyrics","Released May 12, 2000
Featuring

    
      Beginner, Der Tobi, Der Tobi & das Bo & 2 more
Producers

    
      André Luth & Fettes Brot
Copyright ©

    
      Intercord Ton GmbH & Yo Mama’s Recording
Distribution

    
      Indigo Musikproduktion + Vertrieb GmbH & Intercord Ton GmbH
Label

    
      Yo Mama’s Recording"
"31","Fettes Brot","Wir können auch anders","Fettes brot fur die welt","Wir können auch anders!
Schiffmeister ist der Mann, der es anpackt
Exakt im Takt dies Thema mit euch anschnackt
Kommt mit uns, lass dich von uns verführen
Öffne mit den Broten musikalische Türen
Lässt du dich auch von dem Schubladendenken beschränken
Dann lass dich jetzt vor unsern Schrank lenken:
Ein Schrank voller Schubladen, der in euren Köpfen entsteht
Wenn ihr Musik andreht oder ein Video seht
Ich weiß, dass du verstehst
Das Ding heißt Kreativität mit Individualität
Überall unter Schall findest du die Fetten Brote unter
Musik mit der besondren Note
Du bist verwirrt, denn überall sind wir
Wir sind hier, hier, hier und hier
Wir sind in jeder Schublade und das ist keine Kunst
Der Schrank heißt Musik und er gehört uns!

Wir können auch anders!
Wir können auch anders!
Wir können auch anders!

Kreativität entsteht durch Bewegung
Zerlegung alter Regeln, durch neue Überlegung
Alldieweil ich zerteil und dann erneut anpeil
An meinem Style feil, bis jede Zeil geil rüberkommt
Überkommt mich dann und wann ein Drang zur Eile
Empfinde Langeweile, wenn ich zu lang verweile
Du und deine heile Welt, wie aus dem Ei gepellt
Die Weihnachtstanne hast du schon im Mai bestellt
Ein Leben lang im Schonwaschgang, das findest du praktisch
Du bist grade erst dreißig, doch du lebst nur noch faktisch
Seit Jahren festgefahren, es wird sich nichts mehr ändern
Und wenn, dann wirst du's verpenn', Mann
Weil du immer die selben Wege wanderst
Die selben Sachen anhast
Nie Änderungen veranlasst
Im besten Falle kann das dazu führen
Dass du eines Tages spüren wirst
Was dir schon immer fehlte
Und was ich dir grad erzählte:
Kreativität entsteht durch Bewegung
Zerlegung alter Regeln, durch neue Überlegung
Mal sing ich sanft im Stile Zarah Leanders
Doch ich kann das auch anders!

Wir können auch anders!
Wir können auch anders!
Wir können auch anders!

Du kennst unsere Musik
Und du weißt, wie wir uns nennen
Und das ist auch der Grund
Warum du glaubst, uns zu kennen
Die nette deutsche Drei-Mann-Hiphopkapelle
Schublade auf, Brote rein und abgestempelt auf die Schnelle
Nein, mein Freund, so einfach ist das nicht
Denn jeder von uns trägt auch ein anderes Gesicht
Schicht für Schicht für Schicht
Und so manches sieht man auf den ersten Blick nicht
Man kann nicht immer so sein, wie es andere erwarten
Denn wenn man immer so wär, müsste man sich selbst verraten
Beraten kann ich dich in dieser Hinsicht nicht
Ich sage nur schlicht: Richtig ist deine Sicht nicht
Dicht ich, dann hat das seinen Grund
Denn eingeschränkt zu leben ist ungesund
Und ist jemand der Meinung, uns zu gut zu kennen
Sei sicher, dass wir auch anders können!

Jetzt ist aber Schluss! Zurück, Vollgas!
Wir können auch... anders!

Wir können auch anders!
Wir können auch anders!
Wir können auch anders!
Wir können auch anders!","https://genius.com/Fettes-brot-wir-konnen-auch-anders-lyrics","Released May 12, 2000
Featuring

    
      Beginner, Der Tobi, Der Tobi & das Bo & 2 more
Producers

    
      André Luth & Fettes Brot
Copyright ©

    
      Intercord Ton GmbH & Yo Mama’s Recording
Distribution

    
      Indigo Musikproduktion + Vertrieb GmbH & Intercord Ton GmbH
Label

    
      Yo Mama’s Recording"
"32","Fettes Brot","Schwarzbrot-Weißbrot","Fettes brot fur die welt","Wacht auf, ihr Brote!
Schwarze, Weiße, Braune, Grüne, Gelbe, Rote
Der Bote mit der besonderen Note
Renz sagt allen Fans, was man unbedingt wissen muss:
Faschismus ist bloß der Gipfel des Rassismus
Die wer beginnt mit all den kleinen Schweinereien
Von einigen, die meinen, nur mal gemein zu sein
Doch im Hinterstübchen ist
Was ihr seit Kindertagen wisst:
Der Schwarze ist ein Neger, der Weiße ein Rassist – Beschiss!
Kinder, hört nicht auf die Alten
Lasst eurer Meinung Zeit, sich selbst zu entfalten
Die Bräune gibt nur an, wie lang ein Brot gebacken war
Gar oder weniger – schaut auf den Charakter!
Beurteilt ne Person nicht von vornherein schon
Nach Aussehen, Hautfarbe oder Religion
Denn Pizza, Tacco, Döner, Sandwich, Troc, oder Cräcker
Die schmecken alle lecker, denn uns backt der selbe Bäcker

Schwarzbrot, Weißbrot
Schwarzbrot, Weißbrot
Weißbrot, Schwarzbrot
Scheiß auf den Farbcode!

Auf der Welt sind nur Brote und Brot für die Welt
Und deshalb haben wir beim Bäcker fette Brote uns bestellt
Doch die Farbe unserer Wahl ist bei Hautfarbe uns egal
Weil ich beim Malen eines Menschen mit bunten Farben mal
Aber neulich traf ich einen, ich konnt nicht drüber lachen
Wir standen vor der Disco und er wollte mir weismachen:
""Weiße sind aufgrund ihrer Farbe einfach besser
Als diese Negertypen – alles Menschenfresser!""
Der Kerl war der Türsteher, das hatte ich nicht gesehen
Er sagte: ""Hunde und Neger bleiben draußen stehen.""
Für mich war damit klar, hier gehöre ich auch nicht hin
Obwohl ich weder ein Hund noch ein schwarzer Mensch bin
Find ich's wichtig zu zeigen, dies Verhalten ist nicht richtig
Und deshalb dicht ich
Denn dies ist nicht Amerika, wie ihr sicher wisst
Doch warum müssen wir so werden wie Amerika schon ist?!

Schwarzbrot, Weißbrot
Schwarzbrot, Weißbrot
Weißbrot, Schwarzbrot
Scheiß auf den Farbcode!

Zusammen, zusammen – nicht gegeneinander
Egal ob schwarz, ob weiß, ob Kind, ob Frau oder Mann
Ja, mit Hass und Gewalt kann man nur verlieren
Ich sing's so lang, bis auch die Dümmsten es kapieren
Hier ist König Boris und ich rappe nicht für Geld
Sondern über eine Sache, die mir gar nicht gefällt
Und das ist ""Urteile fällen nach Farben im Gesicht.""
Der Mensch steht im Mittelpunkt, was anderes zählt hier nicht
Denn keiner hat das Recht, Menschen zu verachten
Nicht zu akzeptieren, nur von außen zu betrachten
Es ist das Recht eines jeden, in Würde zu leben
Und es darf in diesem Fall keine Ausnahmen geben
Doch es gibt immer noch Menschen, die das Ganze nicht verstehen
Und blind durch die Welt der bunten Backmischungen gehen

Und zum Schluss noch einen Satz an euch vom Fetten Brot:
Ob Weißbrot, ob Schwarzbrot – Scheiß auf den Farbcode!","https://genius.com/Fettes-brot-schwarzbrot-weibrot-lyrics","Released May 12, 2000
Featuring

    
      Beginner, Der Tobi, Der Tobi & das Bo & 2 more
Producers

    
      André Luth & Fettes Brot
Copyright ©

    
      Intercord Ton GmbH & Yo Mama’s Recording
Distribution

    
      Indigo Musikproduktion + Vertrieb GmbH & Intercord Ton GmbH
Label

    
      Yo Mama’s Recording"
"33","Fettes Brot","Tschüssikowski Hardcore","Fettes brot fur die welt","""Jetzt mal los.""
""Ja. Tschüssikowski Hardcore!""","https://genius.com/Fettes-brot-tschussikowski-hardcore-lyrics","Released May 12, 2000
Featuring

    
      Beginner, Der Tobi, Der Tobi & das Bo & 2 more
Producers

    
      André Luth & Fettes Brot
Copyright ©

    
      Intercord Ton GmbH & Yo Mama’s Recording
Distribution

    
      Indigo Musikproduktion + Vertrieb GmbH & Intercord Ton GmbH
Label

    
      Yo Mama’s Recording"
