"";"artist";"title";"album";"text";"url";"metadata"
"1";"Hannes Wader";"Wo ich herkomme";"Sing";"Schon als ich noch jung war tat ich selten was ich sollte
Aber nicht weil ich dass was ich sollte nicht tun wollte
Konnte nur nicht den Erwartungen entsprechen die
Andere an mich hatten konnte ich auch später nie

""Der Bengel landet noch mal in der Gosse"", diesen Satz
Sprach Onkel Heinz, er selbst hatte einen Logenplatz
Und zwar als Pförtner in der Backpulverfabrik
Von Dr. Oetker, damals machte ich Strassenmusik

Also fast schon in der Gosse, doch ich hätte es nicht mal
Gemerkt wenn ich abgestürzt wäre, auch egal
Denn die Fallhöhe für einen aus der Unterschicht
Wie mich wäre zu gering gewesen, tiefer ging's ja nicht

Wo ich herkomme dahin gibt es für mich kein zurück
Vom Leben an fremde Ufer gespült bin ich zum Glück
Nie zu hart gestrandet, doch auch nie wirklich gelandet
Und zuhause gefühlt hab ich mich nie wo ich auch war
Das ist OK so, damit komme ich klar

Z.B. einer der für Niedriglohn und im Akkord
In Werkskantinen Zwiebelringe schneidet bleibt oft dort
Hängen mir erlaubt mein eigener Werdegang den Schluss
Dass einer der von unten kommt nicht unten bleiben muss

Wer gleich mir einer bildungsfernen Schicht entstammt
Kann sagen wir mal durchaus beim Katasteramt
Auch als Sachbearbeiter es zu etwas bringen
Oder in der freien Wirtschaft so wie ich mit Singen

Doch wenn du glaubst du kannst dich über andere erheben
Deine Herkunft bleibt dir immer an den Hacken kleben
Irgendwas irgendwer und wenn du selbst es bist
Wird schon dafür sorgen dass du es niemals vergisst

Niedere Abkunft saugt sich an dir fest wie feuchter Lehm
Zieht alles runter was nach oben will und außerdem
Liegt auf der Unterschicht dem Bodensatz der Welt
Das ganze Gewicht der Oberschicht, denn die stellt

Sich nicht etwa gleichrangig neben andren Klassen auf
Wie wir glauben sollen, nein, sie legt sich auf die unteren drauf
Wie es schon der Name sagt, sonst wäre sie ja nicht
Die Ober- sondern nur 'ne Seiten oder Nebenschicht

Wer von unten kommt wird dabei gleich doppelt abgebügelt
Doch wer oben ist wird von seiner Herkunft noch beflügelt
Über sich nur noch Gott und dessen Handynummer auf
Kurzwahltaste, wenn er Lust hat drückt er drauf

Wo ich herkomme dahin gibt es für mich kein zurück
Vom Leben an fremde Ufer gespült bin ich zum Glück
Nie zu hart gestrandet, doch auch nie wirklich gelandet
Und zuhause gefühlt hab ich mich nie wo ich auch war
Das ist OK so, damit komme ich klar

Dann die schönen reichen Frauen, sanfte Stimme nie laut
Ihr Lachen klingt wie Musik, der Glanz auf ihrer Haut
Ein Schimmer wie Perlmutt, grad bei gedämpftem Licht
Wie ein schein von Innen aus der subkutanen Unterschicht

Für immer jung, sie lassen, zeigen sich die ersten Falten
Gleich ihr Äußeres von Grund auf umgestalten
Von den angesagten Stars der Schönheits-Chirurgie
Virtuosen am Skalpell meist setzen die

Ihre Botox Injektionen punkt genau
So glaubt jede noch so Welterfahrene und reife Frau
Im Begriff stramm auf die 95 zuzugehen
Für die nächsten 50 Jahre wie 30 auszusehen

Auch meine Nichte Inge wollte sich endlich mal den Traum
Von einer kleinen Korrektur im Mund- und Rachenraum
Den Wangenknochen, Kinnpartien und auch am Nasenbein
Erfüllen und das sollte weil sie arm ist billig sein

In so 'nem fall wäre ein Chirurg der Spezialist
Für Nasen-Hasen-Scharten und für Gaumenspalten ist
Die beste Wahl doch ist sie an einen geraten
Der macht sein Geld fast nur mit Brustimplantaten

Und anstatt ihr zu sagen: ""Tut mir leid ich kann nur Titten""
Hat er ihr den Kiefer aufgesägt und sich total verschnitten
Sein Rest-Honorar treibt er trotzdem bei ihr ein
Obwohl jeder der sie sieht denkt: ""Oh Gott, Frankenstein""

Wo ich herkomme dahin gibt es für mich kein zurück
Vom Leben an fremde Ufer gespült bin ich zum Glück
Nie zu hart gestrandet, doch auch nie wirklich gelandet
Und zuhause gefühlt hab ich mich nie wo ich auch war
Das ist OK so, damit komme ich klar

Um den Kontakt zur Oberschicht hab ich mich nie gerissen
Wollte nie, wie man so sagt, mit den größeren Hunden pissen
Auf Empfängen findet man mich mehr so ausersehen
Schon mal mit 'nem Sektglas in der Hand in 'ner Ecke stehen

Sehen die Konzern- und Banken-Chefs, Politiker im Saal
Mich im dunklen Bläser-Einstecktuch, Krawattenschal
Die Gewerkschafts-Ehrennadel am Reveer
Wissen sie gleich auf die Frage: ""Wo kommt der denn her?""

Die Antwort, aber ich meinerseits, ich frage mich
Woran erkennen die sich untereinander eigentlich
Sogar noch nackt in der Sauna und schon auf den ersten Blick
Keine Ahnung wenn du's weißt, verrat' mir doch den Trick

Es heißt, die Arbeiterklasse ist ja auch nicht mehr
Das was sie mal war, ich weiß nur ich komme daher
Ich glaub ja nicht das ich noch mal auf meine alten Tage
In der Gosse lande und ganz unten hart aufschlage

Weiter rauf geht's aber auch nicht und jetzt sitze ich
Zwischen allen Stühlen, doch noch immer fühl ich mich
Euch den Unterschichten nah so dass ich mich weiterhin
In den Kampf für euer Recht auch von dort, wo ich jetzt bin

So lange und so gut ich kann einmischen werde
Seid ihr doch die Verdammten aber auch das Salz der Erde
Auch wenn ihr mir manchmal tierisch auf den Senkel geht
Gilt euch meine Treue meine Solidarität

Wo ich herkomme dahin gibt es für mich kein zurück
Vom Leben an fremde Ufer gespült bin ich zum Glück
Nie zu hart gestrandet, doch auch nie wirklich gelandet
Und zuhause gefühlt hab ich mich nie wo ich auch war
Das ist OK so, damit komme ich klar
Das ist OK so, damit komme ich klar";"https://genius.com/Hannes-wader-wo-ich-herkomme-lyrics";"Released 2015
Produced by

    
      Hannes Wader & Ben Ahrens
Mixed By

    
      Ben Ahrens
Mastered by

    
      Chris von Rautenkranz
Mastered at

    
      Soundgarden Tonstudio, Hamburg
Mixed At

    
      Blue Noise Studio, Hamburg
Recorded At

    
      Clouds Hill Studio, Hamburg
Writers

    
      Hannes Wader"
"2";"Hannes Wader";"Alles nur Schein";"Sing";"Ganz von wildem Wein überwachsen liegt
Dort der Brunnen im Schatten der mächtigen Linde
Wohl schon seit germanischen Zeiten wiegt
Sie sommers ihren grünen Wipfel im Winde
Verwunschen, wie von guten Geistern bewacht
Atmet der Ort einen so tiefen Frieden
Fern von Unglück und Not, so als hätte die Macht
Des Bösеn diesen Hof von jehеr gemieden
Heitere Stille, nur der leise Gesang
Des Baches unter den Erlen, sie säumen
Seinen Lauf am Fuße der Hügel entlang
Hier leben, so wohnen, davon kann man nur träumen

Nein, nein, nein
Nichts hier ist das, was es vorgibt zu sein
Fall nicht drauf rein
Alles nur Schein, Schein, Schein

Damals wurden hier Russen, so wird es erzählt
Im Krieg von dem Bauern mit Peitschenhieben
Und Fusstritten bis aufs Blut gequält
Zur Zwangsarbeit auf die Äcker getrieben
Die Gefangenen haben ihn dann umgebracht
Ihm zuvor noch Jauche in den Schlund gegossen
Ihn dann in den Brunnen geworfen, den Schacht
Mit Schweinemist aufgefüllt und verschlossen
In dem Brunnen liegt, unbeweint und verflucht
Tief unten der Bauer, für immer verschwunden
Man hat später gar nicht erst nach ihm gesucht
Hätte ihn wohl auch nicht gern wiedergefunden

Und der älteste Sohn trat sein Erbe an
Hat sich an der eigenen Tochter vergangen
Zeugte ein Kind mit ihr und hielt sie dann
Lange mit ihrem Sohn in dem Haus gefangen
Als er alt wurde, zahlte sie es ihm zurück
Sperrte ihn ein, gab ihm kaum zu essen
In Hungerfantasien träumte er von dem Glück
Sich im Stall mit den Schweinen am Trog satt zu fressen
Hat zu fliehen versucht, schaffte es jedenfalls
Fast blind eines Nachts raus ins Freie zu taumeln
Und sein Sohn sah ihn, mit 'nem Strick um den Hals
Tot und schon kalt in der Thing-Linde baumeln

Nein, nein, nein
Nichts hier ist das, was es vorgibt zu sein
Fall nicht drauf rein
Alles nur Schein, Schein, Schein

Auch die Tochter starb, nun gehört das Haus
Ihrem Sohn - oder sollte ich Bruder sagen?
Ein Neo-Nazi, baut alles um, macht daraus
Ein Kampftrainingscamp. Jetzt eben tragen
Männer panzerbrechende Munition
Raus auf den Hof, wieder andere schaffen
Noch mehr Kriegsgerät ran. Ein Teil davon
Sind Granaten, Geschütze und Handfeuerwaffen
Ich glaube, dass hier in den Büschen noch
Viel mehr ""Arier"" auf der Lauer liegen
Ich mache mich vom Acker, gern würden die doch
Mal so einen wie mich vor die Flinte kriegen

Es wird Nacht, ich umgehe im Dämmerlicht
Weiträumig, leise die Bewegungsmelder
Quer durch den Mais, der steht hoch und dicht
Dann durch die Weizen- und Roggenfelder
Tief bücken sich die Ähren im Abendhauch
Als ob - bildlich geseh'n - sie den Hut vor mir zögen
Als kröchen sie am liebsten vor mir auf dem Bauch
Doch sicher nicht, weil sie mich so toll mögen
Alles Täuschung und Lüge, nein, ich darf hier
Einfach keinem trau'n - nein, nicht mal den Ähren
Die buckeln doch vor jedem, nicht nur vor mir
Auch wenn es Nazis und Kinderschänder wären

Nein, nein, nein
Nichts hier ist das, was es vorgibt zu sein
Fall nicht drauf rein
Alles nur Schein, Schein, Schein";"https://genius.com/Hannes-wader-alles-nur-schein-lyrics";"Released 2015
Produced by

    
      Hannes Wader & Ben Ahrens
Mixed By

    
      Ben Ahrens
Mastered by

    
      Chris von Rautenkranz
Mastered at

    
      Soundgarden Tonstudio, Hamburg
Mixed At

    
      Blue Noise Studio, Hamburg
Recorded At

    
      Clouds Hill Studio, Hamburg
Writers

    
      Hannes Wader"
