"";"artist";"title";"album";"text";"url";"metadata"
"13";"Kay One";"Unsterblich";"Der junge von damals";"[Hook: Phillipe Heithier]
Heute nacht sind wir unsterblich
Wir reiten ohne Zügel los
Gesucht und gefährlich
Wir sind ein Sturm, der auf den Straßen tobt
Wir sind jung und verwegen
Uns gehört die ganze Stadt
Wir spielen ohne Regeln
Wir woll'n mehr, wir sind noch lang nicht satt
Wir sind unsterblich
Ja, wir sind unsterblich
Ja, wir sind unsterblich
Ja, wir sind unsterblich
Auch wenn nur diese eine Nacht

[Part 1: Kay One]
Ich mach heute nacht das, was ich will
Ich hatt' die Vision und erschaffe das Bild
Ruf meine Kumpels, und wieder geht's ab
Begleitet vom Mond, oh, wir lieben die Nacht
Ab in den Smog, die Straßen sind leer
Wir fahren umher
Ohne ein Ziel, doch wir lieben die leuchtenden Tankstell'n
Grade noch mehr als den Stress im Alltag
Und diesen Chef, der uns unterdrückt
Viele werden verrückt auf der Suche nach Glück
Bald hat jeder von uns seine Jugend vermisst
Mist, Mist gebaut ohne nachzudenken
Und genau so muss der Abend enden
Heut nacht ist alles egal wie bei The Purge, lasst uns gar nicht wenden
Rein in diesen Spätkauf, heute nacht nehm' ich alles mit
Und ganz egal, was wir heute erleben, Bruder, behalt's für dich
Unaufhaltbar wie ein Sturm, der durch die Straße tobt
Betrunken und die Augen sind ferrarirot

[Hook: Phillipe Heithier]
Heute nacht sind wir unsterblich
Wir reiten ohne Zügel los
Gesucht und gefährlich
Wir sind ein Sturm, der auf den Straßen tobt
Wir sind unsterblich
Ja, wir sind unsterblich
Ja, wir sind unsterblich
Ja, wir sind unsterblich
Auch wenn nur diese eine Nacht

[Part 2: Kay One]
Ich skippe den Tag und liebe die Nacht
Deutschland, eure Vampire sind wach
Deutschland, eure Vampire sind wach
Mal gucken, ob ich es aufs Titelblatt schaff
Ich kenn keine Regeln und kenn keine Grenzen
Diggah, was für Konsequenzen
Nie wieder sind wir so jung wie heute Nacht, Mann
Ich drücke aufs Gas und mich kann keiner bremsen
Bemale die Wände mit all meinen Logos
Beschmiere Politiker-Poster
Wir sind niveaulos, woher kommt die Aggression bloß?
Spaß haben der Fokus
Denn wir handeln unüberlegt
Deshalb wird alles in Trümmer gelegt
Smile now, cry later, da rüberklettern, um schwimmen zu geh'n
Mann, als wir Kinder war'n, war jede Nacht wie heute nacht
Vielleicht waren wir jung und dumm, aber dieses Feuer wurd' neu entfacht
Wir sind nicht gebor'n, um zu sterben
Sondern gebor'n, um zu leben, also lasst uns leben

[Hook: Phillipe Heithier]
Heute nacht sind wir unsterblich
Wir reiten ohne Zügel los
Gesucht und gefährlich
Wir sind ein Sturm, der auf den Straßen tobt
Wir sind unsterblich
Ja, wir sind unsterblich
Ja, wir sind unsterblich
Ja, wir sind unsterblich
Auch wenn nur diese eine Nacht";"https://genius.com/Kay-one-unsterblich-lyrics";"Released September 2, 2016
Distributor

    
      Tonpool Medien GmbH
Copyright ©

    
      Prince Kay One GmbH
Phonographic Copyright ℗

    
      Prince Kay One GmbH
Label

    
      Prince Kay One GmbH
Cover Design

    
      Mikkansy
Artwork

    
      Eric Ullrich
Executive Producer

    
      Kay One
Featuring

    
      Al-Gear, Brandon Beal, Faydee & 5 more
Producers

    
      Gorex
Writers

    
      Alex Dehn, Al-Gear, Brandon Beal & 8 more
Composer

    
      Alex Dehn, Gorex, Mario Winans & 1 more
Copyright ©

    
      Prince Kay One GmbH"
"14";"Kay One";"GTA";"Der junge von damals";"[Intro]
„Hm, Hallo?“
„Yo, Digga, Kay, wo bist du, Mann?“
„Alter, geh mir nicht aufn Sack, Alter. Ich bin hier eingepennt, Mann, wat los?“
„Ja, ey, deine Perle steht total wütend vorm Studio, was hast du gemacht?“
„Alter“
„Soll ich die reinlassen oder?“
„Wie kann das, das kann doch überhaupt nicht sein, Alter. Normalerweise piepst das auf meiner Uhr, wenn sie die Küche verlässt. Ich hab' da wie so Sensoren an ihr'm Fuß!“
„Hahahahahahahaha“
„Haha“

[Hook]
Wie Waffe entsichert, Jacke von Yigga
Ab in die Küche, back mir 'ne Pizza
Ich kack' auf euch Schwuchteln, wer kann mich batteln?
Ich werd' mein Bitch an die Herdplatte fesseln
Und zähl' nicht nach
Ich geb' es aus und leb' wie'n Star
Du Nutte heulst wie bei Tränengas
Wer ich bin? Der von GTA – nur in Reallife

[Part 1]
Welche von den Bitches juckt es, ob du BWL studierst?
In deinem Alter hab' ich mein'n ersten CL foliert
Ich check' bei Autoscout die Autos und bestell' sie mir
Blick auf meine Kühlerhaube, kennst du diesen gelben Stier?
Ah, doch erzähl mir nichts von hartem Leben
Mein Geschichtslehrer dürfte heute meine Straße fegen
Frag jeden, ich bin authentisch, Digga
So krass braungebrannt, ich seh' aus wie ein Ficker
Was wollt ihr Rapper? Macht mir bloß nicht auf Swagger
Wer ist Meister Proper? Ich bin 'ne millionenmal fresher
Fresher, ich kack' Minzblätter
Bei dir steht „Caritas-Restware“ im Sweater
Bitch, better have my money, aber mach hier nicht auf dicke Hose
Beim Fußballspiel'n miete ich die Loge
Fick die Mode, gib die Kohle
Ich spuck' dem Bankdirektor ins Gesicht, quatsch nicht, putz die Krone

[Hook]
Wie Waffe entsichert, Jacke von Yigga
Ab in die Küche, back mir 'ne Pizza
Ich kack' auf euch Schwuchteln, wer kann mich batteln?
Ich werd' mein Bitch an die Herdplatte fesseln
Und zähl' nicht nach
Ich geb' es aus und leb' wie'n Star
Du Nutte heulst wie bei Tränengas
Wer ich bin? Der von GTA – nur in Reallife

[Part 2]
Komm, mach hinne, spring auf dein'n Müllwagen
Große Fresse, aber hinterher nach einem Bild fragen
Jetzt wird rasiert, Digga, Glattrasur
Ich mach' von mir selbst eine lebensgroße Wachsfigur
Lieb' die Seychell'n, zahl' mit lilanem Geld
Minus zehn Grad, Bitch, doch ich frier' nicht im Pelz
Die berühmten Hotels der Welt hab' ich schon durch, Bitch
Italien ist kein Urlaub, für mich ist das wie ein Kurztrip
Lauf' mit Baseballschläger in dein'n Plattenlabel
Fluch' auf jedem Song, doch bekomme meine Hot-Rotation
Ihr wollt faken? Wir ficken euch im Reallife
Rappe über deine Zahnlücke, wenn ich freestyle
Steig' in den Jeep ein, dreh' 50 Cent auf
Asozial, mich schmeißen sie aus dem Event raus
Was kann ich dafür, wenn ich nicht in das Bild pass'?
Der Fernsehstar, jetzt wird deine Milf nass

[Hook]
Wie Waffe entsichert, Jacke von Yigga
Ab in die Küche, back mir 'ne Pizza
Ich kack' auf euch Schwuchteln, wer kann mich batteln?
Ich werd' mein Bitch an die Herdplatte fesseln
Und zähl' nicht nach
Ich geb' es aus und leb' wie'n Star
Du Nutte heulst wie bei Tränengas
Wer ich bin? Der von GTA – nur in Reallife

";"https://genius.com/Kay-one-gta-lyrics";"Released September 2, 2016
Distributor

    
      Tonpool Medien GmbH
Copyright ©

    
      Prince Kay One GmbH
Phonographic Copyright ℗

    
      Prince Kay One GmbH
Label

    
      Prince Kay One GmbH
Cover Design

    
      Mikkansy
Artwork

    
      Eric Ullrich
Executive Producer

    
      Kay One
Featuring

    
      Al-Gear, Brandon Beal, Faydee & 5 more
Producers

    
      Gorex
Writers

    
      Alex Dehn, Al-Gear, Brandon Beal & 8 more
Composer

    
      Alex Dehn, Gorex, Mario Winans & 1 more
Copyright ©

    
      Prince Kay One GmbH"
"15";"Kay One";"Eingetauscht";"Der junge von damals";"[Hook,Michelle Mendes]

Schatz du hast mich eingetauscht
Gegen all das was du brauchst
Dein Erfolg und deine Frauen
Heute wachst du ohne mich auf
Sah dir all das wird zu viel
Bitte sag mir was das wird
Man liebt in Leben nur einmal
Und das wirst du jetzt lern'

[Part1, Kay One ]

Behalt die Frau die bei dir war als du noch gar nichts hattest
Denn solche Frauen würden auf Stars und all die Partys kacken
Eine die von Herzen lacht
Wenn sie mit deiner Mama chillt
Eine die nicht einen reichen Bastard in 'nem Anzug will
Glaub mir
Ich hab so eine gehen lassen
Lern aus meinen Fehlern
Man
Dafür könnt ich mich für ewig hassen
Heut' bin ich im Regen ich fühl mich einfach stehen gelassen
Dabei war es meine Schuld Baby ich wollt' nichts verpassen
Der Mensch ist so
Hast du etwas gutes dann willst du etwas besseres und bis dann auf der suche
Du tauscht deine Frau für's Leben gegen eine Hure
Und schmeißt eine weiße Rose weg gegen eine Blume
In 'ner Beziehung will man Freiheit
Doch ist man endlich frei hat man Angst vor den allein sein
Das ist keine Weisheit
Am Ende geht's uns allen gleich
Schatz schmeiß mein Herz ruhig weg ich behalte deins

[Hook,Michelle Mendes]

Schatz du hast mich eingetauscht
Gegen all das was du brauchst
Dein Erfolg und deine Frauen
Heute wachst du ohne mich auf
Sah dir all das wird zu viel
Bitte sag mir was das wird
Man liebt in Leben nur einmal
Und das wirst du jetzt lern'

[Part2, Kay One ]

Wir sagen dass wir aus den ganzen Fehlern lernen
Doch wir lieben die Sünde
Ich kann's mir anders nicht erklären
Wir sind Engeln von Montag bis Donnerstag
Doch dann kommt der Freitag und Samstag
Und chillen wird verdammt hart
Partys, Alkohol und Spaß haben ohne Grenzen
Leb für den Moment der Rausch verdrängt alle Konsequenzen
Baby was hab ich getan
Ich war auf den graden Weg aber haben mich verfahren
Wunderschöne Frauen die von innen aber hässlich waren
Die sofort gegangen sind an den schlechten Tagen
Die meine Witze nicht mehr witzig fanden
Als ich kein Bock mehr auf shoppen hatte geht ihr verfickte Schlampen
Ich weiß nicht wo du heute bist
Ob nichts auf mich gibst
Und die alte Zeit vermisst
Und auch wenn's dich nicht juckt ich wollte mich bedanken
Heute kann ich sagen ich hab's verstanden

[Hook,Michelle Mendes ] 2X

Schatz du hast mich eingetauscht
Gegen all das was du brauchst
Dein Erfolg und deine Frauen
Heute wachst du ohne mich auf
Sah dir all das wird zu viel
Bitte sag mir was das wird
Man liebt in Leben nur einmal
Und das wirst du jetzt lern'";"https://genius.com/Kay-one-eingetauscht-lyrics";"Released September 2, 2016
Distributor

    
      Tonpool Medien GmbH
Copyright ©

    
      Prince Kay One GmbH
Phonographic Copyright ℗

    
      Prince Kay One GmbH
Label

    
      Prince Kay One GmbH
Cover Design

    
      Mikkansy
Artwork

    
      Eric Ullrich
Executive Producer

    
      Kay One
Featuring

    
      Al-Gear, Brandon Beal, Faydee & 5 more
Producers

    
      Gorex
Writers

    
      Alex Dehn, Al-Gear, Brandon Beal & 8 more
Composer

    
      Alex Dehn, Gorex, Mario Winans & 1 more
Copyright ©

    
      Prince Kay One GmbH"
"16";"Kay One";"One Day";"Der junge von damals";"[Intro: Faydee]
I´m trying hard to understand
How the world keeps spinning around while you´re not here with me
Didn´t had the chance to make it there
Couldn´t even say “good bye”, thought it last forever
Keep on praying, keep keep on praying, say we keep on praying for now
Say we keep on praying, keep keep on praying, say we keep on praying for now
And we will see each other again
One day we´re gonna understand it´s plans
Remember all the good times that we had and I promise, i´ll never forget you

[Verse 1: Kay One]
Ich blick in den Himmel und rede mit dir
Ich würd‘ es dir geben das Leben von mir
Ich kann‘s nicht verstehen und ich möcht es auch nicht
Dreh dich nicht um, lauf direkt in das Licht
Wir alle waren da, an deinem schneeweißen Sarg
Und trugen dich wirklich zu zehnt an dein Grab
Jeder war da, glaub mir jeder war da
So viele Fotos von dir und die Tränen sie kamen
Ich zählte nicht nach, so viele Kerzen am brennen
Du warst so ein herzlicher Mensch
Egal wo du warst, du hast Freude bereitet
Wolltest dich nie mit den Freunden drum streiten
Ich schreib hier die Zeilen, mit meinem Blut
Wer will mich trösten, nichts mehr ist gut
Nichts mehr wird so sein, wie es einmal war
Bitte bleib doch da

[Hook: Faydee] 2x
And we will see each other again
One day we´re gonna understand it´s plans
Remember all the good times that we had and I promise, i´ll never forget you

[Verse 2: Kay One]
Ich sitz am PC und seh diese Videos von uns
Und all unsere Songs hab‘ ich nie mehr gepumpt
Es zieht mich so runter es bringt mich nur um
Ich würd‘ gern weiterleben, doch find keinen Grund
Mir läuft´s eiskalt gerade den Rücken hinunter
Bald mach ich mir dein Tattoo auf die Schulter
Mit deinem Todestag
Man ich bete millionen Mal für dich, ich sterbe grad ohne Spaß
Wie oft hab‘ ich Gott gefragt und gehofft, dass er antwortet
Schmeiß mir ein Seil in das Loch, ich will raus
Alles erinnert an dich
Denk ich an gute Zeiten, verschlimmert es sich
Es tut weh, ich war für den Scheiß nicht bereit
Ich fahr durch die Nacht, verkneif mir das weinen
Vorbei ist die Zeit, als wir das Leben noch liebten
Ruhe in Frieden

[Hook: Faydee]
And we will see each other again
One day we´re gonna understand it´s plans
Remember all the good times that we had and I promise, i´ll never forget you

[Bridge: Faydee]
Why you have to go and leave me on my own
In my heart I know, the angels [?]

[Hook: Faydee]
And we will see each other again
One day we´re gonna understand it´s plans
Remember all the good times that we had and I promise, i´ll never forget you

[Outro: Faydee]
No I never forget you
No I never forget you";"https://genius.com/Kay-one-one-day-lyrics";"Released September 2, 2016
Distributor

    
      Tonpool Medien GmbH
Copyright ©

    
      Prince Kay One GmbH
Phonographic Copyright ℗

    
      Prince Kay One GmbH
Label

    
      Prince Kay One GmbH
Cover Design

    
      Mikkansy
Artwork

    
      Eric Ullrich
Executive Producer

    
      Kay One
Featuring

    
      Al-Gear, Brandon Beal, Faydee & 5 more
Producers

    
      Gorex
Writers

    
      Alex Dehn, Al-Gear, Brandon Beal & 8 more
Composer

    
      Alex Dehn, Gorex, Mario Winans & 1 more
Copyright ©

    
      Prince Kay One GmbH"
"17";"Kay One";"Dagobert Duck";"Der junge von damals";"[Part 1]
In der linken Hand mein Glas, Digga, in der rechten Hand mein'n Schwanz
So viel Geld, dass Leute mein'n, ich wohn' direkt in einer Bank
Fick' ganz Deutschrap, weil mir all die Rapper leid tun
Meine Uhr zeigt keine Zeit, meine Uhr zeigt meinen Reichtum
Swag wie ein verfickter Millionär
Ich hab' in der Stadt gewohnt, doch wohne inzwischen auf 'nem Berg
Shit, die Btiches kommen her, fick' sie wie ein Pferd
Ich bin echt genervt, Baby, ganz schnell zurück an deinen Herd
Du bist wer? Geh dich erstmal vorstell'n im Bordell
Du supportest Rapper, das ist schön, ich support' Geld
Yeah, braune Scheine, grüne Scheine, gelb und lila
Bin Neanderthaler, zauber' aus dem Tigerfell ein T-Shirt
Digga, ich bin Swag sein Vater
Mein Kleiderschrank so groß wie ein komplettes Zara
Ich bin King, weitersagen, Weiber müssen weiterblasen
Jede Nacht wach' ich auf und denk' mir, es ist Heilig Abend

[Pre-Hook]
Mein erstes Auto war ein Lamborghini (Lamborghini)
Die Sitze schwarzweiß wie ein verdammter Schiri (Schiri)
Ich lauf' in den Club, zieh' mich an wie Breezy
Leandro Lopes, Bitch, was für Yeezys?

[Hook]
Yeah, wir sind jung und wir hab'n ausgesorgt
Ich hol' im Urlaub zehn Riesen aus den Shorts
Zwanzig Topmodels grad auf der Yacht
Und aus Kay One wurde jetzt Dagobert Duck

[Part 2]
Deine Bitch wird geknackt
Deutscher Rap ist wie ein Crip (wie ein Crip), ich bin Blood
Und ich gebe kein'n Fick (kein'n Fick), was ihr macht
Mann, ich nenne meine Nerven Tick, Trick und Track
Mann, ich chille nur im Golfclub, deine Bitch macht mir nix vor
Düsseldorf, Hyatt Hotel, ich chill' im Aventador
Ich hab' grad Bock, mit Schlagstock die Szene zu zertrümmern
Deutsche Rapper drohen sich, doch ich seh' sie nur twittern
Lass mich im California jetzt durch die Lobby fahr'n
Und hinter mir steht der ganze Swarovski-Clan
Es geht von Kitzbühel bis raus in die Welt
Und meine Bude sieht schon aus wie'n Hotel
Mann, ich fick' dich auch ohne Beat
Ich bin fly wie ein Kolibri, echtes Cash, scheiß auf Monopoly
Lass uns Poker spiel'n, Treffpunkt Vegas
Kein Schulabschluss, doch mehr Cash als meine Lehrer

[Pre-Hook]
Mein erstes Auto war ein Lamborghini (Lamborghini)
Die Sitze schwarzweiß wie ein verdammter Schiri (Schiri)
Ich lauf' in den Club, zieh' mich an wie Breezy
Leandro Lopes, Bitch, was für Yeezys?

[Hook]
Yeah, wir sind jung und wir hab'n ausgesorgt
Ich hol' im Urlaub zehn Riesen aus den Shorts
Zwanzig Topmodels grad auf der Yacht
Und aus Kay One wurde jetzt Dagobert Duck

";"https://genius.com/Kay-one-dagobert-duck-lyrics";"Released September 2, 2016
Distributor

    
      Tonpool Medien GmbH
Copyright ©

    
      Prince Kay One GmbH
Phonographic Copyright ℗

    
      Prince Kay One GmbH
Label

    
      Prince Kay One GmbH
Cover Design

    
      Mikkansy
Artwork

    
      Eric Ullrich
Executive Producer

    
      Kay One
Featuring

    
      Al-Gear, Brandon Beal, Faydee & 5 more
Producers

    
      Gorex
Writers

    
      Alex Dehn, Al-Gear, Brandon Beal & 8 more
Composer

    
      Alex Dehn, Gorex, Mario Winans & 1 more
Copyright ©

    
      Prince Kay One GmbH"
"18";"Kay One";"Denkmal";"Der junge von damals";"[Hook: Michelle Mendes]
Alles, was ich wollte, war ein Denkmal setzen
Redet, was ihr wollt, ich kenn' mich selbst am besten
Ein Leben voller Tiefen, später kam'n meine Höh'n
Lag am Boden und sagte, ihr werdet noch seh'n
Gott hat ihn geschrieben, diesen Weg und ich geh'
Solange weiter, bis ich keinen Regen mehr seh'
Alles, was ich wollte, war ein Denkmal setzen
Alles, was ich wollte, war ein Denkmal setzen

[Part 1: Kay One]
Es kommt mir noch wie gestern vor, meine ersten Tracks im Ohr
Kein Label wollt' mich sign'n und ich bekam indirekt ein'n Korb
Ich weiß, du willst es hör'n und du hast recht, ich komm' aus dem Dorf
Und trotzdem wollt' ich's schaffen, Mama, du weißt es, ich hab' drauf geschwor'n
Du willst es allen zeigen, wenn keiner an dich glaubt
Ich hab' Gedanken über die Welt und dacht' mir, schreib sie einfach auf
Versuch' dort hinzukomm'n, wo vor dir kein Mensch war
Ich hatt' 2Pacs Album und dachte mir, zieh dir seine Worte rein vorm Schlaf
Das ganze Leben bleibt ein Battle, nicht nur meine Freestylesessions
Hab' die Presse so gehasst, wie oft erwisch' ich sie beim Hetzen
Du versuchst Musik zu machen, doch sie woll'n die Schlagzeil'n lieber
Journalisten interessiert's nicht, ob ich mal ein Arbeitstier war
Freunde wurden Feinde, wer hat meinen Traum schon ernst genomm'n?
Deshalb glaub' ich heut nicht, dass ihre Glückwünsche von Herzen komm'n
Mann, alles, was ich mach', mach' ich für meine Fans, weil sie es schätzen
Hab' nur diesen Wunsch, dass sie mich nie vergessen

[Hook: Michelle Mendes]
Alles, was ich wollte, war ein Denkmal setzen
Redet, was ihr wollt, ich kenn' mich selbst am besten
Ein Leben voller Tiefen, später kam'n meine Höh'n
Lag am Boden und sagte, ihr werdet noch seh'n
Gott hat ihn geschrieben, diesen Weg und ich geh'
Solange weiter, bis ich keinen Regen mehr seh'
Alles, was ich wollte, war ein Denkmal setzen
Alles, was ich wollte, war ein Denkmal setzen

[Part 2: Kay One]
Das Leben bleibt 'ne Achterbahn, erst geht es hoch, dann kommt der Fall
Doch nur deine Familie hilft dir, nicht auf den Beton zu knall'n
Autos, Schmuck, Geld und Bitches, 5-Sterne-Hotels und Blitzlicht
Alles kommt, alles geht, doch mir sind nur meine Eltern wichtig
Sie war'n da, als gar nichts da war, mein Zuhause ist mir heilig
Dorthin kehre ich zurück, wenn alles wieder viel zu heiß ist
Wenn mir dieser Scheiß zu viel wird, ja, ich weiß, ich wollt' das hier
Doch manchmal ist es hart und man verliert die Kontrolle hier
Ich bin durch diesen Regen durch und die Hölle kenn' ich längst
Und das Gefühl zu sterben, wenn man noch an einem Menschen hängt
Sie woll'n nicht mit dir tanzen, wenn es stimmt, aber mit dir chill'n
Wenn bei dir die Sonne scheint, mit dem Erfolg kommt der Neid
So viel Videos abgedreht, so viel Alben rausgebracht
Viele Shows gespielt, ich lieb' die Bühne und ich brauche das
Denn alles, was ich mach', mach' ich für meine Fans, weil sie es schätzen
Hab' nur diesen Wunsch, dass sie mich nie vergessen

[Hook: Michelle Mendes]
Alles, was ich wollte, war ein Denkmal setzen
Redet, was ihr wollt, ich kenn' mich selbst am besten
Ein Leben voller Tiefen, später kam'n meine Höh'n
Lag am Boden und sagte, ihr werdet noch seh'n
Gott hat ihn geschrieben, diesen Weg und ich geh'
Solange weiter, bis ich keinen Regen mehr seh'
Alles, was ich wollte, war ein Denkmal setzen
Alles, was ich wollte, war ein Denkmal setzen

";"https://genius.com/Kay-one-denkmal-lyrics";"Released September 2, 2016
Distributor

    
      Tonpool Medien GmbH
Copyright ©

    
      Prince Kay One GmbH
Phonographic Copyright ℗

    
      Prince Kay One GmbH
Label

    
      Prince Kay One GmbH
Cover Design

    
      Mikkansy
Artwork

    
      Eric Ullrich
Executive Producer

    
      Kay One
Featuring

    
      Al-Gear, Brandon Beal, Faydee & 5 more
Producers

    
      Gorex
Writers

    
      Alex Dehn, Al-Gear, Brandon Beal & 8 more
Composer

    
      Alex Dehn, Gorex, Mario Winans & 1 more
Copyright ©

    
      Prince Kay One GmbH"
"19";"Kay One";"Tomorrow Is Never Coming";"Der junge von damals";"[Hook: Michelle Mendes]
Let's live tonight like tomorrow's never coming
Coming, coming, tomorrow's never coming
Let's live tonight like tomorrow's never coming
Coming, coming, tomorrow's never coming
Let's live tonight like tomorrow's never coming
Coming, coming, tomorrow's never coming
Let's live tonight like tomorrow's never coming
Coming, coming, tomorrow's never coming
Let's live tonight like tomorrow's never coming

[Part 1: Kay One]
Ich steig' aus dem Flieger, chill' dann am Strand
Bin hier zum Abstürzen, film uns nicht, Mann
Lass uns wieder durchdreh'n, trinken, kack drauf
Und alle meine Jungs leih'n sich heute Quads aus
Dicke Ärsche, sexy Möpse
Gelbe Lambos, Verdeck geöffnet
Spring' vom Fenster in den Pool rein
Hauptsache, vor allen Weibern cool sein
Yeah, wir sind vom selben Stern, Baby
Und jetzt pass mir den Belvedere, ey
Gib was ab von dem Moloko, Bro
Die Sonne habt die gleiche Farbe wie ein Wodka-O
Ah, Sommer, die geilste Zeit
Jet-Ski, du weißt Bescheid
Ich bleib' dabei

[Hook: Michelle Mendes]
Let's live tonight like tomorrow's never coming
Coming, coming, tomorrow's never coming
Let's live tonight like tomorrow's never coming
Coming, coming, tomorrow's never coming
Let's live tonight like tomorrow's never coming
Coming, coming, tomorrow's never coming
Let's live tonight like tomorrow's never coming
Coming, coming, tomorrow's never coming
Let's live tonight like tomorrow's never coming

[Part 2: Kay One]
Minibar leer, also Kiosk stürm'n
Pose am Strand immer wie ein Tier
Sixpack, bitte komm und crem mich ein
Wer die Frau bekommt, werden wir noch seh'n, Einstein
Yeah, ich genieß' das
Leben, jeden Tag am Strand Shisha
Egal, ob Lloret, Malle, Ibiza
Ich komm' mit der Fähre und knall' dich im Siebener
Schnelle weiße Motorboote
Instagram-Chicks oben-ohne
So viel Kohle wie ein Bergwerk
Bitches fragen immer, wo kommt dieser Millionär her?
Jungs und Mädels
Glaubt mir, ich brauch nicht rumzureden
Das wird der Sommer unsres Lebens

[Hook: Michelle Mendes]
Let's live tonight like tomorrow's never coming
Coming, coming, tomorrow's never coming
Let's live tonight like tomorrow's never coming
Coming, coming, tomorrow's never coming
Let's live tonight like tomorrow's never coming
Coming, coming, tomorrow's never coming
Let's live tonight like tomorrow's never coming
Coming, coming, tomorrow's never coming
Let's live tonight like tomorrow's never coming

[Bridge: Michelle Mendes]
Party 'til the mornin', 7 a.m.
Can't get enough, they keep on watchin' where us been
You get your drink, we got bottles
Rich as fuck, but still in college
We party 'til the morning like, hate me, I live my life
Spread my wings, I wanna fly, yes, I wanna fly
Let me feel the summer breeze, feelin' like I'm on the beach
Yeah, we keep it real

[Hook: Michelle Mendes]
Let's live tonight like tomorrow's never coming
Coming, coming, tomorrow's never coming
Let's live tonight like tomorrow's never coming
Coming, coming, tomorrow's never coming
Let's live tonight like tomorrow's never coming
Coming, coming, tomorrow's never coming
Let's live tonight like tomorrow's never coming
Coming, coming, tomorrow's never coming
Let's live tonight like tomorrow's never coming

";"https://genius.com/Kay-one-tomorrow-is-never-coming-lyrics";"Released September 2, 2016
Distributor

    
      Tonpool Medien GmbH
Copyright ©

    
      Prince Kay One GmbH
Phonographic Copyright ℗

    
      Prince Kay One GmbH
Label

    
      Prince Kay One GmbH
Cover Design

    
      Mikkansy
Artwork

    
      Eric Ullrich
Executive Producer

    
      Kay One
Featuring

    
      Al-Gear, Brandon Beal, Faydee & 5 more
Producers

    
      Gorex
Writers

    
      Alex Dehn, Al-Gear, Brandon Beal & 8 more
Composer

    
      Alex Dehn, Gorex, Mario Winans & 1 more
Copyright ©

    
      Prince Kay One GmbH"
