"","artist","title","album","text","url","metadata"
"19","Fettes Brot","Rock Mic’s (Remix)","Fettes brot fur die welt","[Sample]
The Remix

[Chorus:]
Wir werden jede Party rocken, ne?
Immer mit dem Herzen dabei wie Artischocken, ne?
Junges Gemüse und auch harte Brocken, ne?
Wir machen euch schön feucht wie Vatis Socken, ne?
""Ja, das rockt""

[Strophe I:]
Boa, watt'n Schietwetter
Mach' den Beat fetter
Sag' ich, als ich den Jeep kletter
Und dieses Lied schmettеr
Ja, et Cetera
Allе sind da
Der Star ist die Mannschaft
Mit Spannkraft
Wie Dreiwetter Taft brettern wir durch Die Landschaft
Es ist so eng im Bus
Daß man drängeln muss
Wo sind wir eigentlich hier?
Das hätt' ich auch gern mal gewußt
Mit krummen Rücken und mit blauen Flecken
Kommen wir zwei Stunden zu spät zum Soundchecken
Eins, zwo, eins, zwo
Hans und Jörn
Könnt Ihr mich hören?
Auf Mein Mikro
Keine Piepshow
You gotta let it burn
Und die Zuschauer kommen alle in die Halle und rennen zur Bühne
Unsere Nerven liegen blank wie mit ohne Sensodyne
Schnell nochmal gepieschert
Verdammt, wo ist mein Lieblings-T-Shirt?
Jetzt sollten wir nicht mehr warten
Auf Worte folgen Taten
Aufgeregt machen wir uns auf den Weg
Und mein Herz weitet sich zu einem saftigen Steak

[Chorus:]
Wir werden jede Party rocken, ne?
Immer mit dem Herzen dabei wie Artischocken, ne?
Junges Gemüse und auch harte Brocken, ne?
Wir machen euch schön feucht wie Vatis Socken, ne?
""Ja, das rockt""

[Strophe II:]
Guten Abend, meine Damen und Herren
Wir haben euch gern
Wenn ihr unten mit uns seid, make some Motherfuckin' Lärm
Ohrenbetäubend
Fettes Brot ist die geborene Boyband
""Nein, hört bloß nicht auf zu rocken""
Wir lieben den Jubel
Den Trubel
Bis zur Heiserkeit
Und wir sind froh, wenn ihr am Ende der Show kein bißchen leiser seid
Tolle Gigs voller Tricks wie brasilianischer Fußball
Flach spielen, hoch gewinnen; Der Rest ist Zufall
Abrakadabra, dreimal Muskelkater, ein Cleveres Wechselspiel
Aus Klamauk und Sexappeal
Der Beat vom Band brennt
Ohne Band
Wir brauchen keine schlaffen Mucker
Rabauke gibt dem Affen Zucker, Motherfucker
Der eine geht ab, der andere Schaut bloß zu
Wir kriegen Gänsehaut When the crowd goes ""u-hu-hu""
So, das war's, gut Nacht allerseits
We live to love and we Love to rock mic's

[Chorus:]
Wir werden jede Party rocken, ne?
Immer mit dem Herzen dabei wie Artischocken, ne?
Junges Gemüse und auch harte Brocken, ne?
Wir machen euch schön feucht wie Vatis Socken, ne?
""Ja, das rockt""

[Strophe III:]
Pitschplatsch naß wie 'ne Pampers
Jedes Baby Kennt das
Und noch viel Krasser Wasser
Macht alles nasser, ne?
Im frischen Wohlfühlpulli erstmal 'n Gang runterschalten
Und zur Überleitung mit 'ner Schülerzeitung unterhalten
Ende im Gelände
Schluss für Heute, Leute
Die Band Ihres Vertrauens verläßt Jetzt das Gebäude
Eine letzte Frage doch noch: Wo wollt ihr denn hin?
Wir wollen in's Hotel Motel, Holiday Inn
Nach'm Duschen
In Puschen
Und Pyjama. Endlich wird's romantisch
Am Himmel strahlt ein Sternenmeer
Glücklich und zufrieden liegen wir im Bett
Es läuft Bananarama und wir flirten mit der
Bedienung - vom Fernseher
Am nächsten Morgen fällt das Frühstück flach; Kommt schon mal vor
Weil wir weiter wollen
Auch mit geschwollen-en
Augen,wie Rocky Bal-boah watt'n Schietwetter
Mach' den Beat fetter
Sag' ich, als ich in den Jeep kletter
Und dieses Lied schmetter","https://genius.com/Fettes-brot-rock-mics-remix-lyrics","Released May 12, 2000
Featuring

    
      Beginner, Der Tobi, Der Tobi & das Bo & 2 more
Producers

    
      André Luth & Fettes Brot
Copyright ©

    
      Intercord Ton GmbH & Yo Mama’s Recording
Distribution

    
      Indigo Musikproduktion + Vertrieb GmbH & Intercord Ton GmbH
Label

    
      Yo Mama’s Recording"
"20","Fettes Brot","Kleines Kind (Demo)","Fettes brot fur die welt","Wenn meine welt in flammen steht
Sich mein leben nicht auf 45 und nicht auf 33 dreht
Dann kommt sie zurück die zeit
In der das kind in mir schreit und bitterlich weint
Dann such' ich einen schoß, der warm ist
Eine hand, die einen hält, wenn man fällt
Die bedingungslos da ist
Doch suchen heißt nicht finden
Und ich merke, wie die bretter unter meinen füßen schwinden
Und dann kommt er - dеr freifall gratis
Der flug ist umsonst, weil dеr aufprall zu hart ist
Du spürst den flug, den wind und dann kommt die angst
Und auf einmal wird dir klar
Dass du nicht mehr stoppen kannst
Du fällst und du fällst immer schneller
In ein tiefes schwarzes loch
Es wird nur dunkler und nicht heller
Dann liegst du am boden, und es ist still
Und du weinst wie ein kind, das zu seiner mami will
Nie mehr kind, nie mehr klein, nie mehr unschuldig sein
Jetzt hab' ich diese angst und ich kann mich nicht befreien
Noch einmal die last von den schultern
Noch einmal das wissen, ich bin nicht schuld dran
Noch einmal das gefühl, das ich verlor

[Chorus:]
Es kommt schon vor, da wünscht' ich
Ich wäre wieder ein kleines Kind

[Strophe II:]
Was ist bloß mit mir los?
Ich fühle diesen großen kloß in meiner kehle
Ich zähle quälende stunden, minuten und sekunden
Meine seele ist elendig geschunden
Freunde, wo seid ihr? Bleibt hier und erkennt
Ihr seid mein fundament, meine 100 prozent
Nah den tränen
Sehn ich mich nach jenen tagen, in denen
Ich in gummistiefeln im regen lief
Fröhlich und naiv, auf wolken schlief
Wieviele spiele haben wir zusamm' gespielt?
Verdammt, sag mir, warum unsere liebe nicht hielt
Tagtäglich standst du früher vor meiner tür
Und nachträglich dank ich dir dafür
Es ist schwer zu beschreiben
Ich wollte ewig dein herzbube bleiben
Doch jeder kroch in sein loch
Verschlossen und verschwiegen
Und da liegen wir immer noch
Heute nach so einer langen zeit
Bleibe ich gefangener meiner vergangenheit

[Chorus]

[Strophe III:]
Ich bin so müde, so schläfrig
Doch bleibe ich wach und schwer
Treibe schwach umher
Wie ein tier im käfig
Entziehe ich mich der schranken
Fliehe in gedanken
Zurück als ich noch ein kind war
Nachts ruhig schlief
So naiv und unwissend blind war
Wie einfach muss alles wohl gewesen sein
Meine welt hatte ordnung und war besenrein
Es ist umgekehrt
Ich leb' nicht mehr so unbeschwert
Hab erkannt
Dass diese freiheit im alltag verschwand
Und am ende wende ich mich wieder problemen zu
Denn ich schätz
Ich leb nicht in der vergangenheit sondern jetzt
Ich bin so müde, habe schwere lider
So schlaf ich ein und wünsche mir
Ich wäre wieder ein kleines kind

[Chorus]","https://genius.com/Fettes-brot-kleines-kind-demo-lyrics","Released May 12, 2000
Featuring

    
      Beginner, Der Tobi, Der Tobi & das Bo & 2 more
Producers

    
      André Luth & Fettes Brot
Copyright ©

    
      Intercord Ton GmbH & Yo Mama’s Recording
Distribution

    
      Indigo Musikproduktion + Vertrieb GmbH & Intercord Ton GmbH
Label

    
      Yo Mama’s Recording"
"21","Fettes Brot","Das Präteritum schlägt zurück","Fettes brot fur die welt","Alles im grünen Bereich heut' morgen, oh yeah

Moin moin, uah, es war schon neun Uhr
Wir wuchten und ruchten den Gestank der Natur
Jeder schrat von uns ins Bad für eine Rasur
Noch 'ne kleine Massur für die Nackenmuskulatur
Wir worden hungrig, rieften den Karpfenservice
Halbe bis dreiviertel Stunde
Uns zerloften im Wasser schon das Munde, Fische, gesunde
Doch der schreckliche Geruch much immernoch die Runde
Irgendwas stimmte nicht, irgendwer nimmte sich
Die Fernsehgangschaltung und knipste die hipste TV-Schau an
Wir zappten zu Käpt'n Mola
Der uns mit seinen braunen Cola-Augen anschote
Er much uns eindeutige Angebote
Wir haben uns reingesasst und fahrten nach Lanzarote
Die Fetten Brote auf Lanzarote
Plötzlich pizzte der Klingelmann - einmal, zweimal
Kein Karpfen war im Eimer
Stattdessen brang er dreimal Pizza Affenbrotbaum
Hey,hier riecht's ja wie im Kotraum
Haben wir auch schon bemurkt
Den ganzen Tag verzweifelt durch die Wohnung gegurkt
Doch niemand fund den Grund, doch niemand fund den Grund
Trotz alledem:

Alles im grünen Bereich heut' morgen, oh yeah

Hut ab und Gnulasch dem gesellschaftlichen Druck, kuck'
Quel bouquet, dans la WC, oje
Zermürbte Psyche, wir verlogten die Süche in die Küche
Noch mehr Gerüche, die Flüche, der Pharaonen, die bei uns wohnen
Süchten unser Heim heim diese Aromen kommt bestimmt nicht von allein ran
Nein, nein, sörry, don't wörry, it could be my Kartoffelbörry
Sörry, don't wörry, it could be my Kartoffelpörry
Hurry up, guys, ohne Fleiss kein Preis
Es flosste literweis' Schweiss auf der Suche nach dem Scheiss
Wir entdockten Schiffmeisters Cousin unterm Sofa
Mensch, ist doch viel zu eng hier, du Doofa
Naja, muss ja jeder selber wissen
Und nett wie wir sund giebten wir ihm dann 'n Kissen
Da frugten wir die Sphinx, warum es hier so stinkt
Hey, Jungs, das seid ihr, ich spendier' euch 'n paar Drinks
Jau, das bringt's mal wieder

Alles im grünen Bereich heut' morgen, oh yeah","https://genius.com/Fettes-brot-das-prateritum-schlagt-zuruck-lyrics","Released May 12, 2000
Featuring

    
      Beginner, Der Tobi, Der Tobi & das Bo & 2 more
Producers

    
      André Luth & Fettes Brot
Copyright ©

    
      Intercord Ton GmbH & Yo Mama’s Recording
Distribution

    
      Indigo Musikproduktion + Vertrieb GmbH & Intercord Ton GmbH
Label

    
      Yo Mama’s Recording"
"22","Fettes Brot","Meh’ Bier","Fettes brot fur die welt","Fettes Brot lässt heute wieder mal die Sau raus
Und wir basteln uns einen privaten SuperGAU aus
Hopfen und Malz: Gott erhalt'sdenn wenn
Das Brot mit Freunden feiert dann knallt's
Aufgedrehte Bässe n Pils in der Fresse
Feuchtfröhliche Nässe und bevor ich es vergesse
Ist der Ruf erst ruiniert lebt's sich gänzlich ungeniert
Wer die Party zelebriert hat das sowieso kapiert
Deswegen ist uns heute Abend alles scheissegal
Wie und wo wir feiern Hauptsache das Bier ist erste Wahl
Bezahlen tun wir später denn wir sind grade nicht flüssig
Doch des Feiern und des Bieres - noch lang nicht überdrüssig
Überschüssige Kraft umgesetzt in Gerstensaft
Jeder trinkt so lang und viel wie er eben schafft
Wir feiern laut und doll bis alle auf den Tischen springen
Und am Höhepunkt der Party fangen wir laut an zu singen

Mehr Bier - unser Lebenselexir
Mehr Bier - wozu sind wir sonst denn hier
Mehr Bier - weckt das Partytier in mir
Mehr Bier - denn ich bin der Biervampir

Mehr Bier - unser Lebenselexir
Mehr Bier - wozu sind wir sonst denn hier
Mehr Bier - weckt das Partytier in mir
Mehr Bier - denn ich bin der Biervampir

Schiffmeister ist im Haus
Und König Boris ist im Haus
Unser Mann Tobi ist auf Klo
UndRechtsanwalt Dr. Renzsowieso

Oh Ich bin am Pilse bügeln allein im Waschkeller
Such noch ne volle Knolle aber jemand war schneller
Herr Gastgeber noch n Lütten Stimmungsheber
Ich mach noch einen weg, hab ne Leber wie n Seebär
Ich staun denn die Frauen werden netter mit jedem Pils
Sach was du willst ich glaub ich bin in Beverly Hills
Jetzt gilts: I got fat skills dank des einen oder andern Promills
Vorm Haus in allen Winkeln stehn Leute und pinkeln
Fips hat wieder n Schwips und zitiert Abraham Lincoln
Um ihn herum entsteht Kuddelmuddel
Während ich im Sand nach ner Pfandbuddel buddel
Ich schwenke zur Tränke - äh - ich schwanke zur Tanke
Fünf Halbe fürs Sägewerk- Bitte - Danke
Kranke und Kinder zuerst ins Rettungsboot
BIERALARM - hier kommen Fettes Brot

Mehr Bier - unser Lebenselexir
Mehr Bier - wozu sind wir sonst denn hier
Mehr Bier - weckt das Partytier in mir
Mehr Bier - bevor ich hier was abmontier

Mehr Bier - unser Lebenselexir
Mehr Bier - wozu sind wir sonst denn hier
Mehr Bier - weckt das Partytier in mir
Mehr Bier - bevor ich hier was abmontier

He ihr - hä? - ich seh hier eine ganze Menge
Leute die wollen wie wir mehr Bier
Ich hol gerade Nachschlag ich Trunkenbold
Und komm mit einem dicken Fass jetzt auf euch zugerollt
Ich fühl mich richtig wohl mit ner Flasche
In der Hand - ich seh den Fisch hinter mir an der Wand -
Fand eine Bierdose muss ich doch mal gleich
Nippen - äh lecker,schmecker? - randvoll gefüllt mit Kippen
Kipp'n Inhalt ins Klo ich musste sowieso pissen
Nach soviel Bier tut das Not müsst ihr wissen
Schiffmeister mach meinem Namen Ehre entleere
Meine Blase und kehre um, um Musik zu hören
Und wage mich in den Kampf um die Stereoanlage
Ertrage schon seit Stunden schlechte Technomusik
GESCHAFFT - jetzt hörn wir mein Lied

Mehr Bier - unser Lebenselexir
Mehr Bier - wozu sind wir sonst denn hier
Mehr Bier - weckt das Partytier in mir
Mehr Bier - denn ich bin ein Biervampir

Mehr Bier - unser Lebenselexir
Mehr Bier - wozu sind wir sonst denn hier
Mehr Bier - weckt das Partytier in mir
Weil ich ein Bröööötchen bin

Ich sitz hier seit einer Weile ziemlich stumm
Allein um meine Stammtischrunde rum
Setzten sich da plötzlich drei Muskeltiere zu mir
Und bestellen beim Wirt mehr Bier
Meh’ Bier für die Runde, von der ich hier Kunde tu
Gieß’ noch mehr dazu; ich laß Dir keine Ruh
Wenn es um’s Trinken geht
Lass uns doch mal schauen, wer noch beim Hinken steht
Nach Schinken zu stinken ist der Wermutstropfen
Ich stink lieber nach Gerste, Malz und Hopfen
Wär’ste halt so’n Pfropfen auf der Flasche
Dann stiftest Du ungut Unmut
Mit Deiner Masche, denn ich erhasche Dich
Wenn Du die Flasche nicht an den Mund nimmst
Stimmt’s, daß Du ein BH bist -
Ein „Bierhalter"", der nach Stunden pro Halbe misst?
Bin kein Politiker,der sich am Buffett nährt
Doch ich fordere meh’ Bier, bis sich mein Magen umkehrt
Herr Ober, noch’n Pferd!","https://genius.com/Fettes-brot-meh-bier-lyrics","Released May 12, 2000
Featuring

    
      Beginner, Der Tobi, Der Tobi & das Bo & 2 more
Producers

    
      André Luth & Fettes Brot
Copyright ©

    
      Intercord Ton GmbH & Yo Mama’s Recording
Distribution

    
      Indigo Musikproduktion + Vertrieb GmbH & Intercord Ton GmbH
Label

    
      Yo Mama’s Recording"
"23","Fettes Brot","Schule der Gewalt","Fettes brot fur die welt","Er steht morgens früh auf und der Horror beginnt
Er muss Kämpfen in einem Kampf, den keiner gewinnt
Wie ein Soldat im Krieg der Sinnlosigkeit
Mit der Knarre und dem Messer, jetzt ist er bereit
Es geht los, es klingelt zur Pause
Nach der ersten Stunde läutet sie ein, die erste Runde
Es klopft ihm jemand auf die Schulter, nicht unbedingt ganz zart
Das Klopfen waren fünf Mark und er der Ziesenautomat
Und ihm ist klar, dass er nur ein Opfer war
Im Teufelskreis der Kindermafia
Aber es hat einfach keinen Zweck, neulich hat er sich geweigert
Nu ist die Jacke weg und die Schuhe versteigert
Als er dann was sagte, schlug der Kerl mit seinen Pranken drauf
Der Lehrer wusst von nix und er lag dann im Krankenhaus
Auch der Lehrer aus der Neunten hat noch nicht kapiert
Was an seiner Schule Tag für Tag so passiert

Ein Lehrer brachte einen Schüler zur Polizei
Wer hier wirklich regiert, brachten sie ihm sofort bei
Warum kein Schüler was sagte, hatte er nicht verstanden
Bis seine Kollegen ihn bewusstlos wiederfanden
Ein Schüler schoss mit Gas auf ein Kind
Er traf das rechte Auge und auf dem ist es jetzt blind
Auch ein Mädchen auf der Schule sieht jetzt ziemlich traurig aus
In der letzten grossen Pause kam sie aus dem Klo nicht raus
Die Jungs hatten ihren Spass und liessen sie dann liegen
Jetzt versucht der Seelenarzt sie wieder hinzukriegen
Auch ein anderer hat kein Glück gehabt
Am Montag letzte Woche holte ihn ein Notarzt ab
Sein Schutzgeld hatte er zu Haus vergessen
Erst gab´s Nierentritte, dann musste er Scheisse fressen
Manch einer wird sich fragen, wann platzt ihm denn der Kragen?
Denn es schlagen ihm die Dinge wortwörtlich auf den Magen
Doch warum sie sich so plagen, anstatt zu wagen was zu sagen
Die Leute anzuklagen, weil sie die Angst nicht mehr ertragen
Viele Schüler in Deutschland haben Angst
Was du an ihren ängstlichen Blicken sehen kannst
Doch sie schweigen weiterhin und die Waffen regieren
So wird man niemals stark, so wird man immer verlieren
Doch Tränen, Winseln, Schreien, das lässt sie alle kalt
Ja, so ist das Leben in der Schule der Gewalt

Tja, so ist das Leben in der Schule der Gewalt
Tja, so ist es eben in der Schule der Gewalt","https://genius.com/Fettes-brot-schule-der-gewalt-lyrics","Released May 12, 2000
Featuring

    
      Beginner, Der Tobi, Der Tobi & das Bo & 2 more
Producers

    
      André Luth & Fettes Brot
Copyright ©

    
      Intercord Ton GmbH & Yo Mama’s Recording
Distribution

    
      Indigo Musikproduktion + Vertrieb GmbH & Intercord Ton GmbH
Label

    
      Yo Mama’s Recording"
"24","Fettes Brot","Freak-A-Deli d’Amour","Fettes brot fur die welt","[Strophe I:]
Es ist wieder mal samstagmorgen und ich wache plö tzlich auf von einem klingeln an der tü r, doch ich mach mir da nichts draus. Ich bleibe besser liegen, ist mir eigentlich auch egal, aber nach tausendmal klingeln hab ich keine andere wahl. Vor der tü r steht 'n mann mit 'nem grauen kittel an, als er dann zu reden anfä ngt kann ich vage die lage erkennen, denn er ist der hausmeistеr und er sagt, wenn ich so ein' lä rm wiе letzte nacht noch einmal mach hä tte ich den letzten tag in dieser wohnung verbracht er meckert er kleckert nicht, er klotzt, er motzt, und ich hä tte ihm fast vor seine fü ß e gekotzt. Trotz alledem redet er immmer noch, und es wird schlimmer doch, nachdem ich in mein zimmer kroch, holt er eine flasche aus der tasche - einen flachmann ""prooost!"" - man versteht sich unter nachbarn. Er leert den schnaps mit einem schwung. Er sagt, er kö nnte mich verstehen, er war ja auch mal jung. Ganz vä terlich quä lt er mich mit einem schwank aus seinem leben. Das war zuviel fü r mich, ich muß mich ü bergeben daneben..., dabei war die party fett. Endlich ist der kerl gegangen und ich kann wieder ins bett. Das war alles nicht so schlimm, ich nehm' es mit humor, doch schlä ft es sich schlecht mit frikadelle am ohr

[Chorus:]
Baby, red' mir eine Frikadelle ans Ohr!

[Strophe II]
Oh, oh weia, was fü r eine feier, war ja die pest gestern nacht - erst um acht in der heia. Naja, es ging ganz sutsche los: um neun ging das geknutsche los. An meinem bier mich labend, freute ich mich auf den abend. Ich steh am bü fett, wobe ich chips aus meinem mund pule: ""hey - ist das nicht fips aus meiner grundschule!?!"" cool ey, wir stoß en an auf alte zeiten, leider lä ß t er sich dazu verleiten, nichtigkeiten zu verbreiten. Zu gescheiten kommentaren ist er offenbar nicht fä hig und eh ich einschlafe dann geh ich lieber - fieberhaft ü berlege ich, auf welchem wege ich diesen mann wieder loswerden kann. Er fragt mich nach aspirin - ma' sehen vielleicht hab' ich noch arsen fü r ihn. Er redet wie ein labersack nicht gerade interessant, dafü r aber schabernack - ohne sinn und verstand. Ich hasse leute, die nicht merken, wenn sie nerven, nur mit dichtungen von eigenen werken um sich werfen. Noch einen mucks und ich schicke ihn flugs mit dem fluxkompensator zurü ck in die vergangenheit wie michael j. Fox. Der typ ist doch dicht wie fort knox. Hö rt nicht auf zu texten. Ich merke schon, mir wä chst'n kropf am kopf. Mann, ich bin herbivor - ich eß kein fleisch, nimm das hack aus meinem ohr!

[Chorus:]

[Strophe III:]
Ich sitz grad' beim mittagessen, eß 'n leckeres gericht. Es klingelt laut an der tü r und ich erschrecke mich. Mittagessen in den augen richtig sehen kann ich nicht, mach die tü r auf, jemand drü ckt mir eine bibel ins gesicht. ""hallo, mein sohn. Ich wollte mit dir ü ber gott sprechen!"" und an dieser stelle wollt' ich das gesprä ch abbrechen, doch der typ redet weiter ü ber sein, ü ber schein, die mundwinkel voller schleim. Oh nein! Er kommt rein! ""sex vor der ehe, das ist sü nde mein sohn. Du sollst deine unschuld bis zur hochzeitsnacht schonen!"" er zeigt mir bü cher, bunte bilder mit bibeltreuen brü dern. Und er sagt zu mir: ""mein sohn, willst du ü berleben, muß t du mir etwas geben und gebete reden."" er redet ü ber engel, ü ber himmel, ü ber erde. Er redet ü ber frieden und wie ich erlö st werde. Er lä chelt mich an und sagt, wie glü cklich er ist und mir wird klar, der typ heiß t schmidt und ist christ. Und er redet und er redet und er redet und er redet und er redet und er liest mir etwas vor. Und weil er redet, weil er redet, weil er redet weil er redet, wä chst mir 'ne frikadelle am ohr. Und aufgrund dieser frikadelle hö r ich ihn seit stunden nicht, doch er redet und er redet und er redet und er redet. Er redet und ich werde ohnmä chtig

[Chorus]","https://genius.com/Fettes-brot-freak-a-deli-damour-lyrics","Released May 12, 2000
Featuring

    
      Beginner, Der Tobi, Der Tobi & das Bo & 2 more
Producers

    
      André Luth & Fettes Brot
Copyright ©

    
      Intercord Ton GmbH & Yo Mama’s Recording
Distribution

    
      Indigo Musikproduktion + Vertrieb GmbH & Intercord Ton GmbH
Label

    
      Yo Mama’s Recording"
"25","Fettes Brot","Sonntag","Fettes brot fur die welt","Es ist Sonntag ein Tag den ich gar nicht mag
Weil ich mich Sonntags viel zu viele dumme Fragen frag
Sonntags ist es ruhig und stillund ich weiß nicht wie und was ich machen will
Und dann kommen diese Fragen nach dem woher, wohin
War alles falsch oder richtig oder hat es keinen Sinn?
Bin ich wirklich das was ich meine zu sein
Oder besteht mein Welt nur aus Trug und Schein
Nein keine Frage soll mir heut den Tag versauen
Denk ich mir und geh in meine Träume abhauen
Auch dort ist keine Antwort auf die Fragen in Sicht
Tja, König Boris vielleicht gibt es die nicht
Kann schon sein doch sie sind ja da diese Fragen
Und manchmal kommt der Punkt da kann ich es nur noch schwer ertragen
Da möchte ich abhauen, mir meine Welt bauen
In den Süden reisen, mich nur umschauen
Ja oder Nein, Wahrheit oder Schein
Ist das wirklich alles oder kann da mehr sein
Wer weiß das schon doch das ist was ich so frag...Sonntag

Sieben Sinne sagen nein wenn ich aufwach
Und meine Augen ein wenig aufmach
Ein neuer Tag steht vor der Tür
Ich habe ein Gespür dafür es ist Sonntag
Und ich hass' alles das was ich sonst mag
Wiedermal Quelle der Qual, Terror total
Wenn ich mir ausmal das ich jede falsche Wahl irgendwann mal teuer bezahl
Langsames Zwängen im Gedränge der Welt
Wird es gelingen mich zum springen zu bringen für Geld?
Hält mein Anstand stand der Maschinerie?
Wie leist' ich geistige Autonomie?
Vielleicht flieh ich im Taxi aus unsrer Galaxie
Ich krieg´ es nicht hin mich heut zu besinnen
Und noch weniger kann ich mich Sonntags entspannen
Und bevor ich innerlich zu kochen anfang'
Geh ich pennen und freu´ mich auf den Wochenanfang

Manchmal habe ich Tage da möchte ich einfach Party machen
Möchte Hüpfen, Springen, Singen, Tanzen, Rappen oder Lachen
Manchmal habe ich Tage an denen das nicht geht
An denen die Zeit still steht sich alles im Kreis dreht
Wenn ich alleine vor mich hin Philosophiere
In 'ne Kerze Stiere, mich und mein Leben reflektiere
Bin ich nicht der Schiffmeister sondern einfach nur Björn
Möchte am liebsten nichts und niemanden hören
Vielleicht mag es für den einen oder anderen komisch klingen
Doch frag ich mich dann wo bin ich jetzt wo will ich hin
Auf welchem Wege möcht ich mein Ziel erreichen,muß ich dabei rennen
Oder will ich dabei schleichen.Die Weichen für sein Leben stellt man immer
Jetzt,wie man sich einschätzt.Entsetzt stellst du fest du hast keinen Test
Ob du andere verletzt,Prioritäten werden gesetzt von Entscheidungen gehetzt
Da bleibt dann wenig Zeit mit sich selber klarzukommen
Wie wirst du von dir selbst und von anderen wahrgenommen
Das war so ein Tag der für mich keinen Horizont hat
Das war das Ende des Sonntags","https://genius.com/Fettes-brot-sonntag-lyrics","Released May 12, 2000
Featuring

    
      Beginner, Der Tobi, Der Tobi & das Bo & 2 more
Producers

    
      André Luth & Fettes Brot
Copyright ©

    
      Intercord Ton GmbH & Yo Mama’s Recording
Distribution

    
      Indigo Musikproduktion + Vertrieb GmbH & Intercord Ton GmbH
Label

    
      Yo Mama’s Recording"
