"","artist","title","album","text","url","metadata"
"1","257ers","Komm sach ma","Tracksdienichtgutgenugfurdasneuealbumwaren ep","[Part 1: Keule]
Ich hab ne Schraube locker
Und nen Haufen Schotter
Aber klau den Wodka
Weil ich den Letzten ausgekotzt hab
Ich bin blau du Opfer
Wo ist das Problem?
Ich seh' das anders
Ich kann alles doppelt sehn' (doppelt sehn')
Pfoten hoch! Ich habe ne Wasserpistole (Pistole)
Mach jetzt besser keine Faxen du Homo (du Homo)
Und erzähl' mir nicht du hast keine Kohle
Denn ansonsten spritze ich dich nass
Ich hab grad erst Wasser nachgefüllt (nachgefüllt)
Ich ziele auf dein Namensschild
Gib' mir den Beat
Deine Braut tropft wie Waschlappen
Sie ist feucht wie im Regen, Radkappen
Ich bin auf Schore du Punk
Hab' meine Kohle verbrannt
Und habe plötzlich keine Hose mehr an
Ich bin,ich bin auf Schore du Punk
Hab' meine Kohle verbrannt
Und habe plötzlich keine Hose mehr a-an

[Hook]
Komm sach ma, wat is hier passiert? (Sag schon)
Ja, komm sach ma, wat soll ich den noch hier? (Was los?)
Komm sach ma, gibbet hier kein Alk?
Gibbet hier kein Alk? (Sag, sag schon)
Komm sach ma, wat is hier passiert? (Sag schon)
Ja, komm sach ma, wat soll ich den noch hier? (Was los?)
Komm sach ma, gibbet hier kein Alk?
Gibbet hier kein Alk?

[Part 2: Shneezin]
Ey, deine Tochter
Ist ne Hurensohntocher
Und deine Mutter mein Sklave
Weil sie mir Nudeln gekocht hat
Ey deine Crew ist ein Opfer. Uwe und Roger
Ihr gibt Sprudel in Wodka
Und fudelt bei Monopoly
Ich fudel beim Gotcha
Mit Kugeln im Koffer
Und shoot dir den Kopf ab (Bada-da-da-dam)
Ah, scheiß auf Parental Advisory
Ich bange deine Wife bei lebendigem Leib'
Und sie endet als Leiche
Wie es aussieht
Würd' ich mich als Gangster bezeichen
Ey ich.. (warte ma)
Ey ich brauch neue Lines, tausend neue Lines
Also sauf ich die Pulle aus
Und klau eure Lines
Haa, bin ich cool
Boa ist dat lustig
Ich habe IQ
Und du fährst im Bus mit
Und ich fahr' Auto..
Doch nich

[Hook]
Komm sach ma, wat is hier passiert? (Sag schon)
Ja, komm sach ma, wat soll ich den noch hier? (Was los?)
Komm sach ma, gibbet hier kein Alk?
Gibbet hier kein Alk? (Sag, sag schon)
Komm sach ma, wat is hier passiert? (Sag schon)
Ja, komm sach ma, wat soll ich den noch hier? (Was los?)
Komm sach ma, gibbet hier kein Alk?
Gibbet hier kein Alk?

[Part 3: Mike]
Ey du bist nicht Captain Future
Nicht Batman's Bruder
Und auch keine Leuchte
Wenn ich sag Deckenfluter
Aber du gehst ab wie die Uzi
Der Media Markt Azubi
An der Tanke gescheitert
Du bist ja nicht blöd ne
(Waaas?!)
Jetzt erzähl bitte keinem vom Pferd, ey
(Spaaast!)
Ich kann dich grad echt nicht ernst nehmen
(Laaass)
Das pinke Shirt und den Ghettoslang weg
Und versuchs nochmal
Denn ich bin eigentlich ganz nett
Und will euch auch nicht ärgern, Jungs
Erfülle dir deinen Sterbewunsch
Und komme nicht zu Beerdigung
Sehr gelungen
Wer Vernunft jetzt ich vernünftig [?]
Wir sind 257 du bist 0815
Hast dein ganzes Hab & Gut in einer Plastiktüte
Aber wir gucken von Oben auf dich, wie auf Glastischfüße
Das ist übel du kriegst massig Prügel
Während deine Frau bei mir zu Hause meine Sachen bügelt (Yeah)

[Hook]
Komm sach ma, wat is hier passiert? (Sag schon)
Ja, komm sach ma, wat soll ich den noch hier? (Was los?)
Komm sach ma, gibbet hier kein Alk?
Gibbet hier kein Alk? (Sag, sag schon)
Komm sach ma, wat is hier passiert? (Sag schon)
Ja, komm sach ma, wat soll ich den noch hier? (Was los?)
Komm sach ma, gibbet hier kein Alk?
Gibbet hier kein Alk?","https://genius.com/257ers-komm-sach-ma-lyrics","Released January 2009
Producers

    
      Beat Junkiez, Krizz Dallas & Marvelous Beats
Writers

    
      257ers, Keule257, Mike 257 & 1 more"
"2","257ers","Ich weiß es nicht","Tracksdienichtgutgenugfurdasneuealbumwaren ep","[Hook 2x]
Warum mach' ich das hier eigentlich?
Ich weiß es nicht
Was hab' ich von der Scheiße hier?
Ich weiß es nicht
Wofür zerbrech' ich mir den Kopf?
Ich weiß es nicht, ich weiß es nicht
Ich weiß es nicht

[Part 1: Shneezin]
Ey jo, guck mal wie aussiehst du
Aussiehst du denn
Ey wie alt bist du?
Acht? Ich bin auch neun, krass alter
Du willst rappen, ich bin ein erfahrener Junk und
Trage die gun im Wadenverband
Guck das Abendprogramm mit geblasenem Schwanz
Und du bist ne Schwuchtel
Stehst auf Wintersport, singst im Kinderchor
Und machst Sex mit Männern
Hässlichen Männern, sechs hässlichen Männern
So mit Tanga und Bierbauch

[Part 2]
Ich bin splitterfasernackt am Gedicht lesen
Und mein Pillemann wird gesuckt von so ein, zwei Gesichtsgrätschen
(Hää) nichts ich will nur grade über mich reden
Ich bin.. öhhm.. AKK
Ich bin [lebladen?] die grad neun sind, Shneezin nervt
Krieg deine Perle auf jeden Fall rum mit Maschinengewehr
Und eure Bitches werden uns bald ausnahmslos lieben
Denn ihr habt Ausschlag am Schniedel und wir haben South Park geschrieben

[Hook 2x]
Warum mach' ich das hier eigentlich?
Ich weiß es nicht
Was hab' ich von der Scheiße hier?
Ich weiß es nicht
Wofür zerbrech' ich mir den Kopf?
Ich weiß es nicht, ich weiß es nicht
Ich weiß es nicht

[Part 3]
Ich bin 'ne verlorene Seele, geboren im Mehl
Kill den Toten mit nem Sebel, knall mir Coke in den Schädel
Gib mir Vodka-O, versorg mit Drogen mein Leben
Vielleicht sollte ich lieber joggen, statt mir Schore zu geben
Zwei flaschen doppel Korn, eine Whisky-Cola Mischung
Ich fühle mich nicht wohl, ohne Alkoholvergiftung
Meine Leber macht die Scheiße nicht mehr lange mit
Dann mach ich halt alleine weiter, undankbares Stück

[Part 4: Slax]
{polnisch}
Nie gadaj mi kutasieZe ja [oszronialem?]Daj mi WodkeJa ci pokaze jak ja wiecej wypijeWidzisz tu moja sileJak ja wodke wypijeEj ja jestem narkomanem i co wieczor wale schizeStaje rano ""scakzet"" domie piszomMi to obojentnie bo ja sziedze sziszomWszyscy co mie nie nawidzom to zniknomTwarde zyczie, twarde jest hip hop

[Hook 2x]
Warum mach' ich das hier eigentlich?
Ich weiß es nicht
Was hab' ich von der Scheiße hier?
Ich weiß es nicht
Wofür zerbrech' ich mir den Kopf?
Ich weiß es nicht, ich weiß es nicht
Ich weiß es nicht","https://genius.com/257ers-ich-wei-es-nicht-lyrics","Released January 2009
Producers

    
      Beat Junkiez, Krizz Dallas & Marvelous Beats
Writers

    
      257ers, Keule257, Mike 257 & 1 more"
"3","257ers","Dein Arsch und mein Fuß","Tracksdienichtgutgenugfurdasneuealbumwaren ep","[Part 1: Shneezin]
(Wer ist hier der Chef im im Haus, hee)
(Brlililili, Shneezin 123, juhu)
Ey Hakuna Matata, ich bin cool und ich moonwalk dein Vater
Du schwuler Versager. Wieso du machst so, ich nicht weiß du Scheiße
Ich bin dauer drauf und laufe wie ein Pausen Clown nach Hause
Sitz zu Hause und draußen laufen Tausend von euch auf, eh
Ich laufe raus und hau euch haufenweise voll die Schnauze
Ey ich weiß wie du gebaut bist
Nicht gut, aber ganz nah am Wasser
Du hörst Lanz Hal und Ragger und Abba
Und ich fahre den Panzer manjaga, Malaka
Ey du triffst mich Nachts mit gelben Socken nackt
Wochentags, weil ich zu viel AKKtimel gesoffen hab
Und offenbar hast Du Spasti den Kopf im Arsch
Ehh und du kaufst dir jetzt ein Ticket
Denn ich bin der Busfahrer, ufftata
Ich komm mit Roskiben[?] und Mustafa
Schlagen dich kaputt, ja das muss harter Rap sein
(Muss harter Rap sein)

[Hook 2x]
Was willst du tun, was willst du tun, was willst du tun
Wenn dein Arsch und mein Fuß
Was willst du tun, was willst du tun, was willst du tun
Wenn dein Arsch und mein Fuß Party machen

[Part 2: Keule]
Ich bin blau geboren, sauf 'nen Korn
Wären dann auf meinem Konto keine Miese
Hätten sogar meine Kindeskinder ausgesorgt
Ich hab kein Benehmen, aber bin benommen
Deutsch 6 weil ich beim ABC nicht übers' B komme
Behindert, Bekloppt, Besoffen, Bete besser
Ein Box du bist Babynahrung von Alete Esser
Gib mir den Beat es lohnt nicht mehr für dich zu rappen
Kohle her
Ich habe keine Hose mehr und würde mir gern 'ne neue kaufen
Ich stech ins Rote Meer und es wird zum Toten Meer
Fazit: benutze beim Sex besser nie wieder dein Schrotgewehr
Nicht grade lobenswert, kann man noch mal drüber hinweg sehn
Ich ex den Vodka ich bin ehm real
Ey du kriegst 'nen miesen Klatscher
Und brauchst 'nen Dino Pflaster
Ihr seid alles Gangster weil die Mama keine Liebe hatte
Ich bin fies bewaffnet, aber hau dich nur
Ich bin übelst back, die Ausgeburt der Hölle!

[Hook 2x]
Was willst du tun, was willst du tun, was willst du tun
Wenn dein Arsch und mein Fuß
Was willst du tun, was willst du tun, was willst du tun
Wenn dein Arsch und mein Fuß Party machen","https://genius.com/257ers-dein-arsch-und-mein-fu-lyrics","Released January 2009
Producers

    
      Beat Junkiez, Krizz Dallas & Marvelous Beats
Writers

    
      257ers, Keule257, Mike 257 & 1 more"
"4","257ers","Hoodwatcher Skit","Tracksdienichtgutgenugfurdasneuealbumwaren ep","(Wriiing)(Wriiing)
Hallo?
Ja?
Ja, Ische...
Ja du weißt, dass ich deine Perle gefickt hab, ja und?
Du Hurensohn alter, weißt du was?
Deine Perle hat gesagt du bist nicht mehr gut also hab ich die genommen weißte
Und ehhm.. Um mal bei deiner Perle zu bleiben, die war gar nicht so
Also die sah scheiße aus aber egal gute Muschi ist immer besser du weißte
Du guckst auch nicht aufs' Gesicht, du guckst aufn Arsch und auf Muschis so
Also hab ich die einfach gefickt
Wenn du was dagegen hast alter meld dich bei mir
Ich töte dich alter","https://genius.com/257ers-hoodwatcher-skit-lyrics","Released January 2009
Producers

    
      Beat Junkiez, Krizz Dallas & Marvelous Beats
Writers

    
      257ers, Keule257, Mike 257 & 1 more"
"5","257ers","Wieder so ein Track ohne Sinn","Tracksdienichtgutgenugfurdasneuealbumwaren ep","[Part 1: Keule]
Check mal den ich sage
(*ding-dong*, ehhh)
Und reime darauf
(rim-rim *rübs*)
Tschuldigung, wollt ich nicht, war 'nen versehen
Ich Hacke mitnehm und lass hier und da mal ein stehn
Tja selbst Schuld Mutti
Aber das war die Bohnensuppe
Du servierst mir Bohnensuppe
Tu's und ich geb dir Bodensuppe
Lausche diesen herlichen Ton
Ich sag bio Apfel
Dat ist Keule AKK
Die lebendige Biowaffe
Jap ich sitz im Kino und ich breche die Stille (*rübs*)
Die Vorlage zu Tarental Filmen
Ich lass einen ziehn und empör deine Freunde
Mein Album ist geprägt von schlechtem Rap und Körpergeräuschen
Das ist wieder ein Track ohne Sinn (ohne Sinn)
Check mal den, mein After kann singen (kann singen)
Jap und wenn er will trifft er gekonnt alle Noten
Und ich geb Geräusche von mir wie Balance ohne Knoten

[Part 2: Shneezin]
Ey du hast engagiert und fleißig
Fanta vier und bleichkind
Wat Hansa-Bier ist scheiße
Ey ich Tanke vierunddreißig
Und randalier in Kneipen, du Arschloch
Ey guck wie ich deinen Vater schlage
Solange bis meine Hand aussieht wie eine Bananenschale
Und dieser Motherfucker heult wie eine Alarmanlage
Ihr seid Analakrobaten
Die in Sandalen rumlatschen
Ich hab Turnschuhe an
Geh auf Spurensuche
Und finde die Wurstbude dann
Und stell mich nur so mal an
Jap, Ey, pass mal auf
Meine, Meine Mutter sagt die Glotze macht blind
Ich guck ihr vors Kinn
Und sach, Mutter bleib mal locker du spinnst
Wat für blind, blind werd ich höhstens vom Alk
Ich bin eine böse Gestalt
Wat zwischen Pöbel und Gewalt (Gewalt)
Deine Bitch will in die Möse geknallt
Und macht dann Geräusche so wie Vögel im Wald","https://genius.com/257ers-wieder-so-ein-track-ohne-sinn-lyrics","Released January 2009
Producers

    
      Beat Junkiez, Krizz Dallas & Marvelous Beats
Writers

    
      257ers, Keule257, Mike 257 & 1 more"
"6","257ers","Du bist nicht der wir sind der Boss","Tracksdienichtgutgenugfurdasneuealbumwaren ep","[Intro]
Pah, Gangsterbeat
Ha, na hör mal
Haha das is aber 'n Gangsterbeat
Pah

[Part 1: Shneezin]
Bring deine Schmock und dein Block mit
Wenn ich Bock hab machst du Augen so wie Doktor Robotnik
Und ich die Glock an dein Kopp drück und dir locker vorn Kopp tritt
Mach deine Gang höchstens mit bei Top of the Pops, Bitch
Dat is Shneezin du Opfer
Und ich seh' mies aus weil ich zu viel Resident Evil gezockt hab
Nein mies aus weil ich zu viel Heroin aufgekocht hab
Komm verbiet mir den Vodka und ich gib dir 'n Boxer
Gib mir 'n Boxer und ich gib dir 'n Boxer, du bist 'n Opfer
Du bist nicht mal dat Geld wert dat deine Mum für dich bezahlt hat
Dat deine Mum für dich bezahlt, dat ist ein Wunder du Pfeife
Du schaffst es nicht mal von nem Berg 'n Klippe runter zu scheißen
Und anstatt runter zu schmeißen und dich als Tunte verkleiden
Machst du lieber den Mund zu sonst kommst du unter die Reifen
Warum ich Crews ficke? Nur so, ich bin Shneezin One und du bist ein Hurensohn
Du bist ein Hurensohn

[Hook 2x]
Du denkst du wärst der, der wir sind, doch du bist nicht der
Wir sind der Boss, wir sind der Boss, wir sind der Boss und du ein Rapper ja

Du denkst du wärst der, der wir sind, doch du bist nicht der
Wir sind der Boss, wir sind der Boss, wir sind der Boss und du ein Hurensohn

[Part 2: Keule]
Ey ich geh nicht zur Schule, geh nicht zum Auftritt
Wat ihr seht ist mein Double, Life is a Bitch
Ey ich gebe die Kugel es ist zu spät für die Buse
Ich hab täglich geblutet, aber das tut ja nichts zu Sache
Ey deine splitternackte Perle kriegt nen Cumshot
Und denkt sie ext 'ne 2 Literflasche ich geb dir 'n Fick du Affe
Was rhymt sich auf: Ich hab ne Wumme in der Hand
Es liegt dir auf der Zunge (joo), auf der Zunge wie mein Schwanz
Ey deine Mudder is 'n Countrystar, dein Vater fucking Funpirat
Ich geb dir 'n Mic, du machst 'n Backflip bis nach Santiba
Ich chill mich an die Bar, wat für Antifa
Reale Nigger finden in der Schwulwahl Akk an die Macht
Ey ich scheiß auf rappen, scheiß auf rappen
Ey mein Job ist besoffen sein, deiner mir den Wein ausschenken
Ihr sagt dat is kein Job, aber dat is mir egal Junge
Ich bin nicht Arbeitslos, ich mach Sozialstunden

[Hook 2x]
Du denkst du wärst der, der wir sind, doch du bist nicht der
Wir sind der Boss, wir sind der Boss, wir sind der Boss und du ein Rapper ja

Du denkst du wärst der, der wir sind, doch du bist nicht der
Wir sind der Boss, wir sind der Boss, wir sind der Boss und du ein Hurensohn

[Part 3: Mike]
Ich sag mal Simsalabim Abrakadabra, aber du bist ja immernoch da man
Rap braucht Abitur, was? Rap braucht bald 'nen Behindertenparkplatz
Ich geb Gas, weil ich die Scheiße so liebe
Und mach aus euch Streichelzootieren Reifenprofiele
Denn du bist nun Hauptberuflich nicht schwarz, Nebenberuflich Hurensohn
Wie man hört Shneezin es eben schon gesagt hat ""Nur so""
Wir schmeißen scheiße im Club, Brocken mit nem Umfang von nem Eishockeypuk
Ohne Leistungsverlust und deine Braut rennt oben ohne rum wie 'n Sightseeingbus
Und dat is ganz schön wat ekliges, versteht ihr des
Dat ist so wie Cumshots mit Syphilis wie Bankok und Neviges
Und ich gebe deiner Frau meinen Dick in den Mund bis sie denkt, dass das Kollegah ist, wa
Nein dat würd ich niemals tun, wie in Scheiße zu wühlen
Oder Intimrasuren, denn deine Freundin sieht aus wie hingeschissen
Und wir sind ähh Boss

[Hook 2x]
Du denkst du wärst der, der wir sind, doch du bist nicht der
Wir sind der Boss, wir sind der Boss, wir sind der Boss und du ein Rapper ja

Du denkst du wärst der, der wir sind, doch du bist nicht der
Wir sind der Boss, wir sind der Boss, wir sind der Boss und du ein Hurensohn","https://genius.com/257ers-du-bist-nicht-der-wir-sind-der-boss-lyrics","Released January 2009
Producers

    
      Beat Junkiez, Krizz Dallas & Marvelous Beats
Writers

    
      257ers, Keule257, Mike 257 & 1 more"
"7","257ers","Fick wer du bist","Tracksdienichtgutgenugfurdasneuealbumwaren ep","[Intro]
Jo, hier
Hehe 257ers oder meheahahe Akk
Dasisehdaisehhweißduehh
Mach mal fertig, haha juhu
Halt die Fresse

[Hook 2x]
{französisch}
S'il vous plaitNe parle pas avec moiHé, les gars, deux-cinq-sept sont les patronsTaisez vous et arretez avec caJe baise que tu es, baise, baise que tu fait

[Part 1]
Während ich mir J Joe gebe, mit Playboy Häschen
Musst du dir im DSF die Late-Show geben
Gaylord, rede
Und ich zermatsche dir den Kopf wie Play Doh Knete
Komm mir nicht mit deiner Hippi-Scheiße
Denn ab diesem Jahr bin ich die Nummer eins wie [tele?]
Ich verpass dir mit ner Motorsäge Mittelscheitel
Um aus deinem Schädel sowas ähnliches wie..
Gib mir den Beat und ich t-töte die Drums
Verkrüppel die Base, ich rap gewöhnlich auf Schranz
Ey ich scheiß auf Rappen, scheiß auf Rappen
Ey sachmal kommst du dir nicht blöd vor die ganze Zeit so'n scheiß zu rappen
Von wegen Ghetto und dat du kein Geld für Essen hast
Frag mich nur woher du dann dein Geld für dein Ketten hast
Für deine Kani Schuhe und dein pinkes Poloshirt
Ey du bist kein Gangster, du bist schwul

[Hook 2x]
{französisch}
S'il vous plaitNe parle pas avec moiHé, les gars, deux-cinq-sept sont les patronsTaisez vous et arretez avec caJe baise que tu es, baise, baise que tu fait

[Part 2]
Ey ich nehm deine Tochter mit ins Bett
Sie kriegt Wochentags mein Knochen, abends Sex
Und am Wochenende noch ne Esapent bis ihr Loch brennt
Wie nen Lockenstab im As
Und jetzt wasch deine Haare
Oder geh mir Hackfleisch braten Nutte
Du weißt warum deine Baggys Kackstreifen haben alter
Mach keine.. Faxen du Bastard
Du rappst über Nutten und Pfotzen
Toll ich rap unter Wasser
Und das ist hundertmal krasser
Und ich geb mir stundenlang hundertmal Crack als Muntermacher
Ey ich bin der Shneezin, dat ist kein Problem
Ich geb mir die Pulle vom Morgen schon um drei vor zehn
Und bin nüchtern
Jap weil ich nicht weiß dat ich besoffen bin
Renn' ich durch die Straßen nackt und scheiß dir in den Briefkasten
Ey, meine Jungs kommen mit Skimasken erschießen Spasten
Und klaun ihnen die Spielsachen
Ey, ich bin Sheezin One
Und du bist ein Hurensohn

[Hook 2x]
{französisch}
S'il vous plaitNe parle pas avec moiHé, les gars, deux-cinq-sept sont les patronsTaisez vous et arretez avec caJe baise que tu es, baise, baise que tu fait","https://genius.com/257ers-fick-wer-du-bist-lyrics","Released January 2009
Producers

    
      Beat Junkiez, Krizz Dallas & Marvelous Beats
Writers

    
      257ers, Keule257, Mike 257 & 1 more"
