"","artist","title","album","text","url","metadata"
"7","Farid Bang","Nicht vergessen","Blut","[Bridge]
You are just the kind of girlI always wantedWhen I was a little boyThink about being grown

[Part 1]
Ah, viele Frauen sitzen neben dir im SLSDoch welche Frau sitzt neben dir, liegst du am Sterbebett?(keine)
Hinter der harten Schale ist meistens ein Herz versteckt
Ich merke es, das zwischen uns ist mehr als Sex
Ich suchte dich in Clubs und ich suchte dich im Alk
Meinst du, Mandy ständ' zu Özil ohne Fußballergehalt? (eh-eh)Als Nächstes möchte sie paar Kinder von ihmDamit sie was zu posten hat im Insta-Profil
Beweg' mich in der Kälte, ich erzähle, was ich denke
Alle Frauen sind nicht gleich, nur das Benehmen ist dasselbe
Glaub mir, es lohnt sich, für die wenigsten zu kämpfen
Denn viele Mädchen sind geblendet vom Mercedes eines Fremden, ah
Manchmal denke ich an meine scheiß Ex
Und ihre Eltern, die lachten, weil ich kein Schweinefleisch ess'
Verkleidet als Frau, der Teufel möchte dich verführen
Denn Geld ist wie ein Gentleman - es öffnet viele Türen

[Hook]
Narben im Herzen, Narben in der Fresse
Ich hab' die schweren Tage nicht vergessen
Wär' nicht da, ohne zu kämpfen, ganz egal, wer dich jetzt testet
Ich hab' die schweren Tage nicht vergessen

[Bridge]
You are just the kind of girlI always wantedWhen I was a little boyThink about being grown

[Part 2]
Und viele Frauen sitzen neben dir im VIP
Doch welche Frau sitzt neben dir, wenn dich niemand liebt?
Bin nicht gegen Frauen, nein, ich habe kein Problem
Ich rapp' für die Frau, die mit dir durch harte Zeiten geht
Nicht die auf Partymeilen steht, im Abendkleid um 10
Nein ich rappe für die Frau, die deine Narben heilen will
Bist du fame steigen viele Bitches in dein BettDamit sie Interviews geben im InStyle-Heft
Hausfrau montags, Pornostar samstags
Und sie bewerten dich nach deiner Followeranzahl
Und kommst du an den Ort, an dem die Sonne nie scheint
Vergessen alle Frauen plötzlich Bonnie und Clyde
In 'ner besonderen Zeit, als ich noch kein Rapper war
Öfters in der S-Bahn saß, Geld nicht aus dem Fenster warf
Gab es in Clubs kein' Einlass für mich
Heute zahlen sie fünfstellig, wenn ich zwei Takte spitt'

[Hook]
Narben im Herzen, Narben in der Fresse
Ich hab' die schweren Tage nicht vergessen
Wär' nicht da, ohne zu kämpfen, ganz egal, wer dich jetzt testet
Ich hab' die schweren Tage nicht vergessen

[Bridge]
You are just the kind of girlI always wantedWhen I was a little boyThink about being grown

","https://genius.com/Farid-bang-nicht-vergessen-lyrics","Released May 27, 2016
Distributor

    
      Warner Music Group
Artwork

    
      ADOPEKID
Label

    
      Banger Musik
Copyright ©

    
      Banger Musik
Phonographic Copyright ℗

    
      Banger Musik
Featuring

    
      Al-Gear, Fat Joe, Jasko & 7 more
Producers

    
      Abaz, Bad Educated, B-Case & 11 more
Writers

    
      Abaz, Al-Gear, Bad Educated & 22 more
Composer

    
      Abaz, Bad Educated, B-Case & 11 more
Copyright ©

    
      Banger Musik"
"8","Farid Bang","Wer hat etwas anderes gesagt","Blut","[Part 1: Farid Bang]
Ey, zu viel Testo in der Jugend, kein Pesto in den NudelnKein Rechtsschutz, ich musste Gesetzestexte googeln
Sowas lernst du auf der Straße und es heißt:„Seine Mutter weint, bevor meine Mutter weint“
Fährst du 'nen schnelleren Wagen und machst dein Geld auf der StraßeSteigt die Wahrscheinlichkeit, dass dich deine Eltern begraben
Vito Corleone sagt: „Es gibt mehr als dieses Geld!“
Und deshalb lass' ich niemals jemand merken, was ich denk'
Und kommt der Tag, an dem du fast am Boden bist
Dann sei dir sicher: es gibt keinen Schatten ohne Licht!
Wenig Waffen ohne Griff, ich wollt' Diamantenketten
Mein Leben - Brustschwimmen im Piranhabecken

[Hook: Xavier Naidoo]
Ja, dieses Leben ist hart, aber wer hat etwas anderes gesagt?
Dieses Leben hier ist gut zu mir, so gut wie ich's gerade anvisier', ich arbeit' hier
Und ich lebe hier, Blut, Schweiß und Tränen, Schmerz in der Seele, alles Einfluss bei mir
Ich hab' subtrahiert und dividiert: wie viele andere sind schon längst abgeschmiert? Ja ...

[Part 2: Farid Bang]
Und wird es ernst, lassen deine Freunde dich im StichAuf dem Weg nach oben, wo dir keiner Räuberleiter gibt
Und steigst du aus einem neuen BMW ausBehaupten sie, du hättest deine Seele verkauft
Leider ist Opa gegangen, der Tod macht mir AngstIch lass' nur Sachen in mein Leben, von denen ich loslassen kann
Dieser Hype ist zwar enorm, doch diese Scheibe voller Zorn
Und wie Tony sagte: ich habe nur meine Eier und mein Wort!
Sie nennen dich Bruder, doch in schweren Zeiten
Waren sie nicht da wie das Mercedes-Zeichen
Wollt's nach oben schaffen, das Licht sehen, die Millionen machenDenn große Gebäude werfen große Schatten

[Hook: Xavier Naidoo]
Ja, dieses Leben ist hart, aber wer hat etwas anderes gesagt?
Dieses Leben hier ist gut zu mir, so gut wie ich's gerade anvisier', ich arbeit' hier
Und ich lebe hier, Blut, Schweiß und Tränen, Schmerz in der Seele, alles Einfluss bei mir
Ich hab' subtrahiert und dividiert: wie viele andere sind schon längst abgeschmiert? Ja ...

[Part 3: Farid Bang]
Zu viele Schlangen die kamen, ich war zu lange im Schlaf
Das Leben ist hart, aber wer hat etwas andres gesagt?
Mein halbes Leben auf der Überholspur
Zeit ist Geld und der Grund, weshalb ich über rot fuhr
Vieles falsch gemacht und meine Taschen wurden vollerZuhälterei - niemals! - Es passt nicht zu La Honda
Ich verkaufte mich nicht, brauchte nix außer 'nen Stift
Und war wie Religionen, denn nicht jeder glaubte an mich
Hab' für die Straße gerappt, alles auf 'ne Karte gesetzt
Das Blut, der Schweiß, die Tränen und die Narben sind echt
Geld, materielle Dinge und Glamour bedeuten nichtsAn dem Tag, an dem der Richter plötzlich Zeuge ist

[Hook: Xavier Naidoo]
Ja, dieses Leben ist hart, aber wer hat etwas anderes gesagt?
Dieses Leben hier ist gut zu mir, so gut wie ich's gerade anvisier', ich arbeit' hier
Und ich lebe hier, Blut, Schweiß und Tränen, Schmerz in der Seele, alles Einfluss bei mir
Ich hab' subtrahiert und dividiert: wie viele andere sind schon längst abgeschmiert? Ja ...

[Outro: Xavier Naidoo]
Dieses Leben ist hartAber wer hat etwas anderes gesagt?Ja, dieses Leben ist hartAber wer hat etwas anderes gesagt?Dieses Leben ist hartAber wer hat etwas anderes gesagt?Ja, dieses Leben ist hartAber wer hat etwas anderes gesagt? Ja ...","https://genius.com/Farid-bang-wer-hat-etwas-anderes-gesagt-lyrics","Released May 27, 2016
Distributor

    
      Warner Music Group
Artwork

    
      ADOPEKID
Label

    
      Banger Musik
Copyright ©

    
      Banger Musik
Phonographic Copyright ℗

    
      Banger Musik
Featuring

    
      Al-Gear, Fat Joe, Jasko & 7 more
Producers

    
      Abaz, Bad Educated, B-Case & 11 more
Writers

    
      Abaz, Al-Gear, Bad Educated & 22 more
Composer

    
      Abaz, Bad Educated, B-Case & 11 more
Copyright ©

    
      Banger Musik"
"9","Farid Bang","Alles hat sein Sinn","Blut","[Hook: Sample]I want to fly, can you take me far away?Give me a star to reach for, tell me what it takesAnd I'll go so high, I'll go so highMy feet won't touch the groundJust stitch my wings and pull the stringsI bought these dreams that all fall down

[Part 1: KC Rebell]
Yeah!
Ich kam hierher als Einwanderer
Mit dem Drang, etwas zu schaffen so wie kein anderer
Hing mit den Jungs ab ohne Sinn, doch spuckte dann Strophen hin
Und heute represent' ich dieses Von-unten-nach-oben-Ding
Damals mit Farid in Clubs gehangen wie ein Heckenpenner
Durch dieses Geld bei Banger haben wir heute 'nen selben Nenner
Selten Blender, echte Männer lassen Taten sprechen
Du willst in meinen Schuhen laufen - lass die Karten wechseln
Während du dein' Arsch nicht hochbekommst aus deinem Winterschlaf
Kenn' ich meine ganzen Angestellten nicht bei Namen
Und ich weiß, du kommst gerade nicht klar
Denn dein Jahresetat trag' ich in bar
Alter mach dein Scheiß, du Penner, ich hab leider keine Zeit für kleine Bengel
Die meinen, jetzt meinen Style zu bemängeln
Ihr habt dick Vision, doch von Motivation keine Spur
Eure Neidkultur schläft bis um 13 Uhr

[Hook: Sample]I want to fly, can you take me far away?Give me a star to reach for, tell me what it takesAnd I'll go so high, I'll go so highMy feet won't touch the groundJust stitch my wings and pull the stringsI bought these dreams that all fall down

[Part 2: Farid Bang]
Du bist ein neidhabender Typ, dein Leihwagen ist grün
Wie die Scheinfarbe, für die dich dein Weib abends betrügt
Und ich hab mich für den Scheiß grade bemüht
Millionär mit dreißig - ich war zwei Jahre zu früh
Du warst Wände am malen, ich habe gekämpft für das Bare
Damit Kinder mir heut sagen: „Farid Bang ist nicht Straße!“
Ich kam aus dem nichts, ein paar tausend Klicks
Doch ich bin wie dein Album - ich verkauf' mich nicht
Banger Musik - wir überrollen das Business
Inzucht auf der Street, Brüder wollen uns ficken
Hol' es mir von euch, geb' meiner Mama das Kies
Denn wer nichts verlangt, der hat alles verdient
Hilf Leuten auf die Beine, die in 'nem Käfig leben
Und das erste was sie machen, wenn sie stehen, dich treten
Das gilt nicht für uns - Rap-Rebell und Farid
Banger Musik, Übernahmestart, Kanax in Paris

[Hook: Sample]I want to fly, can you take me far away?Give me a star to reach for, tell me what it takesAnd I'll go so high, I'll go so highMy feet won't touch the groundJust stitch my wings and pull the stringsI bought these dreams that all fall down

[Bridge: Farid Bang]
Bis hierhin war's kein leichter Weg
Wo ich jetzt bin, wollt mich keiner sehen
Hab mich die meiste Zeit im Kreis gedreht
Guck mal, alles ergibt jetzt Sinn
Fast hätte ich die Chance verpasst
Zu viele Cousins im Knast
Meine Feinde wollten, dass
Ich nie dahin komm, wo ich jetzt bin

[Hook: Sample]I want to fly, can you take me far away?Give me a star to reach for, tell me what it takesAnd I'll go so high, I'll go so highMy feet won't touch the groundJust stitch my wings and pull the stringsI bought these dreams that all fall down
","https://genius.com/Farid-bang-alles-hat-sein-sinn-lyrics","Released May 27, 2016
Distributor

    
      Warner Music Group
Artwork

    
      ADOPEKID
Label

    
      Banger Musik
Copyright ©

    
      Banger Musik
Phonographic Copyright ℗

    
      Banger Musik
Featuring

    
      Al-Gear, Fat Joe, Jasko & 7 more
Producers

    
      Abaz, Bad Educated, B-Case & 11 more
Writers

    
      Abaz, Al-Gear, Bad Educated & 22 more
Composer

    
      Abaz, Bad Educated, B-Case & 11 more
Copyright ©

    
      Banger Musik"
"10","Farid Bang","Bentley","Blut","[Intro]
„Farid Bang is the biggest nigga in Europe!“ („biggest nigga in Europe!“)„The, the guns, the cash, the dro, it's all I knowThe, the guns, the cash, the dro, it's all I knowE-e-every video bitch scared to fuck with meDrop top Bentley, Bentley, Bentley, Bentley!“

[Part 1: Farid Bang]
Aus dem Mansory kommt jetzt ein Schuss
Ich baller' mit Schrot in deiner scheiß Hood direkt auf dein' Polizeibegleitschutz
Deine profitgeilen Scheißhooks klingen nach Tourette-Syndrom
Ich griff mehr Berliner an als die Sowjetunion
Erfolgsdruck, mehr Goldschmuck, back in dem Business
Ich bin kein Friseur, doch mache Welle bei Bitches
Möchte Rapper vernichten, auf ihre Hintermänner zielen
Bin kein Sklave, auch wenn du mich meist in dicken Ketten siehst
Regel 7 - komm mir nicht mit StylingtippsWenn an deinem Arm nicht mal 'ne Breitling ist
Und eigentlich fick' ich deine Bitch in einem Ford-LKW
Ich hab' ein' Stiernacken, der bis zu den Ohrläppchen geht
Ich bin Unternehmer, Schutzgeldzähler, Muskelträger, Nuttenschläger
Und das Wichtigste: Schwanz-an-deine-Mutter-Geber
Du hast nie trainiert und noch nie hast du gekämpftDu hast dir nie Kur'n gegeben, wie einst Maskulin-Fans, Bitch!

[Hook](2x)
„The, the guns, the cash, the dro, it's all I knowThe, the guns, the cash, the dro, it's all I knowE-e-every video bitch scared to fuck with meDrop top Bentley, Bentley, Bentley, Bentley!“
„The, the guns, the cash, the dro, it's all I knowThe, the guns, the cash, the dro, it's all I knowE-e-every video bitch scared to fuck with meDrop top Bentley, Bentley, Bentley, Bentley!“

[Part 2: Farid Bang]
Es gibt kein' Terroristenbart (nein), doch Ghettos mit AKs (ja)
Du steigst nicht auf die Eins ein, weder Rap noch in den Charts
Rapp' für die Blocks und die Killas (Killas), Moccros und Biras (Biras)
Und habe den Kontostand eines Lottogewinners (Gewinner)
Kleine Bitch, steht mir dein Ehemann im Weg (ja)Kann es sein, dass du wieder dein' Mädchennamen trägst
In die Disco mit Uzi, ich will, dass richtiges Blut fließt
Und man sieht mich neben Adeligen, wie Ich-+-Ich-Groupies
M-O-K, ich breche dir sämtliche KnochenDeine Tochter ist nicht Kylie Jenner, doch ihr Dad ist 'ne Fotze ('ne Bitch)
Ihren Unterhalt hast du in Jelzin versoffen
M-O-K - ein Jahrzehnt dieselben Klamotten (Penner)
Mein Lebensretter und mein Glücksbringer ist Schrot
Ich hab' keine Berührungsängste wie Flüchtlinge am Dom
Verrückt klingende Flows, eure Mütter sind am blow'n
Banger Musik ist back, ich bin zurück in Al Tabon

[Hook](2x)
„The, the guns, the cash, the dro, it's all I knowThe, the guns, the cash, the dro, it's all I knowE-e-every video bitch scared to fuck with meDrop top Bentley, Bentley, Bentley, Bentley!“
„The, the guns, the cash, the dro, it's all I knowThe, the guns, the cash, the dro, it's all I knowE-e-every video bitch scared to fuck with meDrop top Bentley, Bentley, Bentley, Bentley!“","https://genius.com/Farid-bang-bentley-lyrics","Released May 27, 2016
Distributor

    
      Warner Music Group
Artwork

    
      ADOPEKID
Label

    
      Banger Musik
Copyright ©

    
      Banger Musik
Phonographic Copyright ℗

    
      Banger Musik
Featuring

    
      Al-Gear, Fat Joe, Jasko & 7 more
Producers

    
      Abaz, Bad Educated, B-Case & 11 more
Writers

    
      Abaz, Al-Gear, Bad Educated & 22 more
Composer

    
      Abaz, Bad Educated, B-Case & 11 more
Copyright ©

    
      Banger Musik"
"11","Farid Bang","Gangstabossrap","Blut","[Part 1]
Farid ist zurück, es werden Mütter gefickt
Mit der Kalashnikow auf dein Flüchtlingsgesicht
Jeder fickt jeden nach ei'm Gramm Koka
Doch rappt mit der Grammatik von Meister Yoda
Ich geh' in die Bank nur mit Skimaske rein
Leck' ich eine Frau, muss sie auf 'ner Briefmarke sein
Oli Marquart, ich komm' im Benz gefahrenDu willst auch gern, doch passt nur in ein' CampingwagenDer Gangsterpate auf YouPorn mit deiner AltenDein Körper steht für unsportliches VerhaltenDu bist bekannt für Bukkake-PartysIch für den rechten Haken wie damals Nazis
Es ist besser zu schweigen vor GerichtDenn meine Hood ist wie ein Dark-Room - du weißt nicht, wer dich fickt
„Banger Musik“ - die Szene wird weiterhin gedisst
Solang' ich den Text per Schwanz auf Schreibmaschine tipp'

[Hook]
Ich überroll' die Szene, also lieber aus dem Weg
Denn die meisten Gangsterrapper sind nur Dealer auf CD
Was für Niederlanden-Haze? Ich mach' Gangstabossrap!
Gangstabossrap, G-, G-, Gangstabossrap
Düsseldorf - du willst wissen, ob wir Ghettos haben
Dreihundert Beamte auf der Ellerstraße
Du musst Teflon tragen,ich mach' Gangstabossrap!
Gangstabossrap, G-, G-, Gangstabossrap

[Part 2]
Ich kenn' nicht den Preis meines Maybachs, du Nutte!
Weil Millionäre nicht auf Preisschilder gucken
Meine Feinde sind Bullen, du frisst Schrot, kleiner Kerl
Ich lass' dich für dein' Text bezahlen als wenn ich Ghostwriter wär'
Wie MoTrip bei ...und diese ausländischen Penner
Machen auf authentische Rapper, doch verkaufen nichts wie Bettler
Das System ist wie Billard in meinem BlockAm Ende wird der Schwarze vom Weißen eingelocht (kling)
Und stellten mir deutsche Rapper mal Fragen
War es zu achtzig Prozent, ob ich Wechselgeld habe
Ich bin testogeladen, lauf' im Djellaba durch Harlem
Und triffst du mich, wär' es besser für dich, Teflon zu tragen
Und Rapper, die über Tonnenpreise labern im Oberteil von Zara
Waren nie in Polizeigewahrsam
Gib mir Koka-Lines, ich flow' am Mic und hole mir den Hype
Und will schuld dran sein, dass ihr rote Zahlen schreibt

[Hook]
Ich überroll' die Szene, also lieber aus dem Weg
Denn die meisten Gangsterrapper sind nur Dealer auf CD
Was für Niederlanden-Haze? Ich mach' Gangstabossrap!
Gangstabossrap, G-, G-, Gangstabossrap
Düsseldorf - du willst wissen, ob wir Ghettos haben
Dreihundert Beamte auf der Ellerstraße
Du musst Teflon tragen, ich mach' Gangstabossrap!
Gangstabossrap, G-, G-, Gangstabossrap

[Bridge]
Ich hab' es prophezeit, nach dem Massaka kommt Blut
Zücke den Ballermann und schieße deinem Bodyguard in' Fuß
Erzähl mir nix von deinem harten Leben, du Schlampe
Eins-gegen-Eins fick' ich jeden aus Compton
Ich hab' es prophezeit, nach dem Massaka kommt Blut
Rap-Konzerte werden ab jetzt mit Kalashnikows besucht
Ich lernte einst: es gibt in diesem Leben nichts umsonst
Eins-gegen-Eins fick' ich auch jeden aus der Bronx

[Hook]
Ich überroll' die Szene, also lieber aus dem Weg
Denn die meisten Gangsterrapper sind nur Dealer auf CD
Was für Niederlanden-Haze? Ich mach' Gangstabossrap!
Gangstabossrap, G-, G-, Gangstabossrap
Düsseldorf - du willst wissen, ob wir Ghettos haben
Dreihundert Beamte auf der Ellerstraße
Du musst Teflon tragen, ich mach' Gangstabossrap!
Gangstabossrap, G-, G-, Gangstabossrap
","https://genius.com/Farid-bang-gangstabossrap-lyrics","Released May 27, 2016
Distributor

    
      Warner Music Group
Artwork

    
      ADOPEKID
Label

    
      Banger Musik
Copyright ©

    
      Banger Musik
Phonographic Copyright ℗

    
      Banger Musik
Featuring

    
      Al-Gear, Fat Joe, Jasko & 7 more
Producers

    
      Abaz, Bad Educated, B-Case & 11 more
Writers

    
      Abaz, Al-Gear, Bad Educated & 22 more
Composer

    
      Abaz, Bad Educated, B-Case & 11 more
Copyright ©

    
      Banger Musik"
"12","Farid Bang","Jebemti Majku","Blut","[Intro:Kollegah& Farid Bang]
„Alles gut, Bruder? Bist du in Düsseldorf?“
„Yo, was geht ab?“
„Denkst du dasselbe wie ich?“„Ja! Es wird wieder Zeit!“

[Verse 1: Farid Bang]
Gangsterflow, JBG, Aggro Berlins Endstation
Ich seh’ aus wie eine Testperson für Trenbolon
Waffenhehlerei/massig Schlägerei’n
„Farid ist kein Gangster.“ muss ein Grammatikfehler sein
Ich hab’ es geschafft von der Straße ins Kino
Mit Migrationshintergrund wie ein HDF-Video
„Banger Musik“, wir ballern in Kanaken-Rapper Blei
Unser Logo müsste eigentlich ein Taschenrechner sein
Bringe dich Nuttensohn um für Album-Promo
Dann ist meine Album-Promo nur noch ein Fahndungsfoto
Beende per Schlaghand die Tour von diesen albernen Hur’n
Für den Sohn von The Rock hab’ ich eine Vaterfigur
Und während die anderen Rapper bei Kanaken abdrückenBezahlt Farid Bang nur bei Massagen für sein’ Rücken
Und mein Ballermann zerstückelt - Farid Bang ist Psycho
Ich ficke deine Mutter - jebem ti majku

[Hook: Farid Bang &Kollegah]
Ey, ich komm’ auf dein Konzert, um dich wegzuflinten
Das Letzte, was du vor dem Tod siehst: mich dreckig grinsen
Bist im Internet Rambo und am Handy Psycho
Doch ich fick’ deine Mutter - jebem ti majku!
Ey, ich komm’ auf dein Konzert, um dich wegzuflinten
Das Letzte, was du vor dem Tod siehst: mich dreckig grinsen
Bist im Internet Rambo und am Handy Psycho
Doch ich ficke deine Mutter - jebem ti majku!

[Verse 2: Kollegah]
Stählern wie ein Navy-Seal - Arroganz des Todes
Spann’ ich den Lat an, wechseln Fanboys in den Panoramamodus
Ich mach’ Gold klar, bis ich reich bin wie ein Golfstaat
Stolz, hart und fokussiert wie ’n tschetschenischer Soldat mit Vollbart
Du wirst mit Kettensägen zum Pflegefall gequält
Wie der Regenwald für meine Lebensqualität
JBG - wir hab’n Cash und HypeDoch hängen immer noch im Ghetto, wie von Hauswand zu Hauswand aufgespannte Wäschelein’
Gangstersound, du Fotze
Ich komm’ mit Kriegsverbrechern, du mit kleinen Bengeln, die an Rentnerautos boxenTze, Hundesohn! Wie kann man nur so langweilig rappen?Du hätt’st nicht mal Kanten und Ecken, würd’st du in ’nem Schwammkostüm stecken
Yo, wenn ich auf meine Breitling gucke
Merk’ ich gleich, es ist Zeit, du Feigling musst dich fleißig vor paar Highkicks ducken
Und wenn sie deine Plattenkritik in ’ne Zeitschrift druckenIst da ’n ekelhafter Verriss drin wie in der Deichkind-Truppe

[Hook: Farid Bang & Kollegah]
Ey, ich komm’ auf dein Konzert, um dich wegzuflinten
Das Letzte, was du vor dem Tod siehst: mich dreckig grinsen
Bist im Internet Rambo und am Handy Psycho
Doch ich fick’ deine Mutter - jebem ti majku!
Ey, ich komm’ auf dein Konzert, um dich wegzuflintenDas Letzte, was du vor dem Tod siehst: mich dreckig grinsenBist im Internet Rambo und am Handy PsychoDoch ich ficke deine Mutter - jebem ti majku!

[Verse 3: Farid Bang]
War-, warum, warum brüsten sie sich mit dem Taschengeld von Sechzehnjährigen?
Und warum tun sie so, als wenn sie vom Crack am leben sind?
Ah, warum macht jeder Fettsack auf breit?
Und warum fürchten sie nix, doch haben dann Messer dabei?
Warum machen Automatenboxer auf Weltmeister?
Und warum trägt mittlerweile jeder Kelb ein’ Bart?
Warum zahlst du Geld an die schwulen Penner?
Und warum redest du von Straße, du Studiogangster?

[Hook: Farid Bang & Kollegah]
Ey, ich komm’ auf dein Konzert, um dich wegzuflinten
Das Letzte, was du vor dem Tod siehst: mich dreckig grinsen
Bist im Internet Rambo und am Handy Psycho
Doch ich fick’ deine Mutter - jebem ti majku!
Ey, ich komm’ auf dein Konzert, um dich wegzuflintenDas Letzte, was du vor dem Tod siehst: mich dreckig grinsenBist im Internet Rambo und am Handy PsychoDoch ich ficke deine Mutter - jebem ti majku!","https://genius.com/Farid-bang-jebemti-majku-lyrics","Released May 27, 2016
Distributor

    
      Warner Music Group
Artwork

    
      ADOPEKID
Label

    
      Banger Musik
Copyright ©

    
      Banger Musik
Phonographic Copyright ℗

    
      Banger Musik
Featuring

    
      Al-Gear, Fat Joe, Jasko & 7 more
Producers

    
      Abaz, Bad Educated, B-Case & 11 more
Writers

    
      Abaz, Al-Gear, Bad Educated & 22 more
Composer

    
      Abaz, Bad Educated, B-Case & 11 more
Copyright ©

    
      Banger Musik"
"13","Farid Bang","Gerichtsrapskit","Blut","[Part: Farid Bang,Staatsanwalt&Anklägerin]
Bin ich vor Gericht, hörst du den Staatsanwalt sagen:
„Ach Herr Bang, wieder eine Vaterschaftsklage!?
Was ist passiert?“Die Bitch hat im Ferrari geblasen!
„Und wann war das?“Wahrscheinlich wieder ein Karnevalsabend
Wir hatten Sex!- nein, du gabst dem Banger Deep-Throat
Als Beweismittel, Herr Richter, hier ein Handyvideo!
Er sagt:„Das machst du junge Dame aber gut
Doch um ehrlich zu sein, ist das für Unterhalt doch nicht genug“
Aber ich hab'geschluckt, Herr Richter!
„Junge Dame, ich geh' jetzt auf Nummer sicher
Kommen Sie mal bitte in das Nebenzimmer mit“
Und kurz darauf ist sein Penis in der Bitch
Nachdem der Richter in die Nutte reingewichst hat
Kommt der Banger rein ins Zimmer und baut sich ein' wie Kiffer
Danach gibt es das Urteil im scheiß Gerichtssaal
Ich warte leise zitternd auf das Urteil vom Richter
„Herr Bang, sie sind reich, jetzt wollen Scheiden Geld
Doch gegen sie habe ich das Verfahren eingestellt“
Die Nutte ist vom Urteil verletzt und weint
„Vielen Dank, Herr Richter, das nenn' ich Gerechtigkeit!“

[Outro]
„Das ist doch mal ein gerechtes Urteil, oder?
Na ja, jetzt aber ab zum Oktoberfest!“","https://genius.com/Farid-bang-gerichtsrapskit-lyrics","Released May 27, 2016
Distributor

    
      Warner Music Group
Artwork

    
      ADOPEKID
Label

    
      Banger Musik
Copyright ©

    
      Banger Musik
Phonographic Copyright ℗

    
      Banger Musik
Featuring

    
      Al-Gear, Fat Joe, Jasko & 7 more
Producers

    
      Abaz, Bad Educated, B-Case & 11 more
Writers

    
      Abaz, Al-Gear, Bad Educated & 22 more
Composer

    
      Abaz, Bad Educated, B-Case & 11 more
Copyright ©

    
      Banger Musik"
