"";"artist";"title";"album";"text";"url";"metadata"
"1";"Kay One";"Paff Paff Pass";"Der junge von damals";"[Part 1]
And're Leute fahren einen Golf 3, ich wollt einen Rolls Royce
Wollte, dass aus dem Wasserhahn pures Gold läuft
Mama, du musst dir nie wieder Sorgen machen
Schwarze Regenjacke an mit einem Porschewappen
Kann es nicht in Worte fassen, Gott hat mich gesegnet
Ohne mein Talent säß ich wie ein Opfer heut im REWE
Ich rotz in die Manege wie ein besoffener Dompteur
Halt die Schnauze, mach den Frauen lieber Locken, du Friseur
Ich rocke alle Shirts, die mindestens 500 kosten
Komm mit weißem Anzug auf deine Hochzeit, nur um rumzuprotzen
20.000 Euro hat allein mein Hund gekostet
Ja, ich geb mein Geld jeden Tag aus, na und, du Fotze?
Meine Pullis sind durchlöchert wie bei Obdachlosen
Dafür trag ich Brillis, die noch größer sind als Mokka-Bohnen
Los, geh mir Wodka holen, ich zeig dir, wie ein Reicher feiert
All black everything - Michael Myers, gib mal Feuer

[Hook]
Paff Paff Pass, Paff Paff Pass
Damals auf dem Pausenhof, Paff Paff Pass
Auf der Landebahn steht ein Rolls Royce, diggah
Auf der Landebahn warten drei Gold Digger auf mich
Paff Paff Pass, ich mach krass Cash
Puste jetzt den Zoll an, Paff Paff Pass
Jeder wusste, meine Lehrer ham' versagt
Als sie sahen, dass der Joint in der Federmappe war

[Part 2]
Ich bin fresher, besser, ich fresse meine Gegner
Ich bin mächtiger als jemals, Reinkarnation von Cäsar
Die Mukke mein Denkmal, das schwarze Pferd am Lenkrad
Ich bin ein Sexsymbol und ja, nächstes Jahr kommt mein Kalender
Während du grade für Mathe paukst, chille ichmit Pacquiao
Wollte aus dem Plattenbau, heut stech ich aus der Masse raus
Pass mal auf, wenn ich möchte, kaufe ich dein Leben
Denn du gehst nur duschen, wenn es draußen grade regnet
Ich verkaufe meine Seele niemals
Gib mir 100.000 Euro, trotzdem kriegst du immer noch kein Feature
Verbringe in Ibiza, meine Freizeit mit den Frau'n
Unter meinem Hals hängt ein ganzes Einfamilienhaus
Falls du denkst, irgendwann wär mein Leben im Arsch
Hast du falsch gedacht, ich heirate mit Ehevertrag
Gold Digger Bitches denken, sie wär'n klug
Halt die Schnauze, es geht Paff Paff Pass, nimm ein' Zug

[Hook]
Paff Paff Pass, Paff Paff Pass
Damals auf dem Pausenhof, Paff Paff Pass
Auf der Landebahn steht ein Rolls Royce, diggah
Auf der Landebahn warten drei Gold Digger auf mich
Paff Paff Pass, ich mach krass Cash
Puste jetzt den Zoll an, Paff Paff Pass
Jeder wusste, meine Lehrer ham' versagt
Als sie sahen, dass der Joint in der Federmappe war

[Part 3]
Am Strand leben in meinem Anwesen
Meine Rottweiler machen dich ein' Kopf kleiner
Kannst du nicht lesen, Mann? Privatgelände
Du willst Geld verdienen? Komm, hol mir paar Getränke
Da vorne ist ein Kiosk, Junge
Ab heut bist du der Kioskjunge
Wolltest mit mir reden, aber bist wer?
So viel Rauch im Haus, wir sehen nichts mehr

[Hook]
Paff Paff Pass, Paff Paff Pass
Damals auf dem Pausenhof, Paff Paff Pass
Auf der Landebahn steht ein Rolls Royce, diggah
Auf der Landebahn warten drei Gold Digger auf mich
Paff Paff Pass, ich mach krass Cash
Puste jetzt den Zoll an, Paff Paff Pass
Jeder wusste, meine Lehrer ham' versagt
Als sie sahen, dass der Joint in der Federmappe war";"https://genius.com/Kay-one-paff-paff-pass-lyrics";"Released September 2, 2016
Distributor

    
      Tonpool Medien GmbH
Copyright ©

    
      Prince Kay One GmbH
Phonographic Copyright ℗

    
      Prince Kay One GmbH
Label

    
      Prince Kay One GmbH
Cover Design

    
      Mikkansy
Artwork

    
      Eric Ullrich
Executive Producer

    
      Kay One
Featuring

    
      Al-Gear, Brandon Beal, Faydee & 5 more
Producers

    
      Gorex
Writers

    
      Alex Dehn, Al-Gear, Brandon Beal & 8 more
Composer

    
      Alex Dehn, Gorex, Mario Winans & 1 more
Copyright ©

    
      Prince Kay One GmbH"
"2";"Kay One";"Shake That";"Der junge von damals";"[Verse: Brandon Beal]
Hey hey, what it is, shawty?
All up in the club, lookin' real naughty
Meet me in the hotel lobby
With all your friends, and
We gon' get it in, mami
I'mma pull up in this—skrrt—Rari
We ain't gonna tell nobody
What we doin', no
So hit me up, when you get there
Swimmin' in this Belvedere
All I really want is to see you
Pick it up and drop it low
Come on, girl, let's start the show
'Cause all I want is to see you

[Hook: Brandon Beal]
Shake it like a protein shake
Shake it like pepper on a T-Bone-Steak
Shake it like money, just got paid
Do like I do, when I got more weight (turn it up, turn it up)
Shake it like a protein shake
Shake it like pepper on a T-Bone-Steak
Shake it like money, if got paid
Do like I do, when I got more weight

[Drop]
Shake that
Shake that
Shake that
Bitch, ich mach aus dir noch ein'n Pornostar, denn
Ich bin fresh, gutaussehend und vorbestraft, egal, was soll's?

[Part 1: Kay One]
Yeah, ich komm in 'nem Rolls Royce an
Wegen mir sagt USA: Bei euch läuft, Deutschland
Fresh Prince Flow, Frau'n direkt am stöhn'n
Mein Styling-Ratschlag: Geh zu Extrem Schön
Ich ficke Bitches, von denen du träumst
Und du steigst grad in den Telebus, Boy
Check, Führerschein und dann gleich Lamborghini
Schmeiß mit den Scheinen wie Breezy - fang, du Wichser
Ich kann's, du Pisser, Landbesitzer
Allein mein Garten erinnert dich an Ibiza
Schneller, lauter, Harley
Wenn er Roli sagt, sag ich ab heute Rari
Ah, zehnter Stock und die Chick lutscht
Steig aus dem Sportwagen, nix Bus
Und nehm ich dir die Bitch weg, ist Schluss
Baby, lass ihn geh'n, diesen Nichtsnutz

[Hook: Brandon Beal]
Shake it like a protein shake
Shake it like pepper on a T-Bone-Steak
Shake it like money, just got paid
Do like I do, when I got more weight (turn it up, turn it up)
Shake it like a protein shake
Shake it like pepper on a T-Bone-Steak
Shake it like money, if got paid
Do like I do, when I got more weight

[Drop]
Shake that
Shake that
Shake that
Bitch, ich mach aus dir noch ein'n Pornostar, denn
Ich bin fresh, gutaussehend und vorbestraft, egal, was soll's?

[Part 2: Kay One]
Während du Penner in 'nem Zug einpennst
Lern ich Grundlagen für den Flugschein kenn'
Ich wollte schon immer diesen Flugschein, denn
Ich hab gehört, 'ne Stewardess kann mich gut reiten
Aha aha, plus ich mach, was ich will
Tätowiert unter'm Anzug, das passt nicht ins Bild
Doch trotzdem fick ich die Geschäftsführerin
(Bis wann?) Bis ich Geschäftsführer bin
Du willst mir hier erzähl'n, wie ich mein Geld vervielfach?
Bevor wir weiter reden: Du verdienst was?
Klappe, ich bin hier, um zu feiern
Links eine Bitch, rechts eine Bitch - Dreier
Weiter feiern, geiern, trinken
Ich ficke die Bitches heute in 'nem Maybach hinten
Schatz, ich bin dein Superheld
Der heute Nacht dein Talent sucht wie Bruce Darnell - Bitch

[Hook: Brandon Beal]
Shake it like a protein shake
Shake it like pepper on a T-Bone-Steak
Shake it like money, just got paid
Do like I do, when I got more weight (turn it up, turn it up)
Shake it like a protein shake
Shake it like pepper on a T-Bone-Steak
Shake it like money, if got paid
Do like I do, when I got more weight

[Drop]
Shake that
Shake that
Shake that
Bitch, ich mach aus dir noch ein'n Pornostar, denn
Ich bin fresh, gutaussehend und vorbestraft, egal, was soll's?
Shake that
Shake that
Bitch, ich mach aus dir noch ein' Pornostar
Denn ich bin fresh, gutaussehend und vorbestraft
Egal, was soll's?";"https://genius.com/Kay-one-shake-that-lyrics";"Released September 2, 2016
Distributor

    
      Tonpool Medien GmbH
Copyright ©

    
      Prince Kay One GmbH
Phonographic Copyright ℗

    
      Prince Kay One GmbH
Label

    
      Prince Kay One GmbH
Cover Design

    
      Mikkansy
Artwork

    
      Eric Ullrich
Executive Producer

    
      Kay One
Featuring

    
      Al-Gear, Brandon Beal, Faydee & 5 more
Producers

    
      Gorex
Writers

    
      Alex Dehn, Al-Gear, Brandon Beal & 8 more
Composer

    
      Alex Dehn, Gorex, Mario Winans & 1 more
Copyright ©

    
      Prince Kay One GmbH"
"3";"Kay One";"Lookalikes";"Der junge von damals";"[Part 1]
Steig' in meinen Spider, Frisur sitzt - weißes Hemd, braune Haut
Mein Blick verrät es dir: Ich hab' grad dein Haus gekauft, yeah
Ich kann eins am besten: Fahrstreifenseiten wechseln
Und wäre jeder Mann wie ich, dann gäb' es keine Lesben
Ich zerstör' krass, wecke mein' Friseur nachts
Erzähle Bitches, dass ich Erfahrung als Masseur hab'
Gorex, gib mehr Bass, mehr Kick, mehr Clap
Mehr Cognac, mehr Party, mehr Chicks, mehr Sex
Endboss, Tanktop, Goldkette, Prada-Brille
Mache so viel Geld und eure Rap-Idole fahr'n sich Filme
Winke aus der Limo wie pubertierende Teenies
Wozu Möbel? Bei mir stehen Nutten in Bikinis!
Fresher als ein Mundwasser- Champagner und Pasta
Und zum Hände waschen nehm' ich drei FlaschenKrumbacher
Bitch, ich bin dekadent, sauf' mich voll in Vegas
Verpiss dich hier, du Staubsaugervertreter, ich will

[Hook]
Eine Bitch links und eine Bitch rechts
Keiner hier im Deutschrap erreicht mein' Swag
Digga, fick dein Image, ihr seid bloß fake
Jeder von euch Lookalikes wär' gern Kay
Fenster runter, Drive-By auf dich Hater -*bam bam*
Keine Golddigger-Bitch entkommt mei'm Charme
Fick dein Image, ihr seid bloß fake
Jeder von euch Lookalikes wär' gern fame (fame, fame)

[Part 2]
Mehr Geld, mehr Probleme, mein Verhalten schwer daneben
Leer dir mein Getränk auf deinen Kopf mit deinen ernsten Themen
Bitch, bring uns mehr Gras; Flatscreen, First Class
Tausend Euro für 'ne Show - du denkst echt, du wärst was!?
Pisser! Ich bleib' der arroganteste Wichser
Der beste Reim auf dieses Wort wär' jetzt Lambo-Besitzer
Mein Anzug verknittert, dein Hausmädchen muss sich bücken
Scheiß mal auf Romantik, Mann, für mich bedeutet kuscheln ficken
Wenn du Migräne hast, bin ich auf der Segelyacht
Fresse wiederHäagen-Dazsund mach' danach die Mädels nass
Und es kommt noch besser: darunter deine Schwester
Sie ist auf dem Boot und ich bums' die Nutte wie ein Rentner
Bitch, ich ohrfeige dich mit einem Batzen Geld
Dein scheiß Pullover ist so voll mit Haaren von dem ganzen Katzenfell
Du Dreckshippie, ich bin komplett busy
Mein nächstes Ziel: direkt Diddy

[Hook]
Eine Bitch links und eine Bitch rechts
Keiner hier im Deutschrap erreicht mein' Swag
Digga, fick dein Image, ihr seid bloß fake
Jeder von euch Lookalikes wär' gern Kay
Fenster runter, Drive-By auf dich Hater - *bam bam*
Keine Golddigger-Bitch entkommt mei'm Charme
Fick dein Image, ihr seid bloß fake
Jeder von euch Lookalikes wär' gern fame (fame, fame)";"https://genius.com/Kay-one-lookalikes-lyrics";"Released September 2, 2016
Distributor

    
      Tonpool Medien GmbH
Copyright ©

    
      Prince Kay One GmbH
Phonographic Copyright ℗

    
      Prince Kay One GmbH
Label

    
      Prince Kay One GmbH
Cover Design

    
      Mikkansy
Artwork

    
      Eric Ullrich
Executive Producer

    
      Kay One
Featuring

    
      Al-Gear, Brandon Beal, Faydee & 5 more
Producers

    
      Gorex
Writers

    
      Alex Dehn, Al-Gear, Brandon Beal & 8 more
Composer

    
      Alex Dehn, Gorex, Mario Winans & 1 more
Copyright ©

    
      Prince Kay One GmbH"
"4";"Kay One";"Der Junge von damals";"Der junge von damals";"[Part 1]
Ich vergesse nicht: wir sind nach Italien mit dem Wohnwagen
Meine erste Wohnung und ich konnte nie den Strom zahlen
Jeden Tag Lidl, ich kannte jeden scheiß Artikel
Hab' gedacht: ,Lieber Gott, warum brichst du meine Flügel?‘
Ich wollt' weit weg wie ein Adler über die Berge
Die Schulzeit war cool, doch statt Lernen schrieb ich Verse
Über uns'rem Hochbett hing ein Ferrari-Poster
Ich war so krass stolz auf mein' ersten Nike-Pullover
Als wir klein waren, gab es noch kein Internet und iPhone
Kickerz, Tsubasa Ohzora, meine Zeit, Bro
He-Man, Mario Kart, Street Fighter - warte mal
Flashback: Gameboy, Spalding, Basketball
G-Shock, Reebok, Freestyle, krasser Flow
Adidas-Knopfhosen - wer kennt noch die Buffalos?
Doch keine Kohle für die Miete
Da war GTA noch aus der Vogelperspektive

[Hook]
Und wenn ich heute draufgehen sollte, scheiß drauf ich hab' gelebt (ich hab' gelebt)
Meine beste Zeit hatt' ich, als ich nichts war und das kann mir niemand hier nehmen (kann mir niemand hier nehmen)
Mann, war alles nur durch Rap, warum wollte mich denn damals keiner verstehen? (keiner verstehen)
Ich bleib' für immer dieser Junge von damals, doch würd' gern die Zeit zurückdrehen (die Zeit zurückdrehen)

[Part 2]
Ich schwör' dir, ich vergesse nicht, das erste Mal geklaut mit dem großen Bruder
In dem gleichen Alter haben andre ihren ersten Schultag
Ice Cube - „Friday“, das waren unsere Filme
Es war Menace - „Boyz n the Hood“ und ich chillte
Frech in der Schule, mit Kippe und ich saß am Pult
Windjacke, Helly Hansen und alles von Chicago Bulls
PlayStation 1, Sega Mega Drive
Mama hat gekocht, Chop Suey mit Reis
Jugendhaus, Mist gebaut, das erste Mal blau
Das erste Mal verliebt, Bruder, wer ist die Frau?
Mit dem Zug durch das ganze Land, nur um zu freestylen
Ghettoblaster dabei, hauen den Beat rein
Yeah! Ich werd' die Zeit nie vergessen
Ich vermisse so sehr, es war einfach am besten
Ich bedank' mich bei mein' Eltern für diese schöne Kindheit
Ich konnte Kind sein!

[Hook]
Und wenn ich heute draufgehen sollte, scheiß drauf ich hab' gelebt (ich hab' gelebt)
Meine beste Zeit hatt' ich, als ich nichts war und das kann mir niemand hier nehmen (kann mir niemand hier nehmen)
Mann, war alles nur durch Rap, warum wollte mich denn damals keiner verstehen? (keiner verstehen)
Ich bleib' für immer dieser Junge von damals, doch würd' gern die Zeit zurückdrehen (die Zeit zurückdrehen)

[Bridge]
Früher war alles besser, ich hatt' zwar nicht so viel Geld
Doch der Spielplatz war dafür uns're Welt
Und die Autos waren da noch ferngesteuert
Hab' mein Nike-Schuh gesehen - Shit, der's zu teuer!
Aber trotzdem fehlt mir die Zeit so sehr
Und ich kann heut sagen, ich hab' eins gelernt:
Genieß die Zeit mit den Liebsten, solang' du kannst
Bei vielen hat sie grad angefangen - sei dankbar!

[Hook]
Und wenn ich heute draufgehen sollte, scheiß drauf ich hab' gelebt (ich hab' gelebt)
Meine beste Zeit hatt' ich, als ich nichts war und das kann mir niemand hier nehmen (kann mir niemand hier nehmen)
Mann, war alles nur durch Rap, warum wollte mich denn damals keiner verstehen? (keiner verstehen)
Ich bleib' für immer dieser Junge von damals, doch würd' gern die Zeit zurückdrehen (die Zeit zurückdrehen)";"https://genius.com/Kay-one-der-junge-von-damals-lyrics";"Released September 2, 2016
Distributor

    
      Tonpool Medien GmbH
Copyright ©

    
      Prince Kay One GmbH
Phonographic Copyright ℗

    
      Prince Kay One GmbH
Label

    
      Prince Kay One GmbH
Cover Design

    
      Mikkansy
Artwork

    
      Eric Ullrich
Executive Producer

    
      Kay One
Featuring

    
      Al-Gear, Brandon Beal, Faydee & 5 more
Producers

    
      Gorex
Writers

    
      Alex Dehn, Al-Gear, Brandon Beal & 8 more
Composer

    
      Alex Dehn, Gorex, Mario Winans & 1 more
Copyright ©

    
      Prince Kay One GmbH"
"5";"Kay One";"Herr Reichert";"Der junge von damals";"[Part 1]
Yo, was geht ab, Sie fettes Schwein, erinnern Sie sich noch?
Ich war dieser Junge ohne Kohle aus dem Block
Sie war'n sowas von geschockt, weil ich mit Ihrer Tochter essen war
Und dieses Steak für Ihre Prinzessin unvergesslich war
Sie wollt' mich wiederseh'n, sie konnt' mir nicht widersteh'n
Bis Sie ihr sagten, dass ich zu den Scheiß-Verlierern zähl
Weil ich aus einer schlechten Gegend komm, wo's nix gibt
Ich hab's Ihrer Tochter beigebracht, das Fick Dich
Ich wollt ihr zeigen, dass es mehr auf dieser Welt gibt
Dass sie nicht wie ihre Mutter wird, diese Chanel-Bitch
Sie wurd erzogen mit Shoppen geh'n und Hausmädchen
Und auf euren teuren Teppich durfte keiner drauftreten
Ich war ein Dorn, ein Dorn in Ihrem Auge
Denn mein Papa hatte kein' Stern vorne auf der Haube
Tut mir Leid, wir hatten kein Einfamilienhaus
Weil in meinem Haus noch 'ne andre Scheiß-Familie haust
Kein Pferd zum Geburtstag, bei uns war'n's die Jordans
Papa sagte immer nur: Jungs, denkt an morgen
Damals hab ich mir eins geschwor'n
Ich werd nie so wie Sie sein, ich bin nicht reich reingebor'n

[Hook]
Lieber Herr Reichert, ich komm aus 'ner Kleinstadt
Ham' Sie nicht gelacht, weil ich nie was erreicht hab?
Früher noch Hochhaus, heut komm ich groß raus
Na, Sie Großmaul? Ihr Ex-Schwiegersohn macht mehr Geld als Sie
Lieber Herr Reichert, ich komm aus 'ner Kleinstadt
Ham' Sie nicht gelacht, weil ich nie was erreicht hab?
Früher noch Hochhaus, heut komm ich groß raus
Na, Sie Großmaul? Ich mach mehr als Sie

[Part 2]
Heute steh ich hier, erinnern Sie sich noch?
Ich war dieser Junge ohne Kohle aus dem Block
Mit dem ganz kleinen Unterschied von 'ner Million hier
Denn Ihr Scheißcharakter hat mich damals so krass motiviert
Heute gucken sie mich an und lutschen meinen Schwanz
Ganz egal, ob Ihre Tochter oder Nutten dort hin kann
Früher konnt ich Cote d'Azur nicht mal buchstabier'n
Heut steht der 458er geparkt vor der Tür
Schlaf bis um Vier, Angestellte machen meinen Job täglich
Sekretärinnen kriegen heut den Bosspenis
Ich les die Post eh nicht, das macht mein Manager
50 Securities und jeder macht MMA
Meine Musik, meine Mode, meine Immobilien
Und der einzige Deutschrapper ohne Großfamilie
Mein Lebenswerk meistern, wer ist Herr Reichert?
Bringt mir einen Scheißrapper, der noch mehr Likes hat
Zeigt mir einfach einen Star, der so wohnt wie ich
Keine meiner ganzen Frauen hatte je ein Mondgesicht
Scheiß auf Ihre Tochter, nur für Sie ist jetzt der Song
Ich rotz aus dem Ferrari, ich vergess nicht, wo ich herkomm

[Hook]
Lieber Herr Reichert, ich komm aus 'ner Kleinstadt
Ham' Sie nicht gelacht, weil ich nie was erreicht hab?
Früher noch Hochhaus, heut komm ich groß raus
Na, Sie Großmaul? Ihr Ex-Schwiegersohn macht mehr Geld als Sie
Lieber Herr Reichert, ich komm aus 'ner Kleinstadt
Ham' Sie nicht gelacht, weil ich nie was erreicht hab?
Früher noch Hochhaus, heut komm ich groß raus
Na, Sie Großmaul? Ich mach mehr als Sie

[Part 3]
Als Sie Alki, fettes Schwein mit rotem Kopf
Sie ham' abgekotzt, als Sie sahen, wer neben Bohlen hockt
Und ich kann mir vorstell'n, Sie ham' sich ein' gewichst darauf
Samstagabend mit der Family, den kenn ich doch auch
Überall Titelblatt, ausverkaufte Tour'n
40.000 sind zwar viel, doch ich kaufte mir die Uhr
Heute lauf ich im Flur zu den 5-Sterne-Suiten
Herr Reichert fährt Benz, doch der Hund muss ihn leasen
Durch Rap nie mehr broke, ich rauch sechs und bin stoned
Tätowiert, ohne Manier'n, ich bleib Ihr Ex-Schwiegersohn
Wer macht jetzt die Million? Tiefbett voll verchromt
Sie Drecks-Hurensohn, fick Respekt und Niveau
Vier Top-Ten-Alben, Featuregäste aus den USA
Merk dir eins, ich bin kein Rapper, sondern Superstar
Doch für Ihre Tochter war ich nicht gut genug
Heut spuck ich dir ins Gesicht für den Move

[Hook]
Lieber Herr Reichert, ich komm aus 'ner Kleinstadt
Ham' Sie nicht gelacht, weil ich nie was erreicht hab?
Früher noch Hochhaus, heut komm ich groß raus
Na, Sie Großmaul? Ihr Ex-Schwiegersohn macht mehr Geld als Sie
Lieber Herr Reichert, ich komm aus 'ner Kleinstadt
Ham' Sie nicht gelacht, weil ich nie was erreicht hab?
Früher noch Hochhaus, heut komm ich groß raus
Na, Sie Großmaul? Ich mach mehr als Sie";"https://genius.com/Kay-one-herr-reichert-lyrics";"Released September 2, 2016
Distributor

    
      Tonpool Medien GmbH
Copyright ©

    
      Prince Kay One GmbH
Phonographic Copyright ℗

    
      Prince Kay One GmbH
Label

    
      Prince Kay One GmbH
Cover Design

    
      Mikkansy
Artwork

    
      Eric Ullrich
Executive Producer

    
      Kay One
Featuring

    
      Al-Gear, Brandon Beal, Faydee & 5 more
Producers

    
      Gorex
Writers

    
      Alex Dehn, Al-Gear, Brandon Beal & 8 more
Composer

    
      Alex Dehn, Gorex, Mario Winans & 1 more
Copyright ©

    
      Prince Kay One GmbH"
"6";"Kay One";"Lederjacke";"Der junge von damals";"[Hook]
Die Lederjacke, sie ist schwarz und glänzt
Zutätowiert und ich start den Benz
Du Nutte, check mal meinen Kontostand
Ich geh die Woche dreimal Sonnenbank
Ja, du bist am haten, aber wärst gern ich
Du würdest shoppen geh'n
Aufsteh'n, die Nummer von einem Model wähl'n
Urlaubsziel: Ganz egal wohin
Guck, wie sie am blasen sind

[Part 1]
Steig aus dem Auto, Mann, braungebrannt, heute geht's auf Tour
Wie ein Obdachloser penn ich jeden Tag bis 15 Uhr
Damals hatte man mich oft gefragt, was ich einmal werden will
Ich zeigte auf den Himmel und man sah mich als Sternenbild
Klick klick klick, wieder ein perverses Bild
Deine Bitch sieht mich und strahlt so wie Tschernobyl
Sie lieben meinen Flow, mein asoziales Image
Ich komm nicht in den Club? Okay, den Laden fick ich
Ich klär mir deine Schwester plus die Cousin'
Und wenn du Welle machst, dann gibt's ein Schuss in die Knie
Richtig, ich war bei RTL, Deutschland sucht den Superstar
Allein schon die Bezahlung heißt: Nie wieder U-Bahn fahr'n
Yeah, eine weitere Million für meine Immobilien
Welcher andre Star lässt sich Nutten komm'n aus Brasilien?
Top-Ten-Rapper, Trendsetter, rennt besser
Wenn wir komm'n, diggah, wir sind Gangbanger

[Hook]
Die Lederjacke, sie ist schwarz und glänzt
Zutätowiert und ich start den Benz
Du Nutte, check mal meinen Kontostand
Ich geh die Woche dreimal Sonnenbank
Ja, du bist am haten, aber wärst gern ich
Du würdest shoppen geh'n
Aufsteh'n, die Nummer von einem Model wähl'n
Urlaubsziel: Ganz egal wohin
Guck, wie sie am blasen sind

[Part 2]
Guck, wie sie am blasen sind, wenn sie durch den Garten spring'n
Meine Scheine alle lila, scheiße, man könnt glauben, ich bin farbenblind
Mein Haus könnte fast durchgeh'n als Labyrinth
Dein Haus ist genauso groß? Ja, bestimmt
Halt den Ball flach, du fickst wieder mit dem Falschen
Und meine Ex wurde depressiv durch mein Verhalten
Doch scheiß drauf, Ex bleibt Ex, ich exe lieber Alk, Bitch
Rede mit der Presse und es knallt, ich
Habe kein Respekt vor euch steroiden Luftpumpen
Raus aus der Wohnung, Schlampe, warte auf dein' Bus unten
Keine Toleranz, keine Angst, mein Geschäft
Ihr habt kein Talent, ihr bleibt wack, also scheiß auf Rap
Komm im Designerhemd, gestylter arroganter Sack
Du willst Schutzgeld? Meine Knarre liegt im Handschuhfach
Yeah, ich bin angesagt, kranker Part, steig in mein' Ferrari ein
Lederjacke, Partytime

[Hook]
Die Lederjacke, sie ist schwarz und glänzt
Zutätowiert und ich start den Benz
Du Nutte, check mal meinen Kontostand
Ich geh die Woche dreimal Sonnenbank
Ja, du bist am haten, aber wärst gern ich
Du würdest shoppen geh'n
Aufsteh'n, die Nummer von einem Model wähl'n
Urlaubsziel: Ganz egal wohin
Guck, wie sie am blasen sind";"https://genius.com/Kay-one-lederjacke-lyrics";"Released September 2, 2016
Distributor

    
      Tonpool Medien GmbH
Copyright ©

    
      Prince Kay One GmbH
Phonographic Copyright ℗

    
      Prince Kay One GmbH
Label

    
      Prince Kay One GmbH
Cover Design

    
      Mikkansy
Artwork

    
      Eric Ullrich
Executive Producer

    
      Kay One
Featuring

    
      Al-Gear, Brandon Beal, Faydee & 5 more
Producers

    
      Gorex
Writers

    
      Alex Dehn, Al-Gear, Brandon Beal & 8 more
Composer

    
      Alex Dehn, Gorex, Mario Winans & 1 more
Copyright ©

    
      Prince Kay One GmbH"
