"","artist","title","album","text","url","metadata"
"8","Fler & Jalil","Gang für immer","Epic","[Songtext zu „Gang für immer“ ft. Remoe]

[Bridge: Remoe]
All die Schlampen komm'n und geh'n
All die Bündel komm'n und geh'n
All die Nächte komm'n und geh'n
Komm'n, komm'n, geh'n, komm'n, komm'n, geh'n
All die Hater komm'n und geh'n
All die Freunde komm'n und geh'n
All die Alben komm'n und geh'n
Komm'n, komm'n, geh'n, komm'n, komm'n, geh'n

[Hook: Remoe]
Doch die Gang bleibt für immer
Gang, Gang für immer
Die Fam bleibt für immer
Fam, Fam für immer

[Part 1: Fler]
Seh' Menschen, die kommen und Menschen, die geh'n
Menschen, die reden, fern ab von Realität
Doch hab' es so selber gewollt, um die Gang mal in fettesten Mansions zu sehen
Blute für jeden von denen, selbst wenn es stürmt oder regnet
Selbst wenn es Schüsse hier regnet
Denn von meiner Gang ist hier niemand ersetzbar
Folgen nie Trends, sondern sind mehr die Setter
Nehm' deine Schwester und fick' sie im Tesla
Unsere Feinde im Benzer, die Scheiben durchlöchert
Der Himmel, kein Limit, will einfach nur höher
Was ist das für ein Leben, scharfe Waffen, AMGs
Egal wie und was-was sie reden
Ich lass sie, lass sie, lass sie reden

[Telefonausschnitt: Kool Savas]Digga, du bist eh Hardcore, Bruder, was soll ich sagen, alter, du rastest ja eh aus, Mann, aber ist gut so, du hast dich auf jeden Fall richtig gegen die Zweifler durchgesetzt, jetzt auf einmal sind sie alle deine Fans

[Bridge: Remoe]
All die Schlampen komm'n und geh'n
All die Bündel komm'n und geh'n
All die Nächte komm'n und geh'n
Komm'n, komm'n, geh'n, komm'n, komm'n, geh'n
All die Hater komm'n und geh'n
All die Freunde komm'n und geh'n
All die Alben komm'n und geh'n
Komm'n, komm'n, geh'n, komm'n, komm'n, geh'n

[Hook: Remoe]
Doch die Gang bleibt für immer
Gang, Gang für immer
Die Fam bleibt für immer
Fam, Fam für immer

[Part 2: Jalil]
Tausend Messages bei WhatsApp
Und ich weiß nicht, wo mein Kopf steckt
Yeah, falsche Freunde spielen gute Mine
Wären sie da, hätt' ich den Albumdeal nicht unterschrieben
Sag, endlich leb' ich meinen Scheiß TraumIronie, denn du schläfst in dieser Zeit kaum
Jah, es ist nicht immer wie die Lage scheint
Nutten ficken Freunde nur, um mir dann nah zu sein
Ich schwör', meine Seele ist schon kalt
Gottes Segen hält uns jung, denn Probleme machen Neid
Sei, hutsam in wen du Zeit investierst
Denn jeder will nur vom Hype profitier'n und
Jeder sagt dir, wie sehr er dich liebt
Den Fame hättest du schon eher verdient, klar
Alle setzen auf die Unterschrift
Nie gedacht, denn wir kamen aus der Unterschicht
Da, wo sie jeden Tag ins Gesicht lachen
Online geh'n und dann lästern über ihre SHIFT-Tasten, doch
Vertrau', ich hab' die Hunde im Sichtfeld
Beschütze die Gang, dass sie steht und durch nichts fällt, denn

[Bridge: Remoe]
All die Schlampen komm'n und geh'n
All die Bündel komm'n und geh'n
All die Nächte komm'n und geh'n
Komm'n, komm'n, geh'n, komm'n, komm'n, geh'n
All die Hater komm'n und geh'n
All die Freunde komm'n und geh'n
All die Alben komm'n und geh'n
Komm'n, komm'n, geh'n, komm'n, komm'n, geh'n

[Hook: Remoe]
Doch die Gang bleibt für immer
Gang, Gang für immer
Die Fam bleibt für immer
Fam, Fam für immer

","https://genius.com/Fler-and-jalil-gang-fur-immer-lyrics","Released June 30, 2017
Distributor

    
      Groove Attack
Label

    
      Maskulin
Executive Producer

    
      Fler
Featuring

    
      Mortel & Remoe
Producers

    
      Christopher Bauer, Fler, Grasser & 7 more
Writers

    
      Christopher Bauer, Fler, Grasser & 9 more
Additional Vocals

    
      Kool Savas & Remoe
Artwork

    
      Memo Filiz & Omely"
"9","Fler & Jalil","Coogi","Epic","[Intro: Sample]Living better now, Coogi sweater nowLiving better now, Coogi sweater nowLiving better now, Coogi sweater nowDrop top BM's, I'm the man, girlfriend

[Hook: Mortel]
Coogi, Coogi, Coogi, Coogi, CoogiCoogi, Coogi, Coogi, Coogi, CoogiCoogi, Coogi, Coogi, Coogi, CoogiCoogi, Coogi, Coogi, Coogi, Coogi

[Part 1: Mortel]
Yeah, von meiner Generation fühlst du dich Pisser bedroht
Ich präsentier' dir mein'n Block, als wär mein Schädel aus Chrom
Tote Blicke zier'n die Perspektivlosigkeit
Verschiedene Kulturen, doch die Meinung ist gleich: Fick die Polizei!
Deux cent quarante-trois, wir hatten noch nie so viel
Patte, guck die Pläne sind jetzt so groß wie Shaquille O’Neal
Der Beanie von Ünkut, der Sweater von Coogi
Mein Outfit die Straße wie Carlo Colucci

[Bridge: Sample]Living better now, Coogi sweater nowLiving better now, Coogi sweater nowLiving better now, Coogi sweater nowDrop top BM's, I'm the man, girlfriend

[Hook: Mortel]
Coogi, Coogi, Coogi, Coogi, CoogiCoogi, Coogi, Coogi, Coogi, CoogiCoogi, Coogi, Coogi, Coogi, CoogiCoogi, Coogi, Coogi, Coogi, Coogi

[Part 2: Jalil]
Jalil, ich bin nicht von der Elfenbeinküste
Wenn ich will, fallen für einen gelben Schein Schüsse
Hatte Jordans in mei'm Schrank bevor ich erstmals laufen konnte
Sag zum Bullen, der mich anhält: „Nutte, geh mir aus der Sonne!“
Lauf die City im Balenciaga-Kicks
Wenn ich die Navi-Adresse an mein Wagen schick'
Coogi-Sweater für ein halbes Vermögen
Hab' Coogi-Prints gedruckt auf all meine Möbel
Ausnahmezustand im Viertel mit Bantus
Wenn wir ankommen ist gut, wenn du Land suchst
Epische Racailles, Coogi-Sweater reflektiert auf dem Asphalt

[Bridge: Sample]Living better now, Coogi sweater nowLiving better now, Coogi sweater nowLiving better now, Coogi sweater nowDrop top BM's, I'm the man, girlfriend

[Hook: Mortel]
Coogi, Coogi, Coogi, Coogi, CoogiCoogi, Coogi, Coogi, Coogi, CoogiCoogi, Coogi, Coogi, Coogi, CoogiCoogi, Coogi, Coogi, Coogi, Coogi

[Part 3: Fler]
Yeah, ich hab vom teuren Champagner noch Nachgeschmack
Fingerabdrücke, sie ficken mein'n Kopf denn der Benz hat Pianolack
Carlo Colucci und 2001, mittlerweile ein Artefakt
Ficke in etwa 'ne Bitch wie sie Kanye hat'Ne Lil Kim ist die Sidebitch
In ihren Augen der Sheytan
Welle schieben, mein Trademark
Saint-Laurent-Jeans voll Paper
Frank White, einziger Weißer am Corner mit Bantus
Rest in Peace B.I.G, verkippen deswegen am Corner den Schampus

[Bridge: Sample]Living better now, Coogi sweater nowLiving better now, Coogi sweater nowLiving better now, Coogi sweater nowDrop top BM's, I'm the man, girlfriend

[Hook: Mortel]
Coogi, Coogi, Coogi, Coogi, CoogiCoogi, Coogi, Coogi, Coogi, CoogiCoogi, Coogi, Coogi, Coogi, CoogiCoogi, Coogi, Coogi, Coogi, Coogi","https://genius.com/Fler-and-jalil-coogi-lyrics","Released June 30, 2017
Distributor

    
      Groove Attack
Label

    
      Maskulin
Executive Producer

    
      Fler
Featuring

    
      Mortel & Remoe
Producers

    
      Christopher Bauer, Fler, Grasser & 7 more
Writers

    
      Christopher Bauer, Fler, Grasser & 9 more
Additional Vocals

    
      Kool Savas & Remoe
Artwork

    
      Memo Filiz & Omely"
"10","Fler & Jalil","Sollte so sein","Epic","[Hook: Fler]
Weil ich und meine Clique kein' Fick gaben
Mehr Groupies im Backstage als Misswahlen
Habe in der Hood die Jordan 6 an
Und kläre deine Bitch, das ist SchicksalSollte so sein, sollte so sein, sollte so seinSollte so sein, sollte so sein, sollte so sein

[Part 1: Jalil]
Yeah, laber mich nicht voll, Nigga, yeah
Und sag' mir nicht, Jalil wäre nicht famous
Was, ich hab’ kein Erfolg, Nigga?!
Weiße feiern mich wie Oasis
Rap' mir keine Message vor
Tagsüber im Store, nachts Predator
Aha, Kapuze auf wie Skeletor
Und Schläger um mich rum wie auf dem Center Court
Ah, Südberlin ist meine HometownThermosiedlung, minimaler Wohnraum
12-2-07
Bleib' loyal zu der Hood, man ich schwör’s auf die Bibel
Maskulin, wir zwei sind die Essenz, Nigga
Treffsicher, 9 Shots, 50 Cent, Nigga
Kugelsicherer Jugendlicher
Represent, represent, Nigga

[Hook: Fler]
Weil ich und meine Clique kein' Fick gaben
Mehr Groupies im Backstage als Misswahlen
Habe in der Hood die Jordan 6 an
Und kläre deine Bitch, das ist SchicksalSollte so sein, sollte so sein, sollte so seinSollte so sein, sollte so sein, sollte so sein
​
[Part 2: Mortel]
Ah, yeah, ich komme rein mit einem « Nique ta race ! »​
Ihr kommt nicht klar auf meine Wortwahl
Ghetto-Youth, époque sale
Unter Tatverdacht in einem Mordfall
Meine Vergangenheit hat mich gefickt
Schon als Kinder hab’n wir Kilos weggedrückt
Keine Hantelbank, Digga, du weißt
Tausend Prozent Realtalk, ohne Scheiß
Stabile négros in NRW
On fait la bicrave um jeden Preis
Cash, Koks, Nutten, bin pflegeleicht
Streck das Kokain mit Edelweiß
Griselda Blanco, busy wie Pablo
In Kongo wird geschossen so wie in Chicago
Scheiß auf Rapbeef, bin unparteiisch
Hab’ schon Beef mit Bullen, das reicht

[Hook: Fler]
Weil ich und meine Clique kein' Fick gaben
Mehr Groupies im Backstage als Misswahlen
Habe in der Hood die Jordan 6 an
Und kläre deine Bitch, das ist SchicksalSollte so sein, sollte so sein, sollte so seinSollte so sein, sollte so sein, sollte so sein

[Part 3: Fler]
Bleib’ derselbe, man du kennst mich
Jede Woche wieder vor dem Richter
Leben auf der ÜberholspurFührerschein weg wegen Blitzer
Jeder kleine Schritt wird zur Headline
Jede Handbewegung wird zum Gangsign
Seit 2003 in den Top Ten
Und das alles nur durch rumbrüll’n und frech sein
Signe den DealDroppe Sentino, signe Jalil
Bleib’ immer real
Streite mit viel’n, live aus Berlin
Diese Rapper alles Fler-Klone
Doch passen nicht in meine Air-Sohle
Ich Racaille, du Lakai
Du bist vor Gericht Papagei

[Hook: Fler]
Weil ich und meine Clique kein' Fick gaben
Mehr Groupies im Backstage als Misswahlen
Habe in der Hood die Jordan 6 an
Und kläre deine Bitch, das ist SchicksalSollte so sein, sollte so sein, sollte so seinSollte so sein, sollte so sein, sollte so sein

","https://genius.com/Fler-and-jalil-sollte-so-sein-lyrics","Released June 30, 2017
Distributor

    
      Groove Attack
Label

    
      Maskulin
Executive Producer

    
      Fler
Featuring

    
      Mortel & Remoe
Producers

    
      Christopher Bauer, Fler, Grasser & 7 more
Writers

    
      Christopher Bauer, Fler, Grasser & 9 more
Additional Vocals

    
      Kool Savas & Remoe
Artwork

    
      Memo Filiz & Omely"
"11","Fler & Jalil","Makellos","Epic","[Pre-Hook: Fler]
Lauf' im SchattenDenn ich wurd' hier erwachsen im Hausflur mit TagsUnd den tausend KanakenDie Straße verdreckt, doch der Wagen, er glänztHab' das Blaulicht im NackenSeh' keine Liebe am Block, doch ich kann mein Zuhause nicht hassenNooo

[Hook: Fler]
Makellos, Makellos
Makellos, Makellos
Makellos, Makellos
Makellos, Makellos

[Part 1: Fler]
Yeah, Junge aus der Hood, meine Skyline voller Dreck und Staub
Es riecht nach Weed und der Dunst zieht durch jede Etage im Treppenhaus
Hunderttausend-Euro-Wagen steht am Corner nur im Parkverbot
Narben im Gesicht, doch die Bitches sagen: „Flizzy deine Optik, sie ist makellos.“
Keine Sterne am Himmel nachts, dafür Sterne auf der Limousine
Hab' den Block nicht gekauft, doch es weiß jeder hier: mir gehört diese Immobilie
Die Stimmung, sie ist aufgehitzt - Berlin-City-Klimawandel
Gemacht unter Druck, denn ich kam aus der Asche und wurd' zu 'nem Diamanten
Ich hab' im Deutschrap erst polarisiert und dann modernisiert
Guck, Rap etabliert,Louis-Vuittonisiert
Junge, wo ich lebe: 12207Represente meine Hood, Berliner Süden

[Pre-Hook: Fler]
Lauf' im Schatten
Denn ich wurd' hier erwachsen im Hausflur mit Tags
Und den tausend Kanaken
Die Straße verdreckt, doch der Wagen, er glänzt
Hab' das Blaulicht im Nacken
Seh' keine Liebe am Block, doch ich kann mein Zuhause nicht hassen
Nooo

[Hook: Fler]
Makellos, Makellos
Makellos, Makellos
Makellos, Makellos
Makellos, Makellos

[Part 2: Jalil]
Yeah! Der Körper ist von Narben übersät
Doch hier gewann ich jeden Einzelkampf
War der Polizei ein'n Schritt voraus
Sprangen über Zäune in mein'n Nike Dunks
Tätowierte Träume prägen jede Muskelfaser
Hier fressen wir die Löwen, keine Hipster und Veganer
Niemand in mei'm Viertel ging schon jemals in ein'n Starbucks
Stattdessen gibt es Schlägerei'n im Ghetto auf dem Marktplatz
Im CLA unter Citylights
Heut geliebt, wenn ich auftauche
Hab' gemacht, was hier keiner schafft
Bin fürs Viertel eine Blaupause
Von den Streets zu dem Leben in dem ScheinwerferlichtDu kannst ernten, was du säst, wenn das Leid dich nicht bricht
Wir Leben schwarz-weiß, doch die Scheine machen farbenfroh
Deshalb verpacken wir die Tüten so wie Haribos
Hab'n nur Drogen und Tags an der Wand
Umgeben von Schmutz, doch das Outfit ist tadellos
Familie im Block
Doch gibt es Verräter, dann stechen wir, stechen wir gnadenlos
12207, geprägt und geliebt und gehasst in der Nachbarschaft
Hätt' mein Leben fast im Knast verbracht, doch rappte viel zu makellos

[Pre-Hook: Fler]
Lauf' im SchattenDenn ich wurd' hier erwachsen im Hausflur mit TagsUnd den tausend KanakenDie Straße verdreckt, doch der Wagen, er glänztHab' das Blaulicht im NackenSeh' keine Liebe am Block, doch ich kann mein Zuhause nicht hassenNooo

[Hook: Fler]
Makellos, Makellos
Makellos, Makellos
Makellos, Makellos
Makellos, Makellos

[Outro]
Noo, makellos, makellos, makellos","https://genius.com/Fler-and-jalil-makellos-lyrics","Released June 30, 2017
Distributor

    
      Groove Attack
Label

    
      Maskulin
Executive Producer

    
      Fler
Featuring

    
      Mortel & Remoe
Producers

    
      Christopher Bauer, Fler, Grasser & 7 more
Writers

    
      Christopher Bauer, Fler, Grasser & 9 more
Additional Vocals

    
      Kool Savas & Remoe
Artwork

    
      Memo Filiz & Omely"
"12","Fler & Jalil","Lebron","Epic","[Hook: Fler &Jalil]
Mit den Air Max auf dem Beton
Steig' ich in den Veyron
Geld in allen Farben wie Chamäleon
Bin am ballen, so wie Lebron (Swish!)Bin am ballen, so wie Lebron (Swish!)Bin am ballen, so wie Lebron (Swish!)Bin am ballen, so wie Lebron (Swish!)Bin am ballen, so wie Lebron

[Part 1: Fler &Jalil]
Immer noch ein Bad Boy, der nur randaliert
Nur heut' krieg ich im Restaurant das Lamm serviert
Nein, ich bin nicht Everybody's Darling
Trage an meinem Körper die Bestellung aus Italien
Brülle durch mein Loft, Billy-Wilder-Bootcamp
Steak für die Produzenten, Flizzy ist ein Gutmensch
Bester deutscher Rap-Act national
Denn mein Shopping-Level: abnormal
Mein Leben ist der Inbegriff von dolce vita (Swish!)
Ich bin nicht wie diese deutschen Spießer (Swish!)
Steige barfuß in die teuren Sneaker (Swish!)
Rauche die Elektro-Shisha
Was für diskutieren, ein Gangster kann nur anschreien
Live on stage, gleiche Pyro wie bei Rammstein
Sitze im Veyron, Champagner auf den Ledersitzen
Lass' uns auf das Leben trinken

[Hook: Fler &Jalil]
Mit den Air Max auf dem Beton
Steig' ich in den Veyron
Geld in allen Farben wie Chamäleon
Bin am ballen, so wie Lebron (Swish!)Bin am ballen, so wie Lebron (Swish!)Bin am ballen, so wie Lebron (Swish!)Bin am ballen, so wie Lebron (Swish!)Bin am ballen, so wie Lebron

[Part 2: Jalil]
Die Sneaker sind gestapelt bis zur Zimmerdecke
Geh' ich ins Restaurant, bestell' ich nur vom Rind das Beste
Ketten glänzen durch die Scheibe von der Fahrerseite
2000-Euro-Outfit, wenn ich aus dem Wagen steige
Fahr' den Bugatti durch die Nacht und fick' die Tempolimits
Maskulin, Newschool, deutscher Rap ist Vintage
Neues Level, wenn ich balle, dann wie Durant
Kriminelle Machenschaften seit der Jugend
Wie Hugh Grant krieg ich Bitches vor die Kamera
Und kipp' den Schampus in der Penthouse-Suite vom Mandala
Unser Leben geht vom Bordstein bis zur Skyline
Heute posten Weiber mich auf jeder Facebook-Timeline
Yeah, hab die Straße in der DNA
Kauf' den Veyron bar, als Zweitwagen 'nen CLA
Ah, keine Grenzen, wenn du hustlest, Bruder
All Eyes On Me, als wäre ich verwandt mit 2Pac

[Hook: Fler & Jalil]
Mit den Air Max auf dem Beton
Steig' ich in den Veyron
Geld in allen Farben wie Chamäleon
Bin am ballen, so wie Lebron (Swish!)Bin am ballen, so wie Lebron (Swish!)Bin am ballen, so wie Lebron (Swish!)Bin am ballen, so wie Lebron (Swish!)Bin am ballen, so wie Lebron (Swish!)

[Sample: LeBron James]""Uhm, I'm in a position where I can be the best I can be each and every night. I have an organization, I have a team, that can put ourselves in a position to be the best each and every year.""

[Outro: Fler]
Mit den Air Max auf dem Beton
Steig' ich in den Veyron
Geld in allen Farben wie Chamäleon
Bin am ballen, so wie Lebron
Mit den Air Max auf dem Beton
Steig' ich in den Veyron
Geld in allen Farben wie Chamäleon
Bin am ballen, so wie LebronBin am ballen, so wie LebronBin am ballen, so wie Lebron

","https://genius.com/Fler-and-jalil-lebron-lyrics","Released June 30, 2017
Distributor

    
      Groove Attack
Label

    
      Maskulin
Executive Producer

    
      Fler
Featuring

    
      Mortel & Remoe
Producers

    
      Christopher Bauer, Fler, Grasser & 7 more
Writers

    
      Christopher Bauer, Fler, Grasser & 9 more
Additional Vocals

    
      Kool Savas & Remoe
Artwork

    
      Memo Filiz & Omely"
"13","Fler & Jalil","On/Off Beziehung","Epic","[Hook: Fler]
Sie will, dass ich bei ihr bleib'(hello?)
Liegt vor mir im Designerkleid
Ich lauf' davon in weißen Nikes
Und meld' mich nur von Zeit zu Zeit, yeah
Die Beziehung ist on-off
Die Bezieung ist on-off, on-off
Die Beziehung ist on-off
Die Bezieung ist on-off, on-off

[Part 1: Fler]
Immer unterwegs und dann wieder Stress mit dem Album
Erst will sie den Ehering, dann will sie die Scheidung
Breakfast bei Tiffany, gemeinsame History
Die Stimmung, sie ist permanent explosiv, die Chemie Nitroglyzerin
Sie weiß, dass ich fremdgeh', ich sag' nicht einmal sorrySie weiß, dass ich fremdgeh', ich sag' nicht einmal sorry
Airmax im Lexus, sie hat gern Sex im Lexus
Fünf K für die Airbags auf ihr'm Solarplexus
Drei Tage Hotel und dann ab zu Chanel
Sie stellt mir die Eltern vor, danach den Bruder, geht alles zu schnell
Sie schreibt mir bei WhatsApp, ich block' sie bei WhatsApp
Bin grad im Studio und schreib' einen Hit, warum du fickst du mein'n Kopf jetzt?
Ständig im Rampenlicht, bin nicht so der Beziehungstyp
Mach nicht auf Kardashian, Schlampe, du wirst nie berühmt
Erst schick' ich sie weg und dann will ich sie wieder
Genau wie Jasmina, Alina, Sabrina

[Hook: Fler]
Sie will, dass ich bei ihr bleib'(hello?)
Liegt vor mir im Designerkleid
Ich lauf' davon in weißen Nikes
Und meld' mich nur von Zeit zu Zeit, yeah
Die Beziehung ist on-off
Die Bezieung ist on-off, on-off
Die Beziehung ist on-off
Die Bezieung ist on-off, on-off

[Part 2: Jalil]
On-Off-Beziehung, sie steht zu mir, so wie ich zu der Siedlung – blood in and blood out
Sex bis zum Morgengrauen, fünf Tausend liegen bar auf dem Tisch, ich kann's ihr blind anvertrau'n
Immer vertrau'n, sie anzugucken – Sightseeing, in den Nike Freeze und tight Jeans
Sie ist loyal, hat es tätowiert, denn jeder, der sie ansieht, will auch Sex mit ihr
Ah, ich beiß' ihr in die Oberschenkel, ah, und wir lassen uns von Drogen lenken
Ah, Alkohol steigert die Promille, Schwanz geht tief rein und testet alle ihre Sinne
Ich hass' es, wenn sie geht, doch lieb' es zu zusehen, mach' tausend Fotos von ihr, so wie Buscapé
Kauf' ihr Unterwäsche, die sie nachts trägt, denn alles, was passiert ist ab achtzehn
Ah, wir sind on-off und off-on, doch sie lässt nichts rein, so wie Buffon
Ich bin die Ausnahme, lande die Treffer, sie gibt ein'n Fick auf die anderen Rapper
Und selbst wenn sie fickt, vermisst sie mich stetig, sie rennt durch Clubs und macht gern auf ledig
Bitch, komm, erzähl nicht, hätt' ich den Ring, wärst du die Erste, die sich schon direkt verehelicht, Realtalk
Wegen dem offenen Beziehungsstatus sind die Bitches hier bei mir im Radius
Doch ich bleib' weiter konsequent, wär' die Pussy kostenpflichtig, wär' ich Konsument
Wir sind on-off bis dato, kenn'n nur Drama, so wie Tony Soprano
Sex in Milano, am nächsten Tag Streit im Hotelzimmer, fünf Minuten später 'ne Umarmung

[Hook: Fler]
Sie will, dass ich bei ihr bleib' (hello?)
Liegt vor mir im Designerkleid
Ich lauf' davon in weißen Nikes
Und meld' mich nur von Zeit zu Zeit, yeah
Die Beziehung ist on-off
Die Bezieung ist on-off, on-off
Die Beziehung ist on-off
Die Bezieung ist on-off, on-off

","https://genius.com/Fler-and-jalil-on-off-beziehung-lyrics","Released June 30, 2017
Distributor

    
      Groove Attack
Label

    
      Maskulin
Executive Producer

    
      Fler
Featuring

    
      Mortel & Remoe
Producers

    
      Christopher Bauer, Fler, Grasser & 7 more
Writers

    
      Christopher Bauer, Fler, Grasser & 9 more
Additional Vocals

    
      Kool Savas & Remoe
Artwork

    
      Memo Filiz & Omely"
"14","Fler & Jalil","Regen","Epic","[Hook: Jalil &Fler]
Scheine regnen, Scheine regnenLasse Diamanten tanzen und die Scheine regnenScheine regnen, Scheine regnenLasse Diamanten tanzen und die Scheine regnenScheine regnen, Scheine regnenLasse Diamanten tanzen und die Scheine regnenScheine regnen, Scheine regnenLasse Diamanten tanzen und die Scheine regnen

[Part 1: Fler]
Ich trau mich zu sagen, was keiner hier sagt(Realtalk)
Nehm, was ich will und ich frag nicht danach
Schau in den Spiegel, seh' gern mein Gesicht(Playboy)
Denn niemand im Game ist hier realer als ich(nein)
Steig in die G-Klasse ein, jede Kopflehne hat einen Monitor
Kille den Louis-Store, kille den Louis-Store(brrr)
Ficke deine Bitch im Hotelbett
Mal hart, mal laid-back(yeah)
Ja, ich bin nicht mehr wie früher
Ein Star so wie vorne auf dem Kühler
Egal, wie die Wichser jetzt haten
War vieles, doch niemals ein Lügner
War vieles, doch niemals am faken
Egal, wie die Wichser jetzt haten
Bin weiter die Bitches am daten
Ha, Bitches am daten
Yeah, trage die Louboutins wie andere Nikes
Yeah, mein Kleiderschrank hat nur die neusten Designs
Yeah, ich such' nicht den Ärger, der Ärger sucht mich
Yeah, das Butterfly macht hier von selber ein'n Stich

[Hook: Jalil &Fler]
Scheine regnen, Scheine regnenLasse Diamanten tanzen und die Scheine regnenScheine regnen, Scheine regnenLasse Diamanten tanzen und die Scheine regnenScheine regnen, Scheine regnenLasse Diamanten tanzen und die Scheine regnenScheine regnen, Scheine regnenLasse Diamanten tanzen und die Scheine regnen

[Part 2: Jalil]
Scheine fliegen durch den Nachtclub
Auf die Schlampen mit Verachtung
Diamanten reflektieren in den Scheinwerfern
Und bringen die Hater aus der Fassung
Beweg' mich wie einstudiert
Auf der Kette Gangsigns graviert
Werd' gesponsort vom Adidas-Store
Und der Bart wächst wieder in die Taliban-Form
Deine Bitch leg' ich flach wie eine Yogamatte
Denn ihr Körper ist geformt wie eine Cola-Flasche
Mein Wagen, er glänzt nur im Hochglanzlack
Und bezahle mit dem Vorschuss meiner Soloplatten
Selbst der Security grüßt mich mit Namen
Schlafe in Geld, denn nur das hält mich warm
Lauf' durch die City, als wär' ich auf Kamera
Inspirier' Rapper als wär' ich aus Kanada
Alle Features mach ich in Bar
Aber keine Features unter 10K
Stehe im Club und sortier' mir die Bitches
Nach rechts und nach links wie bei Tinder
Drei Flaschen am Tisch
Umzingelt von Ochsen und jeder ist kampfbereit
Bin mein'n Hatern um Längen voraus
Darum will keiner ein'n Schwanzvergleich
Werf die Scheine im Dunkeln
Und die Steine, sie funkeln
Wert der Schuhe ist dreistellig
Mann, ich kam von nichts, hatte nicht ein'n Pfennig
Alles hat sich geändert, außer mein'm Charakter
Realness ist Teil meiner DNA
Das sorgt dafür, dass die Kids heute hör'n
Und befolgen, was dieser Nigga sagt

[Hook: Jalil &Fler]
Scheine regnen, Scheine regnenLasse Diamanten tanzen und die Scheine regnenScheine regnen, Scheine regnenLasse Diamanten tanzen und die Scheine regnenScheine regnen, Scheine regnenLasse Diamanten tanzen und die Scheine regnenScheine regnen, Scheine regnenLasse Diamanten tanzen und die Scheine regnen","https://genius.com/Fler-and-jalil-regen-lyrics","Released June 30, 2017
Distributor

    
      Groove Attack
Label

    
      Maskulin
Executive Producer

    
      Fler
Featuring

    
      Mortel & Remoe
Producers

    
      Christopher Bauer, Fler, Grasser & 7 more
Writers

    
      Christopher Bauer, Fler, Grasser & 9 more
Additional Vocals

    
      Kool Savas & Remoe
Artwork

    
      Memo Filiz & Omely"
