"","artist","title","album","text","url","metadata"
"18","Bushido","Leben, das du nicht kennst","7","[Songtext zu „Leben, das du nicht kennst“]

[Part 1]
Ich kann sehen wie die alte Frau beklaut wird
Weil der Skrupel hier bei unserer Jugend ausstirbt
Kannst du den Jungen sehen wie er sein Stoff vertickt
Er wandert in den Knast doch er nimmt die Hoffnung mit
Siehst du diesen anderen Jungen, der sich wieder schlägt
Widerstand gegen diese Staatsgewalt, Krieger stehen
Kannst du sehen wie sie gerade diese Kasse öffnen
Wir machen sowas, weil wir in die 1. Klasse möchten
So nimmt man den Smog der sich hier verteilt
Ganz egal was passiert, glaub mir du bist hier allein
Nimm das Papier und schreib einfach nur was Gangster ist
Halt die Fresse ich bin einer der authentisch ist
Kennst du das Gefühl, wenn die Kripo grad
An deiner Türe klingelt, scheiße, sie sind wieder da
Ich sag dir was passiert, wenn du nicht abkassierst
Dann ficken sie dich Junge, diesen Smog atmet ihr

[Hook]
So ist das Leben das du nicht kennst
So ist das Leben und für dich kämpfst
Sogar wenn du im Gericht hängst
So ist das Leben wenn es hart wird
So ist das Leben wenn die ganzen Träume platzen
Und es schwarz wird

[Part 2]
Du kannst hier sehen wie die Autotür geknackt wird
Schau in den Spiegel Junge merkst du wie du blass wirst
Mach die Augen auf ich zeig dir wie man Koks streckt
Fällst du ins Gefängnis kommen solltest, Junge so ein Pech
Kannst du sehen wie der Junge vor dem Richter steht
Er möchte nicht hinein, von seinen Freunden sitzen zehn
Sitzen zehn die das Tageslicht vermissen
Die anderen zwanzig konnte man auf der Strasse nicht erwischen
Atme tief ein, atme tief aus
Gib auf, glaub mir meine Jungs sind agressiv drauf
Das ist Strassenrap siehst du er wird vorgeführt
Denkst du wirklich du wirst durch ne Cordon Sport zum Tier
Und glaub mir wenn ich sag das ist der selbe Scheiss
Überall nur Bullen und mein Fazit ist: ""die Welt ist klein""
So ist das Leben hier, jeder Tag ist grau
Soviel scheiss Probleme doch ich zähle sie nicht auf

[Hook]
So ist das Leben das du nicht kennst
So ist das Leben und für dich kämpfst
Sogar wenn du im Gericht hängst
So ist das Leben wenn es hart wird
So ist das Leben wenn die ganzen Träume platzen
Und es schwarz wird

[Part 3]
Wenn es schwarz wird, fällt dir auch das Denken schwer
Sas hier ist meine Gegend, denkst du hier sind Menschen fair?
Hier wirst du abgezogen und geschlagen, so siehts aus
Ghettolife, Ghetto heisst: bring den Eltern Brot nach Haus
Das ist wahr, das ist echt weil es hart ist hier
Siehst du diesen alten Mann, der gerade auf der Strasse friert
Sag mir nicht was fair ist alter, wir leben alle in ner scheiss Welt
Du bist kriminell, du hast kein Geld
Scheisse ich merk langsam wie es kalt wird
Und diese Stahlkette die sich um den Hals schnürt
Wenn du an meinem Grab stehst, bring mir rote Rosen
Scheiss auf den Jackpot, ich hab das falsche Los gezogen
Der Ascheregen fällt, die ganze Stadt sie ist jetzt grau
Von oben wirkt jetzt einfach alles wie ein Bau
Und wir bringen dir den Ärger man, das Gangsterding ist unser Werdegang
Und was dich nicht umbringt macht dich härter man

[Hook]
So ist das Leben das du nicht kennst
So ist das Leben und für dich kämpfst
Sogar wenn du im Gericht hängst
So ist das Leben wenn es hart wird
So ist das Leben wenn die ganzen Träume platzen
Und es schwarz wird","https://genius.com/Bushido-leben-das-du-nicht-kennst-lyrics","Released August 31, 2007
Distribution

    
      Sony BMG
Copyright ©

    
      ersguterjunge
Phonographic Copyright <U+2117>

    
      ersguterjunge
Artwork

    
      Ben Baumgarten
Photography

    
      Mat Hennek
Label

    
      ersguterjunge
Featuring

    
      Chakuza, Kay One, Nyze & 2 more
Producers

    
      Auditory, Bazzazian, Beatlefield & 8 more
Writers

    
      Bushido, Chakuza, Kay One & 3 more
Bass

    
      Markus Runzheimer
Copyright ©

    
      ersguterjunge"
"19","Bushido","Outro (7)","7","Ich hab' jetzt acht Jahre durchgerapptVier davon ging ich durch den DreckIn den ander'n vier hab' ich mich durchgesetzt
Ich bin kein Typ, der wegen Gold auf überheblich machtIhr habt mich on top gesehen, ihr habt mich geseh'n im Knast
Guck ich werd' jetzt 29, wer macht auf erwachsen?
Meine Fans sind wie Geschwister, sie sind mit mir aufgewachsen
Jetzt wird dieser Traum zerplatzen, mich macht die Scheiße müde
Springe von der Klippe, aber Mama ich hab' keine Flügel
Keine Flügel, die mich tragen und nach Hause bringen
Kannst du's hören? Die Engel hören auf zu singen
Hörst du auf zu singen? Sonny, hörst du auf zu rappen?
Tut mir Leid, ich kann euch diesmal aus dem Alptraum nicht wecken
Wenn der Teufel sagt: ""Tu es"", bleibt mir keine Wahl
Scheiß' auf Geld, Geld ist nur Papier mit ein paar Zahl'n
Er meint ich hätte meine Seele verkauft
Das Leben zeichnet dich mit Narben, doch ich nehm' sie in Kauf
Ich gebe nicht auf; Mama die Tapete ist grau
Das Feuer in mir drin es wurde zu 'nem Regen aus Staub
Dieser Junge fühl sich ausgebrannt
Wo ist dieses Licht? Es ist ausgegangen
Das geht an die Fans: Tausend Dank!
Nichts im Leben ist hier selbstverständlich
Ich bin nicht wie and're Stars, and're werden durch ihr Geld nur ängstlich
Und ich laufe mit erhobenem HauptOhne Moral, Drogen und Frau'n
Das hier bleibt Bushido
Ich wollte einfach nur, dass meine Taten weiterleben
Auch wenn ich mal aufhöre zu atmen
Wird es kein Problem
Guck her ich bleib' hier stehen, doch die Welt dreht sich weiter
Dreht sich weiter, auch wenn ich dann kläglich scheiter'","https://genius.com/Bushido-outro-7-lyrics","Released August 31, 2007
Distribution

    
      Sony BMG
Copyright ©

    
      ersguterjunge
Phonographic Copyright <U+2117>

    
      ersguterjunge
Artwork

    
      Ben Baumgarten
Photography

    
      Mat Hennek
Label

    
      ersguterjunge
Featuring

    
      Chakuza, Kay One, Nyze & 2 more
Producers

    
      Auditory, Bazzazian, Beatlefield & 8 more
Writers

    
      Bushido, Chakuza, Kay One & 3 more
Bass

    
      Markus Runzheimer
Copyright ©

    
      ersguterjunge"
