"","artist","title","album","text","url","metadata"
"13","Kool Savas","Techno Pilot","Die john bello story iii","[Kool Savas - Verse I:]
Rappt, ihr Idioten, Techno Piloten
Sie verkaufen ihren Hintern wie Opel
Was fresh, ihr lebt noch hinter dem Mond
Wenn ich komme ist Schicht, Winter im Ofen
Behinderte Flows und Ecstacy-Beats
Ihr seid dirt, dirt dirt, wie das Pepp das ihr zieht
Und die Pillen die ihr schmeißt, wir kill'n sie am Mic
Schiebt Optik, ganz ohne Brillen und der gleichen
Diese Deppen können gerne meckern und machen als wäre was
Ich komme und baller dein Mädel bis ihr Schädel platzt
Sie könn mir nicht folgen, fragen: Wie gehtn das?
Lasst dis gerhyme und spielt Federball
Nicht wahr, du Gay genießt die Opferrolle
Loveparade, ich schieß aufDr. Motte
Der Topspitter, immer nochOptiker
Rap tot, hell motherfuckin tech- no ficker

[Kool Savas - Refrain A:]
Techno Pilot - Los, komm in dasOktagon
[8x]

[Olli Banjo]: Chorus B
Nein, Du bist kein Rapper mehr
Du bist ein Tech-Tech-Tech-Tech-Techno Pilot
[2x]

[Olli Banjo - Verse II:]
Rappt, ihr Idioten, Techno Piloten
Künstliche, dreckige, hässliche Drogen
Krebs in den Hoden, Herpess im Arsch
Schweinegrippe an der Lippe und Aids in den Ohren
Ich geb kein fick für Techno Pilot
Steck sechs Kilo Hack deiner Ex in den Po
Du hektischer Vogel, ich rappe dich tot
Auf elektrischem Strom, als hätt ich gekokst
Du bist wie Fähnchen Wind, wechsel das Boot
Wir mach einfach coole Scheiße wie Eskimo-Kot
Ui-ui-ui-ui Techno Polizei
Pille-Pile Jippie-Jippie, g-g-g-g-geil
Ihr macht Patte auf Malle, K-kacke am Ballermann
Dein Label macht deine Rosette zu einer Ananas
Du musst deine Pille schmeißen, Kokain auf Winterreifen
Blas in deine Trillerpfeife *pah pah pah pah*
Frag Sven Väth - Techno PilotFrag Mark Spoon - Das ist schlecht, der ist tot

[Refrain A & B 2x]","https://genius.com/Kool-savas-techno-pilot-lyrics","Released March 12, 2010
Distributor

    
      Groove Attack
Copyright ©

    
      Essah Entertainment
Phonographic Copyright ℗

    
      Essah Entertainment
Photography

    
      Katja Kuhl
Executive Producer

    
      Kool Savas
Artwork

    
      Eric Ullrich
Label

    
      Essah Entertainment
Featuring

    
      Alex Prince, Amar, Azad & 16 more
Producers

    
      Bazz, Benlo, Big Bazz & 7 more
Writers

    
      Alex Prince, Amar, Azad & 27 more
Additional Drums

    
      Igor Lier
Additional Vocals

    
      Ioredana Doleo & Naomi Jackson"
"14","Kool Savas","Weck mich nicht auf","Die john bello story iii","[Part 1: Curse]
Ich steh im Raum, eng, heiß, Sachen kleben voll Schweiß
Er beißt, brennt in den Augen und darum blinzel ich leicht
Das Licht scheint von der Decke auf das Blatt in der Ecke
Gehalten fest in meiner rechten Hand wie heilige Zettel
Diese Bäume verrecken nich umsonst, ich geb mein Versprechen
Ich werd sie rächen, ihren Tod durch Reden ins Leben übersetzen
Ich setz an zu sprechen, öffne die Augen beim ersten Wort
Und seh Vocalkabine, Studio, Mikros und drück Record...

[Part 2: Kool Savas]
...und die Magie nimmt ihren Lauf, der Alchemist mit den Silben
Die Sätze biegen sich wie Kautschuk, beugen sich meinem Willen
Jeder Vergleich ein Flush, jeder Style ein Ass
Jedes Blatt hier haucht mir unendlich Leben ein wie Leonidas
Nimm mir das und du nimmst mir alles
Und ich mein nich Ruhm und das ganze Zeug
Ich hör die Melodie, die Kick mit ihrem Boom und fang an zu träumen
Und seh die Crowd wie sie laut meinen Namen schreit, Arme weit und breit
Das ist alles zu schön um wirklich wahr zu sein also weck mich nich auf

[Hook: Moe Mitchell]
Auch wenn das alles nur gespielt ist...
Auch wenn es hoch und tief ist...
Auch wenn mein Glück nur ein Traum ist...
Lass mich im Glauben daran, aber weck mich nicht auf!
Auch wenn das alles nur gespielt ist...
Auch wenn es hoch und tief ist...
Auch wenn mein Glück nur ein Traum ist...
Lass mich im Glauben daran, aber weck mich nicht auf!

[Part 3: Curse]
Ich weiß nicht, hab ich das verdient oder habe ich Gott überlistet?
Das Glück war falsch adressiert, ich frag mich ob's wirklich für mich ist
Ich halt es in meiner Hand, manchmal Angst, dass es leicht zerbrechlich ist
Wie lächerlich, ich lach laut wie Verrückte, weils nichts besseres gibt
Ich kipp den Rest aus der Flasche weg, kauf ne neue, ne teurere
Ne neue Runde aus Freude auf meine Freunde
Wir feiern heute zum dreihundertfünfundneunzigsten mal
Die Erfüllung des Kindertraums vom Träumer zum Rapstar
Und Neid ist natürlich da, aber Neid ist Unsicherheit
Von gebrochenen Herzen, denn ihr Traum wurd noch nicht Wirklichkeit
Doch ich wisch es weg wie Beschlag auf dem Spiegel im Bad
Und trag meine Freude trotzdem nach draussen auf dass sie sie inspirieren mag
Was gibt es schöneres als wenn Liebe erwidert wird?
Was gibt es krasseres als wenn das was ich denke Denkmal durch Lieder wird?
Ich bin gesegnet doch seh das oft nicht, ich Pessimist
Darum auch wenn mein Glück nur geträumt ist, dann bitte weck mich nicht!

[Hook: Moe Mitchell]
Auch wenn das alles nur gespielt ist...
Auch wenn es hoch und tief ist...
Auch wenn mein Glück nur ein Traum ist...
Lass mich im Glauben daran, aber weck mich nicht auf!
Auch wenn das alles nur gespielt ist...
Auch wenn es hoch und tief ist...
Auch wenn mein Glück nur ein Traum ist...
Lass mich im Glauben daran, aber weck mich nicht auf!

[Part 4: Kool Savas]
Mein treuer Begleiter, ewiger Helfer
Ich hielt an ihm fest, widersetzte mich dem Willen meiner Eltern
Und folgte ihm wie 'nem tonlosen Navi, fand den Weg intuitiv
Den Traum im Hinterkopf während ich nächtelang schrieb
Und ich schlief, um acht als Leiche zur Arbeit, ich sitz am Zeichenbrett
Wehr mich dagegen einzupennen während ich meine Zeilen rap
Und wär es meinem Meister nicht aufgefallen wär vielleicht dieser Track nich'Wie so viele andere davor, wär das nich ätzend?
Ich denk nich dran was danach ist, stress nich wegen Verkäufen
Denn ich weiß die meisten könnten sich so'n Leben nichtmal erträumen
Kein Rapvokabeltest, ich beherrsch diese Sprache hier fließend
Ich schieß mich nicht ab, bin berauscht von dieser Musik, ich lieb das
Und trotzdem bin ich so rastlos, setz ständig noch einen drauf
Denn ich hab Angst dieser Traum hier könnte enden und ich wach auf
Siehst du die Kids da? Sie wurden groß mit mir und ich wurd groß durch sie
Drum lass mich schlafen in ihren Armen, denn ""It was all a dream!""

[Hook: Moe Mitchell]
Auch wenn das alles nur gespielt ist...
Auch wenn es hoch und tief ist...
Auch wenn mein Glück nur ein Traum ist...
Lass mich im Glauben daran, aber weck mich nicht auf!
Auch wenn das alles nur gespielt ist...
Auch wenn es hoch und tief ist...
Auch wenn mein Glück nur ein Traum ist...
Lass mich im Glauben daran, aber weck mich nicht auf!","https://genius.com/Kool-savas-weck-mich-nicht-auf-lyrics","Released March 12, 2010
Distributor

    
      Groove Attack
Copyright ©

    
      Essah Entertainment
Phonographic Copyright ℗

    
      Essah Entertainment
Photography

    
      Katja Kuhl
Executive Producer

    
      Kool Savas
Artwork

    
      Eric Ullrich
Label

    
      Essah Entertainment
Featuring

    
      Alex Prince, Amar, Azad & 16 more
Producers

    
      Bazz, Benlo, Big Bazz & 7 more
Writers

    
      Alex Prince, Amar, Azad & 27 more
Additional Drums

    
      Igor Lier
Additional Vocals

    
      Ioredana Doleo & Naomi Jackson"
"15","Kool Savas","Die John Bello Story erzählt von Franky Kubrick & Moe Mitchell","Die john bello story iii","[Intro: Moe Mitchell]
Die Zeit bleibt stehen, ich geh kurz ein Schritt zurück
Und ich nehm dich ein Stück mit, folgt mir auf mei'm Weg
Denn du musst sehen was ich sag, du musst gehen durch was ich ging
Um zu wissen wer ich bin, komm folgt mir auf mei'm Weg

[Hook: Moe Mitchell]
Das ist der Soundtrack zu meinem Film und hier sind die besten Szenen
Das ist mein Schmerz, die Tränen, mein Struggle
Das ist mein Weg den ich geh bis ich falle
Das hier ist meine Story, das ist meine Story
Das ist das echte Leben
Lauft ein kleines Stück mit in mein' Schuhen
Vielleicht könnt ihr mich jetzt verstehen, lasst mich den Rest erzählen

[Part 1: Franky Kubrick]
Es war 1975 - ein kleines Kind war geboren
Guck, keiner konnt' es damals wissen, doch ein King war gebor'n
Er ist, Sohn einer Deutschen, Sohn eines Türken
Und sie verließen dieses Land, wollten vor Ort was bewirken
Dort fiel er auf - keiner von sein' neuen Freunden war blondUnd alle Kids haben ihn ""Den Deutschen"" genannt, Alman
Er musste lernen morgens allein aufzustehen - da war er 4
Er lerne früh auf eigenen Beinen zu stehen, was auch passiert
Mama nahm ein Blatt Papier in die Hand, malte zwei Zeiger drauf
Er schaute auf die Uhr an der Wand - verglich sie und ging raus
So lernt er schnell wie man die Uhr liest
Wie man sich schnürt und in seinen Schuhen steht
Bevor man in die Schule geht
Mama und Papa war'n politisch engagiertIn einer Zeit wo keiner wusste, was am nächsten Tag passiertEr hatte schiss, konnt' nicht schlafen, hörte Schüsse auf den StraßenMenschen schreien und sie schlagen Polizei im StreifenwagenDes war der Tag vor sein'm sechsten GeburtstagAls Polizisten kamen und sein Dad plötzlich fort warUnd seine Ma - tröstet, küsst und drück ihren kleinenNur eine Woche später flüchten die Zwei - Die John Bello Story

[Hook: Moe Mitchell]
Das ist der Soundtrack zu meinem Film und hier sind die besten Szenen
Das ist mein Schmerz, die Tränen, mein Struggle
Das ist mein Weg den ich geh bis ich falle
Das hier ist meine Story, das ist meine Story
Das ist das echte Leben
Lauft ein kleines Stück mit in mein' Schuhen
Vielleicht könnt ihr mich jetzt verstehen, lasst mich den Rest erzählen

[Part 2: Franky Kubrick]
Zurück nach Deutschland, Tante Edith nimmt sie auf
Und es regnet und es regnet und hört ewig nicht mehr auf
Das erste Mal scheiß Wetter, dichte Wolken, alles grau
Das erste Mal Nutella, Haferflocken und Kakao
Als er hier rüberkam im Zug, da aß er Marzipan
Das Oma ihm geschenkt hat, er erinnert sich noch manchmal dran
Wie als sein Vater wieder auftaucht nach all den Jahr'nUnd er war nicht mehr der selbe, er war ein anderer MannUnd sie gingen von Aachen in die City wo was los warKreuzberg 36 - Ghetto einer GroßstadtDie meisten Kids war'n grob da, man schlug sich auf dem PausenhofMan musste sich halt pausenlos beweisen dass man groß war
Der erste Rapsong im Radio den er dope fand
Die ersten eigenen Texte, die Tags und das erste WholecarDie ersten Pads und die Sprühdosen die er gestohlen hatDas erste Mal erwischt, das erste Mal holen ihn Bullen ab
Einige Freunde waren in Gangs, das wurd der Weg für sieEr wollte nicht den Selben gehen, guck er war jetzt MC
Bald wird es bei seinen Eltern eng, er beschließt wegzuziehen
Und er lernt dieses Mädchen kennen, sie hieß Melanie
Die John Bello Story

[Hook: Moe Mitchell]
Das ist der Soundtrack zu meinem Film und hier sind die besten Szenen
Das ist mein Schmerz, die Tränen, mein Struggle
Das ist mein Weg den ich geh bis ich falle
Das hier ist meine Story, das ist meine Story
Das ist das echte Leben
Lauft ein kleines Stück mit in mein' Schuhen
Vielleicht könnt ihr mich jetzt verstehen, lasst mich den Rest erzählen

[Part 2: Franky Kubrick]
Das erste Mal unterwegs, hat die ersten Shows
Die ersten Tipps von seinem Mentor - Rest in Peace Boe B
Die erste Crowd, der erste der an ihn glaubt
Und die erste jubelnde Menge von Menschen in die er schaut
Das erste Mal dieses Feeling in seinem Bauch
Der erste Flow auf dem aller ersten Beat den Mel ihm baut
Das erste Mal ab in die Staaten und dann
Zurück in Deutschland, sie bringen Berlin auf die Karte zusamm'
Jetzt warte mal Mann, diese Story hier fängt gerade erst an
Und ihr wisst schon wovon ich rede - History in the makin'
Auf einmal laberte jeder im Business und dieser Szene
Von Hoes, Flows, Moneytoes, vom Spitten und diesen Dingen
Und er krempelt das ganze Game um, Hater hassen sein' Style
Doch um ein paar 16er später steppen alle ans Mic
Und dann - dann kam die Platte raus die Deutschrap verändert
Und seine Herrschaft, die bis heute nicht endet - Die John Bello Story

[Hook: Moe Mitchell] (2x)
Das ist der Soundtrack zu meinem Film und hier sind die besten Szenen
Das ist mein Schmerz, die Tränen, mein Struggle
Das ist mein Weg den ich geh bis ich falle
Das hier ist meine Story, das ist meine Story
Das ist das echte Leben
Lauft ein kleines Stück mit in mein' Schuhen
Vielleicht könnt ihr mich jetzt verstehen, lasst mich den Rest erzählen","https://genius.com/Kool-savas-die-john-bello-story-erzahlt-von-franky-kubrick-and-moe-mitchell-lyrics","Released March 12, 2010
Distributor

    
      Groove Attack
Copyright ©

    
      Essah Entertainment
Phonographic Copyright ℗

    
      Essah Entertainment
Photography

    
      Katja Kuhl
Executive Producer

    
      Kool Savas
Artwork

    
      Eric Ullrich
Label

    
      Essah Entertainment
Featuring

    
      Alex Prince, Amar, Azad & 16 more
Producers

    
      Bazz, Benlo, Big Bazz & 7 more
Writers

    
      Alex Prince, Amar, Azad & 27 more
Additional Drums

    
      Igor Lier
Additional Vocals

    
      Ioredana Doleo & Naomi Jackson"
"16","Kool Savas","Tribut","Die john bello story iii","[Hook]
Mixtapes, Alben, Auftritte, Features, Videos - Sie zollen mir Tribut
Für jedes einzelne Tag auf der Wand, jeden Zug, jede Show
Jede Jam, jeden Flow, den ich erschuf - Sie zollen mir Tribut
Das Alpha, das Beta, das Gamma, das Delta, das Essah
Ich bin Rap bis auf's Blut - Sie zollen mir Tribut
Hebt die Hände hoch (Komm), hebt die Hände hoch (Komm)
Hebt die Hände hoch (Komm) - Sie zollen mir Tribut

[Verse]
Professor Essah, der Prototyp eines Rappers
Rede nicht: Salutier, zoll mir Tribut
Vor mir war nix als Steine und ErdeIch gab euch Sonnenwärme, Reime und BergeFlüsse und Himmel,Deutschrap begann mit""Neongelb"",""NLP""
Dem ""Pimplegionär""und ""Küss meinen Pimmel"",LMSund jetzt
Ist das alles, was ihr Ochsen draus macht?
Ich spritz den Beat voll, bei euch ist nicht mal'n Tropfen im Sack
Ihr rappt auf Techno-Beats? Gut - Punkrock? Gut
Reggae-Mucke? Gut, aber was hat das mit Rap zutun? Nix!
Ich bin der letzte meiner GattungMit 'nem Flow, der mehr Wind machtAls Michael Jacksons Bestattung
Und meine Stimme ist so argh, so argh, so argh!
Deswegen klingt auch jedes Wort so hot, so wahr, so nah!
Dreh die Mucke laut, geh die Wände rauf (Whoo!)
Sie stehen kerzengerade da, wie 'ne Gänsehaut
Der Gladiator, Rap-König, der Hardcore MC
Ich gab dieser Musik hier mein Ja-Wort wie Eminem
Deswegen muss dieser Flow her
Ich mach unendlich weiter, ruh mich nicht auf aus den Lorbeeren
Ihr könnt mich fesseln und schlagen, könnt mich erpressen
Und mir drohen, doch ihr kriegt nie diese Krone
Kriegt mich nicht runter von dem Thron, uh-uh
The best Lyricist, kein Koks, kein wirrer Mist
Ich schreib nur über mich und sag nur, wie es ist
Und sie haben Schiss, dass ich ma' ihre Namen erwähne
In dem Fall wären ihre Karrieren wie Curtis Mayfield gelähmt
Denn diese Szene hier steht hinter mir und fragt nicht malWarum mein Name ""Kool SA"" istWeil bei jedem dieser Bars dein Hintern friert
Renn' wahllos auf euch Rapper wie'n blinder Stier
Und spieß euch auf
Game Over, denkt nicht, dass dieses Spiel euch braucht
Der deutsche Soundtrack zu ""Hustle & Flow""
Die deutsche Version von Russell zum Crowe - Let's go

[Hook]
Mixtapes, Alben, Auftritte, Features, Videos - Sie zollen mir Tribut
Für jedes einzelne Tag auf der Wand, jeden Zug, jede Show
Jede Jam, jeden Flow, den ich erschuf - Sie zollen mir Tribut
Das Alpha, das Beta, das Gamma, das Delta, das Essah
Ich bin Rap bis auf's Blut - Sie zollen mir Tribut
Hebt die Hände hoch (Komm), hebt die Hände hoch (Komm)
Hebt die Hände hoch (Komm) - Sie zollen mir Tribut","https://genius.com/Kool-savas-tribut-lyrics","Released March 12, 2010
Distributor

    
      Groove Attack
Copyright ©

    
      Essah Entertainment
Phonographic Copyright ℗

    
      Essah Entertainment
Photography

    
      Katja Kuhl
Executive Producer

    
      Kool Savas
Artwork

    
      Eric Ullrich
Label

    
      Essah Entertainment
Featuring

    
      Alex Prince, Amar, Azad & 16 more
Producers

    
      Bazz, Benlo, Big Bazz & 7 more
Writers

    
      Alex Prince, Amar, Azad & 27 more
Additional Drums

    
      Igor Lier
Additional Vocals

    
      Ioredana Doleo & Naomi Jackson"
"17","Kool Savas","Halluzinationen","Die john bello story iii","[Vers 1: Kool Savas]
Rap ist Tod, aber ich bin nicht Schuld dran
Ich mach es kurz trenn' deinen Kopf von den Schultern
Das ist mir wurscht, rasier' dein' Arsch, häng' ihn in den Puff
Spreng ihn in die Luft - Sav-ulkanRapper sind nur Pulver, Asche und Staub
Sag deiner Mum nimm ihn zurück durch die VulvaLass ihn im Bauch
Ich passe nicht auf, hört ihr mit dem Irsinn
Deswegen klingt dieser Flow hier so ultra
Deutsche beten Vater Unser, geheiligt sei dieser Türke
Nennen mich Urknall, nicht Uhr
Falls ihr mich sucht, ich chill im Wappen der Kurpfalz
Bleib' mit deinen Affen im Urwald!
Ich hör euch nicht wie wenn ich ich mein Schuh halt und auf stur schalt
Ihr kommt zu spät wie das T grad, ich rede grad
Stellt euch hinten an wie in C-Part
Wartet sie, fragen wie, bitte verfärbt die Arme mit ihren feinen Schauspiel schaut euch Beowulf an
Dann wisst ihr's

[Hook: Kool Savas]
Packt die Nadel auf die Platte, schalte das Mic auf vorn sie wagen es nicht zu fronten, wir haben nie verloren
Wir jagen sie, holen sie uns alle wie in SAW
Was fresh? Das sind alles HalluzinationenWas fresh? Das sind alles HalluzinationenWas fresh? Das sind alles HalluzinationenWas fresh? Das sind alles

[Verse 2: Ercandize]
Sie sagen „guckt mal, dieser Dude, er ist zu fanatisch
Er spuckt Feuer, Flammen, Glut bis die Booth vernarbt ist
Er kommt mit Glatzen auf die Tour, wie paar super Nazis“
Deine Crew gehört nicht auf die Bühne, eher auf Tupperparties
Es reicht ein Funke, falscher Blick und ein schluck Bacardi
Ich hab Bonbons für euch alle und gib deinerKurwa Smarties
Du kriegst das Pulver gratis, schau unser Rat ist
Geh Gassi schmier dir Pansen auf die Backen, bis dein Hund am Arsch ist
Du bist ein Butterkarpfen, machst Party mit Fischen, Gunther und Karsten
Uwe, Peter, Felix und dem Martin „hi“ und der Kathy „hallo“ und dem Vati
Ich komm' mit Ahmed Murat Fatih und schlag sie
Du bist kein Partylöwe, du bist ein Tagelöhner und kein Bodybuilder
Du siehst aus wie ‘n beharrter Döner
Lan, was hübsche Freundin ich find' ein' Krater schöner
Und die große Pussy ist neben den noch ein harter Köter

[Hook: Kool Savas]
Packt die Nadel auf die Platte, schalte das Mic auf vorn sie wagen es nicht zu fronten, wir haben nie verloren
Wir jagen sie, holen sie uns alle wie in SAW
Was fresh? Das sind alles HalluzinationenWas fresh? Das sind alles HalluzinationenWas fresh? Das sind alles HalluzinationenWas fresh? Das sind alles

[Vers 3: Amar]
Geddon S, Erc Erc, alte Rapschule
Du und Rap[??] Minenfeld und Steppschuhe
Du rappst Homes du stammelst, sammel lieber Pfandflaschen
Was Koffer du bist Kategorie Handtaschen
Und Bruder bitte bleib Cool
Was Thron du kriegst einen Stuhl
*psst* Armageddon 1:0, sechster Sinn
Presse wird das schlimm, wenn du es nicht regelst
Setz dich hin und halt die Fresse, wenn du mit mir redest
Amar ein Angstrapper, Original gunklapper
Wenn ich wie Diebe durch die Bank Bretter
Ich hör erst auf wenn deine Mutter auf den Schrank klettertOder dein Vater sich einen Nagel durch den Schwanz schmettertDeine kleine Schwester sich den Kopf rasiertOder dein kleiner Bruder Opfer von Vodka wird
16 Zeilen und die Ficker rennen
Eure Arschbacken verarbeite ich am Mic zu Frikadellen

[Hook: Kool Savas]
Packt die Nadel auf die Platte, schalte das Mic auf vorn sie wagen es nicht zu fronten, wir haben nie verloren
Wir jagen sie, holen sie uns alle wie in SAW
Was fresh? Das sind alles HalluzinationenWas fresh? Das sind alles HalluzinationenWas fresh? Das sind alles HalluzinationenWas fresh? Das sind alles","https://genius.com/Kool-savas-halluzinationen-lyrics","Released March 12, 2010
Distributor

    
      Groove Attack
Copyright ©

    
      Essah Entertainment
Phonographic Copyright ℗

    
      Essah Entertainment
Photography

    
      Katja Kuhl
Executive Producer

    
      Kool Savas
Artwork

    
      Eric Ullrich
Label

    
      Essah Entertainment
Featuring

    
      Alex Prince, Amar, Azad & 16 more
Producers

    
      Bazz, Benlo, Big Bazz & 7 more
Writers

    
      Alex Prince, Amar, Azad & 27 more
Additional Drums

    
      Igor Lier
Additional Vocals

    
      Ioredana Doleo & Naomi Jackson"
