"","artist","title","album","text","url","metadata"
"1","Kollegah","Runde 04","Rba kollegah vs boz 1 battle","[Produced by Bushido & DJ Ilan]

[Part]
Ich hab' ein beängstigendes Glied so wie Lexington Steele
Ey, du bist hässlich und siehst aus wie Ferris MC
Ich punch' dich zum Beat, Raps Muhammad Ali, Depp
Ich handel mit Speed, Crack und Amphetamin
Was willst du tun, Bitch?
Ich komm mit der Uzi und bombe per Kugeln ein Loch
In den blutenden Kopf einer Hure, du Schmock
Bist nicht gut, sondern doch nur ein Schwulen-Maskottchen, wie Troopa Da Don
Du willst ein Battle, dann battle die Wand
Ich zerfetze dich Punk
Und verstecke dich unter der Bettdecke von deiner Tante
Deine Verwandten sind alle schwul und haben Klamotten in Rosa an
Ich verwandele mich in dem Battle in einen tollwütigen Dobermann!
Ich bin ein Bluthund, der bellt und dich zerreißt, Bitch
Du weißt ich bin die Zukunft der Welt, Wie der Treibhaus-EffektUnd das Jahr 2006
Ich zieh die Gun und schieß dir dann ne Ladung Blei auf dein Head
Jetzt sei leise du FaggotKeine Widerworte, MädelSonst hast du ein Rendezvous beim nächsten Kiefer-Orthopäden!
Du hast gegen Ezkey verloren, da du eine Tucke bistDie immer wacker wird, Bitch
Dein billiger Style ist für mich einfach keine Gefahr
Da du wie deine Mutter rappst
Und sie ist sauer, wenn sie deine Runde anhört
Denn es ist eine Schande für sie
BoZ ist dumm und behindert und meint er kann gegen mich siegenWenn ich mit der Kalaschnikov an das Mic step
Und billige Toys auf die Plätze verweise
Du bist ne kleine verdorbene Nutte und wenn du mich siehst
Dann spreizt du die Beine, denn ich komm und gib dir mein Cock in die Fotze
So hart, dass es weh tut und alles voll Blut ist
Mein Penis ist eine gefürchtete Waffe, die Bitches im Battle zerballert, wie Uzis
Nigga spar' dir deine RundeDenn sie wird sich eh anhör'n wie jede andere deiner Runden(Du kennst mich nicht, ich fick die Frau, die du liebst!)
Ach, halt dein Maul, du bist weak, Nigga, saug' an meim Glied!

[Hook]
Die Zielgruppe deines Raps ist Daniel Kübelböck
Ey ich bügel deine Drecksbitch auf einem Bügelbrett!
BoZ wird geschlagen wie Sahne
Ich schlage dein' Kadaver zurück nach Pakistan
Die Zielgruppe deines Raps ist Daniel Kübelböck
Ey ich bügel deine Drecksbitch auf einem Bügelbrett!
BoZ wird geschlagen wie Sahne
Ich schlage dein' Kadaver zurück nach Pakistan

[Outro]
Meine MG entscheidet, deine Lebenszeit geht vorbei
Ich geb dir Blei und deine Seele schwebt ins Jenseits, du Toy
Du kommst zwar aus Hamburg, doch dein Sex findet im Darm statt
Dein Analtrakt dient Verkehrsteilnehmern als Parkplatz","https://genius.com/Kollegah-runde-04-lyrics","Released December 14, 2004
Primary Artists

    
      BOZ & Kollegah
Producers

    
      Bushido, DJ Ilan & Kanye West
Writers

    
      BOZ & Kollegah"
"2","BOZ","RBA Rückrunde 1 vs Kollegah (1. Battle)","Rba kollegah vs boz 1 battle","[Part]
Ich komm' ans Mic von der Dunkelheit ans Licht
Mein Schwert spiegelt sogar in der Dunkelheit das Licht
Du bist unglaublich, Bitch
Ich hör' dein Text an, und glaub es nicht
Unglaublich – Bitch
Du und Kollegah, du bist nichtmal Bang die Atze
Wenn der Boss boxt, kugelst du dich zusamm'n wie 'ne Katze
Du handelst mit Drogen? Was redest du dir ein du Weib?
Nur weil Daddy dir die Drogen spritzt, damit du bei ihm bleibst
Du kannst Doubletime rappen und du bist on point
Gut gemacht, John boy – jetzt schreib dein Song neu
Du bist im Grunde auch nur irgendein Rapper
Alleine wegen deiner Stimme bin ich vierzig mal besser
Ich bin der größte Tacher aus dem allerschlimmsten Märchen
Und steck' dir ein' Schwanz aus Feuer in dein kleines Kinderärschchen
Wo willst du hin Kollegah, der Hund läuft hinterm Herrchen
Hier lang, hier – Hinterherchen
Du hast gesagt, meine Fans sind wie Küblböck'
Ich pimper dein' Po und du denkst an Düsenjets
Mach' 'n Lügentest, alle Rapper lügen jetzt
Ich mach' mein Part, und alle Rapper üben jetzt
Wir sind keine Gangster, wir sind nichtmal harte Typen
Aber wenn du meine Tracks hörst, kriegst du Nasenbluten
Alles Arschgeburten
Kollegah, du redest du viel von deinem Schwanz – Du hast nen Kurzen
Digga, du denkst du bist schnell, aber dein Doubletime bockt nicht Deine behinderten Doubletime-Parts kannst du dir metertief in den Arsch stecken
Ich bin so dope, ich zermatsch' dich zu Brei wie Kacke
Du machst einen auf innovativ und fährst immer die gleiche Masche
","https://genius.com/Boz-rba-ruckrunde-1-vs-kollegah-1-battle-lyrics","Released December 14, 2004
Primary Artists

    
      BOZ & Kollegah
Producers

    
      Bushido, DJ Ilan & Kanye West
Writers

    
      BOZ & Kollegah"
"3","BOZ","RBA Hinrunde 2 vs Kollegah (1. Battle)","Rba kollegah vs boz 1 battle","[Part]
Okay, komm' Kollegah, wir müssen an die Gewehre gehen
Ich muss dich sofort vernichten, wie Antimaterie
Du bist vollgestopft mit Dreck, wie 'ne Junkie-Arterie
Ich bring' dich dreimal um und dann geht das ganze in Serie
Das is' Battlerap und du weißt, was dazugehört
Ich würg' dich so lang, bis dein Kopf nicht mehr durchblutet wird
Diggah bist du gestört, verpiss dich mit dei'm Doubletime
Mittlerweile klingt jeder so wien' stotternder Sappel[3:35?]
Wenn du dich jetzt erst setzt, setzt du dich in Kacke rein
Du verlierst die Fassung und dein Headset ist jetzt abgefallen
Vorsichtig, Mann, ich halt' dich auf kurze Distanz
Und dann furz' ich dich an
Noch bevor du verstanden hast
Wieso du meinen ganzen Arsch in dein' Gesicht hast
Ich wollt'[?] mich für dich anstreng', du siehst, dass ich es nicht mach'
Denn es reicht, wenn ich ein paar Zeil'n kickt
Deine Knie zittern,, bis dein Bein bricht
Du bist peinlich, und das wars Bitch
Du kriegst hier noch ein Arschtritt

Bang
(Pu—Ba–Dang)

","https://genius.com/Boz-rba-hinrunde-2-vs-kollegah-1-battle-lyrics","Released December 14, 2004
Primary Artists

    
      BOZ & Kollegah
Producers

    
      Bushido, DJ Ilan & Kanye West
Writers

    
      BOZ & Kollegah"
"4","Kollegah","Runde 05","Rba kollegah vs boz 1 battle","[Intro]
Okay mann, ich bin grad heimgekommen, Alter!Ich mach jetzt noch schnell die Runde und dann geh ich pennen!Ich brat mir noch 'n Spiegelei dabei, ist ja kein ProblemDeine Vorlage war ja nicht besonders schwer - zu kontern. Also!Jetzt noch schnell die Runde, Digga!

[Part 1]
Komm jetzt BoZ, wir müssen an die Gewehre gehenUnd ich durchlöcher dich öfter als Junkie-Arterien
Denn ich bin erst zufrieden, wenn ich Punks unter der Erde sehe
Geh' sterben, BoZ. Denn du nervst schlimmer als Bärbel Schäfer
Mein Headset ist jetzt abgefallen und was soll's?
Bitch, Dein Head ist jetzt abgefallen - und er rollt!
In Richtung Park, Bitch, kleine Kinder spielen Fußball damitUnd dann jeder Schuss ist sozusagen wie ein Arschtritt für DichDenn du bist ein Arschgesicht und rappst beschissen
Du trittst deine Mama um ne dicke Runde zu kicken!
Ja, das ist Battlerap und ich weiß was dazu gehört
Und du bist's leider nicht, denn du gehörst zu den Golden Girls!
Ich beklebe deine Mum mit Paketklebeband
Geb ihr nen Punch und sie fliegt quer durchs Land wie Magnetschwebebahnen
Denn BO hat nichts in der Hose, außer Bügelfalten
Keiner mag dich, weil du stets ein' fahren lässt, wie grüne Ampeln
Wie willst du mich erwürgen? Mit deinen Mädchen-FingernIch werd' dein Mädchen fingern, bis sie zittert wie bei Schnee im Winter!
Ich nehm' dir den Blinddarm raus und stranguliere deine Kehle
Amputiere deinen Schädel, deine Haut wird Wandtapete in meinem Wohnzimmer
Peinlich ist höchstens deine kleine Schwester, denn Sie ist behaarter als ein Gorilla
Ich bin ein Killer, der Dich abknallt du Bitch
Was den Effekt hat, dass du von nah den Asphalt besichtigst!

[Outro]
Yeaaaahh...!
Weißt du wieviel Nutten ich heut gefickt hab, Nigga?Drei Stück - Und eine davon warst Du!
Okay, Nigga!
Ich geh pennen, es ist halb vier!","https://genius.com/Kollegah-runde-05-lyrics","Released December 14, 2004
Primary Artists

    
      BOZ & Kollegah
Producers

    
      Bushido, DJ Ilan & Kanye West
Writers

    
      BOZ & Kollegah"
"5","Kollegah","Runde 06","Rba kollegah vs boz 1 battle","[Produced by Kanye West]

[Part 1]
Ich bin grade aufgestanden, es ist Viertel vor 12Egal, ich hau' dir jetzt in deinem eigenen Viertel eins auf die Zwölf
(Pom Pom Hurensohn!)
Lauf zu Mama, sonst erhältst du von der Faust von K-O-Doppel-L
'nen Schlag auf's Trommelfell
Du stehst vor'm Traualtar, gibst deiner Frau das Ja-WortDoch sie antwortet nicht, denn sie ist aufblasbar
Du bist neidisch auf mein' SchwanzMotherfucker, was kann ich dafür?Hab' ich ihn nur halb drin sagen Hoes, ich wirke distanziert
Ich besuche deine Stadt, bewaffnet mit 'nem Golfschläger
Und verursache mehr Kieferbrüche als ein Holzfäller
Deine Mom ist lustig, wenn ich zufällig vorbei komm'Springt sie mir sofort an meine Eier, nenn' es Eisprung
Du hast Homies in der Jury und solltest du gewinnenDann höchstens durch Schiebung, so wie beim Sumoringen
Ich bin der Bitcheskenner und Gewichtestemmer im Fitnesscenter
B-O wird gepuncht und ist schwer mitgenommen wie dicke Tramper

[Kollegah imitiert BoZ]
Ey Kollegah, digga, ich weiß du hast mich schon mal gefickt wie ne Bitch.Aber ey ich hab zum Schluss noch eine Bitte so. Ey kannst du vielleicht nochmal so richtig geil abflowen? Geht das klar?
[Kollegah]
Ey für meine Fans doch gerne, pass auf!

[Part 2]
Ich zerficke deine billigen Parts mit der Fist
Und verbrenne deine Mutter mit Napalm Geschütz
Deine Bitch ist auch bei meiner [?] geworden
Und ich hab mit einigen Homies zusammen ihr Grabmal bepisst
Pass auf, ich kille dich zum Beat, ficke deine Bitch
Gib ihr dann paar Tritts, ficke deine Hits
Nigga, du bist weak
Penner, geh mir bitte nicht auf die Eier
Laber mich nicht voll mit ""Gib mir bitte Feedback""
Punk, ich amputiere deine Füße und du flehst mich an von wegen
""Nigga, gib mir doch mal bitte meine Feet back""
Ich fick mit deinem Girl Motherfucker
Ich hab das Gefühl, ich bin jetzt in die Ho verliebt
Und kann nicht ohne sie, ich geh Kondome ziehen und komme wieder
Und dann popp' ich sie die ganze lange Nacht zu dopen Beats von Jordan C
Oder von dem Nigga Timbaland
Bitch, ich trage meine Timbalands
Viele nennen mich den deutschen Twista
Doch ich selber nenne mich den deutschen Killa Cam
Ich kille deine Family mit einer Gilloutine, Nigga
Bis du ganz alleine bist und keiner dich mehr lieb hat
Nein, ich gebe dir kein Feature, weil ich busy bin ich ficke gradeGina Wild und laber dann wie zwei wie Nina Sky, Nigga","https://genius.com/Kollegah-runde-06-lyrics","Released December 14, 2004
Primary Artists

    
      BOZ & Kollegah
Producers

    
      Bushido, DJ Ilan & Kanye West
Writers

    
      BOZ & Kollegah"
"6","BOZ","RBA Rückrunde 3 vs Kollegah (1. Battle)","Rba kollegah vs boz 1 battle","Runde drei diggah

[Part]
Yo, uh
Geh bitte zurück nach Kanada, Mann
Ich war bei deiner Mama der Kameramann
Sie war mal n Mann heute ist sie ne Frau
Aber dass sie mehr sieht fick ich sie bis in den Bauch
Ich bin der beste Rapper ever, clever smart und gut
Füge dich bei den Affen deiner Art hinzu
Stecke dir ne Waffe in den Arsch und Boom
Wie der Soldat bei Doom
Du bist ein armes Huhn
Schlag' dir den Kopf ab brech' dir die Flügel
Du bist monoton und die Raps sind gefühllos
Kollegah, du bist so ne billige Imitation
Du kannst halftimen so wie SImitar flowen
Behinderter Sohn von 'ner Prostituierten
Lass dich am besten []operieren in die Augen
Lieder rappen für Forenkids, die glauben dir das
Du Haufen Tierkacke
Spit, aber bitte bedenk
Es wird ein bitteres Ende nehmen
Nach diesem Battle kannst du durch deine Hände sehn'
Bitch ich tank die tops und ich [?]
Du denkst nur hoffentlich fickt BOZ mich nicht nochmal
Denn jetzt hast du n größeres Loch im Kopf als n Pottwal

[Outro]
Fucker","https://genius.com/Boz-rba-ruckrunde-3-vs-kollegah-1-battle-lyrics","Released December 14, 2004
Primary Artists

    
      BOZ & Kollegah
Producers

    
      Bushido, DJ Ilan & Kanye West
Writers

    
      BOZ & Kollegah"
