"","artist","title","album","text","url","metadata"
"1","Bushido","Intro (7)","7","[Intro/Sample]Überall an jeder Straßenecke sehen wir TodsündenIn jeder Wohnung... und wir nehmen es hinWir tolerieren es, weil es schon zur Gewohnheit geworden istEs ist trivialWir tolerieren es morgens, mittags und nachtsNun... ab jetzt nicht mehr!

[Part]
Ihr habt so lange drauf gewartet man
Doch ich bin wieder mal zurück
Und jeder deutsche Rapper wird von mir gefickt
Das ist der Beton
Fresse, das bin typisch ich
Du wirst therapiert bis du auf die Tränen Drüse drückst
Die meisten Nutten sind am kotzen, weil das Album kommt
Wer sagt ich bin weich geworden? Ich bring die Gewalt in Songs
Ich renn einfach auf die Bühne rauf, wenn ich nicht darf
1000 Euro Strafe, denn ich sitze im Gericht und schlaf'
Sonny Black ich bin dreifach aggressiv
Reis die Maske runter, fresse, ich hab einfach Appetit, yeah
Die Patronen fallen, hörst du die Kanone knallen?
Bring mir ne Rakete, und ich schieße Fettes Brot in All
Ich bin der Junge der die Platten verkauft hat
Der kriminelle scheiß Kanacke aus der Hauptstadt
Schau den Gangster an, wer ist aus dem Knast gekommen?
Kletter jetzt zurück, und ich zertrete deinen Pappkarton
EGJ Labelboss, das ist Gangster Rap
Fresse, ich bin King und nimm dir deine Rente weg
Keiner wird hier auf der Street akzeptiert
Auf der Street hast du dich mit Keep it Real krass blamiert
Wir verstehen deine Sprache nicht, du bist leider du
Leider Schwul, leider quatscht du mich mit jeder Scheiße zu
Kannst du sehn, ja, die Wolken reißen auf
Ja, ich such ein schlechtes Vorbild und folter' einen Clown
Ich bin zurück, jetzt wird die Szene aufgemischt
Und für mich gehört in Sachen Rapper jeder ausgeknipst
Immer noch ich, das ist Album Nummer 7
Und sie wollen mir hier echt den Mund verbieten, dann fickt euch
Ab sofort hab ich offiziell mit jedem Streit
Und ich ficke deine Schwester, meine Tracks sind themenreich
Ich mach vor keinem Halt, Jungs von den Straßen sind so
Ihr Zecken, das war grade mal das Intro","https://genius.com/Bushido-intro-7-lyrics","Released August 31, 2007
Distribution

    
      Sony BMG
Copyright ©

    
      ersguterjunge
Phonographic Copyright <U+2117>

    
      ersguterjunge
Artwork

    
      Ben Baumgarten
Photography

    
      Mat Hennek
Label

    
      ersguterjunge
Featuring

    
      Chakuza, Kay One, Nyze & 2 more
Producers

    
      Auditory, Bazzazian, Beatlefield & 8 more
Writers

    
      Bushido, Chakuza, Kay One & 3 more
Bass

    
      Markus Runzheimer
Copyright ©

    
      ersguterjunge"
"2","Bushido","Hinter dem Horizont","7","[Part 1]
Ich war nicht verschwunden, Junge
Ich war nur hinter dem Horizont
Du findest Bushido, wenn Geräusche von Patronen komm'n
Ich bin wieder back, ich hab mir das Ziel gesetzt
Mich stark zu machen für den ganzen primitiven Dreck
Wir bleiben böse Jungs, ohne Bildung, ohne nichts
Ohne Perspektive und jetzt Auftrittstverbot für mich
Selbst Politiker, sie möchten es verschlimmern
Denn ich bringe Terror in die Köpfe ihrer Kinder
Ich spreche nur das aus, was sich keiner traut
Ich seh' Jugendliche, die am dealen sind und schreib es auf
Ihr seht Jugendliche dealen, doch ihr scheißt darauf
Ihr bringt lieber Studien, dass heute jeder Zweite klaut
Armes Deutschland, wenn das die Presse sieht
Dass ihr eure scheiß Probleme jetzt schon auf 'nen Rapper schiebt
Ich sag euch eine Sache: Ihr werdet mich nicht los bekomm'
Dieser Mann war hinter dem Horizont

[Hook]
Ihr dachtet wirklich alle dieser Mann ist fort
Sorry, doch ich musste nochmal wiederkomm'n
Ich sag euch eine Sache: Ich war niemals weg
Denn ich war nur hinter dem Horizont
Ich scheiß drauf, dass sie mich jetzt verbieten woll'n
Und meine Leiter brechen, dass ich nicht nach oben komm'
Ich sag euch eine Sache: Ihr bekommt mich niemals weg
Dieser Junge war hinter dem Horizont

[Part 2]
Hinter dem Horizont,das hier ist nicht Carlo Cokxxx
Album Nummer Sieben und ich bringe den Sopranos-Flow
Sieben krasse Alben, sieben mal zufriedener
Sieben, um das Gold zu bekommen für den 7er
Ihr seid im Bushido Fieber, jeder möchte ein Bushido-Feature
Halt die Fresse, kauf dir ein Bushido-T-Shirt
Hab ich schon erwähnt, dass ich Platin bin?200.000 CDs, das ist Marketing
Deutschraps Next Level,ersguterjunge
Du willst Praktikant sein? Knie vor meinem Chefsessel
Scheiß drauf wieviel Geld ich noch verdien'
Selbst im Bravo-Interview red' ich von edlem Kokain
Ich bin immer noch ich, siehst du, nichts hat sich verändert
Echte Gangster hassen immer noch dich
Und ich brauche kein' Personenschutz
Es ist Schicksal wenn Personen komm'n
Ihr findet mich hinter dem Horizont

[Hook]
Ihr dachtet wirklich alle dieser Mann ist fort
Sorry, doch ich musste nochmal wiederkomm'n
Ich sag euch eine Sache: Ich war niemals weg
Denn ich war nur hinter dem Horizont
Ich scheiß drauf, dass sie mich jetzt verbieten woll'n
Und meine Leiter brechen, dass ich nicht nach oben komm'
Ich sag euch eine Sache: Ihr bekommt mich niemals weg
Dieser Junge war hinter dem Horizont

[Part 3]
Hinter dem Horizont, die Wolken werden schwarz
Ich verklage Rapper jetzt schon international
Geschäft bleibt Geschäft, Mann
Junge, das hier bleibt die Straße
Und Gesetz bleibt Gesetz, Mann
Sie mein', dass Kriminelle mich im Knast hör'n
Ich sag mit Stolz, dass die Brüder mich im Knast hör'n
Ich schreib das Album für die Jungs hier auf den Straßen
Der Smog ist wieder da, ihr dürft alle wieder atmen
Das hier bleibt die Ansage, Mann, auf der Anklagebank
Schreib ich dir 'ne Autogrammkarte, dann
Bist du Witzfigur glücklich
Ich krieg die Stelle schon im Voraus
Du schwule Missgeburt, fick dich
Ich geh nicht weg von hier, ich bin mir treu geblieben
Hab mich nicht verändert und deswegen gibt es heute sieben
Gott sei Dank ist es so gekomm'n
Ich dreh mich um und warte hinter dem Horizont

[Hook]
Ihr dachtet wirklich alle dieser Mann ist fort
Sorry, doch ich musste nochmal wiederkomm'n
Ich sag euch eine Sache: Ich war niemals weg
Denn ich war nur hinter dem Horizont
Ich scheiß drauf, dass sie mich jetzt verbieten woll'n
Und meine Leiter brechen, dass ich nicht nach oben komm'
Ich sag euch eine Sache: Ihr bekommt mich niemals weg
Dieser Junge war hinter dem Horizont","https://genius.com/Bushido-hinter-dem-horizont-lyrics","Released August 31, 2007
Distribution

    
      Sony BMG
Copyright ©

    
      ersguterjunge
Phonographic Copyright <U+2117>

    
      ersguterjunge
Artwork

    
      Ben Baumgarten
Photography

    
      Mat Hennek
Label

    
      ersguterjunge
Featuring

    
      Chakuza, Kay One, Nyze & 2 more
Producers

    
      Auditory, Bazzazian, Beatlefield & 8 more
Writers

    
      Bushido, Chakuza, Kay One & 3 more
Bass

    
      Markus Runzheimer
Copyright ©

    
      ersguterjunge"
"3","Bushido","Es kann beginnen","7","[Part I:]
Ihr wollt die Songs verbieten
Guck ich sende live von dem Piratensender
Ich mach ein Blutbad und glaubt mir
Hier baden Gangster
Mein Lebensstil ist wie ein Ticket in den Knast
Schenk mir zum Geburtstag eine Kiste voller Schnaps yeah
Denkst du wirklich noch ich halte mich zurück du Kek
Zurück du Kek ich unterhalte mich hier nicht mit Dreck
Was willst du Affenhure
Deutscher Rap ist Massenmord
Die Amis lassen mich nicht rein ich hab den Pass verloren
Du bist wie Elton JohnDu bist als Schwuler auf die Welt gekommenMänner sind in deinen Arsch für Geld gekommen
Ich bin umstritten und das ganze Land hat Angst
Deine Freundin heiratet am Standesamt den Schwanz yeah
Ich mach dich fertig Junge
Du rauchst ne Friedenspfeife
Dann zieh noch mal bevor ich dich auf die Vitrine schmeiße
Geh mir aus den Augen
Ich mein das nur im Guten
Und du kannst weiter meine Skrupel suchen

[Hook]
Kannst du die Sonne sehn
Ich beschreib euch Nutten wie die Sonne gerade hinter meinen Blöcken hier verblasst
Wir klettern wiedermal aufs Dach
Dieser Blick geht auf die Stadt und ich sag nur lieber Gott es werde Nacht
Kannst du die Streife sehn
Sag mir kannst du sehn wie sie um die Blöcke fahrn und sie denken wir sind blind
Wir klettern wiedermal vom Dach
Und auf uns wartet der Knast
Und ich sag nur lieber Gott es kann beginnen

[Part II:]
Die Sonne geht und meine ganze Stadt wird anthrazit
Und jeder weiß Bescheid dein Nebenjob ist Transvestit
Das ist wie Speed
Der Espresso hält mich fit
Dein Verhalten bricht dir hier im Ghetto das Genick yeah
Wer hohlt die Base raus
Sag mir wer ist Mannsgenug
Ich soll mich kurz beschreiben
Ghetto,arrogant und klug
Außerdem bin ich der Inbegriff von stur
CLAMG das ist Gangsterrap ihr Huren yeah
Ich lach dich aus
Du Gangster auf ner Hantelbank
Ich komm zu dir und zünde deinen schwulen Ledermantel an
Hier gibt es nichts zu diskutiern weil ich das Thema bin
Was ist das Abitur ich ficke deine Lehrerin
Komm in den Fightclub komm wir erwarten dich
Für deinen Vater gibt es so wie jeden Abend Fisch
Weil eure scheiß Familie stinkt du hast ne heiden Angst
Du bist diesen Beef mit mir eingegangen

[Hook]

[Part III:]
Es kann beginnen also geh mit deinem Schwulen grillen
Du Straßenpenner sammelst Kohle um den Hut zu füllen
Ich fick dein Ego-Tripp
Geh mit deinen Zecken los
Deine Freunde gehn zur Uni meine strecken Koks
Du bist cridible besorg mir was zu ziehn
Du wolltest davon rappen jetzt besorg das Kokain
Ich beförder dich ins Krankenhaus
Ja und ich äußer mich jetzt öffentlich bei Kerner
Dass ich ab und zu paar Schlampen hau
Gangsterrap höchstes Level
Das ist der Rhythym für die Street
Lad das Magazin
Bizzy mach den Beat yeah
Man wir sind aufgewachsen zwischen diesem Blaulicht
Du willst mich ficken willst mir drohen ja dann trau dich
Ich komm zu dir,komm zu ihr und ich regel das
Ich scheiß auf alle und ich scheiß auf euer Sägeblatt
Wer kann mir das Wasser reichen
Ich fick dein ganzen Missgeburtenclub
Scheiß egal wie ihr Missgeburten guckt","https://genius.com/Bushido-es-kann-beginnen-lyrics","Released August 31, 2007
Distribution

    
      Sony BMG
Copyright ©

    
      ersguterjunge
Phonographic Copyright <U+2117>

    
      ersguterjunge
Artwork

    
      Ben Baumgarten
Photography

    
      Mat Hennek
Label

    
      ersguterjunge
Featuring

    
      Chakuza, Kay One, Nyze & 2 more
Producers

    
      Auditory, Bazzazian, Beatlefield & 8 more
Writers

    
      Bushido, Chakuza, Kay One & 3 more
Bass

    
      Markus Runzheimer
Copyright ©

    
      ersguterjunge"
"4","Bushido","So sein wie sie","7","[Songtext zu „So sein wie sie“]

[Part 1: Bushido]
1978, er kam ohne Schatten auf die Welt
Seine Mutter musste putzen denn sie hatten noch kein Geld
Andere sorgen als manche Leute die mit Geld gesegnet sind
Eine starke Frau die in Problemen schwimmt
Tränen sind
Auf ihren Wangen zu erkennen wenn sie schlafen will
Sie wollte nicht viel nur seinen Magen füllen
Er hat sie im stich gelassen
Sie konnt es nich verkraften
Es is leicht, ein Kind zu machen
Doch bring mal ein Kind zum lachen
Auf sich allein gestellt hat sie ihn dann großgezogen
Sie war für ihn da, sie hat auf ihren Tod geschworen
Doch was dem Jungen einfach fehlte war ne harte Hand
Ne Mutter kann Sachen nich rüberbringen so wies ein Vater kann
Er hat gemacht worauf er bock hatte
Was er grad im Kopf hatte
Wenn er diesen Umgang mit Gesocks hatte
Dann brachten Bullen ihn zum ersten Mal nach Haus
Mit 13 bewaffnet das erste Mal geklaut

[Hook: Bushido]
Eines Morgens bin ich aufgewacht
Ich wusste schon sehr früh ich bin ein Teil von ihnen
Ich wollte sein wie sie
Kein Therapeuth, Pädagoge konnte mich damals im Heim erziehn
Ich wollte sein wie sie
Ich hatte Koks, hatte Gras, hatte Trips
Es war mein Gebiet
Ich wollte sein wie sie
Mama es tut mir leid du weinst
Und ich weiss du verziehst mir nie
Doch ich wollte sein wie sie
So sein wie sie

[Part 2: Bushido]
2 Jahre Später
15, Vorbestraft Streit mit dem Lehrer
Mit 16 wurd er rausgeschmissen
Er fing an zu den falschen Leuten aufzublicken
Er war jung drauf geschissen
Wer entscheidet schon was falsch oder richtig ist
Wichtig war ihm Geld und er vertickte Trips
Langsam kamen die Großen auf ihn zu
Er wurde ihr Kurier
Also fick auf jeden Wichser der Studiert
Das Motto auf die schnelle was verdienen
Kriminelle Energien
Hat er guten Stoff bestelle ich bei ihm
Er sah die ganzen Älteren die alle schon ein Namen hatten
Gangster die sich Namen machten
Und über die Strafe lachten
Das hier ist Berlin
Er hatte keinen Vater mehr
Im Bezug auf seinen kleinen Bruder fühlt er sich als ob er Vater wär
Räumte jeden Laden leer
Er wollte wie die großen sein doch wie soll man so was diesem Staat erklärn

[Hook: Bushido]
Eines Morgens bin ich aufgewacht
Ich wusste schon sehr früh ich bin ein Teil von ihnen
Ich wollte sein wie sie
Kein Therapeuth, Pädagoge konnte mich damals im Heim erziehn
Ich wollte sein wie sie
Ich hatte Koks, hatte Gras, hatte Trips
Es war mein Gebiet
Ich wollte sein wie sie
Mama es tut mir leid du weinst
Und ich weiss du verziehst mir nie
Doch ich wollte sein wie sie

[Part 3: Bushido]
So sein wie sie; und die Jahre vergingen
Er bereut es heute, keine seine Taten als Kind
Er geht auf die ende 20 zu
Er sucht den inneren Frieden
Doch guck er kann nich ruhen
Weil ihn das verlangen ruft
Es wurd ihm beigebracht
Das ganze Leben ist vergleichbar mit ner Einzelhaft
Dreh nich durch beweis dir was
Es ist ein Geistesblitz
Er sieht die Älteren von damals
Aber heute sitzen beide hier an einem Tisch
Und trotzdem spürt er dieses böse Blut
Sag was du in der Höhle eines Löwen suchst
Wenn der Instinkt zum töten ruft
Töten um zu überleben
Wenn du vermögen hast nich drüber reden
Es gibt falsche Freunde die bei Brüdern stehlen
Und deswegen bin ich nur noch im Café
Und deswegen werd ich nur noch hier gesehn
Das ist Al-Bustan
Guck was im Ghetto so passiert
Du kannst mich aus dem Ghetto holen
Doch das Ghetto nicht aus mir

[Hook: Bushido]
Eines Morgens bin ich aufgewacht
Ich wusste schon sehr früh ich bin ein Teil von ihnen
Ich wollte sein wie sie
Kein Therapeuth, Pädagoge konnte mich damals im Heim erziehn
Ich wollte sein wie sie
Ich hatte Koks, hatte Gras, hatte Trips
Es war mein Gebiet
Ich wollte sein wie sie
Mama es tut mir leid du weinst
Und ich weiss du verziehst mir nie
Doch ich wollte sein wie sie","https://genius.com/Bushido-so-sein-wie-sie-lyrics","Released August 31, 2007
Distribution

    
      Sony BMG
Copyright ©

    
      ersguterjunge
Phonographic Copyright <U+2117>

    
      ersguterjunge
Artwork

    
      Ben Baumgarten
Photography

    
      Mat Hennek
Label

    
      ersguterjunge
Featuring

    
      Chakuza, Kay One, Nyze & 2 more
Producers

    
      Auditory, Bazzazian, Beatlefield & 8 more
Writers

    
      Bushido, Chakuza, Kay One & 3 more
Bass

    
      Markus Runzheimer
Copyright ©

    
      ersguterjunge"
"5","Bushido","Heile Welt","7","[Hook: Bushido und (Chakuza)]:
Du lebst in deiner kleinen Welt, es tut uns leid, du bist leider Du
(Doch leider kannst du nix erzählen, Mann, von Schweiß und Blut)
Wir sind verschieden, Junge, merk dir eins, wir teilen nicht
(Du lebst in deiner heilen Welt und ja, ich scheiß auf dich )
Ich scheiß auf deine heile Welt, Mann, du bist leider Du
(Verschließ' die Tür, denn du kriegst heute von uns zweien Besuch)
Wir sind verschieden und wir teilen niemals deine Sicht
(Du siehst, wie deine heile Welt in 1000 Teile bricht)

[Strophe I: Chakuza]:
Hier bist du weg und keiner sieht`s, wenn es passiert
Und wirst du frech
Kannst du statt Geld nur eine Kiezschelle kassieren
Es hat sich viel verändert hier
Es wirkt so endlos jeden Tag
Denn statt zu betteln um was Bares
Sagt man: Hände hoch, du Arsch!
Es ist alles Frust und niemals Schluss mit diesem Dreck
Nur ein Schuss und du bist weg
Junge, Russisches Roulette
Und statt lustig ist es hässlich und grau
Und zum Schluss kriegst du statt Essen nur ein Messer in den Bauch
Hört die Sachen und verbietet es!
Ich bin froh, ich brauche Kraft, denn diese Strasse war noch nie gerecht
Idiot, was für ein Absturz, Junge, siehst du es?
Du hast erst Frieden
Wenn dich irgend so ein Bastard mal kurz abmurkst und dann liegen lässt
Du kannst hart sein oder arm
Ein Soldat, bist du da, bist du am Arsch
Scheiß egal, was einmal war
Jeder Schlag trifft dich hart
So schwer am Kopf, wie ein Boxer
Hier ist nur Scarface ein Star und Harry Potter ein Opfer

[Hook]

[Strophe II: Bushido]:
Die Welt ist grau und du siehst jeden Tag den gleichen Müll
Weil sich kein Kühlschrank an diesem Ort alleine füllt
Hier platzen deine Seifenblasen
Hier macht keiner Geld
Und leider hat auch keiner Lust, Kanaken einzustellen
Hier stirbt die Hoffnung und zwar jeden Tag
Deine Welt ist kunterbunt
Doch in dieser Welt ist die Tapete schwarz
Du kannst mir glauben
Hier schreibt man die Probleme groß, was für Skrupel?
Unsere Jugend geht auf Lehrer los
Wo siehst du Kinder spielen?
Ich seh nur Kinder dealen
Und wenn schon Kinder dealen
Ist das echt ein Kinderspiel
In dieser Welt siehst du jeden Tag den gleichen Dreck
Menschen verlieren wirklich alles und verzweifeln echt
Wo dein arbeitsloser Vater ohne Kohle ist
Und deine Mutter auch im Supermarkt den Boden wischt
Und mir ist wirklich so egal
Ob dir der Scheiß gefällt
Leb dein Leben jetzt in deiner heilen Welt

[Hook]

[Strophe III: Chakuza]
Es ist traurig
Es ist wolkig
Es ist grau
Auch das Blaulicht
Hält den Horizont nicht aus
So sieht's aus
So sieht's aus
Jeder Clown
Wird im Vollkontakt verhauen
Während die Vollspasten da draußen
Einen Wolkenkratzer bauen
Und das Volk kommt hier nicht raus
Es bleibt da
Scheiße bleibt Scheiße
Es bleibt einfach alles da
Scheiße bleibt Scheiße
Und kommt einfach aus dem Arsch
Und dieses Jahr kommt für die Kleinen
Auch der Weihnachtsmann in schwarz

[Strophe IV: Bushido]:
Du kannst das alles ignorieren
Wenn du die Augen schließt
Doch hier trägt jeder eine Waffe
Und zwar aus Prinzip
Du hörst richtig
Sie sprechen hier gebrochen deutsch
Kein Aspirin dein Schädel wird mit Smog betäubt
Du meinst ich übertreib
Schön für dich ich untertreib
Du spürst das warme Blut
Vom Messerstich im Unterleib
Scheiß auf deine heile Welt
Herzlich willkommen hier in meiner Welt
Ich begrüße deine Jungs mit dreizehn Schellen

[Hook]","https://genius.com/Bushido-heile-welt-lyrics","Released August 31, 2007
Distribution

    
      Sony BMG
Copyright ©

    
      ersguterjunge
Phonographic Copyright <U+2117>

    
      ersguterjunge
Artwork

    
      Ben Baumgarten
Photography

    
      Mat Hennek
Label

    
      ersguterjunge
Featuring

    
      Chakuza, Kay One, Nyze & 2 more
Producers

    
      Auditory, Bazzazian, Beatlefield & 8 more
Writers

    
      Bushido, Chakuza, Kay One & 3 more
Bass

    
      Markus Runzheimer
Copyright ©

    
      ersguterjunge"
"6","Bushido","Dieser eine Wunsch","7","[Strophe I]
Bruder das hier wird mein letzter Brief
Du weißt ich schreib ihn nur für dich
Und du liest in jeder Zeile wies mich trifft
Nichts ist für die Ewigkeit
Und trotzdem bin ich mich am fragen
Warum Gott dich schon so früh aus meinem Leben reißt
1000 Fragen die mich wirklich jeden Tag quälen
Vorwürfe die mir jede nacht den Schlaf nehmen
Ich schwör ich kann nich mehr
Mann und ich hoff du verstehst was ich fühl
Bitte trockne meine Tränen
Ich schreib von Herzen mann
Und dein Foto steht direkt neben dem Bett
Ich zünd jede nacht ne Kerze an
Ich war nie der typ der jeden Tag Gebete spricht
Doch das ändert sich wenn du merkst wie kurz das Leben ist
Ich schwör dir ich kann immer noch dein Lachen hörn
Damals hab ich oft gesagt das mich deine Grimassen störn
Ich bin so gefickt verdammt
Ich vermiss dich mann
Streif bei deinem Foto am Gesicht entlang

[Hook]
Wenn Gott mir doch nur diesen Wunsch erfüllen könnte
Dich noch einmal zu sehen
Kannst du meine Tränen sehen
Mann wir sind am Ende
Wie gern würd ich dich noch mal in den Arm nehmen
Ich schaff es nich wie soll ich vor dem Grab stehen
Wenn Gott mir diesen Wunsch erfüllen könnte
Dich nur noch einmal zu sehen
Kannst du meine Tränen sehen
Wie ich gerade kämpfe
Wie gern würd ich dich noch mal in den arm nehmen
Ich schaff es nich ich will dich nicht im Sarg sehen

[Strophe II]
Deine Beerdigung
Der schlimmste Tag in meinem ganzen Leben
Überall standen die Kerzen rum
Und deine Mutter
Sie hat mir so leid getan
Sie hat so sehr geweint
Dein Vater nahm sie in den Arm
Und deine kleine Schwester
Sie hats noch nich gerafft
Doch dafür dein großer Bruder
Sein Gesicht war blass
Da waren so viele Leute
Die ich noch nich kannte mann
Ich meine deine Tanten Verwandten
Deine Bekannten kamen
Merkst du wie du uns fehlst
Sag mal spürst du diese Trauer
Kannst du sehn wie sich unsre jungs quälen
Und glaub mir wir sind gar nich mehr so unterwegs
Uns ist so die lust vergangen abends rumzustehn
Kein Tag vergeht an dem wir nicht an dich denken
Ich hab meinen Freund verloren
Und keinen Mitmenschen
Ich bin so gefickt verdammt
Ich vermiss dich mann
Ich hoff nur das du uns von oben sehn kannst

[Hook]
Wenn Gott mir doch nur diesen Wunsch erfüllen könnte
Dich noch einmal zu sehen
Kannst du meine Tränen sehen
Mann wir sind am Ende
Wie gern würd ich dich noch mal in den Arm nehmen
Ich schaff es nich wie soll ich vor dem Grab stehen
Wenn Gott mir diesen Wunsch erfüllen könnte
Dich nur noch einmal zu sehen
Kannst du meine Tränen sehen
Wie ich gerade kämpfe
Wie gern würd ich dich noch mal in den arm nehmen
Ich schaff es nich ich will dich nicht im Sarg sehen

[Strophe III: Bushido]
Ich wache schweißgebadet auf
Schweißgebadet ja schon wieder dieser Traum
Wir sitzen beide auf der Couch
Du hast mich zufrieden angeschaut
Danach liefen wir dann raus
Spazieren gehen
Doch der ganze Strand war grau
Die Sonne konnte mann nich sehn
Weil sie zu dunkel war
Du hast so oft gefragt stranden unsere Jungs am Sarg
Weiße Blumen und der Himmel war türkis gefärbt
Vielleicht war ich gar nicht weit vom Paradies entfernt
Ich wollte wirklich so viel sagen doch ich konnt es nicht
Deshalb schreib ich diesen einen Song für dich
Kannst du mich den hörn
Konntest du mich hörn als ich am Grab stand
Konntest du mich hörn durch diese Glaswand
Ich schwör ich bin von dir nich weggegangen
Nein du warst nicht allein
Du hast gekuckt wie ein Engel
Dein Gesicht war frei
Frei von Sorgen
Frei von den Schmerzen
Wir vermissen dich so sehr es wird zu viel

[Hook]
Wenn Gott mir doch nur diesen Wunsch erfüllen könnte
Dich noch einmal zu sehen
Kannst du meine Tränen sehen
Mann wir sind am Ende
Wie gern würd ich dich noch mal in den Arm nehmen
Ich schaff es nich wie soll ich vor dem Grab stehen
Wenn Gott mir diesen Wunsch erfüllen könnte
Dich nur noch einmal zu sehen
Kannst du meine Tränen sehen
Wie ich gerade kämpfe
Wie gern würd ich dich noch mal in den arm nehmen
Ich schaff es nich ich will dich nicht im Sarg sehen","https://genius.com/Bushido-dieser-eine-wunsch-lyrics","Released August 31, 2007
Distribution

    
      Sony BMG
Copyright ©

    
      ersguterjunge
Phonographic Copyright <U+2117>

    
      ersguterjunge
Artwork

    
      Ben Baumgarten
Photography

    
      Mat Hennek
Label

    
      ersguterjunge
Featuring

    
      Chakuza, Kay One, Nyze & 2 more
Producers

    
      Auditory, Bazzazian, Beatlefield & 8 more
Writers

    
      Bushido, Chakuza, Kay One & 3 more
Bass

    
      Markus Runzheimer
Copyright ©

    
      ersguterjunge"
