"","artist","title","album","text","url","metadata"
"10","257ers","Track 12","Mit essen spielt man nicht","[Part 1: Shneezin]
Alter Platz da, Shneezin ist bereit für den Kampf
Nimmt das Mic in die Hand
Und drückt dir Line um Lines
Du weißt bescheid
Komm mir nicht mit Gold und Prada
Und mach voll Palaber
Man ich hau dich zeig die Blings und du bist Rollstuhlfahrer
Und stehst nie wieder auf, du bist real wie ein Clown
Also garnicht, ich auch nicht
Mach die Faxen und bezahl nicht, Ich bounce dich
Und erzähl mir nichts von Battle dies das Shneezin, rapp nicht
Und is trotzdem more fly als Aladdin mit nem Teppich
Und du bist ungefähr so fly wie die Fliege am Esstisch
Nein man ungefähr so fly wie die Fliege auf Crack ist am Esstisch
Du bist dreckig und hässlich, man ich fresse dich lässig
Mit nem ganz easy Move
Und du schreißt verkackter als es Young Shneezin tut
Du kriegst Schwanz in die Schnute, Bitch
Und es fühlt sich an als ob du Cumshot in die Luke kriegst
Ein Punch und eine Kugel frisst
Und du Hure siehst ein, dass du Faker als ein Double bist

[Hook: 257ers 2x]
Komm Punk du willst Beef ich hau dich weg
Komm guck wie ich dir vor die Schnauze snack
Komm check wir ham dein Ott mit Kraut gestreckt
Nutte du bist scheiße und deine Mutter ist dein Dad!

[Part 2: Keule]
Ich mach Click-Clack und Ich hab die Guns geladen
Und bei weitem kein Problem damit euch Punks zu schlagen
Es machtpeng peng peng
Das ist Bankräuber-Sound
Mit mir ficken ist mies, wie auf Sandkörnern kauen
Ich komm mit Guns in dein Town, Geb dir Punches du Clown
Zwing dich Punk-Bitch dann auf mein Schwanz rumzukauen
Wer ist der Mann hier im Haus? (Welcher Hurensohn?)
Zieh die Handschuhe aus und klatsch den Punk wie Applaus
Bis er Krankenhaus braucht und bleib voll entspannt
Wenn Ich komm seid ihr on the run wie Forrest Gump
Alter, check die Pump, Alter, scheiß an die Wand, Alter
Ich verteil mehr Kugeln als n Eismann am Strand, Alter
Ich bin echt mal zu real
Und du verkackst wie en Japse derBrrräsagen will
Oder ne Frau die grad rückwarts den Kadett parken will
257 Nigger, jetzt ist Keule der King hier

[Hook]

[Part 3: Mike]
Mit mir zu battlen ist wie Fahrradfahren im Gegenverkehr
Seitdem deine Mama dich gekriegt hat ist sie gegen Verkehr
Du bist der Rede nicht wert
Wie eine Mutter die ihr Kind ohne Zähne gebärt
Und jetzt rede nicht mehr
Oder deine Frau wird ihr Kind ohne Leben gebären
Nein Scherz, denn dafür bin ich zu lässig
Aber ne kleine Hoe wie dich kehr Ich noch locker unterm Teppich
Und fäll dich, check Ich bin immer noch derbe am Mic
Immer noch bisschen besser einfach derbe der Mike
Wir genießen unser Leben bald in vollen Zügen
Fahren mit nem Tourbus zum Splash, Ihr in vollen Zügen
Ich müsste vollends lügen, wenn Ich behaupte das Ihr gut seid
Warum zieht Ihr Vögel nicht in Richtung Süden ist doch Brutzeit
Uhh rhymed! Mike Rohleder wieder dick
Der Typ der selbst am Chinaman nen Big Mac kriegt
Weil er n dick Mac ist und sich sicher nimmt was er will
Stellst du dich ihm in die Quere wirst du gekillt wie bei Bill","https://genius.com/257ers-track-12-lyrics","Released June 2007
Featuring

    
      Voddi
Writers

    
      257ers, Keule257, Mike 257 & 2 more"
"11","257ers","Sunshine","Mit essen spielt man nicht","[Part 1: Mike]
Echt cool, dass wir jetzt endlich wieder Sommer haben
Wonderbra, Kippen, Dekoltees und dann Sonnenbaden
Wieder einmal sind drei Mann mittendrin statt nur dabei man
Wodka on mass und high, man - ""Hi, man!""
Nein echt, da war'n Hai, man!
Fuck it, jetzt schwimmt da 'n Leichnam
Hä! Das kann doch in Holland gar nicht sein, man
Bitch, schon wieder voller als 'n Kleinwagen mit 8 Mann
Ach man, das fängt schon morgens um halb 8 an
Ich baller mir dann mit Abstand den allererste Flachmann
""Tach, man!"" Schöne holländische Frau
Begrüße sie nur kurz mit einem holländischem Brauch
Damit sie mir dann später Abends holländisch einen kaut
Und einkauft. Nimm meine Pilze und mein Ott
Ihr glaubt ja wohl nicht wirklich das so'ne Nutte diesen Cock kriegt
257!

[Hook: 257ers 2x]
Bitches, Bitches und 'n Kilo zu otten
Wieder die drei Bekloppten, mit Tequila im Kopp
Und Bier in Litern gesoffen
Mit deiner Schlampe am Schwanz im Sunshine

[Part 2: Shneezin]
Mal siehst du Keule, Shneezin und Mikroleada
Besoffen am Beach liegen, so mit Weed und Tequila
So mit Alk und Fahne, so mit Eis mit Sahne
So mit heißen Girls die uns den Alk bezahlen
Das ist Urlaub, das ist geiles Wetter
Das ist mein Girl in meinem Bett, kein Wecker
Und drei Rapper, das wird lustig
Wie sich als Pizza verkleiden
In den Flitzer zu steigen
Und bei 220 Spitze dem Blitzer Wichser zu zeigen
Einen Shit zu rhymen
Tittenfick antäuschen und dann auf den Bauch kacken
Auslachen und dann aus dem Staub machen
Boar wird der Urlaub geil, boar Ich werd nur drauf sein
Ich trink den Wodka pur, rauch ein und lasse deine Hure schrein
Und Shneezin trinkt das Glas aus, gib Gas Sau
Ich warte das du Bastard mehr Schnaps kaufst, Ich hab Durst
Und wenn du Kackwurst nicht spurst schieb Ich Absturz
Klatsch dich und lach als ob du nackt aufm Dach turnst

[Hook: 257ers 2x]
Bitches, Bitches und 'n Kilo zu otten
Wieder die drei Bekloppten, mit Tequila im Kopp
Und Bier in Litern gesoffen
Mit deiner Schlampe am Schwanz im Sunshine

[Part 3: Keule]
Das ist ein Kasten Bier, eisgekühlt - Nur für die Reisedauer
Bis zum Strand und dann die Sau rauslassen wie'n Schweinebauer
Das ist geiles Wetter jeden Tag, das ist Kampfsaufen
Erst die Pussy abfüllen und dann muss sie den Schwanz saugen
Das ist Blunts rauchen, high sein
In der Sonne braun werden und mir mit Mike 'n Spongebob-Eis teil'n
Das ist Wodka saufen und 'n 5 Liter Fass
Das ist auf die Kacke hau'n bis alles braune Spritzer hat
Immer dicke Buds haben und 'n Brocken Piece
Das ist alles doppelt geil, weil man alles doppelt sieht
Das ist einfach nur chillen und relaxen, dick was im Pack
Das ist Nutten ficken und lecken
Das ist 257 shit laut aus der Box pumpen
Und total besoffen geilen Frauen unter'm Rock gucken
Das ist Keule, Mikroleada, Shneezin shit
Das ist erst der Anfang, Mit Essen spielt man nicht

[Hook: 257ers 2x]
Bitches, Bitches und 'n Kilo zu otten
Wieder die drei Bekloppten, mit Tequila im Kopp
Und Bier in Litern gesoffen
Mit deiner Schlampe am Schwanz im Sunshine","https://genius.com/257ers-sunshine-lyrics","Released June 2007
Featuring

    
      Voddi
Writers

    
      257ers, Keule257, Mike 257 & 2 more"
"12","257ers","Outro (MESMN)","Mit essen spielt man nicht","Yeah, ja man das wars Alter
Keule, Mikroleada, Shneezin Shit
Genau so siehts aus, alter, das ist der Du-kriegst-den-Schniedel-Vorm-Kopp-Riesenshit, alter
Ja pass mal auf, Ich würd sagen ihr kauft den Scheiß, geht ins Dingenladen rein alter kauft das Album
Ey, Ey ey, kann man nicht kaufen Schneider
Ja was denn, klar alter
Nein das geht nicht
Ach laber doch nicht
Nur Internet frei, alter!
Dann lad den Scheiß runter, brennt die verhurte CD so oft wie es geht, alter, verteilt die an all eure Kollegen und hört euchs an, pumpt die Kacke bis euch die HurensohnOhren abfallen, Ich ficke alles alter
Macht das beste draus alter
Ja Kot in your face alter
Peace!
257 alter. Juhu! Du Hurensohn! Nigger

[Sample von ""Queen - We Are The Champions""]","https://genius.com/257ers-outro-mesmn-lyrics","Released June 2007
Featuring

    
      Voddi
Writers

    
      257ers, Keule257, Mike 257 & 2 more"
