"","artist","title","album","text","url","metadata"
"1","Eko Fresh","Der verlorene Sohn","Fick deine story","[Intro: Gesprochen von Hafed]
Hey, hey. Ich bin's, Hafed
Ich und mein Bruder Brian sagen euch:
Lasst mein Jungen Eko Fresh in Ruhe und all die German Dream Boys
Sonst gibt's was auf die Fresse!

[Hook]
Er ist wieder da, um seine Krone zu holen
Eko der König, er ist der verlorene Sohn
Geh raus und sag deinen Jungs, dass er jetzt zurück ist
Back to Business, weil dieser Ek verrückt ist
Das hier ist mein Leben und das bleibt's auch
Jeder will mir was erzählen, aber scheiß drauf
Eko Fresh ist zurück, der verlorene Sohn
Denn jetzt hat wieder Bizzy Bora den Thron

[Verse I]
Ich war der Leader of the New School
Wenn ich rappe dann siehst du zu
Wenn ich Chrysler fahre, gehst du zu Fuß
Bin nicht mehr der Junge den ihr rumschubsen könnt
Wisst ihr nicht mehr, dass ihr alle meinen Thron putzen könnt
Es ist Freezy oder E.K.O., German Dream CEO
Alles ist jetzt anders, seit dem Abrechnungs-Video
Unschuldig, hab darin die Hände gebadet
Brachte den Track raus, irgendwann am Ende des Jahres
Es war zuviel! Ich musste Savas noch dissen
Guck jetzt wie die ganzen Leute heute Arschloch küssen
Deutscher Rap-Beef. Ich hab sehr viel gelernt in den Tagen
Schlangen überall und ich wurde im Fernsehen begraben
Ihr wolltet mich tot sehen, doch ich stand wieder auf
Ging als Junge in den Krieg, doch kam als Mann wieder raus
Nie wieder CallYa-Handy, heute ist mein Business am laufen
1. Mai Berlin - Eine Flasche zwischen die Augen
Ihr wolltet mich tot sehen, doch ich bieg die Kacke grade
Jetzt hab ich 'ne [?], du bist nur 'ne [?]
Machte keine Tracks mehr - Savas macht ein Mixtape
Das war der Punkt, an dem ich sagte: Scheiß drauf und ich fick den
SD sieht es ein und er läuft über zu mir
Ich habe nur Angst vor Gott, denn meine Brüder sind hier
*Verfremdung* meint am Telefon, ich wär' kein mächtiger Mann
Pech für ihn, lan. Denn ab heute regelt Ek dieses Land

[Hook]

[Verse II]
Antigaranti for Life. Das sind Ekrem und Cem
Es ist offiziell, ich hab mich von Valezka getrennt
Ich frag mich immer noch: Wollen diese Homos mich verarschen?
Denn ich rappe wie der King, seit dem Logo mit der Krake
Zwei Wochen nach der Abrechnung ist Anis am Phone
Yayo zum halben Preis und den Rest kennt ihr ja schon
Ich flog wieder nach Berlin, als ob's das erstes mal wär
Ich und Bushido sind jetzt Freunde, keine Erzrivalen mehr
Wer kam als erster raus? Wer war schon damals Arrogant
Wer hat Optik geschoben, als noch keiner Aggro kannt
Es ist Ek der Mack, Leute, alles war cool
Aber dieses Jahr clap ich back, so wie Ja Rule
Zweites Album - Höchste Zeit für ein Klassiker
Wie 50 und sein Massacre - Turkish Delight Mafia
Zurück in Kalk, es ist Jagdsaison
Mein Sampler ist auch ohne Hilfe in die Charts gekomm'
Der wahre Don, vielleicht geht dieser Scheiß auch in die Hose
Doch mit 17, war ich schon berühmter als meine Idole
Jüngster Rapstar des Landes. Ich hab so ein verrücktes Leben
Dünya Dönüyor - Denn mir hat Staiger was zurückgegeben
Und ich will sie glücklich sehen, denn meine Mutter hat nur mich
Die berühmtesten aus Gladbach, sind Borussia und Ich
Hartz IV fickt das Land und die Nazis sind im Bundestag
Scheiß egal. German Dream. Die Asis sind jetzt in den Charts

[Hook]","https://genius.com/Eko-fresh-der-verlorene-sohn-lyrics","Released 2005
Primary Artists

    
      Eko Fresh & PA Sports
Featuring

    
      Capkekz, Emely (DEU), Farid Bang & 12 more
Producers

    
      Bushido, Decay & Kingsize
Writers

    
      Capkekz, Caput, Eko Fresh & 16 more
Composer

    
      Kingsize"
"2","Eko Fresh","Fick deine Story","Fick deine story","[Verse I: Jadakiss]
[?]

[Shout out von ?]
[?]

[Verse 2: Eko]
Du bist kein Türke (Savas)
Komm in mein Viertel (Savas)
Komm her und Hakan Abi schlägt dich mit einem Gürtel (Savas)
Ich bin begeistert (Savas)
Jetzt bist du Kleinstadt (Savas)
Kommen meine Jungs, ziehen dir dein Ice ab (Savas)
Und ich bin verwirrt (Savas)
Und der King ist hier (Savas)
Du weißt alle Ausländer stehen hinter mir (Savas)
Fick die Ami Feats (Savas)
Deine Ami Beats (Savas)
Du hast mich dafür gehatet und machst R&B (Savas)
Du hast Glück, weißte (Savas)
Du bist ein Stück Scheiße (Savas)
Ich hab gehört, du musst nach Aachen. Gute Rückreise (Savas)
Ich krieg 'ne Flasche ab (Savas)
Jetzt bin ich Scarface (Savas)
Und du weißt genau, dass es um dein Arsch geht (Savas)
Das ist der German Dream (Savas)
Tipini Sikim (Savas)
Eko Freezy ist der Don, ficke nicht mit ihm (Savas)
Das ist der German Dream (Savas)
Und was ist mit Berlin (Savas)
Keiner ist doch mit dir down, außer Lumidee (Savas)
Du bist stockschwul (Savas)
Du brauchst Gleitcreme (Savas)
Dein verfickter Diss war so süß wie Eiscreme (Savas)
Und ich komme rein (Savas)
Wie in Columbine (Savas)
Ich hab Banger, aber frage nicht nach Sonnenschein (Savas)
Du hast kein Gewehr (Savas)
Lebst in Heidelberg (Savas)
Wollte mich vertragen, doch du bist den Scheiß nicht wert (Savas)
Du und dein kleiner Bruder (Savas)
Ihr seid beide Loser (Savas)
Und mit 21 hattest du noch keinen Cruiser (Savas)
Eko ist fresh (Savas)
Schreib ein' Disstext (Savas)
Doch die Straßen, die dich liebten, lieben mich jetzt (Savas)
Ich hab' Köln-Kalk (Savas)
Ich hab' Gladbach (Savas)
Ich weiß, dass du in Berlin keine Macht hast (Savas)
Weil du kaputt bist (Savas)
Ich bin Hood Rich (Savas)
Bleib im Wagen, wenn du mal in meiner Hood bist (Savas)
Und mit jeder Nutte (Savas)
Machst du Zungenkuss (Savas)
Jede Nutte weiß danach, du hast Mundgeruch (Savas)
Du bist ungepflegt (Savas)
Du wirst untergehen (Savas)
Sieh wie dein Imperium jetzt vor die Hunde geht (Savas)
Du wärst gerne hart (Savas)
Du wärst gerne schwarz (Savas)
Nach diesem Part, bekommst du Opa einen Herzinfarkt (Savas)
Du bist nur ein Hater (Savas)
Du rappst nur für Skater (Savas)
Du kommst nur mit 50 und ich komm' nur mit Jada (Savas)
Wir fucken dich ab (Savas)
Du bist nich' Pac (Savas)
Schon bald hängen deine Rapper auf dem Strich ab (Savas)
Ihr seid schwule Hunde (Savas)
Ich lass dich bluten Tunte (Savas)
Der Punisher, German Dream, ersguterjunge, Yeah

[Outro]
Whooo
Yeah
Freezy
Jetzt sind wir quitt
Fick deine John Bello Story, man
Eigentlich hätte ich [?] Fick deine Story-Story nennen sollen
German Dream. ersguterjunge
Moruk, du musst jetzt was tun. Moruk
Jetzt tu' was, geh raus und kauf dir ein Jada 16er für 30.000€, oder so
Du verlierst deine Diplomats/D-Block Credibility, man
Weil ist ja voll wichtig für dein Leben, was die Amis führen, du hast recht
Schöne Scheiße, die du deinem Bruder da beibringst
Ey, ich mache dich arm, aus der Entfernung, Biatch
Geh und kauf dir ein Verse, du Opa
Yeah! Und jetzt halt dein Maul
Sei froh, dass ich dich in ganz Köln bekannt gemacht hab, du Untergrund Rapper
Du Opfer, du Punk, alter
Du bist nur der Falafel-King
Ich bin Eko Freezy aka Ek der Mack aka Busy Bora
German Dream, baby
Ich werde reich, alter
Wir werden sehen, wo ich bin, wenn ich so alt bin wie du, du Schwuchtel","https://genius.com/Eko-fresh-fick-deine-story-lyrics","Released 2005
Primary Artists

    
      Eko Fresh & PA Sports
Featuring

    
      Capkekz, Emely (DEU), Farid Bang & 12 more
Producers

    
      Bushido, Decay & Kingsize
Writers

    
      Capkekz, Caput, Eko Fresh & 16 more
Composer

    
      Kingsize"
"3","Eko Fresh","Toy Story","Fick deine story","[Shout Out: Baba Saad]
Ok, hier ist Saad. Ich bin der mit der ""Fick deine Mutter Slang"", Eko Fresh ist zurück mit ""Fick deine Story Slang"". Ihr kleinen Bastarde könnte alle einpacken alter. Ihr Fotzenkinder eure Zeit ist um, Eko Fresh ist zurück

[Hook: Eko Fresh]
Ich bringe euch den Punisher Flow
Und sage es wie ein Mann, ich so: Du erzählst nur eine Toy Story
Ich bin Eko der Don und habe das verdammte Battle gewonnen
Und ich ficke deine Toy Story
German Dream wir sind Kings tut mir Leid für deine Boys, sorry
Scheiß auf deine Toy Story
Grembranx ist der Ort, Bang-Bang du bist fort
Ich rechne ab mit deiner Toy Story

[Part 1: Eko Fresh]
Fick deine Story für dich wird ganze zu hart hier
Deine Rapper stellen Antrag auf Hartz IV
Ihr könnt mich eh hassen, ich sage ""ne, klasse""
Und fahre durch Kanaken Ghetto ihn 'ner E-Klasse
Ich weiß das jeder Kanake mich liebt
Hör die Bordstein oder Jetzt kommen wir auf die Sachen EP
Also werf nicht mit Steinen wenn du ihm Glashaus sitzt
Ich fahre durch den Block und höre Glashaus Shit
Ich hab Capkekz der dich nur aus Spaß haut, Bitch
Ich hab Manuell er reißt dir dein Arsch auf, Bitch
Ich bin der German Dream CEO, guck ich bringe die Kacke zum laufen
Keiner von euch kann sich meiner Lederjacke, so kaufen
Du Blamage geh, jetzt sind deine Tage gezählt
Ich hab deine Kinder heute ihn der Garage gequält
Mach den Flow für die Türken auf der Sonnenbank
Köln-Kalk Mutterficker du weißt das du kommen kannst
Ich bin immer noch, immer noch Eko Fresh
Ich bin immer noch, immer noch Ghetto Chef
Du gehst mit deinen Onkel wählen
Ich und Summer bringen dein [Strichernarbe ?], Hartz IV ihn eure Fotzengegend
Ihr müsst die Konten leeren, öffnet den Safe
Das ist mein Wagen ich verbiet' dir an die Knöpfe zu gehen
Mein [Göt ist geschenkt ?], ich ficke deine Töchter im stehen
Du Junkie hast dir jetzt dein Hero auf den Löffel gelegt (Yeah)

[Hook: Eko Fresh]
Ich bringe euch den Punisher Flow
Und sage es wie ein Mann, ich so: Du erzählst nur eine Toy Story
Ich bin Eko der Don und habe das verdammte Battle gewonnen
Und ich ficke deine Toy Story
German Dream wir sind Kings tut mir Leid für deine Boys, sorry
Scheiß auf deine Toy Story
Grembranx ist der Ort, Bang-Bang du bist fort
Ich rechne ab mit deiner Toy Story

[Part 2: Eko Fresh]
Jetzt ist dein cooler Rapper, Traum geplatzt
Hättest du ihn der Schule etwas besser aufgepasst
Vielleicht ist auf dem Schwulenstrich da draussen platz
Mein Mixtape Features kommen gerade aus dem Knast
Gib mir noch 2 Jahre und ich hab ein Laden aufgemacht
Ob du hart bist oder nicht, klar du wirst gefickt
Nenn mich Scarface den ich hab jetzt ne Narbe im Gesicht
Ich fresse eure Flaschen, Westside Kanaken Rap
German Dream bis ihr Ek's [?] ihn der Kacke steckt
Im Cafe trink ich wie ein Mann mein Tee
Du Riesenbaby kannst bei Diplomats, Schwanz nuckeln gehen
Ich hab mehr Banger ihn mein Team als du, also Penner höre mir mal zu
Dann all dieser Männer können dir was tun
Hugo Boss Crew ich zeig dir jetzt wie ill Ek ist
Ich bin down mit Saad, du bist down mit Illmatic
Ihn mein alter hattest du kein Chrysler nein
Nein, alter nein, ich ficke dein Scheiß Verein
Du musst ins Altersheim den Ek ist so gut
Und ich hoffe du Kartoffel stürzt, back to the roots
Guck mal an wie ich den Respekt verlier
Ich bin der Inhalt deiner Scheiß Karriere, du redest ihn jedem deiner Interviews über mir
Sieh es ein du kannst mit Glässern auf mich Schmeißen
Aber danach gibt es dick aufs Maul von Reza oder Feisel
Dein Label ist so scheiße, wir nehmen dich als Geisel
Sie ist deine neue Freundin trotzdem bläst sie meine Eichel
Immer immer schneller ich nenn sie Cinderella
Meine laufen gut bei dir laufen deine Singles ihn den Keller
Turkish Delight ich hab mir neues Ot besorgt
Komm her wir schicken deine Opfer fort, ihn Boxershorts
(Mutterficker)

[Hook: Eko Fresh]
Ich bringe euch den Punisher Flow
Und sage es wie ein Mann, ich so: Du erzählst nur eine Toy Story
Ich bin Eko der Don und habe das verdammte Battle gewonnen
Und ich ficke deine Toy Story
German Dream wir sind Kings tut mir Leid für deine Boys, sorry
Scheiß auf deine Toy Story
Grembranx ist der Ort, Bang-Bang du bist fort
Ich rechne ab mit deiner Toy Story","https://genius.com/Eko-fresh-toy-story-lyrics","Released 2005
Primary Artists

    
      Eko Fresh & PA Sports
Featuring

    
      Capkekz, Emely (DEU), Farid Bang & 12 more
Producers

    
      Bushido, Decay & Kingsize
Writers

    
      Capkekz, Caput, Eko Fresh & 16 more
Composer

    
      Kingsize"
"4","Eko Fresh","Fuck your Story","Fick deine story","[Intro: Eko Fresh &Hell Rell]
Yeah. Freezy. Summer. Rell, was geht man?
Hell Rell, Dipset, Kingsize, German DreamAhaa
You know who this is com'on
German Dream Baby!
You know who this is com'on
Fick deine Story

[Part 1: Hell Rell]
....

[Part 2: Summer Cem]
Summer Cem ich falle auf wie ein Taliban, am Badestrand
Du Krüppel wurdest geboren, 9 Monate nach Karneval
Man kann dich aufmuntern, doch es ist aus Lutscher
Du bist kein Wunschkind, du bist nur ein Ausrutscher
Es macht Bam Bam, ich ficke am Bahndamm
Ich hol den Bülük raus, moruk ich hab Harndrang
Ich sage Schizophren und weiß nicht mal was das heißt
Wenn du den Pitbull siehst musst du wissen das er beißt
Homie ich rappe deine Schwester ist eine Professionelle
Ruf nach uns und sofort sind die Profis zur Stelle
Stenzgang halte lieber deine Opfer fest
Ich komm mit so viel Türken du denkst es ist Opferfest
Es ist ihn meiner Hand jetzt wie beim Erntedankfest
Ich schneid den Truthahn während deine Mutter Schwanz leckt
Deutschrap ist ne Schießgrube, deine Mutter ist ne Schießbude
Eine Dipset und German Dream Hure

[Hook: Eko Fresh &Hell Rell] (2x)
Das hier sind J.R. Writer, Summer
Hell Rell [?] Story
Kingsize am Beat
Eko Fresh's fucking Story
Fick deine Story das hier sind Dipset und die Stenzgang
Harlem oder Grembranx - es macht immer Bang Bang

[Part 3: Eko Fresh]
Das hier sind GD und Dipset
Du wirst von Freezy gekidnapped
Deine große Liebe sie strippt jetzt
Ich nehme deiner Frau easy den Slip weg
Und ich weiß das eure Rapper Liebling wie ich rappt
Es sind Viertel Beef man, wann willst du diesen Türken featuren
Das ganze Land schaut jetzt auf mich wie auf Jürgen Klinsmann
Du willst im Takt rappen doch es hört sich wirklich schief an
Du willst Kokain ich kann nicht wirklich unter 40 liefern
Köln Kalk du hast riesen Verbot
Nenn den Freezy, Idiot, und die spielst mit dem Tod
Meine Brüder sind die G's in Person
Ich guck zu wie sie dir den Arsch ziemlich versohlen
Ich bleib ""der auf dich Scheißer"", du einer von tausend Biter
E K O der Aussenseiter keiner der drausse ist tighter
Es ist die Stenzgang die Geschäfte laufen weiter
Guck deine Freunde an, sie sind nur ein Haufen Scheißer
Chrsyler Cabrio, hör an wie ich den Wagen starte
Deine Bitch will blasen, warte, sie hat eine Hasenscharte
Auf der Straße hier von Morgens bis Abends
Kille ermorde und schlage ich jeden [Sorge von?]
(Ich bin der Don)

[Part 4: J.R. Writer]
...

[Hook: Eko Fresh & Hell Rell] (2x)
Das hier sind J.R. Writer, Summer
Hell Rell [?] Story
Kingsize am Beat
Eko Fresh's fucking Story
Fick deine Story das hier sind Dipset und die Stenzgang
Harlem oder Grembranx - es macht immer Bang Bang

[Part 5: ????]
...

[Outro: Eko Fresh]
Oh (Oh). Das hier ist mein Mixtape (Mein Mixtape). Hier hast du Diplomat Feature du Lutscher (Lutscher). Brrääääää (Brääää). German Dream (German Dream). Electro Eko Baby (Electro Eko Baby). Yeah. Mein Album kommt, mein 2. Album kommt bald. Biatch (Biatch). HA-HA (Ha-Ha)","https://genius.com/Eko-fresh-fuck-your-story-lyrics","Released 2005
Primary Artists

    
      Eko Fresh & PA Sports
Featuring

    
      Capkekz, Emely (DEU), Farid Bang & 12 more
Producers

    
      Bushido, Decay & Kingsize
Writers

    
      Capkekz, Caput, Eko Fresh & 16 more
Composer

    
      Kingsize"
"5","Eko Fresh","Antigaranti 4 Life","Fick deine story","[Shout out: Bushido]
Okay, okay. Ich bin Bushido, dass ist Eko Fresh
Fick deine Story Mixtape. Jungs, es wurde Zeit, alter
Eko, du ziehst das Ding durch, alter
Mein Name ist Bushido - ersguterjunge, Okay

[Verse I: Summer Cem]
GD - E-K-O - S-U doppel M E-R - Antigaranti 4 Life

Antigaranti Soldat, komm dieser Bande zu nah
Und ich kann dir schwör'n, dein kleiner Körper landet im Park
Ja, ich danke Allah und sag: Al-hamdu lillah
Doch für einen Türken wie mich, war der Sandmann nie da
Es gab mal vier Kanaken for Life, hörten Pac und den Scheiß
Machten Tracks, doch glaub mir E, jetzt ist alles vorbei
Das hier sind deepe Kriesen, in miesen Zeiten, ich will nicht übertreiben
Leute kommen, Leute gehen, doch nur deine Brüder bleiben
Es tat mir alles Leid, es könnte anders sein
Noch nicht mal ein' Bruderkuss, als ihr gegangen seid
Oh verdammt, nein. Du musst ein Mann sein
Ohne Eko, wärst du immer noch ein Landei
Keine Zeit für Kriesen jetzt, dass hier ist Banditenrap
Schnauze halten, Geld raus. Das hier ist Familie, Ek
Ich bleibe in Rheydt, Moruk, ich schreib und ich schreib
Wie ein Kampfhund der beißt - Antigaranti 4 Life

[Hook 2x: Eko Fresh &Summer Cem]
Eko Fresh,Summer Cem, Antigaranti 4 Life
Wir sind sexyKanaken, 21 und geil
Mönchengladbach Rheydt,irgendwann gehen wir Gold
Zwei Türken aus dem Viertel,voller Ehre und Stolz

[Verse II: Eko]
Die Stenzgang, so klingt Antigaranti noch heute
Mönchengladbach-Rheydt - Ich fick deine Verwandten und Freunde
21 und total beliebt. Ercan und Caput waren loyal zu Savas
Doch er war ja leider nicht loyal zu ihn'
Die am meisten angekündigte Crew
Ich gewinne, ihr loost. Abrechnung, ein finishing Move
Die Schlangen sind jetzt weg, nur mein Bruder Cem und Ich
Frag die Kids nach den anderen, man kennt sie nicht
Wo ist dein Doppelalbum, wo ist deine DVD?
Du kannst Summer Cem mit Xzibit bei Viva seh'n
Antigaranti. Das hier ist mehr als deine Szene mitkriegt
Mein Bruder G-Style, bleibt für immer Ehrenmitglied
Ich habe keinen Kontakt zur Aussenwelt
100.000 B-Seiten, seit ""bin jung und brauch das Geld""
Es waren einmal vier Türken, danach nur drei
Heute nur zwei, ich ficke euer Urteil

[Hook 2x: Eko Fresh &Summer Cem]

[Verse III: Eko & Summer Cem]
Antigaranti ist keine Crew, sondern ein Schwur
Ceza hat es klar gemacht, wir fliegen jetzt Türkei Tour
Ihr wollt Beef, doch dafür hat Ek keine Zeit
Du hast mich verraten, als gucke jetzt wo du bleibst (Bitch)
Ja, du bist eine Schwuchtel. Nein, du hast kein' NutzenAG 4 Life, bis sie mich einbuchtenReleast was ihr wollt, mein Wort in Gottes OhrenIch bin ein Gentleman, ich lass die Fotzen vor
Wir sind jetzt prominent, als bring die Kamera hierhin
Und wir rappen für dich live, amina koyim (Oh)
Du kannst die Stars sehen, wahrnehmen, AG
Ihr seid jetzt im Arsch, ey, denn ihr hattet Plan B
Schau uns an, denn wir haben's geschafftHast du die Kacke gerafft, denn so wird Patte gemachtDenn diese Scheine im Bündel, sind für mich einer der GründeWarum ich AG bleibe und mich mit keinem verbünde

[Hook 2x: Eko Fresh & Summer Cem]","https://genius.com/Eko-fresh-antigaranti-4-life-lyrics","Released 2005
Primary Artists

    
      Eko Fresh & PA Sports
Featuring

    
      Capkekz, Emely (DEU), Farid Bang & 12 more
Producers

    
      Bushido, Decay & Kingsize
Writers

    
      Capkekz, Caput, Eko Fresh & 16 more
Composer

    
      Kingsize"
