"","artist","title","album","text","url","metadata"
"14","Farid Bang","Das letzte Mal im Leben","Blut","[Verse 1: Farid Bang &Aydın]
Drei Uhr mittags - ich bin grade aufgewacht
Das Leben ist ein Auf und Ab, doch ich brauche dasHeute bist du nix, morgen bist du reichUnd hast du Pech, ist es übermorgen schon vorbei
Es ist ein Kampf, ich bin meistens in Unterzahl
*Handy klingelt* - Teilnehmer unbekannt!Hör mir zu, ich komm' grade ausm KnastUnd hab' gehört, du hast was mit meiner Frau gehabtMorgen hau' ich dich aus deinem Mercedes raus„Fick deine Mutter!“ - und ich lege auf
So 'nen Scheiß hör' ich fast jeden Morgen
Die Zeit vergeht schnell, es ist spät geworden
Auf mein' Wagen ein Schuss von hinten -
Ich dacht', du wollt'st mein' Mutter ficken!?
Ich gebe Gas, doch sie fangen mich ab
Erinner' mich an nix, doch werd' im Krankenhaus wach

[Hook]
Besser, wenn du mir in solchen Nächten nicht begegnest
Denn ich trage das Messer, um zu nehmen
Und ich nehm' dir deine lächerliche Ehre
Das letzte Mal im Leben
Ich trag' nicht 'ne Teflon-Weste, um zu reden
Du weißt, meine Schwäche ist die Knete
Ich halt' dir die Beretta an die Schläfe
Das letzte Mal im Leben

[Verse 2: Farid Bang,Polizist,Ayla&Sezer]
Auf der Straße wird leider nicht mit Fäusten gekämpft
Immer mehr wollen töten, gehen dem Teufel nicht fremd
Bullen kommen rein:„Wir haben ein paar Fragen an Sie!
Wer waren die Angreifer und wieso waren Sie das Ziel?“
Sie zeigen mir paar Fotos auf ihrem Weg
Erkenne ihn, doch sag': „Den hab' ich nie gesehen!“
Auf Wiedersehen! Ich ruf' Ayla an:
Bist du da? -„Ja, was ist los, mein geiler Mann?“
Hör' mir zu: fünfhundert Euro, wenn du sprichst
Wie heißt er und wo find' ich den Freund von deiner Sis?
„Sein Name ist Aydın, er ist meistens im Heim
Und weiß auch bescheid, deine Zeit ist vorbei!“
Verlass' das Hospital, zieh' mir 'ne Koka-Line
Rufe Sezer an - „Kannst du mir ein' Controller leihen?“
„Komm vorbei!“- Gut, in zwanzig Minuten
Angekommen bei ihm gibt er mir 'ne Gun und paar Kugeln

[Hook]
Besser, wenn du mir in solchen Nächten nicht begegnest
Denn ich trage das Messer, um zu nehmen
Und ich nehm' dir deine lächerliche Ehre
Das letzte Mal im Leben
Ich trag' nicht 'ne Teflon-Weste, um zu reden
Du weißt, meine Schwäche ist die Knete
Ich halt' dir die Beretta an die Schläfe
Das letzte Mal im Leben

[Verse 3: Farid Bang, Aydın & Kollegah]
Die Gun ist geladen und der Wagen ist getankt
Der Schlagring direkt über der Narbe meiner Hand
Habe etwas Angst, doch bin bereit für meinen Weg
Genug geredet - es geht rein in das Café
Aggressiver Blick, meine Waffe hab' ich mit
Und sie garantiert mir, dass ich sie heut fick'
Sie machen Politik, doch nach der ersten Rechten
Wissen sie ihr Leben wertzuschätzen
Seine Jungs laufen weg - es gibt ein Eins-Gegen-Eins
Aydın, sei dir sicher, ich nehme dir dein Leben gleich
Verpass' ihm einen Punch, verlier' die Waffe aus der Hand
Doch das Problem ist: er fällt mit den Armen auf die Gun
Und Aydın hält mir die Plem an den Rücken
Es ist vorbei, wenn ich abdrücke!Dein letzter Wunsch? - dreh dich mal um, du Bitch!
Er hat doch gesagt, dass er deine Mutter fickt!

[Hook]
Besser, wenn du mir in solchen Nächten nicht begegnest
Denn ich trage das Messer, um zu leben
Und ich nehm' dir deine lächerliche Ehre
Das letzte Mal im Leben
Ich trag' nicht 'ne Teflon-Weste, um zu reden
Du weißt, meine Schwäche ist die Knete
Ich halt' dir die Beretta an die Schläfe
Das letzte Mal im Leben

","https://genius.com/Farid-bang-das-letzte-mal-im-leben-lyrics","Released May 27, 2016
Distributor

    
      Warner Music Group
Artwork

    
      ADOPEKID
Label

    
      Banger Musik
Copyright ©

    
      Banger Musik
Phonographic Copyright ℗

    
      Banger Musik
Featuring

    
      Al-Gear, Fat Joe, Jasko & 7 more
Producers

    
      Abaz, Bad Educated, B-Case & 11 more
Writers

    
      Abaz, Al-Gear, Bad Educated & 22 more
Composer

    
      Abaz, Bad Educated, B-Case & 11 more
Copyright ©

    
      Banger Musik"
"15","Farid Bang","Immer noch ins Gesicht schauen","Blut","[Songtext zu „Immer noch ins Gesicht schauen“]

[Part 1]
Und falls irgendwann der Tag kommt und du Hype um dich verlierst
Dann mach dir keine Sorgen, denn ich bleibe neben dir
Und heut fahr' ich in einem schwarzen Porsche wegDen ich wahrscheinlich niemals hätt, hätt ich nicht Summer vorgerapptEr hat mir Rappen beigebracht, ich gekämpft für meinen Platz
Zehn Jahre und danach Millionär in einer Nacht
Habe 'ne schwere Zeit gehabt und nicht jeder meint, ich schaff's
Alles vergessen, ey, ich steig' in mein'n Mercedes rein und lach'
Lach' über deine Niederlagen und dein'n Kontostand
Was wär Erfolg und Geld ohne meine Entourage?
Ich bet' zu Gott und sag', dass ich ihn über alles lieb'
‚‚Bring meine verstorbene Tante ins Paradies''
Ich musste kämpfen gegen Schlangen, um am Ende nicht zu fallen
Ich mache das hier nur für meine Engsten und Verwandten
Ich mache das hier nicht für meinen Wagen oder dich
Nein, ich mache das, damit mich die Straße nicht vergisst

[Hook]
Erstmal kam das BangDanach kam der Beef und danach kam der Fame, aha
Danach kam das GeldDamit auch der Benz und somit auch die Bitch, ah
Erst Banger MusikDanach kam die Eins und somit auch der Neid, ey yo
Die Platten waren GoldDie Hallen wurden voll, ich danke meinen Fans

[Part 2]
Beiß niemals die Hand, die dich füttert, lern die Lebensweise kenn'n
Und deshalb dank' ich jedem meiner Fans
Steh' zu meinem Camp, bereit durch das Feuer zu gehen
Was wäre Farid Bang ohne seine Loyalität?
Auch wenn viele sagen, Massiv hätte grad kein'n HypeFür mich bist du mehr als ein Bruder und die wahre EinsHarte Rhymes, ich traf' wenig Menschen wie dich
Hamad, bleib stark, ich vergesse dich nicht
Frag mal Al Gear, denn er hat es live gesehenWie viele Kämpfe ich gehabt hab' auf meinem Weg (ja, Mann)
Eure Karrieren bestehen nur aus verschwendeten Rhymes
Ich erkämpf' mir den Neid, du leckst Schwänze für Hype
Das hätt ich vielen von euch gern ins Gesicht gesagt
Denn außer meiner Taten nehme ich nichts mit ins Grab
Verlier' ich alles und geh' hier mit nichts raus
Kann ich mir immer noch ins Gesicht schauen

[Hook]
Erstmal kam das BangDanach kam der Beef und danach kam der Fame, aha
Danach kam das GeldDamit auch der Benz und somit auch die Bitch, ah
Erst Banger MusikDanach kam die Eins und somit auch der Neid, ey yo
Die Platten waren GoldDie Hallen wurden voll, ich danke meinen Fans

[Post-Hook: Sample]
Ana lli nestahel mashet ma3ak benneya
We 3atetek ma 3endi shofiti el 3ada feya
Ana lli nestahel mashet ma3ak benneya
We 3atetek ma 3endi shofiti el 3ada feya","https://genius.com/Farid-bang-immer-noch-ins-gesicht-schauen-lyrics","Released May 27, 2016
Distributor

    
      Warner Music Group
Artwork

    
      ADOPEKID
Label

    
      Banger Musik
Copyright ©

    
      Banger Musik
Phonographic Copyright ℗

    
      Banger Musik
Featuring

    
      Al-Gear, Fat Joe, Jasko & 7 more
Producers

    
      Abaz, Bad Educated, B-Case & 11 more
Writers

    
      Abaz, Al-Gear, Bad Educated & 22 more
Composer

    
      Abaz, Bad Educated, B-Case & 11 more
Copyright ©

    
      Banger Musik"
"16","Farid Bang","Real Madrid","Blut","[Songtext zu „Real Madrid“ ft. Majoe]

[Part 1: Farid Bang &Majoe]
Du Maricon, fick deine Partysongs, dein VIP
Was ist Gangsterrap gegen eine Kriegs-Naschid?
M-A-J, Gangsterboss, B-B-Banger Musik
Mein Image? - Keine Ahnung, doch die Message ist Krieg!
Im Interviewsagst du: „M-A-J hat kein' Mumm!“
Parallel dazu fällt in China ein Sack Reis um, ah
Meine Brüder machen Mixed-Martial-ArtsUnd sind wie Konzertbesucher - zum Mitklatschen da
Es gibt Uppercuts für den Hurensohn MOK
Weiber fliegen auf michwie der Stuhl auf dein' Kopf, ah
Und ich hol' mir die Raubware bewaffnet
Dein Wort hat Gewicht, denn deine Aussage belastet
Werden mir Nutten gegenüber etwas laut oder schreien
Hau' ich sie gleichfrauenhausreif
Ich lauf' durch Hawaii,mach' die Shisha eben an
Die Rechnung auf dein' Nacken wie 'ne Libanesenhand, ah

[Hook: Farid Bang &Majoe]
Mein letztes Album, es sollte die Szene killenKeine Swingerparty, doch es kamen wenig Singles
Mein Rap-Style ist vielleicht wirklich sehr kindisch
Doch die Taschen sind gefüllt- türkischer Imbiss!
Banger Musik,wir machen ohne Ende Patte
Doch eigentlich wollt' ich hier nur Drogengelder waschen(ah)
Und seit Rap bin ich im legalen Biz
Banger Musik - Deutschraps Real Madrid

[Part 2: Farid Bang &Majoe]
M-A-J, AMG- und kein Audi-Fahrer
Ich mach' Geschäfte auf dein' Rücken wie KV-Liebhaber
Sie hassen dich, wenn du bei den Bullen ein' Namen angibstAber nicht, wenn du mit deinen Einnahmen angibst
Für Promo siehst du ein paar Image-Rapper pöbelnFür Promo werd' ich einen Kinderschänder töten
Dank' dem Label und den Fans, denn ich dreh' Runden im Benz
M-A-J ist Kante wie das Präteritum von kenn'
Ich diss' alle Dreckskanaken von Halt-die-Fresse
Auch wenn ich sie nicht kenne wie Angst und Schwäche
Ich komme mit Guns zum Treffen, du wirst vor Primark entführt
Drive-By, Schüsse aus der Beifahrertür
Meine T-Shirt-Größe kann nicht jeder Mensch anziehenDenn sie hat mehr ,X‘e als ein Käsekästchenspiel
Nuttensohn, ich fick' deine Cordon-Sportjacke
Und beende dein Konzert mit 'ner Molotow-Flasche

[Hook: Farid Bang & Majoe]
Mein letztes Album, es sollte die Szene killenKeine Swingerparty, doch es kamen wenig Singles
Mein Rap-Style ist vielleicht wirklich sehr kindischDoch die Taschen sind gefüllt - türkischer Imbiss!
Banger Musik, wir machen ohne Ende Patte
Doch eigentlich wollt' ich hier nur Drogengelder waschen (ah)
Und seit Rap bin ich im legalen Biz
Banger Musik - Deutschraps Real Madrid

[Scratches/Samples]„Banger Musik“„Fat laces, gun charge, court cases, fought that“„Cocaine coming out my pores in the sauna“„Got a 100 guns, a 100 clips, why I don’t hear no shots?“„Farid Bang, Farid Bang“„Yeah, yo“„Farid Bang, ich bin Sohn dieser Straßen, Düsseldorf“„I'm a bad boy“„Thirty-two shots in the clip, hollow tips in the MAC“„Who's the one you call? Mr. Majoe, Majoe“„Who's the, who's the one you call“

[Hook: Farid Bang & Majoe]
Mein letztes Album, es sollte die Szene killenKeine Swingerparty, doch es kamen wenig Singles
Mein Rap-Style ist vielleicht wirklich sehr kindischDoch die Taschen sind gefüllt - türkischer Imbiss!
Banger Musik, wir machen ohne Ende Patte
Doch eigentlich wollt' ich hier nur Drogengelder waschen (ah)
Und seit Rap bin ich im legalen Biz
Banger Musik - Deutschraps Real Madrid","https://genius.com/Farid-bang-real-madrid-lyrics","Released May 27, 2016
Distributor

    
      Warner Music Group
Artwork

    
      ADOPEKID
Label

    
      Banger Musik
Copyright ©

    
      Banger Musik
Phonographic Copyright ℗

    
      Banger Musik
Featuring

    
      Al-Gear, Fat Joe, Jasko & 7 more
Producers

    
      Abaz, Bad Educated, B-Case & 11 more
Writers

    
      Abaz, Al-Gear, Bad Educated & 22 more
Composer

    
      Abaz, Bad Educated, B-Case & 11 more
Copyright ©

    
      Banger Musik"
"17","Farid Bang","Blut auf dem Asphalt","Blut","[Songtext zu „Blut auf dem Asphalt“ ft. Juelz Santana]

[Intro: Juelz Santana]
Farid Bang
Bang Records!
What up? Was geht?

[Part 1: Farid Bang]
Meine kugelsichere Weste ist passend zu den Schuhen
Mein Wagen passt zur Waffe, doch die Waffe nicht zum Blut
Werde vom Verfassungsschutz gesucht wegen meinem Knastinsassenruf
Ich werd' dich gern ficken und vernichte per Attentat die Juice
Denn ich komme rein wie bei Columbine in die Bank mit Gun
Ficke die Polizei, ich hab' Schrot dabei, jetzt sind Schlampen dran, ah
Wenn Rapper mich in ihrer Scheiße erwähn'Ist es wie I auf der Tastatur - danach heißt es OP
Ah, was denkst du, wer du bist, du Fotze?
Bring mir deine Schwester, ich mach dich zum Onkel
Zücke die Gun, ficke dich dann, begeh Bodyguard Mord
Schieß' dich an, ich komm' mit Thommy-Gun wie Rocky Balboa

[Bridge: Farid Bang]
Heute spendest du dein Blut an den Asphalt
Denn sonst fick' ich deine Mutter, du Kasper
Du bezahlst an einen Zuhälter Abstand
Und zeugst dann mit der Hure ein' Bastard

[Hook: Farid Bang]
Wir wollen dein Blut auf dem Asphalt (was ist los, Mann?!)
Dein muttergeficktes Blut auf dem Asphalt (wer?)
Ich möchte dein Blut auf dem Asphalt (und alle!)
Heute Nacht will ich dein Blut auf dem Asphalt (Hurensohn!)

[Part 2: Juelz Santana]
If it ain't about their money, they now count me in
If my man in the dollar-show, we gotta count again
Still shoot in dead bodies, we be count in them
So many shells on the sea, we lost count again
'Cause I know my niggas, I can count on them
You probably owe your niggas, you can't count on them (Bastard)
We're not the same run alone nigga
You count other niggas money, I count my own nigga
Yeah, real niggaz they stack with it
You gotta go get it, then come back with it
Catch me in traffic, I'm clappin', I got the crash with it
Catch me in traffic, I'm clappin', I got the crash with it

[Bridge: Farid Bang]
Heute spendest du dein Blut an den Asphalt
Denn sonst fick' ich deine Mutter, du Kasper
Du bezahlst an einen Zuhälter Abstand
Und zeugst dann mit der Hure ein' Bastard

[Hook: Farid Bang]
Wir wollen dein Blut auf dem Asphalt (was ist los, Mann?!)
Dein muttergeficktes Blut auf dem Asphalt (wer?)
Ich möchte dein Blut auf dem Asphalt (und alle!)
Heute Nacht will ich dein Blut auf dem Asphalt (Hurensohn!)

[Part 3: Farid Bang]
Ich bin in Las Vegas, du Arschgeber, jetzt ist meine Zeit, Bitch
Bei Roulette bin ich wie Zinker, ich setz' auf 31
Wenn ein Rapper mir ans Bein pisst, zerleg' ich die Sippe
Merk dir eins: um Baba zu sein, musst du jemanden ficken
Die Bitch, die meinen Dick blowt, sieht dabei auch schick aus
Silikon, Billigkoks, die Nutte kommt aus Litauen
Ich rapp' über AKs, Geld, Fame und auch meinen Bentley
Denn ich bin B-A-N-G
Geh, du Nuttensohn, sonst gehst du per Vollkontakt drauf
Meine Facebooklikes sehen wie mein Kontostand aus
Typen, die ich respektier' für menschliche Werte
Sind meistens die, die in Gefängnissen sterben

[Bridge: Farid Bang]
Heute spendest du dein Blut an den Asphalt
Denn sonst fick' ich deine Mutter, du Kasper
Du bezahlst an einen Zuhälter Abstand
Und zeugst dann mit der Hure ein' Bastard

[Hook: Farid Bang]
Wir wollen dein Blut auf dem Asphalt (was ist los, Mann?!)
Dein muttergeficktes Blut auf dem Asphalt (wer?)
Ich möchte dein Blut auf dem Asphalt (und alle!)
Heute Nacht will ich dein Blut auf dem Asphalt (Hurensohn!)
Wir wollen dein Blut auf dem Asphalt (was ist los, Mann?!)
Dein muttergeficktes Blut auf dem Asphalt (wer?)
Ich möchte dein Blut auf dem Asphalt (und alle!)
Heute Nacht will ich dein Blut auf dem Asphalt (Hurensohn!)","https://genius.com/Farid-bang-blut-auf-dem-asphalt-lyrics","Released May 27, 2016
Distributor

    
      Warner Music Group
Artwork

    
      ADOPEKID
Label

    
      Banger Musik
Copyright ©

    
      Banger Musik
Phonographic Copyright ℗

    
      Banger Musik
Featuring

    
      Al-Gear, Fat Joe, Jasko & 7 more
Producers

    
      Abaz, Bad Educated, B-Case & 11 more
Writers

    
      Abaz, Al-Gear, Bad Educated & 22 more
Composer

    
      Abaz, Bad Educated, B-Case & 11 more
Copyright ©

    
      Banger Musik"
"18","Farid Bang","Nach oben","Blut","[Songtext zu „Nach oben“ ft. Al-Gear & Jasko]

[Part 1: Farid Bang]
Ich rappte hart, freshe Parts, wollte mich verewigen
Brüder in dieser Szene - ich traf nur sehr wenige
Der Auserwählte, lernte niemals aufzugeben
Denn auf dem Weg nach oben kannst du keinen Aufzug nehmen(ah)
Das geht ein Leben lang, komm mir nicht mit Regeln an
Denn ich fürchte nur das, was ich nicht sehen kann
Ich lernte schon früh, auf Gefühle zu scheißen (yeah)
Denn mein Beruf, er macht Brüder zu Feinden
Andre verkauften sich auf ihrem Weg an den Teufel (ich nicht)
Ich mach' heut das, was ich vor zehn Jahren träumte
Sollte auf der Strecke bleiben in meinen besten Zeiten
Muss jeden Tag trainieren, darf keine Schwäche zeigen (niemals)
Meine echte Meinung: Hunde sind loyaler als Menschen
Und für den Frieden musst du sie brutaler bekämpfen
Denn viel zu oft wurd' ich runtergezogen
Ich war im Grunde am Boden, doch kam von unten nach oben

[Hook: Al-Gear &Jasko&Farid Bang]
Du bist nicht wie wir, deine Eltern konnten dich verwöhnen
Ich hab' es mir so ausgesucht, ich wollte ins Milieu
Und wirst du reich, kommen dir Bonzen nicht mehr blöd
Denn heut bin ich willkommen auf der Kö
Du bist nicht wie wir, deine Eltern konnten dich verwöhnen
Ich hab' es mir so ausgesucht, ich wollte ins Milieu
Und wirst du reich, kommen dir Bonzen nicht mehr blöd
Denn heut bin ich willkommen auf der Kö

[Part 2: Al-Gear]
Fick die Zeit, wo ich Bares noch mit Kilos machte
Wo ich ein Niemand war und keine Chartplatzierung hatte
Farid zu mir sagte: „Bruder, scheiß auf die Kunden!
Tu das Kleinzeug nach unten!“ - leider wurd' es meistens gefunden
Dann gab es Stress, doch unseren Gegnern brachen wir die Rippen
Wir waren in der Hood als würden wir den Gladbachspieler ficken
Kam' in kein' Club - die Türsteher waren dreckige Wichser
Heute warten sie vor dem Klo, bis ich zu Ende gepisst hab'
Tausend Gesichter, die dich auf dem Weg nach oben begleiten
Doch nur die wenigsten bleiben in diesen komischen Zeiten
Musste mich entscheiden: Versorg' ich Kunden mit Drogen
Oder mach' ich Rap und schaff' es von unten nach oben?
Ich hab' mein Ziel erreicht, die Sonne scheint, der Schatten ist weg
Und hab' die Tränen meiner Mutter durch ein Lachen ersetzt
Ich brauch' mir keine Sorgen machen, es mangelt nicht an Fans
Denn ich hab' Farid schon gekannt, lange vor dem „Bang“

[Hook: Al-Gear & Jasko & Farid Bang]
Du bist nicht wie wir, deine Eltern konnten dich verwöhnen
Ich hab' es mir so ausgesucht, ich wollte ins Milieu
Und wirst du reich, kommen dir Bonzen nicht mehr blödDenn heut bin ich willkommen auf der Kö
Du bist nicht wie wir, deine Eltern konnten dich verwöhnen
Ich hab' es mir so ausgesucht, ich wollte ins Milieu
Und wirst du reich, kommen dir Bonzen nicht mehr blödDenn heut bin ich willkommen auf der Kö

[Part 3: Jasko]
Von meinen Lehrern gehasst, so viele Fehler gemacht
Ohne meinen Vater wäre ich schon zehnmal im Knast
Leere Taschen - ich hab' nicht mal einen Zehner gehabt
Aber heute wird die Kohle von der Gema verprasst
Und im Gegensatz zu dir habe ich es nicht so leicht gehabt
Dein Freund ist ein Junk und dein Bruder sitzt in Einzelhaft
Ich bin die Scheiße satt und diese steinigen Wege
Ich stand viel zu oft alleine im Regen, yeah
Ich bin loyal, denn ich teile mit jedem
Doch auf einmal werden deine Freunde Feinde, die reden
Wurd' von Hunden belogen, will von unten nach oben
Bis ich Scheine zähle, die so bunt sind wie Drogen
Schreibe hunderte Strophen, um meine Ziele hier zu schaffen
Denn in diesem Leben kannst du dich auf niemanden verlassen
Lieder für die Gassen, Hit für Hit
„Wenn kommt, dann kommt“ - von nix kommt nix

[Hook: Al-Gear & Jasko & Farid Bang]
Du bist nicht wie wir, deine Eltern konnten dich verwöhnen
Ich hab' es mir so ausgesucht, ich wollte ins Milieu
Und wirst du reich, kommen dir Bonzen nicht mehr blödDenn heut bin ich willkommen auf der Kö
Du bist nicht wie wir, deine Eltern konnten dich verwöhnen
Ich hab' es mir so ausgesucht, ich wollte ins Milieu
Und wirst du reich, kommen dir Bonzen nicht mehr blödDenn heut bin ich willkommen auf der Kö","https://genius.com/Farid-bang-nach-oben-lyrics","Released May 27, 2016
Distributor

    
      Warner Music Group
Artwork

    
      ADOPEKID
Label

    
      Banger Musik
Copyright ©

    
      Banger Musik
Phonographic Copyright ℗

    
      Banger Musik
Featuring

    
      Al-Gear, Fat Joe, Jasko & 7 more
Producers

    
      Abaz, Bad Educated, B-Case & 11 more
Writers

    
      Abaz, Al-Gear, Bad Educated & 22 more
Composer

    
      Abaz, Bad Educated, B-Case & 11 more
Copyright ©

    
      Banger Musik"
"19","Farid Bang","Creed","Blut","[Songtext zu „Creed“]

[Part 1]
Ich kam in das Game als respektloser G
Brachte Rap von der Street mit guter Technik auf Beats
Hatte die Wahl, entweder jetzt oder nie
Versuch es mit Rap oder streck Kokain
Hätte mich damals nicht Summer Cem beim Rappen entdecktHätte mich ein deutscher Richter ins Gefängnis gesteckt
Habe für das Ghetto gerappt, aus jedem Reim wurd' ein Pfeil
Dann kam der Hype, nicht alleine, er hatte Neid mit dabei
Meinen Erfolg konnten Beamten nicht verhindern
Die Goldplatte kam, doch meine Tante ging für immer
Jeder will Benz fahren, Verräter und Gangster
Ich bin der Beweis, ein Reim kann ein Leben verändern
Alles fing für mich mit einem scheiss Zettel anUnd mein Motto: ""Austeilen solang du einstecken kannst!""
Lieber sterbe ich im Kampf wie Apollo CreedAls zu leben wie ein Feigling dem man Stolz entzieht
Ich verfolg mein Ziel denn der Benz ist vollgetankt
Willkommen in einer Welt voller Tommy-Guns
Ich verkaufte am Spielplatz du wuchst auf in der Kita
Wo war Jan Böhmermann als ich da draußen gedealt hab?

[Hook]
Creed! Das hier ist der Soundtrack zum Kampf
Und ich mache es weil ich in dieser Haut stecken kann
Falls es irgendwann mal heißt, ich wurde ausgezählt
Kann ich sagen, ich habe mein Traum gelebt
Creed! Jede Hand passt in den Handschuh rein
Doch nur die Hand geht nach oben, die kein Handtuch schmeißt
Ganz egal was ihr Jungs auf der Strasse denkt
Doch für den schwarzen Benz hat Farid Bang sehr hart gekämpft
Creed! (Creed!)

[Part 2]
Wen interessiert es wieviel du für ein Kilogramm kriegst?Wenn meine Biographie sagt, ich hab Mios verdient
Von 1000 nur einer, sonst schaffts keiner hoch
Was weiß Jimi Blue von in 'ner Absteige wohnen?Hast du dir jemals mit 3 anderen ein Zimmer geteilt?
Umstrittener Hype, jeder weiss ich kam zur richtigen Zeit
Wenn mir kein Image mehr bleibt, gib mir ein Stift und ein Mic
Denn Farid Bang ist mehr als ein paar witzige Lines
Was für ein Gefühl wenn der Bulle deinen Wagen anhält
Doch nichts findet außer einen Stapel an Geld
Nimm mir das Mic und fronte, kein kleiner Bonze
Ich rapp' das was der Richter nicht beweisen konnte
Rapp' für jeden der mit mir ein Tag verbrachte
Rapp' für jeden der mit mir mal Gras abpackte
Rapp' für jeden der mir irgendwann geholfen hat
Das ist mein Leben, ich hab aus Scheiße Gold gemacht

[Hook]
Creed! Das hier ist der Soundtrack zum Kampf
Und ich mache es weil ich in dieser Haut stecken kann
Falls es irgendwann mal heißt, ich wurde ausgezählt
Kann ich sagen, ich habe mein Traum gelebt
Creed! Jede Hand passt in den Handschuh rein
Doch nur die Hand geht nach oben, die kein Handtuch schmeißt
Ganz egal was ihr Jungs auf der Strasse denkt
Doch für den schwarzen Benz hat Farid Bang sehr hart gekämpft
Creed! (Creed!) Creed! (Creed!)","https://genius.com/Farid-bang-creed-lyrics","Released May 27, 2016
Distributor

    
      Warner Music Group
Artwork

    
      ADOPEKID
Label

    
      Banger Musik
Copyright ©

    
      Banger Musik
Phonographic Copyright ℗

    
      Banger Musik
Featuring

    
      Al-Gear, Fat Joe, Jasko & 7 more
Producers

    
      Abaz, Bad Educated, B-Case & 11 more
Writers

    
      Abaz, Al-Gear, Bad Educated & 22 more
Composer

    
      Abaz, Bad Educated, B-Case & 11 more
Copyright ©

    
      Banger Musik"
