"","artist","title","album","text","url","metadata"
"1","Fettes Brot","Intro (Fettes Brot für die Welt)","Fettes brot fur die welt","Wir präsentiern dir Rap-Musik im Glitzerkleid
Dabei verliern wir ganz sicher unsre Sittsamkeit
So dass keiner von euch Hängern länger sitzen bleibt
Wenn Fettes Brot die blitzgescheiten Witze schreibt
Und es auf die Spitze treibt
Ging dir das etwa 'n Schritt zu weit?
Alter, selbst Urologen finden unsern Shit zu tight
But it's all right baby, cause we making Hits tonight
Und unsre Rechnung die ist aufgegangen wie Pizzateig","https://genius.com/Fettes-brot-intro-fettes-brot-fur-die-welt-lyrics","Released May 12, 2000
Featuring

    
      Beginner, Der Tobi, Der Tobi & das Bo & 2 more
Producers

    
      André Luth & Fettes Brot
Copyright ©

    
      Intercord Ton GmbH & Yo Mama’s Recording
Distribution

    
      Indigo Musikproduktion + Vertrieb GmbH & Intercord Ton GmbH
Label

    
      Yo Mama’s Recording"
"2","Fettes Brot","Da Draussen","Fettes brot fur die welt","[Part 1: Flash Müller (Schiffmeister)]
Du hast nicht die leiseste Ahnung und kennst das alles nur vom Hörensagen
Wir ham' einiges in Planung darauf kannst du Gift nehmen oder Björn fragen
Denn ich rap um mein Leben kanns' da was besseres geben
Als die drei Harros von eben die das Niveau wieder heben
Die Vorurteile widerlegen bis der Knoten dann geplatzt ist
Fakt is: Ich hörte selten so etwas beknacktes
Wer wagt es und kommt mit mir bis in die Arktis
Wo wir dich burnen, dass du im Krematorium Rabatt kriegst
Weil mein Part der lodert, deiner klingt arg vermodert
Wir ham' mit Styles die Charts erobert , die glänzen wie frisch gebohnert
Heiliger Strohsack das ist für manchen starker Tobak
Ich komm mit Bildern wie Kodakund bin der Mann für jede Tonart
Wenn ich bei mir zuhaus in meiner Plattenkiste stöber
Bastel ich für Euch die Bombe und kein lieblosen Scheiß
Viele Diddel ham euch jahrelang mit Rattengift geködert
Doch das kann euch nicht passieren wenn ich zum Mikrofon greif
So trennt sich die Spreu jetzt vom Weizen. Wie ich mich freu euch zu reizen
Verlier die Scheu hier zu geizen. Denn wir sind neu und die geilsten
Schiff ahoi! Es schlägt dreizehn denkst du dir bei meiner Handarbeit
Dreh meine Joints nur vom Feinsten. Da spricht bei Dir nur blanker Neid
Was wir heute produzieren wird erst in Jahren dann gecheckt
Doch ich will keine Dankbarkeit ich will Respekt
Keine Angst!! Dies ist nur die Zukunft. Könnt ihr mich hören?

[Hook]
Flash Müller baut n' Haus für das neue JahrtausendWo sind meine Leute da draußen?Kaybee Baby pflanzt n' Baum für das neue JahrtausendWo sind meine Leute da draußen?Rektor Donz zeugt n' Kind für das neue JahrtausendWo sind meine Leute da draußen?
Unsere Fans sind die Größten, die Schönsten, die Schlausten

[Part 2: Rektor Donz (Doktor Renz)]
Yeah, jetzt bekommst du von hip hop's Schwiegersohn deine letzte Chance
Nix ist mehr wie gewohnt,überschätzte Schnomps
Wurden ja eh nie geschont. Raps par excellence
Rektor Donz ist am Mikrofon
Ich bin der letzte der geht, wenn alle anderen walkenBin der letzte der spricht, wenn alle anderen talken
Manchmal macht mir diese Scheisse echt Sorgen
Viele Flaschen können den Hals nicht voll kriegen
Hier kommt endlich der Korken
Schönen guten Morgen an all die Banausen da draussen
Ich verteil erstmal n' paar gute Ratschläge
In punkto Tüchtigkeit und Ordnung setz ich hier die Maßstäbe
Weil ich tüchtig gasgebe und ordentlich arschtrete, ey
Wer wenn nicht wir, wo wenn nicht hier
Wann wenn nicht gerad', wie wenn nicht hart
Selbst Onkel Punkrock geht nach unserer Show am Stock
Drei kleine Scheisser laufen Amok mit'm Rammbock
Hamburgs Hip Hop Dinosaurier 92er Baujahr laden ein auf die tollere Party
Auja, wir machen schön ein' auf dicke Hose wie Oliver Hardy
Und riskieren 'ne dicke Lippe wie Lollo Ferrari
Mäusschen sag mal hip ""hip"", sag mal hop ""hop""
Sag mal Fettes Brot, oh mein Gott, don't stop ""don't stop ""
Sag mal wie heißt dieses Showtalent im weißen Oberhemd
Für sie immer noch Herr Vorragend

[Hook]
Flash Müller baut n' Haus für das neue JahrtausendWo sind meine Leute da draußen?Kaybee Baby pflanzt n' Baum für das neue JahrtausendWo sind meine Leute da draußen?Rektor Donz zeugt n' Kind für das neue JahrtausendWo sind meine Leute da draußen?
Unsere Fans sind die Größten, die Schönsten, die Schlausten

[Part 3: Kaybee Baby (König Boris)]
Die Leute liegen auf der Lauer denn sie finden unsere Tape gut
Die anderen Bauern werden sauer wie ne' Grapefruit
Denn sie wissen ganz genau auf unserem Tanzboden klebt Blut
Denn Fettes Brot geht immer dahin wo es weh tut
Doch mach mal halb lang alter ist doch noch kein Grund zum schreien
Setz ein Helm auf, spann die Muskeln an und Mundschutz rein
Nur für den Fall denn wenn das ganze Land zu unser Platte nickt
Kann es gut sein das Fettes Brot Dich auf die Matte schickt
Denn Du Spacken verstummst wenn ich wie kein zweiter abstyle
Mit Backen wie Mumps bei jeder weiteren Zeile
Das ist packende Kunst an der ich auch weiterhin feile
Weil so alles begann und uns gibt es seither ne' Weile
Also Keule denk nach über einen Neuanfang
Weil selbst erfrorene Ohren Feuer fangen bei unserem Schleudergang
So sieht es aus auch wenn Du die Wahrheit nicht ab kannst
Bei uns ist jeder Laden voll da kriegst Du Schlappschwanz Platzangst
Überall lassen wir die Korken knallen Kollegen
Da kennen wir wirklich nichts das steht in allen Verträgen
Und damit niemand schubst, schwitzt und sich alle bewegen
Müssen Klubs unsere Gigs in große Hallen verlegen
Denn wenn wir ne' neue Platte aufnehmen damit auftreten und aufdrehen
Erregen wir aller Ortens ungeahntes aufsehen
Bei uns bleibt alles in Bewegung und wir ändern den Kurs nicht
Denn wir sind immer noch durstig

[Hook]
Flash Müller baut n' Haus für das neue JahrtausendWo sind meine Leute da draußen?Kaybee Baby pflanzt n' Baum für das neue JahrtausendWo sind meine Leute da draußen?Rektor Donz zeugt n' Kind für das neue JahrtausendWo sind meine Leute da draußen?
Unsere Fans sind die Größten, die Schönsten, die Schlausten
„Hey, wo sind meine Leute da draußen?“

[Outro] (4x)
Drei Hamburger mit'm MonsterbassSaßen auf der Strasse und erzählten euch dasDa kam die Polizei und fragte sonst noch wasDrei Hamburger mit'm Monsterbass

","https://genius.com/Fettes-brot-da-draussen-lyrics","Released May 12, 2000
Featuring

    
      Beginner, Der Tobi, Der Tobi & das Bo & 2 more
Producers

    
      André Luth & Fettes Brot
Copyright ©

    
      Intercord Ton GmbH & Yo Mama’s Recording
Distribution

    
      Indigo Musikproduktion + Vertrieb GmbH & Intercord Ton GmbH
Label

    
      Yo Mama’s Recording"
"3","Fettes Brot","Gangsta Rap (Remix)","Fettes brot fur die welt","Wir werden geprägt durch unser Umfeld, unsere Umwelt
Höchste Zeit, daß der Mensch sich umstellt, bevor alles umfällt
Doch die Industrie verschleiert, weil sie uns für dumm hält
Denn das Geld regiert die Welt und Leute, das bedeutet
Der Wald wird abgepellt und der Boden ausgebeutet
Lebendigen Leibes wird die Erde gehäutet
Die Uhr der Natur hat längst elfmal geläutet
Rinder fressen die letzten Grassoden
So daß bald nach dem Roden die Böden veröden
Geehrte Gangsta, wir lassen uns nicht blenden!
Beenden Sie das Verschwenden von Regenwaldbeständen!
Ach, ich überseh', es wird kein Tier aus Übersee nach hier importiert
- wie raffiniert!
Um Kohle zu scheffeln, muß man halt'n bisschen schummeln
Wolte schon immer wissen, was Ronald davon hält
Doch seit ich ihn in ""ES"" sah, ist ihm alles klar -
Ronald selbst ist längst der Obergangsta
Hahahah, Du Clown, ich werd' Dir niemehr trauen
Jetzt setzt es ein letztes Geschoß zwischen die Brauen!

Du denkst Gangsta: Hut, Sonnenbrille, hochgeschlagener Kragen
Doch ich muß Dir leider sagen, daß die echten Gangsta meistens weiße Westen tragen
Und ein' dicken Wagen und ein Fahrer mit steifem Hemd
Und 'n Sitz im Parlament
Fetter Arsch - nee, nicht ""fett"", sonderm einfach nur häßlich
- anläßlich der Machtposition läßt sich lässig ein neues Gesetz erlassen
Ein Antrag verfassen - Hauptsache volle Kassen!
Alte, faltige Männer, die schwitzen
Die nur um sitzen zu bleiben da sitzen
Um das Volk zu beruhigen gibt es Brot und Spiele
Denn es wär ja echt schlecht, wenn jemandem auffiele
Wie abgezockt Euer Spielchen ist
Daß einer gar nichts kriegt, der andere alles frißt
Ein zweites As immer in der Manschette
Denn wenn er fair spielen würde, dann hätte
Er nicht den Thron, auf dem er jetzt hockt
Und gemütlich mal hier und mal da was abzockt
Doch ich bin der König und gehör' auf den Thron
Und deswegen werde ich hier laut betonen:
Gangstabacke, Du gehst mir auf den Sack
Kreuze nicht meinen Weg, sonst macht's Ratatatat!

""Geld stinkt nicht und alles ist käuflich""
Hörst Du Dich oft reden, doch häufig
Merkst Du dabei nicht, daß du der Gekaufte bist
Der von Leuten, die Dich ausbeuten, zu kaufen ist
Vielleicht von einem Unternehmer
Der unter ""nehmen"" das Gegenteil von Geben versteht
Seht in die Welt und stellt Fragen
Hinterfragt das Jagen nach Geld
Fällt Euch dabei auf, daß der, der die Arbeit kauft
Auf der Jagd nach Geld und Macht niemals verschnauft?
Dann ist es vielleicht ein richtiger E.V
– Ein was? – Ein ""Echter Verbrecher"" – Genau!
Die Leute, die ein noch dickeres Auto fahren
Die eher an Löhnen als an ihrem Luxus sparen
Vielleicht einer, der 5 Milliarden in Krediten abzieht
Sich Toupets dafür kauft und dann flieht
Mit Profit auf die Politik Einfluß nimmt
Was zählen Menschen, solange die Kasse stimmt?
Mach Dir ruhig Sorgen
Denn vielleicht schon morgen
Werd' ich mir ein MG aus Deinem Waffenschmuggel borgen","https://genius.com/Fettes-brot-gangsta-rap-remix-lyrics","Released May 12, 2000
Featuring

    
      Beginner, Der Tobi, Der Tobi & das Bo & 2 more
Producers

    
      André Luth & Fettes Brot
Copyright ©

    
      Intercord Ton GmbH & Yo Mama’s Recording
Distribution

    
      Indigo Musikproduktion + Vertrieb GmbH & Intercord Ton GmbH
Label

    
      Yo Mama’s Recording"
"4","Fettes Brot","Bela ruft an","Fettes brot fur die welt","(Spoken)
Hey, ihr Rap-Pisser! Hier spricht so Bela B. Ihr wollt unser schönstes deutsches Liedgut verhuntzen, ja? So Nana-mäßig, voll die Styles, Skills, fett mit Flow belegt oder so. Jungs, ein falscher Ton und ihr lernt die Ärzte-Posse kennen, is' das klar? Da geht dann nämlich gar nichts mehr!
Joa, das war's dann eigentlich, hab euch ganz furchtbar lieb. Ähm, ich koste für solche Kleinauftritte inzwischen Geld, darum nehm' ich die Independent-Bands nicht mehr. Das wisst ihr hoffentlich. Die Maggie teilt euch dann meine sechs-stelligen Gagenforderungen mit. Bis dann! Tschau!","https://genius.com/Fettes-brot-bela-ruft-an-lyrics","Released May 12, 2000
Featuring

    
      Beginner, Der Tobi, Der Tobi & das Bo & 2 more
Producers

    
      André Luth & Fettes Brot
Copyright ©

    
      Intercord Ton GmbH & Yo Mama’s Recording
Distribution

    
      Indigo Musikproduktion + Vertrieb GmbH & Intercord Ton GmbH
Label

    
      Yo Mama’s Recording"
"5","Fettes Brot","Was hat der Junge doch für Nerven","Fettes brot fur die welt","Er lauert mir morgens an der Schule auf
Denn er ist stärker als ich
Er hält mich fest, damit ich nicht weg lauf
Denn er ist stärker als ich
Manchmal ist er extrem gemein
Denn er ist stärker als ich
Dann zertrümmert er mir mein Nasenbein
Denn er ist stärker als ich
Er weiß genau, er ist stärker als ich
Aber trotzdem liebst du mich
Denn keiner hier tanzt Breakdance so wie ich

Uh hu, Barbara

Er braucht keinen Spickzettel in Mathematik
Denn er ist klüger als ich
Er spricht fließend Latein und hat ne 1 ich Physik
Denn er ist klüger als ich
Er lässt mich niemals im Diktat abschreiben
Denn er ist klüger als ich
Im Gegensatz zu mir wird er nie sitzen bleiben
Denn er ist klüger als ich
Er weiß genau, er ist klüger als ich
Aber trotzdem liebst du mich
Denn keiner sprüht Graffiti so wie ich

Uh hu, Barbara

Nach ihm dreh'n sich alle Mädchen um
Denn er ist schöner als ich
Er ist braun gebrannt und geht niemals krumm
Denn er ist schöner als ich
Er küsst die Mädchen völlig ungehemmt
Denn er ist schöner als ich
Meine Akneprobleme sind ihm fremd
Denn er ist schöner als ich
Er weiß genau, er ist schöner als ich
Aber trotzdem liebst du mich
Denn keiner kratzt die Platten so wie ich

Mit uns kommt sowie so keiner mit
Denn wir sind die Brote und wir sind zu dritt

Uh hu, Barbara","https://genius.com/Fettes-brot-was-hat-der-junge-doch-fur-nerven-lyrics","Released May 12, 2000
Featuring

    
      Beginner, Der Tobi, Der Tobi & das Bo & 2 more
Producers

    
      André Luth & Fettes Brot
Copyright ©

    
      Intercord Ton GmbH & Yo Mama’s Recording
Distribution

    
      Indigo Musikproduktion + Vertrieb GmbH & Intercord Ton GmbH
Label

    
      Yo Mama’s Recording"
"6","Fettes Brot","Hubschraubermütze","Fettes brot fur die welt","König Boris: ""Liebe Leute in Winterthur, seid ihr schon müde?""
Publikum: ""Nein!""
König Boris: ""Hab ich eine Hubschraubermütze? Na, hab ich eine? Na, ihr seid euch nicht sicher. Ne, ich hab keine, oder. Das ist meine Frisur. Man was ist los mit euch?
Seid ihr auch alle da?""
Publikum: ""Ja!""
König Boris: ""So Boris, was ist mit dir denn los? Hey, was soll das? Leck mich am Arsch. Meine Hand
Freunde, apropos Hand, die muss jetzt mal schwer in die Luft und zwar nicht nur eine sondern zwei
Ja bei euch, nicht bei mir
Alle Hände hoch!""","https://genius.com/Fettes-brot-hubschraubermutze-lyrics","Released May 12, 2000
Featuring

    
      Beginner, Der Tobi, Der Tobi & das Bo & 2 more
Producers

    
      André Luth & Fettes Brot
Copyright ©

    
      Intercord Ton GmbH & Yo Mama’s Recording
Distribution

    
      Indigo Musikproduktion + Vertrieb GmbH & Intercord Ton GmbH
Label

    
      Yo Mama’s Recording"
"7","Fettes Brot","Silberfische (Headknot Remix)","Fettes brot fur die welt","[König Boris:]
Ah Jawoll, Jawoll, das ist an die Schenefelder Situation
König Boris am Mikrophon - kommt krass

Guten Morgen! Ich wach auf und denk, das muß mein Glückstag sein
Guck aus dem Fenster. Es gießt in Strömen und ich höre jemand schreien:
„Dein Glückstag muß ein anderer sein
Denn ich bin Dein Tag und heute bin ich Schwein!“
Oh, nein, ich sollte besser liegen bleiben bis morgen
Doch das geht nicht, denn ich muß für Fettes Brot noch was besorgen

Gießt draußen der Regen, drinn' die Pflicht im Nacken
Kriegt mich morgens früh um 8 ein lustiger Würgreiz zu packen
Ich steh auf, zieh mich an, weil ich dann losgehn kann
Such ein Regenschirm doch ich kann keinen finden, Mann!
Ich kann kein' finden, weil ich das Scheißteil überall vergesse
Geh dann ohne. Resultat: Regen in der Fresse

1, 8, 8, – ich geh zum Linienbus
Weil ich die 1-8-8-Linie nehmen muß
Regenguß, ich sitz im Bus, naß wie ein bepißter Hund
Zähneputzen auch vergessen, und ich stinke aus dem Mund
Und ich wunder mich schon: „Warum verzieht hier jeder sein Gesicht?“
Des Rätsels Lösung: Der Grund bin ich!

1000 Stunden lang im Bus vom Publikumsverkehr erniedrigt
Und beim Schwarzfahren erwischt, und das ist ja ordnungswidrig
60 Kröten sind flöten – wieder in finanziellen Nöten
Wenn der Tag so weiter geht, bin ich bald bereit zu töten (Oh Boris)
Endlich am Ziel meiner Wahl angekommen
Klopfe ich an die Tür, denn ich hatte ja angenommen
Daß wie verabredet jemand da ist
Doch es macht kein Schwein auf, und ich frag mich ob es wahr ist

Scheiße, Scheiße, Scheiße
Mir wird schlecht wie der Scherz – alles rückwärts!
Wieder in'n Bus, wieder durch'n Regen
Wenn ich zu Hause bin, werde ich mich hinlegen
Ich komm auch an und denke „Mmmh, Mittagsschläfchen wär jetzt nett!“
Doch äh, äh: Silberfische in meinem Bett

Silberfische in meinem Bett...
... wunderbar und mir war klar, daß
Dieser Tag im Eimer war

Der Tag fing scheiße an, vielleicht wird er ja noch besser;
Ich hab' mit meinem Babe noch ein Date, und die ist scharf
Weil ich keine Lust auf'n Bus und kein Kleingeld mehr da hab
Steig ich umweltbewußt um auf mein Fahrrad
Die Entscheidung stellt sich sehr bald als grober Fehler raus
Denn zwei Straßen später bremste mich ein Peterwagen aus
„Halt! Bleiben Sie stehen! Sie wurden gesehen
Beim Autos aufbrechen und beim Radios mitnehemen!“

Sie schreien was von Zeugen und von stichfesten Beweisen
Und so langsam fangen die Jungs an, verbal zu entgleisen
Ich sag: „Jungs, hört mal zu, gebt mal Ruh', checkt den Clou!
Ihr labert alle Kacke!“ – „In den Knast kommst Du!“
Zickzack in Handschellen gepackt
Knüppel auf'n Kopf und rein in den Sack
Mit Blaulicht fahren wir aufs Polizeirevier
Als wir ankommen stehn die anderen Kollegen schon Spalier

Ich werd angeschrien, verhört und ausgefragt
Und hätt ich es getan, hätt ich ausgesagt
Ich war's nicht; doch zur Sicherheit und für alle Fälle
Sperren mich die Jungs in Grün erst mal in die Zelle
Sie schubsen mich den Gang entlang
Und ich fang an zu verfluchen, warum ich diesen Tag begann
In der Zelle kahle Wände, ein Stuhl und ein Tisch
Und ein kleiner grinsender Silberfisch

Silberfische in meinem Bett...
... wunderbar und mir war klar. daß diese
Tag im Eimer war

3. Strophe, letzter Teil. Der Tag war nicht geil
Was wahrhaftig kein Grund zum Trauern war, weil:
Ging der Tag in die Hose, gibt's am Abend Möglichkeiten
Das Ende des Tages noch schön zu gestalten
Also steht fest, ich gehe aufs Fest
Weil man sich kein Fest entgehen läßt

König Boris, Chiefrocker, geht auf Party und trinkt Wodka
Doch nach 20 Gläsern hatte ich echt kein Bock mehr
Wurde bleich im Gesicht, halt mein Gleichgewicht nicht
Fall aufs Maul. Peinlich! Doch das reicht mir noch nicht
Die Mutter des Gastgebers sammelt Enten aus Porzellan
Die mir aus den Händen gepurzelt waren

Mir wird schlecht, ich will raus, in die Büsche
Was ist das in meinem Magen? Das sind wohl Silberfische!
An die frische Luft wollte ich mich retten
In den Garten reihern, mich daneben betten
Ich renne, doch ich schaff es nicht, kotze voll aufs Buffet
Mmmh, lecker, Silberfische auf Baguette

Silberfische in meinem Bett...
... wunderbar und mir war klar, daß dieser
Tag im Eimer war","https://genius.com/Fettes-brot-silberfische-headknot-remix-lyrics","Released May 12, 2000
Featuring

    
      Beginner, Der Tobi, Der Tobi & das Bo & 2 more
Producers

    
      André Luth & Fettes Brot
Copyright ©

    
      Intercord Ton GmbH & Yo Mama’s Recording
Distribution

    
      Indigo Musikproduktion + Vertrieb GmbH & Intercord Ton GmbH
Label

    
      Yo Mama’s Recording"
"8","Fettes Brot","Kleiner Nager","Fettes brot fur die welt","Ein buntes Paar in Orange und in Blau
Die Maus und der Elefant sind echt schlau
Die Maus kann mit den Wimpern klimpern – ""klapp klapp""
Und das Elefantgetröte ist bezaubernd wie die Zauberflöte
Ey Mann, du bist echt 'n Überzeugungstäter:
Dich gab's schon vor 25 Jahren, und 25 Jahre später gibt's die Sendung noch immer
Als ich klein war, kamt ihr durch den Fernseher ins Zimmer
Sprechen könnt und wollt ihr nicht, das hab ich schnell erkannt
Doch das war auch nicht nötig, weil man ohne Wort verstand
Die Geschichten, die ihr erzählt von schönen Dingen, die es gibt
Maus Baby, Elefant, yeah, ich hab euch lieb, so lieb... yeah... so lieb

Lass uns die Sau raus lassen außer Haus heute Abend
Brauchst keine Angst vor nem Kater haben
Na, was ist? Äußer dich: Maus oder Mäuserich?
Ach, du sprichst ja nicht, aber immerhin freust du dich
Mit 25 Jahren, wo so mancher deiner Ahnen schon dünn und ranzig war
Da hat das Leben dich eben nicht gezeichnet
Du bist wunderbar weich und reichhaltig wie streichfett
Das Gegenstück zu jeder Tratsch- und Klatschweibe
Und trotz alledem wöchentlich auf der Mattscheibe
Och, bleibe doch noch – tja, Baby, eins weiß ich:
Du muss jetzt wohl gehen um 18 Uhr 30 – es ist 18 Uhr 30, es ist 18 Uhr 30, 18 Uhr 30

Oh Mausi, ich werde dich immer lieben
Wir sehen uns immer Donnerstags zwischen 6 und halb 7
An Sex mit dir dacht' ich nie – ich steh nicht auf Sodomie
Doch Nacht für Nacht dacht ich wie
Du treu auf meinem Bettkasten sitzt
Natürlich nur als Replikat, aber plauschig und du lächelst verschmitzt
Daher widme ich dir einen meiner Schmit's-Hits
Somit dein Herz auf Platte statt in Baumrinde ritz
Du kannst nicht sprechen, doch du schenktest mir so viel Wissen
Ich würde dich vermissen, wenn du irgendwann verschwindest
Und 'n Job als Talkshow-Moderator findest

Irgendwie ist das Ganze für mich mehr als ne Romanze
Meine Herren, eher eine schwere Affäre durch 'n Fernseher
Und so bliebe euch die Liebe nur zur Mattscheibe
Doch für mich ist das anders und ihr wisst das ich keinen Quatsch schreibe
Da wir uns beide schon seit vielen Jahren kennen
Wurde es endlich Zeit, dass wir das Kind beim Namen nennen
Denn unser Techtelmechtel lies sich nicht mehr verheimlichen
Um uns vor peinlichen Situationen zu schonen
Ähm... werd ich dann halt der Bravo ein intimes Interview geben
Und dann darin öffentlich verkünden, dass wir jetzt halt zusammen leben, nur...
Der arme Elefant musste leider gehen und das war ziemlich fies, weil
Ich mach's jetzt mit der Maus und er macht Freestyle – Freestyle

Oh Säugling, oh du süße Maus, ich fand dich geil, weil
Du mich leertest wie ich 'n Glas Milch
Damals war ich noch 'n Knilch
Doch oh, du süße Maus, ich find dich geil, weil
Ich mach Mäuse mit der Maus
Nicht Läuse mit der Laus
Ich bin raus und bekannt wie Maus und Elefant
Kleiner Nager, du bist die schönste Maus der Welt!
Ich kann auch wie Louis Armstrong:
Oh, what a wonderful mouse this is!","https://genius.com/Fettes-brot-kleiner-nager-lyrics","Released May 12, 2000
Featuring

    
      Beginner, Der Tobi, Der Tobi & das Bo & 2 more
Producers

    
      André Luth & Fettes Brot
Copyright ©

    
      Intercord Ton GmbH & Yo Mama’s Recording
Distribution

    
      Indigo Musikproduktion + Vertrieb GmbH & Intercord Ton GmbH
Label

    
      Yo Mama’s Recording"
