"","artist","title","album","text","url","metadata"
"1","Massive Töne","Topmodel","Zuruck in die zukunft","[Intro]
Massive Töne, Junge
Massive Töne

An alle J.Lo 's
An alle Marilyn Monroe's
Mit Top Figur und schöner Frisur: WOW!

[Hook]
Du siehst gut aus, du bist mein Topmodel
Du kommst groß raus, du ziehst dich an
Und ich, ich zieh dich aus
Du ziehst dich an, ich zieh dich aus
Komm sieh dich an du siehst gut aus
Du bist mein Topmodel

[Verse 1]
Hey Süße, schmeiß das Müsli weg
Leg das Vollkornbrot und das Gemüse weg
Ey Süße, wie du fühlst dich fett?
Nimm den Lolli in den Mund
Schau wie süß er schmeckt
Sag mir willst du ausseh'n wie nen Bügelbrett?
Wie die auf'm Laufsteg?
Mir wird schlecht
Ich übergeb mich
Du bist nicht dünn und grätig
Du bist mein Topmodel
Deine Bauch, Beine, Po sind geil und stylish
Und schau deine Boobs sind weich und weiblich
Nein ich schleim nicht, ich begreifs nicht
Warum bist du bloß auf Heidi neidisch?
Nein, ich will keine Campbell
Ich will dich und deine Schenkel
Wer ist Heidi Klum?
Ihre Zeit ist um
Du hast keinen Grund
Also sei nicht dumm, denn...

[Hook]
Du siehst gut aus, du bist mein Topmodel
Du kommst groß raus, du ziehst dich an
Und ich, ich zieh dich aus
Du ziehst dich an, ich zieh dich aus
Komm sieh dich an du siehst gut aus
Du bist mein Topmodel

[Verse 2]
Fuck Yoga, fuck Pilates
Trink Cola, schnapp dir den Nachtisch
Ich warn' dich, wenn du gar nix
Oder nur Salat frisst bist du eines Tages
Nur Haut und Knochen, hör auf zu joggen (warum?)
Komm wir geh'n nach Hause kochen
Viele finden 's zum kotzen, sind magersüchtig
Mensch, alle Menschen sind nach Nahrung süchtig
Komm hör endlich auf, Kalorien zu zählen
Ich muß dir nix mehr über Bulemie erzählen
Weißt du wieviel sich quälen? Es sind Millionen
Eigentlich müßte man Helmut Kohl wieder wählen
Was Magazine erzähl'n und die Brigitte Diät
Igitt igitt nee, der Appetit vergeht
DU darfst! Essen soviel du magst
Du darfst! Schüttel diesen Arsch

[Hook]
Du siehst gut aus, du bist mein Topmodel
Du kommst groß raus, du ziehst dich an
Und ich, ich zieh dich aus
Du ziehst dich an, ich zieh dich aus
Komm sieh dich an du siehst gut aus
Du bist mein Topmodel

[Bridge 1]
Mach den Döner warm, komm mach ihn heiß, baby
Scheiß auf die Schöhnheitsfarm, du bist so nice, baby
Bleib, wie du bist, die Kalorien machen dich schön
Nimm Mondamin statt Kokain, du bist mein Topmodel!

[Verse 3]
Ich will nix mehr hör'n von deinem Slimfast Getraenk
Warum sonst hat dir Gott diesen Hintern geschenkt?
Wenn du das trinkst ist er weg
Ich steh auf Babyspeck
Und hass es wenn du Pullis trägst
Und ihn dahinter versteckst
Komm zeig was du hast!
Scheiß auf den Jojo-Effekt
Ey jo das ist Rap
Ich find deinen Popo echt fett
Ich find deinen Popo perfekt
Also los aufs Parkett
Beweg deinen Arsch in der Hose
Das ist gerade in Mode
Du bist die Queen in Minis, Jeans
Oder Abendgarderobe ne wahre Kanone
Ich mag dich auch ohne, Idealgewicht
Bitte bitte plag dich nicht
Keine Frage, du brauchst keine Waage
Denn dein Gewicht ist ideal für mich

[Hook]
Du siehst gut aus, du bist mein Topmodel
Du kommst groß raus, du ziehst dich an
Und ich, ich zieh dich aus
Du ziehst dich an, ich zieh dich aus
Komm sieh dich an du siehst gut aus
Du bist mein Topmodel

[Bridge 2] x4
Topmodel, mein Topmodel...
Du bist mein Topmodel

[Outro]
Yeah, das geht raus an all die starken Frauen
Mit Selbstvertrauen, die sich nicht anpassen (yeah)
Denn wir wollen was zum Anfassen

So sieht's aus...

Du bist mein Topmodel","https://genius.com/Massive-tone-topmodel-lyrics","Released October 5, 2005
Mixed At

    
      Benztown Studio & Tucan Studio
Recorded At

    
      Kopfnicker Studio
Label

    
      Kopfnicker Records
Featuring

    
      Ceza, Fatman Scoop, Fetsum & 2 more
Producers

    
      Baby Dooks, Chris Sholar, DashBeatz & 5 more
Backing Vocals

    
      Ghee Diakhate
Backing Vovcals

    
      Anastasia Toufa
Guitar

    
      Don Philippe"
"2","Massive Töne","Worauf Wartest Du?","Zuruck in die zukunft","Yo okay

Dein Leben langweilt
Die Kids sind fett frustriert
Dein neues image
Von fifty cent kopiert
Wie Pressefotos fake und Retuschiert
Die Bösen jungs im clip sind echt mit cash geschmiert
Mann jeder träumt jetzt dass sein Dorf zum Ghetto wird
Und hier bei uns in Deutschland vielleicht morgen n rapper stirbt
Bald wird Hameln zu Harlem und Kempten zu Compton
Du kommst aus Heilbronn und denkst du hängst in der Bronx rum
Komm schon
So sieht die Neue Deutsche Welle aus
Dass jeder rapper sich vom Vorschuss nur ne schöne neue Kette kauft
Rapper die Waffen zeigen
Böse Grimassen schneiden
Bodyguards mitbringen die nix bringen
Wenn Kids mit Flaschen schmeissen
Alle sind hart und cool
Keiner will Liebe spreaden
Nicht jedem passt der Schuh
Doch rap hat verdammt viele Facetten
Alle sehen rap wenn sie auf MTV und VIVA zappen
Worauf wartest du?
Dass ihn die Massiven retten?


Worauf wartest Du?
Ey worauf wartest Du?
Beweg dein Arsch
Komm beweg Dein Arsch dazu
Worauf wartest Du?
Ey worauf wartest Du?
Beweg Dein Arsch
Komm beweg Dein Arsch dazu


İki elinle bir siki doğrultamadın sen
Önünde koca bir hedef 12 vuramadın
Ben yerimde duramadım, sen adını yazamadın
Al eline kalemini, geri çekil ve seyret
Bankada bekletsen düşüncene faiz eklenmez
Teknik bu yürüyeceksin bariz
Boş durma koştur
Ve sabretmek dostum en büyük irfan
Bu en büyük dosttur
Eline yüzüne bulaşır her işin akıbetini bilirim
Hep bir işe de yaramaz eylemin
Bir hareket et de görelim
Ancak senin hayatla yarışın tek sidikle
Belki olabilir, bir bakıma sen de haklısın
Bu duruma biz kayıtsısız
Massive Töne ve Ceza işte burada bana da bir bak
Boş gezen ve kalfası, sen hadi git yat
Maymun iştahınla bir yere varabilirsin belki
Beklemek yararsız, yarım akıllı kal orada densiz


Worauf wartest Du?
Ey worauf wartest Du?
Beweg dein Arsch
Komm beweg Dein Arsch dazu
Worauf wartest Du?
Ey worauf wartest Du?
Beweg Dein Arsch
Komm beweg Dein Arsch dazu


Du brauchst nicht fragen oder raten Bitch
Du weißt wer's ist
Ich hab 10 Jahre drauf gewartet
Meine Zeit ist jetzt
Gib mir den Chord
Lass n paar Rubel rollen
Ich schreib dir n Hit
Dein Lieblingssong heißt was?
Du Blutest Voll?
Der Scheiß war ein witz
Ich war nur 5 Minuten kacken
Und `n stift mit nehm
Jetzt hab ich durchfall
Drop den shit und werd zum Busieness Man
Freaky die friends
Back die strophe babe
Merk dir die namen
Ficka Funberg
Zamas ist Cool
Und Fett klunker am Arm
Ich ich?
Bin immer noch Bro' und immer nur Stoned dazu
Flip n paar Flows und Fick n paar Homes wie Snoop
Es macht mich sauer, ich brauche Kilos an Weed
Denn ich seh Täglich diese miesen Freaks auf Interaktiv
Komm sags den Kids die mich nicht kennen
Erzähl ihnen Franky ist hier
Dein Lieblingsrapper aus m Fernsehen ist ein Fan von mir
Ich steche raus aus diesen Gangs wie Diamanten im Dreck
Und hab keinen Bock länger zu warten
Worauf wartest Du?


Worauf wartest Du?
Ey, worauf wartest Du?
Beweg deinen Arsch
Komm beweg dein Arsch dazu
Worauf wartest Du?
Ey, worauf wartest Du?
Beweg deinen Arsch
Komm beweg dein Arsch und tu's

Worauf wartest du?
Beweg dein Arsch dazu
Heb dein Glas dazu
Geh ab und Tanz dazu
Beweg deinen Arsch dazu
Dreh dein Glas dazu
Worauf wartest du?

Yeah, Massive Töne
Franky Kubrick
CEZA
Von Stuttgart bis Istanbul und zurück
In die Zukunft","https://genius.com/Massive-tone-worauf-wartest-du-lyrics","Released October 5, 2005
Mixed At

    
      Benztown Studio & Tucan Studio
Recorded At

    
      Kopfnicker Studio
Label

    
      Kopfnicker Records
Featuring

    
      Ceza, Fatman Scoop, Fetsum & 2 more
Producers

    
      Baby Dooks, Chris Sholar, DashBeatz & 5 more
Backing Vocals

    
      Ghee Diakhate
Backing Vovcals

    
      Anastasia Toufa
Guitar

    
      Don Philippe"
"3","Massive Töne","Mein Job","Zuruck in die zukunft","Paroles de la chanson Mein Job :
Schönen guten Morgen Deutschland- schönen guten Morgen!
Aufstehen!!
Ja- jetz wird wieder in die Hände gespuckt!

Refrain:
Ich liebe mein Job
Jaja- mein Gehalt und die Kollegen sind top
Ich hab echt Bock drauf
Ich hab immer Bock -jaja
Mein Gott ich liebe mein Job

Ich bin verkatert und müde
Oh mein mein Schädel tut weh
Mein Radio weckt mich
Es ist schrecklich -Dragostea din tei
Kein Bock in Spiegel zu sehn
Gibt nur n Kaffee und geh
Noch ne Kipp aufn Weg
Shit - schon wieder zu spät

Keiner begrüßt mich
Keiner mag mich
Hab echt Bock auf diesen Job
Hab wieder Dünnschiss renn aufs Klo
Und drop it like it´s hard
Hör nebenan die Sekretärin
Und wie mein Boss sie grade poppt
Sie mach n guten Job -arbeitet mit dem Korb

Man es ist jeden Tag das gleiche
Ich komm gerade vom Kacken
Auf meinem Schreibtisch wartet wieder n Stapel mit Daten
Muss keine Überstunden machen
Ich kann hier übernachten
Ich seh eh nie die Sonne
Mein Arbeitsplatz ist im Schatten

Refrain (2x)

Ja was ist jetz nur passiert
Ich werde zum Chefe zitiert
Hab auf Gehhaltserhöhung längst spekuliert
Doch er explodiert
Will mir die Knete halbiern!
Ich wird ohne Grund kretisiert
Er sagt ich sei unpünktlich, unproduktiv, unmotiviert

Nein, ich bin zu raffiniert
Hab gut rechachiert -dokumentiert
Und diesen Blow- Job eben fotografiert
Jetz kommts- wir wollen nicht sehen wie ihre Frau darauf reagiert
Sie haben ein Problem
Und das wird -glauben sie mir- ausdiskutiert
Und ich will nichts tauschen mit dir

Nein ich will nur ne Beförderung
Fensterplatte
Ne Sekretärin mit nem traumhaftem Körperm
Will kein Gauner verkörpern
Sie auch gar nicht erpressen
Es sind nur paar Interessen
Lass uns die Sache vergessen

Refrain (1x)

Ja- Ich liebe mein Job
Tja- denn ab heute bin ich der Boss
Ich bin der Boss hier
Ja was hab ich gekotzt -jaja
Ja jetz wird mir der Kaffee gekocht
Und jeder sagt mir -grüß Gott
Man ich mag diesen Job

Meine Firma mit Naturwerk
Jedes Zahnrad muss drehn
Wer nichts stramm steht muss gehen
Denn sonst erkrankt das ganze System
Ich machs mir bequem -muss gehen
Hab ich das schon erwähnt
Ich kann Nostradamos selbst seit heute morgen verdammt gut verstehn

Ich muss mein Mann stehn
Und ich steh mein Mann
Ruf die Sekräterin an
Ich nehm sie mit nach nebenan
Und nehm die Sekretärin ran
Ich schieß den Vogel ab
Hätts mir niemals so gedacht
Fuck- ich seh wie er das Foto macht

Refrain (2x)","https://genius.com/Massive-tone-mein-job-lyrics","Released October 5, 2005
Mixed At

    
      Benztown Studio & Tucan Studio
Recorded At

    
      Kopfnicker Studio
Label

    
      Kopfnicker Records
Featuring

    
      Ceza, Fatman Scoop, Fetsum & 2 more
Producers

    
      Baby Dooks, Chris Sholar, DashBeatz & 5 more
Backing Vocals

    
      Ghee Diakhate
Backing Vovcals

    
      Anastasia Toufa
Guitar

    
      Don Philippe"
