"","artist","title","album","text","url","metadata"
"12","Eko Fresh","Was du willst","Fick deine story","[Intro: Azra]
Hier Spricht Azra, macht das Battleding, Yeah!
Eko Fresh, Fick deine Story, Mann! Yeaaah!
(Fuck you) (Fuck you)

[Part 1: Eko Fresh]
Eyo von Wedding bis nach Grembranx
Ich seh die Enemys und Bang Bang
Triff mich ihn Rheydt wo ich mit Summer Cem häng
Gegner haben Dünnschiss und kacken einen Strahl
Denn sie kommen mit Flaschen ich mit einem Waffenarsenal
Bring die Affen deiner Wahl, die Kanaken sind jetzt da
Wir sind kult, German Dream, Lederjacken, kurzes Haar
Die Pissers fucken sich jetzt ab, du Hurensohn bis jetzt am Arsch
Und ich klingel Nachts bei Kingsize wie das Drogendezernat
Undercover, Paranoia, Köln Kalk, Killer Style
Dein Gesicht ist jetzt gefickt als wär das hier Vanilla Sky
Ich komm mit Goriilas weil, ihr alle behindert seid
Und ich ficke deine kleine Schwester ihn ihr Hinterteil
Es wird finster sein, ich fick sie ihn der Dunkelheit
Der Grund ist leicht du bist eine Fotze und nicht tight
Ich komm mit 7 Türstehern, du mit Skatern und Sprühern
Eine Frage warum rappt jetzt dieser E-K, wie früher
Du willst mich haten wofür, GD wir stehen vor der Tür
Mit so vielen Türken ihr wollt die Rassentrennung legalisieren
Diss noch ein mal mein Bruder und wir fahren los
An meinen [Mankalou ?] ich halte deinen Namen hoch

[Hook: J-Luv][??? Generell sehr unverständlich]
[... ?] Hoes für die fliegen
Denn wir fahren hier die Mittel, die sie zu sehr kitzeln
Den wir fliegen hier, fliegen hier über euch hinweg
Denn heut Abend geht die Party die noch keiner kennt, Hey
[Tanz bitte bis das hier rollt ??]
[ sehr unverständlich ??????]
Heute Abend gibt es was du willst
Das ist Wedding, FB und die Kalker Clique

[Part 2: Kalusha]
All eyez on me, wie der Nigga Tupac
Leb ich mein Leben als ein Thug Nigga, weil mir der Schub passt
Scheiß auf halbe Sachen Homie, ich will alles haben
Gib mir dickes Haus, dickes Konto und ein dicken Wagen
Dann bin ich Kalusha der Bossplayer
Ich komm ihn dein Hood und der ganze Ort geht ab
It's all good, ich mache kein soft, Hater
Solange mein Rap flowt und somit mein Cash flowt
Werde ich die größten Fische aus dem Netz holen
Von nix kommt nix, wer will gerne ihn Dreck wohnen
Ich zieh mein Ding durch wie Jay Jo
Bis zu dem Punkt an dem ich bigbooty Hoes ficke wie J.Lo
Siehs du mich neben Eko, ist es ok so
Real reconize real, Haters drehen durch
Dein kleiner Körper kriegt noch ein Loch
Ich schieß aus dem background und sagt Fuck them all
Kein Bock auf Schrott, dann bist du uns genau richtig
Wir ficken das Business und machen ein auf Wichtig
Hää? Ihr wollt Gangster sein
Dicke Autos fahren und aus dem Fenster schrein
Typen wie Eko zeigen dir wie man am besten rhymed
Suchst du Stress hast du in Kalusha jetzt ein Feind


[Hook: J-Luv] [??? Generell sehr unverständlich]
[... ?] Hoes für die fliegen
Denn wir fahren hier die Mittel, die sie zu sehr kitzeln
Den wir fliegen hier, fliegen hier über euch hinweg
Denn heut Abend geht die Party die noch keiner kennt, Hey
[Tanz bitte bis das hier rollt ??]
[ sehr unverständlich ??????]
Heute Abend gibt es was du willst
Das ist Wedding, FB und die Kalker Clique

[Part 3: Capkekz]
Junge [Pass ist Zasta ?], weil ich hass den Bastard
Nenn mich [?], alter ich pass ins Rasta
Du Bello bist am bellen als wenn du ein Hund wärst
Komm und ich zerschmetter dir dein dreckiges Mundwerk
Ich bin Kölner du Pisser und einflussreich
Komm ihn meine Straße ich sage dir ein Schuß reicht
Ihr seid so weich ich ficke euch ihr Bonzenopfer
Komm zu mir oder komm zu Onkel Doktor
Dein Arsch ist benommen wenn ich mit paar Nazis komme
Hau ab und es erdrückt dich wie ein Capri Sonne
Schau wie ich Rapper klatsch, das hier ist die Messerschlacht
Sonne, Regen oder Schnee ich bin wie 3 Wetter Taff
Es ist Bandenkrieg, deutscher Rap ist Kampfgebiet
Sag nur einmal Hurensohn und du siehst was dann geschieht
Das hier ist Vollkontakt und besser als K1
Mein Gruß geht raus Kalusha, Eko und J-Luv

[Hook: J-Luv] [??? Generell sehr unverständlich]
[... ?] Hoes für die fliegen
Denn wir fahren hier die Mittel, die sie zu sehr kitzeln
Den wir fliegen hier, fliegen hier über euch hinweg
Denn heut Abend geht die Party die noch keiner kennt, Hey
[Tanz bitte bis das hier rollt ??]
[ sehr unverständlich ??????]
Heute Abend gibt es was du willst
Das ist Wedding, FB und die Kalker Clique","https://genius.com/Eko-fresh-was-du-willst-lyrics","Released 2005
Primary Artists

    
      Eko Fresh & PA Sports
Featuring

    
      Capkekz, Emely (DEU), Farid Bang & 12 more
Producers

    
      Bushido, Decay & Kingsize
Writers

    
      Capkekz, Caput, Eko Fresh & 16 more
Composer

    
      Kingsize"
"13","Eko Fresh","Aus dem Weg da","Fick deine story","[Shout Out: Nordin]
Yo das ist Nordin, Cagefighting King, Rattingen ihr Wichser
Das geht an alle euch da draußen man, das ist mein Mann Eko alter, fickt euch alle mir euren scheiß Superhelden
Dieser Junge ist mein Bruder ist das klar ihr Wichser und keiner legt sich mit ihm an sonst kriegt ihr es mit mir zu tun
[?] Nordin, ich bin hier draußen und warte auf euch
German Dream 4 Life Baby
Fickt euch alle man (Fickt euch alle man) ihr Penner

[Hook: S.Diddy &Eko Fresh] (2x)[Beinhaltet viele Fehler wahrscheinlich]
Aus dem Weg da, wir sind auf dem weg da
Den die Nigga ficken die Hater mit der 9mm
Wir sind back mit dem [?], Clap Boom
Du und deine Crew klingeln richtig whack
Und ist der Tisch gedeckt ist der [?] schmeckt
[?]
Ihr seid [?], hab ich recht gehört
Richtig Ek, bevor du [??????] Rap

Rest folgt","https://genius.com/Eko-fresh-aus-dem-weg-da-lyrics","Released 2005
Primary Artists

    
      Eko Fresh & PA Sports
Featuring

    
      Capkekz, Emely (DEU), Farid Bang & 12 more
Producers

    
      Bushido, Decay & Kingsize
Writers

    
      Capkekz, Caput, Eko Fresh & 16 more
Composer

    
      Kingsize"
"14","Eko Fresh","GD Army","Fick deine story","[Intro: Capkekz &???]
Ey richtig gicik du möchtegern Amerikaner, du hast übertrieben mit deiner Bello Story, du Bello. Ich habe lange nichts gesagt aber die Straßen fangen langsam an dich zu hassen du Lumidee Feature. Eko hat mir Storys erzählt alter, da würde sich jeder schämen man, geh und lass dich von kleinen Mädchen in München jagen. Oh Mann du Ami für Arme. (Haaahaay German Dream)
Lan Selam, tipini siktimin, wat is dat für'n Schnäuzer Junge, rasier dir mal dein Milch Bart du Affe. Wir sind Barbaren (Ipne Hahayy)
Ey yo, Ey yo, Ey yo, Ey yo

[Strophe 1: Capkekz]
Ich bin es, der der auf euch spuckt, ihr Wichser
Optik Boom - Ihr könnt nicht mehr in die Hood, ihr Pisser
Das ist das Vorspiel, das euch jetzt bumst, ihr Stricher
Euren Muschi Club erwartet jetzt ein dunkles Schicksal
Caput. Du hast bei Eko geschleimt wie ein Bruder
Ich mein's, du Stizzel. Der ist leider wie ein Schwuler
Wie ein Hura. Ich fick euch Ochsen, das ist Ernst gemeint
Eko rappt. Wer von euch Fotzen ist Ercandize?
Merkt euch eines, ihr habt übertrieben. Ich zerreis euch Spacken
Ihr seit nicht cool. Ihr seit wie weiße Kanacken
German Dream steckt S mehr Scheiß in den Rachen
Ihr peinlichen Affen, ich werd' euch vertreiben wie Ratten
Das ist die arabische Antwort. Es gibt nie wieder Frieden
Die Kriegserklärung, Jungs, und ich lieb' es zu Siegen
Denn ihr Pisser habt euch wirklich 'ne Menge erlaubt
Ich schwänger' eure Frauen. GD beendet dein' Traum

[Strophe 2: Ice H]
Mönchengladbach, Moruk. Wir haben nix zu verlieren
Und stopfen Mäuler mit Schwänzen, bis alle Bitches krepieren
Jetzt könnt ihr draufzahlen, denn der Chief ist im Haus
Ich klau mir dein' Lex, sag mir wie viel Diesel ich brauch
Das ist Ice H. Ich bin stark geboren
Im Viertel hör' ich außer Pac nur das Martinshorn
Dein Schwanz wird nicht groß, dein Girl ist wirklich hohl
Du weißt was dich erwartet, wenn dich mal ein' Türke holt
Und du denkst, der ist neu im Bizz. Mach dich bereit
Anti Garanti fickt dein Leben und sie schlagen euch gleich
Jetzt habt ihr Hände in Ketten, ihr seit zum sterben verflucht
GD die Spitze des Eisbergs und wir werden gesucht
Und ihr seit unerträglich, wie besoffene Penner
Gegen GDE läuft man jetzt ins offene Messer
Die Bitches kochen jetzt schneller
Ihr seit Ochsen, wir Rapper
[?]
Und ich hustle die Wege, hab die Taschen voll Knete
Manchmal denk' ich, ich bin nur noch von Affen umgeben
Sieh, ich switche den Flow und seine Lippen sind groß
Mein Pitbull wartet in der Ecke und dann frisst er dich tot

[Strophe 3: Farid Bang]
Jetzt ist Optik Massaker mit Eko Fresh
SOS - Wer von euch Kindern sucht jetzt noch Stress
Caput, du bist nicht hart, du bist kein Wahnsinniger
Du bist nicht schwarz. Du Schwuchtel bist kein Harlem Nigger
Illmatic, du Vogel, sag mir wer ist die Eule
Boris Becker und ich machen Schwester S eine Freude
Ihr seit meine Feinde wie die Polizei
Ich schieß auf Rapper. Ich muss ein OG sein
Costa mach doch mal mit dei'm Basey Krach
Während ich deiner Frau mal ein Baby mach
Ihr seit keine Gangster, seit nicht Murder Inc
Optik Records ist dreckig wie Burger King
Ihr kommt nicht hoch, wie ein impotenter Opa
Caput, du bist nicht Tupac, noch bist du kein Toter
Was jetzt auf euch zukommt ist Vergewaltigung
Softy Records ist vorbei, eure Zeit ist um

[Strophe 4: Emely]
Ich und Optik und ihr nur Hunde mit Scheiß' im Gesicht
Geht und spielt woanders, Kinder, ihr seit nicht Bereit für das Bizz
Ihr seit nur kaputte Opfer und habt zu lang' mein Kopf gefickt
Ich bin drauf und lass euch alle ficken, [?]
Ihr seht nicht ein, dass es Knarren schießen nur hier im Pott gibt
Du siehst es spätestens ein, wenn die Knarre an dein' Kopf klickt
Scheiß auf dich, deine Homies und dein' ganzen feigen Rest
Zeig mir eine Bitch die rappt wie ich, ich pump ihr Blei in die Chest
Ich bin so unberrechenbar, du kannst es nicht erraten
Ich raste aus und werd' ganz schnell zum Messerstechenden Psychopaten
Und ihr markiert nur den Harten und seit alles nur Pussies
In Oberhausen werden solche Opfer geknallt wie Tussies
Ich hab keinen von euch jemals irgendwo kämpfen sehen
Kommt vorbei, du wirst das Blut an unseren Händen sehen
Ich komm' mit 'nem üblen Team, ihr werdet blind vernichtet
Diss den German Dream, du Hund, und du wirst hingerichtet

[Strophe 5: SD]
Das hier ist Meuterei, Kreuzberg Style, Ghetto Blues
Ich schwöre es auf Ekos Blut und Hakans Hand
Ihr betretet Satans Land
Der heilige Vater hat mich mit einem unglaublichen Flow gesegnet
Bald mach ich große Knete und der Rest sieht Rote Bete
Geht durch wie bei Kokser Fete
Ich mach das du mit einem Poster redest
Wenn du sowas hatest
Ich hab den German Sheppard Joker, Baby
Ich bin obercrazy und beherrsche die Kunst der Kings
Ihr werdet gebumst von links, du singst
Und summst, als wärst du eine Funz die stinkt
German Sheppard, Baby, der Hund gewinnt
Öffne den Mund und nimm, Bitch
Meine Lunte glimmt
SD ist unempfindlich, hetz deine Hunde auf mich
Doch so geht automatisch auch die nächste Runde auf mich
Ich ficke dich unverbindlich, in dein dummes Gesicht, Bitch
Du übernimmst dich, das macht deine Lunge nicht mit
Du wurdest im Grunde gefickt
Nimm nachher mein Gummi als Strick
Denn ich häng' wie ein hungriger Pitt im Bett deiner Bitch und bums sie geschickt
Ich betrete den Raum um dir die Knete zu klauen
Wenn ich rappe kommt ihr nicht mehr aus dem beten und staunen
Ich rede im Traum. Ich glaub dein Schädel verfault
SD ist des Grauen. Ich hab mein Mädel verhauen
Danach Crack auf einer Fete geraucht
Das ist der Wettkampf von Gut und Böse
Euer Rap ist nur gestöhne
Ich hab Wut und töte Hurensöhne mit der MG
Komm mir nicht in den Weg, ich bin SD
Der, der dich mit einem Take zerlegt
Wie ein Paket von mir zerfaltet
Euer Flow ist veraltet
Ich werdet so vergewaltigt, das ihr wie tot auf'm Asphalt liegt
Ich weiß, ihr Fotzen tobt., doch das ist Rock & Roll
Diddy schneidet Hater in Scheiben wie ein Roggenbrot
Hier ist der Hit-Werfer, ich spitt härter
Deine Frau macht einen Rittberger
Ich hoff ihr fühlt euch Wohl mit Ärger
Ihr könnt euch aufregen
Doch ihr könnt mich nicht runterbringen
Ich kotz in ein' Brunnen, es springt
Hier kommt das Wunderkind
Ihr verdammten Hurensöhne, ich bin dirty SD
Ich hab ein' riesen Schwanz und ich hab ihn deinem Girly gegeben
Ich weiß, deine Eltern finden es empörend wie ich red'
Doch ich scheiß drauf! Baller 'ne Nase
Und trinke einen Bourbon mit SP
Ich verkleide mich als Pirat und mal mir mit Scheiße ein' Bart
Zieh mein Schwert und stecke es dir dreist in dein' Arsch
Fuck Savas, Buster blas, du Strichergeburt
Spast das war's, ich erwürg dich mit einem Sicherheitsgurt
Hört, hört. Sie sagen, ich rate zu schnell in Rage
Doch Dirt' burned, ich durchdringe euer Trommelfell wie ein Nagel
Meine Rhymes schlagen in dein Gesicht wie die Faust eines Boxers
Spiel mein Shit so laut, das alle denken, in diesem Haus leben Rockstars
Ich lass euch aussehen wie Opfer, aus meinem Koffer springt eine Plem
Und ich halt sie auf deine Gang
Nehmt jetzt besser eure Bein, renn!
Da ist ein Killer in mir, ihr Fronter seht her
Hier ist ein Wilder, ein Tier, ein Monster
Wir haben das Feuer eröffnet, wer möchte das ich ihn zersiebe
Ich schieße auf diese MC's, wie Vin Diesel
Jetzt brennt Tim Wiese und ihr rennt wie Wiesel
Doch, wenn ich dich kriege
Wirst du in Butter geschwenkt wie 'ne Zwiebel
Denn du bist eine schwule San Francisco Hure
Ich lass dich von der Decke häng' wie 'ne Discokugel
Ich bin Diddy, ich lass eure Bitches dancen
Ich habe die Hits die glänzen. Ich zeige den Kids die Grenzen
Ich habe den dicksten Schwänzen. Spart euch die blöde Leier
Hier kommt der böse Bayer. Ich habe die größten Eier
Ich ficke [?]
Die Leute kennen die Flows los [?]
Ein Tost auf die Hoffnung [?]

[Outro: Voice Cut von Kool Savas]
Ich höre nicht viele Sachen aus Deutschland, weißte. Wenn ich was höre dann... Eko... Savas... sone Sachen gefallen mir","https://genius.com/Eko-fresh-gd-army-lyrics","Released 2005
Primary Artists

    
      Eko Fresh & PA Sports
Featuring

    
      Capkekz, Emely (DEU), Farid Bang & 12 more
Producers

    
      Bushido, Decay & Kingsize
Writers

    
      Capkekz, Caput, Eko Fresh & 16 more
Composer

    
      Kingsize"
"15","PA Sports","Oh","Fick deine story","[Intro: Gesprochen von Gengiz]
Eko, was läuft?
Gengiz hier am Start. Ich habe die Optische Story von Anfang bis Ende mitbekommen
Das was ich dazu zu sagen habe: Fick deine Story!

[Verse I]
S, du sagst dein Team ist beliebt
Ich zieh in den Krieg und ihr seid nix mehr, ihr Wixer
Guck wie ich dein Bruder wie ein Pimp hier vernichte
Deine John Bello Story wird zur Kindergeschichte
Sinan, du bist kein Gegner der mein Vibe zerbangt
Dieses Battle ist wie Kiffer gegen Spiderman
Was fällt euch ein Pissern ein mein Label zu dissen?!
Ich bin bereit für Eko Freezy von euch jeden zu ficken
Sinan ist 17 und war noch nicht mal im Stimmbruch
Optik Records wird so langsam zum Kinderpuff
Nimm 'ne Glock mit und zeigs es
Wie ich dein Kopf fick und reinwichs
Bis auf Erco fick ich jeden der bei Optik gesignt ist
Was ist mit Hip-Hop los? Ist dieser Dimi G?
Ich erschieße den Freak, nenn' ihn Mini Me
Das ist Militär-Shit, ich nehm mein Gewehr mit
Es wird richtig gefährlich, wie ich dich fick und zu Fler schick
Sinan ich hab gehört Kanye West will dich signen
Er braucht Hoden in die Kimme, eine hochgepitschte Stimme
Optik Youngsters ich blow dein pack
Savas' Bruder, hört sich an wie Donald Duck
S. Eko zerschmettert dich
Langsam wird's lächerlich
Du bist auf etwas hängen geblieben
Was schon längst vergessen ist
Für mein Homie hast du 10 LP's im petto
Nenn dein nächstes Mixtape doch einfach ""Verliebt in Eko""

[Bridge: Gesprochen von Eko]
Okay Savas, du bist doch Esoterik-Freak
Alles kommt zurück im Leben
Dein bruder ist 17
Dieser Junge ist 15 und fickt euch
Brappp

[Hook 2x]
Savas holt seinen kleinen Bruder in den Beef
OR Youngsters, es gibt keine die schwuler sind wie sie
Haltet lieber den schnabel
Du heisst nicht Sinan, sondern Pawel
Du bist am dissen
Auf der Straße stehst du nie dafür grade

[Verse II]
Ihr wollt Beef ich mache euch Gürtel und Knarren klar
Komm nach Kalk, das das ist ne türkische Mafia
Savas, ich bin erst 15 jahre
Und um so zu rappen braucht dein Bro' noch 15 jahre
Was ist los mit euch? Ich fick eure Gegend, Honies
Dimi das ist Rap Biz. Wir sind nicht bei den Teletubbies
Bald sieht man big Sinan und Dimi bei Rugrats
Oder Nein, ihr beiden sieht so aus wie Beavis und Butt-Head
Ich hab keine Angst, ich weiß wer meine Fans beratet, Bitch
Willst du sehn wie PA deinem Bruder seine Nase bricht
Lass die Kinder zuhause. Sie sind zu winzig für's Shit
Sie kommen wieder nach Haus mit einem Gips um den Knie
Sinan, du disst Manuell, den Jungen mit dem Megaschwanz
Der dich und deinen Bruder ohne ein Problem bis nach Teheran puncht
Ich mein' Manuell hat ein M um den Hals
Er gibt dir eins damit und du fliegst bis zum [?] Aspahlt
Pawel, du machst dein Para mit Rap styles
Dimi bläst pervers während Savas die Texte schreibt
S ich wollt dir sagen, dass dein ganzes Camp nur Scheisse bringt
Und lass dein Bro lieber zuhause, denn sonst bist du bald Einzelkind

[Hook 2x]

[Verse III]
Nach dem Track ist Dimi der Pissling im Sack
Und ich lass Optik Youngsters aussehen wie Tick, Trick und Track
Sinan, in deinem schönen Leben, gibt es draußen keine Hood
Junge, du kriegst Schläge, bis du aussiehst wie Caput
Ich kenn' einen wahren Sinan, der dich mit 'ner harten Gat smackt
Du heißt nicht Sinan, ah! Du siehst aus wie Pavel Nedvěd
Guck dir diesen jungen Perser an, der dich gerade wegslapt
Du bist behaart und rappst whack, Homie ich bring harten Rap back
Amar fick ich aus Spaß
Komm' aus dem Club, Summer schiebt Schawarma in dein Arsch
Der German Dream fickt euch in Null Komma Nix
Ich komm mit Moruks und auf deinem Konto ist Null Komma Nix
Guckt, wie ich diese Kinder klatsch wie immer schnell
Savas' Label wird zu Kinderquatsch mit Michael
Mein Ziel ist Ice. Das sind reale Lines
Hast du gesehen wie PA Sports dein ganzes Team zerreißt","https://genius.com/Pa-sports-oh-lyrics","Released 2005
Primary Artists

    
      Eko Fresh & PA Sports
Featuring

    
      Capkekz, Emely (DEU), Farid Bang & 12 more
Producers

    
      Bushido, Decay & Kingsize
Writers

    
      Capkekz, Caput, Eko Fresh & 16 more
Composer

    
      Kingsize"
"16","Eko Fresh","Die Bestrafung","Fick deine story","[Part 1: Summer Cem]
Ich hab so viele Bars. Ich schreibe sie auf
So viele man, ihr habt die Scheiße gebaut
So viele man, dass hier die Scheiße nix taugt
Die Profis sind da, wir reiten jetzt aus
Oh no, SD. Oh no, S-C - Ihr Homos könnt ins Bett gehen
Auf wiedersehen Rapgame
Wir sind die Champions wie Queen, denn jeder kennt jetzt den Dream
Sorry savas-Abi, aber ich verdräng jetzt dein Team
Du willst mein Brot nehm. Ihr schließt euren Untergang
Wir laufen durch die Szene, wie Alice durch ihr Wunderland
Rauben in eurem Bundesland, genau wie bei 'nem Hundekampf
Alles ist kaputt, du kannst jetzt schon mal beim Bund anfang
Du bist ein Fan, versuchst wie 2Pac zu reim
Doch ein Türke ist nur Fan von einem Fußballverein
Fenerbahce, Beşiktaş oder Galatasaray
Ihr schafft's nicht allein, ihr müsst euch gegen Summer verein'
Nein, du warst nie mein Freund und du wirst nie mein Feind
Komm Bruder, ich lad dich ein zu einem türkischen Chai - Summer

[Gesprochen von Summer]
Huh, Ey Savas. Ich hatte immer Respekt vor dir, Alter
Aber warum willst du mich schlecht machen, bei meinem Partner
Warum stellst du mich als unloyales Schwein dar, Alter?
Ich bin kein Verräter und du weißt das auch
Und um dir das zu beweisen, hab ich dir extra jemanden mitgebracht
Special Guest - Check mich ab

[Part 2: SD]
Ich werde diese Zeit nicht vergessen
Ich sitze hier und schreib wie besessen
Ich kenne das Leid und die Fesseln
Bitte lieber Gott bleib hier denn es sind
Zu viele Fights in den [?]
Ich bin es leid wenn sie testen
Steh auf und zeig in den Westen
Sie sind alle feig und verpesten
Jetzt ist der Zeitpunkt am besten
Ich werd' meine Feinde zerfetzen
Ich leg die Knarre auf den Boden und werd sie mit Rhymen verletzen
Wenn nötig, töt ich
Meine Klinge ist wie sonst keine am blitzen
Ich bin hier um für Scheine zu schlitzen
Ich bringe dich Kleiner zum Schwitzen
Ich bin die einsame Spitze
Auf einem Eisberg aus Hitze
Du zerreist deine Skizze
Denn ich bin die Eins und der diggste
Ich pumpe eiserne Wichse, in deine kleine verfickte Freundin
Rap ist sich jetzt am freuen, denn ich bin einfach der sickste
Ich muss permanent pumpen
Ich mach Lärm mit den Lungen
Ich muss mich wärmen und verwunden
Ich bin nicht mehr fair zu den Hunden
Ihr seht aus als wärt ihr früher mal in Sperma ertrunken
Ihr erbärmlichen Tunten
Riecht wie Laternen von unten

[Hook 2x: Eko Fresh]
Ich hab mich Spontan entschieden, ihr seit Amar-sch
Ihr seit Caput, denn man hat euch Savas't
German Dream - Wir sind über Optik Records
Das sind S-C, SD - Bitte, bitte S geh'

[Part 3: Summer Cem]
Das ist Summer Cem - S-U doppel M E-R
Wenn du noch ein anderen kennst, bitte bring ihn doch hier her
Antigaranti for life ihr seit keinen Penny wert
Also du schäbiger Schmock, bete zu Gott und seh wie sich das Ende nährt
Du bist jetzt am Ende, yeah
War's denn die Trennung wert?
Und nach meinen zweiten Vers
Glaub mir kennt dich keiner mehr
Im Endeffekt tut das ganze mir Leid
Kommt schon, kommt. Kommt wir machen Tanzen im Mai
Oh schade dass dein Taktgefühl zum tanzen nicht reicht
Summer - Für euch wird das ganze zu heiß
Ich weiß dass es auch weh zu tut, doch truth hurts
Jeder Track von euch ist wie ein Mann der sich vor nem zug wirft
Du willst dich verbessern, doch Junge sei zufrieden
Alles was ich hör ist nur ein stummer Schrei nach Liebe
In Deutschland, haben wir das Feuer gelegt
Summer featuring Diddy und das ist Loyalität

[Part 4: SD]
Wenn ich battle, dann battle ich jeden von euch liebend gern
Bora weiß, ihr hofft auf ein Wunder wie in Bern
S halt die Rapper fest
Sie sind nicht Wetterfest
Draußen ist es richtig freezy
Ich flow und vernicht dich easy
Ich habe Haus und HofIch brauche kein Haus und Boot
Ich hab über Tausend flows
Ich tobe pausenlos
Wenn mein Mixtape kommt, seid ihr Idioten mausetot
Was ich dort sag, wird euch nicht schmecken wie euer Pausenbrot
Du isst Chicken für Pac
Doch hast die Lippen am Sack
Kommt mit und fick mit der Glock
Du schwule Sissi am Block
Jetzt übernimmt Diddy den Job
Ich gebe kein figgy-di-fuck
Es macht klick, klick, boom und ihr macht Pippi im Club
Sponte gib's zu, du hasst Erc
Als Raptile in Dortmund zu dir kam
Und gefragt hat ob alles cool ist
Sagtest du: ""Ja, Sir!""
Costa ist ein Biter und sitzt auf Savas' Mast, word
Nicon ist eine Bitch und ein Bastard (Bastörd)

[Hook 2x: Eko Fresh]
Ich hab mich Spontan entschieden, ihr seit Amar-sch
Ihr seit Caput, denn man hat euch Savas't
German Dream - Wir sind über Optik Records
Das sind S-C, SD - Bitte, bitte S geh'

[Part 5: SD]
Was ist Beef?
Beef ist wenn selbst deine Freunde nicht mehr zu dir stehn
Beef ist wenn du keine Freude hast an deinem Leben
Beef ist wenn ich dich seh
Ich garantier dir Beef wenn ich dich seh
Ey yo. Caput du rappst schlecht
Spitte nicht, nein. Wenn Pac dich sehen könnte
Würde er sich im Grab umdrehen und bitterlich weinen
Mach die Fliege Bitch, jetzt wird ans Knie gepisst
Vorher wollte ich noch fragen
Ob Spontan Papzt wieder Schwanz lutscht und wer sein DJ ist
Erc hat im Pott schon nix gerissen, sowie Spontan seit Jahren
Erfolglos durch die Gegend reist
Niemand behauptet das Gegenteil
Unter Savas Mütze sitzt Nicon
Auf einem Ei, was sie seit 10 Jahren ausbrüten ist
Und es will nicht schlüpfen, weil es wütend ist
Ihr Schwuler Freund Illmatic wär für mich ein Standgebläse
Er tanzt den ganzen Tag Sirtaki und kriegt als Gage Feta Käse
Du bist kein Grieche sondern Fake Amese[?]
Jetzt weis es jede Theke
Player hate ich kann alles bezeugen was E-K redet

[Part 6: Summer Cem]
Optik-tik-tik-tik Boom und die Bombe ist geplatzt
Es ist wie der Comedy Club und auch S weiß Soner ist nicht Pac
Eko rechnet ab und die Konkurrenz verkackt
Diddy was meinst du dazu?: Stimmt Summer, Spontan ist am Sack!
Mönchengladbach Rheydt, denn ich sterb in der Hood
Wer ist Caput?
Ich hör lieber Fler als Caput
Wo ist die Optik Army jetzt?: Das ganze Heer ist kaputt!
Westberlin Maskulin, MOR ist kaputt
Du kannst in den Spiegel schauen, doch nicht EK in die Augen
Ihr wollt Eko nicht glauben. Jungs, ich war mit Eko da draußen
Ich will dir was sagen Homie: Optik ist tot Summer!
Tot? ...Ja so tot wie Moshammer
Deutschrap SOS-hammer schickt dich in die Stricherszene
Und du weißt Eko gab dir Probs auf dem RZA Beat
German Dream - Ich bin mit Eko durch die Scheiße gegangen
Guck mich an, ich stehe hier auf beiden Beinen wie ein Mann. OK!

[Eko 4x]
Keiner schiebt mehr Optik - Alle sind am träumen
Keiner ist auf Aggro - Alle sind am träumen","https://genius.com/Eko-fresh-die-bestrafung-lyrics","Released 2005
Primary Artists

    
      Eko Fresh & PA Sports
Featuring

    
      Capkekz, Emely (DEU), Farid Bang & 12 more
Producers

    
      Bushido, Decay & Kingsize
Writers

    
      Capkekz, Caput, Eko Fresh & 16 more
Composer

    
      Kingsize"
