"","artist","title","album","text","url","metadata"
"1","Farid Bang","100 Bars","Blut","[Intro]
Juh-Dee! Ich will Blut!

[Part 1]
Dissen ist für mich eine VermögensstrategieDie Königsdisziplin für die blöderen MCs
Hurensöhne wollen Beef, deshalb pöbeln sie auf Beats
Mit dem IQ eines Menschen aus der Dönerindustrie
Oli Marquart will was gegen meine Alben sagenArgumente fehlen, deshalb Reviews mit falschem Namen
Im Interview bei Bushido suckt er DickDoch sitzt er neben mir, ist er kritischer Journalist
Ich sei ein Imagerapper, Möchtegern-50 CentMuss ich mir anhören von einem Fettsack, der sich Skinny nennt
Du weißt, dass viele Rapper wegen mir obdachlos sind
Du wirst der erste Mensch, den Ärzte zur Bosstrafo zwing', ahIch bin nicht von dei'm Gewicht überraschtMich überrascht mehr, dass deine Hand in eine Chipstüte passt
Ich fick' Kitzbüheler Sluts, mache Hits über Nacht
Und fing mit Rap an, denn damals war ich die Wichstücher satt
Banger Musik – wir haben was aus unsrer Chance gemacht
Nicht die Klitschkos, doch werden für Erfolg gehasst, ah
Und auch wenn jeder in der Szene hatet
Die Rebell Lounge macht mehr Umsatz als jedes Label
Fick den Hype, die Szene kriegt mich nicht mehr klein
Hasst du jemanden wegen Erfolg, dann ist es Neid
Merk dir: Lieber habe ich nur Kinder als Fans
Als Menschen, die den ganzen Tag vorm Internet häng'n
Geb' einen Fick, kleiner Tipp an jeden Habibi:Jeder Part gegen mich ist wie ein Abschiedsbrief
Diss mich und man liest auf deiner Grabinschrift:„Sowas passiert eben, wenn man Farid disst.“
Luzifer will mich und die Szene will mein' KopfIhr könnt sagen, was ihr wollt, doch meine Seele gehört Gott
Und wenn Rapper sagen, sie können mein' Hype ficken
Dann ist das kein Diss, sondern vielmehr Science-Fiction
Laut der Bild klatsche ich jetzt Fans in Shisha-BarsDoch dass der Hurensohn mich angriff, wurd' nie gesagtSieben Mille, weil ich einen Schwanz wegboxeDoch was sind sieben, wenn meine Kette zwanzig kostet?
Die meisten Rapper sind nur G auf Tonträgerlänge
Erst kommt „Blut“ und danach mach' ich mit Kollegah Welle
Wegen mir sind viele Ex-MaskulinPlus wegen mir gibt es keine Sektenmuzik
Hier kommt der Berbisch sprechende, Messer werfende Ausländer
Der deine Schwester stechende, besser rappende Frauenkenner
Der einfach Rapper battelnde Mac, zerfetzende Draufgänger
Der früher in Dreck verreckende, Ängste weckende Faustkämpfer
Dagi Bee im Video, für dich ist der Scheiß nicht okayHass nicht KC, hass mich, denn es war meine Idee
Du Schwanz willst ProfitDoch deutscher Rap ist wie die Sphinx: man kann sich nicht an der Nase hochziehen
Der wahre O-G, sie wollen mein' Hype erlangen
Wollen auf mich schießen, doch sie haben Eisenmangel
Bullen identifizieren mich am Kenzo-SneakerDie Beweislage erdrückend wie Nintendo-Spieler
„Majoe rappt nicht im Takt, er hat kein' eigenen Stil.“
Rappt er eine Line wie ich, heißt es, er sei 'ne Kopie
Doch halb FFM klingt gleich, alle biten Hafti
Gleicher Reim, gleicher Style und das Gleiche mit Beats
Und was macht ihr? Ihr gebt diesen Spinnern noch Props
Ich kille die Cops, Mutterficker, ich steh' hinter der Glock
Umzingel' den MOK unter der Brücke im Winter bei Frost
Und seine Todesursache wird ein Internetblog
B-B-Banger Musik, immer dem Hype entlang
Mehr als die Hälfte unsrer Alben sind auf Eins gegang', ah
Die meisten Rapper sind nur Hühnerbrust mit Flow
Ich wollt' Gangster sein, weil sich dann die Überstunden lohn'
Viel Zeit ist vergang' seit mei'm letzten Release
Ferris MC ist schuld daran, dass ich keine Festivals spiel'
Bei Gott: ich gab ihm die Hand, sagte: „Viel Spaß für deine Show!“
Zwei Tage später in 'ner Mail heißt es, ich habe ihn bedroht
Du Crossdresser, Cocklecker machst auf Playboy, Bitch
Doch führst mit Männern Relationships
Wie gay du bist, kann man nicht in Worte fassen
Der Benz Mansory, er ist aus der PortokasseWie Rückgelder aus der portugiesischen Stadt
Und während ich aus dem Porsche schieße auf Cops
Wird mein Dick von 'ner Pornomieze gesuckt
Denn mein Kampfstil ein Mix aus Wolverine und Ong-Bak
Heute lauf' ich durch Miami mit 'nem freshen Hemd
Und mehr Schnitten in den Armen als ein Casper-Fan
Du hast recht, ich verkauf' erst seit zwei Jahren gut CDs
Doch allein im letzten Jahr mehr als du in zehn
Und sie fragen mich: „Wie passen deine Texte zum Islam?“Doch keiner fragt sich, warum man für die Rechten stimmen darf?
Du bist nicht grade, Fotze, wie mein Nasenknochen
Der das Ergebnis ist, fünfzehn Jahre Straßenboxen
In diesem scheiß System geht jeder sein' eig'nen Weg
Auf dem Schlachtfeld muss man über Leichen gehen
Schieße auf euch, wenn der Beat nicht mehr läuft
Bin ich immer noch der Gleiche, Zeit für Realtalk, mein Freund!Schöne Grüße auch an Bass Sultan HengztEin cooler Typ, auch wenn es heißt: „Dein' Hype hast du verpennt!“
Gesteh' mir meine Fehler ein, wir beide waren nicht fehlerfreiUnd falls wir uns nie mehr sehen: Alles Gute für die Ewigkeit!
Weil viele um uns rum viel Quatsch erzählenWerden Brüder zu Feinden, Farid Bang und HaftbefehlGlaub mir, ich wünsch' dir Gold, Erfolg und MiosIch vergess' niemals deine Zeile auf dem Song mit Sido
An meine Feinde: inshallah werd' ich nie wie ihr
Denn um viel zu erreichen, musst du viel riskieren
Und muss es wieder sein, geh' ich back und zähl' PacketsAlles, was ich brauch', ist eine Gun und ein Gebetsteppich","https://genius.com/Farid-bang-100-bars-lyrics","Released May 27, 2016
Distributor

    
      Warner Music Group
Artwork

    
      ADOPEKID
Label

    
      Banger Musik
Copyright ©

    
      Banger Musik
Phonographic Copyright ℗

    
      Banger Musik
Featuring

    
      Al-Gear, Fat Joe, Jasko & 7 more
Producers

    
      Abaz, Bad Educated, B-Case & 11 more
Writers

    
      Abaz, Al-Gear, Bad Educated & 22 more
Composer

    
      Abaz, Bad Educated, B-Case & 11 more
Copyright ©

    
      Banger Musik"
"2","Farid Bang","Das Imperium schlägt zurück","Blut","[Intro]
„Heatmakerz, crack music“

[Bridge 1]
Mutterficker, ich bin wieder back auf der Street
Und als erstes überfall' ich eine Wempe-Boutique
Drive-By - Schüsse aus den Benz-Limousinen
Das Imperium schlägt zurück - „Banger Musik“

[Part 1]
Du zitterst nach 'nem Backfist wie Piratenbretter, der cracktickende Nasenbrecher
Hab' ich grad nicht Sex mit dieser Kylie Jenner
Komme ich mit Häftlingen und Hantelstemmern
Auf Rap-Gigs und erschlage Rapper, Swag-Bitches im Prada-Sweater
Du bist im Juice-Heft drin, doch ich charte besser
Die andern sind nicht authentisch
Ich geb' Frauen auch Rechte, wenn meine Linke verletzt ist
Kille dein Camp, Bitch, undbei bösen DamenRutscht mir öfter mal die Hand aus wie bei Ölmassagen
Im Ghetto Promi mit Testo-Body, ich bin ein reicher G
Mein Geschäft läuft mit Pep(p) Strecken wie das Bayern-Team
Seitdem du weißt, dass ich bei dir den Tour-Start macheHast du die 110 auf der Kurzwahltaste

[Hook]
Nutten, Autos, Drogen, Kampfsport
Panzerglas, Rolex, Uzis, Guntalk
Poker, Koka, Derendorf, Totschlag
Drive-Bys, Schutzgeld - der Banger ist zurück
Glücksspiel, Testo, Pitbulls, Kutten
Geldwäsche, Käfigkampf, Vollbart, Schussfeld
Teflon-Vest, Cadillacs, Turban, Gangster
Stripclubs, Völkermord - der Banger ist zurück

[Bridge 2]
Zeichen meines Comebacks sind Fan-Hysterien
Einschusslöcher in deinem Range-Rover-Jeep
Lauf' ich schwerbewaffnet durch das Zentrum Berlins
Das Imperium schlägt zurück - „Banger Musik“

[Part 2]
Ey, hier kommt der Beste der Besten, ich war schon Gangster im Westen
Da waren in Pornos Schamhaare länger als Schwänze
Und meine Kette ist am glänzen, Bitch
So krass, dass selbst Astronauten im All sagen: „Sie blendet mich!“
Und wenn mich im Interview ein Lutscher angreift
Endet es mit 'nem Diss wie die Zuckerkrankheit
Deine Mutter suckt gleich, ich geb' Melanie Müller Schwanz
Denn die Nutte steht auf reiche Männer wie Gülcan Kamps
Ey, du Zinker gehst andere bei den Cops verratenFall' ich durch Zinken auf, dann nur wegen der Boxernase
Laas Unltd. will gern dissen, doch den Folgen entkommenDenn er ist ein Hamburger Clown wie Ronald McDonald

[Hook]
Nutten, Autos, Drogen, Kampfsport
Panzerglas, Rolex, Uzis, Guntalk
Poker, Koka, Derendorf, Totschlag
Drive-Bys, Schutzgeld - der Banger ist zurück
Glücksspiel, Testo, Pitbulls, Kutten
Geldwäsche, Käfigkampf, Vollbart, Schussfeld
Teflon-Vest, Cadillacs, Turban, Gangster
Stripclubs, Völkermord - der Banger ist zurück

[Bridge 3]
Ich fahr' eine Schiene und die änder' ich nie
Langsam müssen Leute sterben - Endstadium-Beef
Und wenn es brennt kommen Cousins aus Paris
Das Imperium schlägt zurück - „Banger Musik“

[Part 3]
Meine Barschecks reden Klartext und mein' Rapsound leben Pimps
Das Letzte, was du vor dem Tod siehst: dass ich Rechtsausleger bin, ah!
Und Nicone hat es super gemachtDenn er hat seine Verkaufszahlen sei'm IQ angepasst
Mitte-30-Jährige machen für Kinder Gangstarap
Doch neben mir wirken sie wie ein Chimperator-Act
Jetzt sprinten Rapper weg, sie tragen Ballermann in Clips
Kanaken-Image, doch kann seine Vatersprache nicht
Ferris MC, mach hier nicht auf Killer, du Bastard
Denn mein neues Album ist der Bringer wie Butler
Ich komm' mit Ringern und Hustlern, du wirst ein toter Mann
Und hast höchstens beim Kellnern die Oberhand

[Hook]
Nutten, Autos, Drogen, Kampfsport
Panzerglas, Rolex, Uzis, Guntalk
Poker, Koka, Derendorf, Totschlag
Drive-Bys, Schutzgeld - der Banger ist zurück
Glücksspiel, Testo, Pitbulls, Kutten
Geldwäsche, Käfigkampf, Vollbart, Schussfeld
Teflon-Vest, Cadillacs, Turban, Gangster
Stripclubs, Völkermord - der Banger ist zurück","https://genius.com/Farid-bang-das-imperium-schlagt-zuruck-lyrics","Released May 27, 2016
Distributor

    
      Warner Music Group
Artwork

    
      ADOPEKID
Label

    
      Banger Musik
Copyright ©

    
      Banger Musik
Phonographic Copyright ℗

    
      Banger Musik
Featuring

    
      Al-Gear, Fat Joe, Jasko & 7 more
Producers

    
      Abaz, Bad Educated, B-Case & 11 more
Writers

    
      Abaz, Al-Gear, Bad Educated & 22 more
Composer

    
      Abaz, Bad Educated, B-Case & 11 more
Copyright ©

    
      Banger Musik"
"3","Farid Bang","Russische Diät","Blut","[Part 1: Farid Bang]
Rapper haben Visionen, ja - Bahnhofsmission
Kein Fake-Rap seit way back, ich stapel' Millionen
Denn meine Gagen sind hoch, ich zieh' kolumbianisches Koks
Und schmeiße Handgranaten in das Aggro-Büro
Ich bin Hantelheber wie der Undertaker, du Alkoholiker mit kranker Leber
Der Latin-Lover fickt deine Ma' durch und macht der Nutte was vor wie Karate-Trainer
Der Massenschläger, Waffenhehler, komm' in einem Mansory - Nappa-Leder
Lauf' ich in die Bank, bin ich Maskenträger, krimineller Bodybuilder, Attentäter
Kein Sonnenschein, sondern Blitzlicht, ich komme rein und zerfick' dich
Die Polizei, sie nimmt mich mit, ich tick' Koka-Lines an die Rich-Kids
Zieh' die AK, erschieß' die Amcas und begrabe sie wie den Beef mit Alpa
Ich zähle Money, du Fotze bist out, du siehst Money nur vor Pacquiao
Glaub mir, ich hab' für die Straßen gekämpft, war nie Student, kein Abiturient
Feinde haben mir nur Narben geschenkt, kaufe mir Wohnungen, fahre 'nen Benz
Das Leben gab mir keinen reichen Dad, keine Geschenke vom Nike-Geschäft
Lernte leider nur, wie Scheiße schmeckt, heut mach' ich Millionen mit einem Text

[Bridge: Farid Bang]
Mit AK-47 zersieb' ich dein' Kopf
Wo ich herkomm', sind Gangster beliebter als Cops
Entweder mit Zinsen oder mit Gewalt
Russische Diät und du frisst Metall

[Hook: Farid Bang]
Russische Diät und du frisst Metall
Ru-, ru-, russische Diät und du frisst Metall
Mach 'ne russische Diät und friss Metall
Wo ich herkomm', sind Gangster beliebter als Cops

[Part 2: Summer Cem]
Aus meiner kranken Kindheit sind in meinem Kopf noch Schäden
Wie viel' Schwarzköpfe könn' in Rostock leben?
Wusstest du, dass dein Ostblock-Mädchen
Mehr Würstchen im Brötchen hat als Hotdog-Läden?
Damals hätt' ich fast alles verloren, heute fahren die Manitas vor
Flügeltüren am Aventador, fünfhundert auf Manisaspor
Ich baller' mir gleich sechs Cialis, während du noch vor dem Rent-a-Car sitzt
Summer Cem rollt bestialisch, auf Aston-Martin- oder auf Bentley-Basis
Ich kann was bei den Kids bewirken, doch Summer gibt keinen Fick, das hört ihr doch!?
Laber nicht, wenn du beim Pizzaservice jobbst, Moonwalk geht, aber nicht in Birkenstocks
Piss die Wand an, B-A-N-G, alle andern sind die andern
Steh' vor dem Schalter mit der Pumpgun, nehm', was mir gehört - nicht mit Anstand
Deine Mama kommt um halb sechs rüber,Para wie die Albrecht-Brüder
Eure fünf Minuten Fame waren ganz nett, aber sind jetzt bald hinüber
Du weißt, wer da oben die Macht hat, ich fahr' in 'nem Porsche die Stadt ab
Cem ist so straight mit der Mentalität eines nordafrikanischen Grabschers

[Bridge: Farid Bang &Summer Cem]
Mit AK-47 zersieb' ich dein' Kopf
Wo ich herkomm', sind Gangster beliebter als Cops
Entweder mit Zinsen oder mit Gewalt
Russische Diät und du frisst Metall

[Hook: Farid Bang]
Russische Diät und du frisst Metall
Ru-, ru-, russische Diät und du frisst Metall
Mach 'ne russische Diät und friss Metall
Wo ich herkomm', sind Gangster beliebter als Cops","https://genius.com/Farid-bang-russische-diat-lyrics","Released May 27, 2016
Distributor

    
      Warner Music Group
Artwork

    
      ADOPEKID
Label

    
      Banger Musik
Copyright ©

    
      Banger Musik
Phonographic Copyright ℗

    
      Banger Musik
Featuring

    
      Al-Gear, Fat Joe, Jasko & 7 more
Producers

    
      Abaz, Bad Educated, B-Case & 11 more
Writers

    
      Abaz, Al-Gear, Bad Educated & 22 more
Composer

    
      Abaz, Bad Educated, B-Case & 11 more
Copyright ©

    
      Banger Musik"
"4","Farid Bang","Koma","Blut","[Part 1]
An jeden Bullen da draußen: Tae Bo ist kein Kampfsport
Du kannst mich dissen, doch dein Tod ist die Antwort
Eindhoven nach Frankfurt, gestreckt mit Ethanol
Guckst du auf mein' Schmuck, machst du eine Kettenreaktion
Klatsche dich, du Fake
Denn deine Tracks sind wie Rihanna nach dem Sex: angelehnt an Drake
MOK und seine Sippe, ein paar Fotzen ohne Titten
Bin wie Thor, ein Hummer ist mein Fortbewegungsmittel
Mit bronze Leder-Sitzen, weil ich Tonnen Beyda ticke
Wenn ich komme, gibt es Stiche - der Don in diesem Business
Überrolle diese Bitches, wenn sie wollen, dass ich spitte
Weil ich songsmäßig vernichte, mein Erfolg ist, dich zu ficken
Bitch, ich werd' niemals in die Schufa kommenDenn ich bin Unternehmer wie Fußballstollen
Sie fürchten mich, weil ich jetzt Bandagen anhab'
Und mein Wecker ist meistens ein SEK-Beamter, Bitch!

[Hook]
Heut' sagt jeder Dreckskanake (jeder Dreckskanake), dass er Koka vertickt (was?!)
Jeder Nuttensohn in Deutschland (jeder Nuttensohn) dreht jetzt Low-Budget-Clips (ihr Pisser!)
Wenn ich die Großstadt betrete (mit dem Mansory), nehm' ich die Stoßstange mit (und du bist tot!)
Und du kannst dich glücklich schätzen, wenn du dem Koma entwischst (dem Koma entwischst!)

[Part 2]
Rapper klingen wie der Dolmetscher von KaarisUnd denken, damit werden sie ein Goldrapper wie Farid
20-Zoll-Felgen in Platin, richt' die Waffe auf dich
Du hast nur Latte in der Short, wenn dir Kaffee drauf kippt
Du rappst über Bitches mit Traum-Oberweite
Doch deine Bitch hat nicht einmal im Traum Oberweite
Für Blut kriege ich kein Applaus in der Juice
Doch wär's ein leerer Rohling, würd' ich mehr verkaufen als du
Bist du reich wie ich und trägst bunte Prada-Jacken
Wollen Bitches aus dir einen jungen Vater machen
Ich komm' aus der Sonnenbank, du bist heroinbleich
Drückt dein Finger auf die Gun, muss es ein Emoji sein
Kidnappe Prominente und mach' ohne Ende Moos
Ich will zwei Millionen Lösegeld für Boris Beckers Sohn
Hole mir mein Flous bevor Cops die Gewehre sicherstellen
Banger Musik - wir sind das neue Medellín-Kartell

[Hook]
Heut' sagt jeder Dreckskanake (jeder Dreckskanake), dass er Koka vertickt (was?!)
Jeder Nuttensohn in Deutschland (jeder Nuttensohn) dreht jetzt Low-Budget-Clips (ihr Pisser!)
Wenn ich die Großstadt betrete (mit dem Mansory), nehm' ich die Stoßstange mit (und du bist tot!)
Und du kannst dich glücklich schätzen, wenn du dem Koma entwischst (dem Koma entwischst!)

[Bridge]
(B-B-Banger Musik!), ihr seid Kleinkriminelle
Macht auf Mafia, doch könnt nur meine Reifen abstechen
(B-B-Banger Musik!), fick die Einzelhaft!
Ist man 'ne Scheinfirma, wenn man zu viel Scheine macht?
(B-B-Banger Musik!), der Komissar hat Schiss
Und dein Reim ist fett, wenn er Oli Marquart disst
(B-B-Banger Musik!), ich lass' Mütter blasen
Und am Tag der Toten wird zurückgeschlagen

[Hook]
Heut' sagt jeder Dreckskanake (jeder Dreckskanake), dass er Koka vertickt (was?!)
Jeder Nuttensohn in Deutschland (jeder Nuttensohn) dreht jetzt Low-Budget-Clips (ihr Pisser!)
Wenn ich die Großstadt betrete (mit dem Mansory), nehm' ich die Stoßstange mit (und du bist tot!)
Und du kannst dich glücklich schätzen, wenn du dem Koma entwischst (dem Koma entwischst!)","https://genius.com/Farid-bang-koma-lyrics","Released May 27, 2016
Distributor

    
      Warner Music Group
Artwork

    
      ADOPEKID
Label

    
      Banger Musik
Copyright ©

    
      Banger Musik
Phonographic Copyright ℗

    
      Banger Musik
Featuring

    
      Al-Gear, Fat Joe, Jasko & 7 more
Producers

    
      Abaz, Bad Educated, B-Case & 11 more
Writers

    
      Abaz, Al-Gear, Bad Educated & 22 more
Composer

    
      Abaz, Bad Educated, B-Case & 11 more
Copyright ©

    
      Banger Musik"
"5","Farid Bang","Escobar","Blut","[Part 1: Farid Bang]
Deine Texte haben jedes Jahr 'ne neue Handschrift
Ich mach' Zeugen Angst mit deutschen Gunclips
Der Einzige, der beim Kampf mit Fäusten antritt
Und verlier' ich mein Gesicht, dann nur per Säureangriff
Schwesta S in FFM auf Alk und Beyda
Der einzige Mann, der sie anfasst: ein Altenpfleger
Viele wollen Fuß in dieser Szene fassen
Ich mache sie mit Kugeln kalt wie bei Schneeballschlachten
Farid trägt 'ne Waffe, du trägst Southpole, du Bitch
Der erste deutsche Rapper mit eigenem Auto im Clip
Trifft deine Freundin backstageUnd es ist wie das Leben von David Bowie, es endet mit 69
An alle, die im Herzen hofften, dass ich stürze:
Wenn ihr kein' Respekt habt, solltet ihr mich fürchten
Ich dreh' mehrere Dinger, Rapper heben den Finger
Bin kein Marsmensch, doch du siehst mich mit Venus-Gesichtern

[Hook: Farid Bang]
Ich bin Escobar(Mutterficker)
Ein Gangster wie Pablo Escobar(Gangster)
Ich zieh' das Koks wie Pablo Escobar(Cocaina)
Mach hier bitte nicht auf Escobar(Hurensohn)
Hijo de puta!
Ich bin Escobar
Mutterficker, Pablo Escobar
Gangster wie Pablo Escobar
Ich zieh' das Koks wie Pablo Escobar
Viva Colombia!

[Part 2: Farid Bang]
Und wenn Rapper was gegen mich sagen auf CD
Kriegen sie ein Meet-and-greet im arabischen Café
Wenn ich deine Schulter mit der Tec-9 streifeZeigst du Heimweh wie Tupac beim Westside-Zeichen(„Westside“)
Deutsche Rapper machen nichts außer Minus
Mehr Cash auf der Bank als du Klicks auf dei'm Video
Ich hau' Picos in Ohnmacht
Und mein Rap spricht Jungs von der Strasse an wie in Malle Discopromoter
Mittlerweile interessieren deine Alben kein' Menschen
Anstatt in Alben solltest du dich in 'nen Galgen reinhängen
Ich möchte Carmen Geiss bangen, habe den fettesten CockSie ist ein gefundenes Fressen wie das Essen von MOK
Es wird in die Fresse geboxt, ich komm' mit Thaiboxern und Gs
Und zieh' die Waffe als würd' ich 'ne Steinschleuder bedienen
Am iPhone blasen sie, machen gerne ein' auf mutig
Doch sie sind Heimscheißer wie Fler in seiner Jugend

[Hook: Farid Bang]
Ich bin Escobar (Mutterficker)
Ein Gangster wie Pablo Escobar (Gangster)
Ich zieh' das Koks wie Pablo Escobar (Cocaina)
Mach hier bitte nicht auf Escobar (Hurensohn)
Hijo de puta!
Ich bin Escobar
Mutterficker, Pablo Escobar
Gangster wie Pablo Escobar
Ich zieh' das Koks wie Pablo Escobar
Viva Colombia!

[Part 3: Fat Joe]
It's what the game's been missing, caine in kitchens
Point blank aim and brains get missin', chain addictions
I spend two hundred on the kilo
I get that work out Puerto Rico
Speakers are dirt, you are leaving in a hearse
That's collateral damage them hummer are blamed at the popo
All the way up, that's plata o plomo
It's a scene out of Escobar
I got the whole, shot down dem kevlar
That's born prove for the not trues
They pushin' 'em out the helicopter, no chute
And watcha dreams get shattered, the team cadavered
Balmain jeans and leisures, flee to Paris
Pablo, Pablo, Pablo

[Hook: Farid Bang]
Ich bin Escobar (Mutterficker)
Ein Gangster wie Pablo Escobar (Gangster)
Ich zieh' das Koks wie Pablo Escobar (Cocaina)
Mach hier bitte nicht auf Escobar (Hurensohn)
Hijo de puta!
Ich bin Escobar
Mutterficker, Pablo Escobar
Gangster wie Pablo Escobar
Ich zieh’ das Koks wie Pablo Escobar
Viva Colombia!

","https://genius.com/Farid-bang-escobar-lyrics","Released May 27, 2016
Distributor

    
      Warner Music Group
Artwork

    
      ADOPEKID
Label

    
      Banger Musik
Copyright ©

    
      Banger Musik
Phonographic Copyright ℗

    
      Banger Musik
Featuring

    
      Al-Gear, Fat Joe, Jasko & 7 more
Producers

    
      Abaz, Bad Educated, B-Case & 11 more
Writers

    
      Abaz, Al-Gear, Bad Educated & 22 more
Composer

    
      Abaz, Bad Educated, B-Case & 11 more
Copyright ©

    
      Banger Musik"
"6","Farid Bang","Schutzweste","Blut","[Part 1: Farid Bang]
Yeah! Ah!
Und macht deine Crew ein'n LabelsamplerSieht man zwei Hunde aufm Cover wie beim Zuhältertape 4
Transportiere Koks, stürme mit Kampfsportlern die Show
Meine Einnahmen kommen aus deiner Zwangsprostitution, ah
Und auf mich kannst du ein' Haufen kacken
Wenn ich bei McFit meine Wertsachen aus den Augen lasse
Ich war ein No-Name auf Cocaine, heute für dich nur ein Prolet
Julian und Farid im schwarzen Ferrari, komm' grad aus Miami und los geht's
Dicke Autos, schöne Frauen und die Mios verschwinden
Manchmal muss sich der König opfern, um das Spiel zu gewinnen
Ich gebe die Krone nicht kampflos ab, glaub mir, ich hab' keine Angst vor Knast
Und zeig' dir, wie man aus 'nem Blankoblatt in einer Nacht ein' Lambo macht
Und jeder dieser gestörten Jungs gehört zu uns
Kein Streifenwagen, doch Cops sehen in mir ihre Beförderung - yeah!
Gangstarap ist mehr als eine Waffe zu tragen
Doch mein Rap ist wie Drilling - passend zur Straße

[Hook:Farid Bang& Julian Williams]
Du scannst mich, du kennst mich ich lass' dich durch meine Grenzen durch
Trotzdem fällst du ein (trotzdem fällst du ein, trotzdem fällst du ein, trotzdem fällst du ein)
Du siehst mich, ich ziel' nicht, ich kämpf' mich durch zu dir hoch
Doch du lenkst nicht ein (doch du lenkst nicht ein, doch du lenkst nicht ein, doch du lenkst nicht ein)
Wenn der Krieg beginnt, zieh' meine Weste an, lass deine Wut zurück, weil ich nicht kämpfen kann
Wenn du nicht zu mir stehst -ich und meine Schutzweste
Ich und meine Schutzweste
Ich werde untergehen, wenn's keinen Grund mehr gibt (wenn's keinen Grund mehr gibt)
Wofür ich weiterleb(-eb, -eb, -eb, -eb, -eb, -eb)
Ich und meine Schutzweste
Schu-, Schutzweste

[Part 2: Farid Bang]
Fick dein' Stock-Car-Fahrer-Fame,in diesem gottverdammten Game
Habe ich bis dato noch kein MOK Plakat gesehen
Ich will schuld dran sein, dass du bald 'ne Kopfbandage trägst
Schuld dran sein, dass vor deiner Tür paar Rockerbanden stehen
Schuld dran sein, dass man dir eine Boxernase schlägt
Und auch der Schuldige sein, wenn es heißt: „Der Doktor kam zu spät!“
Diss mich und du weißt, dass dich 'ne Backpfeife erwartet
Die meisten Rapper kommen nur bei Glatteis von der Straße
Chill' in Dubai, du weißt, dass du Freunde hintergehst
Die Straße vergisst nicht, dass du auf der Zeugenliste stehst, ah!
Und mittlerweile wird jeder Apple-VerkäuferJeder Penner und Säufer Gangstarapper in Deutschland
Fick AMG, ich ging den harten Weg, bei dem man leider kein Versace trägt
Bullen suchen mich mit Strafbefehl, deshalb muss ich in der Garage drehen
Dein Bro bekam mit, dass seine Frau mit mir schliefJetzt ist es wie Spieler und Trainerbank - Aus zwischen ihnen

[Hook: Farid Bang & Julian Williams]
Du scannst mich, du kennst mich ich lass' dich durch meine Grenzen durch
Trotzdem fällst du ein (trotzdem fällst du ein, trotzdem fällst du ein, trotzdem fällst du ein)
Du siehst mich, ich ziel' nicht, ich kämpf' mich durch zu dir hoch
Doch du lenkst nicht ein (doch du lenkst nicht ein, doch du lenkst nicht ein, doch du lenkst nicht ein)
Wenn der Krieg beginnt, zieh' meine Weste an, lass deine Wut zurück, weil ich nicht kämpfen kann
Wenn du nicht zu mir stehst - ich und meine SchutzwesteIch und meine Schutzweste
Ich werde untergehen, wenn's keinen Grund mehr gibt (wenn's keinen Grund mehr gibt)
Wofür ich weiterleb(-eb, -eb, -eb, -eb, -eb, -eb)
Ich und meine SchutzwesteSchu-, Schutzweste","https://genius.com/Farid-bang-schutzweste-lyrics","Released May 27, 2016
Distributor

    
      Warner Music Group
Artwork

    
      ADOPEKID
Label

    
      Banger Musik
Copyright ©

    
      Banger Musik
Phonographic Copyright ℗

    
      Banger Musik
Featuring

    
      Al-Gear, Fat Joe, Jasko & 7 more
Producers

    
      Abaz, Bad Educated, B-Case & 11 more
Writers

    
      Abaz, Al-Gear, Bad Educated & 22 more
Composer

    
      Abaz, Bad Educated, B-Case & 11 more
Copyright ©

    
      Banger Musik"
