"";"artist";"title";"album";"text";"url";"metadata"
"7";"Kay One";"Das Öl wurde zu Blut";"Der junge von damals";"[Intro: Nachrichtensprecher &Kay One]
„Es sieht aus wie ein Ferienparadies.“
„Läuft die Kamera?“
„Die Fahrt mit diesem Schiff haben 22 Menschen nicht überlebt.“
„So, das Öl wurde zu Blut.“
„Der Anschlag von Paris trifft Frankreich, trifft Europa ins Herz.“
„Mit Polizeieskorte auf dem Weg zum größten Flüchtlingslager der Welt in Kenia.“
„Zuvor hatte die israelische Kriegsmarine einen Strand in der Stadt Gaza beschossen und dabei vier spielende Kinder getötet.“

[Part 1: Kay One]
Ah!
Wir sind blind, denn wir sehen Gottes Zeichen nicht
Bekriegen uns, während der and're keine Schale Reis besitzt
Jeder streitet sich für nichts, will sich in der Sonne räkeln
Während einer schon mit 5 mitkriegt, wie es Bomben regnet
Mütter wein' - ihre Söhne kehren nicht mehr heim
Politiker sind unter sich und jeder Schritt ist geheim
Menschen töten Menschen, wir sind dauernd unzufrieden
Leute töten für den Glauben, doch der Glaube steht für Frieden
Und anstatt sich zu lieben, sich zu helfen und zu kämpfen
Siehst du verzweifelte Väter mit Kindern an den Grenzen
Siehst du Kinder, die ertrinken, weil sie eine Zukunft wollten
Massenmanipulation; Hände, die mit Blut schon voll sind
Echte Gangster tragen nicht einfach 'ne Knarre, nein
Echte Gangster treten auf mit Anzug und Krawatte
Sie lächeln in die Kamera für ihre Dreckspartei
Sie erzählen, du sollst wählen, dann wird alles anders sein
Ihr bleibt alles Lügner und Betrüger - ja, ich hass' euch Hunde echt
Und ich scheiß' auf jeden König, der sein Volk verhungern lässt
So viel Religion und die ganzen Menschen streiten noch
Lasst jeden beten, wie er will und mag - es gibt nur einen Gott
Hetze hier, Hetze da, doch wir sollten zusammenhalten
Sonst werden wir bald zusammen fallen
Und ich bet' so oft zu Gott, dass er uns allen verzeiht
Wir sind verantwortlich für das Leid

[Hook: Michelle Mendes]
Und das Öl wurde zu Blut
Der Himmel fing zu leuchten an
Aus Frieden wurde Wut
Jeder wartet auf ein' Neuanfang
Wir zerstören uns von selbst
Und Kindertränen lügen nicht
Dann geht sie hin die Welt
Dann geht sie hin die Welt
Es ist zu spät!

[Part 2: Kay One]
Bitte sag das nicht! Wir müssen einfach aufwachen
Aufeinander aufpassen, wir könn' das auch schaffen
Reiche werden reicher und die Armen werden ärmer
Doch gibt der Reiche den Armen was, dann wird er nicht ärmer
Okay, wir sollten lernen, uns zu tolerier'n
Miteinander zu leben, auch mal geben, nicht nur nehmen
Dieser schwarze Regen wird sonst zu 'ner Flut
Einfach mal dankbar sein und sagen: „Gott sei Dank, uns geht es gut!“
Denn es gibt Menschen, die oft tagelang nichts essen
Und sie schlafen in verdreckten Müllbergen - tja, wir haben sie vergessen
Abgelenkt durch die Werbespots, Instagram, Snapchat
Gehirnwäsche durch die Medien, das Internet lässt
Uns keine Zeit zum Schlafen, wir sind nur beschäftigt mit dem Müll
Während die Mächtigen nur Waffen bau'n und Frau'n und Kinder kill'n
Panzer rollen, Anschläge - Unschuldige sterben
Kampfjets über Schulen und plötzlich ist der ganze Unterricht voll Scherben
Und ja, die Mutter weint zurecht
Wird ihr Kind niemals wiedersehen, ein Soldat trägt die Leiche weg
Der Vater wurd' erschossen, seine Frau liegt jetzt allein im Bett
Und in den News nur ein scheiß Politiker, der weiter hetzt
Und dieser Hass wird täglich größer
Es geht um Macht, es geht um Geld und um das Öl da
Doch wir Menschen sind geblendet und verstehen's nicht
Bis es dann irgendwann zu spät ist

[Hook: Michelle Mendes]
Und das Öl wurde zu Blut
Der Himmel fing zu leuchten an
Aus Frieden wurde Wut
Jeder wartet auf ein' Neuanfang
Wir zerstören uns von selbst
Und Kindertränen lügen nicht
Dann geht sie hin die Welt
Dann geht sie hin die Welt
Und das Öl wurde zu Blut
Der Himmel fing zu leuchten an
Aus Frieden wurde Wut
Jeder wartet auf ein' Neuanfang
Wir zerstören uns von selbst
Und Kindertränen lügen nicht
Dann geht sie hin die Welt
Dann geht sie hin die Welt
Es ist zu spät!";"https://genius.com/Kay-one-das-ol-wurde-zu-blut-lyrics";"Released September 2, 2016
Distributor

    
      Tonpool Medien GmbH
Copyright ©

    
      Prince Kay One GmbH
Phonographic Copyright ℗

    
      Prince Kay One GmbH
Label

    
      Prince Kay One GmbH
Cover Design

    
      Mikkansy
Artwork

    
      Eric Ullrich
Executive Producer

    
      Kay One
Featuring

    
      Al-Gear, Brandon Beal, Faydee & 5 more
Producers

    
      Gorex
Writers

    
      Alex Dehn, Al-Gear, Brandon Beal & 8 more
Composer

    
      Alex Dehn, Gorex, Mario Winans & 1 more
Copyright ©

    
      Prince Kay One GmbH"
"8";"Kay One";"Believe";"Der junge von damals";"[Intro: Faydee]
They said that I won't make it
They said that I would fail
They said that I'm not good enough
That things will never change
I'm walking through the rain again
And yeah, I'll be okay
Cause I'll never stop believin'
And now I'm on my way

[Hook: Faydee]
Oh-oh-oh now I'm standing here, no, I just can't believe it
I'm living my dreams the way I wanna live
My mom told me that I could be anything, anything
If I believe…
If I believe, if I believe
If I believe, if I believe
If I believe, I believe, yeah
If I believe, if I believe, believe, believe
If I believe, yeah

[Part 1: Kay One]
Man versucht, dir dein' Traum auszureden
Und sie raten dir, besser aufzugeben
Junge, wie oft bin ich aufgewesen
Hab' zu Gott gebetet? Glaub mir, täglich!
Das Leben 'ne Klippe und sie woll'n dich fallen sehen
Du kannst zwischen Glück oder Alk wählen
Wählst zwischen Gesundheit und Drogen
Gehst du kaputt oder stehst später oben
Hör nicht auf and're, hör auf die Familie
Glaub an dich selbst, verfolg deine Ziele
Sie ist nur bedingt, die Zeit, die du hast
Wenn du alt bist, sag: „Ich hab's einfach gemacht
Mein' Traum gelebt, die Welt gesehen
Konnt' so viele schöne Dinge mein' Eltern geben
Und den Leuten, die immer gezweifelt haben
Einfach mal zeigen, dass sie alle falsch lagen!“

[Hook: Faydee]
Oh-oh-oh now I'm standing here, no, I just can't believe it
I'm living my dreams the way I wanna live
My mom told me that I could be anything
Anything if I believe
If I believe, if I believe
If I believe, if I believe
If I believe, I believe, yeah
If I believe, if I believe, believe, believe
If I believe, yeah

[Part 2: Kay One]
Und sie haten, weil sie selber nichts erreicht hab'n
Dein Ziel muss ein Benz sein und kein Kleinwagen
Doch das Leben schenkt ei'm nichts
Kämpf nicht für die and'ren, kämpfe für dich
Irgendwann ist dein Leben sonst aussichtslos
Und die andern haben dann ihr Haus und Boot
Die Zeit, die du heute verschwendet hast
Kriegst du nie mehr zurück, also denk ma' nach
Ich erinner' mich noch an damals
Wie die fette Frau vom Jobcenter gesagt hat
„Du bist unvermittelbar, hier mein Ratschlag:
Ein Stock höher, dritte Tür - Sozialamt!“
Aber ich hab' nie drauf gehört
Und hab' mich nie unterkriegen lassen
Lasst euch von niemandem einreden, dass ihr nichts wert seid
Denn ihr könnt so vieles schaffen

[Hook: Faydee]
Oh-oh-oh now I'm standing here, no, I just can't believe it
I'm living my dreams the way I wanna live
My mom told me that I could be anything
Anything if I believe
If I believe, if I believe
If I believe, if I believe
If I believe, I believe, yeah
If I believe, if I believe, believe, believe
If I believe, yeah";"https://genius.com/Kay-one-believe-lyrics";"Released September 2, 2016
Distributor

    
      Tonpool Medien GmbH
Copyright ©

    
      Prince Kay One GmbH
Phonographic Copyright ℗

    
      Prince Kay One GmbH
Label

    
      Prince Kay One GmbH
Cover Design

    
      Mikkansy
Artwork

    
      Eric Ullrich
Executive Producer

    
      Kay One
Featuring

    
      Al-Gear, Brandon Beal, Faydee & 5 more
Producers

    
      Gorex
Writers

    
      Alex Dehn, Al-Gear, Brandon Beal & 8 more
Composer

    
      Alex Dehn, Gorex, Mario Winans & 1 more
Copyright ©

    
      Prince Kay One GmbH"
"9";"Kay One";"Baller";"Der junge von damals";"[Part 1: Kay One]
Ich leb, was du rappst, hier ist alles echt
Guck auf meine Schuhe, Leandro Lopes
Heut fickt dich ein Player, clean cut, Bitch
Ich komm auf die Party und hab den Ich-fick-dich-Blick
Tiefergelegt und breite Felgen, Lack: rot-matt
Immer die Bullen, die mich stoppen, ich hab's so satt
Diggah, wir sind Baller, Ferrari California
International, Fotze, Euro oder Dollars
Ich zahle mit allem und trinke pur, in der Uhr
Brillis von 'nem Juwelier aus Winterthur
Flashback: letzte Nacht, New York, einfach weg der Pass
Ich glaub, ich hab mit zwei Lesben Sex gehabt

[Hook: Kay One]
Diggah, wir sind Player, wir sind Wichser, wir sind Baller
Du hast Abi und ich ein Ferrari California
Du warst auf dem Internat? Cool, ich war in den Charts
Und dein Kaviar und Hummer, schieb's dir in den Arsch
Steig auf deine Harley, Bruder
Du wirst dicht gefolgt von meiner Hayabusa
Deutscher Rap ist fast tot, Hallelujah
Manu, mach es wie King Martin Luther - fick sie mit der Wahrheit!

[Part 2: Manuellsen]
M-Punkt, Asozial, in der Hood wie ne Spritze
Asozial, trag Kutte beim Ficken
Mois, ich verputz deine Sippe, geh und lutsch mir den Sippi
Ich geh in die Charts und nebenbei paar Hooks so wie Fifty
Rolle ich den Pimmel aus, kommt Stille auf
Mois, und die Bitches werden zahm wie 'ne Diddl-Maus
Also bevor ich dich wegbügel, lern den Respekt fühlen
Mois, ich trag 'ne Gun lang wie Scheckfüße
Komm ich in dein Viertel, denkst, dass Batman kommt
Sieh, die Hater fang'n zu stottern an wie Scatman John
Nutte, sieh es endlich ein
Für Angst vor Aussagen musst du Gangster sein

[Hook: Kay One]
Diggah, wir sind Player, wir sind Wichser, wir sind Baller
Du hast Abi und ich ein Ferrari California
Du warst auf dem Internat? Cool, ich war in den Charts
Und dein Kaviar und Hummer, schieb's dir in den Arsch
Steig auf deine Harley, Bruder
Du wirst dicht gefolgt von meiner Hayabusa
Deutscher Rap ist fast tot, Hallelujah
Manu, mach es wie King Martin Luther - fick sie mit der Wahrheit!

[Part 3: Kay One]
Hungrig, respektlos, Mitternacht Esso
Kippen kaufen, Wodka saufen, alle Jungs auf Testo
Bastard, guck nicht, Cash durch die Clubhits
Du bist am Rennen, nur damit du Depp noch den Bus kriegst
Fly wie ein verdammter Adler, angesagter als jemals
Ich lass dich im Flur penn' wie 'ne Oma ihren Malteser
Kawasaki-Rennmaschin', wir jagen dich durch unsre Hood
Bin Superstar, doch fick die ganzen MCs weg im Untergrund
Na und, du Hund? Dann bin ich eben überall im Scheiß-TV
Dafür erreich ich Leute, die kein' Rap hör'n wie deine Frau
Ich date sie, dann fick ich sie, mehr Goldketten als Mr. T
Kay One, Mr. Germany, du Mr. Bean

[Hook: Kay One]
Diggah, wir sind Player, wir sind Wichser, wir sind Baller
Du hast Abi und ich ein Ferrari California
Du warst auf dem Internat? Cool, ich war in den Charts
Und dein Kaviar und Hummer, schieb's dir in den Arsch
Steig auf deine Harley, Bruder
Du wirst dicht gefolgt von meiner Hayabusa
Deutscher Rap ist fast tot, Hallelujah
Manu, mach es wie King Martin Luther - fick sie mit der Wahrheit!

[Bridge: Kay One]
Ein neureicher Wichser [6x]

[Hook: Kay One]
Diggah, wir sind Player, wir sind Wichser, wir sind Baller
Du hast Abi und ich ein Ferrari California
Du warst auf dem Internat? Cool, ich war in den Charts
Und dein Kaviar und Hummer, schieb's dir in den Arsch
Steig auf deine Harley, Bruder
Du wirst dicht gefolgt von meiner Hayabusa
Deutscher Rap ist fast tot, Hallelujah
Manu, mach es wie King Martin Luther - fick sie mit der Wahrheit!";"https://genius.com/Kay-one-baller-lyrics";"Released September 2, 2016
Distributor

    
      Tonpool Medien GmbH
Copyright ©

    
      Prince Kay One GmbH
Phonographic Copyright ℗

    
      Prince Kay One GmbH
Label

    
      Prince Kay One GmbH
Cover Design

    
      Mikkansy
Artwork

    
      Eric Ullrich
Executive Producer

    
      Kay One
Featuring

    
      Al-Gear, Brandon Beal, Faydee & 5 more
Producers

    
      Gorex
Writers

    
      Alex Dehn, Al-Gear, Brandon Beal & 8 more
Composer

    
      Alex Dehn, Gorex, Mario Winans & 1 more
Copyright ©

    
      Prince Kay One GmbH"
"10";"Kay One";"Beverly Hills";"Der junge von damals";"[Hook: Michelle Mendes]
I want a house in the hillside of Beverly Hills
Don't give a shit about tomorrow, never pay my bills
Don't wanna care if I spend money like a star
I want a house in the hills with a big garage
I want a house in the hillside of Beverly Hills
Don't give a shit about tomorrow, never pay my bills
Don't wanna care if I spend money like a star
I want a house in the hills with a big garage
Full of cars, full of cars, full of cars
In my garage, my garage, my garage
Full of ca-a-a-a-a-a-ars
I want a house in the hillside of Beverly Hills

[Part 1: Kay One]
Diggah, wie gern wär ich mal ein Rockstar
Mit 'ner Villa, wo ich weiß, da geht die Post ab
Mit 'nem großen Pool, die Frauen wasserstoffblond
Und im Club wär jede Flasche umsonst
Meine Nachbarn wär'n prominent und
Keine der Familien im Brennpunkt
Meine Ex wär aus irgendeiner Sendung
Ja, mein Leben hätte so 'ne schöne Wendung
Aber that's life, ich chill wieder im Block
Fick das Arbeitsamt, ich hab wieder kein' Job
Wie gern wär ich einer dieser vielen Scheiß-Snobs
Will Leandro Lopes und verkauf mein Riesen-i-Pod
Mich fuckt grad das Leben ab, was ich hier führ
Hätt auch gern die Yacht an der Scheiß-Cote-d'Azur
Schon wieder die Zwangsräumung vor meiner Tür
Hoff, der Lottoschein bringt mich zu dir

[Hook: Michelle Mendes]
I want a house in the hillside of Beverly Hills
Don't give a shit about tomorrow, never pay my bills
Don't wanna care if I spend money like a star
I want a house in the hills with a big garage
Full of cars, full of cars, full of cars
In my garage, my garage, my garage
Full of ca-a-a-a-a-a-ars
I want a house in the hillside of Beverly Hills

[Part 2: Kay One]
Ein' eigenen Fußballplatz und 'nen Fuhrpark
Damit kein Spast mich mehr zuparkt
Ein eigenes Home-Kino
Die ganze neue Kollektion von Moschino
Hätt so gern 'nen begehbar'n Kleiderschrank
Doch im Moment hat meine verdammte Karre keinen Tank
Kein Cash für die Miete und Rechnungen
Jedes Bewerbungsgespräch komplett verpennt
Komplett verpennt, ich versteh nur Ghetto-Slang
Und muss mir mein' Wagen teil'n, Mann, mit sechs Cousins
Existenz am Arsch, kennst du das?
Die Urlaubskasse reicht nur für Campingplatz
Doch irgendwann schaff ich es raus und werd reich
Will nix geschenkt kriegen, es braucht seine Zeit
Du musst an deinen Traum glauben, es reicht
Ich will kein einfaches Haus, ich will ein

[Hook: Michelle Mendes]
I want a house in the hillside of Beverly Hills
Don't give a shit about tomorrow, never pay my bills
Don't wanna care if I spend money like a star
I want a house in the hills with a big garage
Full of cars, full of cars, full of cars
In my garage, my garage, my garage
Full of ca-a-a-a-a-a-ars
I want a house in the hillside of Beverly Hills";"https://genius.com/Kay-one-beverly-hills-lyrics";"Released September 2, 2016
Distributor

    
      Tonpool Medien GmbH
Copyright ©

    
      Prince Kay One GmbH
Phonographic Copyright ℗

    
      Prince Kay One GmbH
Label

    
      Prince Kay One GmbH
Cover Design

    
      Mikkansy
Artwork

    
      Eric Ullrich
Executive Producer

    
      Kay One
Featuring

    
      Al-Gear, Brandon Beal, Faydee & 5 more
Producers

    
      Gorex
Writers

    
      Alex Dehn, Al-Gear, Brandon Beal & 8 more
Composer

    
      Alex Dehn, Gorex, Mario Winans & 1 more
Copyright ©

    
      Prince Kay One GmbH"
"11";"Kay One";"Irgendwann (Der Junge von damals)";"Der junge von damals";"[Hook: Michelle Mendes]
Irgendwann sehen wir uns wieder
Irgendwann bin ich bereit
Irgendwann merk ich dass du, all die Lieder für mich schreibst
Irgendwann bin ich allein und dann fällt´s mir wieder ein
All die Jahre war ich dein
Irgendwann sehen wir uns wieder
Und wir beide schau'n zurück
Gott wird helfen, doch wir zwei
Wir verschenkten unser Glück
Irgendwann bin ich allein und dann fällt´s mir wieder ein
All die Jahre war ich dein

[Part 1: Kay One]
Mir fällt es schwer, doch ich kann es nicht mehr
Du bist heut anders, ich hab es schon lange gemerkt
Du bist nicht mehr diese Frau die mich geliebt hat, nein, Schatz
In deiner Welt gibt es für einen wie mich kein' Platz
Sag wie lang hab ich um dich gekämpft
Nichts mehr gegessen und nicht gepennt
Wie lange hab ich auf mein Handy gestarrt
Obwohl ich wusste, du bist längst nicht mehr da
Hab mir eingeredet, dass die Hoffnung zuletzt stirbt
Und gesehen, dass in den Medien gehetzt wird
Heute weiß ich, sie wollten uns trenn', denn
Leider ist nicht alles Gold, was hier glänzt
Wir waren zu jung, für den Schritt nicht bereit
Vielleicht war es auch nicht die richtige Zeit
Eifersucht und Streit durch den Druck
Sekunde, ich gönne mir noch kurz 'nen Schluck
Denk jeden Tag an dich, wenn ich aufsteh, raus geh
Wie viele Songs muss ich noch aufnehm'n?
Kein', denn das war mein Letzter
Was mach's gut? Ok, mach's besser
Doch denk dran, ich wünsch dir das Beste
Zeig deinen Kindern meine 10000 Texte und lächle
Denn wir hatten eine gute Zeit
Dein Kay, PS: Tut mir Leid

[Hook: Michelle Mendes]
Irgendwann sehen wir uns wieder
Irgendwann bin ich bereit
Irgendwann merk ich dass du, all die Lieder für mich schreibst
Irgendwann bin ich allein und dann fällt´s mir wieder ein
All die Jahre war ich dein
Irgendwann sehen wir uns wieder
Und wir beide schau'n zurück
Gott wird helfen, doch wir zwei
Wir verschenkten unser Glück
Irgendwann bin ich allein und dann fällt´s mir wieder ein
All die Jahre war ich dein

[Part 2: Kay One]
Schlaflose Nächte, eiskaltes Herz
Und jede Scheiß-Party war's einfach nicht wert
So oft war ich von den Weibern genervt
Blick in mein Inneres, ich zeig dir den Herbst
Ich leide nicht mehr, wenn ich uns're Bilder seh
Wie oft hast du mir gesagt, du willst nicht geh'n?
Wie oft hast du mir gesagt, bleib für immer?
Ein Foto von dir? Ich hab gar keins im Zimmer
Baby, ich hab abgeschlossen
Wie viele Jahre war ich nachts besoffen?
Wie viele Male hab ich mich geschlagen?
Ich schwör, ich konnt diesen Kopfschmerz nicht ertragen
Meine Wut raus gelassen, hab mich nicht im Griff
Doch scheiß drauf, egal, es ist, wie es ist
Bleib wie du bist, du gehst dein' Weg
Das sind Geschichten, die das Leben erzählt
Ich wünsch dir das Beste, ein Haus mit 'nem Garten
Ein' Mann, der dich liebt, mit 'nem fetten Sportwagen
Zwei Mädchen und zwei Jungs, wie du's wolltest
Auf dass sie gut in der Schule sind und du stolz bist
Viel Geld, doch am meisten Gesundheit
Dass du noch die nächsten 50 Jahre jung bleibst
Und dass Gott dich beschützt
Vergiss mich nicht

[Hook: Michelle Mendes]
Irgendwann sehen wir uns wieder
Irgendwann bin ich bereit
Irgendwann merk ich dass du, all die Lieder für mich schreibst
Irgendwann bin ich allein und dann fällt´s mir wieder ein
All die Jahre war ich dein
Irgendwann sehen wir uns wieder
Und wir beide schau'n zurück
Gott wird helfen, doch wir zwei
Wir verschenkten unser Glück
Irgendwann bin ich allein und dann fällt´s mir wieder ein
All die Jahre war ich dein";"https://genius.com/Kay-one-irgendwann-der-junge-von-damals-lyrics";"Released September 2, 2016
Distributor

    
      Tonpool Medien GmbH
Copyright ©

    
      Prince Kay One GmbH
Phonographic Copyright ℗

    
      Prince Kay One GmbH
Label

    
      Prince Kay One GmbH
Cover Design

    
      Mikkansy
Artwork

    
      Eric Ullrich
Executive Producer

    
      Kay One
Featuring

    
      Al-Gear, Brandon Beal, Faydee & 5 more
Producers

    
      Gorex
Writers

    
      Alex Dehn, Al-Gear, Brandon Beal & 8 more
Composer

    
      Alex Dehn, Gorex, Mario Winans & 1 more
Copyright ©

    
      Prince Kay One GmbH"
"12";"Kay One";"Mile High Club";"Der junge von damals";"[Part 1]
Okay, ich park' direkt vor dem Club und
Jede Bitch macht sofort den Kussmund
Allein mein Wagen, als ich vorgefahren bin
Garantiert mir den Pluspunkt
Holt Luft, Jungs, macht Bräute klar
Ich hab' den Swag aus den Neunzigern
Wie's mir geht? Läuft, Digga!
Meine Haare geleckt wie ein Bräutigam
Heute Star, gestern kriminell
Beide Mittelfinger zeig' ich jetzt der Welt
Wie ich mein Cash will? Am besten schnell!
Hab' grad den neuen SL bestellt
Läuft - ich will Poolparty im Blue Marlin und Flaschen killen
Mach dein Bild ich will einfach wie Dan Bilzerian mit Waffen chillen
Zerschmetter' die Rapper, der Baller, der Swagger
Weshalb wohn' ich noch nicht in Beverly Hills?
Ich hab' keine Ahnung, doch meine Bezahlung
Bei all diesen Nutten sind dreckige Pillen
Die fetteren Villen, die größeren Jets
Der König ist back und die Harley am rollen
Mein Auto kostet über 200.000,die Neider gehören geschlagen ganz doll

[Hook]
Mile-High-Club, wir vögeln die Bitches grad über den WolkenMann, wir sind der Mile-High-Club - zuerst in der Luft und später beim GolfenMann, hol mir die Bitches, Mann, hol mir die BitchesWir sind der Mile-High-Club, Digga, Mile-High-ClubMann, hol mir die Bitches!

[Bridge 1]
„Mann, ich weiß selber nicht, was die erste Strophe mit der Hook zu tun hat, aber ich glaub', das ändern wir mal ganz schnell! Pass ma' gut auf!“
Yeah!

[Part 2]
Guck, ich flieg' im Jet und die Stewardess gibt mir auf Toilette 'nen Blowjob, Bitch!
Hier kommt Kenneth,das ist Menace, wenn dich Deutschraps O-Dog fickt
Ich schick' den Piloten zu Boden, denn geht es um Kohle, verdien' ich doch hundertmal mehr
Ich hass' dicke Ärsche, bring mir dünne Models, am besten noch skinny und unterernährt
Reich und schön, Digga, ich bleib' ein Prototyp für diesen Lifestyle
Jette nach Bangkok ins beste Hotel und den Nutten geb' ich im Jacuzzi ein' Highfive
Du willst dabei sein? Kein Problem! Jede der Bitches ist eine 10
In meinem Auto sitzt mein Emblem, so viel' Diamanten, die Zeit bleibt stehen
Teenies am kreischen, sie kommen nicht klar, ich wink' aus dem Fenster wie 'n Hollywood-Star
Nichts mehr mit schlafen, ich muss zum Flughafen im Terminal check' ich paar Ollen vorm Start
Air Berlin, Lufthansa oder auch Emirates - frag, wen du willst, ja sie kenn' den Kay
Hol mir den Wodka Moloko imDuty Free, jetzt bin ich für diesen Flug bedient, wir sind der

[Hook]
Mile-High-Club, wir vögeln die Bitches grad über den WolkenMann, wir sind der Mile-High-Club - zuerst in der Luft und später beim GolfenMann, hol mir die Bitches, Mann, hol mir die BitchesWir sind der Mile-High-Club, Digga, Mile-High-ClubMile-High-Club, Digga, Mile-High-Club, yeahMile-High-Club, Digga, Mile-High-Club, yeahMile-High-Club, Digga, Mile-High-Club, yeahMile-High-Club, Digga, Mile-High-Club, yeahMann, hol mir die Bitches!

[Bridge 2]
„So, wie kann ich in diesem Club mitmachen? Einfach 'ne Perle nehm', auf der Toilette im Flugzeug weghauen, muss nur hoch genug sein!“";"https://genius.com/Kay-one-mile-high-club-lyrics";"Released September 2, 2016
Distributor

    
      Tonpool Medien GmbH
Copyright ©

    
      Prince Kay One GmbH
Phonographic Copyright ℗

    
      Prince Kay One GmbH
Label

    
      Prince Kay One GmbH
Cover Design

    
      Mikkansy
Artwork

    
      Eric Ullrich
Executive Producer

    
      Kay One
Featuring

    
      Al-Gear, Brandon Beal, Faydee & 5 more
Producers

    
      Gorex
Writers

    
      Alex Dehn, Al-Gear, Brandon Beal & 8 more
Composer

    
      Alex Dehn, Gorex, Mario Winans & 1 more
Copyright ©

    
      Prince Kay One GmbH"
