"","artist","title","album","text","url","metadata"
"6","Eko Fresh","OR Killaz","Fick deine story","[Intro: Aus einem Live Freestyle von Kool Savas]
Eko Whack, Eko Frosch, Eko Freak
Ich zertrampel dein Kopf solange, bis du kein Echo kriegst
Und wenn 'ne Flasche fliegt, dich trifft und dir platzt der Schädel
Ist es auch nicht weiter schlimm
- Das sind Kollateralschäden

[Part 1: Summer Cem]
Ist OK Moruk, flax mich nur
Und ich demolier dir dein Kopf du Schmock, als wärst du eine Wachsfigur
Du Arschgeburt, komm ich geb dir Promo umsonst
Hau deine schöne Nase krumm, wie ein Schokocroissant
Du musst dich aufrappeln. Ich rappe wie auf Pappe
Erwürg dich im Teich, lass dich schwimmen wie 'ne Kaulquappe, au Kacke
Schau dich Homo an, ich mach dich Todeskrank
Mach aus 'nem guten Jungen 'nen abgefuckten Schorejunk
Du willst es auch nicht, wenn ich dich aufmisch
Helfen dir weder die Bullen, noch das Blaulicht
Der Typ der eine Flasche ext, der seine Hand in deine Tasche steckt
Das Geld zählt und danach über Patte rappt
Scheiß auf deine Lala-Songs, denn wenn Summer kommt
Rennst du Schwuchtel weg, als wär das hier ein Marathon
Amar ist ein Hund, sag wie kann man diesen Spinner fördern?
Er macht auf Mann, doch er steckt in einem Kinderkörper
Die Kacke, die du rappst, wird dir kaum einer glauben
Ich hau die Kippe hinters Ohr und die Faust auf dein Auge
Glaub mir, du kannst mich nicht halten
Ramm dir den Schwanz in den Hals und
Glaub mir doch Junge du fickst grad mit dem Falschen

[Part 2: Manuell]
Seitdem die Leute denken, ich wär weg vom Dream, hängt mir dein Block am Schwanz
Denn ich spitt göttlich, als wäre ich mit Gott verwandt
But a stuffler Bastard, but I'm a Hustler Bastard
Einer der bei Action draufgeht, Homie ask about me
Wenn du denkst dein Bruder juckt mich, Homie, hast du Recht
Ich mach mir Sorgen um den Schmock
Er wird von Goonie Kids ermordet im Block
Und es ist deine Schuld, was nützt dir der Bling
Du versteckst dich hinter 'nem Kind
Und Homie komm zu Manuellsen..
Oder ich komm zu dir Dog, glaub mir, ich kann dich von der Bühne holen
Jeder, der mein Namen in den Mund nimmt ist 'n Hurensohn
Speichers in dein Kopf, Moruk, tipps besser ein
Dog ich komm zu dir nach Hause und schlag dir die Fickfresse ein
Ich bin 'n normaler Typ - Nett, höflich, gut erzogen
Treibt mich die Wut nach oben
Du hast keine Hoden du Bitch, mach 'n Bogen um mich
Glotz mich nicht an - geh vorbei und sag nix, frag nix, ich schnitz den Sarg für dich
Homie, es ist wie es ist, ich spitte die Parts wie ein Dampfhammer
Durch dein Schädel. Punk laber, rede, Ich geb mein Schwanz in dein Mädel
Und kümmer dich nicht um mich und frag, ob ich wirklich Triggers hab
Kümmer dich um dich, du bist ein Türke der gerne Nigga sagt

[Hook 2x]
OR Killaz, komm ich fick deine Story
Alle die Kanacken glauben nicht deine Story
Savas ab heute weißt du, man, es ist keine Story
Wenn German Dream dich irgendwann trifft mit der Forty

[Part 3: Lil' Kay]
Oh Savas, du warst mal der König des Raps
Deine Melanie ist weg, wen vögelt sie jetzt?
Früher hast du mit MOR über Schlampen gerappt
Doch selber warst du 10 Jahre mit 'ner Schlampe im Bett
Jetzt ist alles vorbei - Savas ja du wolltest den Beef
Du sitzt im Lexx - 100 Kanacken verfolgen dein Jeep, Brraa
Doch für mich bist du nur ein Haufen Scheisse wert
Ja du bist Berliner, deshalb wohnst du auch in Heidelberg
Du hast gesagt Eko der komerzielle MC
Habt ihr gewusst, dass Savas Geld bekommt von L.O.V.E.?
Und C.A.P.U.T du bist nicht der türkische Pac, türkische Pac
OR, das türkische Pack
Homie, jetzt ist der deutsche Twista vor Ort
""Oh nein, komm her"" Ich versteh von deinem Geflüster kein Wort
Und ich box, bis dein Nabel reisst
Und Savas nennt seinen kleinen Bruder Sinan, alter, nur weil kein Türke Pawel heisst
Und weißt du noch vor zwei Jahren auf der Splash
Bei Bushido seinem Gig, du warst nicht so geflasht
Ja wir beide standen dran, du hast fast geflennt
Alter, hast du nicht gesagt: ""Hey, der klaut mir meine Fans""
Oh Savas. Nix mehr mit S Hova, du willst Stress Hova?
Kein Problem, ich fick dich du Drecksposer
Und was soll dein deutsches Pimp my Ride
Bevor du deine Karre pimpst Moruk, pimp dein Weib
Was ist los?! Deine Shirts werden Körperbetonend
Werd doch Hippie, du pflanzenfressender Körneridiot
Du Vegetarier hast die Hosen voll, komm mach dein Bett mit Rosen voll
Schwuli, mach noch ein Video mit Rosenstolz
Du warst mit Samy down, als wäre Samy dein Bester
Doch als du bei uns warst, hast du über Samy gelästert
Oder hast du ihn nicht nachgeäfft? Hast du nicht gesagt: ""Kay und Jay, wie gesagt, im Endeffekt, es wär Geschäft.""

[Part 4: Capkekz]
Du bist nur Kacke und kein G. Savas du hast nichts kapiert
Bist kein Kanacke wie wir. Savas du hast dich blamiert
Friss weiter Karotten, dein Style ist leider Kartoffel
Man, ein erwachsener Mann trägt keine weiten Klamotten
Alter komm kämpf wie ein Mann, und ich versenk dich im Sand
Du bist ein Hemd und sehr krank. Ich nenn dich Penner, du Punk
Mach dich kaputt und am Arsch, du bist ein Hund und kein Star
Ich ficke euch, ich ficke dich. Ich fick Caput und Amar
Ich habe lang nichts gesagt, du bist ein Affe und nicht hart
Jetzt wird die Ratte gejagt, mit meiner Latte im Arsch
Bist kein Berliner, du Toy, du hast schon wieder enttäuscht
Alter, ich bin die Strasse (YEAH) und du ne Diva und feucht
Hab deine Kleine gebumbst, du kannst jetzt weinen du Hund
Du hast zum weinen ein Grund, ich geb dir eine in dein Mund
Du wärst viel besser ein Clown, doch jetzt verletz ich dein Maul
Also halt besser dein Maul, sonst ist ein Messer in deinem Bauch

[Hook 2x]

[Part 5: Elektro Eko]
Scheiss drauf, das du jetzt von jedem der Liebling bist Savas
Und die Subword/BMG kriecht noch tief in deinen Arsch
Ja du dominierst bei MTV TRL die Charts
Doch mit einem hast du nicht gerechnet, Freezy seine Parts (Yeah)
Du bist ein Feigling, leider, jetzt geht die Scheisse weiter
Kill dich wie Jason Voorhees, Freddy Kruger, Michael Myers
Das ist der German Dream, das ist der heilige Krieg
Du wolltest es so, alter Mann, und die Scheisse geschieht
Ihr macht Studentenrap - Zielgruppe: Sarah Kuttner
Doch ich bleibe fresh und ficke Adam Green seine Mutter
Dieser eine Lutscher sagt er macht die Promo für mich
Doch nach Abrechnung war überall ein Homogesicht
Savas dein Bruder wird nicht abgehn
Du kannst nicht mal alleine durch deine eigene Stadt gehen
Scheisse ja ich hab Schuhe verkauft, doch du gingst durch Restaurants""Wer will ein Abo der Süddeutschen, das hier ist eure Chance""
Du bist ein guter Rapper, Ibne, doch ein Pimp bist du nicht
Hast Mel tätowiert und am selben Abend Kinder gefickt
Die Blamage des Jahrhunderts - Falsch! Es ist die Savage des Jahrhunderts
Das du deine Kameraden noch ermunterst
Untergang kam doch raus - Caput, was ist ein Brockhaus?
Nur durch mich kam dein dummer Arsch hier aus dem Block raus
Iserlohn Ich frag dich wie viel Menschen da wohnen
Deine ernstgemeinte Antwort zu mir: Eine Millionen
Jetzt bist du Hartz 4 Rapper und es geht ziemlich ans Ego
Du bist am Start, warum schickt mir dein Neffe wieder ein Demo
Ey yo Amar, ich sage es dir voll konkret
Zu dir fällt mir nicht mehr ein als Gollum lebt
Eine Sache noch: Ercan wird kein Star
Und das hier machte ich zuerst. Ercan wird kein Star, yeah!
Was will Costa nur, du bist ein solcher Bastard
Moses fand mich immer cool, bis du ihn vollgequatscht hast
Freeze, der eine der Optik je geburnt hat
Die cheesigste Scheisse die ich je gehört hab
Probs an Azad - Savas ist der mal blasen darf
Denn in seinem behaarten Arsch steckt immer ein Massagestab
S so wirst du nie Kanacke, und du nennst Reen hier Assel
Dabei bist du selber Essah aka die Falaffel
Und du warst mal Hausbesitzer, die Nummer 1 für alle Backpacker
Aber auf den Streets da draußen lästern
Und dein hammerharter Blick ist ein aufgesetzter
Und deine John Bello Story macht es auch nicht besser
Ey yo Savas, du hast jetzt ein dickes Problem
Ich ficke dich eh und das ist meine Identität
All' deine Pisser kommen aus NRW
Aber schau mal auf den Tourplan, genau dort kann man nichts von deinen Pennern sehen
Fickt bis Heidelberg, die Clique und den kleinen Zwerg
Du sagst: Werft Flaschen - Ich hoffe dir sticht man in deinen Herz
Dein Problem wird immer dicker. Mo Savas wird immer sicker
Michael Jackson, R. Kelly, King Kool Kinderficker

[Hook 2x]","https://genius.com/Eko-fresh-or-killaz-lyrics","Released 2005
Primary Artists

    
      Eko Fresh & PA Sports
Featuring

    
      Capkekz, Emely (DEU), Farid Bang & 12 more
Producers

    
      Bushido, Decay & Kingsize
Writers

    
      Capkekz, Caput, Eko Fresh & 16 more
Composer

    
      Kingsize"
"7","Eko Fresh","Raab Skit","Fick deine story","Stefan Raab: Wer ist denn dein, wer ist denn dein, dein, dein...ja...dein... Chef-Feind? Sozusagen. Wollen wir mal Feind sagenEko Fresh: Sogesehen...ääh... ist mein Spezi Kool Savas, dass ist auch der der mich entdeckt hat. Wir waren früher sehr gute...Stefan Raab: ...Kool Savas! Schon mal gehört (schon mal gehört...schon mal gehört...schon mal gehört...schon mal gehört.....)","https://genius.com/Eko-fresh-raab-skit-lyrics","Released 2005
Primary Artists

    
      Eko Fresh & PA Sports
Featuring

    
      Capkekz, Emely (DEU), Farid Bang & 12 more
Producers

    
      Bushido, Decay & Kingsize
Writers

    
      Capkekz, Caput, Eko Fresh & 16 more
Composer

    
      Kingsize"
"8","Eko Fresh","Stenz Music","Fick deine story","[Verse I: Hakan Abi]
Das ist Hakan Abi, ich lad' dich ein zu ner privaten Party
Kommt vorbei, auf der Straße gibt es Narben gratis
Man nennt mich Pate von Gremberg
Weil ich entscheiden kann, ob ich deinen Arsch hier nich' sehn werd
Ich bin der Abi der nicht lange fackelt
Ich hab en Pitbull, alle kommen angedackelt
Aber auch mein zweiter Pitbull ist ein Höllenhund
Hakan ich werd' zu Satan wenn ich dich in Kölle bums
Das ist Stenz Music hart wie ein Stein
Für alle meine Jungs im Knast, Hafet und Brian
Köln Kalk 4 Life und weil das Ghetto mich so liebt
Bin ich dieser Typ, den du jetzt in Eko Videos siehst
Das ist Turkish Delight, hier gibt's türkischen Cay
Alle deine Hurensöhne dürfen nicht rein
Grembranx Hurensohn, egal was deine Gang denkt Hurensohn Bang Bang Hurensohn. Antigaranti

[Hook 2x: Eko Fresh]
Das hier ist Stenz Music
Das hier ist Fenster runter, spiel es in nem Benz Music
Fick drauf was du denkst Music
Grembranx. Hier wird jeder geschlagen
Das ist für jede Stenz mit Kragen hoch und Gel in den Haaren

[Verse II: Eko Fresh]
Ich bin kein netter Mensch, ich bin ein echter Stenz
Ein ganz normaler Turkish DelightPesevenk
Schreibe dein Testament, das ist Gremberg-Humboldt
Köln Kalk, ihr Rapper. Ich will seh'n wer hier rumprollt
Seit ich hier wohne, zieh' ich mich wie ein Stenz an
Du gehst auf Hip Hop Jams, ich häng' ab mit Gangstern
Das hier ist Stenz Music - Hose in die Socken
Triffst du mich im Club, bin ich vielleicht auf Koks oder besoffen
Du bist Tod, wenn wir dich boxen du kannst Flaschen auf mich drauf zielen
Aber danach jahrelang dein Essen durch den Schlauch ziehn'
Die Stenz-Gang trägt von Hugo Boss die Oberteile
Hängen nur mit Nutten ab, riesengroße Oberweite
Du bist oberscheisse; fick deinen Jammerhaufen
Ich verdiene soviel Geld, ich kann mir deine Mama kaufen
Und dein Monatslohn bekomm' ich in ner halben Stunde
Rede nicht vom deutschen Rap, dass sind für mich alles Hunde
Glaub diesem Ek, keine braucht diesen Dreck das ist Ausländerrap
Ich seh aus wie geleckt - Sonnenbank, neues Handy und den Chrysler unterm Arsch
Fenster runter Stenz Music und ich scheiße auf Savas - German Dream

[Hook 2x: Eko Fresh]

[Verse III: Summer Cem]
Wenn du in der Grembranx bist, macht es bang bang klick
Ich seh' deine Schwester, sie ist eine Gang-Bang-Bitch
Summer Cem denkt, ihr seid nur Verlierer und Looser
Alles was ich auf spanisch sagen kann, ist Hijo de Puta
Aus liebe zu meinem Bruder, wirst du weggeboxt
Yunus Küche sieht aus als hätten wir dort Crack gekocht
Das ist die Stenz Gang, sagt mir jetzt wer will´s mit den Jungs
Nicht bei uns, Moruk, nur im Puff wird billig gebummst
Das ist Köln Kalk, und nicht der Baggersee
Du brauchst keinen Job, wenn deine Olle für dich ackern geht
Das ist ein Koka Betrieb, es gibt auf dem Klo was zu ziehn
Ein Stenz kriegt in der Woche, was ein Arzt im Monat verdient
Du bist ein Bonzen Kind und lässt dich von Joop-Designern anziehn
Ich lass deine Verlobte Koks von meinem Schwanz ziehen
Ich bin Anti. Du bist ein mickriger Stricher im Tanga, Summer Cem ich bin der türkische Bushido

[Hook 2x: Eko Fresh]

[Outro: Gesprochen von Murat Abi]
[?]
Wir erwarten euch alle, kommt vorbei [?]
[?]
Ihr könnt alle vorbei kommen
Gremberg. Ihr wisst ja unsere Adresse, ihr Pissers
[?]
Gremberg Kalk ihr Pissers
Nee, nich' Kool Savas, solche Namen hab ich mir gegeben, wo ich 12 war, hömma' - Kool Savas... Du bist schon über 30, du Wichser","https://genius.com/Eko-fresh-stenz-music-lyrics","Released 2005
Primary Artists

    
      Eko Fresh & PA Sports
Featuring

    
      Capkekz, Emely (DEU), Farid Bang & 12 more
Producers

    
      Bushido, Decay & Kingsize
Writers

    
      Capkekz, Caput, Eko Fresh & 16 more
Composer

    
      Kingsize"
"9","Eko Fresh","Wir marschieren","Fick deine story","[Intro: Bass Sultan Hengzt]
Yeah, hier ist Bass Sultan Hengzt, größte Schnauze Deutschlands. Ihr hört Eko Fresh 'Fick deine Story'-Mixtape. Ihr Fotzen, der Untergrund regiert. Ihr Scheißer...

[Strophe 1: Eko]
Ey yo, du wärst gerne hart, wärst gerne schwarz
Du willst dich blamiere, ich helfe sehr gerne nach
Denn ich ficke dich jetzt in den Mund und pump' in den Hals
Komm nach Kalk. Meine Welt ist dunkel und kalt
Ich laufe durch die Straßen und rufe ""Kölle Alaaf!""
Punisher Flow - Ihr werdet in der Hölle bestraft
Manche Sachen kannst du einfach vor den Kindern nicht bring'
Doch ich sag einfach ""Hurensohn"" und guck, das Image ist hin
Ihr lügt mich alle an. All die Fotzen fucken mich ab
Ich mache dich platt, mach' alles, was ihr Affen nicht macht
Ich bin Freezy der Star. Du riechst die Gefahr
Ficke die Credibility tief in den Arsch
Man sieht dich im Park nur mit Streunern und Pennern
Ek der Mack, Junge, ich zieh um die Häuser mit Bangern
Jeder sagt was, doch ich werd' mich für euch Toys doch nicht ändern
Du bist ein geheimer Schwuler und hast Freude mit Männern
Ich habe das gewisse Etwas, pisse in dein Sekt Glas
Wer hat deine Freundin nun gefickt, Junge - Ek war's
Ich höre kein' Rap mehr länger auf deutsch
Lutscher, du wurdest von einem anonymen Spender gezeugt
Denn ich hab heut den Respekt vor allem verloren
Lieber schneide ich mir ins Bein, anstatt dein Album zu holen
Kleiner, wir quälen dich. Bei uns nennt man das 'Alte Methoden'
Wie ist es, wenn man dir ein' Ziegelstein knallt in die Hoden
Eko, der Führer. Ja, es stimmt, ich rappe wie früher
Ich habe gestern deine Schwester an der Ecke verführt
Ey yo, dein Vater schmeißt 'ne riesen Fete
Deine Mutter macht aus meinem Sperma Ziegenkäse
Sie will ein Autogramm und dein großer Bruder scheißt in die Pampers
Ich bin auf Tour. Deine kleine Cousine steigt in den Bangbus
Moruk, ich rapp für mein Brot
Du rappst nur, weil du keine Freude mehr am Leben hast
Was, Junge? Eko ist dich los

[Hook: SD]
Ihr hab gehört, was jetzt so geht
Wir sind die jenigen [?] tuen euch weh
Also komm her und drück auf Play
Ihr könnt lyrisch leider nix, aber Jungs, das ist okay
Pass genau auf, was jetzt passiert
Wir sind der schlimmste Albtraum
Wir kommen fokusiert
Wie die Sintflut kommen wir
Das ist der German Shepherd, GD, wir marschieren

[Strophe 2: SD]
Hi Kids! Die Show hat begonnen
Ich bin S. Diddy, ich habe zuviele Drogen genommen
An meinem siebten Geburtstag flog mein Gehirn wie ein Vogel davon
Schon als kleines Kind, sagte meine Mama zu mir ""Lass die Pfoten davon!""
Jetzt kriegt die [?] ihr Fett ab, das ist der German Shepherd
Homie, der Bourbon scheppert, bei so 'nem burner Wetter
[?]

[Hook: SD]
Ihr hab gehört, was jetzt so geht
Wir sind die jenigen [?] tuen euch weh
Also komm her und drück auf Play
Ihr könnt lyrisch leider nix, aber Jungs, das ist okay
Pass genau auf, was jetzt passiert
Wir sind der schlimmste Albtraum
Wir kommen fokusiert
Wie die Sintflut kommen wir
Das ist der German Shepherd, GD, wir marschieren

[Strophe 3: Spontan]
German Shepherd, Baby, es gibt kein besseres Label
[?]
[?]
Du pokerst hoch, doch wir setzen dagegen
Ich bin zurück, doch alle hetzen [?]
Doch egal was sie erzählen, ich töte dich lyrisch
Alle mögen mich wirklich, ich hab mich schön verwirklicht
[?]

[Hook: SD]
Ihr hab gehört, was jetzt so geht
Wir sind die jenigen [?] tuen euch weh
Also komm her und drück auf Play
Ihr könnt lyrisch leider nix, aber Jungs, das ist okay
Pass genau auf, was jetzt passiert
Wir sind der schlimmste Albtraum
Wir kommen fokusiert
Wie die Sintflut kommen wir
Das ist der German Shepherd, GD, wir marschieren

___
Rest folgt noch","https://genius.com/Eko-fresh-wir-marschieren-lyrics","Released 2005
Primary Artists

    
      Eko Fresh & PA Sports
Featuring

    
      Capkekz, Emely (DEU), Farid Bang & 12 more
Producers

    
      Bushido, Decay & Kingsize
Writers

    
      Capkekz, Caput, Eko Fresh & 16 more
Composer

    
      Kingsize"
"10","Eko Fresh","Techno Eko Skit","Fick deine story","[Intro: Cut aus einem Caput Track]
S hat dich groß gemacht, S kriegt dich klein
Ich dagegen bin nur hier um dir zu sagn: ich bin dein Feind!
It's On kleiner Sucker, sag leb wohl zum Game!
Keiner, will dich Homo sehn
Versuchs doch mit Techno, Eko
Nenn dich einfach ""Techno Eko""

[Bridge: Gesprochen von Eko]
Yeah, yeah. Whooh
Herzlich Willkommen, mein Name ist Techno Eko
Man nennt mich ""König von Deutschland""
Und ich hab euch jemanden mitgebracht
Es ist C-A-P-U-T
Sing für sie, Playa
Yüah

[Verse: Cut aus Caput Track]
Mein Engel, mein Engel. Du bist bei mir jeden Tag
Mein Engel, mein Engel. Du bist bei mir jeden Tag
Auch wenn es mal Regen gab
Manchmal ist das Leben hart...immer in meiner Gegenwart
Und ich bin deswegen Stark, auch wenn es mal Regen gab
Manchmal ist das Leben hart...immer in meiner Gegenwart
Und ich bin deswegen Stark","https://genius.com/Eko-fresh-techno-eko-skit-lyrics","Released 2005
Primary Artists

    
      Eko Fresh & PA Sports
Featuring

    
      Capkekz, Emely (DEU), Farid Bang & 12 more
Producers

    
      Bushido, Decay & Kingsize
Writers

    
      Capkekz, Caput, Eko Fresh & 16 more
Composer

    
      Kingsize"
"11","Eko Fresh","Jetzt gibt’s Streit","Fick deine story","[Shout Out: Orgi69]
Orgi69,[?], Eko Fresh, Fick deine Story Mixtape
[?] (Woooohhhhoo)

[Hook 1: S.Diddy] [? Könnte Fehlern enthalten]
Jetzt gibt's Streit, seid leis', schweigt, es ist vorbei
Weil keiner von euch Motherfuckern peilt doch Freezy
Summer und Diddy haben einen ganz anderen Deal
Schreit oder du wirst zerfressen von Neid
Jetzt gibt's Streit, seid leis', schweigt, es ist vorbei
Weil Blei, sicher nicht fort bye bye
Eko Freezy, Spontan und Diddy haben ein ganz anderen Deal Schreit oder du wirst zerfressen von Neid

[Part 1: Eko Fresh]
Jetzt gibt's Streit, Summer Cem und Ek zu zweit
Mein Label tickt so viel wie ihr zu eurer besten Zeit
Gib mir das Money, ich mach ein Track und fick deine Mami
Ich seh aus wie meine Landsleute nicht wie ein Ami
Sieh mich an und du siehst 2 Generationen, voller Krieg und Kampf
Ek, ich habe die ganze Scheiße ausgebadet wie ein Mann
Vielen Dank Lutscher, euch hat keiner gesucht
Ihr seid alles Hurensöhne aus dem Hype den ich schuf
Wenn ich will mach ich ein Liebeslied und verdien mehr als du ihn dein Scheiß Leben ich bin Nummer eins Baby
Bora, der Grund warum ein Loch ihn deine Decke ist
SD ist die beste Kartoffel die am rappen ist
Junge dich verlässt deine Hoffnung bist du hinfällst
Am Muttertag gibt's du deiner Puffmutter Trinkgeld
Diddy passed mir jetzt ein Kilo vom Jay
Ich bin der, der alle Filme hat auf Video CD
Gestern Nacht war ich drauf und hab Deniro gesehen
Vieler meiner Brüder hat leider ein Visum gefehlt
Du Hurensohn bald ist jeder in der Clique ein Stenz
German Dream Baby wir sind [?] ,ich fick deine Gang

[Hook 2: Eko Fresh] (2x)
Jetzt gibt's Streit, weil ihr alle ätzend seid
Wir sind der Grund warum du dich versteckst daheim
Jetzt gibt's Streit, S.Diddy und Ek, zu zweit
Ihr seid alle Fotzen, Deutschrap hat Pech und weint

[Bridge: Eko Fresh]
Jetzt gibt's Streit

[Part 2: S.Diddy]
Die [?] sehen weg, die Affen reden Dreck
Sie sollen das ich schlecht schlaf'
Doch ich habe die Waffe neben den Bett, falls ich es nicht mit Rap schaff'
Mach ich meine Knete mit Track
Den ich hab noch nie den Arsch von einem Label geleckt
Ich verwandel Tränen in Sekt, und Bier ihn Champagner
Vor mir gab es hier noch nie einen Rapper in Alemanya
Mein Flow frisst sich durch die deutschen Hirne, wie ein Piranha
[?] ich den Takt, wie ein [Tyranier ?]
Komm locker an deine Tür, und vergeb dir ein Sack Ganja
Deine Freundinn macht mir ein Antrag und trink meine Pisse wie ein Glas Fanta
Ich habe die Äxte geschliefen und hack dir eine Hand ab
Den du bist am bitchen und ich der erste PIMP im Landtag
(German Shephard) SD kommt mal wieder brillant [?]
[?]
Diddy Da Da Da, ich schreibe sie weil ich fun hab
Mach die Augen auf sieh zu wie das Genie das hier handhabt

[Hook 2: Eko Fresh] (2x)
Jetzt gibt's Streit, weil ihr alle ätzend seid
Wir sind der Grund warum du dich versteckst daheim
Jetzt gibt's Streit, S.Diddy und Ek, zu zweit
Ihr seid alle Fotzen, Deutschrap hat Pech und weint

[Bridge: Eko Fresh]
Jetzt gibt's Streit

[Part 3: Summer Cem]
Summer Cem der Scheißtürke den niemand braucht
Streng dich an vielleicht sieht man dich bei GIGA TV
Mein Cousin geht ihn den Knast und guckt VIVA im Bau
Ich bin ein Moslem, du hast Gyros Pita im Bauch
Du machst auf Italianer und trinkst eine Latte macchiato
Ich komm ins Eiscafe und drück dir meine Latte ins Arschloch
Amina Koyim, glaub mir es ist endlich finito
Du bist ein kleiner Pinguin wie Danny DeVito
Du denkst manchmal du hast es schon erreicht
Doch du hast Angst das Mama dir keine Kohle leiht, Baba dich aus der Wohnung schmeißt
Oh Nein, ich komm jetzt ihn deine Wohnung rein
Er ist groß und steif, steck ihn dich Homo rein
Warte ab ich habe jetzt alles klar gemacht
Schau dich an wie ein Stenz, seine Nutte die ihre Tage hat
Vorm Club noch bisschen Party macht
Statt sich ihn die Fut [?] und sich ans blasen macht
Bubbles und sich ne Nase klatscht

[Hook 1: S.Diddy] [? Könnte Fehlern enthalten]
Jetzt gibt's Streit, seid leis', schweigt, es ist vorbei
Weil keiner von euch Motherfuckern peilt doch Freezy
Summer und Diddy haben einen ganz anderen Deal
Schreit oder du wirst zerfressen von Neid
Jetzt gibt's Streit, seid leis', schweigt, es ist vorbei
Weil Blei, sicher nicht fort bye bye
Eko Freezy, Spontan und Diddy haben ein ganz anderen Deal Schreit oder du wirst zerfressen von Neid

[Outro: Eko Fresh]
Wat is los du Funz? Salz du Funz! Salz, Salz, Summer, Salz!","https://genius.com/Eko-fresh-jetzt-gibts-streit-lyrics","Released 2005
Primary Artists

    
      Eko Fresh & PA Sports
Featuring

    
      Capkekz, Emely (DEU), Farid Bang & 12 more
Producers

    
      Bushido, Decay & Kingsize
Writers

    
      Capkekz, Caput, Eko Fresh & 16 more
Composer

    
      Kingsize"
