"","artist","title","album","text","url","metadata"
"7","Bushido","Alles Verloren","7","[Verse 1]
Mir fließt das Ghetto durch die Pulsadern – ich gebe dir dafür die Schuld, VaterDass bei uns damals die Bullen da waren
So wie ich ist diese halbe scheiß Nation
Wir sind den heißen Tropfen auf den kalten Steinen gewohnt
Lass doch mal die Lügen seinWir knacken dafür keine Schlösser und das SEK tritt dafür keine Türen ein
Sag mir endlich, wann kommt Ali ausm Knast?
Ich hoffe nur, ich geb' dir mit dem Lied ein bisschen Kraft
Ich bin der, der die Regeln bricht
Und du wirst angehalten weil du als Kanacke in 'nem AMG Mercedes sitzt
Du bist für sie nur wie Dreck und sie schließen dich wegUnd dann wird mir gesagt, ich handle nicht politisch korrekt
Wie gern würden mich die Wichser in die Zelle bringen
Weil in meiner Fangemeinde eh nur Kriminelle sind
Ihr seid nur unzufrieden, deswegen wollt ihr mir den Mund verbietenIch hab' keine Lust meinen Mund zu schließen

[Hook]
Kannst du das Ghetto sehen, kannst du es sehen?
Kannst du im Ghetto sehen, wie alles verkommt?
Denn sie hat alles verloren
Kannst du die Tränen sehen, kannst du sie sehen?
Sie würde nur zu gern dem Alltag entkommen
Sie wartet auf ihre Chance
Kannst du das Ghetto sehen, kannst du es sehen?
Kannst du jetzt sehen, wie er den Job jetzt verliert?
Denn er hat alles verloren
Kannst du das Ghetto sehen, kannst du es sehen?
Und jetzt sag mir nochmal, ich schau' nicht nach vorn
Wir haben alles verloren

[Verse 2]
Für deine Eltern jetzt der Albtraum in Person
Das ist Gangster-Rap, denn ich rappe für ein paar Million'n
Ja, der Kritiker, er spekuliert – und ich geb' ihm jetzt 'ne Hilfe
Ich bin vorbestraft, asozial und tätowiert
Gut erkannt, hier rappt der Junge über Knast
Beim Echo fühlte ich mich wie ein unerwünschter Gast
Falsches Lachen, denn sie hassen mich, ich spür' den krassen Neid
Ja, ich bin der Typ, der im Supermarkt den Kassen greift
Ihr wollt das echte Leben? Dann lasst mich aussprechen
Ich kann noch mehr als nur Autotüren aufbrechen
Kannst du seh'n, wie sich die Wolkendecke völlig schließt?
Mein ganzer Lebensstil wird mich noch in die Hölle ziehen
Ihr könnt mir den Tod wünschen
Ich möchte einfach in den siebten Himmel, doch ich werd' mich in den siebten Tod sünden
Das ist sieben, Junge – das hier ist das siebte Album
Und ich bewahre immer noch die Haltung

[Hook]
Kannst du das Ghetto sehen, kannst du es sehen?
Kannst du im Ghetto sehen, wie alles verkommt?
Denn sie hat alles verloren
Kannst du die Tränen sehen, kannst du sie sehen?
Sie würde nur zu gern dem Alltag entkommen
Sie wartet auf ihre Chance
Kannst du das Ghetto sehen, kannst du es sehen?
Kannst du jetzt sehen, wie er den Job jetzt verliert?
Denn er hat alles verloren
Kannst du das Ghetto sehen, kannst du es sehen?
Und jetzt sag mir nochmal, ich schau' nicht nach vorn
Wir haben alles verloren

[Verse 3]
Ich hab mir diesen Weg hier ausgesuchtUnd mag der Weg auch wieder steinig werden scheiß drauf ich geh die Strecke auch zu Fuß
Was wollt ihr mir nur erzählen
Ihr seid ein Haufen Opfer
Ein Haufen Opfer dass man grade frisch ausgekotzt hat
Scheiß egal wie viel Geld ich schon verdient habIch bleib für immer dieser Junge der gedealt hat
Ich mach den Unterricht
Den Unterricht für die Unterschicht
Fresse es gibt keinen der mich unterbricht
Sie versuchen mir die Art zu rappen auszureden
Man dabei haben sie uns vor langer Zeit schon aufgegeben
Ihr könnt mich abführen
Hundert tausend Kriminelle die mein Album kaufen
Könnt ihr diese Macht spüren
Ihr könnt mich weg sperren
Ihr könnt mich observieren
Die Langeweile treibt mich dazu euch zu provozieren
Es gibt keine Konkurrenz
Und ich ficke eure Artgenossen
Ich bin jetzt zurück jetzt wird scharf geschossen

[Hook]
Kannst du das Ghetto sehen, kannst du es sehen?
Kannst du im Ghetto sehen, wie alles verkommt?
Denn sie hat alles verloren
Kannst du die Tränen sehen, kannst du sie sehen?
Sie würde nur zu gern dem Alltag entkommen
Sie wartet auf ihre Chance
Kannst du das Ghetto sehen, kannst du es sehen?
Kannst du jetzt sehen, wie er den Job jetzt verliert?
Denn er hat alles verloren
Kannst du das Ghetto sehen, kannst du es sehen?
Und jetzt sag mir nochmal, ich schau' nicht nach vorn
Wir haben alles verloren","https://genius.com/Bushido-alles-verloren-lyrics","Released August 31, 2007
Distribution

    
      Sony BMG
Copyright ©

    
      ersguterjunge
Phonographic Copyright <U+2117>

    
      ersguterjunge
Artwork

    
      Ben Baumgarten
Photography

    
      Mat Hennek
Label

    
      ersguterjunge
Featuring

    
      Chakuza, Kay One, Nyze & 2 more
Producers

    
      Auditory, Bazzazian, Beatlefield & 8 more
Writers

    
      Bushido, Chakuza, Kay One & 3 more
Bass

    
      Markus Runzheimer
Copyright ©

    
      ersguterjunge"
"8","Bushido","Abschaum","7","[Strophe I]
Yeah
Ich lad mich selber auf die Party ein, wo sind deine reichen Kids?
Ich bin der einzige mit Iron-Mike-Tyson-Schnitt
Ich war der Erste mit Zahnstocher drin
Und dein Vater ist ein Wichser, weil das Arschloch sich schminkt
Deine Eltern würden mich am liebsten hinter Gittern sehen
Ich würde deine Eltern gerne mit 'nem Tripper sehen
Jack Daniel's Gläser und dann Prost
Ich hab unter meinen Fingernägeln Koks
Steht stramm salutiert, hier geht es nicht um mies oder fresh
Ich hab die Picaldi-Jeans voller Cash
CL AMG, scheiß auf den Klimaeffekt
Ich bin kein Schwiegersohn, ich bin Drogendealer, der rappt
Nenn' mich ab heute Sonny Escobar, ich führe das Volk
Kuck sie folgen mir, sie folgen diesem Typen aus Gold
Und ganz egal ob ich jetzt Geld mach
Deine Eltern sehen mich immer noch als den Abschaum der Gesellschaft

[Hook] [2x]
Du Bonzenjunge bist so arm dran
Wir sind genau diese Typen hier
Von denen deine Eltern dich gewarnt haben
Dieser Abschaum der nicht nach vorne schaut
Und wir jagen dich bis zum Morgengrauen

[Strophe II]
Wir sind einfache Jungs, Jungs die von der Straße sind
In deiner bunten Welt sind wir leider farbenblind
Komm und gib mir einen triftigen Grund
Und ich ramm dir meinen Stift in den Mund
Das ist Kommunikation, du und dein Streberverein
Öffne die Haustür und der schwarze Nebel kommt rein
Und ich scheiß auf deine saubere Welt
Ich hab Schläge hier im Angebot, doch ich würde tauschen für Geld
Siehst du keiner von uns lacht, siehst du keiner von uns hat
Angst, wir haben Scheiße durchgemacht
Dieser Abschaum, der dich wie ein Schatten verfolgt
Und denkt bloß nicht, ich nehm' euch ganzen Ratten für voll
Ja ich reiß dir deinen Kopf ab
Schick ihn per post deiner Freundin
So wie bei 7 weil ich Bock hab
Wer ist meine Kragenweite
Ich komm mir vor wie ein Pitbull
Leute wechseln wegen mir die Straßenseite

[Hook] [2x]
Du Bonzenjunge bist so arm dran
Wir sind genau diese Typen hier
Von denen deine Eltern dich gewarnt haben
Dieser Abschaum der nicht nach vorne schaut
Und wir jagen dich bis zum Morgengrauen

[Strophe III: Bushido]:
Ja, das Thema is' geklärt
Deine Eltern haben Recht, ich gehöre in den Käfig eingesperrt
Ich passe nicht in dein Bild, du passt leider nicht in mein Bild
Und ab heute bist du Freiwild
Ich bin der Staatsfeind
Und breche in dein scheiß Privatinternat ein
Gewissen? Ich hab keins
Warte bis Mitternacht
Mich halten die Rachegefühle hinter Gittern wach
Kuck was du Ficker machst
Sonny Al Capone
Junge da wo deine Eltern wohnen
Tauch ich auf um mein Geld zu holen
Hier im Herzen von Berlin
Wir hören wie dein Herz klopft
Denn mir sind die Schmerzen jetzt zu viel
Wie eine Fledermaus seh' ich in der Nacht besser
Alpha Jacke, Airmax, Klappmesser
Bei Nacht, ihr könnt nur hilflos zusehen
Wie ich euer Land therapier', ja, es tut weh

[Hook] [2x]
Du Bonzenjunge bist so arm dran
Wir sind genau diese Typen hier
Von denen deine Eltern dich gewarnt haben
Dieser Abschaum der nicht nach vorne schaut
Und wir jagen dich bis zum Morgengrauen","https://genius.com/Bushido-abschaum-lyrics","Released August 31, 2007
Distribution

    
      Sony BMG
Copyright ©

    
      ersguterjunge
Phonographic Copyright <U+2117>

    
      ersguterjunge
Artwork

    
      Ben Baumgarten
Photography

    
      Mat Hennek
Label

    
      ersguterjunge
Featuring

    
      Chakuza, Kay One, Nyze & 2 more
Producers

    
      Auditory, Bazzazian, Beatlefield & 8 more
Writers

    
      Bushido, Chakuza, Kay One & 3 more
Bass

    
      Markus Runzheimer
Copyright ©

    
      ersguterjunge"
"9","Bushido","Zeiten ändern sich","7","[Songtext zu „Zeiten ändern sich“]

[Part 1]
Ghettostory, Ghettojunge, dieser Mann war ziemlich broke
Leider spielte MTV keines meiner Videos
Keine Kohle, nur Routine, Nummer ziehen beim Arbeitsamt
Arbeitsdrang? Fehlanzeige, der Konsum von Gras begann
Immer kalkulieren, was kann ich bei Lidl kaufenHeut könnt ich mir einen ganzen Lidl kaufen
Hast du was, bist du was, die Wichser wollten meine Wohnung pfänden
Ich kauf mir 'ne Villa und kann D-Bo meine Wohnung schenken
Zeiten ändern sich, damals hatte ich keinen Pfennig
Heute sagt mir Kay fast immer: „Leih mir mal paar Scheine Anis“
Zeit für Tennis, Zeit für Golf, Zeit für nix, Zeit zum Shoppen
EGJ, ich laufe ins Büro rein, Zeit zum Mobben
Früher war Mama bei der BäckereiHeute hat sie so viel Geld, sie könnt selber Rapper sein
Fick das Finanzamt, die Pumpgun im Wandschrank
Verdammt man, ich lade nach, mich macht dieses Saldo auf der Bank krank

[Hook]
Ich wurde von euch ausgelacht
Ihr Missgeburten habt geredet, ich hab drauf gekackt
Seid ihr Fotzen aufgewacht
Guck, ich verkaufe was, 500.000, krass
Kaufe mir 'nen Traumpalast, Zeiten ändern sich
Wer hat sich was draus gemacht
Ihr falschen Schlangen habt geredet, ich hab drauf gekackt
Ja, sie hören den Sound im Knast
Ich verkaufe was, 500.000, krass
Das hier ist mein Traumpalast
Zeiten ändern sich

[Part 2]
Ghettostory, Ghettojunge, Sonny war im Block der G
Du fragst mich: „Wie spät?“ und danach: „Shit, was kostet die?“
Früher der Asoziale, der sich reiche Mädchen sucht
Heute der Asoziale, den ein reiches Mädchen sucht
Was für La Martina, ich hatt‘ irgendeine Scheiße an
Heute lauf ich rein in meinen Kleiderschrank
Ich habe Sachen von Designern an, das war nicht immer so
Damals noch zu fünft in zwei Zimmern wohnen
Ich bin Steuerzahler, 7er mit Allrad
Meine Mutter wusste nichts, Dealen war mein Alltag
Fick auf das Gesetz, die Kohle wurde knapp
Scheiß auf Günter Jauch, ich hab die Millionen schon geknackt
Wer ich bin? King Bushido. Ich bin kein Geschäftsmann
Ersguterjunge, ich bin ein Geschäft, Mann, das sind 200.000
Und diese 200.000 Kette konnt ich einfach so kaufen

[Hook]
Ich wurde von euch ausgelacht
Ihr Missgeburten habt geredet, ich hab drauf gekackt
Seid ihr Fotzen aufgewacht
Guck, ich verkaufe was, 500.000, krass
Kaufe mir 'nen Traumpalast, Zeiten ändern sich
Wer hat sich was draus gemacht
Ihr falschen Schlangen habt geredet, ich hab drauf gekackt
Ja, sie hören den Sound im Knast
Ich verkaufe was, 500.000, krass
Das hier ist mein Traumpalast
Zeiten ändern sich

[Part 3]
Ghettostory, Ghettojunge, kriminelles Blut
Das ist meine Attitüde und nicht irgendein Versuch
Ich hab einfach Bock darauf gehabt
Ich hab den Dreck in meinen Kofferraum gepackt
Und diesen Stoff verkauft bei Nacht
Guck unter dein Kopfkissen, 10.000 Euro
Doch bevor ich geh, werd ich noch deinen Kopf küssen
Ich denk zurück und ja, es lohnte sich hier drauf zu warten
Ich hab ein Haus und Garten, 10.000 verkaufte Karten. Yeah!
Wie konnt ich ahnen, was heute so passiert
Und ich dachte nie, dass ich dadurch Freunde so verlier
Das ist meine Denkweise. Wer will diskutieren
Ich seh rot und komme mit der Herde wie ein Stier
Immer noch derselbe, heute wird nur ausgepackt
Ich wollte nie in euer Bild passen, ich hab drauf gekackt
Und was ihr redet interessiert diesen Gangster nicht
Alle Preise abgeräumt
Zeiten ändern sich

[Hook]
Ich wurde von euch ausgelacht
Ihr Missgeburten habt geredet, ich hab drauf gekackt
Seid ihr Fotzen aufgewacht
Guck, ich verkaufe was, 500.000, krass
Kaufe mir 'nen Traumpalast, Zeiten ändern sich
Wer hat sich was draus gemacht
Ihr falschen Schlangen habt geredet, ich hab drauf gekackt
Ja, sie hören den Sound im Knast
Ich verkaufe was, 500.000, krass
Das hier ist mein Traumpalast
Zeiten ändern sich","https://genius.com/Bushido-zeiten-andern-sich-lyrics","Released August 31, 2007
Distribution

    
      Sony BMG
Copyright ©

    
      ersguterjunge
Phonographic Copyright <U+2117>

    
      ersguterjunge
Artwork

    
      Ben Baumgarten
Photography

    
      Mat Hennek
Label

    
      ersguterjunge
Featuring

    
      Chakuza, Kay One, Nyze & 2 more
Producers

    
      Auditory, Bazzazian, Beatlefield & 8 more
Writers

    
      Bushido, Chakuza, Kay One & 3 more
Bass

    
      Markus Runzheimer
Copyright ©

    
      ersguterjunge"
"10","Bushido","Gibt es dich?","7","[Strophe 1]
Ich hörte von den meisten Frauen, ich hab es nicht ernst gemeint
Von den meisten Frauen, ich hätte ein Herz aus Stein
Wie kann ein Mann Schmerzen zeigen wenn er gar nichts fühlt?
Bei einer Schlampe wird ein Mann doch automatisch kühl
Bis jetzt hab ich mich nur einmal verliebtSogar das war einmal zu viel!
Ich scheiße auf das Spiel, ich bin nicht dafür geschaffen
Es tut mir leid!
Deine Frau geht fremd? Du bist ein Hund
Wenn du verzeihst!
Ich bin wählerisch. Nein, ich versteh nur nicht
Warum heutzutage keine Frau was auf die Ehre gibt
Ich will nur Eine die mich respektiert
Die weiß, dass Freundschaft zwischen Mann und Frau nicht existiert
Die nicht fremd geht, Flirten ist schon Fremdgehen
Nur ein Blick reicht und ich lasse diesen Menschen stehen
Es war ein Fehler diese Frau zu suchen
Diesen Engel unter 1000 Huren
Und jetzt frag ich mich:


[Refrain]
Gibt es dich?
Ich bin allein und jetzt fickt es mich
Weil ich mir täglich diese Frage stelle
Gibt es dich?
Gibt es dich?
Ich weiß
Du glaubst mir die Geschichte nicht
Ich such dich schon mein Leben lang
Sag, gibt es dich?
Gibt es dich?
Ich bin allein und jetzt fickt es mich
Weil ich mir täglich diese Frage stelle
Gibt es dich?
Gibt es dich?
Ich weiß
Du glaubst mir die Geschichte nicht
Ich such dich schon mein Leben lang
Sag, gibt es dich?


[Strophe 2]
Gibt es dich? Eine die zufrieden ist mit mir
Falls ich dich je finden sollte, dann verriegel ich die Tür!
Eine Frau die keine Disko braucht
Wo nicht mal ein Idiot sagen kann: Ich hab sie gefickt, die Frau
Keine MySpace Schlampe, die sind alle gleich
Es reicht schon wenn ich sag: Hier mein 7er, steig ein!
Ich geb dir jetzt ein Beispiel:
Sie meint,dass sie auf jeden Typen scheißt? Warum hat sie dann Minirock und Highheels?
Der man trauen kann weil man einfach keine Scheiße hört
Die es nicht nötig hat auf jeden Scheiß zu schwören
Wo ich ganz genau weiß; Reißt sie heute jemand anders auf?
Nein! Meine Frau! Sie ist daheim!
Eine,die mit mir im Kino wär
Ich mein im Kino wär
Auch wenn ich nicht dieser Bushido wär
Und glaub mir echt: Es war ein Fehler, diese Frau zu suchen
Diesen Engel unter 1000 Huren
Und jetzt frag ich dich:

[Refrain]
Gibt es dich?
Ich bin allein und jetzt fickt es mich
Weil ich mir täglich diese Frage stelle
Gibt es dich?
Gibt es dich?
Ich weiß
Du glaubst mir die Geschichte nicht
Ich such dich schon mein Leben lang
Sag, gibt es dich?
Gibt es dich?
Ich bin allein und jetzt fickt es mich
Weil ich mir täglich diese Frage stelle
Gibt es dich?
Gibt es dich?
Ich weiß
Du glaubst mir die Geschichte nicht
Ich such dich schon mein Leben lang
Sag, gibt es dich?


[Strophe 3]
Eine bei der ich stolz sagen kann: 'Sie ist schwanger.'
Bei der ich sagen kann: 'Ich bin mit ihr zufrieden, Mama.'
Ich fühl mich gut bei ihr und spüre die Geborgenheit
Und mich nicht fragen muss mit wem sie es wohl morgen treibt
Die bei mir bleibt, die zu ihrem Chef sagt:
""Mein Freund ist der Grund Warum ich auf den Termin pfeif""
Du bist Karrierefrau, dann reise um die Welt
Genieß deinen eigenen Urlaub von deinem eigenen Geld
Eine Bei der ich nie mehr fragen müsste: 'Gibt es dich?'
Weil ich sie gefunden hätte. Im Moment fickt es mich
Und die nicht gutgläubig mit dem besten Kumpel chillt
Männer sind schwanzgesteuert! Merkst du was dein Kumpel will?
Du siehst doch wie sie sich mit 16 schon aufstylen
Am Wochenende, Party, Alkohol, drauf sein
Es war ein Fehler diese Frau zu suchen
Diesen Engel unter 1000 Huren
Und zum letzten Mal:


[Refrain]
Gibt es dich?
Ich bin allein und jetzt fickt es mich
Weil ich mir täglich diese Frage stelle
Gibt es dich?
Gibt es dich?
Ich weiß
Du glaubst mir die Geschichte nicht
Ich such dich schon mein Leben lang
Sag, gibt es dich?
Gibt es dich?
Ich bin allein und jetzt fickt es mich
Weil ich mir täglich diese Frage stelle
Gibt es dich?
Gibt es dich?
Ich weiß
Du glaubst mir die Geschichte nicht
Ich such dich schon mein Leben lang
Sag, gibt es dich?","https://genius.com/Bushido-gibt-es-dich-lyrics","Released August 31, 2007
Distribution

    
      Sony BMG
Copyright ©

    
      ersguterjunge
Phonographic Copyright <U+2117>

    
      ersguterjunge
Artwork

    
      Ben Baumgarten
Photography

    
      Mat Hennek
Label

    
      ersguterjunge
Featuring

    
      Chakuza, Kay One, Nyze & 2 more
Producers

    
      Auditory, Bazzazian, Beatlefield & 8 more
Writers

    
      Bushido, Chakuza, Kay One & 3 more
Bass

    
      Markus Runzheimer
Copyright ©

    
      ersguterjunge"
"11","Bushido","Keine Sonne","7","[Verse 1:Bushido& Kay One]
Ich lade nach, ich bleibe kriminell, gefährlich und ein Außenseiter
Ich schlag die Steine jetzt zu Staub, ich verkauf es einfach
Glaub mir, ich gebe einen Scheiß darauf du schwuler Stricher
Soll das ein Scherz sein, du kugelsicherer Jugendlicher?
Ich bleib der King auf dem Pausenhof in deinem Block
Pausenlos im iPod, draußen fick ich deinen Kopf
Ich bin asozial wie keiner, gib die Basy, Kay
Ich lass deine teure Uhr verschwinden so wie David Blaine
Lass es ruhig zwölf werden, ich komm zum Streetfight
Und ich sag es offiziell, Samy kann nicht freestylen
Ich fick das ganze Land, weil keiner dran geglaubt hat
Keiner, nurdieser Junge aus der Hauptstadt
Ich lach mich tot, was, du boxt jeden Rapper um?
Ich boxe dich, das Gesocks und die Rapper,Punkt
Ich tret' alleine mit den Thaiboxern auf
Bitte sag mir endlich,wann wacht ihr scheiß Fotzen auf?

[Hook:Bushido& Kay One]
Diese Nacht, dieses Leben, diese Bullen, diese Gegend
Keine Sonne, zu viel Regen, ich hab Kopfschmerzen
Dieser Schatten, diese Tränen, diese Aggression in jedem
Und ich krieg von diesem scheiß GelaberKopfschmerzen
Spür' den Hass, keine Regeln, diese Nutten, die hier kleben
Jeder Tag ist grau, scheiße, so viel Kopfschmerzen
Dieser Schatten, dieser Zorn, gewaltbereit, ich hab was vor
Und ich krieg' von deiner Fresse immer Kopfschmerzen

[Verse 2:Bushido& Kay One]
Vor 2 Jahren hab ich gesagt, es soll verrecken, das SplashKaum zu glauben, wenig später hieß es „Rettet das Splash!“
Man wird sind nicht bei Vendetta, das hier ist nicht Carlo CokxxIch muss dich erziehen, Junge, das hier ist Guantanamo
Ich zeig dir mein Milieu, scheiß auf deine Fremdsprachen
Schwarze Lederjackensind bei uns im Sommer Trendfarben
Trendfarben, scheiß auf deine Pressekonferenz
Sag wie hieß der eine Rapper da?Bässe Sultan Hengzt?Schon vergessen! Interessiert mich nicht!Mich interessiert nur was ich kann, was ich hab, wo ich bin und ob der Beef mich fickt
Ich fick dein Leben Junge, du hast null Persönlichkeit
Du hast ein Label, aber Geld hast du womöglich keins
So viel zu dem Ghetto hier,Oberkörper tätowiert
Geld, Drogen, Sex und für Kay noch mal den Jacky, yeah
Ihr habt euch zu 'nem Missgeburten vereint
Deswegen passt auch die Bezeichnung „Missgeburtenverein“

[Hook: Bushido & Kay One]
Diese Nacht, dieses Leben, diese Bullen, diese Gegend
Keine Sonne, zu viel Regen, ich hab Kopfschmerzen
Dieser Schatten, diese Tränen, diese Aggression in jedem
Und ich krieg von diesem scheiß Gelaber KopfschmerzenSpür' den Hass, keine Regeln, diese Nutten, die hier kleben
Jeder Tag ist grau, scheiße, so viel Kopfschmerzen
Dieser Schatten, dieser Zorn, gewaltbereit, ich hab was vor
Und ich krieg' von deiner Fresse immer Kopfschmerzen

[Verse 3: Bushido & Kay One]
Ich behandle euch wie Drecksnutten, so wie im KiezJedes Video wird gespielt, das Mafiosi PrinzipSonny Black, in meinem alter passiert mehrFresse Junge, du bist mir zu alternativ (yeah!)Yeah, es wird dunkel wenn ich durch mein Viertel laufProgrammier' die Kick, du willst tanzen und du Krüppel bouncedScheiß auf dich, dein Abitur, ich fick den UnterrichtErste Stunde und ich bleibe der, der deine Mutter fickt
Kriminell, 22, sag mir was der Richter will
After-Party, yeah, ich geh raus und fick mit Bill
Bring mir ein Rapper, der es schafft mit mir zu ficken
Red' mal deutsch, Hundesohn, ich halt nich viel vom Spitten
Scheiß auf dich, das ist Gangster wie Carlito's Way
Provozier' die Bullen, gib bei YouTube ein: ""Bushido Kay""
Schlampe ich hab für dein Storytelling wenig Zeit
Guck ich hab jetzt offiziell mit jedem Streit

[Hook: Bushido & Kay One]
Diese Nacht, dieses Leben, diese Bullen, diese Gegend
Keine Sonne, zu viel Regen, ich hab Kopfschmerzen
Dieser Schatten, diese Tränen, diese Aggression in jedem
Und ich krieg von diesem scheiß Gelaber KopfschmerzenSpür' den Hass, keine Regeln, diese Nutten, die hier kleben
Jeder Tag ist grau, scheiße, so viel Kopfschmerzen
Dieser Schatten, dieser Zorn, gewaltbereit, ich hab was vor
Und ich krieg' von deiner Fresse immer Kopfschmerzen","https://genius.com/Bushido-keine-sonne-lyrics","Released August 31, 2007
Distribution

    
      Sony BMG
Copyright ©

    
      ersguterjunge
Phonographic Copyright <U+2117>

    
      ersguterjunge
Artwork

    
      Ben Baumgarten
Photography

    
      Mat Hennek
Label

    
      ersguterjunge
Featuring

    
      Chakuza, Kay One, Nyze & 2 more
Producers

    
      Auditory, Bazzazian, Beatlefield & 8 more
Writers

    
      Bushido, Chakuza, Kay One & 3 more
Bass

    
      Markus Runzheimer
Copyright ©

    
      ersguterjunge"
