"","artist","title","album","text","url","metadata"
"8","Fler","Businessman","Neue deutsche welle 2","[Produced by Therapy]Back to the Future!

[Pre-Hook: Fler]
Du willst an mein Geld, fick mal deine Mama
Alles faule Schweine hier, ich mach meine Para
Fahre mit dem Beamer, komm mal in die Gänge
Ich mach lila Scheine, und davon jede Menge

[Hook: Fler]
Yeah, ich lass keinen an mein Business ran
Keine neuen Freunde mehr, ich bin jetzt ein Businessmann, ah
Bei mir läuft, Junge, bei mir läuft, Junge
Bei mir läuft, Junge, bei mir läuft, Junge
Yeah, ich lass keinen an mein Business ran
Keine neuen Freunde mehr, ich bin jetzt ein Businessmann, ah
Bei mir läuft, Junge, bei mir läuft, Junge
Bei mir läuft, Junge, bei mir läuft, Junge

[Strophe 1: Jihad]
Yeah... Yeah!
Jihad ist ein Businessmann, breit gebaut
Dieser Kanack - meine Frau, geile Sau
Deutschland ist befallen von der Kanackenplage
Für Angelika bin ich nur 'ne Kakerlake
Vielleicht hatt' ich damals viel zu wenig
Vielleicht bin ich deswegen ein wenig überheblich
Dicke Autos, dünne Frauen, primitiver geht nicht
Komme von ganz, ganz unten, glaub mir, tiefer geht nicht
Auch ein Jihad lebt nicht sorgenfreiWie bekomm' ich bloß die neongelben Jordan 3?
Ich hab' sie alle weggefickt - MotherfuckMein Handy klingelt durchgehend am Vatertag
Dieser Majoe, er reicht mir bis zum SchienbeinDu könntest original der Schauspieler von E.T. seinAuf jeden Fall passt du in so ein scheiß Kostüm rein
Deswegen sei mal nicht so frech

[Pre-Hook: Fler]
Du willst an mein Geld, fick mal deine Mama
Alles faule Schweine hier, ich mach meine Para
Fahre mit dem Beamer, komm mal in die Gänge
Ich mach lila Scheine, und davon jede Menge

[Hook: Fler]
Yeah, ich lass keinen an mein Business ran
Keine neuen Freunde mehr, ich bin jetzt ein Businessmann, ah
Bei mir läuft, Junge, bei mir läuft, Junge
Bei mir läuft, Junge, bei mir läuft, Junge
Yeah, ich lass keinen an mein Business ran
Keine neuen Freunde mehr, ich bin jetzt ein Businessmann, ah
Bei mir läuft, Junge, bei mir läuft, Junge
Bei mir läuft, Junge, bei mir läuft, Junge

[Strophe 2: Fler]
Yeah!
Jeder will nur an dein Geld, sie beißen wie Piranha
Bestelle den Champagner und spuck ihn an dein Tanga
Ich komm aus Südberlin, ihr kleinen Stricher seid nur Touries
Ein Massaker, wir schießen auf Schwulis mit den Uzis
Du bist nicht mein Kaliber, bist nicht in meiner Liga
Ich bin attraktiver, von mir aus primitiver
Wegen mir geht deutscher Rap jeden Tag ins Fitnessstudio40 Kilo Kurzhanteln, Schultern, was drückst du so?
Ich mach MMA, komm, wir treffen uns im KäfigMit dir Bastard kämpfe ich eh nicht, denn du Fettsack bist zu eklig
Check mein Instagram, ich bin schöner als die SzeneAlles, meine Haut, meine Haare, meine Zähne
Maskuline Gene, du bist eine Schlampe
Transformation verwandelt zu 'ner Transe
Keine neuen Freunde, ich sag' es so wie Drake
Ich chill nur mit Jihad und wir beide zählen Geld, Mutterficker

[Pre-Hook: Fler]
Du willst an mein Geld, fick mal deine Mama
Alles faule Schweine hier, ich mach meine Para
Fahre mit dem Beamer, komm mal in die Gänge
Ich mach lila Scheine, und davon jede Menge

[Hook: Fler]
Yeah, ich lass keinen an mein Business ran
Keine neuen Freunde mehr, ich bin jetzt ein Businessmann, ah
Bei mir läuft, Junge, bei mir läuft, Junge
Bei mir läuft, Junge, bei mir läuft, Junge
Yeah, ich lass keinen an mein Business ran
Keine neuen Freunde mehr, ich bin jetzt ein Businessmann, ah
Bei mir läuft, Junge, bei mir läuft, Junge
Bei mir läuft, Junge, bei mir läuft, Junge","https://genius.com/Fler-businessman-lyrics","Released September 5, 2014
Distributor

    
      Sony Music Entertainment Germany
Phonographic Copyright ℗

    
      Maskulin
Copyright ©

    
      Maskulin
Photography

    
      Katja Kuhl
Artwork

    
      ADOPEKID
Label

    
      Maskulin
Featuring

    
      Sentino, Shen, Shizoe & 1 more
Producers

    
      Brisk Fingaz, Fler, Iad Aslan & 2 more
Writers

    
      Brisk Fingaz, Fler, Iad Aslan & 6 more
Artwork

    
      ADOPEKID
Composer

    
      Brisk Fingaz, Iad Aslan, Sascha Kunstmann & 1 more"
"9","Fler","Junge mit Charakter","Neue deutsche welle 2","[Produced by Brisk Fingaz; co-produced by Fler]

Schau dich um, alles was du siehst ist dein ProblemEs ist nicht meine Schuld, dass es nicht lief in deinem Leben
Damals fing es an mit Anis rappen - Rap presenten
Doch mein Mentor hatte plötzlich Kon­kur­renz­den­kenIch hab es nie verstanden, warum warst du so ängstlich?Wir hätten jeden ficken können, CCN unendlichIch hab es akzeptiert, du warst kein AnführerDu tauschtest unsre Träume ein für ein paar Clan-Brüder
Du hast mich verraten doch nanntest mich ""Flerräter""
Dir zu vertrauen, war damals schon ein Rie­sen­feh­ler
Und auf einmal stehen die Gangster vor der HaustürIn dem Moment, wo ich meine Freundin ausführ
Ihr überschreitet Grenzen, die Freundin, sie ist heiligUnd dass ihr mich jetzt eine Snitch nennt, ist ziemlich peinlichWär ich eine Snitch, hätt ich Anis angezeigt
Weißt du noch bei MTV? Egal, das ist Vergangenheit
Denn ich stieg auf, wie Phönix aus der AscheMit Beko, mit Umut und 'paar Kröten in der Tasche
Ich holte Silla weg von Orgi, dann kam SBMDenn I Luv Money Records war einfach nicht effizient
Silla hat Talent, aus Silla kann was werden
Er musste aufhörn' zu saufen, um nicht dran zu sterben
Ich ging zu Groove Attack, ich hab 'n Deal, er hat 'n Deal
Ich lasse Taten sprechen, andre Rapper quatschen viel
Keiner wollte G-Hot eine Chance geb'nDarum musst' ich G-Hot eine Chance geb'n
In dieser Zeit kam' sie alle bei mir angestrichertSowie Motrip, Nicone und hundert and're Pisser
Das war die Zeit, wo Beko in den Club ging
Gemeinsam unterwegs, ich liebte dieses Club-Ding
Dann kam der Streit und ich sollte mich entscheiden
Musste mich entscheiden zwischen diesen beiden Seiten
Ihr könnt euch denken, wie oft bei mir die Kripo war
Und mir erzählte, dass der Anschlag von Bushido kam
Ich meinte nur ich verweigere die AussageUnd lief dann weiter, alleine auf der Hauptstraße
Dann rief Bushido an, wollte wieder Bruder sein
Arafat wollte mich bei Ersguterjunge sign'
Ich sagte nein, zwei Alben und dann geh ich wieder
Sido disste mich, es wurde immer negativer
Ich wollte helfen, machte für Bushido Beats klarUnd Djorkaeff, er war so unloyal wie Beatzarre
Auf einmal war's so anstrengend mit Flizzy Fler
Und diese ""Freunde"" taten so als wenn sie busy wären
Ich stellte Gan-G ein und gründete ein Label
Und auch wegen Bushido ist er heute nicht der­sel­be
Dann nahm ich Reason, als Manager im Psalm-Store
Er wollte Rapper sein, ich streckte ihm Gehalt vor
Doch er beklaute mich, ich stellte Umut ein
Und heute stellt Nicone irgendwas bei Youtube rein?Was du laberst nehm' ich nich für bare MünzeHun­dert­tau­send Blutsauger, ja du bist der schlimmsteDu kleiner Parasit, du siehst behindert aus
Du bist der Junkie der im Club nach nem Fünfer schlaucht
Du warst mein Fahrer, mein Bimbo, mein Getränkehalter
Du hast 'ne Tochter, doch du kokst bis ins Rentenalter
Ihr wart am lästern, Nicone über G-Hot
Nicone diese Biatch, jetzt fährst du wieder Fiat
Du weißt genau, was ich für dich getan habe
Ich werd' dich knechten - Erzieherische Maßnahme
Und jetzt zu Animus, du hast auf meiner Couch gepennt
Du machst auf intellektuell mit deinen Tausend Fans
Du bist kein Ehrenmann - Fame Bitch Animus
Im Artemis kommst du Schlaffi nich' zum Samenerguss
Ich hab dich hingestellt und hab dich angezogen
Doch du kleine Stricher-Schlampe hast mich dann betrogen
Du warst nie bei Maskulin gesigned Nutte
Du bist kein Rocker, ich fick dich auch allein Nutte
Ich machte Mixtapes um dich zu unterstützen
Und als Dank lästerst du jetzt hinter meinem Rücken
Ich nahm dich mit nach Paris zum Videodreh
So ein Luxusleben hast du vorher nie gesehen
Es kam von Herzen doch du fühltest dich herab gesetzt
In den Boutiquen war nie was herab gesetzt
Und diese Katja, kann blasen diese Fettsau
Sie macht sich wichtig obwohl keiner ihren Dreck braucht
Scheiß auf Bruce, auf Produes und auf Boris
Und diese Katja geht ins Kit Kat und macht Bondage
Ich rap das hier, dass jeder jetzt die Wahrheit weiß
Ihr faulen Schweine wusstet nie was echte Arbeit heißt
Jetzt komm' die Ratten aus den Löchern bei RapUpdate
Und dieser Congo, der die Wahrheit dann im Netz verdreht
In was für einer Scheiße ich hier lebe
Keiner hat mehr Anstand oder Ehre
Ich hab 99 andere Probleme, weil ich mit dem LKA nicht rede
Und Bushido wollte CCN mit Haft machenFür dich is' CCN 'ne Bitch, du schickst sie anschaffen
Jetzt komm' die Deutsch-Rapper, jeder macht auf Bruderschaft
Hüpft auf Schwänze, euer Arschloch ist ein U-Bahnschacht
Ich mach Urlaub in Miami auf dem Jet-Ski
Man es wird Zeit, dass diese Szene mir Respekt gibt
Ich hab gehört, Farid macht jetzt Urlaub da
Heute Bang, früher war nur Urlaub da
Du hast schon Schellen von Berlinern kassiert
Und kannst sicher gehen, dass es morgen wieder passiert (Yeah)
Farid hatte Glück mit seiner Marktlücke.. Idiotenrap für Hartz-Krüppel
Du willst boxen? Spiel mal lieber Basketball
Du siehst aus wie ein Rentner nach dem Schlaganfall
Und wenn ich mit dir fertig bin hilft auch kein Tapout
Ich steck dir Möhren in den Arsch, bis zum Black Out
Du nennst mich Hurensohn? Dann kennst du meine Mutter nich'
Ich spritze deine Schlampe an mit meiner Buttermilch
Und dieser Toony denkt wirklich er wird morgen was?
Du musst nur Fler dissen, Farid hat es vor gemacht
Du musst Schauspieler sein sowie Felix Blume
Sowie Felix Blume, eine Edel-HureDu siehst aus wie ein Kinder-Ficker, scheiß Student
Ich schieß' auf dich, deine Uni und dein' scheiß Dozent
Schau dich an Junge, du bist nur ein schwuler Boss
Du halbes Hemd, fährst du Fahrrad bei der Tour de France?
Ihr ganzen Opfer trainiert nur wegen Frank White
Rappt nur wegen Frank White, doch keiner ist wie Frank White
Seitdem wir da sind, seid ihr alle Bodybuilder
Doch ihr habt Style, ihr Pickel-Kinder auf den Party-Bildern
Diese Rapper sind für dieses Land hier maßgeschneidert
Möchtegern-Großstadtkiddies in der Straßen-Einfahrt
Eure eignen' Fans sind bereits am haten
Jetzt seid ihr rich Kids und seid nicht mehr dieselben
Die Anzahl meiner Neider ist mein Bankkonto
Du bist nur ein Spast Congo
Warum peilt keiner hier was Rap ist?Oder Timing, oder Groove oder was Trap ist?
Warum bin ich als Deutscher in der Minderheit?
Warum machen Gangster-Rapper heimlich bei mir Klingelstreich?
Warum gibt es keine echten Freunde?
Und warum schiebt die Welle dieser Deutsche?
Jeder will ein Star sein, um jeden PreisDoch weiß nicht was ""ein Star sein"" im Leben heißt
Ich drehte Videos mit Rockern - Residenzstraße
Ein guter Rücken in Berlin ist ExistenzfrageDenn nach Bushido muss jeder eine Gang habenIhr könnt mal gerne Farid Bang fragen
Was wollt ihr mir erzählen? Ich war mein Leben lang alleine
Ohne Rücken oder irgendeine andre Scheiße
Ich bin der Deutsche und ich geh den harten Weg
Du wirst kein' zweiten wie mich jemals auf der Straße sehen
Man bin ich froh, dass es mit uns nich geklappt hat
Doch scheißegal, ich bin der Junge mit Charakter","https://genius.com/Fler-junge-mit-charakter-lyrics","Released September 5, 2014
Distributor

    
      Sony Music Entertainment Germany
Phonographic Copyright ℗

    
      Maskulin
Copyright ©

    
      Maskulin
Photography

    
      Katja Kuhl
Artwork

    
      ADOPEKID
Label

    
      Maskulin
Featuring

    
      Sentino, Shen, Shizoe & 1 more
Producers

    
      Brisk Fingaz, Fler, Iad Aslan & 2 more
Writers

    
      Brisk Fingaz, Fler, Iad Aslan & 6 more
Artwork

    
      ADOPEKID
Composer

    
      Brisk Fingaz, Iad Aslan, Sascha Kunstmann & 1 more"
"10","Fler","Drogen, Nutten und Cash","Neue deutsche welle 2","[Songtext zu „Drogen, Nutten und Cash“ ft. Sentino]

[Produced by Therapy]

[Intro: Sentence]
Yeah
Maskulin, Nutte
Yeah
Flizzy, was los?
Und scheiß mal richtig auf diese ganzen Opfer, Alter!
Yeah

[Part 1: Sentence]
500.000 jährlich, Digga, Pi mal Daumen, Mann
Wenn du was hast, musst du sie füttern, dann kommen viel mehr Frauen an
Die Fotzen sind doch eh nur da, wenn's was umsonst gibt
Roederer Cristal, Bitch, nur weil du blond bist
Du kannst die Falten spritzen, aber nicht dein Brain
Sie können mir alles wegnehmen, aber nicht mein' Fame
Ich mach die Scheine easy, alles kommt und geht
Heute Bonze, morgen Konto leer, null Bonität
Achterbahn, mein Leben war ein Auf und Ab
Digitalwaage, Gangster sein geht auf den Sack
Hallo, Herr Staatsanwalt, ich wollte nur mein Leben ändern
Wurde dann gesucht in BRD und EU-Ländern
Lamborghini Flow, Nutte, fick dein' Panamera
Schlampen wollen, dass ich sie ficke, wie ein Salsa-Lehrer
Deine Alte kommt besoffen an mit Kotzaroma
Ich sitz im Pascha , VIP mit Gangstern, Osteuropa

[Hook]
Drogen, Nutten und CashDrogen, Nutten und CashAlles, was ich im Leben wollte, war Drogen, Nutten und Cash
Drogen, Nutten und CashDrogen, Nutten und CashAlles, was ich im Leben wollte, war Drogen, Nutten und Cash
Drogen, Nutten und CashDrogen, Nutten und CashAlles, was ich im Leben wollte, war Drogen, Nutten und Cash
Drogen, Nutten und CashDrogen, Nutten und CashAlles, was ich im Leben wollte, war Drogen, Nutten und Cash

[Part 2: Fler]
Schuhe Prada, Sonnenbrille: Marc Jacobs
Schwarzes Outfit, Nutte, nenn mich Darth Vader
Dieser Lifestyle bringt einen oft zur Weißglut
Ich schlag den Club kaputt tritt jemand auf mein' Nike-Schuh
Ralph Lauren, Alphagen, wenn ich Knarre zieh
Farid Bang, er rennt weg, verbrennt KalorienKeine Halluzination, das ist Realität
Mein ganzes Leben am Rande der Legalität
Du siehst mehr aus nach Jenifer als Lopez
Day Date, President, 18-Karat-Rolex
Ich komm aus der Zukunft, Schwarzenegger, Terminator
Für meine Lederjacke starb ein Alligator
Du wolltest maskulin sein aber wirst zur Frau
Mit deinen Bitch Tits, schau dich an, du Zirkusclown
Alles, was ich im Leben wollte: Carlo Cokxxx NuttenDoch ohne dich, jetzt kannst du Opfer zu mir hochgucken

[Hook]
Drogen, Nutten und CashDrogen, Nutten und CashAlles, was ich im Leben wollte, war Drogen, Nutten und Cash
Drogen, Nutten und CashDrogen, Nutten und CashAlles, was ich im Leben wollte, war Drogen, Nutten und Cash
Drogen, Nutten und CashDrogen, Nutten und CashAlles, was ich im Leben wollte, war Drogen, Nutten und Cash
Drogen, Nutten und CashDrogen, Nutten und CashAlles, was ich im Leben wollte, war Drogen, Nutten und Cash","https://genius.com/Fler-drogen-nutten-und-cash-lyrics","Released September 5, 2014
Distributor

    
      Sony Music Entertainment Germany
Phonographic Copyright ℗

    
      Maskulin
Copyright ©

    
      Maskulin
Photography

    
      Katja Kuhl
Artwork

    
      ADOPEKID
Label

    
      Maskulin
Featuring

    
      Sentino, Shen, Shizoe & 1 more
Producers

    
      Brisk Fingaz, Fler, Iad Aslan & 2 more
Writers

    
      Brisk Fingaz, Fler, Iad Aslan & 6 more
Artwork

    
      ADOPEKID
Composer

    
      Brisk Fingaz, Iad Aslan, Sascha Kunstmann & 1 more"
"11","Fler","Level","Neue deutsche welle 2","[Produced by Therapy]

[Hook: Fler]
Mein Auto hat Flügel wie ein Engel, ahIhr seid nicht auf meinem Level, ah
Ich bin die Neue Deutsche Welle, ah
Ihr seid nicht auf meinem Level, ah
Level, Level, Level, Level, Level, Level
Ihr seid nicht auf meinem
Level, Level, Level, Level, Level, Level
Ihr seid nicht auf meinem

[Strophe 1: Fler]
Gottverdammten Level, ich bin ein G
Gangsterrapper, kein Rappergangster, bin MC
Und euer Rotlicht ist wie Berlins Graffitiszene
Man, du bist Hippie-Szene, schau dich an - MC Fitti-Gene
Deutschrap landet in der Notaufnahme
Maskulin-Streetwear - Modebranche
SLS, McLarenFlügel wie ein Engel, fick dein Rapbattle
Easy Flizzy, busy busy
Du bist nicht 50, bei mir gibts kein Fifty-Fifty
In meiner Gegend habt ihr Rapper ParanoiaEs geht klick, klack, brrrt, bang, wenn ich ein paar Mal feuer, Junge
Bodenständig, Streetlife
Maskulin, Timberlands, Levi's
7er, Facelift, ich park ihn
Die Scheiben schwarz, das Auto weiß, ich bin kein Nazi

[Hook: Fler]
Mein Auto hat Flügel wie ein Engel, ahIhr seid nicht auf meinem Level, ah
Ich bin die Neue Deutsche Welle, ah
Ihr seid nicht auf meinem Level, ah
Level, Level, Level, Level, Level, Level
Ihr seid nicht auf meinem
Level, Level, Level, Level, Level, Level
Ihr seid nicht auf meinem

[Strophe 2: Fler]
Gottverdammten Level - Endgegner
Im Ghetto kennt mich jeder - Elektrofensterheber
Damals war ich obdachlos, ein Waisenkind
Das ist kein Storytelling, jeder weiß, die Scheiße stimmtDoch ich mache weiter, Junge, shit happensSag dir ins Gesicht: Du bist jetzt gefickt, Anis!
Schreib' das beste Album, was es jemals gab
Bin fresher als die meisten Kiddies - Peter Pan
Courvoisier XO
Ich bin nicht Silla, doch mach Panik in der Disco
Wer von euch hält mit, wenn ich shoppen geh'Gebe meine Kohle aus, jeden Tag im KaDeWe
Anderes Level, kenn' kein Limit
Kontolimit, Tempolimit
Du hörst hier Schüsse - keine Vögel, die hier zwitschern
Jeder macht auf Street, doch fängt vor mir an zu flüstern

[Hook: Fler]
Mein Auto hat Flügel wie ein Engel, ahIhr seid nicht auf meinem Level, ah
Ich bin die Neue Deutsche Welle, ah
Ihr seid nicht auf meinem Level, ah
Level, Level, Level, Level, Level, Level
Ihr seid nicht auf meinem
Level, Level, Level, Level, Level, Level
Ihr seid nicht auf meinem","https://genius.com/Fler-level-lyrics","Released September 5, 2014
Distributor

    
      Sony Music Entertainment Germany
Phonographic Copyright ℗

    
      Maskulin
Copyright ©

    
      Maskulin
Photography

    
      Katja Kuhl
Artwork

    
      ADOPEKID
Label

    
      Maskulin
Featuring

    
      Sentino, Shen, Shizoe & 1 more
Producers

    
      Brisk Fingaz, Fler, Iad Aslan & 2 more
Writers

    
      Brisk Fingaz, Fler, Iad Aslan & 6 more
Artwork

    
      ADOPEKID
Composer

    
      Brisk Fingaz, Iad Aslan, Sascha Kunstmann & 1 more"
"12","Fler","Im Auge des Sturms","Neue deutsche welle 2","[Produced by Therapy]
Back to the future!

[Intro: Shizoe]
Im Auge des Sturms
Im Auge des Sturms

[Strophe 1: G-Hot]
Ich bin die Eins in dieser Gegend hier
Tempelhof, ich bin eins mit dieser Gegend hier
Wegen mir ist der Streifenbulle therapiert
Thematisiert in der Bild, die Kripo recherchiert
Durch das Auge des Sturms rollt mein Auto auf Chrom
Wir sind wie Jay Z und Kanye West, ihr schaut auf den Thron
Um mich rum alles kaputt, doch ich bleibe stabil
Ihr seid leider labil, Rapper bleiben Hartz IV
Ich hab 99 Probleme, die Schlampe ist keins
Das Leben ist schwer doch die Hantel ist leicht
Wenn Rapper vor der Tür stehen, warum klingeln sie nicht
Ich will es nicht mehr sagen, Shizoe komm und sing es für mich

[Hook: Shizoe]
Im Auge des Sturms
Zieh' ich über das Land, mit Zepter und Mic in der Hand
Im Auge des Sturms
Bin ich immer allein und das kann auch für immer so bleiben
Im Auge des Sturms
Ist der Himmel so grau, doch egal, meine Augen sind blau
Im Auge des Sturms
Wird die Welt plötzlich stumm und ihr dreht euch im Kreis um mich rum

[Strophe 2: Fler]
Meine Lederjacke wetterfestDreimal darfst du raten, wer von uns hier besser rapptSteck das Messer weg, Junge, wenn das Messer steckt
Wirst du ge-Eko-Fresht, guck es geht rattattat
Les' die Bibel nur selten, der dreiundzwanzigste Psalm
Von der Straße ins Heim, mit der Skyline allein
Check den Wetterbericht, du bist nicht besser als ich
Wenn die Karriere schon vorbei ist, warum stressen sie mich
Leute wollen mich in die Knie zwingen, doch als es schief ging
Stand ich wieder auf, für mein M-A-S-Kulin Ding
Wenn Rapper vor der Tür stehen, warum klingeln sie nicht
Ich will es nicht mehr sagen, Shizoe komm und sing es für mich

[Hook: Shizoe]
Im Auge des Sturms
Zieh' ich über das Land, mit Zepter und Mic in der Hand
Im Auge des Sturms
Bin ich immer allein und das kann auch für immer so bleiben
Im Auge des Sturms
Ist der Himmel so grau, doch egal, meine Augen sind blau
Im Auge des Sturms
Wird die Welt plötzlich stumm und ihr dreht euch im Kreis um mich rum

[Bridge: Shizoe]
Im Auge des Sturms
Oohoh, Oohoh
Im Auge des Sturms
Im Auge des Sturms (yeah)
Im Auge des Sturms (ye-ye-ye-yeah)","https://genius.com/Fler-im-auge-des-sturms-lyrics","Released September 5, 2014
Distributor

    
      Sony Music Entertainment Germany
Phonographic Copyright ℗

    
      Maskulin
Copyright ©

    
      Maskulin
Photography

    
      Katja Kuhl
Artwork

    
      ADOPEKID
Label

    
      Maskulin
Featuring

    
      Sentino, Shen, Shizoe & 1 more
Producers

    
      Brisk Fingaz, Fler, Iad Aslan & 2 more
Writers

    
      Brisk Fingaz, Fler, Iad Aslan & 6 more
Artwork

    
      ADOPEKID
Composer

    
      Brisk Fingaz, Iad Aslan, Sascha Kunstmann & 1 more"
"13","Fler","Im Ghetto kennt mich jeder","Neue deutsche welle 2","[Part 1]
Ich stehe morgens auf und weiß, was zu tun istMache mir mein Frühstück, ein Kilo ThunfischIch ziehe mich schnell an, denn ich muss zum Fitness
Trainiere nicht seit heute, nur weil es gerade In' ist
Ich laufe aus dem Haus, hab die Tupperbox dabeiJeden Tag der gleiche Scheiß, Putenbrust und Reis
Ich bin schlecht gelaunt, von dem schlechten WetterJeder glotzt mich an, denn ich bin ein RapperFahre zu McFit und lauf rein in das Studio
Hier ist wie im Urlaub: Handtücher und Jugos
Überall nur Kanaks, die die Hantelbank besetzen
Wie sie sich verletzen mit 20-Kilo Sätzen
Auf einmal geht es los, ein Kanak provoziertIch guck ihn böse an und der Kanak kollabiertSo läuft es jeden Tag, jeder stresst mein LebenIch bin nicht arrogant, doch ich rede nicht mit jedem

[Hook]
Die Kanaks, die Deutschen, der Schulhof, die Lehrer
Du weißt, man, im Ghetto kennt mich jeder
Die Politesse, die Hure, der Bulle, der Hehler
Du weißt, man, im Ghetto kennt mich jeder
Die ganzen Gangster, die Homies im Knast und der Gesa
Du weißt, man, im Ghetto kennt mich jeder
Und mein Auto Elektrofensterheber
Du weißt, man, im Ghetto kennt mich jeder

[Part 2]
Ich laufe aus McFit und stehe auf dem Parkplatz
Eine Runde Kanaks, sie sehen es auf mein Arsch ab
Dieser feige Bastard, er traut sich nicht alleine
Hater bleiben Hater, alles faule Schweine
Ich schnappe mir den Größten und gib ihm eine Faust
Er landet auf dem Asphalt und die Nutte bounced
Die anderen greifen an, ich flüchte in den Wagen
Adrenalinschub, mein Puls er ist am rasen
Ich fahre zum McDrive, erstmal Cola LightDer Verkäufer er guckt hoch, Range Rover-Style
Es gibt viel zu tun, G-Hot ruft mich an
Halbe Stunde später, dann komm ich im Studio an
Ich erzähl' ihm was passiert ist, er sagt, der Typ heißt Farid
Er kennt ihn von 'ner Party, der Bastard nennt ihn Abi
Doch jetzt wird erst gerappt, den schnappen wir uns später
Überall sind Zeugen, denn im Ghetto kennt mich jeder

[Hook]
Die Kanaks, die Deutschen, der Schulhof, die Lehrer
Du weißt, man, im Ghetto kennt mich jeder
Die Politesse, die Hure, der Bulle, der Hehler
Du weißt, man, im Ghetto kennt mich jeder
Die ganzen Gangster, die Homies im Knast und der Gesa
Du weißt, man, im Ghetto kennt mich jeder
Und mein Auto Elektrofensterheber
Du weißt, man, im Ghetto kennt mich jeder

[Part 3]
Wir warten vor dem Haus, 23 Uhr
Klettern durch das Fenster, beide auf den Flur
Der Bastard liegt im Bett, und nuckelt an seinem Daumen
Ich klatsch ihn an die Wand, yeah und die Nutte bounced
Ich häng' ihn aus den Fenster, der Typ ist schwer geschockt
""Was bist du für ne Pussy, ist doch nur der erste Stock""
Wir müssen langsam weg hier, die Nachbarn rufen Bullen
Mit einem Bein im Knast, dieser Bastard ist dran schuld
Wir jumpen vom Balkon, und botten in den Park
Der Hurensohn, er weiß ab jetzt, dass niemand mich verarscht
Auf einmal geht es los, die Bullen haben nur gewartet
Sie schlagen uns zusammen und wir liegen auf dem Rasen
Die Fresse ist am Bluten, die Zukunft ist im Arsch
Der Richter gibt 3 Jahre, dieser Bastard nimmt uns Maß
Auf einmal wach ich auf, und weis was zu tun ist
Mache mir mein Frühstück, ein Kilo Thunfisch
Ich laufe aus dem Haus, denn ich muss zum Fitness
Trainiere nicht seit heute, nur weil es gerade in ist
So läuft es jeden Tag, jeder stresst mein Leben
Ich bin nicht arrogant, doch ich rede nicht mit jedem","https://genius.com/Fler-im-ghetto-kennt-mich-jeder-lyrics","Released September 5, 2014
Distributor

    
      Sony Music Entertainment Germany
Phonographic Copyright ℗

    
      Maskulin
Copyright ©

    
      Maskulin
Photography

    
      Katja Kuhl
Artwork

    
      ADOPEKID
Label

    
      Maskulin
Featuring

    
      Sentino, Shen, Shizoe & 1 more
Producers

    
      Brisk Fingaz, Fler, Iad Aslan & 2 more
Writers

    
      Brisk Fingaz, Fler, Iad Aslan & 6 more
Artwork

    
      ADOPEKID
Composer

    
      Brisk Fingaz, Iad Aslan, Sascha Kunstmann & 1 more"
