"";"artist";"title";"album";"text";"url";"metadata"
"1";"Beginner";"Das Boot";"Bambule";"[Intro]
Nächste Station: St. Pauli Landungsbrücken - und da gibt's dann Bambule

[Part 1 - Eißfeldt]
Sie sagen, es kommt die Zeit, in der die Pole schmelzenSich Riesenwassermassen über Küstenstädte wälzen
Ich kenne das, ich hab' das schon mal erlebt, MannFlutwellen von SondermülltonträgernViele Ohren haben sie in den Tod gerissenAber wir konnten uns gerade noch in 'nem Boot verpissenTrieben umher auf dem Meer voller MüllFragten uns, wer denn noch mehr hören willBrauchten Segel zum setzen, aber hatten keinerlei LeinentücherRissen die besten von unser'n Texten aus den Reimbüchern
Und taten es die Flauten fordern
Den fetten S-750 als Außenborder

[Part 2 - Denyo]
Vor uns 'n Dampfer auf Kreuzfahrt, vollgestopft mit schicken LeutenDie vor noch schickeren zitterten, sich ihnen kopfnickend beugtenSah sie an, jene zu billig ihre Stimme verscheuernSah' sie glauben, wenn sie welche zahlen, sie Dinge steuernSah' ihre Kinder Trips nehmend am Galgen hängengebliebenUnd als Faschoprolls pogend auf'm Schiff der Volksdrogen
So wie die wollt' ich nicht baden gehen,schrieb lieber TexteStatt abgrundtief zu sinken, als 'n Wrack ohne Schätze

[Hook]
Texte wachsen nicht auf Bäumen, Beats kommen nicht mit der Post
Darum feilen wir, weilen wir, feilen wir
Bauen Sachen wovon andere nur träumen
Nur beste Kost und so stylen wir, geile Styles stylen wir

[Part 3 - Eißfeldt]
Irgendwo auf einer Fähre Richtung KarriereSaßen mehrere, eher leerere Köpfe mit 'ner RiesenschereFischten die wenigen, frischen MC's aus'm WasserSchnitten sich was ab und ließen die Guten dann in den Fluten verbluten
In trüben Gewässern taten Piraten warten
Wollten uns Hanseaten an den Kragen, uns unsere Styles abjagen
Die Penner wollten uns entern, doch wir brachten sie zum kentern
Denn mein DJ hat 'ne Motorsäge und die wiegt zehn Zentner

[Part 4 - Denyo]
Wir wollten nie ertrinken und wenn am eigenen Schweiß
Wenn wir für Fans rappen mit Styles und ohne halben Scheiß
Alle sind da, sind die Beginner am rappen
Unter uns Meeresgründe und MC's, die flach war'n wie Nichtschwimmerbecken
Ich ging nie unter als Exempel für beknackt klingend
Hatte mein Schiff 'n Leck war ich's, wie Samples, in Takt bringend
Man, es ist egal, was Du findest, was in is'
Mein Textbuch war schon damals das der Rekorde von Guinness
Wie Bomben zündet's
Kanonenhagel fabelhafter Raps, du hast mein Wort
Wir machen weiter, auch mit 'nem Mann über Bord

[Eißfeldt]
Ja, ja, wir kommen korrekt, wie 500 Mark für'n Heck
Und ziehen für Rap wieder den Karren aus'm Dreck

[Hook]
Texte wachsen nicht auf Bäumen, Beats kommen nicht mit der Post
Darum feilen wir, weilen wir, feilen wir
Bauen Sachen wovon andere nur träumen
Nur beste Kost und so stylen wir, geile Styles stylen wir";"https://genius.com/Beginner-das-boot-lyrics";"Released November 9, 1998
Featuring

    
      Das Bo, David P., Ferris MC & 1 more
Producers

    
      Denyo, DJ Mad, Eizi Eiz & 2 more
Writers

    
      Denyo, Eizi Eiz, Jan Delay & 2 more"
"2";"Beginner";"Hammerhart";"Bambule";"[Intro: Eißfeldt]
Oh, na, na
Bambule - Yes, yo
Dies ist Hamburg City callin'

[Hook: Eißfeldt,Denyo, »Sample«]
Ihr seid Zeuge, wie Denyo 'n neuen Hit schreibt
Eißfeldt die fetten Beats holt, aus'm Zip-Drive
Mad seine neuesten Technics Tricks zeigt
Arfmann an den Reglern macht den Shit tight
Is' ja hammer-, hammerhart
Is' ja hammer-, hammerhart
Da is' einiges am Start -»Am Start Baby«
Is' ja hammer-, hammerhart
Is' ja hammer-, hammerhart
Da is' einiges am Start -»Am Start Baby«

[Part I - Denyo:]
Viele wollen chatten und rappen von Hamburg bis Meppen
Bauen Tracks in Ketten, wollen ohne Rucksack tracken
So viele Rapper und Rapletten tun weh, ich brauch Tabletten
Wenn ich mein Heim seh' und vor Fernweh beinah' eingeh'
Labert wer Kackdreck, nehm' ich sein Platzweg, denn ich hab' zwar
Styles auf'm Konto, doch daß heißt nicht, daß ich am Satz spar'
Ich geh' tief, wenn ich eimerweise Rap aus'm Brunnen zieh'Und wieder hoch, wenn ich mit den Flügeln meiner Lunge flieg'
Statt Chartschlüssel hab ich 'n Dietrich an meinem SchlüsselbundSo betret' ich die Tür zum Erfolg, ohne Sprung in der Schüssel und
Stars strecken Beats, wie Fans Hände
Klauen Ideen, wie Chrashkid Dennis Autos für'n Crash ohne Ende
Gelen ihre Haare, während sie Tracks glättenIch steh' auf krause LockenundBeats, die wie Elke fett sindUnd Jans gleicht'm Elefant, ich mach daraus 'n StückFühre ihn rappend zum Porzellanladen, Scherben bringen Glück

[Hook: Eißfeldt,Denyo, »Sample«]
Ihr seid Zeuge, wie Denyo 'n neuen Hit schreibt
Eißfeldt die fetten Beats holt, aus'm Zip-Drive
Mad seine neuesten Technics Tricks zeigt
Arfmann an den Reglern macht den Shit tight
Is' ja hammer-, hammerhart
Is' ja hammer-, hammerhart
Da is' einiges am Start -»Am Start Baby«
Is' ja hammer-, hammerhart
Is' ja hammer-, hammerhart
Da is' einiges am Start -»Am Start Baby«

[Part II - Denyo:]
Weil ich Tracks übe, land' ich Hits, statt in der Klapsmühle
Spiel lieber mit Worten, statt Schach, wenn ich mich matt fühle
Für neue Wege öffne ich Schranken, ey, nee ich meineNicht als BGSler, weil ich will immer noch K.E.I.N.E
Werf' immer noch Meilensteine, doch weil es mir nichts gibtZwanghaft Mißstände zu benennen, üb' ich mehr Rap als Kritik
Hohes Niveau macht Sinn und das zu halten - kein Thema
Lebe von Styles, man, wie Künstler von der GEMA
Typen sind spitz auf Hits und Frauen feucht wie'n HändedruckBesonders wie meiner, wenn ich Geld mach' und in die Hände spuck
Doch ich brauch' keinen Chartzauber und den ganzen HeckmeckVersuch' nicht anders zu sein, als ich bin, weil das keinen Zweck hätt'
Ich vertrete meine Meinung, gepresst auf VinylNicht auf Seite drei in 'ner Zeitung
Wer ist da? Dennis da
Gäb's kein Rap würd' ich breaken, wie 'n Ass, doch nicht als Tennisstar";"https://genius.com/Beginner-hammerhart-lyrics";"Released November 9, 1998
Featuring

    
      Das Bo, David P., Ferris MC & 1 more
Producers

    
      Denyo, DJ Mad, Eizi Eiz & 2 more
Writers

    
      Denyo, Eizi Eiz, Jan Delay & 2 more"
"3";"Beginner";"Rock On";"Bambule";"[Intro: Eizi Eiz]
Wir ham' kein Ziel, aber wir fahr'n los

[Part 1: Denyo]
Ah, ah, ah, ob es weh tut oder nicht, im PortemonaieIch investier’ in die Beginner AG
So steigt mein Wortwert, mein Style wirkt doller
Die Fans wollen uns, wie die an der Börse Dollar
HipHop Tracks fallen im Kurs, wie uns Ideen einSo tun wir Mr. HipHop ein’ Gefallen und füllen Hallen
In denen wir abstylen ""immer weiter""
Die Karriere sucht ‘n Job, als Sprosse in der TonleiterMit Hemd und Schlips nach oben ist kein ClouDenn klettern ist Sport, brauch ein Paar Turnschuh’
Jeden Tag seh’ ich sie, doch sie blicken nicht mehr
""was geht"", schauen nur auf die Uhr, doch ticken nicht mehr
Gefesselt am Schreibtischsessel haut sie nichts vom Hocker
Sie wären gern- doch sind bloß ihre Schrauben locker
Ihr Leben ist verplant, denn sie waren planlos
Wir ham’ kein Ziel, aber wir fahren los
Die Beginner als Job, tausend Styles im Gepäck
Verträge unterschreib’ ich mit’m tag
Die Welt geht kacken, doch vorher werd’ ich Styles kicken
Und mit den Beats bumsen und mit’m Funk ficken

[Hook: Eizi Eiz]
Wir sind am Start und die Welt ist groß
Wir ham’ kein Ziel, aber wir fahr’n los
Unser Zug ist abgefahr’n doch wir sitzen drin
Niemand kann ihn stoppen, wir werden weiterrocken
Wir sind am Start und die Welt ist groß
Wir ham’ kein Ziel, aber wir fahr’n los
Unser Zug ist abgefahr’n doch wir sitzen drin
Niemand kann ihn stoppen, wir werden weiterrocken

[Interlude: Denyo]
Hey Eißfeldt, lang nicht mehr geseh'n ey, was machst du jetzt so?

[Part 2: Eizi Eiz]
Ich verbasse die Masse, indem ich ihr neue Beats verpasse
Krieg’ dafür Geld, daß ich auf’m Kiez verprasse
Oder im Plattenladen, wo sie Rap Platten haben
Denn nur Rap Platten schützen mich an nassen Tagen
Aus meinen Raps daraus, bau ich mir ein Haus
Gegen Hunger hab’ ich einen Kühlschrank voll mit Applaus
Ich seh’ die Welt, und sie sieht den Eißfeldt
Habe Spaß nicht nur am Dienstag, penn’ aus während ihr Dienst habt
Und komm’ mir nicht mit BMW und GTI, Lamborghini und Ferrari
Mit New York Hardcore Rap aufm Ohr, aufm Mic, bin ich zwanzigmal so schnell wie die
Immer motiviert durch Unsympathen aller Arten
Die Luft für mich sind, aber Luft, die ich atmen
Muss, denn ich will überleben
Nicht ersticken in dem Mist, den sie ständig reden
Immer hinter mir, Masen von Kollegen
Die, wie ich, die Ärsche der Nation bewegen
Wir leben und rocken und niemand kann uns stoppen
Wir werden aller Popper foppen und die Charts toppen

[Hook: Eizi Eiz]
Wir sind am Start und die Welt ist groß
Wir ham’ kein Ziel, aber wir fahr’n los
Unser Zug ist abgefahr’n doch wir sitzen drin
Niemand kann ihn stoppen, wir werden weiterrocken
Wir sind am Start und die Welt ist groß
Wir ham’ kein Ziel, aber wir fahr’n los
Unser Zug ist abgefahr’n doch wir sitzen drin
Niemand kann ihn stoppen, wir werden weiterrocken

[Part 3: Platin Martin]
Eure Welt glänzt fünfundzwanzig Mal in der Sekunde
Aber meine Augen sind geschlossen elfte Runde
Und ich flash, bis ich umfall flash auch unprall!
Wenn ich die Karstadtwelt stumm schalt’
Nicht um- sondern ausschalt’
Wann immer ich Bock hab’, den Mund halt, Bassdrum aus’m Auto rausschallt
Bongblast mit Vollgas in’s Gehirn knallt
Selber Drogen kaufen, anstatt Miami Vice gucken
In Gedanken noch jedem Bullen ins Gesicht spucken
Tanz’ weder euren Walzer, noch Disco Fox
Ich nick’ nur mit dem Kopf zum Rap, der aus der Box kommt
Der JBL-Boom, mit dem ich Nachbarn umlege
Denn gute Boxen kennen keine Mietverträge
Ich lebe und liebe die Bilder und ihre Macht
Blinzel’ nach einer durchgemachten Nacht in die Sonne
Du willst Wein, Lady? Du willst Dinner, Lady?
Wie wär’s mit China-Imbiss a la Beginner; Baby?
Mich scheucht keiner irgendeinen Weg lang
Ich bin Beginnermann, irgendwas fang ich immer an

[Bridge: Eizi Eiz]
Seid doch mal ehrlich, ihr seid zwar überhaupt nicht lockerDoch ich weiß, tief in euch drin, wärt ihr doch auch gerne ‘n RockerIhr zieht euch doch heimlich auch mal ‘ne Daunenjacke anUnd schließt euch ein auf’m Klo und hört Rap Radio, oder guckt Yo!

[Hook: Eizi Eiz]
Wir sind am Start und die Welt ist groß
Wir ham’ kein Ziel, aber wir fahr’n los
Unser Zug ist abgefahr’n doch wir sitzen drin
Niemand kann ihn stoppen, wir werden weiterrocken
Wir sind am Start und die Welt ist groß
Wir ham’ kein Ziel, aber wir fahr’n los
Unser Zug ist abgefahr’n doch wir sitzen drin
Niemand kann ihn stoppen, wir werden...";"https://genius.com/Beginner-rock-on-lyrics";"Released November 9, 1998
Featuring

    
      Das Bo, David P., Ferris MC & 1 more
Producers

    
      Denyo, DJ Mad, Eizi Eiz & 2 more
Writers

    
      Denyo, Eizi Eiz, Jan Delay & 2 more"
"4";"Beginner";"Liebeslied";"Bambule";"[Album Intro:]
Oooh... Jetzt... Jetzt brauch' ich einen Drink
Ich auch, und eine Zigarette!
Und Musik brauch' ich auch!
Nur ein bisschen Musik, Robert! Ist gut!
Und jetzt zur Entspannung ein wenig Musik!

[Intro:]
Ihr wollt ein Liebeslied, ihr kriegt ein Liebeslied
Ein Lied, das ihr liebt

[Part I:]
Das ist Liebe auf den ersten Blick
Nicht mal Drum' n Bass hält jetzt mit deinem HerzenSchritt
Du hast deinen Schatz gefunden, ohne lang zu buddeln
Bock ihn in den Arm zu nehmen und stundenlang zu knuddeln
Voll erwischt, du Fisch zappelst am Haken
Heute Nacht wirst du im Zelt vor'm Plattenladen warten
Dabei ein Radio, falls es nochmal wiederkommt
Spontanes Desinteresse an all' den anderen Liedern prompt
Die alle gleich aussehen und zu viel Schminke nehmenAus 50 Wörtern wählen, um das Gleiche zu erzählen
Mit Schönheitsoperationen an digitalen Konsolen
Stylemäßig immer wieder gut beraten von Polen
Für dich gibt's nur noch eins und sonst keins
Und hält jemand nicht deins für Nummer eins
Siehst du rot, wie Heinzund sperrst ihn ein
Quälst ihn mit Simple Minds, bis er weint
Gefährliche Liebschaften
Doch du hast keine Schuld, dafür muss das Lied haften
Deine Ohren fühlen sich wie neugeboren, jeden Tag
Und du fragst dich,kann man auch Tracks heiraten in Dänemark
Unser Beat hat Boom gemachtUnd es hat Zoom gemacht

[Hook:]
Ihr wollt ein Liebeslied, ihr kriegt ein Liebeslied
Ein Lied, das ihr liebt
Also hört zu
Werdet verliebt

[Part II:]
Hast du im Leben nix in Petto, ist alles Ghetto
Das heißt Glück brutto und Frust netto
Und im Gesicht' n Tränentattoo, ey , dann wird's Zeit für Musik
Weil dann tanzt du, und fliegst durch die Plattenboutique
Und ist deine Freundin weg, dass heißt deine ExIst der Griff zum lieben Lied der Beginner dein Reflex
Nicht mehr Seiten - sondern Sprünge auf der Platte
Komm vor, bleib' entspannt, kauf ' ne Neue, is doch Latte
Und sieht dein Leben manchma, doof aus
Mach's wie ich, hol' mein' Philosoph 'raus' schreib'n Text, komm dann groß raus
Du bist in mich verschossen, mein Pfeil hat dich getroffen
Nun bist du im Beginner-Rausch, früher warst du besoffenVon zu vielen Produzenten, denn egal , wie sie's schrauben
Nur dünne Tracks und Rap mit Pipi in den Augen
Deswegen drück ich selten auf die Tränendrüse
Während ich in den Charts stehen übe

[Hook:]
Ihr wollt ein Liebeslied, ihr kriegt ein Liebeslied
Ein Lied, das ihr liebt
Also hört zu
Werdet verliebt

[Sample:]
Hach, ich liebe dieses Lied! Lied, du hast mir gut gefallen! Ich liebe Dich!Ich weiß nicht, was ich sagen soll, aber Du hast mir wahnsinnig gut gefallen!

";"https://genius.com/Beginner-liebeslied-lyrics";"Released November 9, 1998
Featuring

    
      Das Bo, David P., Ferris MC & 1 more
Producers

    
      Denyo, DJ Mad, Eizi Eiz & 2 more
Writers

    
      Denyo, Eizi Eiz, Jan Delay & 2 more"
"5";"Beginner";"Fahr’n";"Bambule";"[Verse I:]
Ich cruise heavy im Chevy von Gidi
Höre Stories über Mini-Disk und Midi
Aus den Boxen,eine von denfettenEimsbush-Kassetten,Sam und Borappen
Fahr'n, fahr'n auf der AutobahnSeit Stunden, seit Tagen, seit JahrenLethargie macht sich breit, man das würd ich auch gern
Wenn die Vorräte nur nicht schon alle aufgebraucht wär'n
Aber bitte keine RaststätteWeil ich mich da schon eher wie Christian Anders nackt an' Knast kette
Lieber weiter anhalten, da will ich bloß nicht anhalten
Man, diese ganzen Gestalten, wo sich mir Fußnägel spalten
Haut fett und weiß, Abgase und Schweiß
WC-Fisch und 'n gieriger Toiletten-Greis
Fehrnfahrer-Merchandise, garantiert kein Lipton Ice
Ein ziemlich hoher Preis, für einen kleinen Scheiß
Nee, nee, wir segeln weiter, aber Kapitäne sind wir ansich' nicht
Wir ham' viel zu viel von unserem Land in Sicht
Man, schau' ich aus'm Fenster
Seh' ich BMW-BWLer, Polo-Prolos, Bonzen-Benzler
TV Teutonia, von früh bis spät
Ja, sie ist hart die Realität
Aber, wir wissen, woher wir kommen und wohin wir müssen
Und pissen, auf Alle, die die's besser wisen!

[Verse II:]
Jippieh, zurück in Hamburg-City
Nur noch ein paar Minuten,und dann von Bord wie Pippi
Zu Hause, Pause von der großen Sause
Aber momentan, immer noch Autofahr'n
Wieder da im Nassen und Blassen
Das Mißtrauen ham' wir auf der Autobahn weiterfahren lassen
Wir treiben auf den Strassen, die immer in uns bleiben
Kool Keats und BIA-Bilder, die wie Schilder zeigen
Wir sind zurück in unserem BarrioUnd des is' net bloß A Dorf, wie Mario
Wo die Bäume höher sind als die Häuser, die labern' dumm 'rum
Im Rathaus drin geht nix, aber drum 'rumGroßstadtkinder wissen was ich mein'
Es muß was los sein, oder wir gehen ein
Wir brauchen eben, die Menschen und Action zum Leben
Hamburg kann uns das geben, was gehd'n, auf jeden
Können alle anderen mal scheißen gehen
Und sollten lieber mal ihr Leben lang auf Reisen gehen
Denn wir ham' auch noch die ganzen MCs die's krachen lassen
Täglich Vinyl-Container, die in Massen die Stadt verlassen
Ja, hier wurde die Saat gesäht, für das wozu ihr gerade den Arsch
Bewegt!";"https://genius.com/Beginner-fahrn-lyrics";"Released November 9, 1998
Featuring

    
      Das Bo, David P., Ferris MC & 1 more
Producers

    
      Denyo, DJ Mad, Eizi Eiz & 2 more
Writers

    
      Denyo, Eizi Eiz, Jan Delay & 2 more"
"6";"Beginner";"Füchse";"Bambule";"[Verse 1: Samy Deluxe]
Wickeda-MC,mit Flows pur Natur wie Sensi
Und Freestyles näher am Geschehen als jedes Hip-Hop-Fanzine
Fuchs' mich in die Materie, da es Möglichkeiten unbegrenzt gibt
Leider folgen viele falschen Vorbildern und lernen's nie
Das Publikum zu rocken, da es auf 'ner anderen Frequenz liegtWas uns nicht betrifft, weil man unsere Bühnenpräsenz liebt
Und Rap-Exzellenz sieht, die sich der Vorstellungskraft Vieler entzieht
Sam Semiliaund die Beginner, ihr kennt sie! - Woh!

[Verse 2: Eißfeldt]
Au, der Magen knurrt wie Sau
Ich hau' ab aus meinem Bau
Verschließ' die Tür, ziehe durch's Revier
Markier' hier und da mal, dass ich da war
Höre Gelaber,schleichegerade über die Promenade
Zeuge einer großen Maskerade
Große Buchstaben, grelle FarbenDie mir sagen, dass sie Kabelfernsehen haben
Gestiken von Gerngesehenen, aber jeder Fuchs weißDass ähnliche Garderobe heute leider nicht mehr Schutz heißt
Deshalb schnupper' ich, was befindet sich darunter?
Immer auf der Hut - wie Udo darunter!

[Hook]
Jede Nacht, jeden Tag auf der Jagd
Denn das Rudel tollt, wenn der Rubel rollt
Jede Nacht, jeden Tag auf der Jagd
Denn das Rudel tollt, wenn der Rubel rollt
Jede Nacht, jeden Tag auf der Jagd
Denn das Rudel tollt, wenn der Rubel rollt
Jede Nacht, jeden Tag auf der Jagd
Denn das Rudel tollt, wenn der Rubel rollt

[Verse 3: Denyo]
Wir haben Pfoten wie Gabi,Mikros als Boten für Rap Schoten
Verboten Quoten-MCs auf unserem Boden zu toben
Durchkreuzen Wälder, wir werden älter,Alter wird's kälterEgal, nicht für'n warmen Platz bin ich beim Major
Press' Vitamine aus Rap wie aus Orangen Granini
Verteil' Beginner-Sticker wie Panini, ernten PlatiniOhne I und ohne Style-tauschen
Wenn ich Mega-Byte gestalt' ich Hits zum 'reinlauschen
Wenn Beats im Reim rauschen: Macht nixWas dreckig ist, kehr'n wir nicht unter'n Teppich
Der Grund warum ich ständig Loops aufgepeppt krieg'Viele vergeigen bloß
Mir egal, wenn bei mir alle Stricke reißen, bin ich den Galgen los
Wir stylen groß!
Du siehst mit List gefuchste Clips, guckst'e Gigs
Von den Beginnern im TV, geklaut ist bei uns nix
Und kriegt wer Futterneid, tut uns leid, kommt vor, bei soviel Geilheit
ZahmeVögelsingen wie Münchener von Freiheit
Kein Sinneswandel, keine Floskel, ungeschminkt, ich bleib' da
Und werd' bestimmt nicht Amsel, Drossel oder Fink – ich bleib' Star!

[Hook]
Jede Nacht, jeden Tag auf der Jagd
Denn das Rudel tollt, wenn der Rubel rollt
Jede Nacht, jeden Tag auf der Jagd
Denn das Rudel tollt, wenn der Rubel rollt
Jede Nacht, jeden Tag auf der Jagd
Denn das Rudel tollt, wenn der Rubel rollt

[Verse 4: Eißfeldt]
Eine Pfote am Mikro, eine auf den Tasten
Ein Auge auf's Geschäft, eines im Plattenkasten
Ein Ohr für's Rudel und eins für den Gegner
Ein Tanzbein und ein Arschtreter
Ein Fuchs muss tun, was ein Fuchs tun muss
Luxus und Ruhm und rulen bis zum SchlussDas ist mein Ziel, was ich noch nie so klar sah'
„Sky is the limit.“ – Pah! Und was ist mit der NASA?

[Verse 5: Samy Deluxe]
So sicher wie Wölfe bei Vollmond jaul'n
Elstern alles was glänzt klau'n
Sitzen wir als Füchse in unserem Bau drin
Feilen mit roten Augen
An Tracks und Texten, bis sie was taugen
Drin' alles ruhig, doch draußen wollen uns tausende unsere Ideen raubenEigentlich ist es Wahnsinn, Lieder wie diese 'rauszubring'nWeil damit garantiert ist, dass die der Anderen bald auch so kling'n
Hamburg-City rult, wer behauptet was anderes?
Jetzt offiziell: Ich battle jeden MC, egal wie bekannt er ist
Mein Treibstoff ist Cannabis sativaDenn ich rapp' high lieberTag für Tag wieder
Letztes Jahr schon Chart-Leader
Mit Denyo in der Style-Liga
Jetzt mal wieder ein fettes Feature
Mad mixt wie'n Barkeeper
Eißfeldt macht den Beat klar
Und schon schallt es durch eure Speaker
Wir gehen weiter und tiefer
Hamburg-City ist am Start
Also wie habt ihr's lieber:
Ausgefuchst oder ausgelutscht? Für letzteres, geht zur Konkurrenz
Wir bleiben in Eimsbush und feiern fette Mongo-Jams! (Yeah! Yeah!)

[Hook]
Jede Nacht, jeden Tag auf der Jagd
Denn das Jagen tollt, wenn der Rubel rollt!
Jede Nacht, jeden Tag auf der Jagd
Denn das Rudel tollt, wenn der Rubel rollt
Jede Nacht, jeden Tag auf der Jagd
Denn das Rudel rollt, wenn der Rubel tollt!

Telefonklingeln- Eißfeldt?!""Ja, hallo! Ich wollt mal sagen: Füchse sind gar keine Rudeltiere.""
- Achso... Ja, ähm... Ja, egal, 's rhymed, ist fett, der Rhyme ist fett""Gut, tschüß!""";"https://genius.com/Beginner-fuchse-lyrics";"Released November 9, 1998
Featuring

    
      Das Bo, David P., Ferris MC & 1 more
Producers

    
      Denyo, DJ Mad, Eizi Eiz & 2 more
Writers

    
      Denyo, Eizi Eiz, Jan Delay & 2 more"
"7";"Beginner";"Showmaster";"Bambule";"[Refrain:]
Du ziehst 'ne Show ab und das macht mich lau
Fuck, dein Leben ist 'ne riesengroße Show
Doch sie wird nicht lang bestehen, ich zähl' bis zehn
Länger wird sie nicht weitergehen, du wirst sehen!

[Verse 1: Denyo]
Du brachtest die Dunkelheit und so wurd' ich heller
Im Kopf schlauer, flinker und brach aus, aus deinem Keller
Obwohl ich Underground bin
Lebend begraben im Leben macht kaum Sinn
Deswegen führe ich Krieg, nein, nicht in deiner Truppe
Brauch nicht dein Ballermann 6, sondern nur meine Gruppe
Lieber Styles als Waffen und Clubs als Kasernen
Ich greif' nach Sternen und du mich an mit deinen Gewehren
Ich will dich, nein, falsch - du kannst mich
Hör' ich Mucke tanz' ich und zwar aus der Reihe
Mit jedem Beat und jedem Rap, den ich mach
Ensteht 'n Hype, durch den ich meine Fans befreie
Ich werde freier, doch keiner auf'm Strich
Und werd' nie deine Nutte sein, wie deine Kinder beide sind
Wie leid ich's bin
Dein Ruhm und Glanz, du Schwanz, polier' dir deine Fresse
Damit sie glänzt, wenn du hängst!

[Refrain]

[Verse 2: Jan Delay]
Ich sage No zu dir, wie der Doktor
Dir zieh' ich sogar Rock vorDenn wie der stinkst du und deine Crew
Ich brauch dich wie ein Beinamputierter ein paar Schuh'
Uh, du setzt mir zu, verlangst von mir soviel
Doch alles, was du kriegst ist diese Bombe aus Vinyl
Du willst mich überwachen, aber übermüdet wirst du, hörst
Du
Denn störst du meine Geschäfte,schick ich dir meine 808
Die dir Tag und Nacht das Leben zur Hölle macht
Weil Hölle-Krach, Terrorrythmus, den du nicht bekämpfen kannst
Weil du den Bass mit keinem Wasserwerfer dämpfen kannst
Denk' nicht: der ist harmlos, der chillt ja nur immer
Für dich bedrohlich, wie die Stadtguerilla, du Spinner
Denn, ich hab Ideen, die du nicht verstehen kannst
Weil du die Dinge nicht wie ich sehen kannst
Du kriegst zwar meine Stimme, aber nicht auf einem Zettel
Nur zu hören auf'm fetten Beat, wenn ich dich battle
Ich rolle meine Zunge, rolle Eine, rolle meine Scheine
Aber Bock auf dein Rollenspiel hab' ich keine
Viele flohen vor dir, ich nicht, ich flow' mit dem Beat-Flow
Niemand kann mich kontollieren, wie ich das Mikro
Deshalb schau' ich deine Show im TV
Studiere meinen Feind genau! Ich kriege selbst alles gebacken
Brauch kein Stück von deinem Kuchen
Kein Zimmer in deinem Hotel auf Lebenszeit zu buchen
In deinem Zimmer geht nix ab, außer der Putz von den Wänden
Denn hier ist nix am Start und so wie du möcht' ich nicht enden
Du willst, daß ich mit dir geh', ok, ich mach's wie
Das Herrchen mit einem Hund und gehe mit dir Gassi
Du willst mein Jäger sein, und alles tun, um mich zu fangen
Du Anfänger fängst gleich welche, nichts an dir, nein, du bist dran
Mal hab' ich schlechte Karten, doch ich werde niemals passen
Genausowenig wie dir in den Kram
Mein Zug ist abgefahr'n genau wie meine Styles, doch sitz' ich drin
Hau' ich dich weg, haut mein Leben wieder hin
Du machst viel Rauch um nichts und ich versuch gegen zu paffen
Schaff' es selbst zu leben, statt für dich anzuschaffen
So schmeiß ich dich raus und mach die Tür von innen zu
Auch ich hab' oft den Faden verloren, doch nie den Pfad - so wie du!";"https://genius.com/Beginner-showmaster-lyrics";"Released November 9, 1998
Featuring

    
      Das Bo, David P., Ferris MC & 1 more
Producers

    
      Denyo, DJ Mad, Eizi Eiz & 2 more
Writers

    
      Denyo, Eizi Eiz, Jan Delay & 2 more"
