"","artist","title","album","text","url","metadata"
"18","Kool Savas","Immer wenn ich rhyme (Mammut Remix)","Die john bello story iii","[Part 1: Kool Savas]
(Immer wenn ich rhyme)
Siehst du den Bosporus undElisenbrunnen
Die Neckarwiesen,die Weinsteige, die Siegessäule
Hörst du durch meine Ohren, fühlst du, was ich fühle
Werden wir alle eins, paar Worte genügen völlig, denn
(Immer wenn ich rhyme)
Form' ich mir die Welt zu 'ner Scheibe aus Teig
Und back' sie auf, bis sie wieder rund ist, tauch' in sie ein
Wenn ich rhyme, beweg' ich Berge, spalt' ich die Erde
Auch wenn ich mal nicht mehr bin, halt' mich in deinem Herzen
Wir reden

[Part 2: Tua]
(Immer wenn ich rhyme)
Werd' ich zu 'nem VST Plugin für TexteIch seh' mein Leben in Spuren und auf jede pack' ich EffekteEcho (Echo... Echo...), Phaser, Hall, Chorus
Mein Leben folgt sowas von keiner Logik, außer nur
(Immer wenn ich rhyme)
Dann färbt sich alles grau, Schatten lernen Laufen
Die Mauern rauf, der Raum teilt sich auf in Kälte und Wärme
Ich sterbe für jeden Song einen kleinen Tod
Meine Strophen Snuffpornos in deinen Ohren

[Part 3: Franky Kubrick]
(Immer wenn ich rhyme)
Sperr' ich mich in mein Zimmer ein
Und flieg zum Fenster raus wie Peter Pan nach Nimmerland
Ich mein, ich tauch den Füller tief hinein, bring Tinte auf's Papier
Und lass sie schimmern in 'ner Line, ich kiff ein Kilogramm allein
(Immer wenn ich rhyme)
Chill und wart ich auf den magischen Moment
Wenn er da ist, geb ich alles, bis ich penn
Das ist alles, was ich kenn, und das ist alles, was ich brauch
Homie, geh, und dreh die Anlage voll auf

[Part 4: Tone]
(Immer wenn ich rhyme)
Tanzen kleine Sternchen vor deinen Augen
Deine traurigen Reime braucht keine Sau
Ich werd dich in der Pfeife rauchen
Weil ich im Haus bin, halten Neider die Schnauzeund benehm' sichAls würden sie ohne Käfig mit Haifischen tauchen
(Immer wenn ich rhyme)
Schiebt meine Muse 'n Flash, sie nennt mich den Casanova
Sie flennt vor Freude, weil sie nicht fassen kann
Wie krass mein Flow war
Konkurrenten sitzen blass auf dem sofa
Schwitzen in nassen Pullovern
Toben und wimmern, so ist es immer

[Part 5: Vega]
(Immer wenn ich rhyme)
Allein bin ich so krass von hier enttäuscht
Meine Stadt schläft nie, heißt es auch, dass sie niemals träumt?
Hier, wo jeder der Chef ist, Leben ist Hektik
""Frankfurt sein"" heißt, dass du gegen den Rest bist
(Immer wenn ich rhyme)
Schreib ich Zeilen aus einem Guss wie die Iron Bitch
Denn viele Rapper bellen, und beißen nicht, ich mach Tyson Shit
Ich scheiß auf das Game, scheiß auf den Fame
Denn schlimmer als blind zu sein ist, als einziger zu seh'n

[Hook: Moe Mitchell]
Immer wenn ich rhyme
Steht die Welt kurz still und ich spür weder Raum noch Zeit
Denn immer wenn ich rhyme
Fällt die Last von mir und ich fühl mich auf einmal frei
Denn dieser Stift hier weist den Weg
Und trägt mich täglich ein Stück mehr
Und zwar immer wenn ich rhyme (...hyme)

[Part 6: Kaas]
(Immer wenn ich rhyme)
Flieg ich in 'nem mikroskopisch kleinem
Rosa U-Boot in die entlegensten Winkel meines Kopfes
Graue Blitze sieht man dort durch wolkenförmige Synapsen zucken
Es riecht nach Kuhmagen Gottes
(Immer wenn ich rhyme)
Ein Glück, dass ich in meinem U-Boot
Einen Dreierpack Wunderbäume der Sorte Vanille-Kirsch wollte
Jetzt riecht es hier lecker, guck' mal da in der Zirbeldrüse
Ist Jesus ein Büro für dich

[Part 7: PMA]
(Immer wenn ich rhyme)
Lass ich meine Krisen im Rücken hier hinter mir
Fülle die Gebiete mit den Worten und den Buchstaben
Die ich von 'nem Stück Papier inhalier
Wenn ich auf der Bühne mit dem Mikrofon allein bin
Wenn ich meine Symphonien inszenier'
Geb ich einen Fick auf diesen Zirkus, den ihr macht
Als ob mich Britney Spears interessiert
(Immer wenn ich rhyme)
Dann zeig' ich euch, wie der Grizzlybär ist, kapiert?
Wenn ich so 'ne Penner wie dich frühstück'
Komm ich und dann vergesse meine Tischmanieren, Kinderspiel
Wenn ich rhyme
Bin ich meiner Zeit voraus wie Lichtgeschwindigkeit
Ich bin immer im Reich, bilde mir ein, kein Limit weit und breit

[Part 8: Ercandize]
(Immer wenn ich rhyme)
Seh ich's wie Filme vor meinen Augen
Ich spreng mir die Wege frei und ich predige meinen Glauben
Es ist Rap, irgendwo zwischen Schädeln, die einen bauen
Und Rappern, die einen fronten und Mädels, die einen kauen
(Immer wenn ich rhyme)
Bin ich innerlich hin- und hergerissen
Irgendwo zwischen Frieden, Liebe, Krisen und Ärgernissen
Der Kopf ist voll, was wollen die Vögel von Ercan wissen?
Ich will die Wolken zur Seite schieben und die Sterne küssen

[Part 9: MoTrip]
(Immer wenn ich rhyme)
Könnte ich vor lauter Glück die ganze Welt umarmen
Und lass Gefühle frei, die früher leider nicht zur Geltung kamen
Wenn ich ins Mic spuck, denk ich nicht an Geld
Und habe kein Druck, ich brauch nicht zu schnell zu fahren, denn
(Immer wenn ich rhyme)
Vergess ich die verflossene Liebe, die offenen Fragen
Aus offenen Briefen, was soll ich sagen?
Ich mach die Augen zu und ich kann hören, wie die Menge tobt
Ich rappe, bis mich irgendwann die Engel holen

[Hook: Moe Mitchell]

[Part 10: Amar]
(Immer wenn ich rhyme)
Steht zum Beispiel die Zeit still
Flashback, Kellersessions, Open Mics, Freistil
Beats burnen, Mics killen, das ganze Paket
M.o.b.b, Nas, Biggie Peter Gunz und Tariq
(Immer wenn ich rhyme)
Sprudeln Gedanken wie Quellwasser
Diese Mukke repräsentiert den gesamten Weltatlas
Dein Stift ist der Schlüssel das Blatt ist die Tür
Öffne sie und frag dich, auf welchen Pfad es dich führt

[Part 11: Kitty Kat]
(Immer wenn ich rhyme)
Bleibt die Welt kurz stehen
Mit jeder Zeile, die ich schreib wird die Welt dann schön
Das ist mein Weg zum Glück, vielleicht auch für dich
Die pumpen alle meinen Sound, und die schreien für mich
(Immer wenn ich rhyme)
Fühl ich mein Herz in der Brust
Das ist mein Leben, mein Job, das ist meine Luft
Auch wenn der Wind hart weht, ich steh stramm
Weil ich weiß, was ich kann, ich weiß es

[Part 12: Sinan]
(Immer wenn ich rhyme)
Vergess ich alles um mich herum, was mich stört
Weil man mich sonst nicht sprechen lässt, verschaff ich mir Gehör
Lass meine Emotionen raus, das Papier saugt sie auf
Ich brauch mich nicht kontrollieren
Denn ich schreibe aus dem Bauch
(Immer wenn ich rhyme)
Ich schreibe aus dem Herz, denn der Stein da drauf drückt schwer
Immer wenn ich rhyme, geht's in eine Richtung aufwärts
Kaum ergreif ich den Stift, tritt ein Lächeln in mein Gesicht
Kurz danach ist es fertig, mein Gedicht

[Part 13: Fiva MC]
(Immer wenn ich rhyme)
Sagt man mir, ich wär anders
Denn in mir lebt das Tier, das nie zum Schlafen veranlasst
Ich bleib wachsam und ehrlich und herrlich lebendig
Ich wehr' mich nicht gegen mich selbst, ich kenn mich
(Immer wenn ich rhyme)
Bin ich frei, denn ich trenn mich
Von dem Druck und der Hoffnung, Verstand trifft auf Verständnis Guck, du baust ein Gefängnis, um nicht anders zu seinUnd genau dagegen kämpf ich (kämpf ich)

[Part 14: Curse]
(Immer wenn ich rhyme)
Zahl ich Schulden beim Schöpfer ab
Denn der Handel war, Talent ist ein Geschenk
Mein Geschenk an ihn ist das, was ich sag
So steigen Zeilen in den Himmel auf, wenn ich rappe
Und finde Gehör beim einzigen Kritiker, den ich schätze
(Immer wenn ich rhyme)
Es ist Beten auf eine Weise, die mich erschreckt
Ich fühl mich vom Glauben an sowas krass unter Druck gesetzt
Auf einmal ist es nicht mehr so einfach, zu schwätzen
Wenn man glaubt, dass Rappen Gottesdienst ist
Ist Labern ein Käffchen

[Hook: Moe Mitchell]","https://genius.com/Kool-savas-immer-wenn-ich-rhyme-mammut-remix-lyrics","Released March 12, 2010
Distributor

    
      Groove Attack
Copyright ©

    
      Essah Entertainment
Phonographic Copyright ℗

    
      Essah Entertainment
Photography

    
      Katja Kuhl
Executive Producer

    
      Kool Savas
Artwork

    
      Eric Ullrich
Label

    
      Essah Entertainment
Featuring

    
      Alex Prince, Amar, Azad & 16 more
Producers

    
      Bazz, Benlo, Big Bazz & 7 more
Writers

    
      Alex Prince, Amar, Azad & 27 more
Additional Drums

    
      Igor Lier
Additional Vocals

    
      Ioredana Doleo & Naomi Jackson"
"19","Kool Savas","30 Sekunden","Die john bello story iii","[Hook: Alex Prince]
Ah, Du weißt, wer die Jungs sind
In diesem Spiel ist das meiste nur Unsinn
Guck auf die Uhr: Nur 30 Sekunden
Auf einmal seid ihr ... verschwunden

[Part 1: Olli Banjo]
Ich tret ein Loch in deine Haustür
Fick dein' Hund, erschieße deinen Babysitter
Ess deine Cornflakes und mach Welle wie ein Seegewitter
Ich mach' ein Loch in die Mucke von jedem Szenezwitter
Ich kann Laser aus meinem Pimmel schießen wie ein Jedi-Ritter
Deine Frau liebt uns're Clique, ja sie schluckt jeden Liter
Doch leider fühlt es sich an, als würde man 'nen Esel füttern
Null Unzen in die Fickfresse wie beim Vale Tudo
Und deutsche Rapper tanzen ihre Namen auf der Walldorfschule
Ihr seid 'ne Gruppe behinderter schwuler Kugelfische
Pusteblumen pflückende, rumbitende Rudeltiere
Im Popo puhlende, Mutti rufende schwule Tiger
Diese Gangster können nicht rappen, der Mist ist ungenießbar
Fucker woll'n spielen, rappen, alles ohne Liebe
Lass dich für die Patte biegen, Fucker, da is Vaseline
Lass die lila Lappen liegen,lerne lieber Locken wickeln
Mach ne Lehre vor der Krise, dropp' das Mic, jobb' bei Lidl

[Hook: Alex Prince] (x2)

Ah, Du weißt, wer die Jungs sind
In diesem Spiel ist das meiste nur Unsinn
Guck auf die Uhr: Nur 30 Sekunden
Auf einmal seid ihr ... verschwunden

[Part 2: Kool Savas]
Nix Rapper, du bist bisschen albern und hast Wortwitz
Ich nehm dich in die Zange, nenn' mich adaptiver Sportsitz
Klinge, als ob sich grade 'n Bagger in dein Ohr frisstOder man dir wochenlang nur Gabba-Lieder vorspielt
Du bist weg und deine Olle knabbert mir am Rohr jetzt
Deepthroat, ihre Zähne knacken wie paar Cornflakes
Kein Halt, mein Hirn rattert wie'n Walkman
Spitt krank, dass sich Lady Gaga in die Shorts pisst
Konkurrenz? Ich kenn hundert Fucker dieser Sorte
Schieß Space-Rapper mit 'nem Shuttle in den Orbit
Und warum müffelt deine Mama wie die Nordsee
Wenn du nicht Kohle machst, indem du Krabben mit 'nem Korb fängst?
Geh mit deinem Paddel mal an Bord jetzt, schwimm weg
Spin back, Essah, ich zercutte diese Horste
G?Nein, bei dir bist du Spacken nur der Dorfdepp
Anthrax, Milch, Eier - ich backe dir 'ne Torte

[Hook: Alex Prince] (x2)
Ah, Du weißt, wer die Jungs sind
In diesem Spiel ist das meiste nur Unsinn
Guck auf die Uhr: Nur 30 Sekunden
Auf einmal seid ihr ... verschwunden

[Part 3: MoTrip]
Okay, du weißt, wer die Jungs sind, weißt, was sie ausmacht
Du weißt, dass ich jung bin, weißt, was ich drauf hab
Ich bleib nich hier unten, gib mir 30 SekundenUnd ich zeige diesem Land, dass ich bereit bin, zu punkten
MoTrip, ich stelle dir ein Beinchen, du humpelst
Dann fütter ich dich Schweinchen mit Lines, bis du umkippst, oh shit
Meine Reime reißen dich umIch bin hier gerade neu, doch habe euch bereits überrundet
Dritter Teil, John Bello, schade, ihr seid nicht dabei
Wenn ich komme, bringen die Versager sich in Sicherheit
Ich warne dich und deine Kameraden, denn ich bin bereitEuch Maden zu vergasen wie im dritten Reich
Ich hab die Granaten immer griffbereitTrip, ich zieh den Stift und schreib 'n Part damitBevor sie meine Bars und mich in Stücke reißenIch warte nicht und spitte gleich
Die Straßen sind erschüttert, ich bin Aachens King, geladen und entsichert

[Hook: Alex Prince] (x2)
Ah, Du weißt, wer die Jungs sind
In diesem Spiel ist das meiste nur Unsinn
Guck auf die Uhr: Nur 30 Sekunden
Auf einmal seid ihr ... verschwunden","https://genius.com/Kool-savas-30-sekunden-lyrics","Released March 12, 2010
Distributor

    
      Groove Attack
Copyright ©

    
      Essah Entertainment
Phonographic Copyright ℗

    
      Essah Entertainment
Photography

    
      Katja Kuhl
Executive Producer

    
      Kool Savas
Artwork

    
      Eric Ullrich
Label

    
      Essah Entertainment
Featuring

    
      Alex Prince, Amar, Azad & 16 more
Producers

    
      Bazz, Benlo, Big Bazz & 7 more
Writers

    
      Alex Prince, Amar, Azad & 27 more
Additional Drums

    
      Igor Lier
Additional Vocals

    
      Ioredana Doleo & Naomi Jackson"
"20","Kool Savas","Rewind","Die john bello story iii","[Verse 1 - Kaine]
Man motherfuck them folksThought the nigga was a joke
Grab their ass about their throat
And choke their ass until they crawl
Nigga don't play the shit no mo'
They can say the shit no mo'
We get to the do' and the mo'fucker know
We can motherfuckin go
I'll make you eat your verseUntil your mouth get dry
Feel like your body bout to lockup, collapse and die
See it's tha yang in it
We keep that bang in it
D-Roc and Kaine in it
And we to blame really
Catchin feelings is really for the bird
Make you eat your words

[Hook - Ying Yang Twins]
We make 'em rewind, we make 'em rewind
We make 'em rewind, we make 'em rewind, we make 'em
Take that, what they sayin, take that, what they sayin
Take that, what they sayin, take that, what they sayin
2x

[Verse 2 - Kool Savas]
Ich weiß ihr denkt ihr seids, ihr kommt in meine Wohnung rein
Und wollt mich vollabern, ihr habt keine Ahnung
Mit wem ihr da grad redet, das ist Kool S-A a.k.a. die Goldader
Nimm's zurück, rewind den Unsinn
Ihr klingt verrückt, im negativen Sinne
Glaub mir, wenn ich komm ist's aus
In meinem Schädel ist's wie in der Pussy deiner Freundin
Immerzu volles Haus - Der Erfolg und das Ganze, sie wollen's auch
Dieser Flow hier ist krank wie der Holocaust
Nenn dich Herr der Ringe, denn du Ficker bist'nTroll
Und deine ach so tolle Frau sieht wie Gollum aus
Überdenke bitte nur mal dein Gesabbel
Als würden grad Scheine fallen
Rapmukke, nein, du tust dir kein Gefallen
Nix Mic,nimm dir ma eine GitarreUnd cover doch mal Songs von Fifty
Ich rotz dir ins Face, nenn's ""Whiskey""
Loser, hiss die Flagge, ich piss die Wanne voll
Zieh das Blatt durch ab zum Rave, ich pack dich Gay
Am Nacken, schüttel dich wach
Lyrische Punches, hart wie'n Fistfuck
Ich lass diese Rapper laufen im Zick-Zack
Was für Demokratie, das hier ist 'ne Diktatur
Ich zerreiß diese Penner
Und sie bringen ihren Mist nur noch heimlich im Kämmerlein
Ihr kleinen Huren habt kein Volumen
In dein Hirn passt, passt, passt grad mal ein Terabyte
Ich dagegen bin überbegabt seit jeher, seh her
Ich renn grad rückwärts ins Ziel ein
Sie mein' das wär nicht mehr regulärer Rap
Denn mit jedem meiner Parts I make 'em

[Hook - Ying Yang Twins]
Rewind, we make 'em rewind, we make 'em rewind
We make 'em rewind, we make 'em rewind, we make 'em
Take that, what they sayin, take that, what they sayin
Take that, what they sayin, take that, what they sayin
2x

[Part 3 - D-Roc]
Hold on, stop, slow your hot ass down
You need to chill your ass up, before you make me clown
You need to back back, think about it
You're no more problem
Cause I'm the nigga who solve 'em
Mister D-Roc, that's me bitch, stir along the same shit
Down for the goddamn claws, you're like us? Fuck yoww
Ying Yang - still here, Kaine - he still here
Kool Savas - still here, damn right - I'm still here
So Sippy, hush your mouth
Dishing out, what you talkin 'bout
I wanna hear no bullshit, so miss me with that bullshit
Nanananana, once I start I don't stop
Crank it up on yo' ass, that's why they call me D-Block
I rock'n roll, shake 'em babe
Crank this bitch from state to state
Ying Yang forever, we way too clever
So you might wanna calm down
And they (?) A-Town

[Hook - Ying Yang Twins]
We make 'em rewind, we make 'em rewind
We make 'em rewind, we make 'em rewind, we make 'em
Take that, what they sayin, take that, what they sayin
Take that, what they sayin, take that, what they sayin
2x","https://genius.com/Kool-savas-rewind-lyrics","Released March 12, 2010
Distributor

    
      Groove Attack
Copyright ©

    
      Essah Entertainment
Phonographic Copyright ℗

    
      Essah Entertainment
Photography

    
      Katja Kuhl
Executive Producer

    
      Kool Savas
Artwork

    
      Eric Ullrich
Label

    
      Essah Entertainment
Featuring

    
      Alex Prince, Amar, Azad & 16 more
Producers

    
      Bazz, Benlo, Big Bazz & 7 more
Writers

    
      Alex Prince, Amar, Azad & 27 more
Additional Drums

    
      Igor Lier
Additional Vocals

    
      Ioredana Doleo & Naomi Jackson"
"21","Kool Savas","Buddy Ogün (Skit)","Die john bello story iii","[Sample]
„Ich fick' dich so tief in dein Loch, dass mein Schwanz mit deinen Rippen flirtet
Ficksau, ich bums' dich in die Klinik!
Bitch: Fresse! Bevor ich dir den Sack in den Mund presse“

[Skit: Buddy 1 &Buddy 2]
„Savas, oder was?“
„Ja, Mann, Digga!“
„Tzz, der Typ ist so ein Opfer, ischör. Digga, weißt du, wie es sich jetzt nennt?!
„Wie denn?“
„John Bello, Digga!“
„Hau ab, Digga!“
„Wallah, Digga! Is' so, lan!“
„Wieso das denn, Digga?“
„Digga, er macht auf Pussy, Digga, weißt du. Er denkt so, öäh, dann hat er mehr Erfolg. So wie Udo Lindenberg, Digga, ischör! Früher er hieß U.L. the Killa, dann er hat gemerkt, viele Leute sind geil auf Schwuchtel-Musik, öäh, und dann hat er sich Udo Lindenberg genannt, weißt du, Digga!“
„Ach, was, Digga! Was macht Savas denn jetzt für Musik, Digga?“
„Öäh, Digga, nur noch so ein Kellek, Digga, ischör. So Kirchenchor-Musik, Schlager, belgische Chansons. Tam, so Knecht-Musik, ischör!“
„Digga, was ist mit ihm passiert, lan?“
„Digga, ich weiß auch nicht. Früher, er war richtiger Gangster, Digga, ischör! Er hat Blumenläden überfallen, er hat S-Bahn-Fahrer abgezogen. Heute, er ist tam so Lauch geworden, ischör. Er hat jetzt gerade so freiwilliges soziales Jahr bei Bürger King in Strahlsund gemacht. Dann er geht freiwillig da bei Park und sammelt Kastanien und Blätter auf und bringt sie zur Polizei. Ischör, letztens ne? Ich hab ihn da bei Schwimmbad gesehn, er ist mit zwei alten Frauen da bei 5er gegangen und ist so Hand-In-Hand mit ihnen zusammen runtergesprungen, ischör! Damit sie so keine Angst haben, weißt du?
„Ach, was Digga! Tam so Opfer, ischör!“
„Jaa, man Digga, ischör! Tzzz, John Bello Digga! So ein Knecht, ischör!“
","https://genius.com/Kool-savas-buddy-ogun-skit-lyrics","Released March 12, 2010
Distributor

    
      Groove Attack
Copyright ©

    
      Essah Entertainment
Phonographic Copyright ℗

    
      Essah Entertainment
Photography

    
      Katja Kuhl
Executive Producer

    
      Kool Savas
Artwork

    
      Eric Ullrich
Label

    
      Essah Entertainment
Featuring

    
      Alex Prince, Amar, Azad & 16 more
Producers

    
      Bazz, Benlo, Big Bazz & 7 more
Writers

    
      Alex Prince, Amar, Azad & 27 more
Additional Drums

    
      Igor Lier
Additional Vocals

    
      Ioredana Doleo & Naomi Jackson"
"22","Kool Savas","Wand","Die john bello story iii","[Part 1]
Ich stepp' ans Mic und Bitches werden feuchter als 'ne Nasszelle
Baller' sie von hinten, es macht ... wie 'ne Basswelle
Ein Rhyme, du verlierst die Fassung und musst botten, Knilch
Ich sitze daheim und such' 'ne Zeile, die der Potte hilft
Jalousien runter, glotze Notting Hill und Aviator
Hör' nicht auf, bis irgendwann jemand von mir 'ne AV8 macht
Euer Album Müll, ich sag' es trocken wie'n Weißwein
Denn ihr spittet Texte aus dem Loch unter dem Steißbein
Bei euch ist Hopfen und Malz verloren, mein FlowcoolWie mein Name,guck, ihr Fotzen seid halb erfror'n
Und während du grad im Solarium liegst
Komm' ich und brech' deinen Rücken –Cranio-Sacral-Therapie
Ihr seid wie Prostituierte, euer Image verfolgt euch lebenslang
Du warst im Knast der Beliebteste, wolltest jeden Schwanz
Sieh dich an, du könntest nicht mal ohne Bong pennen
Deine sogenannte Rapkarriere tot – John Lennon

[Hook]
Ich bin eine Wand, nicht zu überwinden für euch
Und was ihr sagt, prallt so von mir ab
Guck, ihr redet mit einer Wand
Kein Feedback, kein Wort, kein Kommentar
Ganz egal, was ihr macht, glaub mir
Ich bin eine Wand, nicht zu überwinden für euch
Und was ihr sagt, prallt so von mir ab
Guck, ihr redet mit einer Wand
Kein Feedback, kein Wort, nix
Ich bin eine Wand

[Part 2]
Ihr seid Sims, redet viel, doch sagt im Grunde nix
Ich spitt' und erteile diesen jungen Hunden Unterricht
Ich hatt' keinen Bock mehr auf Schule, kochte vor Wut
Und bring' 'nen Flow jetzt durchgeknallter als das Loch einer Hure
Bello 3 ist da und plötzlich kriegen diese Hater Muffensausen
Guck, ich reit' auf 500 Pferden an, made in Zuffenhausen
Und du glaubst, du kannst mich bangen, du Depp?
Doch läufst mit Sonnenbrille rum als wärst duKangaroo Jack
Nahezu unisex, geb' dir den Papagei
Deine Bitch ist heut Abend im Puff, verkauft nach der Uni Sex
Du Trottel bist am Lügen wie Staatsleute
Erzählst über Kohle, doch hältst dich grad so über Wasser wie Amphibienfahrzeuge
Die Tour beginnt, ich komm' in deine Stadt mit 'n paar Bellos
Und zerquetsche jeden Rapper wie 'ne Hand voll Marshmallows
Sieh dich an, du probierst es, aber wirst nie besser
Deine sogenannte Rapkarriere tot – Heath Ledger

[Hook]
Ich bin eine Wand, nicht zu überwinden für euch
Und was ihr sagt, prallt so von mir ab
Guck, ihr redet mit einer Wand
Kein Feedback, kein Wort, kein Kommentar
Ganz egal, was ihr macht, glaub mir
Ich bin eine Wand, nicht zu überwinden für euch
Und was ihr sagt, prallt so von mir ab
Guck, ihr redet mit einer Wand
Kein Feedback, kein Wort, nix
Ich bin eine Wand

","https://genius.com/Kool-savas-wand-lyrics","Released March 12, 2010
Distributor

    
      Groove Attack
Copyright ©

    
      Essah Entertainment
Phonographic Copyright ℗

    
      Essah Entertainment
Photography

    
      Katja Kuhl
Executive Producer

    
      Kool Savas
Artwork

    
      Eric Ullrich
Label

    
      Essah Entertainment
Featuring

    
      Alex Prince, Amar, Azad & 16 more
Producers

    
      Bazz, Benlo, Big Bazz & 7 more
Writers

    
      Alex Prince, Amar, Azad & 27 more
Additional Drums

    
      Igor Lier
Additional Vocals

    
      Ioredana Doleo & Naomi Jackson"
