"","artist","title","album","text","url","metadata"
"6","Kool Savas","Booyaka Shot","Die john bello story iii","[Part 1: Kool Savas]
Renn, als ob du elf Beine hättest
Ich misshandel' dich am Mic, bis du wie'n Geldschein geplättet bist
Keiner kann dir jetzt hier noch helfen, willst hoch, wieder auf die BeineDoch es reichen deine Selbstheilungskräfe nichtEin Wort von mir und du glaubst, Felssteine treffen dich
Deutscher Rap? Stellenweise lächerlich, gut, dass es Essah gibt
Ich tauch' in Salzsäure, komm' aus dem BeckenUnbefleckter als Maria und du Punk erstarrst zur Salzsäule
Dein Flow ist alt, Fäule, nich' die Beginner-Single
Nenn deine Bitch Pflaster, weil ich sie um den Finger wickel'
Geh mal mit deinem Stinkepimmel Windeln ficken
Dis is nich' ein Diss, sondern Hilfe an Nachwuchsspitter bei der Imagefindung
Und deine Braut wurd' gut erzogen, sie liebt Schwanz, die Hure
Spritz' ihr ins Face, bis du dich fragst, „Wer hat die Sams gerufen?“
Zerquatsch' dich Hans wie 'ne Pampelmuse
Dein ganzes Rudel is' gekleidet, als würdest du um die Liebe von Transen buhlen
Nicht 'ne große Nummer, ich bin ein Gigant im Studio
Sie rufenEssah,unstoppbarwie des verdammte Google
Tu nich auf heile Welt,das Zimmer deiner Schlampe wurde öfter von alten Säcken betreten als 'ne Wanderroute
Du gibst wie Pflanzen Ruhe, wenn ich mit dir fertig bin, ah
Zeig deinen Eltern dein Album und sie enterben dich
Ein Relikt meiner Zunft, Essah das Schwergewicht
Und ich hör' nicht auf, bis der letzte von euch beerdigt ist

[Hook: Kool Savas]
Wir sind Heavy-Metal-Spitter, die Eliteeinheit, schießen diese MCs übern Ha-a-a-aufen
Bind deine Schuheund dann lauf, Forest lauf,ansonsten gibts den:
Bo-Bo-Bo-Bo-BoyakashotBo-Bo-Bo-Bo-BoyakashotBo-Bo-Bo-Bo-BoyakashotBo-Bo-Bo-Bo-Boyakashot

[Part 2: Caput]
Ihr könnt nichts für den Mangel an Skills, den ihr habt
Ihr chillt, doch ich dreh' ab nehm' euch in die Mangel
Zwischen Tür und Angelim Vorbeifahren aus dem Auto raus*Pah-pah*, autsch, ich glaub' da hat sich was aufgestaut
Kleiner Zwerg, Haarschnitt á la Prinz Eisenherz
Zeit auf einem Pferd heimzukehren kein Wert von der Leistung her
Weit entfernt von einem Stern, meint ich meins nicht ernst, schreib nicht mehr
Es bleibt verwehrt, weil ich den Scheiß pervers auf alle Zeiten klär'
Pack mein Namen in 'ne Suchmaschiene
Alle, die noch haten, haben ihr Studio in der Duschkabine
Seid froh, dass ich so cool agiere
Hab' schon auf Teil zwei gesagt, für Fehler zu penibel
Gib mir mein Money, Kies, Schotter, Patte, Moos
Ich bring' verschiedene Dinge zusammen wie'n Katalog
Ich bin die Quelle, du Otto,versetz' dich in Extase
Du stehst hiermit vor dem Aus wie 'ne Eckfahne
Uh, Hundekind, tu nicht, als ob wir Kumpels sind
Um dich unbedingt umzubringen, bis zur letzten Sekunde King
Ich mach' mein Ding, es geht immer mehr Richtung Tunnelblick
Frag nicht, warum, als ob es irgendwas zu gucken gibt
Ihr macht auf Untergrund wie mit Rucksack und gucken dumm
Ungesund, Tschuldigung, was ist das, Hass oder Bewunderung?
Red dir mal nicht die Zunge wund, dumme Jungs, Villakunterbund
Andere richtung, schwanger, wenn nicht, dann schließ mal den Muttermund

[Hook: Kool Savas]
Wir sind Heavy-Metal-Spitter, die Eliteeinheit, schießen diese MCs übern Ha-a-a-aufen
Bind deine Schuhe und dann lauf, Forest lauf, ansonsten gibts den:
Bo-Bo-Bo-Bo-BoyakashotBo-Bo-Bo-Bo-BoyakashotBo-Bo-Bo-Bo-BoyakashotBo-Bo-Bo-Bo-Boyakashot

[Bridge/Sample]
I wanna be down with king!

[Hook: Kool Savas]
Wir sind Heavy-Metal-Spitter, die Eliteeinheit, schießen diese MCs übern Ha-a-a-aufen
Bind deine Schuhe und dann lauf, Forest lauf, ansonsten gibts den:
Bo-Bo-Bo-Bo-BoyakashotBo-Bo-Bo-Bo-BoyakashotBo-Bo-Bo-Bo-BoyakashotBo-Bo-Bo-Bo-Boyakashot

","https://genius.com/Kool-savas-booyaka-shot-lyrics","Released March 12, 2010
Distributor

    
      Groove Attack
Copyright ©

    
      Essah Entertainment
Phonographic Copyright ℗

    
      Essah Entertainment
Photography

    
      Katja Kuhl
Executive Producer

    
      Kool Savas
Artwork

    
      Eric Ullrich
Label

    
      Essah Entertainment
Featuring

    
      Alex Prince, Amar, Azad & 16 more
Producers

    
      Bazz, Benlo, Big Bazz & 7 more
Writers

    
      Alex Prince, Amar, Azad & 27 more
Additional Drums

    
      Igor Lier
Additional Vocals

    
      Ioredana Doleo & Naomi Jackson"
"7","Kool Savas","Weg Nach Draussen","Die john bello story iii","[Verse I:]
Eyo, ich traf dich im Club, du warst da mit nem Jungen
An der Wand mit nem Glas in der Hand
Und ich sah dir mitten ins Gesicht
Doch du wandtest deinen Blick
Ab, machtest vor mir auf arrogant
Und trotzdem sprach ich dich an
Wollte wissen was geht
Aber du fragtest nur: ""Wer bist du?""
Bitte fick ma nicht meinen Kopf
Ich war grad auf der Stage
Und du weißt es, gib es ehrlich zu
Also mach nicht auf geil, du bist nichtmal ne Zwei
Du denkst du wärst heiß, doch bist dumm wie ein Stein
Spar dir den Scheiß, ich hoff dass du es begreifst
Es tut mir so leid, jetzt ist die Party vorbei

[Refrain:]
Kennst du den Weg nach draussen?
Die Treppe runter und dann geradeaus
Besser du gehst gleich nach Hause
Für dich ist jetzt der Abend aus
Kennst du den Weg nach draussen?
Die Treppe runter und dann geradeaus
Besser du gehst gleich nach Hause
Für dich jetzt die Party aus

[Bridge:]
Mach ich keine Party, machst du keine Party
Mach ich keine Party, machst du keine Partyty
Denn die Party ist fürn Arsch, wenn die Nutte nicht bläst

[Verse II:]
Sie denkt, dass ich blöde bin, macht einen auf Schönheitskönigin
Bitte wart ne Sekunde, sag nix
Ich stell mir grad vor, wie mein Dick in deinen Mund wie ein Hors d'œuvre dringt
Und bitte laber nicht über ""Du bist so gefragt""
Denn ehrlich, ich hab dich nichtmal gefragt
Raps Vincent Chase sag, Bitch wie gehts?
Sie blowt in der Ecke und ich spritz ins Face
Easy Ho (Ho), sieh mal links, sieh mal rechts
Die Auswahl ist hier riesengroß (groß)
Wenn ich Bock hab ist die Party hier gelaufen für dich rigoros (ros)
Der Fun is grad kurz vorm Ende wie ein Y
Keiner kann dir helfen, wenn der Clubbesitzer kommt
Drum wärs besser für dich Hure mitzukommen
Kein Zwang, nur die Fakten
Du hast keinen Mann, also lass die Faxen
Lässt keinen ran, aber bist am Tanzen
Sag, was willst du in diesem Club?
Und du frontest eiskalt, perverser Reinfall
Bitte gebiet jemand dieser Ollen mal Einhalt
Wenn du der Meinung bist dass ich da heut nicht reinhalt...

[Refrain]","https://genius.com/Kool-savas-weg-nach-draussen-lyrics","Released March 12, 2010
Distributor

    
      Groove Attack
Copyright ©

    
      Essah Entertainment
Phonographic Copyright ℗

    
      Essah Entertainment
Photography

    
      Katja Kuhl
Executive Producer

    
      Kool Savas
Artwork

    
      Eric Ullrich
Label

    
      Essah Entertainment
Featuring

    
      Alex Prince, Amar, Azad & 16 more
Producers

    
      Bazz, Benlo, Big Bazz & 7 more
Writers

    
      Alex Prince, Amar, Azad & 27 more
Additional Drums

    
      Igor Lier
Additional Vocals

    
      Ioredana Doleo & Naomi Jackson"
"8","Kool Savas","Orchestrator","Die john bello story iii","[Kool Savas]
Hey! Hey! Erc! Fick auf alles.Sie nennen mich den...

[Hook 1: Kool Savas]
(Orchestrator)Denn ich geb' den Ton an, Ton an, Ton an
Flow so pervers, so(hardcore)
Sie folgen mir, ich(fahr' fort)
Das ist mehr als Musik, eine riesige Symphonie
Hö-hö-hö-hö-hört ihr das?
Sie nennen mich den(Orchestrator)
Denn ich geb' den Ton an, Ton an, Ton an
Flow so pervers, so(hardcore)
Sie folgen mir, ich(fahr' fort)
Das ist mehr als Musik, eine riesige Symphonie
Hö-hö-hö-hö-hört ihr das?
Sie nennen mich den...

[Verse 1: Kool Savas]
Orchestrator
Meine Stimme: mein Instrument, wie jedes Kind erkennt
Guck, ich mach' Moves, während ihr Stümper pennt
Was für Dörfler? Ihr seid Hinterländerdes KondensatorMic auf ""On"" und ich komm' und ermorde dich
Denn du Horst erlebst den nächsten Morgen nicht
Trost, während deine Ho am Morgen isst, haha-ha
Witzig, oder?Wir ficken und bespucken diese Bitch wie Kobra
Film Pro, gibt mir Chips und Cola, Nacho, Cheese, Salsa, Popcorn
Ich bin Gaga wie die Lady
Knall' deine Mom wie der Vadder, mach'n Baby
Boom Shakalaka, du kannst kommen mit dem Crazy Frog
Ich ramm' euch in den Boden wie Heringe.""Boah
Ist das zu fassen? Der Dude hat nicht mehr seine Sinne beisammen
Er spinnt, er trinkt Chlor.""Der Burner wie Lauda
Ich zieh' deinem Körper die Haut ab
Hüpf' mal davon, du störst meine Aura
Brett vor'm Kopf, du gehörst in den Baumarkt
Das wird hot, hot, hot, hot, hot, hör meine Sauna
Sie sehen, was ich mach', wie ich austick', fragen: ""Was' hier los?
Ob ich denk', was er tut ist gut? Nein, das ist mir zu hirnlos.""
Und ich komme, wie [?], Essah, [?]
[?], bums' dein' Arsch sofort
Jeder wär' gerne so wie er, Kool S,Rap's Pavarotti
Besser auch bekannt als...

[Hook 1]
(Orchestrator)Denn ich geb' den Ton an, Ton an, Ton an
Flow so pervers, so (hardcore)
Sie folgen mir, ich (fahr' fort)
Das ist mehr als Musik, eine riesige Symphonie
Hö-hö-hö-hö-hört ihr das?
Sie nennen mich den (Orchestrator)Denn ich geb' den Ton an, Ton an, Ton an
Flow so pervers, so (hardcore)
Sie folgen mir, ich (fahr' fort)
Das ist mehr als Musik, eine riesige Symphonie
Hö-hö-hö-hö-hört ihr das?
Sie nennen mich den...

[Verse 2: Ercandize]
Orchestrator, er spielt für dich die Balalaika
Bitte geh beim Ausgang, denn du gibst hier das Mic ab
Schnapp dir 'ne Flöte, mach damit weiter
Jap, das Leben ist keine Freifahrt, du musst noch pauken und beten
Ich übernehm' mit Pauken, Trompeten
Ich hab keine Zeit mehr, viel zu tun
Du- bock, bock, bock, rappst wie ein Huhn
Ich gebe dir den Tak-tak-tak-tak-takt vor
Gebe Gas, überroll' wie'n Traktor
Jage dich und die Gang raus zum Stadttor
Ihr seid nur'n Blasorchester, Fagotten und Klarinetten
Rap und ich gehören zusammen wie der Ruhrpott und Adiletten
Reiß' dir das Mic aus der Hand wie KanyeUnd wir machen P-p-party
Dass ihr keine Platten mehr verkauft f-find ich
Wirklich-wirklich-wirklich schade, mach doch Songs wie Sade
Ich mein' ""Lovers Rock"" und ""By Your Side""
Und wenn du so hart bistWarum sind in deinem Block nur Heiopeis?
Leute sagen: ""Guck, dieser Erc ist komisch
Erzählt Unsinn."" Das klingt logisch
Wenn es so ist, ist es so nicht, anders ist es so und so nicht - Spaß
Alle wollen wissen, wer der Typ ist
Ich bin ehrlich, nein, ich lüg' nicht
Man kennt mich als höflich und nett, intelligent
Und türkisch und als...

[Hook 2: Kool Savas]
(Orchestrator)Denn ich geb' den Ton an, Ton an, Ton an
Flow so pervers, so (hardcore)
Sie folgen mir, ich (fahr' fort)
Das ist mehr als Musik, eine riesige Symphonie
Hö-hö-hö-hö-hört ihr das?
Sie nennen mich den (Orchestrator)Denn ich geb' den Ton an, Ton an, Ton an
Flow so pervers, so (hardcore)
Sie folgen mir, ich (fahr' fort)
Das ist mehr als Musik, eine riesige Symphonie
Hö-hö-hö-hö-hört ihr das?
Sie nennen...

[Bridge: Sängerin in der Hook]
Ihn den Orchestrator
Denn er gibt den Ton an, Ton an, Ton an
So, so pervers, so hardcore
Sie folgen ihm, er fährt fohrt
Das ist mehr als Musik, eine riesige Symphonie
Hört ihr das? Yeah, es ist der Orchestrator
Denn er gibt den Ton an, Ton an, Ton an
So, so pervers, so hardcore, er fährt fohrt
Das ist mehr als Musik, eine riesige Symphonie
Hört ihr das? Das ist der...

[Hook 1]

[Outro: Sängerin]
Orchestrator... Oh. Ah. Ah. Ah. Ah. Ah. Ah. Ah. Ah. Ah. Ah
Werd Teil der RGD-Community!","https://genius.com/Kool-savas-orchestrator-lyrics","Released March 12, 2010
Distributor

    
      Groove Attack
Copyright ©

    
      Essah Entertainment
Phonographic Copyright ℗

    
      Essah Entertainment
Photography

    
      Katja Kuhl
Executive Producer

    
      Kool Savas
Artwork

    
      Eric Ullrich
Label

    
      Essah Entertainment
Featuring

    
      Alex Prince, Amar, Azad & 16 more
Producers

    
      Bazz, Benlo, Big Bazz & 7 more
Writers

    
      Alex Prince, Amar, Azad & 27 more
Additional Drums

    
      Igor Lier
Additional Vocals

    
      Ioredana Doleo & Naomi Jackson"
"9","Kool Savas","Merk Dir Meinen Namen","Die john bello story iii","[Kool Savas:]
Man nennt mich E S S A H
Und laut Bravo ist hier jeder jetzt am Start
Bringt den Besten aber
Spätestens am Grab merkt ihr
Das hier ist kein Spaß
Komm ich Piss dir in dein GlasDas ist Urin Geller! TRINK!
Wirklich wahr
Du versucht den Laden zu schmeißen
Du Spinnst!
Ich fick dein ArschUnd verfluch den Vater von Deichkind
Es reicht mir
Get paied
Ich tret Jigga's Sekte bei
Heute heißt mein Flow kurz vor dem Unfall
Der lezte Schrei!

[Franky Kubrick:]
Sie nenn' mich
F R A N K Y K U B R I C K
Ihr ficker, dreht das L A U T
Eyey yo Kumpel konkurenz gibt es nicht
Wenn sag mir W O sag mir W E R
Sonst hier im Buissnes
Komm bringt ruhig jeden her
Legendär
Rettung für Rap und Guerilla-Gegenwehr
Ich red' nicht mehr
Geh besser in Deckung
Vor diesem Besen hier
Jetzt sag schon ihr Pisser
Was wollt ihr tunSobald wir spitten bring wir diese Gewitter wie ein Monsun

[Refrain - Moe Mitchell:]
Merk dir mein Namen
Ich schreibs wie writer an die Wand
Und mach weiter bis ich einfach nicht mehr kann
Das hier ist meine MarkeMein Trademarkmein Image
Kein Fake kram das bin IchAlso sing esMerk dir mein Namen2x

[Olli Banjo:]
Sie nenn' mich B A N J O
Ich fick das Game mit nem' stählernen Kondom
Ich hol die Kohle von der GEMA
Denn trotz roter zahlen der
Tonträgerproduktionen
Deutsche Rapper heulenRapper, Leute meckern, heucheln, täuschnLeute mit dem neuen Trend
Heute Techno morgen ein neuer Rapper
Neue Kette neuer Haircut, enge Hosen
Cowboystiefel - Diese Astronauten sehen morgens eine Frau im Spiegel

[Mo Trip:]
Man nennt mich T R I zum P
Ich kam auf meinem weitem Weg
Erst hier zum Stehn
Anstatt wie früher alles Negativ zu sehnHab ich beschlossen meinen Weg jetzt
Hier zu gehn
Glaub mir wenn ich mich nicht immer
Richtig entschieden hab
Weiß ich jetzt die Richtung ist richtig
Ich rieche das
Und falls du mich nicht verstehst
Kein Problem ich buchstabier's dir mal
I C H F I C K D I C H","https://genius.com/Kool-savas-merk-dir-meinen-namen-lyrics","Released March 12, 2010
Distributor

    
      Groove Attack
Copyright ©

    
      Essah Entertainment
Phonographic Copyright ℗

    
      Essah Entertainment
Photography

    
      Katja Kuhl
Executive Producer

    
      Kool Savas
Artwork

    
      Eric Ullrich
Label

    
      Essah Entertainment
Featuring

    
      Alex Prince, Amar, Azad & 16 more
Producers

    
      Bazz, Benlo, Big Bazz & 7 more
Writers

    
      Alex Prince, Amar, Azad & 27 more
Additional Drums

    
      Igor Lier
Additional Vocals

    
      Ioredana Doleo & Naomi Jackson"
"10","Kool Savas","Asoun & Derya Skit","Die john bello story iii","[Skit: Asoun &Derya]
„Ey, Süße, weißt du, wen ich voll so sweet finde?“
„Sag, ich schwör'“
„Ich schwör', Savas, er ist so hübsch, ich schwör', er hat voll so sanfte Haut, so wie Babykatze, is so.“
„Ey, hau ab, du Ppfer, bis du dumm oder was ? Sa-Savas, nee, er is so hässlig, weiß du's!“
„Halt dein Maul, sein Haut, nee, sie is voll so porenfrei, ich schwör'!“
„Ja, bei sein Gesicht vielleicht. Aber ich schwör', ich hab' doch grade dem letzt so ein Bericht auf Arte über ihn gesehen, weiß du. Sie sind so mit Kamera ganz nah bei sein Rücken gegangen, weil er hat doch Ding. Er hat doch den Kopf von Johann Sebastian Bach da bei sein Rücken tätowieren lassen. Weißt du's. Ich schwör', bei sein Rücken überall Pickel, weiß du's.“
„Na und? Ich schwör', das würde ich ihm voll so verzeihen. Außerdem ich mag Johann Sebastian Bach sowieso nicht. Er hatte voll so fettiges Haar. Dann würde ich Savas eben sagen, er soll Unterhemd anziehen, wenn wir rummachen, ich schwör'.“
„Ich schwör', außerdem die Ohren von Savas, ne. Der eine Ohrläppchen, er ist viel dicker als der andere. Tam, so unsymetrisch, weiß du's“
„Na und das würde ich ihm auch voll so verzeihen. Ich schwör', ich wär' voll so gern mit ihm zusammen, is so!“
„Du stehst immer nur auf tam so Opfers, ich schwör'. Der einzige Rapper der hübsch ist, ne, das ist Haddaway!“
","https://genius.com/Kool-savas-asoun-and-derya-skit-lyrics","Released March 12, 2010
Distributor

    
      Groove Attack
Copyright ©

    
      Essah Entertainment
Phonographic Copyright ℗

    
      Essah Entertainment
Photography

    
      Katja Kuhl
Executive Producer

    
      Kool Savas
Artwork

    
      Eric Ullrich
Label

    
      Essah Entertainment
Featuring

    
      Alex Prince, Amar, Azad & 16 more
Producers

    
      Bazz, Benlo, Big Bazz & 7 more
Writers

    
      Alex Prince, Amar, Azad & 27 more
Additional Drums

    
      Igor Lier
Additional Vocals

    
      Ioredana Doleo & Naomi Jackson"
"11","Kool Savas","Rhythmus Meines Lebens","Die john bello story iii","[Hook: Corona]
This is the rhythm of the night, the night, oh yeahThis is the rhythm of my life, my life, oh yeahThe rhythm, this is the rhythm of the night, the night, oh yeahThis is the rhythm of my life, my life, oh yeahThe rhythm, this is the rhythm of the night

[Verse 1: Kool Savas]
Die Taschen sind gepackt nach einer durchgemachten Nacht
Wir haben noch acht Stunden Fahrt bis in Deine Stadt
Stell die Lehne maximal zurück, das Telefon auf lautlos
Nenn mich Peter Lustig, denn ich leb in einem Auto
Ich bin Globetrotter, seh das ganze Land hier, denn ich flow so locker
Wohne ausm Koffer und die Dudes von früher? Oberopfer!
Ich mach heute Kohle, Schotter, Scheine, Kies - mies oder?
Und das ohne Abschluss! Wie sich sowas anfühlt? Wie im Urlaub!
Alles klaro, heute Nacht in Kassel morgen ab nach Glarus
Und wir brauchen Nahrung, kurzer Schlenker über Zürich Bahnhof
Roaming aus,Liste klären, einchecken, Mic checken
Zwei Stunden schlafen, in die Dusche jetten, dann zum Auftritt
Leute warten vor der Tür, schießen Fotos, geben Shakes
Fragen mich, wie steht’s? Alles bestens, Sir Jai läuft zur Stage
Baut sein Set auf, ich zieh meinen Hoodie aus und setz mein Cap auf
Geh zur Bühne, hör die Intro-Melodie, ab dann ist Blackout
Des ist der Rhythmus meines Lebens

[Hook: Corona]
This is the rhythm of the night, the night, oh yeah
This is the rhythm of my life, my life, oh yeah
The rhythm, this is the rhythm of the night, the night, oh yeah
This is the rhythm of my life, my life, oh yeah
The rhythm, this is the rhythm of the night

[Verse 2: Kool Savas]
In Frankfurt schreien sie ""Gude is auch Azad da?""Wir performen Monstershit, veranstalten ein Massakka
Die Leute schwitzen, Wasser marsch!
Und als wir fahren können wir noch ihre Chöre hören
Doch wir sind inzwischen schon in Nürnberg, bringen den Hirsch zum röhren
Ich lieb den Süden und der Süden liebt den Sound
Wie ich drauf komme? Backstage München immer ausverkauft
Stuttgart springt die ganze Nacht,das Feuerwerk in HeidelbergLässt das Schloss erleuchten in der für mich schönsten Stadt in Deutschland
Abstecher nach Neckargemünd, ich werd melancholischBretter los nach Mannheim,wo die Bellos warten auf‘n Forumtreffen
Hamburg, Erfurt, Kölle, Bremen, Bochum, Düsseldorf und Würzburg
Aachen plus Berlin, sie alle pushen diesen deutschen Türken
Linz und Innsbruck, sie finden diese Texte geil
Feiern diese Bars in Graz, inWien gibt’s immer Fetzerei
Drum fahren wir in die Schweiz: Zürich, Basel, Bern und Biel
Und am nächsten Tag ins weitentfernte Kiel
Ihr wisst Bescheid, des ist der, des ist der
Rhythmus meines Lebens

[Hook: Corona]
This is the rhythm of the night, the night, oh yeah
This is the rhythm of my life, my life, oh yeah
The rhythm, this is the rhythm of the night, the night, oh yeah
This is the rhythm of my life, my life, oh yeah
The rhythm, this is the rhythm of the night

[Bridge: Kool Savas]
Hebt die Hände in die Luft für die Stadt, die ihr liebt
Heut Nacht lassen wir es krachen, bis es von der Decke trieft
Das ist der Rhythmus meines Lebens, der Rhythmus meines Lebens
Das ist der Rhythmus meines Lebens, der Rhythmus meines Lebens
Hebt die Hände in die Luft für die Stadt, die ihr liebt
Heut Nacht lassen wir es krachen, bis es von der Decke trieft
Das ist der Rhythmus meines Lebens, der Rhythmus meines Lebens
Das ist der Rhythmus meines Lebens, der Rhythmus meines Lebens","https://genius.com/Kool-savas-rhythmus-meines-lebens-lyrics","Released March 12, 2010
Distributor

    
      Groove Attack
Copyright ©

    
      Essah Entertainment
Phonographic Copyright ℗

    
      Essah Entertainment
Photography

    
      Katja Kuhl
Executive Producer

    
      Kool Savas
Artwork

    
      Eric Ullrich
Label

    
      Essah Entertainment
Featuring

    
      Alex Prince, Amar, Azad & 16 more
Producers

    
      Bazz, Benlo, Big Bazz & 7 more
Writers

    
      Alex Prince, Amar, Azad & 27 more
Additional Drums

    
      Igor Lier
Additional Vocals

    
      Ioredana Doleo & Naomi Jackson"
"12","Kool Savas","Immer das Schlechte (Stop, Stop)","Die john bello story iii","[Refrain - Olli Banjo]
Sie wollen immer das Schlechte sehen
Immer dann, dann wenn sie die Besten sehen
Wir rollen doch nur auf dem besten Weg
Warum können sie uns nur so schlecht verstehen?
Stop, Stop! Hatet nicht mehr Stop, Stop! Redet nicht mehr
Psst, Psst! Redet nicht mehr Schrott, Schrott, redet nicht mehr
Stop, Stop! Hatet nicht mehr Stop, Stop! Redet nicht mehr
Psst, Psst! Redet nicht mehr Schrott, Schrott, redet nicht mehr

[Verse I - Kool Savas:]
Los stell mal dein Handywecker auf Sieben
Denn ich warte vor deiner Tür mit ’nem Rohr und der Vaseline
Hey, der Spaß beginnt ich vergase Spinner
Mit ’nem Flow bei dem jeder von euch Herzrasen kriegt
Sie rotten sich wie Hippies in WGs
Essah der King,ein Fresh-Spitter wie Febreze
Komm, wir geben dir ’ne Abreibung wie Sohlen
Praktizieren bei dir das Abschneiden von Hoden
Diese Rapper killen und quälen
Am Mic grillen und gehen keine Problem
Das ist fast eine Gewohnheit
Lass mal deine komischen Versuche zu haten
Sie packen an meine Hose, wollen an meine Moneten, aber nein!
Titten auf den Tisch, wer ist besser? Du oder Ich? Ich oder du?Keine Ahnung, blick in die Juice
Ich riskier ’ne dicke Lippe wie Jigga
Doch kanns auch während du deiner Mama den Schwanz saugst

[Verse II - Curse:]
Ich trink keine Cola mehr nur Dosenbier
Tausch süß gegen bitter,so kritisch wie Oberlehrer
Meine Welt durch IC-Brillen fokusiert
Evaluier den ganzen Hokuspokus hier
Die Welt ist krank, ich stau mein Geld im Schrank
Investier das, gehirnloser Modejunk
Immerhin bin ich Stylebewusst
Ohne das war mir im Knast meiner Zwänge nur ’n Scheiß bewusst
Ich kauf Louis Vuitton
Wasserabweisende Tasche für ReisenWo die Laschen nicht reißen
Denn was für Kanye gut istKann für den Mensch nicht schlecht sein
Ich glaube ich brech ein
Ich wehr' mich dagegen ein Opfer zu sein
Red' mir ein, noch im Polo 'n Popstar zu sein
Doch die Gier nach dem Bling entlarvt mich
Ich bin halt Rapstar, Jungs habt Nachsicht

[Refrain]

[Verse III - Ercandize:]
Ich spucke diese Dinger in dein Ohr du Freak
Du weißt alle deine Homies sind ’ne Horde weaker Scheiß
Und komm battle mich, schick deine Outlaws
Du bist nur ein kleiner Penis, schick deine Frau vor
Ich steh vor deiner Tür, schieb deine Couch vor
Klopf, klopf, Erc kommt, Raubmord
Ruf die Cops und Vetiräner
Leute wie du nehmen die Cocks und essen sie gerne
Leute wie du reden noch, doch essen die Perlen
Leute wie du beten zu Gott um besser zu werden
Doch nix ist! Blick es: Schau in den Spiegel um zu sehen was ’ne Bitch ist
Komm bitte her und erzähl mir mehr
Du bis ’n OG Homie, wie gefährlich
Doch deine Birne blinkt wie ’n Fernlicht
Du bist irgendwie behindert, doch auch irgendwie mehr nicht

[Verse IV - Amar:]
Keiner deiner sogenannten Spitter kann uns annähernd ficken
Wir ticken etwas anders als diese ganzen Stripper, whay!Ihr seid keine Rapcrew, Ihr seid die Chippendales
Motherfucker du bekommst den Dick in den Arsch
Ich geb kein Fick, mit meiner Platte will ich dick in die Charts
Denn du bist einer von den die meinen sie wären die Bären am Mic
Aber ich weiß, du bist höchstens HIM wie die Rockgroup
Was fürn Flow und Style, du bist stockschwul
Wach auf, fuck drauf, Axt raus, durchdrehen, schlacht auf
Amargeddon macht diesen Titel zu ’nem Schlachthaus
Amar, Chave, ich hab gelernt von den Besten, slow down
Style, Flow, Swagger, Mühlheim, Südwesten

[Refrain]

-Folg RapGeniusDeutschland!","https://genius.com/Kool-savas-immer-das-schlechte-stop-stop-lyrics","Released March 12, 2010
Distributor

    
      Groove Attack
Copyright ©

    
      Essah Entertainment
Phonographic Copyright ℗

    
      Essah Entertainment
Photography

    
      Katja Kuhl
Executive Producer

    
      Kool Savas
Artwork

    
      Eric Ullrich
Label

    
      Essah Entertainment
Featuring

    
      Alex Prince, Amar, Azad & 16 more
Producers

    
      Bazz, Benlo, Big Bazz & 7 more
Writers

    
      Alex Prince, Amar, Azad & 27 more
Additional Drums

    
      Igor Lier
Additional Vocals

    
      Ioredana Doleo & Naomi Jackson"
