"";"artist";"title";"album";"text";"url";"metadata"
"1";"Capital Bra";"Berlin lebt";"Berlin lebt";"[Songtext zu „Berlin lebt“]

[Intro]
Bra, bra, bra (Woof, bra)
Ja, bra (Woof, woof, woof, woof, Kuku, Kuku)
Berlin lebt (Woof, bra, woof, bra)
Berlin lebt, Berlin lebt, ja (Jajaja)
(Ja, bra) Geht mal alle beiseite (Hahahaha, hahahaha)
Du weißt Bescheid, Bra
Ihr seid mir nicht gewachsen, Bruder
Ah, brraa

[Part 1]
Fick die Rapper, was die reden, alles Lügen
Abiat, Massari, Abiad, ich packe fette Tüten (Bra)
Berlin lebt, Ghetto, Ghetto, Bra, wir komm'n im Rudel
Was für Fitnessplan, Kolleg? In meiner Gegend fliegen Kugeln (Bra, bra)
Jetzt rollt der Rubel, jetzt kannst du den Bratan googeln (Ja)
Heute ess' ich Steak, gestern Fünf-Minuten-Nudeln (Bra, bra)
Ich bin original, der Rest ist Double
Das Leben ist 'ne Bitch, ich pack' die Schlampe an der Gurgel
Keine Skrupel (Nein), der Bra ist Löwe (Ja)
Guck ma', wie ich nur mit Wörtern meine Feinde töte (Guck)
Der Staat will mich nicht oben seh'n wie Mindestlöhne (Ja)
Aber deren Kinder sehen aus wie meine Söhne

[Hook]
Drück' den AMG 300 und die Erde bebt (Bra)
Ich komm' auf die Bühne und schrei' „Berlin lebt!“
Alles ändert sich, doch niemals Capis Qualität (Qualität)
Ich komm' auf die Bühne und schrei' „Berlin lebt!“
Ghetto, Ghetto, weil in meiner Welt nurParazählt (Ja, bra)
Ich komm' auf die Bühne und schrei' „Berlin lebt!“
Kein'n deutschen Pass, Kolleg, der Schriftantrag wurd' abgelehnt (Hahaha)
Ich komm' auf die Bühne und schrei' „Berlin lebt!“

[Part 2]
Fick die ganzen Hater, ich verteile gutes Beyda (Ja)
An Kunden aus Bayern mit dem Kontostand von Neymar (Ja)
Bratan, was für Schutzgeld? Ich klär' meine Sachen selber (Ja)
Und komm' zum Tisch mit Scharfen, so wie thailändische Kellner
Meine Lehrer fragten damals, „Was soll später aus dir werden?“
Und heute drück' ich Karren mit 680 Pferden (Ja)
Ruf' kurz Ufo an und klär' mir Klunker aus Antwerpen (Ufo)
Bra, ich will nur Geld, ich hab' für Schlampen keine Nerven
Und die ganzen Leute merken (Ja), der Bratan hat ein'n Schaden
Komm' mit Egzon in dein'n Laden, pack' die Stangen in das Laken (Bra, bra, bra)
Keine Wahl, Kolleg, ja, mir knurrt der Magen
Bratan, was für Gangster? Meine Bras sind Psychopathen

[Hook]
Drück' den AMG 300 und die Erde bebt (Bra)
Ich komm' auf die Bühne und schrei' „Berlin lebt!“
Alles ändert sich, doch niemals Capis Qualität (Qualität)
Ich komm' auf die Bühne und schrei' „Berlin lebt!“
Ghetto, Ghetto, weil in meiner Welt nur Para zählt (Ja, bra)
Ich komm' auf die Bühne und schrei' „Berlin lebt!“
Kein'n deutschen Pass, Kolleg, der Schriftantrag wurd' abgelehnt (Hahaha)
Ich komm' auf die Bühne und schrei' „Berlin lebt!“

[Outro]
Berlin lebtBerlin lebt";"https://genius.com/Capital-bra-berlin-lebt-lyrics";"Released June 22, 2018
Distribution

    
      Sony Music Entertainment
Phonographic Copyright <U+2117>

    
      TEAM KUKU
Copyright ©

    
      TEAM KUKU
Mixing Engineer

    
      Lex Barkey
Mastering Engineer

    
      Lex Barkey
Label

    
      TEAM KUKU
Photography

    
      Phong Le
Executive Producer

    
      Laura Heid, Capital Bra & Drilon Cocaj
Featuring

    
      AK Ausserkontrolle, Bausa, Capital T & 6 more
Producers

    
      The Cratez, Danny E.B Tracks & Young Taylor
Writers

    
      AK Ausserkontrolle, Bausa, Capital Bra & 10 more
Composer

    
      Danny E.B Tracks, David Kraft, Tim Wilke & 1 more
Copyright ©

    
      TEAM KUKU"
"2";"Capital Bra";"Kennzeichen B-TK";"Berlin lebt";"[Songtext zu „Kennzeichen B-TK“ ft. King Khalil]

[Part 1: Capital Bra]
Capital, radikal,bleib' am Ball wie Neymar
A7, S-Klasse,Kennzeichen B-TK
Damals hatt' ich nix, heute Geld zähl'n, jeden Tag
Ich komm' vonRap am Mittwochund fick' jeden, der was gegen sagt (Brra)
Bretter' meine Beats, ich rolle durch mein'n Kiez
Was ich rede, das ist echt, was du redest, ist tafnis
Und ich schieß', Berlin Favela, wir verzeihen keine Fehler
Rolle mit 'nem Panamera über meine Mathelehrer(Brra)
Berlin lebt, Ghetto, Ghetto, wir sind anders
Grüße alle Bratans, die Mannschaft bleibt standhaft
Tick'Hazeund kein'n Standard, die Quali muss stimm'n (Uff)
Trag' Gucci, kein Carhartt, im Kopf diese Stimm'n (Ja)
Und ich schnapp' mir paar Mill'n, ab und zu wird's hässlich
Das Leben ist wie Darby, es ballert dich und schmeckt nicht(Ballert)
Die Kripo ist hektisch, die Feinde werd'n zersägt (Brrra)
Ich komm' auf die Bühne und schrei', „Berlin lebt!“

[Pre-Hook: Capital Bra]
Mach' sie alle süchtig, oh, Kolleg, du kennst den Bratan
Denn meine Mucke fließt wie Heroin durch deine Adern
Und die ganzen Rapper labern, dass sie krasse Gangs beschützen
Reden was von Batzen, aber streiten sich um Münzen

[Hook: Capital Bra]
Mach' sie alle süchtig, oh, Kolleg, du kennst den Bratan
Denn meine Mucke fließt wie Heroin durch deine Adern
Und die ganzen Rapper labern, dass sie krasse Gangs beschützen
Reden was von Batzen, aber streiten sich um Münzen

[Part 2: King Khalil]
Ah, zehn Gramm wird weggeraucht, THC und Jacky-Rausch
VerteilePäckchen Staub, du bist ein paar Nächte drauf
Stecherei im Treppenhaus (Ah, ah)
Hol deine Kette raus, sonst schlag' ich dir die Fresse auf
Kuku Team, fette Faust, lukrativ und echter Sound
Bruder kommt von Zelle raus
Und dann wird direkt geraucht (Tschin, tschin)
Keine Argumentation
Scheiß auf Diskussion, wir stoßen euch vom Thron
Aktion Reaktion, keine zweite Option (Heh)
Ein paar Feindemit dem Eisen bedroh'n
Push die Preise nach oben mit reineren Drogen (Drogen)
Ganoven, Scheine mit Strophen
Geb' hundert Prozent, keine Aussage (Nein)
Unsere Welt ist 'ne grausame (Ja)
Sie ist dunkel und kennt keine Ausnahme
Dreh'n Runden im Benz, bis wir auffall'n

[Pre-Hook: Capital Bra]
Mach' sie alle süchtig, oh, Kolleg, du kennst den Bratan
Denn meine Mucke fließt wie Heroin durch deine Adern
Und die ganzen Rapper labern, dass sie krasse Gangs beschützen
Reden was von Batzen, aber streiten sich um Münzen

[Hook: Capital Bra]
Mach' sie alle süchtig, oh, Kolleg, du kennst den Bratan
Denn meine Mucke fließt wie Heroin durch deine Adern
Und die ganzen Rapper labern, dass sie krasse Gangs beschützen
Reden was von Batzen, aber streiten sich um Münzen (Bra)";"https://genius.com/Capital-bra-kennzeichen-b-tk-lyrics";"Released June 22, 2018
Distribution

    
      Sony Music Entertainment
Phonographic Copyright <U+2117>

    
      TEAM KUKU
Copyright ©

    
      TEAM KUKU
Mixing Engineer

    
      Lex Barkey
Mastering Engineer

    
      Lex Barkey
Label

    
      TEAM KUKU
Photography

    
      Phong Le
Executive Producer

    
      Laura Heid, Capital Bra & Drilon Cocaj
Featuring

    
      AK Ausserkontrolle, Bausa, Capital T & 6 more
Producers

    
      The Cratez, Danny E.B Tracks & Young Taylor
Writers

    
      AK Ausserkontrolle, Bausa, Capital Bra & 10 more
Composer

    
      Danny E.B Tracks, David Kraft, Tim Wilke & 1 more
Copyright ©

    
      TEAM KUKU"
"3";"Capital Bra";"Giselle Bündchen";"Berlin lebt";"[Intro]
Ja

[Part 1]
Frag in der Gegend, der Bra ist Stecher
Der Kripo ist frech, doch der Bra ist frecher
Hau' auf sein'n Kopf mit ei'm Aschenbecher (bam)
Bra, mir geht's gut, frag mein'n Taschenrechner (woof)
Gib mir noch ein'n Becher mit Cola undHennessy(ja)
Oder mitWoddiund Energy(woof)
Wen soll ich ficken, Nadine oder Melanie? (wen?)
Bitte, vergleich nicht dein'n Ford mit ei'm Ferrari
Hajde, bra,c'est la vie, ich muss jetzt weiter (wrmm)
Gib mal ein'n Fick auf die Neider (fick' euch)
Für den brandneuen Daimler
Verkauf' ich paar Gramm an den Gucci-Designer(hier)
Fick' auf die Weiber, ich will nur Money
Kämpfer seit Tag eins wieMuhammad Ali(bam, bam, bam)
Der Rest wird gefickt wie Gaddafi
Verpiss dich mit Kirsche, ich trink' nur Safari (nur Safari)
Rolle im roten Bugatti, Capital Bratan, ich bleibe der Täter
Steche dem Hurensohn in seine Leber
Weil er ist ein AfD-Wähler (hah)
Komme im Porsche Carrera (uff)
Oder im nagelneuen Benz
Lad' die Knarre nach, knall' sie alle ab
Auf der AfD-Pressekonferenz, bra

[Hook]
Wir machen Para wie keiner (bra)
Ich hab' den Stoff wie Designer(bra)
Ich bring' das Flex für die Weiber (bra)
Und hier noch ein „Bra“ für die Neider (bra)
Wir machen Para wie keiner (bra)
Ich hab' den Stoff wie Designer (bra)
Ich bring' das Flex für die Weiber (bra)
Und hier noch ein „Bra“ für die Neider (bra)

[Part 2]
Die Schlampe macht auf Model, ein'n auf Gisele Bündchen (jajaja)
Ich geb' ihr mein'n Yarak und sie dir dann Küsschen (ja)
Sie macht ein'n auf schüchtern, ein'n auf Mauerblümchen (ja, haha)
Doch wenn ich will, verkauft die Schlampe für mich Tütchen (woof)
Denn sie will auch nur Para, Ferrari mit Alcantara (wrmm)
Holt sich hundert Dinger, zwanzig Dinger kriegt der Fahrer
Capital,Ganja-Farmer, ich mach' keine halben Sachen
Kreidepacken (Bratan)
Ich lass' kein'n von meinen Feinden schlafen
Du holst zwanzig Leute
Bratan, ich hol' nur ein'n Albo (qija nonen)Er schießt von weitemDoch er trifft wie C. Ronaldo (bam, bam, bam)
Drauf wie Falco, bra, das Zeug macht einen happy (hahahaha)
Ich komm' zum Gericht mit einer Flasche Jacky (woof)
Der Anwalt kriegt ein'n Batzen (ja)
Der Richter ist am Platzen (ja)
Denn auf einmal will kein Zeuge mehr den Bra belasten
Ich weiß, dass sie mich hassen
Ich kann's in den Augen seh'n
Doch sie können alle blasen (alle)
Weil ihn'n die Beweise fehl'n, bra

[Pre-Hook]
Wir machen Para wie keiner (bra)
Ich hab' den Stoff wie Designer (bra)
Ich bring' das Flex für die Weiber (bra)
Und hier noch ein „Bra“ für die Neider (bra)
Wir machen Para wie keiner (bra)
Ich hab' den Stoff wie Designer (bra)
Ich bring' das Flex für die Weiber (bra)
Und hier noch ein „Bra“ für die Neider (bra)

[Hook]
Wir machen Para wie keiner (bra)
Ich hab' den Stoff wie Designer (bra)
Ich bring' das Flex für die Weiber (bra)
Und hier noch ein „Bra“ für die Neider (bra)
Wir machen Para wie keiner (bra)
Ich hab' den Stoff wie Designer (bra)
Ich bring' das Flex für die Weiber (bra)
Und hier noch ein „Bra“ für die Neider (bra)";"https://genius.com/Capital-bra-giselle-bundchen-lyrics";"Released June 22, 2018
Distribution

    
      Sony Music Entertainment
Phonographic Copyright <U+2117>

    
      TEAM KUKU
Copyright ©

    
      TEAM KUKU
Mixing Engineer

    
      Lex Barkey
Mastering Engineer

    
      Lex Barkey
Label

    
      TEAM KUKU
Photography

    
      Phong Le
Executive Producer

    
      Laura Heid, Capital Bra & Drilon Cocaj
Featuring

    
      AK Ausserkontrolle, Bausa, Capital T & 6 more
Producers

    
      The Cratez, Danny E.B Tracks & Young Taylor
Writers

    
      AK Ausserkontrolle, Bausa, Capital Bra & 10 more
Composer

    
      Danny E.B Tracks, David Kraft, Tim Wilke & 1 more
Copyright ©

    
      TEAM KUKU"
"4";"Capital Bra";"Neymar";"Berlin lebt";"[Songtext zu „Neymar“ ft. Ufo361]

[Intro: Capital Bra]
Na na na na na na na na, na na na na na na na
Na na na na

[Pre-Hook: Capital Bra]
Und der Richter schreit, ich war der Täter(Der Richter schreit, ich war der Täter)Doch heut bin ich ein Star, so wie Neymar(Bin ich ein Star, so wie Neymar)
Und die Kahba auf Beyda(Und die Kahba auf Beyda)Sie leckt an mei'm Yarak und ich an mei'm Paper

[Hook: Capital Bra]
Und der Richter schreit, ich war der TäterDoch heut bin ich ein Star, so wie Neymar
Und die Kahba auf BeydaSie leckt an mei'm Yarak und ich an mei'm Paper
Weit und breit keine Gegner
Ach, komm, wir wechseln das Thema
Ich will 22-Zoll-Räder
Und die Sitze aus Leder
Und der Richter schreit, ich war der TäterDoch heut bin ich ein Star, so wie Neymar
Und die Kahba auf BeydaSie leckt an mei'm Yarak und ich an mei'm Paper
Weit und breit keine Gegner
Ach, komm, wir wechseln das Thema
Ich will 22-Zoll-Räder
Und die Sitze aus Leder

[Part 1: Capital Bra]
Hier in meiner Welt geht's um UmsatzBau' mir ein'n Ler, ich rauch' ihn zur HälfteDer Rest ist für 2Pac
Ich hab' Ghetto-Massari gebunkert
Nenn mich nicht Bruder, außer wenn du mich kennst
Bra, ich rauch' Baba-Weed, fahre vor in 'nem Benz
Zu der Gucci-Boutique (Brra)
Sag mir, Bra, wer will Beef?
Ich mach' Para, das Kies
Käppi tief und ich schieß'
Roll' im Benz durch mein'n Kiez, locker easy, Kolleg
Ja, der Bra holt sich sein'n Respekt
Auch wenn's keiner von euch versteht
Dass der lila Batzen mir schmeckt
Komm' und baller' sie weg
Nur noch Cash in mei'm Head
Jeder Song ist ein Brett
Roll noch ein'n, ich bin fett
Roll noch ein'n für den BraUnd ich zieh', zieh'-zieh' am Saruch
Komm, wir vergessen, was war
Denn ab heute geht es uns gut
Bra, ich krieg' nicht genug
Alle Scheine sind bunt
Du hältst besser den MundWenn die Kripo mich sucht
Versteck' ich mich bei Freunden
Ich geh' los, bedroh' den Zeugen
Ja, ich sitz' vor Gericht, die Beweise sind frisch
Doch ich werde alles leugnen

[Pre-Hook: Capital Bra]
Und der Richter schreit, ich war der Täter(Der Richter schreit, ich war der Täter)Doch heut bin ich ein Star, so wie Neymar(Bin ich ein Star, so wie Neymar)
Und die Kahba auf Beyda(Und die Kahba auf Beyda)Sie leckt an mei'm Yarak und ich an mei'm Paper

[Hook: Capital Bra]
Und der Richter schreit, ich war der TäterDoch heut bin ich ein Star, so wie Neymar
Und die Kahba auf BeydaSie leckt an mei'm Yarak und ich an mei'm Paper
Weit und breit keine Gegner
Ach, komm, wir wechseln das Thema
Ich will 22-Zoll-Räder
Und die Sitze aus Leder

[Part 2: Ufo361]
Es war dunkel, doch ich sah das Licht, ey
Acker' täglich, nein, ich warte nicht, ey
Hör mein Album, ja, alles Hits, ey (Ja, ihr wisst Bescheid)
Gebe Gas, ja, mein Wagen flitzt (Ja, ja, ja, ey)
Fahr' durch die Straßen im Rari, ja (Skrrt)
Mache jetzt Urlaub auf Bali, ja
Spiel' mit der Bitch wie 'ne Barbie, jaBin ein Playboy, so wie Carti, ja
Oh no, no, no
Ja, sie klau'n meine Flows
Traue nur meinen Bros, traue nur meinen Bros
Fliegen rauf bis zum Mond, ey (Ey)
Diamanten aus Antwerpen, ey (Ey)
Ja, wir bleiben, bis wir sterben, ja, ja
Digga, glänzen, so wie Sterne, ja, oh
Ihr wisst Bescheid, Stay High

[Pre-Hook: Capital Bra]
Und der Richter schreit, ich war der Täter(Der Richter schreit, ich war der Täter)Doch heut bin ich ein Star, so wie Neymar(Bin ich ein Star, so wie Neymar)
Und die Kahba auf Beyda(Und die Kahba auf Beyda)Sie leckt an mei'm Yarak und ich an mei'm Paper

[Hook: Capital Bra]
Und der Richter schreit, ich war der TäterDoch heut bin ich ein Star, so wie Neymar
Und die Kahba auf BeydaSie leckt an mei'm Yarak und ich an mei'm Paper
Weit und breit keine Gegner
Ach, komm, wir wechseln das Thema
Ich will 22-Zoll-Räder
Und die Sitze aus Leder
Und der Richter schreit, ich war der TäterDoch heut bin ich ein Star, so wie Neymar
Und die Kahba auf BeydaSie leckt an mei'm Yarak und ich an mei'm Paper
Weit und breit keine Gegner
Ach, komm, wir wechseln das Thema
Ich will 22-Zoll-Räder
Und die Sitze aus Leder";"https://genius.com/Capital-bra-neymar-lyrics";"Released June 22, 2018
Distribution

    
      Sony Music Entertainment
Phonographic Copyright <U+2117>

    
      TEAM KUKU
Copyright ©

    
      TEAM KUKU
Mixing Engineer

    
      Lex Barkey
Mastering Engineer

    
      Lex Barkey
Label

    
      TEAM KUKU
Photography

    
      Phong Le
Executive Producer

    
      Laura Heid, Capital Bra & Drilon Cocaj
Featuring

    
      AK Ausserkontrolle, Bausa, Capital T & 6 more
Producers

    
      The Cratez, Danny E.B Tracks & Young Taylor
Writers

    
      AK Ausserkontrolle, Bausa, Capital Bra & 10 more
Composer

    
      Danny E.B Tracks, David Kraft, Tim Wilke & 1 more
Copyright ©

    
      TEAM KUKU"
"5";"Capital Bra";"5 Songs in einer Nacht";"Berlin lebt";"[Hook]
Bratan, ich hab' damals schon dieSteineabgepackt
Ja, ich hab' damals schon die Kripos abgefuckt
Alles ist okay, solang' der Bratan Scheine macht
Und wenn ich will, mach' ich fünf Songs in einer Nacht
Bratan, ich hab' damals schon die Steine abgepackt
Ja, ich hab' damals schon die Kripos abgefuckt
Alles ist okay, solang' der Bratan Scheine macht
Und wenn ich will, mach' ich fünf Songs in einer Nacht

[Part 1]
Ah, komm, wir machen Krach, ich zeig' dir, wie man Scheine macht (komm)
Aber nicht mit Gier, wir machen es mit Leidenschaft(ja)
Ach, lass die Huren reden, Bra, ich will ein gutes Leben
Schnapp' mir alles, was ich kriegen kann, und lass' mir gar nix nehm'n
Ihr werdet alle seh'n, weil bunte Scheine niemals lügen
Pack' dasShem-Shemin die Tüten, was für Gangster? Ihr seid Küken
Ihr seid out wieHieroglyphen, guck, der Bratan ballert grad' (Bra)
Ich grüß' alle Bras in Einzelhaft

[Hook]
Bratan, ich hab' damals schon die Steine abgepackt
Ja, ich hab' damals schon die Kripos abgefuckt
Alles ist okay, solang' der Bratan Scheine macht
Und wenn ich will, mach' ich fünf Songs in einer Nacht
Bratan, ich hab' damals schon die Steine abgepackt
Ja, ich hab' damals schon die Kripos abgefuckt
Alles ist okay, solang' der Bratan Scheine macht
Und wenn ich will, mach' ich fünf Songs in einer Nacht, ah

[Part 2]
Ja, Kolleg, jaja, Kolleg, ich will jetzt viel verdien'n (uff)
Deswegen check' ich auch dieMedizin aus Medellín(ja)
Ich lass' die Kunden zieh'n und geh' danach die Ware packen
Und lauf' völlig drauf durch deinen Club mit zwei Sechs-Liter-Flaschen
Und alle Bitches tanzen, ja, ich lass' die Bitches tanzen (uff)
Meine Bras sind hinter mir und alle Hater platzen (bam)
Wir teil'n den lila Batzen, hab' mir alles beigebracht
Und für kein Geld auf dieser Welt mich kleingemacht (nein!)

[Hook]
Bratan, ich hab' damals schon die Steine abgepackt
Ja, ich hab' damals schon die Kripos abgefuckt
Alles ist okay, solang' der Bratan Scheine macht
Und wenn ich will, mach' ich fünf Songs in einer Nacht
Bratan, ich hab' damals schon die Steine abgepackt
Ja, ich hab' damals schon die Kripos abgefuckt
Alles ist okay, solang' der Bratan Scheine macht
Und wenn ich will, mach' ich fünf Songs in einer Nacht, ah
Bratan, ich hab' damals schon die Steine abgepackt
Ja, ich hab' damals schon die Kripos abgefuckt
Alles ist okay, solang' der Bratan Scheine macht
Und wenn ich will, mach' ich fünf Songs in einer Nacht, ah";"https://genius.com/Capital-bra-5-songs-in-einer-nacht-lyrics";"Released June 22, 2018
Distribution

    
      Sony Music Entertainment
Phonographic Copyright <U+2117>

    
      TEAM KUKU
Copyright ©

    
      TEAM KUKU
Mixing Engineer

    
      Lex Barkey
Mastering Engineer

    
      Lex Barkey
Label

    
      TEAM KUKU
Photography

    
      Phong Le
Executive Producer

    
      Laura Heid, Capital Bra & Drilon Cocaj
Featuring

    
      AK Ausserkontrolle, Bausa, Capital T & 6 more
Producers

    
      The Cratez, Danny E.B Tracks & Young Taylor
Writers

    
      AK Ausserkontrolle, Bausa, Capital Bra & 10 more
Composer

    
      Danny E.B Tracks, David Kraft, Tim Wilke & 1 more
Copyright ©

    
      TEAM KUKU"
"6";"Capital Bra";"Gutes Herz";"Berlin lebt";"[Songtext zu „Gutes Herz“ ft. KC Rebell]

[Intro: Capital Bra]
Ja, ah

[Part 1: Capital Bra]
Ich kam her mit drei Monate Aufenthalt
Ich kochte innerlich, doch mir war trotzdem kalt
Du willst der Stärkste sein? Bra, du kommst nicht weitWas bringt dir der Respekt, wenn deine Mutter dann zuhause weint?
Und eure Nazis sind schon lustig, gucken AnimeHolen bei Kanaken Schnee, doch wählen dann die AfD
Ich bin auch ein Mensch, weil ich auch Fehler mache
Doch das, was diese Leute machen, nennt man Selbstverarsche
Du gehst klau'n mit deinen Jungs und ihr springt über Zäune
Aber sag mir, wer von den' sind deine wahren Freunde?
Ich mein', vielleicht macht ihr Business und verkauft paar Kisten
Aber wer von den'n würde für dich drei Jahre sitzen?
Auf einmal sind das alles Brüder und tun ein'n auf Fam
Doch läuft's nicht mehr tun sie so, als ob sie dich nicht kenn'n
Ich erzähl' dir nur vom Leben, bra, damit du lernst
Denn um weiter hier zu komm'n, brauchst du ein gutes Herz
Und dann kommst du weit, glaub mir, bra, dann kommst du weit
Was für Knarre? Mit Erfolg killst du jeden Feind
Zu viel Hass und Neid, scheiß auf die ganzen Hater
Wer schweigt, hört viel, doch wer schreit, hört nur sich selber
Die Menschen werden kälter, die Augen immer leerer
Und spricht man über ihre Fehler, wechseln sie das Thema
Ich erzähl' dir nur vom Leben, bra, damit du lernst
Denn um weiter hier zu komm'n, brauchst du ein gutes Herz

[Hook: Capital Bra]
Du brauchst ein gutes Herz, weil es nicht anders geht
Denn egal, was du auch machst, nur deine Absicht zählt
Mama meinte mal zu mir: „Diese Welt ist hässlich
Doch weißt du nicht, wie du handeln musst, dann handel menschlich!“
Egal, ob arm und reich, schwarz und weiß
Denn am Ende des Tages bluten alle gleich
Ich erzähl' dir nur vom Leben, bra, damit du lernst
Denn um weiter hier zu komm'n, brauchst du ein gutes Herz

[Part 2: KC Rebell]
Eins weiß ich: Gefälligkeiten bekomm'n ihre Preis-Leistung
Loyalitäten laufen einseitig
Menschen benehmen sich so, als ob hier Steinzeit ist
Lachen ins Gesicht, aber ficken sich dann gleichzeitig
Ich bin verwirrt, denn als ich nix war, hat sich keiner für mich interessiert
Heute steh'n sie hinter mir
Freunde hab'n mir mein'n Erfolg sicherlich gegönnt
Doch was bringt das, wenn sie Niederlagen nicht teilen könn'n?
Ich bin in guten Zeiten da, auch wenn es unsinnig klingt
Doch wusste nicht, dass ich in schlechten Zeiten Luft für sie bin
Enttäuschungen können Gift in dein' Venen sein
Die Motivation der Sinn deines Lebens sein
Wir beide zum Beispiel könn'n mit dem Stift von der Seele schreiben
Auf das dieses Gefühl uns wie der Wind durch die Segel treibt
Wir kamen mit nix aus 'ner schweren Zeit
Und setzten ein'n Schritt in die Ewigkeit

[Hook: Capital Bra]
Du brauchst ein gutes Herz, weil es nicht anders geht
Denn egal, was du auch machst, nur deine Absicht zählt
Mama meinte mal zu mir: „Diese Welt ist hässlich
Doch weißt du nicht, wie du handeln musst, dann handel menschlich!“
Egal, ob arm und reich, schwarz und weiß
Denn am Ende des Tages bluten alle gleich
Ich erzähl' dir nur vom Leben, bra, damit du lernst
Denn um weiter hier zu komm'n, brauchst du ein gutes Herz";"https://genius.com/Capital-bra-gutes-herz-lyrics";"Released June 22, 2018
Distribution

    
      Sony Music Entertainment
Phonographic Copyright <U+2117>

    
      TEAM KUKU
Copyright ©

    
      TEAM KUKU
Mixing Engineer

    
      Lex Barkey
Mastering Engineer

    
      Lex Barkey
Label

    
      TEAM KUKU
Photography

    
      Phong Le
Executive Producer

    
      Laura Heid, Capital Bra & Drilon Cocaj
Featuring

    
      AK Ausserkontrolle, Bausa, Capital T & 6 more
Producers

    
      The Cratez, Danny E.B Tracks & Young Taylor
Writers

    
      AK Ausserkontrolle, Bausa, Capital Bra & 10 more
Composer

    
      Danny E.B Tracks, David Kraft, Tim Wilke & 1 more
Copyright ©

    
      TEAM KUKU"
"7";"Capital Bra";"Panzer, Tiger";"Berlin lebt";"[Part 1: Capital Bra]
Uff, wieder auf der Flucht vor den Fahndern (ja)
Wir machen Cash, aber nicht wie die andern
Bratan, ich teile nur mit mein'n Partnern
Was Päckchen? Bring' Kilos mit Gabelstaplern (uff)
Chill' im Pool mit Yasmin und Latifa (bra)
Capital Bra, ich bleibe Dealer (uff)
Ja, Kolleg, ich spiel' 'ne andre Liga
Ghetto-Gucci, deutscher Panzer, Tiger (brra)
Leg' den Benzer tiefer
Was für highclass? Bra, ich ficke jede (go)
Die Bitch bringt mir Hänchenpastete (uff)
Und ich packe nebenbeiShem-Shem-Pakete(brra)
Makarow unterm weißen Kissen (ah)
Bratans, die sitzen für weiße Kisten(ja)
Dreh' mir noch ein'n, bra, für mein Gewissen
Dann geh' ich los die Feinde schlitzen, ja

[Pre-Hook: Capital Bra]
Gib' mir nur ein'n Grund und ich mach' mich auf die Suche (ja)
Komm' in deine Bude und ich ficke deine Hure
Lange Nächte, keine Schule(uff), mitOt-Tickerund Dieben
Geld machen, probieren, auf Sendung, ProSieben

[Hook: Capital Bra]
Gib' mir nur ein'n Grund und ich mach' mich auf die Suche (ja)
Komm' in deine Bude und ich ficke deine Hure (ahh)
Lange Nächte, keine Schule (uff), mit Ot-Ticker und Dieben
Geld machen, probieren, auf Sendung, ProSieben (brra)

[Part 2: Farid Bang]
Mach' bei deinem Opa BenediktDer in Rente ist, den Enkel-Trick
Du weißt, dass ich trotz gebrochener Nase
Wie Jean-Claude Van Damme bin inTopform wie Vasen(ah)
Ich fick' dich Hurensohn jetzt (ah)
Leg deine Uniform weg (ah)
Du weißt, ich suche nur Stress
Denn ich habe ein'n Schuss wie bei Russisch Roulette (huh)
Farid der King, weil ich radikal bin
Lieg' ich mit deiner Tante im Bett
Und sie bläst für Scheine, wir dreh'n ein'n StreifenAls wär' es ein Schwangerschaftstest (uh)
Banger Musik, Gangster, Gangster
Keine Rentner-Rapper, so wie Helta Skelta (nein)
Rapper sind wie Wechselgelder (ja)Denn ich geb' ihn'n den Rest wie Kellner

[Pre-Hook: Capital Bra]
Gib' mir nur ein'n Grund und ich mach' mich auf die Suche (ja)
Komm' in deine Bude und ich ficke deine Hure
Lange Nächte, keine Schule (uff), mit Ot-Ticker und Dieben
Geld machen, probieren, auf Sendung, ProSieben

[Hook: Capital Bra]
Gib' mir nur ein'n Grund und ich mach' mich auf die Suche (ja)
Komm' in deine Bude und ich ficke deine Hure (ahh)
Lange Nächte, keine Schule (uff), mit Ot-Ticker und Dieben
Geld machen, probieren, auf Sendung, ProSieben (brra)";"https://genius.com/Capital-bra-panzer-tiger-lyrics";"Released June 22, 2018
Distribution

    
      Sony Music Entertainment
Phonographic Copyright <U+2117>

    
      TEAM KUKU
Copyright ©

    
      TEAM KUKU
Mixing Engineer

    
      Lex Barkey
Mastering Engineer

    
      Lex Barkey
Label

    
      TEAM KUKU
Photography

    
      Phong Le
Executive Producer

    
      Laura Heid, Capital Bra & Drilon Cocaj
Featuring

    
      AK Ausserkontrolle, Bausa, Capital T & 6 more
Producers

    
      The Cratez, Danny E.B Tracks & Young Taylor
Writers

    
      AK Ausserkontrolle, Bausa, Capital Bra & 10 more
Composer

    
      Danny E.B Tracks, David Kraft, Tim Wilke & 1 more
Copyright ©

    
      TEAM KUKU"
