"","artist","title","album","text","url","metadata"
"1","Stoppok","Mülldeponie","Neues aus la la land","Ich war heute bei der mülldeponie
Hatte alles schön getrennt allmählich weiß ich wie
Man blech und alu auseinander hält
Wer glaubt eigentlich noch das rettet die welt

Die möwen kreisten über dem müll
In der ferne ein bagger ansonsten war's still
Ich spürte diesen komischen windzug am hals
Und dann war alles wieder da wie damals

Ich sah dich in der wohnungstür stehn
Die koffer in der hand du warst fertig zum gehn
Sah genau deinen blick wie er nach hilfe schrie
Und ich saß da gelähmt ich wußte nicht wie

Wie wieviel wieviel müll kann man schlucken

Zwölf jahre ist das ganze jetzt her
Man sollte meinen das zählt jetzt nicht mehr
Doch wie 'ne kleine mauer die man übersah
Knallt man davor und alles ist wieder da

Wie wieviel wieviel müll kann man schlucken

Dir liebe schwör'n im nachhinein ist sinnlos ich weiß
Das wär so als wenn in china ein sack reis
Umfällt das interessiert hier kein vieh
Die zeit hat's gefressen und keiner weiß wie

Wie wieviel wieviel müll kann man schlucken

Die möven kreisen über dem müll
Der beißende geruch stört das idyll","https://genius.com/Stoppok-mulldeponie-lyrics","Released February 19, 1999"
"2","Stoppok","Nach New York geflogen","Neues aus la la land","Ich bin mit Ihr nach New York geflogen
Hab mir megacoole Sachen angezogen
War mit Ihr in den teuersten Boutiquen
Und dachte nicht ein´ Moment ans... Geld

Ich war mit Ihr in den besten Diskotheken
In den Bars mit den längsten Theken
Vom Hotelzimmer konnte man über ganz Manhatten blicken
Und dachte nicht ein´ Moment ans... Geld

Ich bin frühmorgens Joggen gegangen
War jeden Abend mit Ihr in ´nem teuren Restaurant
Hab´ ein´ Cadillac geliehen, einen superschicken
Und dachte niemals ans verdammte Geld

Doch Sie liebt Ihn immer noch
Diesen versifften Typen, Er hat Ihr nichts zu bieten
Sie liebt Ihn immer noch
Diese schmuddelige Erscheinung, doch Sie fragt nicht nach meiner Meinung

Ich hab´ Ihr den Arsch nachgetragen
Hab´ Ihr alles erfüllt, Sie brauchte nicht zu fragen
Wenn Ihr was runterfiel brauchte Sie sich nicht zu bücken
Und ich dachte wirklich nicht ans Geld

Doch Sie liebt Ihn immer noch
Diesen versifften Typen, Er hat Ihr nichts zu bieten
Sie liebt Ihn immer noch
Diese schmuddelige Erscheinung, doch Sie fragt nicht nach meiner Meinung

Ich hab´ ihr quasi alles gegeben
So war´s das erste mal in meinem Leben
Wie kann sie nur so falsch ticken
Ich will Sie wenigstens auch einmal so richtig in die Wüste schicken

Ist doch wirklich nicht zuviel verlangt bei dem Geld was ich ausgegeben hab´
Der Flug alleine hat 2500 gekostet dann die teuren Klamotten
Jeden Abend mindestens 200 Dollar verfressen
Und der blick auf Manhatten war auch nicht gerade umsonst
Und keine Spur von Dank, das macht mich Krank

Doch Sie liebt Ihn immer noch
Diesen versifften Typen, Er hat Ihr nichts zu bieten
Sie liebt Ihn immer noch
Diese schmuddelige Erscheinung, doch Sie pfeift auf meine Meinung","https://genius.com/Stoppok-nach-new-york-geflogen-lyrics","Released February 19, 1999"
"3","Stoppok","Jede Stunde","Neues aus la la land","Jede Stunde bringt dich ´n stück näher
Jeder wagen der mich überholt
Jeder regenschauer jeder kilometer
Jeder halbe oder volle mond
Jeder baum der am fenster vorbeifliegt
Jede ampel grün gelb oder rot
Jeder fahrer der sich noch mal aufregt
Jeder blick der sich schon nicht mal mehr lohnt

Oh ich denk´ an dich
Wenn im scheinwerferlicht die nacht anbricht
Und der neonengel auf dem hügel verspricht noch benzin

Jede meldung die im radio durchkommt
Jeder witz über den ich noch lach´
Jede kurve die beinah´ zu scharf war
Jeder geisterfahrer den ich noch schaff´
Jedes glitzern der straße im zwielicht
Ist wie ´n traum der mich irritiert
Die zeit ist mein feind und ich will dich
Nicht einfach an ´nen zufall verlier´n

Oh ich denk´ an dich
Wenn im scheinwerferlicht die nacht anbricht
Und der neonengel auf dem hügel verspricht noch benzin

Jedes stück das die sonne am horizont
Versinkt wie ein schiff im meer
Jede sekunde die du an mich denkst
Bringt mich ´n stück näher zu dir

Oh ich denk´ an dich
Wenn im scheinwerferlicht die nacht anbricht
Und der neonengel auf dem hügel verspricht noch benzin","https://genius.com/Stoppok-jede-stunde-lyrics","Released February 19, 1999"
"4","Stoppok","Fan von","Neues aus la la land","Kennst du eigentlich den Typen aus dem Fernsehn
Der immer die tollen Witze macht
Na Klar, da bin ich Fan von
Und dann die Frau die kenn´ ich auch nur aus dem Fernsehn
Die diese angenehme Stimme hat
Da bin ich Fan von, da bin ich Fan von, da bin ich Fan von
Und der Andere der noch viel lustiger ist
Der mit den Grimassen
Na Klar, da bin ich Fan von
Und diese Blonde mit den großen Ohr´n
Und den dicken Lippen voll das geile Teil

Da bin ich Fan von, da bin ich Fan von
Da bin ich Fan von....

Und kennst du die Serie mit dem coolen Team
Und dem cleveren Kommissar
Na Klar, da bin ich Fan von
Der immer Streß kriegt mit seinen Vorgesetzten
Und immer alles riskiert und sich nie blamiert
Da bin ich Fan von, da bin ich Fan von, da bin ich Fan von, da bin ich Fan von

Da bin ich Fan von.....

Und auch die Talkshow mit den heiklen Themen
Wo immer was mit Sex kommt
Na Klar, da bin ich Fan von
Und wo einer kocht mit Prominenten
Da gibt´s Ratatouille und gefüllte Enten
Da bin ich Fan von, da bin ich Fan von, da bin ich Fan von, da bin ich Fan von

Da bin ich Fan von.....","https://genius.com/Stoppok-fan-von-lyrics","Released February 19, 1999"
