"","artist","title","album","text","url","metadata"
"1","Kool Savas","Denn ein Bello Kommt Selten Allein","Die john bello story iii","[Intro]
„Bello, Bello, Bello, Bello, Bello, Bello, Bello, Bello, Bello, Bello, Bello, Bello, Bello, Bello, Bello, Bello“

[Hook]
Ein Bello, zwei Bello, drei Bello, vier...
Jede Menge Bellos stehn vor deiner Tür
Denn ein Bello kommt selten allein
Denn ein Bello kommt selten allein
Fünf Bello, sechs Bello, sieben Bello, acht...
Jede Menge Bellos steigen heute auf dein Dach
Denn ein Bello kommt selten allein
Denn ein Bello kommt selten allein

[Part 1]
Nein, nicht „Hello Kitty“, sondern „Hi Bello“
Seid ihr mit mir? Wir geh'n steil, Bello
Keine Zeit für was anderes, Bello-Time, Bello
Du willst rumstehen, nix tun? Kein Bello
Zieh mit, los, komm reih dich ein Bello
Nix Ärger, erstick den Unsinn im Keim, Bello
Du bist so broke, pleite wie Matthias Reim, Bello
Brauchst du nicht zu weinen, Bello
Denn ich lad dich ein Bello
Wir sind ein Volk, kein Verein, Bello
Und gehen diesen Weg gemeinsam über Stock und Stein, Bello
Halt den Kopf klar, dein Herz rein, Bello
Nichts und niemand hält dich, Feuer frei, Bello
Und du bist nicht allein, Bello
Ich bin dein Bello, du bist mein Bello
Lass die Sorgen heim, spring als wärst du high, Bello
Atme ein:Schrei dir die Seele aus dem Leib, Bello!

[Hook]
Ein Bello, zwei Bello, drei Bello, vier...
Jede Menge Bellos stehn vor deiner Tür
Denn ein Bello kommt selten allein
Denn ein Bello kommt selten allein
Fünf Bello, sechs Bello, sieben Bello, acht...
Jede Menge Bellos steigen heute auf dein Dach
Denn ein Bello kommt selten allein
Denn ein Bello kommt selten allein

[Part 2]
Wir haben 1 Million Stimmen, Bello
Keine Uniformen, wir sind von innen bello
Lass sie reden, wir stehen über den Dingen, Bello
Der freie Wille, sie können uns zu nichts zwingen, Bello
Sie haben gedacht, mir wird im Leben nichts gelingen, Bello
Wollten, dass ich ewig sitze, heut lass ich sie Springen, Bello
Bis in die wolken in den Himmel, Bello
Jenseits ihrer Limits, Bello
Dieses Licht, sie können es nich dimmen, Bello
Nennen sie dich Loser, kannst du nur noch gewinnen, Bello
Sie sehen was wir machen und sagen ""Wir spinnen"", Bello
Ich reiß die Hose auf und gebe ihnen den Pimmel, Bello
Die anderen sind frustriert, brauchen dringend Bello
Ihre Mucke ist alt, dirty und sie schimmelt, Bello
Lass sie verstummen, Bello, wir finden Bello
Doch wir nicht, wir schreien es raus wie von Sinnen, Bello!

[Hook]
Ein Bello, zwei Bello, drei Bello, vier...
Jede Menge Bellos stehn vor deiner Tür
Denn ein Bello kommt selten allein
Denn ein Bello kommt selten allein
Fünf Bello, sechs Bello, sieben Bello, acht...
Jede Menge Bellos steigen heute auf dein Dach
Denn ein Bello kommt selten allein
Denn ein Bello kommt selten allein","https://genius.com/Kool-savas-denn-ein-bello-kommt-selten-allein-lyrics","Released March 12, 2010
Distributor

    
      Groove Attack
Copyright ©

    
      Essah Entertainment
Phonographic Copyright ℗

    
      Essah Entertainment
Photography

    
      Katja Kuhl
Executive Producer

    
      Kool Savas
Artwork

    
      Eric Ullrich
Label

    
      Essah Entertainment
Featuring

    
      Alex Prince, Amar, Azad & 16 more
Producers

    
      Bazz, Benlo, Big Bazz & 7 more
Writers

    
      Alex Prince, Amar, Azad & 27 more
Additional Drums

    
      Igor Lier
Additional Vocals

    
      Ioredana Doleo & Naomi Jackson"
"2","Kool Savas","Immer wenn ich rhyme","Die john bello story iii","[Intro: Sample]
My-my-my-my mic check is life or death
For every rhyme I write, it's twenty-five to life
My-my-my-my mic check is life or death
For every rhyme I write...

[Refrain: Moe Mitchell]
Immer, wenn ich rhyme
Steht die Welt kurz still und ich spür' weder Raum noch Zeit
Denn immer, wenn ich rhyme
Fällt die Last von mir und ich fühl' mich auf einmal frei
Denn dieser Stift hier weist den WegUnd trägt mich täglich ein Stück näher
Und zwar immer, wenn ich rhy-yme
Immer, wenn ich rhyme...

[Verse 1: Olli Banjo]
Lass' ich mich fallen, wie in ein smoothes Sofa
Rap ist für mich mehr als Disco und ein altes 2Pac-Poster
Ihr rappt Scheiße über große Knarren, gutes Koka
Ich dagegen guck 'nWholecar, verstehste?
Immer, wenn ich rhyme
Kann ich atmen, ohne Rap, ich stell's mir hart vor
Ich schreib' es hin, wenn ich mir Luft mache, wie ein Ventilator
Es reinigt mich von innen und es dient als Sprachrohr
Meine Träume, meine Artform, verstehst du?
Immer, wenn ich rhyme hab' ich etwas, woran ich mich festhalte
Ich vergesse die Welt wie 'ne gelöschte Festplatte
Ich schlage Schneisen in die Lichtung für die Morgensonne
Mit dem Mic, immer wenn die Sorgen kommen
Immer, wenn ich rhyme, heb' ich für kurze Zeit ab und lass' es raus
Sehe diese blaue Kugel von oben wie'n Astronaut
Leidenschaft, scheiß mal auf das paper, ich hab' alles hierEin Stift, ein Blatt Papier, verstehste?

[Refrain: Moe Mitchell]
Immer, wenn ich rhyme
Steht die Welt kurz still und ich spür' weder Raum noch Zeit
Denn immer, wenn ich rhyme
Fällt die Last von mir und ich fühl' mich auf einmal frei
Denn dieser Stift hier weist den WegUnd trägt mich täglich ein Stück näher
Und zwar immer, wenn ich rhy-yme
Immer, wenn ich rhyme...

[Verse 2: Azad]
Schreib' ich mir von der Seele, was auf meinem Herzen liegt
Die Schlinge sitzt zu fest um meine Kehle
Muss den Schmerz besiegen
Hab' für manche Krise in meinem Leben einen Vers geschrieben
10 Alben, ich hab' immer noch einen Berg von ihnen
(Immer, wenn ich rhyme)
Doch bau' den Berg ab, mit der Hoffnung, die mein Hammer ist
Der Stift wird mein Meißel seinUnd Stein für Stein fällt von meinem HerzenUnd ich fühl' mich bisschen besser danach
Ich blick' nach oben und hoff', morgen wird ein besserer Tag
Immer, wenn ich rhyme ist es wie immer, wenn ich wein'
Gefühle brechen aus, ich finde einen Beat
Der mein Gefühl versteht und sprech' mich aus
In Hypnose text' ich auf'n Blatt Papier, nächtlich auf-
Wacht am 4, mächtig laut, das ist, wie ich ticke, Bruder
(Immer, wenn ich rhyme)
Und wenn ich spitte, blute ich meine Wunde aus, will aus dem
Dunkeln raus und das Schreiben hilft mir unermesslich
Ich will runter, Stress ist für meinen Geist nur Gift
Such' mir 'n Beat und ich greif' zum Stift und flieg'

[Refrain: Moe Mitchell]
Immer, wenn ich rhyme
Steht die Welt kurz still und ich spür' weder Raum noch Zeit
Denn immer, wenn ich rhyme
Fällt die Last von mir und ich fühl' mich auf einmal frei
Denn dieser Stift hier weist den WegUnd trägt mich täglich ein Stück näher
Und zwar immer, wenn ich rhy-yme
Immer, wenn ich rhyme...

[Verse 3: Kool Savas]
Verschwindet die Umgebung im Nebel
Tauch' ich Worte in Farbe, feuer' sie raus in 'ner Fontäne
Erweck' ich Blätter zum Leben, Stifte zum Sprechen
Ich wär' nix ohne Rap
Und ich weiß, ob ihr wollt oder nicht, ihr merkt es
Immer, wenn ich rhyme
Glänzen ihre Augen, schlägt ihr Herz schneller
Ihr bekommt den besten Flow ever direkt vom Hersteller
Ihnen fehlt der Glanz und deswegen leuchtet mein Stern heller
Food for thought, anstatt 'n leeren Teller kriegt ihr
Immer, wenn ich rhyme
Hört ein and'rer damit auf und lässt es, ich versteh's nicht
Ich brauch' keinen Therapeuten, rapp' es mir von der Seele
Mein Juwel strahlt lupenrein, wie unter Halogenlicht
Augen zu, du kriegst ihn jedes Mal zu sehen
Immer, wenn ich rhyme
Verbann' ich die Kälte nach draußen vor die Türe
Eins, zwo, Mic Check, so klingt uns're Ouvertüre
Diese Mucke ist so einzigartig, so verführerisch, so (Herzpumpen)
Du spürst es

[Refrain: Moe Mitchell]
Immer, wenn ich rhyme
Steht die Welt kurz still und ich spür' weder Raum noch Zeit
Denn immer, wenn ich rhyme
Fällt die Last von mir und ich fühl' mich auf einmal frei
Denn dieser Stift hier weist den WegUnd trägt mich täglich ein Stück näher
Und zwar immer, wenn ich rhy-yme
Immer, wenn ich rhyme...
Immer, wenn ich rhyme
Steht die Welt kurz still und ich spür' weder Raum noch Zeit
Denn immer, wenn ich rhyme
Fällt die Last von mir und ich fühl' mich auf einmal frei
Denn dieser Stift hier weist den WegUnd trägt mich täglich ein Stück näher
Und zwar immer, wenn ich rhy-yme
Immer, wenn ich rhyme...

-Folg RapGeniusDeutschland!","https://genius.com/Kool-savas-immer-wenn-ich-rhyme-lyrics","Released March 12, 2010
Distributor

    
      Groove Attack
Copyright ©

    
      Essah Entertainment
Phonographic Copyright ℗

    
      Essah Entertainment
Photography

    
      Katja Kuhl
Executive Producer

    
      Kool Savas
Artwork

    
      Eric Ullrich
Label

    
      Essah Entertainment
Featuring

    
      Alex Prince, Amar, Azad & 16 more
Producers

    
      Bazz, Benlo, Big Bazz & 7 more
Writers

    
      Alex Prince, Amar, Azad & 27 more
Additional Drums

    
      Igor Lier
Additional Vocals

    
      Ioredana Doleo & Naomi Jackson"
"3","Kool Savas","Mach doch deinen Scheiss","Die john bello story iii","[Refrain 2x]
""Dann mach doch deinen Scheiß""
Dann Mach doch deinen Scheiß, wir haben
""Genug zu tun""
Und keine Zeit für euch, wir werden dich auf deinen
""Platz zurückverweisen, wo du hingehörst du Idiot""
Wir haben wirklich schon viel gesehen, doch
""So blöd kann keiner sein""

[Verse I - Mo Trip:]
""Ist das zu fassen?""
Jede Zeile bricht die Schweigepflicht
Straight aus dem Bauch entweder ""schrei ich oder schrei ich nicht""
Könntest du mir freiwillig den Wagen geben
Sonst muss ich dich schlagen, treten, das ist mir
Schon ""immer scheißegal gewesen""
Überfahr dich, park deine ""Scheißkarre in Holland""
Könnte einfach so am Zollamt vorbeifahren auf'm Roller
Bring das Weed nach hause, erzähl nix von Weedverkaufen du Fisch
Du kannst viel behaupten, doch du ""existierst überhaupt nicht für mich""

[Verse II - Olli Banjo:]
""Ist das zu fassen?""
Ich will wirklich nicht cholerisch sein
Doch wenn ich spitte wirkt sogar Kinski gegen mich pflegeleicht
Ich knebel deinen Eselarsch
Mach ""wirbel in Amerika""
Asien, Europa, den Mond erober ich nächstes Jahr
""Wenn du zu frech wirst"" vergrab ich dich im Rasen, Ficker
Ja ich bin ein psychopatischer Killer, ein ""Wahnsinniger""
Dein Label dehnt deinen Anus, du kommst dir wie 'n großer Star vor
Du hast jetzt Top10 Hits aber dafür ""hast du so ein Arschloch""
Du bist fake, phony und du lügst in deinem Text
Image kann Realität nicht ersetzen wie Cybersex
Dein Produzent bitet Timbaland seinen Sohn
Ganz ehrlich, ""so ein Arschloch ist verantwortlich für deine Produktion""?
Nich dein Ernst, ihr seid sehr behaarte Hinterwäldler
Und im falschen Beruf wie ein pädophiler Kindergärtner
Du machst auf Zuhälter und sagst du hättest 50 Huren
Suchst aber gleichzeitig deinen Penis mit 'ner Wünschelrute

[Verse III - Kool Savas:]
""Ist das zu fassen?""
Du lachst wenn du große Schwänze in den Arsch kriegst
""Doch du bist so bescheuert, dass du dir nichmal über die Konsequenzen klar bist""
Dir fehlt die Basis, der Stil und der Flow
Ich und Rap sind wie Friedmann und Koks
Einfach untrennbar, undenkbar wenn es anders wär, gib das Lenkrad her
""Du dumme Sau"", du wirfst dein bisschen Grips aus dem Fenster
Nein, nicht der Henker, ich bring dich kurz um wie Kiefer und Co
Tu auf cool, doch du kommst nicht an wie 'n Athlet der den Start schwänzt
Und sag, was fürn Feature? Niemals, nein, ""leck mich doch am Arsch, Mensch!""
Ich behandel dich wie im ""Zuchthaus""
Quäl und verhör dich denn ""du störst mich""
Auf dir warn mehr Gays als auf nem Friseurtisch
Und ""du"" bist des Wahnsinns, gehst zum Arzt
""Weil du nicht mehr normal bist"", tust als würd bei dir was gehn
Das is ""ungeheuerlich, was der mir erzähl""
Ich glaubs nich, ""überhaupt nichts"", von dem was er da bringt ist sinnig
Denkt dieser Punk wirklich dass er ein Pimp is? hmm
Was fürn Kerl, ""dass er nich merkt""
Dass seine Bitch gerade mit mir Party macht
Ich hör sein Auto, spuck sie noch einmal an und dann ""hau ich ab""

[Refrain 2x]

[Verse IV - Franky Kubrick:]
Ich mach live on stage die Action, dass die Atzen 'n Gang raufschalten
Doch Fusi kennt den Text nicht, bitte ""sag nur er solls Maul halten""
Diese Rapfans sehen mich, fackeln nich lang
Und fragen nach Autogrammen, ich bleibe freundlich und sage: ""Fass mich nich an!""
Halt, ich bin eigentlich ja gegen Gewalt, ""verstehst du?""
Doch red jetzt weiter und ich geh dir an Hals, ""verstehst du?""
Homie, komm stör mich wenn ich schreibe
Fick mein Vibe bis ich den Text versaue
""Der Moment ist doch gekommen, wo ich dir in die Fresse haue""
Nix wie weg hier, ""diesmal schlag ich dir in die Fresse""
Homie vertrau mir, guck ich versprechs dir
Dein Jochbein, dein Genick und dein Rückgrat, *krrkr* ich brechs dir
Ihr Affen, was pimpen, rumposen und knete machen, ihr habt nichts ""zu tun""
Doch redet von hustlen, ""ungeheuerlich""

[Verse V - Kaas:]
""Ist das zu fassen?""
Sagt der ungebetene Hochzeitsgast
Nachdem der Pfarrer fragt, ob noch irgendwer was zu sagen hat
Die Gäste und das Brautpaar schauen verstört zu diesem alten Sack
Und er legt richtig los: ""Du bist ja nich normal, du Idiot!""
Ähm, entschuldigung, wir heiraten hier gerade..!?
""Ich hab so Sachen jeden Tag""
Denn er meint, Liebe hält nicht ewig und dass das Paar da 'n Fehler macht
Doch die zwei nehm sich in den Armen, küssen sich und sagen dann
Liebe lebenslang, wir glauben dran und dieser Mann sagt:

[Refrain 2x]","https://genius.com/Kool-savas-mach-doch-deinen-scheiss-lyrics","Released March 12, 2010
Distributor

    
      Groove Attack
Copyright ©

    
      Essah Entertainment
Phonographic Copyright ℗

    
      Essah Entertainment
Photography

    
      Katja Kuhl
Executive Producer

    
      Kool Savas
Artwork

    
      Eric Ullrich
Label

    
      Essah Entertainment
Featuring

    
      Alex Prince, Amar, Azad & 16 more
Producers

    
      Bazz, Benlo, Big Bazz & 7 more
Writers

    
      Alex Prince, Amar, Azad & 27 more
Additional Drums

    
      Igor Lier
Additional Vocals

    
      Ioredana Doleo & Naomi Jackson"
"4","Kool Savas","MySpace","Die john bello story iii","[Refrain - Moe Mitchell:]
Ich traf mein Baby auf MySpaceTraf mein Baby auf Facebook, StudiVZ im Netz
Wir sind stundenlang im Chat
Und ich weiß nichtmal wie sie aussieht, oh yeah
Ich traf mein Baby auf MySpaceTraf mein Baby auf Facebook, StudiVZ im Netz
Wir sind stundenlang im Chat
Und ich weiß nichtmal wie sie aussieht, no no

[Olli Banjo - Verse I:]
Ey jo, MySpace, Twitter Twitter, bloggen, posten, tippen, sichern
Sie hatte echt künstlerisch äußerst wertvolle Tittenbilder
Sie schrieb mir, sie will mich besuchen in ner Riesenvilla
Ich dachte, ich geb n Fick, ihr Foto war ja krisensicher
Ich schreib ihr hirnverbrannte, blind gewichste Liebesbriefe
Hihi, haha, kicher kicher, gelber Smiley, zwinker zwinker
Ich stell mir vor wie ich mit ihr auf dem Bett Liebe mache
Und sie geisteskrank durch die Gegend hacke, den Käfer mache
Umgeschnallte Negerlatte, Tigerbalsam, Ledermaske
Ich bin ausgerüstet für die blogschreibende Leseratte
Ich fahr zum Bahnhof um sie abzuholen, ohne Warnung
Steigt sie aus, dichte rote Oberlippenbartbehaarung
Auf ihrer großen Nase hatte sie ne große Warze
Auf der ein großer Rabe saß und dieser Vogel sagte:
Dieses Internet ist böse und ein Ort des Wahnsinns
In dem viele photoshopgemogelte Grotten warten

[Refrain - Moe Mitchell:]
Ich traf mein Baby auf MySpaceTraf mein Baby auf Facebook, StudiVZ im Netz
Wir sind stundenlang im Chat
Und ich weiß nichtmal wie sie aussieht, oh yeah
Ich traf mein Baby auf MySpaceTraf mein Baby auf Facebook, StudiVZ im Netz
Wir sind stundenlang im Chat
Und ich weiß nichtmal wie sie aussieht, no no

[MoTrip - Verse II:]
Ich weiß nichtmal wie du aussiehst, nichtmal wie du wirklich heißt
An deinem Bild erkenn ich nur, du musst so Mitte Vierzig sein
Und chattest gern mit Jüngeren, ich merke schnell, du hättest gern nen Jüngeren
Weil sich dein Mann wohl nicht mehr um dich kümmern will
Die große weite Welt, da wolltest du schon immer hin
Und du erinnerst dich, du warst mal ne Gewinnerin
Jetzt bleibst du nur im Zimmer drin, hoffst er ist für immer weg
Seitdem du in den Trümmern sitzt, hockst du vor dem Internet
Und lenkst dich ab, trittst diversen Gruppen bei und checkst
Hier musst du wenigstens nich kuscheln nach dem Sex
Eigentlich hab ich gedacht, ich gruschel meine Ex
Doch dann traf ich dich durch Zufall in nem Chat
Ich find dich super super nett
Du bist korrekt du bist die mit den meisten Klicks
Ich mag es wenn du deine Titten zeigst und stripst
Kannst du noch was näher kommen, ein klitzekleines Stück?
Ich brauch mehr davon, bitte schreib zurück!

[Refrain - Moe Mitchell:]
Ich traf mein Baby auf MySpaceTraf mein Baby auf Facebook, StudiVZ im Netz
Wir sind stundenlang im Chat
Und ich weiß nichtmal wie sie aussieht, oh yeah
Ich traf mein Baby auf MySpaceTraf mein Baby auf Facebook, StudiVZ im Netz
Wir sind stundenlang im Chat
Und ich weiß nichtmal wie sie aussieht, no no

[Kool Savas - Verse III:]
Ich traf sie auf dem Sofa sitzend
Nackig vor dem virtuellen Pokertisch
Sie schrieb mir, sie wär Lo-Lo-Lo-Lo-Lokalistin
Jetzt logg ich mich ein und such mein Cutie bei Studi
Mein Schnuckel bei Knuddel
Will diese Chick widersehn, geh auf kwick.de
Ich gras die Gästebücher ab, durchforste die Foren
Bin am Verzweifeln, Trauer, renne wie 'n Horst durch die Wohnung
Gib mir ein Lebenszeichen, nur ein Kleines *Ring* übern Messenger
Google findet dich auch nicht, da ich leider deinen Nick vergessen hab
Es fickt mein Kopf, du bist nicht topbar von ner andern Frau
Ohne dich, ist mein Leben grad so Doppelpunkt, Klammer auf
Ich kenn dich nicht, aber lieb dich
Und meins ehrlich denn sowas hatt' ich noch nie
Nenn dich Seafight, du hast mein Herzen erobert
Hacker der Liebe, ich durchsurfe jedes einzelne Profil
Sogar männliche Usernamen auf MZEE wie Silohero
Und wenn du das hier hörst, dann meld dich bei mir Baby, was los!Solange warte ich auf dich bei Slutload

[Refrain - Moe Mitchell:]
Ich traf mein Baby auf MySpaceTraf mein Baby auf Facebook, StudiVZ im Netz
Wir sind stundenlang im Chat
Und ich weiß nichtmal wie sie aussieht, oh yeah
Ich traf mein Baby auf MySpaceTraf mein Baby auf Facebook, StudiVZ im Netz
Wir sind stundenlang im Chat
Und ich weiß nichtmal wie sie aussieht, no no","https://genius.com/Kool-savas-myspace-lyrics","Released March 12, 2010
Distributor

    
      Groove Attack
Copyright ©

    
      Essah Entertainment
Phonographic Copyright ℗

    
      Essah Entertainment
Photography

    
      Katja Kuhl
Executive Producer

    
      Kool Savas
Artwork

    
      Eric Ullrich
Label

    
      Essah Entertainment
Featuring

    
      Alex Prince, Amar, Azad & 16 more
Producers

    
      Bazz, Benlo, Big Bazz & 7 more
Writers

    
      Alex Prince, Amar, Azad & 27 more
Additional Drums

    
      Igor Lier
Additional Vocals

    
      Ioredana Doleo & Naomi Jackson"
"5","Kool Savas","Sei nicht schüchtern","Die john bello story iii","[Refrain:]
Sag mal jemand dieser Schlampe bescheid, bescheid
Heut Nacht kommt die Hure mit uns
Sag mal deinem Freund es tut dir so leid, so leid
Aber du wirst gleich wund gebumst
Sei nicht schüchtern Girl
Du schaust so lüstern Girl
Hebt die Schwänze in die Luft
Heut drehen wir am Teller wie im Puff, oh-oh oh-oh

[Sinan - Verse I:]
Yeah, ich bin professioneller Rapper
Dein Freund macht Song mit Hip-Hop-DJ und Magix Music Maker
Stell ihn mir nicht vor, ich spreche nicht mit Drogen
Tu dir selbst einen gefallen und versteck den Idioten
Dieser hässliche Vogel, dünne Beine, dünne Arme
Zu großer Kopf, mit nur einem Ohr wie Van Gogh
Guck ihn an, du willst mit einem behinderten angeben?
Was Gespräch, dieses Opfer darf mit meiner Hand reden
Flachschädel, er ist kein Mann sondern eine Transe
Steht daneben, während meine Jungs mit ihr tanzen
Einer vorne, einer hinten, du wackelst mit deinem Arsch
Währendessen kriecht dein Freund in meinen Arsch
Feature ist zu teuer, also möchte er ein Shout-Out
Hört John Bello 3, steht bis Nacht in der Crowd
Wach auf, dieser Junge hat nicht das was wir haben
Also, wenn willst du hier beindrucken, du Biatch?

[Refrain]

[Ercandize]: Verse II
Er fühlt sich übertrieben geil und fährt endlich mal ein BeamerDoch dein sogenannter Freund ist der Dentagard BiberEr hüpft rum und macht Geräusche sabbert und keuchtDu willst in den Club, er in den Wald und knabbert an Bäumen
Er ist ein haariges etwas und macht Party mit Waldwesen
Du stehst auf die Optik Army, er steht drauf wenn es kalt regnet
Duschen unter freien Himmel, spielt mit seinem kleinen Röhrchen
Er hat miese Feinde, nein, er hat Beef mit Eichhörnchen
Er ist irgendwo zwischen Wiesen und Staudämmen
Glaub mir, wär ich er würd ich mich irgendwo aufhängen
Doch du bist nicht besser, willst sein Rohr in deinem Arsch haben
Und er gibt keinen Fick, du spürst die borstigen Barthaare
Er boastet und kratzt sein Fell, hektische Moves
Und rappt für Tierchen im Wald, träumt von Backspin and Juice
Er ist ne C-C-Comicfigur ohne Perspektive, und jap
Ich hab was gegen Schmocks, doch ein Herz für Tiere, wooooh!

[Refrain]

[Kool Savas - Verse III:]
Ich weiß, du denkst, dass du die schönste aller Mädels bist
Und dein Freund wär' 'ne Größe auf lokaler Ebene
Quatsch mal, ich ess' nicht alles, was man mir vorsetzt
Was da, er ist nur der Voract vom Voract
Bastard, und er macht vor dir auf krassen Rapper
Wachs in den Haaren mit 'ner Form wie ein Aschenbecher
Lass es besser, er holt seine Schlampe und ich steck ihn ihr rein
Oldschool-Flow, Rappers DelightSie wird gefickt , -fucked, de figgi to de figgi de fick fuck, sie ist nackt, saugt SackDenn sie ist ne Gangbangtussi, wir rammen Schwanz in die PussyDenn sie will es, darum bocken wir sie
Und dein Freund, keinen Führerschein und Handyvertrag
Loser, ich führ ihn ein, bang deinen Arsch
Super, mir egal was du Gans gerade labberst
Wie, Beziehung? Geh, saug den Schwanz deines Vaters

[Kool Savas]: Chorus
Sag mal jemand dieser Schlampe bescheid, bescheid
Heut Nacht kommt die Hure mit uns
Sag mal deinem Freund es tut dir so leid, so leid
Aber du wirst gleich übel gebumst
Sei nicht schüchtern Girl
Du schaust so lüstern Girl
Hebt die Schwänze in die Luft
Heut drehen wir am Teller wie im Puff, oh-oh oh-oh
Sei nicht schüchtern Girl
Du schaust so lüstern Girl
Hebt die Schwänze in die Luft
Heut drehen wir am Teller wie im Puff, oh-oh oh-oh
Sei nicht schüchtern Girl
Du schaust so lüstern Girl
Hebt die Schwänze in die Luft
Heut drehen wir am Teller wie im Puff, oh-oh oh-oh","https://genius.com/Kool-savas-sei-nicht-schuchtern-lyrics","Released March 12, 2010
Distributor

    
      Groove Attack
Copyright ©

    
      Essah Entertainment
Phonographic Copyright ℗

    
      Essah Entertainment
Photography

    
      Katja Kuhl
Executive Producer

    
      Kool Savas
Artwork

    
      Eric Ullrich
Label

    
      Essah Entertainment
Featuring

    
      Alex Prince, Amar, Azad & 16 more
Producers

    
      Bazz, Benlo, Big Bazz & 7 more
Writers

    
      Alex Prince, Amar, Azad & 27 more
Additional Drums

    
      Igor Lier
Additional Vocals

    
      Ioredana Doleo & Naomi Jackson"
