"","artist","title","album","text","url","metadata"
"12","Bushido","Wo du hier gelandet bist","7","[Verse 1]
Merkst du, wo du hier gelandet bist?
Zum ersten Mal siehst du Junkies verwahrlost
Von Angesicht zu Angesicht
Ja, im Wannsee bist du gut dran
Red nicht von Berlin
Du warst nur auf Klassenfahrt am Kudamm
Hier gibt es Betonklötze
Wo über tausend Menschen reinpassen
Wo sie einen wie dich nicht vorbeilassen
Du wirst hier nie reinpassen
Das ist Smog aus der Unterwelt
Bullen kommen und du hast dich dumm zu stellen
Hörst du die Hunde bellen?
Sie suchen Rauschgift
Kinder wachsen auf zwischen Fußball und Blaulicht
Zufall? Ich glaub nicht
Du kannst dir hier nicht mal eine Straße merken
Weil du mit nem Kuhstall vertraut bist
Merkst du, wie die Himmeldecke schwarz wird?
Der Ort, wo ein kleines Mädchen angezündet wurdeUnd im Park stirbt
Jeder Tag wird anders als bei dir sein
Doch ich weiß, dass ich in Berlin bleib

[Hook]
Und wenn die Wolken sich zusammenziehen
Und du die Hand nicht mehr vor Augen siehst
Wenn man dich schon zwingt, Schmuck auszuziehen
Wo man Brüder zur Begrüßung auf die Wange küsst
Merkst du gerade, wo du hier gelandet bist
Und wenn die Wolken sich zusammenziehen
Und du die Hand nicht mehr vor Augen siehst
Wenn man dich schon zwingt, Schmuck auszuziehen
Wo man Brüder zur Begrüßung auf die Wange küsst
Merkst du gerade, wo du hier gelandet bist

[Verse 2]
Merkst du, wo du hier gelandet bist?
Wo du beim Einkaufen Penner in der Schlange triffst
Ich würd gern lachen, doch ich kann es nicht, kann es nicht
Wo deine Hoffnung wie ne Sandburg zusammenbricht
Scheiß auf die lange Sicht
Kokain, ich puste goldenen Staub raus
Guter Guss zwingt deine Fotzen in den Kaufrausch
Meine Freunde wurden abgeschoben
Denn meine Freunde haben dich mit Freude abgezogen
Warum machst du immer noch auf hart
In der Stadt die niemals schläft?
Jeder Zweite hat die Höfe aus dem Knast schon gesehen
Ich schick dich back in deinen Bauernstall
Und vielleicht findest du in deiner Drecksscheune auch´n Mauerfall
Für den Touristen die Nutten auf den Standstreifen
Und wenn die Kohle stimmt, kannst du sie auch anscheißen
Das ist die Stadt, wo jetzt jeder drüber reden kann
Wo du nur als Berliner überleben kannst

[Hook]
Und wenn die Wolken sich zusammenziehen
Und du die Hand nicht mehr vor Augen siehst
Wenn man dich schon zwingt, Schmuck auszuziehen
Wo man Brüder zur Begrüßung auf die Wange küsst
Merkst du gerade, wo du hier gelandet bist
Und wenn die Wolken sich zusammenziehen
Und du die Hand nicht mehr vor Augen siehst
Wenn man dich schon zwingt, Schmuck auszuziehen
Wo man Brüder zur Begrüßung auf die Wange küsst
Merkst du gerade, wo du hier gelandet bist

[Verse 3]
Merkst du, wo du hier gelandet bist?
Wenn du auf der Straße Jugendbanden triffst
Platzwunden, wenn dich die Stange trifft
Für deine rosarote Brille gibt es keinen Platz
Ich will ne Entschuldigung und scheiß drauf, ob du Zeit hast
Du bist der nächste tote Mann, der von der Klippe rollt
Hab ich dir nicht grad gesagt, dass du dich verpissen sollst?
Das ist kein Szenetreff
Das ist der Mond, der auf die Stadt scheint
Von Abgasen siehst du diese Nebel jetzt
Wir sind die Augen
Die aus dunklen Gassen schauen
Der Grund, warum sich Eltern nicht auf die Terrassen trauen
Es sind die Straßen hier
Wir sind das Urgestein
Wenn du mit uns reden solltest, halt dein Abitur geheim
Ich seh den Angstschweiß
Weil du wie Dreck stinkst
Du bist ein Landei, noch dazu ein Crackkind
Geh mir aus dem Augen
Ich bin der, der das Berliner Wappen hält
Herzlich willkommen in der Schattenwelt

[Hook]
Und wenn die Wolken sich zusammenziehen
Und du die Hand nicht mehr vor Augen siehst
Wenn man dich schon zwingt, Schmuck auszuziehen
Wo man Brüder zur Begrüßung auf die Wange küsst
Merkst du gerade, wo du hier gelandet bist
Und wenn die Wolken sich zusammenziehen
Und du die Hand nicht mehr vor Augen siehst
Wenn man dich schon zwingt, Schmuck auszuziehen
Wo man Brüder zur Begrüßung auf die Wange küsst
Merkst du gerade, wo du hier gelandet bist","https://genius.com/Bushido-wo-du-hier-gelandet-bist-lyrics","Released August 31, 2007
Distribution

    
      Sony BMG
Copyright ©

    
      ersguterjunge
Phonographic Copyright <U+2117>

    
      ersguterjunge
Artwork

    
      Ben Baumgarten
Photography

    
      Mat Hennek
Label

    
      ersguterjunge
Featuring

    
      Chakuza, Kay One, Nyze & 2 more
Producers

    
      Auditory, Bazzazian, Beatlefield & 8 more
Writers

    
      Bushido, Chakuza, Kay One & 3 more
Bass

    
      Markus Runzheimer
Copyright ©

    
      ersguterjunge"
"13","Bushido","Reich mir nicht deine Hand","7","[Part 1]
Ich war damals grade drei
Als du mich verlassen hast
Es war Mama die es nicht verkraftet hat
Sie wollte sich scheiden lassen, hör auf zu lügenWie oft wurde sie von dir verprügelt?Wie oft hast du sie grundlos angeschrien?Ihre Arme waren blauDoch sie hörte niemals auf ihren Mann zu liebenVielleicht war es wegen mirSie ist stark gebliebenNur damit ich meinen Vater nicht verlierUndich wusste nicht was los ist
Ich hab mich sogar mal gefragt ob du tot bist
Wieso traf es bloß mich?
Ich war im Kindergarten
Aber bist du mal gekommen um mich abzuholen?
Nein du hast dein Kind verraten
Du hast an mich gedacht?
Warum kann dir nicht glauben
Falls du es schaffst dann schau mir in die Augen
Du hast mich im Stich gelassen
Ich guck die Bilder an und fang an dein Gesicht zu hassen

[Hook]
Reich mir nicht deine Hand
Ich würd' sie nie wieder nehmen
Ich will dich nie wieder sehen
Bitte komm jetzt nicht an
Und sag ich muss dich verstehen
Es ist Schluss mit den Tränen
Reich mir nicht deine Hand
Du hast mich so sehr enttäuscht
Du hast diesen Sohn doch gezeugt
Bitte komm jetzt nicht an
Du brauchst mir nichts zu erzählen
Mama sagte du wolltest gehen

[Part 2]
Dann kam meine Einschulung
Mein erster Schultag allein
Und der erste Tag im Fußballverein
Aber dich hat es nicht interessiert
Ich weiß bis heute nicht den Grund
Vater du verleugnest deinen Jungen
Ich möchte dir nichts beibringen
Und ich nenne dich nicht Feigling aber
Wegen dir war ich ein Heimkind
Sogar die Kerzen auf der Torte brannten ohne dich
Du bist ein Lügner wenn du sagst dass du dein Sohn vermisst
Ich war gerade 5
Und schon alleine auf dem Spielplatz
Wo war dieser Vater der mich lieb hat?
Wie kann man sein Kind so verachten?
Ja du bist mein Vater, aber bestimmt nich' erwachsen
So oft gedealtIch hab so oft geklautMama hat sich nicht getrautIhren Sohn zu verhauen
Und ich sag es dir nicht gern
Aber du hast mir gefehlt
Du hast von meiner Jugend nichts erlebt

[Hook]
Reich mir nicht deine Hand
Ich würd' sie nie wieder nehmen
Ich will dich nie wieder sehen
Bitte komm jetzt nicht an
Und sag ich muss dich verstehen
Es ist Schluss mit den Tränen
Reich mir nicht deine Hand
Du hast mich so sehr enttäuscht
Du hast diesen Sohn doch gezeugt
Bitte komm jetzt nicht an
Du brauchst mir nichts zu erzählen
Mama sagte du wolltest gehen

[Part 3]
Das erste mal gesehen hab ich dich zu spät
Ich war 26 Jahre alt, okay
Du warst nicht der Vater den ich mir erhofft habeDeine scheiß Adresse fand ich auf 'ner Postkarte
Und ich habe dich in Düsseldorf gesucht
In Düsseldorf gefunden und Düsseldorf verflucht
Ich saß in deiner Wohnung drin
Ich hab dich angeseh'n
Du hast mir Leid getan
Hör auf mich anzuflehen
Du hast gesagt Mama hätte sich von dir getrennt
Wenn du besoffen warst warst du wie ein fremder Mensch
Und es tut dir ganz bestimmt nicht Leid
Heute sag ich dir, es war für dein Kind nicht leicht
Und ich wünsche dir nichts schlechtes
Einfach aus dem Grund ,weil kein Mensch auf Gottes Erden hier perfekt ist
Ich bin erwachsen ich kann mich jetzt um Mama sorgenSie sind verschwunden, ich meine Mamas Sorgen

[Hook]
Reich mir nicht deine Hand
Ich würd' sie nie wieder nehmen
Ich will dich nie wieder sehen
Bitte komm jetzt nicht an
Und sag ich muss dich verstehen
Es ist Schluss mit den Tränen
Reich mir nicht deine Hand
Du hast mich so sehr enttäuscht
Du hast diesen Sohn doch gezeugt
Bitte komm jetzt nicht an
Du brauchst mir nichts zu erzählen
Mama sagte du wolltest gehen","https://genius.com/Bushido-reich-mir-nicht-deine-hand-lyrics","Released August 31, 2007
Distribution

    
      Sony BMG
Copyright ©

    
      ersguterjunge
Phonographic Copyright <U+2117>

    
      ersguterjunge
Artwork

    
      Ben Baumgarten
Photography

    
      Mat Hennek
Label

    
      ersguterjunge
Featuring

    
      Chakuza, Kay One, Nyze & 2 more
Producers

    
      Auditory, Bazzazian, Beatlefield & 8 more
Writers

    
      Bushido, Chakuza, Kay One & 3 more
Bass

    
      Markus Runzheimer
Copyright ©

    
      ersguterjunge"
"14","Bushido","Asylantenstatus","7","[Songtext zu „Asylantenstatus“ ft. Summer Cem]

[Hook: Summer Cem]
Ich bin ein Mann mit Status, der Asylantenstatus
Du hast den Schwanz im Anus, das ist Summer Cem
Er macht am Tag 'ne Mille, Dolce-Gabbana-Brille
Das ist ein harter Pimmel, das ist Sonny Black
Wir ficken eurer Leben, als würd es Feuer regnen
Kommen in eure Gegend, das wird asozial
Oh, ach, du große Scheiße, jetzt steigen Drogenpreise
Du Idiot bist pleite, das ist unser Job

[Verse 1: Summer Cem]:
Mach dem 7er Platz da, du bist der Kasper
Trage nur mein La Martina, du Bastard
Summer, der König der Türken, ich komm (bomb)
Ich liebe den kalten Beton
Komm, egal, wann du kommst, egal, wo du wohnst
Die Navigation zeigt mir das Dorf, wo du wohnst, Mann
Ich komme zu dir, Mann, und werfe dich von dem Balkon
Scheiß der Hund auf die Punchlines, Mund auf, Schwanz rein
Und du denkst, wie kann ein Mensch von Grund auf so krank sein?
Doch, hey, das ist meine Art, das Leben ist schweinehart
Und du holst jetzt am besten deinen Schädel aus meinem Arsch
Du bist ein Schauspiel-Kanacke
Deine Mutter hat mehr mit Schwänzen zu tun als eine Hauptschülerklasse
Mit der Handfeuerwaffe wie ein Vollprofi killt, dieser Türke
Schmeißt euch Würstchen auf den Holzkohlegrill
Das ist mein Stolz in seiner ganzen Pracht
Ich wollt es und ich hab's gemacht
Danke, Sonny, ich hab Gold in meine Stadt gebracht
Lippen auf den Penis, Pisser, hey, hier kommt der Babysitter
Ich scheiß auf dich und den britischen Premierminister
Rheydt-West, du denkst, du bist in der Gegend sicher
Zwischen all den abgefuckten Junkies und den Eselfickern
Mach es für Geld, du Klappergestell
Ich weiß, du findest Summer scheiße, aber deiner Mama gefällt's, yeah

[Hook: Summer Cem]
Ich bin ein Mann mit Status, der Asylantenstatus
Du hast den Schwanz im Anus, das ist Summer Cem
Er macht am Tag 'ne Mille, Dolce-Gabbana-Brille
Das ist ein harter Pimmel, das ist Sonny Black
Wir ficken eurer Leben, als würd es Feuer regnen
Kommen in eure Gegend, das wird asozial
Oh, ach, du große Scheiße, jetzt steigen Drogenpreise
Du Idiot bist pleite, das ist unser Job

[Verse 2: Bushido]:
Junge, ich schlag dich einfach aus Prinzip
Ich bleib der Gangster der jetzt Lust bekommt, paar Lines auf dem Körper deiner Frau zu ziehen
Sag, wer ist asozial? Du bleibst nur ein Märchenprinz
Eingesperrt in Linz, denn ich bleib in Sachen Ärger King
Ich provozier nur dich, guck, du provozierst nur mich
Ich provozier jetzt nicht, meine Jungs sind fokussiert auf dich
Dein ganzes Label wird so was von in den Arsch gefickt
Nenn mir weiter eure ganzen Rapper, doch es sagt mir nichts
Meine Jungs sind unaufhaltbar, ich hab aufgerüstet
Ghettolife, Ghetto heißt Platzwunde durch Schraubenschlüssel
Du brauchst nicht dumm zu glotzen und mit den Schultern zucken
Du bist ein G? Dann geh doch mal 'nen Bullen bespucken!
King of Kingz, maskulin, du kennst mich nicht
Scheiß aufs Bizz, scheiß auf dich, was int'ressiert sind Cem und ich
Und mir wird jetzt bewusst, dass du nur ein Bastard bleibst
Das ist Schöneberg, Tempelhof, Mönchengladbach-Rheydt
Hier gibt es keine Limits, fick dich, deine Jungs sind peinlich
Gib mir dein Geld, gib dein Schmuck, wir werden uns schon einig
Das hier sind gute Jungs, ja und wir sind streitbereit
Kokain als Zeitvertreib, dann im Eigenheim, yeah

[Hook: Summer Cem]
Ich bin ein Mann mit Status, der Asylantenstatus
Du hast den Schwanz im Anus, das ist Summer Cem
Er macht am Tag 'ne Mille, Dolce-Gabbana-Brille
Das ist ein harter Pimmel, das ist Sonny Black
Wir ficken eurer Leben, als würd es Feuer regnen
Kommen in eure Gegend, das wird asozial
Oh, ach, du große Scheiße, jetzt steigen Drogenpreise
Du Idiot bist pleite, das ist unser Job","https://genius.com/Bushido-asylantenstatus-lyrics","Released August 31, 2007
Distribution

    
      Sony BMG
Copyright ©

    
      ersguterjunge
Phonographic Copyright <U+2117>

    
      ersguterjunge
Artwork

    
      Ben Baumgarten
Photography

    
      Mat Hennek
Label

    
      ersguterjunge
Featuring

    
      Chakuza, Kay One, Nyze & 2 more
Producers

    
      Auditory, Bazzazian, Beatlefield & 8 more
Writers

    
      Bushido, Chakuza, Kay One & 3 more
Bass

    
      Markus Runzheimer
Copyright ©

    
      ersguterjunge"
"15","Bushido","Regenbogen","7","[Strophe I: Bushido]:
Du denkst dein Leben könnte eigentlich nicht schlimmer laufen
Und in dir drin ist ein riesengroßer Trümmerhaufen
Und jedes Mal wenn etwas schönes passiert tut es dir weh
Weil du es womöglich verlierst
Du würdest gerne in die Zukunft blicken
Du fühlst dich alt und deswegen bist du gar nicht so wie all die anderen Jugendlichen
Guck mal ein Aussenseiter, nur weil sie Schwarz liebt
Ihr Lehrer sagt dass man in ihr nen Psychopat sieht
Und auch die andern Mädchen schicken sie weg
Dass ist der Grund warum sie sich vor den Blicken versteckt
Und sie würde gerne lachen, doch wie soll sie lachen wenn sie jeden Tag
Alleine in der Klasse hockt
Und so geschminkt als ob sie eine Tote wär
Und für ein kleines bisschen Spaß halten die Drogen her
Sie will so gerne raus, sie wär so gerne Staub
Und deswegen blickt sie zu den Sternen rauf

Hook:

Das Leben ist wie ein Regenbogen
Für kurze Zeit ist alles schön
Doch leider wird dich immer dieser Regen holen
Denn dieser Regen, der die Sonne am verdrängen ist
Zeigt dass alles Schöne nur vergänglich ist
Das Leben ist so wie ein Regenbogen
Für kurze Zeit ist alles schön
Doch leider wird dich immer dieser Regen holen
Denn dieser Regen, der die Sonne am verdrängen ist
Zeigt dass alles Schöne nur vergänglich ist

[Strophe II: Bushido]:
Du ziehst die Decke über deinen Kopf
Denn deine Eltern streiten sich, es is soweit
Sie scheiden sich
Schon wieder hörst du deine Mutter in der Küche weinen
Und schon seit langem frisst du diese Scheiße in dich rein
Sie wollten dir Mut machen, es wär nicht entgültig vorbei
Nur ne räumliche Trennung für ne Zeit
Doch er glaubte seinen Eltern nicht
Er war kein kleines Kind, doch für das was er fühlte waren beide blind
Er ging daran kaputt, also lief er von zu hause weg
Sein ganzes Leben war ein Haufen Dreck
Und dieses Leben war ihm nichts wert
Ja dieses Leben war zwar alles aber nicht fair
Dieser Junge fühlte sich allein gelassen
Er wollte nie wieder zurück
Weil er das Gefühl bekam dass ihn beiden hassen
Er stellt die Frage: Warum ist alles so gelaufen?
Und ertränkte seine Depressionen im Koma saufen

Hook:

[Strophe III: Bushido]:
Ja ich hör dich in der Dusche weinen
Und nicht mal der laute Schrei wird dich jemals von dieser tiefen Wut befreien
Du machst dir Vorwürfe, du hast dass alles nur für ihn getan
Um sein scheiß Heroin zu zahlen
Es wurde immer mehr, und auch die Schulden kamen
Er gehörte nicht zu diesen Männern die geduldig waren
Und was er dann verlangte konnte sie nicht verstehen
Er zwang sie nur für seine Sucht auf den Strich zu gehen
Ja sie hat es mitgemacht
Sie kam jede Nacht nach Hause
Hat gezittert, geweint ihr Gesicht war blass
Ihre Wunden werden nie wieder heilen
Nie wieder hat sie ihm verziehen, diesem Schwein
Sie hört Stimmen wenn sie schläft
Sie ist am durchdrehen
Sie guckt in den Spiegel und kann selbst durch sich durch sehen
Wo ist ihre Lust am Leben?Heute ist ein guter Tag, um sich den Goldenen Schuss zu geben

Hook:","https://genius.com/Bushido-regenbogen-lyrics","Released August 31, 2007
Distribution

    
      Sony BMG
Copyright ©

    
      ersguterjunge
Phonographic Copyright <U+2117>

    
      ersguterjunge
Artwork

    
      Ben Baumgarten
Photography

    
      Mat Hennek
Label

    
      ersguterjunge
Featuring

    
      Chakuza, Kay One, Nyze & 2 more
Producers

    
      Auditory, Bazzazian, Beatlefield & 8 more
Writers

    
      Bushido, Chakuza, Kay One & 3 more
Bass

    
      Markus Runzheimer
Copyright ©

    
      ersguterjunge"
"16","Bushido","Wer ich bin","7","[Strophe I: Bushido]:
Ich bin zurück dieser Dealer vom Block
Ihr könnt die Scheiße kosten
Ich hab mich für das Album 7 Tage eingeschlossen
Und jetzt wird Deutschrap gefickt von dem Besten hier
Ich scheiß auf jeden und werd keinen von euch respektieren
Respektiere deinen Zeuger also guck mich an
Du wolltest Beef und ich halt dich in nem Bus gefangen
Du willst von Erfolg sprechen
Ich lasse 6mal Gold sprechen
Dass alleine wird deinen Stolz brechen
Wo sind die Stars denn jetzt
Deine Dreckscelebreties
Ich spuck auf jeden und zieh immer noch das Ecstasy
Der Beat is Gangsta, Fresse ich bin schlecht gelaunt
Die Rapper haben sich am meinem Penis festgesaugt
Samy geht in Rente wegen der Verkaufszahlen
Was mit dem Rest passiert könnt ihr euch ja ausmalen
Ich bin der Inbegriff für harten Rap du weißt schon
Wovon ich gerade Spreche keiner steigt auf meinen Thron

Hook (2x):
Ihr habt viel zu lange drauf gewartet
Doch ich bin zurück und ich erlaub euch wieder auszuatmen
Ich bin back
Das ganze Land hat drauf gewartet
Ihr seit jetzt schon außer Atem
Wer ich bin
Kingbushido, Sonny Black

[Strope II: Bushido]:
Ich hab die ganze Scheiße mitverfolgt
Ihr tauscht die Baggy für Picaldi
Redet Slang sorry doch ich nehm euch nich für voll
Ich scheiß auf deutschen Rap, komplett und das mein ich auch
Ihr kennt mein Leben bloß weil es mir die Zeitung klaut
Komm noch ein kleines Stück näher, ich such das Gespräch
Ich hab ein Foto von Osama in den Pass geklebt
Und jetzt wird scharf geschossen, du hast keinen funken Stolz
Deine Eltern haben gelogen du warst ungewollt
Hol deine krassen Freunde hol mir deine krasse Gang
Ich bin ein Wasserfan deshalb wirst du im Fass ertränkt
Sonny skrupellos ja ich ich war als erster da
Ich geh direkt in dein Gehirn rein wie Nervengas
Wer ist der Volksheld der deine Freunde krass besiegt
Bind dir zwei Torpedos an die Füße es ist Apres Ski
Jetzt wird dein Arm gebrochen und du kannst nix dagegen tun
Für mich bleibt ihr Wichser eben Schwul

Hook (2x):

[Strophe III: Bushido]
Carlo Colucci ich trag immer noch Berliner Style
Und das Gesock ich ergreife jetzt für sie Partei
Ich seh dein Dorf und begreife das es nie so wird
Nie so wird das ist Trainingshose und Bushidoshirt
Keine Lust auf Unterhaltung
Das hier ist der Sound der Strasse
Das hier ist das einmal im Jahrhundert Album
Ich mach dem ganzen Land jetzt endlich klar was Rap bedeutet
Für was soll ich mich schämen ich werde nie den Dreck verleugnen
Ich fick dein Missgeburtentreff du bist hier nix Wert
Album Nr.7 jeder wartet auf die Wiederkehr
Ich bin böser als zuvor bist du dem Hass gewachsen
Scheiß egal ob sie jetzt bald diesen Mann verhaften
Ich komm auf die Bühne Junge
Sag mir siehst du diese Menschenmassen
Kriminelle die euch reiche Menschen hassen
Und ich sage euch jetzt eins und ihr könnt mir glauben
Dieses Album öffnet euch die Augen

Hook (2x):","https://genius.com/Bushido-wer-ich-bin-lyrics","Released August 31, 2007
Distribution

    
      Sony BMG
Copyright ©

    
      ersguterjunge
Phonographic Copyright <U+2117>

    
      ersguterjunge
Artwork

    
      Ben Baumgarten
Photography

    
      Mat Hennek
Label

    
      ersguterjunge
Featuring

    
      Chakuza, Kay One, Nyze & 2 more
Producers

    
      Auditory, Bazzazian, Beatlefield & 8 more
Writers

    
      Bushido, Chakuza, Kay One & 3 more
Bass

    
      Markus Runzheimer
Copyright ©

    
      ersguterjunge"
"17","Bushido","Wahrheit","7","[Strophe I: Bushido]:
Er kommt nach Hause und findet diesen Brief
Der Gerichtsvollzieher brachte den Termin
Seine Kinder sind am lächeln doch er wirkt wie versteinert
Weil er nur drei Wochen Zeit hat
Seine Frau ist in der Küche und sie spült
Er dreht die Heizung runter und die Zimmer werden kühl
Er hat Angst seiner Frau etwas zu sagen
Er nimmt erstmal die Kinder und legt sie beide schlafen
Er zieht seinen Mantel an
Geht vor die Tür doch weiß grade nichts mit sich anzufangen
Zehn Jahre geschuftet wie ein Schwein
Mit Nebenjobs seine Frau wusste nicht Bescheid
Wie soll er seinem Chef nur erklären
Das er mehr Geld braucht um den Rest zu ernähren
Und er läuft jetzt zurück sein Haupt ist gesenkt
Er versucht den Scheiß zu verdrängen

Hook:
Jeder Tag gleicht einem Kampf
Den man verwundet übersteht
Nach außen zeigt man keinen Schmerz
Niemand soll die Wahrheit sehn
Und jede Stunde die man lebt
Muss man weiter aufrecht gehen
Egal wie tief die Wunden sind
Niemand soll die Wahrheit sehn

[Strophe II: Bushido]:
Am nächsten Morgen klingelt dann das Telefon
Es ist der Chef jetzt komm ihn die Probleme holen
Er wird gefeuert, die Firma ist bankrott
Verzweifelt fast er sich an seinen Kopf
Kennst du das Gefühl wenn einem nichts<U+0085> außer seiner Würde bleibt
Willkommen in der Wirklichkeit
Sein stolz zerbricht, seine Augen werden wässrig
Seine Frau merkt was ihn beschäftigt
Er sagt es wird nie wieder normal
Sag wie sollen sie die Miete bezahlen
Und die Familie hier muss raus er blickt jetzt in die Augen seiner Kinder
Wenn sie nur wüssten es wird noch ums' tausendfache schlimmer
Er hat sich das nicht ausgesucht dieser Mann der so stark war
Ein Ehrenmann ein aufrechter Vater
Er schämte sich so sehr, sodass er keinem was erzählt hat
Weil ihn das Problem so gequält hat

Hook:
Jeder Tag gleicht einem Kampf
Den man verwundet übersteht
Nach außen zeigt man keinen Schmerz
Niemand soll die Wahrheit sehn
Und jede Stunde die man lebt
Muss man weiter aufrecht gehen
Egal wie tief die Wunden sind
Niemand soll die Wahrheit sehn

[Strope III: Bushido]:
Sein leben geht den Bach runter was für ein Trauerspiel
Wie ein kleines Kind das von einer Mauer fiel
Er hatte nichts mehr dieses Leben war ihm nichts wert
Und er gab auch sein Gesicht her
Eine Frau die ihn zu Hause jetzt hasst
Er ertränkte seine Trauer in Schnaps
Er verzockte die Ersparnisse
Nahm sogar Geld bei seiner Tochter aus der Sparbüchse
Was soll man tun wenn das Geld nicht reicht
In der Spielothek sitzt voller Selbstmitleid
Und sein Leben zog vorbei sein Inneres zerbrach
Ein blinder Mann auf erden der den Himmel nicht mehr sah
Er erinnert sich zurück
An die Liebe und sein Glück
Er schließt die Augen denn er weiß was er verloren hat
Schluckt es einfach runter damit er keine Sorgen hat

Hook:
Jeder Tag gleicht einem Kampf
Den man verwundet übersteht
Nach außen zeigt man keinen Schmerz
Niemand soll die Wahrheit sehn
Und jede Stunde die man lebt
Muss man weiter aufrecht gehen
Egal wie tief die Wunden sind
Niemand soll die Wahrheit sehn","https://genius.com/Bushido-wahrheit-lyrics","Released August 31, 2007
Distribution

    
      Sony BMG
Copyright ©

    
      ersguterjunge
Phonographic Copyright <U+2117>

    
      ersguterjunge
Artwork

    
      Ben Baumgarten
Photography

    
      Mat Hennek
Label

    
      ersguterjunge
Featuring

    
      Chakuza, Kay One, Nyze & 2 more
Producers

    
      Auditory, Bazzazian, Beatlefield & 8 more
Writers

    
      Bushido, Chakuza, Kay One & 3 more
Bass

    
      Markus Runzheimer
Copyright ©

    
      ersguterjunge"
